aiter/configs/a4w4_blockscale_tuned_gemm.csv
cu_num,M,N,K,kernelId,splitK,us,kernelName,tflops,bw,errRatio
256,1,512,4096,21,0,5.4049,_ZN5aiter41f4gemm_bf16_per1x32Fp4_BpreShuffle_32x128E,0.78,194.57,0.0
256,1,800,5120,29,0,8.5995,_ZN5aiter41f4gemm_bf16_per1x32Fp4_BpreShuffle_64x128E,0.95,238.64,0.0
256,1,1024,3072,21,0,5.7795,_ZN5aiter41f4gemm_bf16_per1x32Fp4_BpreShuffle_32x128E,1.09,272.77,0.0
256,1,1024,4096,29,0,6.7429,_ZN5aiter41f4gemm_bf16_per1x32Fp4_BpreShuffle_64x128E,1.24,311.62,0.0
256,1,1280,8192,21,0,16.726,_ZN5aiter41f4gemm_bf16_per1x32Fp4_BpreShuffle_32x128E,1.25,313.85,0.0
256,1,1536,3072,29,0,6.5636,_ZN5aiter41f4gemm_bf16_per1x32Fp4_BpreShuffle_64x128E,1.44,360.15,0.0
256,1,1536,7168,21,0,12.1915,_ZN5aiter41f4gemm_bf16_per1x32Fp4_BpreShuffle_32x128E,1.81,452.09,0.0
256,1,2048,6144,29,0,10.9087,_ZN5aiter41f4gemm_bf16_per1x32Fp4_BpreShuffle_64x128E,2.31,577.39,0.0
256,1,2048,7168,21,0,12.2956,_ZN5aiter41f4gemm_bf16_per1x32Fp4_BpreShuffle_32x128E,2.39,597.59,0.0
256,1,2112,7168,21,0,12.3647,_ZN5aiter41f4gemm_bf16_per1x32Fp4_BpreShuffle_32x128E,2.45,612.81,0.0
256,1,2304,16384,21,0,22.5794,_ZN5aiter41f4gemm_bf16_per1x32Fp4_BpreShuffle_32x128E,3.34,836.48,0.0
256,1,2560,8192,21,0,17.5745,_ZN5aiter41f4gemm_bf16_per1x32Fp4_BpreShuffle_32x128E,2.39,597.17,0.0
256,1,3072,1536,21,0,5.7648,_ZN5aiter41f4gemm_bf16_per1x32Fp4_BpreShuffle_32x128E,1.64,410.46,0.0
256,1,3072,6144,21,0,10.8323,_ZN5aiter41f4gemm_bf16_per1x32Fp4_BpreShuffle_32x128E,3.48,872.06,0.0
256,1,4096,1024,29,0,4.9501,_ZN5aiter41f4gemm_bf16_per1x32Fp4_BpreShuffle_64x128E,1.69,425.42,0.0
256,1,4096,4096,21,0,8.4223,_ZN5aiter41f4gemm_bf16_per1x32Fp4_BpreShuffle_32x128E,3.98,997.22,0.0
256,1,4096,8192,21,0,12.3973,_ZN5aiter41f4gemm_bf16_per1x32Fp4_BpreShuffle_32x128E,5.41,1354.29,0.0
256,1,4096,14336,21,0,20.9628,_ZN5aiter41f4gemm_bf16_per1x32Fp4_BpreShuffle_32x128E,5.6,1401.32,0.0
256,1,4608,16384,21,0,24.1342,_ZN5aiter41f4gemm_bf16_per1x32Fp4_BpreShuffle_32x128E,6.26,1564.84,0.0
256,1,5120,1280,29,0,6.2868,_ZN5aiter41f4gemm_bf16_per1x32Fp4_BpreShuffle_64x128E,2.08,522.95,0.0
256,1,5120,5120,21,0,10.3166,_ZN5aiter41f4gemm_bf16_per1x32Fp4_BpreShuffle_32x128E,5.08,1271.74,0.0
256,1,5120,6400,21,0,13.1399,_ZN5aiter41f4gemm_bf16_per1x32Fp4_BpreShuffle_32x128E,4.99,1247.91,0.0
256,1,5120,25600,21,0,35.9675,_ZN5aiter41f4gemm_bf16_per1x32Fp4_BpreShuffle_32x128E,7.29,1822.73,0.0
256,1,6144,2048,29,0,6.2966,_ZN5aiter41f4gemm_bf16_per1x32Fp4_BpreShuffle_64x128E,4.0,1001.3,0.0
256,1,6144,3072,21,0,7.0757,_ZN5aiter41f4gemm_bf16_per1x32Fp4_BpreShuffle_32x128E,5.33,1335.7,0.0
256,1,6144,4096,21,0,8.4464,_ZN5aiter41f4gemm_bf16_per1x32Fp4_BpreShuffle_32x128E,5.96,1491.43,0.0
256,1,6144,12288,21,0,18.4152,_ZN5aiter41f4gemm_bf16_per1x32Fp4_BpreShuffle_32x128E,8.2,2050.87,0.0
256,1,6144,16384,21,0,24.3831,_ZN5aiter41f4gemm_bf16_per1x32Fp4_BpreShuffle_32x128E,8.26,2065.04,0.0
256,1,6400,5120,29,0,12.2475,_ZN5aiter41f4gemm_bf16_per1x32Fp4_BpreShuffle_64x128E,5.35,1339.0,0.0
256,1,7168,2048,29,0,6.3797,_ZN5aiter41f4gemm_bf16_per1x32Fp4_BpreShuffle_64x128E,4.6,1152.94,0.0
256,1,7168,8192,21,0,13.6832,_ZN5aiter41f4gemm_bf16_per1x32Fp4_BpreShuffle_32x128E,8.58,2147.05,0.0
256,1,7168,16384,21,0,24.8921,_ZN5aiter41f4gemm_bf16_per1x32Fp4_BpreShuffle_32x128E,9.44,2359.9,0.0
256,1,7168,18432,21,0,27.4078,_ZN5aiter41f4gemm_bf16_per1x32Fp4_BpreShuffle_32x128E,9.64,2411.13,0.0
256,1,8192,1024,21,0,5.9074,_ZN5aiter41f4gemm_bf16_per1x32Fp4_BpreShuffle_32x128E,2.84,712.87,0.0
256,1,8192,2048,21,0,6.6356,_ZN5aiter41f4gemm_bf16_per1x32Fp4_BpreShuffle_32x128E,5.06,1266.81,0.0
256,1,8192,3584,21,0,8.4146,_ZN5aiter41f4gemm_bf16_per1x32Fp4_BpreShuffle_32x128E,6.98,1746.75,0.0
256,1,8192,4096,37,0,8.8326,_ZN5aiter41f4gemm_bf16_per1x32Fp4_BpreShuffle_96x128E,7.6,1901.55,0.0
256,1,8192,7168,42,0,17.189,_ZN5aiter42f4gemm_bf16_per1x32Fp4_BpreShuffle_128x128E,6.83,1709.24,0.0
256,1,8192,8192,21,0,14.1316,_ZN5aiter41f4gemm_bf16_per1x32Fp4_BpreShuffle_32x128E,9.5,2375.87,0.0
256,1,8192,28672,21,0,43.2883,_ZN5aiter41f4gemm_bf16_per1x32Fp4_BpreShuffle_32x128E,10.85,2713.69,0.0
256,1,9216,16384,21,0,26.0135,_ZN5aiter41f4gemm_bf16_per1x32Fp4_BpreShuffle_32x128E,11.61,2903.27,0.0
256,1,10240,8192,21,0,14.6562,_ZN5aiter41f4gemm_bf16_per1x32Fp4_BpreShuffle_32x128E,11.45,2863.47,0.0
256,1,12288,512,29,0,4.3707,_ZN5aiter41f4gemm_bf16_per1x32Fp4_BpreShuffle_64x128E,2.88,725.41,0.0
256,1,12288,1536,29,0,5.8524,_ZN5aiter41f4gemm_bf16_per1x32Fp4_BpreShuffle_64x128E,6.45,1616.86,0.0
256,1,12288,4096,21,0,9.5064,_ZN5aiter41f4gemm_bf16_per1x32Fp4_BpreShuffle_32x128E,10.59,2650.05,0.0
256,1,12288,6144,21,0,12.76,_ZN5aiter41f4gemm_bf16_per1x32Fp4_BpreShuffle_32x128E,11.83,2960.53,0.0
256,1,12800,5120,21,0,14.2687,_ZN5aiter41f4gemm_bf16_per1x32Fp4_BpreShuffle_32x128E,9.19,2298.47,0.0
256,1,13312,16384,21,0,33.2284,_ZN5aiter41f4gemm_bf16_per1x32Fp4_BpreShuffle_32x128E,13.13,3282.94,0.0
256,1,14336,8192,37,0,17.338,_ZN5aiter41f4gemm_bf16_per1x32Fp4_BpreShuffle_96x128E,13.55,3388.69,0.0
256,1,16384,512,29,0,4.4281,_ZN5aiter41f4gemm_bf16_per1x32Fp4_BpreShuffle_64x128E,3.79,954.66,0.0
256,1,16384,2048,37,0,6.2861,_ZN5aiter41f4gemm_bf16_per1x32Fp4_BpreShuffle_96x128E,10.68,2674.31,0.0
256,1,16384,4096,21,0,11.8228,_ZN5aiter41f4gemm_bf16_per1x32Fp4_BpreShuffle_32x128E,11.35,2841.06,0.0
256,1,16384,6656,37,0,15.0912,_ZN5aiter41f4gemm_bf16_per1x32Fp4_BpreShuffle_96x128E,14.45,3615.49,0.0
256,1,16384,8192,29,0,19.807,_ZN5aiter41f4gemm_bf16_per1x32Fp4_BpreShuffle_64x128E,13.55,3390.0,0.0
256,1,16384,13312,21,0,24.7664,_ZN5aiter41f4gemm_bf16_per1x32Fp4_BpreShuffle_32x128E,17.61,4404.81,0.0
256,1,16384,16384,29,0,29.8545,_ZN5aiter41f4gemm_bf16_per1x32Fp4_BpreShuffle_64x128E,17.98,4497.1,0.0
256,1,16384,26624,29,0,47.945,_ZN5aiter41f4gemm_bf16_per1x32Fp4_BpreShuffle_64x128E,18.2,4550.0,0.0
256,1,16384,53248,21,0,85.9036,_ZN5aiter41f4gemm_bf16_per1x32Fp4_BpreShuffle_32x128E,20.31,5078.56,0.0
256,1,18432,7168,21,0,14.9154,_ZN5aiter41f4gemm_bf16_per1x32Fp4_BpreShuffle_32x128E,17.72,4431.71,0.0
256,1,18432,16384,0,0,48.5148,a4w4_blockscale_256x64x128x128_16x16_16x16_8x32x1_8x32x1_1x32x1x8_8_2x2_intrawave_v3,12.45,3113.28,0.0
256,1,20480,16384,21,0,34.0333,_ZN5aiter41f4gemm_bf16_per1x32Fp4_BpreShuffle_32x128E,19.72,4931.09,0.0
256,1,24576,1536,21,0,6.1017,_ZN5aiter41f4gemm_bf16_per1x32Fp4_BpreShuffle_32x128E,12.37,3101.48,0.0
256,1,26624,16384,46,0,44.6996,_ZN5aiter42f4gemm_bf16_per1x32Fp4_BpreShuffle_160x128E,19.52,4880.7,0.0
256,1,28672,4096,21,0,14.0433,_ZN5aiter41f4gemm_bf16_per1x32Fp4_BpreShuffle_32x128E,16.73,4185.6,0.0
256,1,32768,512,29,0,5.0283,_ZN5aiter41f4gemm_bf16_per1x32Fp4_BpreShuffle_64x128E,6.67,1681.36,0.0
256,1,51200,5120,14,0,23.3643,a4w4_blockscale_256x32x128x128_16x16_16x16_8x32x1_8x32x1_1x16x1x16_8_2x2_intrawave_v3,22.44,5614.42,0.0
256,1,53248,16384,0,0,73.6484,a4w4_blockscale_256x64x128x128_16x16_16x16_8x32x1_8x32x1_1x32x1x8_8_2x2_intrawave_v3,23.69,5924.4,0.0
256,1,57344,8192,14,0,44.7024,a4w4_blockscale_256x32x128x128_16x16_16x16_8x32x1_8x32x1_1x16x1x16_8_2x2_intrawave_v3,21.02,5256.98,0.0
256,1,59136,8192,14,0,46.5332,a4w4_blockscale_256x32x128x128_16x16_16x16_8x32x1_8x32x1_1x16x1x16_8_2x2_intrawave_v3,20.82,5207.97,0.0
256,1,106496,16384,3,0,145.2761,a4w4_blockscale_256x64x512x128_16x16_16x16_8x32x1_8x32x1_1x32x1x8_8_2x2_intrawave_v3,24.02,6006.74,0.0
256,2,512,4096,21,0,5.4335,_ZN5aiter41f4gemm_bf16_per1x32Fp4_BpreShuffle_32x128E,1.54,194.11,0.0
256,2,1024,3072,21,0,5.8351,_ZN5aiter41f4gemm_bf16_per1x32Fp4_BpreShuffle_32x128E,2.16,270.78,0.0
256,2,1024,4096,29,0,6.8239,_ZN5aiter41f4gemm_bf16_per1x32Fp4_BpreShuffle_64x128E,2.46,308.53,0.0
256,2,1536,3072,29,0,6.3888,_ZN5aiter41f4gemm_bf16_per1x32Fp4_BpreShuffle_64x128E,2.95,370.73,0.0
256,2,1536,7168,21,0,12.3332,_ZN5aiter41f4gemm_bf16_per1x32Fp4_BpreShuffle_32x128E,3.57,447.44,0.0
256,2,2048,6144,21,0,10.8043,_ZN5aiter41f4gemm_bf16_per1x32Fp4_BpreShuffle_32x128E,4.66,583.64,0.0
256,2,2048,7168,21,0,12.4844,_ZN5aiter41f4gemm_bf16_per1x32Fp4_BpreShuffle_32x128E,4.7,589.17,0.0
256,2,3072,1536,21,0,5.8068,_ZN5aiter41f4gemm_bf16_per1x32Fp4_BpreShuffle_32x128E,3.25,408.68,0.0
256,2,3072,6144,21,0,10.7991,_ZN5aiter41f4gemm_bf16_per1x32Fp4_BpreShuffle_32x128E,6.99,875.59,0.0
256,2,4096,1024,29,0,5.0164,_ZN5aiter41f4gemm_bf16_per1x32Fp4_BpreShuffle_64x128E,3.34,421.53,0.0
256,2,4096,4096,21,0,9.4735,_ZN5aiter41f4gemm_bf16_per1x32Fp4_BpreShuffle_32x128E,7.08,887.64,0.0
256,2,4096,8192,21,0,12.6033,_ZN5aiter41f4gemm_bf16_per1x32Fp4_BpreShuffle_32x128E,10.65,1333.13,0.0
256,2,4096,14336,21,0,21.0437,_ZN5aiter41f4gemm_bf16_per1x32Fp4_BpreShuffle_32x128E,11.16,1396.66,0.0
256,2,6144,2048,21,0,6.2664,_ZN5aiter41f4gemm_bf16_per1x32Fp4_BpreShuffle_32x128E,8.03,1008.25,0.0
256,2,6144,3072,21,0,7.4379,_ZN5aiter41f4gemm_bf16_per1x32Fp4_BpreShuffle_32x128E,10.15,1272.51,0.0
256,2,6144,4096,21,0,9.2767,_ZN5aiter41f4gemm_bf16_per1x32Fp4_BpreShuffle_32x128E,10.85,1359.49,0.0
256,2,6144,12288,21,0,18.5205,_ZN5aiter41f4gemm_bf16_per1x32Fp4_BpreShuffle_32x128E,16.31,2040.2,0.0
256,2,6144,16384,21,0,24.4987,_ZN5aiter41f4gemm_bf16_per1x32Fp4_BpreShuffle_32x128E,16.44,2056.13,0.0
256,2,7168,2048,21,0,6.2888,_ZN5aiter41f4gemm_bf16_per1x32Fp4_BpreShuffle_32x128E,9.34,1172.04,0.0
256,2,7168,8192,21,0,13.8337,_ZN5aiter41f4gemm_bf16_per1x32Fp4_BpreShuffle_32x128E,16.98,2125.03,0.0
256,2,7168,16384,21,0,25.1389,_ZN5aiter41f4gemm_bf16_per1x32Fp4_BpreShuffle_32x128E,18.69,2337.62,0.0
256,2,7168,18432,21,0,27.5631,_ZN5aiter41f4gemm_bf16_per1x32Fp4_BpreShuffle_32x128E,19.17,2398.4,0.0
256,2,8192,4096,21,0,8.3685,_ZN5aiter41f4gemm_bf16_per1x32Fp4_BpreShuffle_32x128E,16.04,2009.21,0.0
256,2,8192,8192,21,0,14.1231,_ZN5aiter41f4gemm_bf16_per1x32Fp4_BpreShuffle_32x128E,19.01,2378.75,0.0
256,2,8192,28672,21,0,44.8066,_ZN5aiter41f4gemm_bf16_per1x32Fp4_BpreShuffle_32x128E,20.97,2622.43,0.0
256,2,10240,8192,21,0,14.7818,_ZN5aiter41f4gemm_bf16_per1x32Fp4_BpreShuffle_32x128E,22.7,2840.8,0.0
256,2,12288,512,29,0,4.3287,_ZN5aiter41f4gemm_bf16_per1x32Fp4_BpreShuffle_64x128E,5.81,738.19,0.0
256,2,12288,1536,29,0,6.1797,_ZN5aiter41f4gemm_bf16_per1x32Fp4_BpreShuffle_64x128E,12.22,1535.33,0.0
256,2,12288,4096,21,0,9.7868,_ZN5aiter41f4gemm_bf16_per1x32Fp4_BpreShuffle_32x128E,20.57,2576.85,0.0
256,2,12288,6144,29,0,11.8365,_ZN5aiter41f4gemm_bf16_per1x32Fp4_BpreShuffle_64x128E,25.51,3193.85,0.0
256,2,16384,512,21,0,4.3413,_ZN5aiter41f4gemm_bf16_per1x32Fp4_BpreShuffle_32x128E,7.73,981.35,0.0
256,2,16384,2048,21,0,6.2153,_ZN5aiter41f4gemm_bf16_per1x32Fp4_BpreShuffle_32x128E,21.59,2710.22,0.0
256,2,16384,16384,29,0,32.719,_ZN5aiter41f4gemm_bf16_per1x32Fp4_BpreShuffle_64x128E,32.82,4104.64,0.0
256,2,16384,53248,21,0,86.2066,_ZN5aiter41f4gemm_bf16_per1x32Fp4_BpreShuffle_32x128E,40.48,5061.4,0.0
256,2,18432,7168,21,0,14.9357,_ZN5aiter41f4gemm_bf16_per1x32Fp4_BpreShuffle_32x128E,35.38,4428.4,0.0
256,2,20480,16384,21,0,32.5723,_ZN5aiter41f4gemm_bf16_per1x32Fp4_BpreShuffle_32x128E,41.21,5153.78,0.0
256,2,24576,1536,21,0,6.1676,_ZN5aiter41f4gemm_bf16_per1x32Fp4_BpreShuffle_32x128E,24.48,3076.43,0.0
256,2,28672,4096,29,0,14.0902,_ZN5aiter41f4gemm_bf16_per1x32Fp4_BpreShuffle_64x128E,33.34,4175.88,0.0
256,2,32768,512,21,0,5.2683,_ZN5aiter41f4gemm_bf16_per1x32Fp4_BpreShuffle_32x128E,12.74,1617.26,0.0
256,2,57344,8192,14,0,44.6413,a4w4_blockscale_256x32x128x128_16x16_16x16_8x32x1_8x32x1_1x16x1x16_8_2x2_intrawave_v3,42.09,5266.84,0.0
256,2,59136,8192,14,0,46.4974,a4w4_blockscale_256x32x128x128_16x16_16x16_8x32x1_8x32x1_1x16x1x16_8_2x2_intrawave_v3,41.67,5214.61,0.0
256,2,106496,16384,17,0,148.879,a4w4_blockscale_256x32x512x128_16x16_16x16_8x32x1_8x32x1_1x8x1x32_8_2x4_intrawave_v3,46.88,5862.87,0.0
256,4,512,4096,21,0,5.4783,_ZN5aiter41f4gemm_bf16_per1x32Fp4_BpreShuffle_32x128E,3.06,193.65,0.0
256,4,1024,3072,21,0,5.8909,_ZN5aiter41f4gemm_bf16_per1x32Fp4_BpreShuffle_32x128E,4.27,269.43,0.0
256,4,1024,4096,29,0,6.9926,_ZN5aiter41f4gemm_bf16_per1x32Fp4_BpreShuffle_64x128E,4.8,302.25,0.0
256,4,1536,3072,29,0,6.8371,_ZN5aiter41f4gemm_bf16_per1x32Fp4_BpreShuffle_64x128E,5.52,347.77,0.0
256,4,1536,7168,21,0,12.4212,_ZN5aiter41f4gemm_bf16_per1x32Fp4_BpreShuffle_32x128E,7.09,445.34,0.0
256,4,2048,6144,21,0,10.9315,_ZN5aiter41f4gemm_bf16_per1x32Fp4_BpreShuffle_32x128E,9.21,578.16,0.0
256,4,2048,7168,21,0,12.6032,_ZN5aiter41f4gemm_bf16_per1x32Fp4_BpreShuffle_32x128E,9.32,584.83,0.0
256,4,3072,1536,21,0,5.7958,_ZN5aiter41f4gemm_bf16_per1x32Fp4_BpreShuffle_32x128E,6.51,411.84,0.0
256,4,3072,6144,21,0,10.8927,_ZN5aiter41f4gemm_bf16_per1x32Fp4_BpreShuffle_32x128E,13.86,869.76,0.0
256,4,4096,1024,29,0,5.0499,_ZN5aiter41f4gemm_bf16_per1x32Fp4_BpreShuffle_64x128E,6.64,422.18,0.0
256,4,4096,4096,21,0,8.8735,_ZN5aiter41f4gemm_bf16_per1x32Fp4_BpreShuffle_32x128E,15.13,949.97,0.0
256,4,4096,8192,21,0,12.641,_ZN5aiter41f4gemm_bf16_per1x32Fp4_BpreShuffle_32x128E,21.24,1331.09,0.0
256,4,4096,14336,21,0,21.2148,_ZN5aiter41f4gemm_bf16_per1x32Fp4_BpreShuffle_32x128E,22.14,1386.84,0.0
256,4,6144,2048,21,0,6.4043,_ZN5aiter41f4gemm_bf16_per1x32Fp4_BpreShuffle_32x128E,15.72,990.69,0.0
256,4,6144,3072,21,0,7.677,_ZN5aiter41f4gemm_bf16_per1x32Fp4_BpreShuffle_32x128E,19.67,1236.48,0.0
256,4,6144,4096,21,0,8.9851,_ZN5aiter41f4gemm_bf16_per1x32Fp4_BpreShuffle_32x128E,22.41,1406.8,0.0
256,4,6144,12288,21,0,18.6823,_ZN5aiter41f4gemm_bf16_per1x32Fp4_BpreShuffle_32x128E,32.33,2024.51,0.0
256,4,6144,16384,21,0,24.7138,_ZN5aiter41f4gemm_bf16_per1x32Fp4_BpreShuffle_32x128E,32.59,2039.9,0.0
256,4,7168,2048,37,0,6.45,_ZN5aiter41f4gemm_bf16_per1x32Fp4_BpreShuffle_96x128E,18.21,1147.52,0.0
256,4,7168,8192,21,0,13.9848,_ZN5aiter41f4gemm_bf16_per1x32Fp4_BpreShuffle_32x128E,33.59,2104.7,0.0
256,4,7168,16384,21,0,25.2649,_ZN5aiter41f4gemm_bf16_per1x32Fp4_BpreShuffle_32x128E,37.19,2327.75,0.0
256,4,7168,18432,21,0,27.7628,_ZN5aiter41f4gemm_bf16_per1x32Fp4_BpreShuffle_32x128E,38.07,2382.85,0.0
256,4,8192,4096,21,0,8.9554,_ZN5aiter41f4gemm_bf16_per1x32Fp4_BpreShuffle_32x128E,29.97,1881.65,0.0
256,4,8192,8192,21,0,14.12,_ZN5aiter41f4gemm_bf16_per1x32Fp4_BpreShuffle_32x128E,38.02,2382.18,0.0
256,4,8192,28672,29,0,45.3869,_ZN5aiter41f4gemm_bf16_per1x32Fp4_BpreShuffle_64x128E,41.4,2590.25,0.0
256,4,10240,8192,21,0,14.8201,_ZN5aiter41f4gemm_bf16_per1x32Fp4_BpreShuffle_32x128E,45.28,2836.78,0.0
256,4,12288,512,29,0,4.3638,_ZN5aiter41f4gemm_bf16_per1x32Fp4_BpreShuffle_64x128E,11.53,743.63,0.0
256,4,12288,1536,21,0,5.9719,_ZN5aiter41f4gemm_bf16_per1x32Fp4_BpreShuffle_32x128E,25.28,1597.24,0.0
256,4,12288,4096,37,0,9.9657,_ZN5aiter41f4gemm_bf16_per1x32Fp4_BpreShuffle_96x128E,40.4,2535.93,0.0
256,4,12288,6144,21,0,11.6196,_ZN5aiter41f4gemm_bf16_per1x32Fp4_BpreShuffle_32x128E,51.98,3258.23,0.0
256,4,16384,512,29,0,4.4621,_ZN5aiter41f4gemm_bf16_per1x32Fp4_BpreShuffle_64x128E,15.04,969.59,0.0
256,4,16384,2048,21,0,6.5496,_ZN5aiter41f4gemm_bf16_per1x32Fp4_BpreShuffle_32x128E,40.99,2582.2,0.0
256,4,16384,4096,22,0,21.86,_ZN5aiter42f4gemm_bf16_per1x32Fp4_BpreShuffle_192x256E,24.56,1541.34,0.0
256,4,16384,16384,21,0,32.3766,_ZN5aiter41f4gemm_bf16_per1x32Fp4_BpreShuffle_32x128E,66.33,4150.58,0.0
256,4,16384,53248,21,0,87.0063,_ZN5aiter41f4gemm_bf16_per1x32Fp4_BpreShuffle_32x128E,80.22,5016.25,0.0
256,4,18432,7168,21,0,14.8505,_ZN5aiter41f4gemm_bf16_per1x32Fp4_BpreShuffle_32x128E,71.17,4459.25,0.0
256,4,18432,16384,0,0,47.9528,a4w4_blockscale_256x64x128x128_16x16_16x16_8x32x1_8x32x1_1x32x1x8_8_2x2_intrawave_v3,50.38,3152.58,0.0
256,4,20480,16384,21,0,32.6683,_ZN5aiter41f4gemm_bf16_per1x32Fp4_BpreShuffle_32x128E,82.17,5141.64,0.0
256,4,24576,1536,21,0,6.1764,_ZN5aiter41f4gemm_bf16_per1x32Fp4_BpreShuffle_32x128E,48.89,3088.21,0.0
256,4,28672,4096,21,0,13.9716,_ZN5aiter41f4gemm_bf16_per1x32Fp4_BpreShuffle_32x128E,67.25,4219.83,0.0
256,4,32768,512,21,0,5.2987,_ZN5aiter41f4gemm_bf16_per1x32Fp4_BpreShuffle_32x128E,25.33,1632.81,0.0
256,4,57344,8192,14,0,44.7537,a4w4_blockscale_256x32x128x128_16x16_16x16_8x32x1_8x32x1_1x16x1x16_8_2x2_intrawave_v3,83.97,5258.92,0.0
256,4,59136,8192,14,0,46.6928,a4w4_blockscale_256x32x128x128_16x16_16x16_8x32x1_8x32x1_1x16x1x16_8_2x2_intrawave_v3,83.0,5198.03,0.0
256,4,106496,16384,3,0,147.4268,a4w4_blockscale_256x64x512x128_16x16_16x16_8x32x1_8x32x1_1x32x1x8_8_2x2_intrawave_v3,94.68,5923.62,0.0
256,8,512,4096,21,0,5.5567,_ZN5aiter41f4gemm_bf16_per1x32Fp4_BpreShuffle_32x128E,6.04,193.13,0.0
256,8,512,7168,29,0,9.6677,_ZN5aiter41f4gemm_bf16_per1x32Fp4_BpreShuffle_64x128E,6.07,193.62,0.0
256,8,1024,3072,21,0,6.0269,_ZN5aiter41f4gemm_bf16_per1x32Fp4_BpreShuffle_32x128E,8.35,265.73,0.0
256,8,1024,4096,29,0,6.937,_ZN5aiter41f4gemm_bf16_per1x32Fp4_BpreShuffle_64x128E,9.67,307.04,0.0
256,8,1536,3072,29,0,6.7419,_ZN5aiter41f4gemm_bf16_per1x32Fp4_BpreShuffle_64x128E,11.2,355.41,0.0
256,8,1536,7168,21,0,12.6568,_ZN5aiter41f4gemm_bf16_per1x32Fp4_BpreShuffle_32x128E,13.92,439.15,0.0
256,8,2048,6144,29,0,11.2567,_ZN5aiter41f4gemm_bf16_per1x32Fp4_BpreShuffle_64x128E,17.89,564.0,0.0
256,8,2048,7168,21,0,12.8216,_ZN5aiter41f4gemm_bf16_per1x32Fp4_BpreShuffle_32x128E,18.32,577.27,0.0
256,8,2112,7168,21,0,12.8435,_ZN5aiter41f4gemm_bf16_per1x32Fp4_BpreShuffle_32x128E,18.86,594.22,0.0
256,8,3072,1536,42,0,5.4682,_ZN5aiter42f4gemm_bf16_per1x32Fp4_BpreShuffle_128x128E,13.81,441.57,0.0
256,8,3072,6144,21,0,11.0931,_ZN5aiter41f4gemm_bf16_per1x32Fp4_BpreShuffle_32x128E,27.22,857.37,0.0
256,8,4096,1024,29,0,5.0957,_ZN5aiter41f4gemm_bf16_per1x32Fp4_BpreShuffle_64x128E,13.17,425.22,0.0
256,8,4096,4096,21,0,9.0927,_ZN5aiter41f4gemm_bf16_per1x32Fp4_BpreShuffle_32x128E,29.52,931.57,0.0
256,8,4096,8192,21,0,12.8815,_ZN5aiter41f4gemm_bf16_per1x32Fp4_BpreShuffle_32x128E,41.68,1310.06,0.0
256,8,4096,14336,21,0,21.6872,_ZN5aiter41f4gemm_bf16_per1x32Fp4_BpreShuffle_32x128E,43.32,1359.47,0.0
256,8,6144,2048,29,0,6.4847,_ZN5aiter41f4gemm_bf16_per1x32Fp4_BpreShuffle_64x128E,31.05,986.62,0.0
256,8,6144,3072,21,0,7.2755,_ZN5aiter41f4gemm_bf16_per1x32Fp4_BpreShuffle_32x128E,41.51,1312.32,0.0
256,8,6144,4096,21,0,9.0955,_ZN5aiter41f4gemm_bf16_per1x32Fp4_BpreShuffle_32x128E,44.27,1396.03,0.0
256,8,6144,12288,21,0,19.0255,_ZN5aiter41f4gemm_bf16_per1x32Fp4_BpreShuffle_32x128E,63.49,1991.86,0.0
256,8,6144,16384,21,0,25.2355,_ZN5aiter41f4gemm_bf16_per1x32Fp4_BpreShuffle_32x128E,63.82,2000.97,0.0
256,8,7168,2048,29,0,5.836,_ZN5aiter41f4gemm_bf16_per1x32Fp4_BpreShuffle_64x128E,40.25,1278.77,0.0
256,8,7168,8192,21,0,14.1279,_ZN5aiter41f4gemm_bf16_per1x32Fp4_BpreShuffle_32x128E,66.5,2088.6,0.0
256,8,7168,16384,21,0,25.6172,_ZN5aiter41f4gemm_bf16_per1x32Fp4_BpreShuffle_32x128E,73.35,2299.26,0.0
256,8,7168,18432,21,0,28.2761,_ZN5aiter41f4gemm_bf16_per1x32Fp4_BpreShuffle_32x128E,74.76,2342.92,0.0
256,8,8192,4096,21,0,8.5155,_ZN5aiter41f4gemm_bf16_per1x32Fp4_BpreShuffle_32x128E,63.05,1987.51,0.0
256,8,8192,8192,21,0,14.4423,_ZN5aiter41f4gemm_bf16_per1x32Fp4_BpreShuffle_32x128E,74.35,2334.69,0.0
256,8,8192,28672,21,0,45.9253,_ZN5aiter41f4gemm_bf16_per1x32Fp4_BpreShuffle_32x128E,81.83,2562.56,0.0
256,8,10240,8192,21,0,15.0535,_ZN5aiter41f4gemm_bf16_per1x32Fp4_BpreShuffle_32x128E,89.16,2799.33,0.0
256,8,12288,512,29,0,4.4584,_ZN5aiter41f4gemm_bf16_per1x32Fp4_BpreShuffle_64x128E,22.58,750.13,0.0
256,8,12288,1536,21,0,5.8293,_ZN5aiter41f4gemm_bf16_per1x32Fp4_BpreShuffle_32x128E,51.81,1653.7,0.0
256,8,12288,4096,29,0,9.7782,_ZN5aiter41f4gemm_bf16_per1x32Fp4_BpreShuffle_64x128E,82.36,2595.45,0.0
256,8,12288,6144,21,0,11.7431,_ZN5aiter41f4gemm_bf16_per1x32Fp4_BpreShuffle_32x128E,102.87,3233.38,0.0
256,8,16384,512,42,0,4.8202,_ZN5aiter42f4gemm_bf16_per1x32Fp4_BpreShuffle_128x128E,27.84,924.96,0.0
256,8,16384,2048,21,0,6.3214,_ZN5aiter41f4gemm_bf16_per1x32Fp4_BpreShuffle_32x128E,84.93,2696.8,0.0
256,8,16384,16384,21,0,29.9374,_ZN5aiter41f4gemm_bf16_per1x32Fp4_BpreShuffle_32x128E,143.46,4494.22,0.0
256,8,16384,53248,21,0,88.6774,_ZN5aiter41f4gemm_bf16_per1x32Fp4_BpreShuffle_32x128E,157.41,4924.4,0.0
256,8,18432,7168,21,0,15.1166,_ZN5aiter41f4gemm_bf16_per1x32Fp4_BpreShuffle_32x128E,139.84,4391.46,0.0
256,8,18432,16384,22,0,59.6071,_ZN5aiter42f4gemm_bf16_per1x32Fp4_BpreShuffle_192x256E,81.06,2539.22,0.0
256,8,20480,16384,21,0,32.719,_ZN5aiter41f4gemm_bf16_per1x32Fp4_BpreShuffle_32x128E,164.09,5139.69,0.0
256,8,24576,1536,21,0,6.2605,_ZN5aiter41f4gemm_bf16_per1x32Fp4_BpreShuffle_32x128E,96.47,3078.62,0.0
256,8,26624,16384,24,0,82.4334,_ZN5aiter42f4gemm_bf16_per1x32Fp4_BpreShuffle_256x256E,84.67,2651.78,0.0
256,8,28672,4096,29,0,13.8939,_ZN5aiter41f4gemm_bf16_per1x32Fp4_BpreShuffle_64x128E,135.24,4260.53,0.0
256,8,32768,512,21,0,5.0403,_ZN5aiter41f4gemm_bf16_per1x32Fp4_BpreShuffle_32x128E,53.26,1768.73,0.0
256,8,57344,8192,14,0,44.7964,a4w4_blockscale_256x32x128x128_16x16_16x16_8x32x1_8x32x1_1x16x1x16_8_2x2_intrawave_v3,167.79,5264.51,0.0
256,8,59136,8192,14,0,46.5871,a4w4_blockscale_256x32x128x128_16x16_16x16_8x32x1_8x32x1_1x16x1x16_8_2x2_intrawave_v3,166.38,5220.33,0.0
256,8,106496,16384,3,0,147.25,a4w4_blockscale_256x64x512x128_16x16_16x16_8x32x1_8x32x1_1x32x1x8_8_2x2_intrawave_v3,189.59,5936.74,0.0
256,16,512,4096,21,0,5.6787,_ZN5aiter41f4gemm_bf16_per1x32Fp4_BpreShuffle_32x128E,11.82,193.31,0.0
256,16,512,7168,4,0,16.8692,a4w4_blockscale_256x96x128x128_16x16_16x16_8x32x1_8x32x1_1x32x1x8_8_2x2_intrawave_v3,6.96,113.15,0.0
256,16,800,5120,22,0,21.2953,_ZN5aiter42f4gemm_bf16_per1x32Fp4_BpreShuffle_192x256E,6.15,99.3,0.0
256,16,1024,3072,21,0,6.1362,_ZN5aiter41f4gemm_bf16_per1x32Fp4_BpreShuffle_32x128E,16.4,265.67,0.0
256,16,1024,4096,29,0,7.1983,_ZN5aiter41f4gemm_bf16_per1x32Fp4_BpreShuffle_64x128E,18.65,300.44,0.0
256,16,1280,8192,42,0,16.8681,_ZN5aiter42f4gemm_bf16_per1x32Fp4_BpreShuffle_128x128E,19.89,317.13,0.0
256,16,1536,3072,21,0,6.7767,_ZN5aiter41f4gemm_bf16_per1x32Fp4_BpreShuffle_32x128E,22.28,359.03,0.0
256,16,1536,7168,21,0,13.1256,_ZN5aiter41f4gemm_bf16_per1x32Fp4_BpreShuffle_32x128E,26.84,427.52,0.0
256,16,2048,6144,21,0,11.4627,_ZN5aiter41f4gemm_bf16_per1x32Fp4_BpreShuffle_32x128E,35.13,558.87,0.0
256,16,2048,7168,21,0,13.274,_ZN5aiter41f4gemm_bf16_per1x32Fp4_BpreShuffle_32x128E,35.39,562.22,0.0
256,16,2304,16384,21,0,24.026,_ZN5aiter41f4gemm_bf16_per1x32Fp4_BpreShuffle_32x128E,50.28,794.11,0.0
256,16,2560,8192,37,0,17.9374,_ZN5aiter41f4gemm_bf16_per1x32Fp4_BpreShuffle_96x128E,37.41,592.8,0.0
256,16,3072,1536,21,0,6.009,_ZN5aiter41f4gemm_bf16_per1x32Fp4_BpreShuffle_32x128E,25.13,411.03,0.0
256,16,3072,6144,21,0,11.4387,_ZN5aiter41f4gemm_bf16_per1x32Fp4_BpreShuffle_32x128E,52.8,837.91,0.0
256,16,4096,1024,29,0,5.2016,_ZN5aiter41f4gemm_bf16_per1x32Fp4_BpreShuffle_64x128E,25.8,429.95,0.0
256,16,4096,4096,21,0,9.4039,_ZN5aiter41f4gemm_bf16_per1x32Fp4_BpreShuffle_32x128E,57.09,909.46,0.0
256,16,4096,8192,21,0,13.3131,_ZN5aiter41f4gemm_bf16_per1x32Fp4_BpreShuffle_32x128E,80.65,1274.97,0.0
256,16,4096,14336,21,0,22.4402,_ZN5aiter41f4gemm_bf16_per1x32Fp4_BpreShuffle_32x128E,83.74,1319.32,0.0
256,16,4608,7168,0,0,22.3101,a4w4_blockscale_256x64x128x128_16x16_16x16_8x32x1_8x32x1_1x32x1x8_8_2x2_intrawave_v3,47.38,749.43,0.0
256,16,4608,16384,21,0,25.737,_ZN5aiter41f4gemm_bf16_per1x32Fp4_BpreShuffle_32x128E,93.87,1477.53,0.0
256,16,5120,1280,29,0,6.4902,_ZN5aiter41f4gemm_bf16_per1x32Fp4_BpreShuffle_64x128E,32.31,531.71,0.0
256,16,5120,5120,37,0,14.0232,_ZN5aiter41f4gemm_bf16_per1x32Fp4_BpreShuffle_96x128E,59.82,949.28,0.0
256,16,5120,6400,46,0,14.2958,_ZN5aiter42f4gemm_bf16_per1x32Fp4_BpreShuffle_160x128E,73.35,1161.11,0.0
256,16,5120,25600,21,0,39.0242,_ZN5aiter41f4gemm_bf16_per1x32Fp4_BpreShuffle_32x128E,107.48,1688.81,0.0
256,16,6144,2048,21,0,6.5528,_ZN5aiter41f4gemm_bf16_per1x32Fp4_BpreShuffle_32x128E,61.45,992.62,0.0
256,16,6144,3072,29,0,7.6676,_ZN5aiter41f4gemm_bf16_per1x32Fp4_BpreShuffle_64x128E,78.77,1259.63,0.0
256,16,6144,4096,29,0,9.8679,_ZN5aiter41f4gemm_bf16_per1x32Fp4_BpreShuffle_64x128E,81.61,1298.38,0.0
256,16,6144,12288,21,0,19.6767,_ZN5aiter41f4gemm_bf16_per1x32Fp4_BpreShuffle_32x128E,122.78,1933.44,0.0
256,16,6144,16384,21,0,25.9976,_ZN5aiter41f4gemm_bf16_per1x32Fp4_BpreShuffle_32x128E,123.9,1948.62,0.0
256,16,6400,5120,29,0,13.8091,_ZN5aiter41f4gemm_bf16_per1x32Fp4_BpreShuffle_64x128E,75.93,1204.26,0.0
256,16,7168,2048,21,0,6.4858,_ZN5aiter41f4gemm_bf16_per1x32Fp4_BpreShuffle_32x128E,72.43,1169.6,0.0
256,16,7168,2304,0,0,9.5571,a4w4_blockscale_256x64x128x128_16x16_16x16_8x32x1_8x32x1_1x32x1x8_8_2x2_intrawave_v3,55.3,889.95,0.0
256,16,7168,8192,21,0,14.6268,_ZN5aiter41f4gemm_bf16_per1x32Fp4_BpreShuffle_32x128E,128.47,2027.45,0.0
256,16,7168,16384,21,0,26.4865,_ZN5aiter41f4gemm_bf16_per1x32Fp4_BpreShuffle_32x128E,141.89,2230.6,0.0
256,16,7168,18432,21,0,29.2062,_ZN5aiter41f4gemm_bf16_per1x32Fp4_BpreShuffle_32x128E,144.76,2274.76,0.0
256,16,8192,1024,21,0,5.453,_ZN5aiter41f4gemm_bf16_per1x32Fp4_BpreShuffle_32x128E,49.23,818.75,0.0
256,16,8192,2048,21,0,7.2534,_ZN5aiter41f4gemm_bf16_per1x32Fp4_BpreShuffle_32x128E,74.02,1194.91,0.0
256,16,8192,3584,21,0,8.9059,_ZN5aiter41f4gemm_bf16_per1x32Fp4_BpreShuffle_32x128E,105.49,1681.01,0.0
256,16,8192,4096,21,0,8.6726,_ZN5aiter41f4gemm_bf16_per1x32Fp4_BpreShuffle_32x128E,123.81,1968.51,0.0
256,16,8192,7168,21,0,16.4747,_ZN5aiter41f4gemm_bf16_per1x32Fp4_BpreShuffle_32x128E,114.06,1801.53,0.0
256,16,8192,8192,21,0,14.8938,_ZN5aiter41f4gemm_bf16_per1x32Fp4_BpreShuffle_32x128E,144.19,2274.91,0.0
256,16,8192,28672,21,0,46.3894,_ZN5aiter41f4gemm_bf16_per1x32Fp4_BpreShuffle_32x128E,162.02,2542.22,0.0
256,16,9216,16384,21,0,27.5351,_ZN5aiter41f4gemm_bf16_per1x32Fp4_BpreShuffle_32x128E,175.48,2757.33,0.0
256,16,10240,8192,21,0,15.5584,_ZN5aiter41f4gemm_bf16_per1x32Fp4_BpreShuffle_32x128E,172.53,2721.12,0.0
256,16,12288,512,21,0,4.4122,_ZN5aiter41f4gemm_bf16_per1x32Fp4_BpreShuffle_32x128E,45.63,803.01,0.0
256,16,12288,1536,21,0,6.3038,_ZN5aiter41f4gemm_bf16_per1x32Fp4_BpreShuffle_32x128E,95.81,1561.39,0.0
256,16,12288,4096,42,0,10.1125,_ZN5aiter42f4gemm_bf16_per1x32Fp4_BpreShuffle_128x128E,159.27,2530.71,0.0
256,16,12288,6144,21,0,12.4264,_ZN5aiter41f4gemm_bf16_per1x32Fp4_BpreShuffle_32x128E,194.42,3073.38,0.0
256,16,12800,5120,21,0,15.1771,_ZN5aiter41f4gemm_bf16_per1x32Fp4_BpreShuffle_32x128E,138.18,2188.73,0.0
256,16,13312,16384,21,0,29.6788,_ZN5aiter41f4gemm_bf16_per1x32Fp4_BpreShuffle_32x128E,235.16,3693.17,0.0
256,16,14336,8192,21,0,18.0277,_ZN5aiter41f4gemm_bf16_per1x32Fp4_BpreShuffle_32x128E,208.46,3286.31,0.0
256,16,16384,512,21,0,4.4994,_ZN5aiter41f4gemm_bf16_per1x32Fp4_BpreShuffle_32x128E,59.66,1049.63,0.0
256,16,16384,2048,21,0,6.429,_ZN5aiter41f4gemm_bf16_per1x32Fp4_BpreShuffle_32x128E,167.02,2693.71,0.0
256,16,16384,4096,21,0,13.7825,_ZN5aiter41f4gemm_bf16_per1x32Fp4_BpreShuffle_32x128E,155.81,2474.99,0.0
256,16,16384,6656,29,0,18.0628,_ZN5aiter41f4gemm_bf16_per1x32Fp4_BpreShuffle_64x128E,193.2,3050.66,0.0
256,16,16384,8192,21,0,20.1001,_ZN5aiter41f4gemm_bf16_per1x32Fp4_BpreShuffle_32x128E,213.68,3368.08,0.0
256,16,16384,13312,37,0,26.8849,_ZN5aiter41f4gemm_bf16_per1x32Fp4_BpreShuffle_96x128E,259.6,4079.71,0.0
256,16,16384,16384,21,0,30.6345,_ZN5aiter41f4gemm_bf16_per1x32Fp4_BpreShuffle_32x128E,280.4,4402.65,0.0
256,16,16384,26624,37,0,49.6732,_ZN5aiter41f4gemm_bf16_per1x32Fp4_BpreShuffle_96x128E,281.01,4405.62,0.0
256,16,16384,53248,21,0,91.0136,_ZN5aiter41f4gemm_bf16_per1x32Fp4_BpreShuffle_32x128E,306.74,4803.21,0.0
256,16,18432,7168,21,0,15.5712,_ZN5aiter41f4gemm_bf16_per1x32Fp4_BpreShuffle_32x128E,271.52,4284.03,0.0
256,16,18432,16384,22,0,60.0972,_ZN5aiter42f4gemm_bf16_per1x32Fp4_BpreShuffle_192x256E,160.8,2524.51,0.0
256,16,20480,16384,21,0,33.3906,_ZN5aiter41f4gemm_bf16_per1x32Fp4_BpreShuffle_32x128E,321.57,5048.09,0.0
256,16,24576,1536,21,0,6.4818,_ZN5aiter41f4gemm_bf16_per1x32Fp4_BpreShuffle_32x128E,186.36,3035.13,0.0
256,16,26624,16384,42,0,45.9082,_ZN5aiter42f4gemm_bf16_per1x32Fp4_BpreShuffle_128x128E,304.06,4772.28,0.0
256,16,28672,4096,21,0,14.2242,_ZN5aiter41f4gemm_bf16_per1x32Fp4_BpreShuffle_32x128E,264.2,4195.0,0.0
256,16,32768,512,21,0,5.0649,_ZN5aiter41f4gemm_bf16_per1x32Fp4_BpreShuffle_32x128E,106.0,1864.06,0.0
256,16,51200,5120,14,0,24.0294,a4w4_blockscale_256x32x128x128_16x16_16x16_8x32x1_8x32x1_1x16x1x16_8_2x2_intrawave_v3,349.1,5524.54,0.0
256,16,53248,16384,12,0,74.0858,a4w4_blockscale_256x64x128x128_16x16_16x16_8x32x1_8x32x1_1x16x1x16_8_2x2_intrawave_v3,376.82,5912.64,0.0
256,16,57344,8192,14,0,44.8301,a4w4_blockscale_256x32x128x128_16x16_16x16_8x32x1_8x32x1_1x16x1x16_8_2x2_intrawave_v3,335.32,5281.75,0.0
256,16,59136,8192,14,0,47.0904,a4w4_blockscale_256x32x128x128_16x16_16x16_8x32x1_8x32x1_1x16x1x16_8_2x2_intrawave_v3,329.2,5185.32,0.0
256,16,106496,16384,17,0,145.7428,a4w4_blockscale_256x32x512x128_16x16_16x16_8x32x1_8x32x1_1x8x1x32_8_2x4_intrawave_v3,383.1,6010.27,0.0
256,32,512,4096,21,0,5.9227,_ZN5aiter41f4gemm_bf16_per1x32Fp4_BpreShuffle_32x128E,22.66,193.64,0.0
256,32,512,7168,4,0,17.0396,a4w4_blockscale_256x96x128x128_16x16_16x16_8x32x1_8x32x1_1x32x1x8_8_2x2_intrawave_v3,13.78,116.34,0.0
256,32,800,5120,22,0,21.989,_ZN5aiter42f4gemm_bf16_per1x32Fp4_BpreShuffle_192x256E,11.92,99.19,0.0
256,32,1024,3072,29,0,6.3604,_ZN5aiter41f4gemm_bf16_per1x32Fp4_BpreShuffle_64x128E,31.65,265.32,0.0
256,32,1024,4096,29,0,7.9175,_ZN5aiter41f4gemm_bf16_per1x32Fp4_BpreShuffle_64x128E,33.9,281.43,0.0
256,32,1280,8192,21,0,16.8907,_ZN5aiter41f4gemm_bf16_per1x32Fp4_BpreShuffle_32x128E,39.73,323.01,0.0
256,32,1536,3072,29,0,7.4775,_ZN5aiter41f4gemm_bf16_per1x32Fp4_BpreShuffle_64x128E,40.39,335.24,0.0
256,32,1536,7168,21,0,13.9479,_ZN5aiter41f4gemm_bf16_per1x32Fp4_BpreShuffle_32x128E,50.52,409.96,0.0
256,32,2048,6144,29,0,12.2392,_ZN5aiter41f4gemm_bf16_per1x32Fp4_BpreShuffle_64x128E,65.8,532.78,0.0
256,32,2048,7168,21,0,14.1868,_ZN5aiter41f4gemm_bf16_per1x32Fp4_BpreShuffle_32x128E,66.23,534.71,0.0
256,32,2304,16384,21,0,25.8248,_ZN5aiter41f4gemm_bf16_per1x32Fp4_BpreShuffle_32x128E,93.55,746.72,0.0
256,32,2560,8192,29,0,17.301,_ZN5aiter41f4gemm_bf16_per1x32Fp4_BpreShuffle_64x128E,77.58,623.12,0.0
256,32,3072,1536,29,0,6.1627,_ZN5aiter41f4gemm_bf16_per1x32Fp4_BpreShuffle_64x128E,49.0,418.73,0.0
256,32,3072,6144,21,0,12.2126,_ZN5aiter41f4gemm_bf16_per1x32Fp4_BpreShuffle_32x128E,98.91,796.89,0.0
256,32,4096,1024,14,0,5.3091,a4w4_blockscale_256x32x128x128_16x16_16x16_8x32x1_8x32x1_1x16x1x16_8_2x2_intrawave_v3,50.56,447.47,0.0
256,32,4096,4096,21,0,10.0025,_ZN5aiter41f4gemm_bf16_per1x32Fp4_BpreShuffle_32x128E,107.35,871.41,0.0
256,32,4096,8192,21,0,14.4168,_ZN5aiter41f4gemm_bf16_per1x32Fp4_BpreShuffle_32x128E,148.96,1191.0,0.0
256,32,4096,14336,21,0,24.1615,_ZN5aiter41f4gemm_bf16_per1x32Fp4_BpreShuffle_32x128E,155.54,1235.5,0.0
256,32,4608,7168,0,0,22.2165,a4w4_blockscale_256x64x128x128_16x16_16x16_8x32x1_8x32x1_1x32x1x8_8_2x2_intrawave_v3,95.15,761.81,0.0
256,32,4608,16384,21,0,27.3808,_ZN5aiter41f4gemm_bf16_per1x32Fp4_BpreShuffle_32x128E,176.47,1399.0,0.0
256,32,5120,1280,29,0,6.1505,_ZN5aiter41f4gemm_bf16_per1x32Fp4_BpreShuffle_64x128E,68.19,589.38,0.0
256,32,5120,5120,29,0,14.5083,_ZN5aiter41f4gemm_bf16_per1x32Fp4_BpreShuffle_64x128E,115.64,931.66,0.0
256,32,5120,6400,29,0,16.8268,_ZN5aiter41f4gemm_bf16_per1x32Fp4_BpreShuffle_64x128E,124.63,999.24,0.0
256,32,5120,25600,21,0,42.0705,_ZN5aiter41f4gemm_bf16_per1x32Fp4_BpreShuffle_32x128E,199.39,1575.29,0.0
256,32,6144,2048,29,0,6.6444,_ZN5aiter41f4gemm_bf16_per1x32Fp4_BpreShuffle_64x128E,121.2,1010.99,0.0
256,32,6144,3072,29,0,9.4195,_ZN5aiter41f4gemm_bf16_per1x32Fp4_BpreShuffle_64x128E,128.24,1048.84,0.0
256,32,6144,4096,46,0,10.1863,_ZN5aiter42f4gemm_bf16_per1x32Fp4_BpreShuffle_160x128E,158.12,1280.31,0.0
256,32,6144,12288,21,0,21.2506,_ZN5aiter41f4gemm_bf16_per1x32Fp4_BpreShuffle_32x128E,227.37,1804.12,0.0
256,32,6144,16384,21,0,27.663,_ZN5aiter41f4gemm_bf16_per1x32Fp4_BpreShuffle_32x128E,232.89,1843.15,0.0
256,32,6400,5120,21,0,15.6923,_ZN5aiter41f4gemm_bf16_per1x32Fp4_BpreShuffle_32x128E,133.64,1075.4,0.0
256,32,7168,2048,42,0,6.821,_ZN5aiter42f4gemm_bf16_per1x32Fp4_BpreShuffle_128x128E,137.74,1148.15,0.0
256,32,7168,2304,0,0,9.7787,a4w4_blockscale_256x64x128x128_16x16_16x16_8x32x1_8x32x1_1x32x1x8_8_2x2_intrawave_v3,108.09,895.12,0.0
256,32,7168,8192,21,0,15.6065,_ZN5aiter41f4gemm_bf16_per1x32Fp4_BpreShuffle_32x128E,240.8,1919.07,0.0
256,32,7168,16384,21,0,28.1831,_ZN5aiter41f4gemm_bf16_per1x32Fp4_BpreShuffle_32x128E,266.69,2109.11,0.0
256,32,7168,18432,21,0,31.3603,_ZN5aiter41f4gemm_bf16_per1x32Fp4_BpreShuffle_32x128E,269.63,2130.53,0.0
256,32,8192,1024,21,0,5.8783,_ZN5aiter41f4gemm_bf16_per1x32Fp4_BpreShuffle_32x128E,91.33,805.5,0.0
256,32,8192,2048,21,0,7.2694,_ZN5aiter41f4gemm_bf16_per1x32Fp4_BpreShuffle_32x128E,147.71,1230.59,0.0
256,32,8192,3584,21,0,9.4337,_ZN5aiter41f4gemm_bf16_per1x32Fp4_BpreShuffle_32x128E,199.18,1617.78,0.0
256,32,8192,4096,29,0,9.5391,_ZN5aiter41f4gemm_bf16_per1x32Fp4_BpreShuffle_64x128E,225.12,1820.62,0.0
256,32,8192,7168,21,0,18.6983,_ZN5aiter41f4gemm_bf16_per1x32Fp4_BpreShuffle_32x128E,200.99,1604.38,0.0
256,32,8192,8192,21,0,15.8689,_ZN5aiter41f4gemm_bf16_per1x32Fp4_BpreShuffle_32x128E,270.65,2155.78,0.0
256,32,8192,28672,21,0,50.1679,_ZN5aiter41f4gemm_bf16_per1x32Fp4_BpreShuffle_32x128E,299.64,2360.54,0.0
256,32,9216,16384,21,0,29.3716,_ZN5aiter41f4gemm_bf16_per1x32Fp4_BpreShuffle_32x128E,329.01,2599.43,0.0
256,32,10240,8192,21,0,16.5466,_ZN5aiter41f4gemm_bf16_per1x32Fp4_BpreShuffle_32x128E,324.46,2582.37,0.0
256,32,12288,512,21,0,4.5819,_ZN5aiter41f4gemm_bf16_per1x32Fp4_BpreShuffle_32x128E,87.88,859.98,0.0
256,32,12288,1536,21,0,6.3551,_ZN5aiter41f4gemm_bf16_per1x32Fp4_BpreShuffle_32x128E,190.08,1612.59,0.0
256,32,12288,4096,21,0,9.7836,_ZN5aiter41f4gemm_bf16_per1x32Fp4_BpreShuffle_32x128E,329.25,2659.33,0.0
256,32,12288,6144,21,0,13.449,_ZN5aiter41f4gemm_bf16_per1x32Fp4_BpreShuffle_32x128E,359.27,2872.59,0.0
256,32,12800,5120,21,0,17.2457,_ZN5aiter41f4gemm_bf16_per1x32Fp4_BpreShuffle_32x128E,243.21,1952.32,0.0
256,32,13312,16384,21,0,32.0127,_ZN5aiter41f4gemm_bf16_per1x32Fp4_BpreShuffle_32x128E,436.03,3441.32,0.0
256,32,14336,8192,29,0,18.6847,_ZN5aiter41f4gemm_bf16_per1x32Fp4_BpreShuffle_64x128E,402.26,3198.81,0.0
256,32,16384,512,21,0,4.6435,_ZN5aiter41f4gemm_bf16_per1x32Fp4_BpreShuffle_32x128E,115.62,1130.84,0.0
256,32,16384,2048,21,0,6.8106,_ZN5aiter41f4gemm_bf16_per1x32Fp4_BpreShuffle_32x128E,315.31,2622.17,0.0
256,32,16384,4096,21,0,13.3393,_ZN5aiter41f4gemm_bf16_per1x32Fp4_BpreShuffle_32x128E,321.98,2598.98,0.0
256,32,16384,6656,21,0,18.0028,_ZN5aiter41f4gemm_bf16_per1x32Fp4_BpreShuffle_32x128E,387.68,3092.91,0.0
256,32,16384,8192,21,0,20.7777,_ZN5aiter41f4gemm_bf16_per1x32Fp4_BpreShuffle_32x128E,413.42,3286.63,0.0
256,32,16384,13312,21,0,27.8363,_ZN5aiter41f4gemm_bf16_per1x32Fp4_BpreShuffle_32x128E,501.45,3962.94,0.0
256,32,16384,16384,21,0,33.0522,_ZN5aiter41f4gemm_bf16_per1x32Fp4_BpreShuffle_32x128E,519.78,4100.44,0.0
256,32,16384,26624,29,0,51.4954,_ZN5aiter41f4gemm_bf16_per1x32Fp4_BpreShuffle_64x128E,542.13,4264.04,0.0
256,32,16384,53248,21,0,96.3502,_ZN5aiter41f4gemm_bf16_per1x32Fp4_BpreShuffle_32x128E,579.5,4547.04,0.0
256,32,18432,7168,21,0,17.1967,_ZN5aiter41f4gemm_bf16_per1x32Fp4_BpreShuffle_32x128E,491.71,3916.72,0.0
256,32,18432,16384,22,0,63.2576,_ZN5aiter42f4gemm_bf16_per1x32Fp4_BpreShuffle_192x256E,305.53,2409.78,0.0
256,32,20480,16384,29,0,35.5786,_ZN5aiter41f4gemm_bf16_per1x32Fp4_BpreShuffle_64x128E,603.59,4759.74,0.0
256,32,24576,1536,21,0,6.3941,_ZN5aiter41f4gemm_bf16_per1x32Fp4_BpreShuffle_32x128E,377.84,3201.67,0.0
256,32,26624,16384,37,0,44.8726,_ZN5aiter41f4gemm_bf16_per1x32Fp4_BpreShuffle_96x128E,622.15,4904.33,0.0
256,32,28672,4096,21,0,14.8004,_ZN5aiter41f4gemm_bf16_per1x32Fp4_BpreShuffle_32x128E,507.84,4095.89,0.0
256,32,32768,512,43,0,5.7265,_ZN5aiter42f4gemm_bf16_per1x32Fp4_BpreShuffle_128x256E,187.5,1832.52,0.0
256,32,51200,5120,14,0,25.3094,a4w4_blockscale_256x32x128x128_16x16_16x16_8x32x1_8x32x1_1x16x1x16_8_2x2_intrawave_v3,662.88,5311.49,0.0
256,32,53248,16384,12,0,75.1943,a4w4_blockscale_256x64x128x128_16x16_16x16_8x32x1_8x32x1_1x16x1x16_8_2x2_intrawave_v3,742.54,5849.88,0.0
256,32,57344,8192,14,0,45.7848,a4w4_blockscale_256x32x128x128_16x16_16x16_8x32x1_8x32x1_1x16x1x16_8_2x2_intrawave_v3,656.65,5213.13,0.0
256,32,59136,8192,15,0,47.9633,a4w4_blockscale_256x32x256x128_16x16_16x16_8x32x1_8x32x1_1x8x1x32_8_2x4_intrawave_v3,646.42,5131.77,0.0
256,32,106496,16384,17,0,142.9821,a4w4_blockscale_256x32x512x128_16x16_16x16_8x32x1_8x32x1_1x8x1x32_8_2x4_intrawave_v3,781.0,6151.07,0.0
256,64,192,1024,21,0,3.8719,_ZN5aiter41f4gemm_bf16_per1x32Fp4_BpreShuffle_32x128E,6.5,40.2,0.0
256,64,512,4096,21,0,6.2843,_ZN5aiter41f4gemm_bf16_per1x32Fp4_BpreShuffle_32x128E,42.72,198.14,0.0
256,64,512,7168,4,0,18.2008,a4w4_blockscale_256x96x128x128_16x16_16x16_8x32x1_8x32x1_1x32x1x8_8_2x2_intrawave_v3,25.81,117.02,0.0
256,64,800,5120,22,0,25.8477,_ZN5aiter42f4gemm_bf16_per1x32Fp4_BpreShuffle_192x256E,20.28,89.53,0.0
256,64,1024,3072,21,0,6.3028,_ZN5aiter41f4gemm_bf16_per1x32Fp4_BpreShuffle_32x128E,63.88,285.94,0.0
256,64,1024,4096,21,0,8.9889,_ZN5aiter41f4gemm_bf16_per1x32Fp4_BpreShuffle_32x128E,59.73,262.47,0.0
256,64,1280,8192,21,0,17.9567,_ZN5aiter41f4gemm_bf16_per1x32Fp4_BpreShuffle_32x128E,74.75,315.7,0.0
256,64,1536,3072,21,0,6.9252,_ZN5aiter41f4gemm_bf16_per1x32Fp4_BpreShuffle_32x128E,87.21,383.27,0.0
256,64,1536,7168,21,0,13.372,_ZN5aiter41f4gemm_bf16_per1x32Fp4_BpreShuffle_32x128E,105.39,443.54,0.0
256,64,2048,6144,21,0,11.8464,_ZN5aiter41f4gemm_bf16_per1x32Fp4_BpreShuffle_32x128E,135.96,569.81,0.0
256,64,2048,7168,21,0,13.7284,_ZN5aiter41f4gemm_bf16_per1x32Fp4_BpreShuffle_32x128E,136.87,570.46,0.0
256,64,2304,16384,21,0,25.9264,_ZN5aiter41f4gemm_bf16_per1x32Fp4_BpreShuffle_32x128E,186.37,759.6,0.0
256,64,2560,8192,21,0,17.5991,_ZN5aiter41f4gemm_bf16_per1x32Fp4_BpreShuffle_32x128E,152.53,629.33,0.0
256,64,3072,1536,21,0,6.149,_ZN5aiter41f4gemm_bf16_per1x32Fp4_BpreShuffle_32x128E,98.22,455.63,0.0
256,64,3072,6144,21,0,11.8707,_ZN5aiter41f4gemm_bf16_per1x32Fp4_BpreShuffle_32x128E,203.52,844.69,0.0
256,64,4096,1024,21,0,5.4105,_ZN5aiter41f4gemm_bf16_per1x32Fp4_BpreShuffle_32x128E,99.23,490.57,0.0
256,64,4096,4096,29,0,9.9442,_ZN5aiter41f4gemm_bf16_per1x32Fp4_BpreShuffle_64x128E,215.95,909.47,0.0
256,64,4096,8192,21,0,14.0415,_ZN5aiter41f4gemm_bf16_per1x32Fp4_BpreShuffle_32x128E,305.88,1250.84,0.0
256,64,4096,14336,21,0,23.3334,_ZN5aiter41f4gemm_bf16_per1x32Fp4_BpreShuffle_32x128E,322.12,1300.42,0.0
256,64,4608,7168,0,0,23.1497,a4w4_blockscale_256x64x128x128_16x16_16x16_8x32x1_8x32x1_1x32x1x8_8_2x2_intrawave_v3,182.63,748.79,0.0
256,64,4608,16384,21,0,26.8437,_ZN5aiter41f4gemm_bf16_per1x32Fp4_BpreShuffle_32x128E,360.0,1447.75,0.0
256,64,5120,1280,21,0,6.7463,_ZN5aiter41f4gemm_bf16_per1x32Fp4_BpreShuffle_32x128E,124.34,588.93,0.0
256,64,5120,5120,29,0,13.4294,_ZN5aiter41f4gemm_bf16_per1x32Fp4_BpreShuffle_64x128E,249.86,1037.01,0.0
256,64,5120,6400,37,0,15.43,_ZN5aiter41f4gemm_bf16_per1x32Fp4_BpreShuffle_96x128E,271.83,1117.57,0.0
256,64,5120,25600,21,0,40.7807,_ZN5aiter41f4gemm_bf16_per1x32Fp4_BpreShuffle_32x128E,411.4,1643.19,0.0
256,64,6144,2048,21,0,6.6403,_ZN5aiter41f4gemm_bf16_per1x32Fp4_BpreShuffle_32x128E,242.55,1075.77,0.0
256,64,6144,3072,21,0,8.6835,_ZN5aiter41f4gemm_bf16_per1x32Fp4_BpreShuffle_32x128E,278.22,1188.68,0.0
256,64,6144,4096,29,0,9.8189,_ZN5aiter41f4gemm_bf16_per1x32Fp4_BpreShuffle_64x128E,328.06,1374.94,0.0
256,64,6144,12288,21,0,20.6497,_ZN5aiter41f4gemm_bf16_per1x32Fp4_BpreShuffle_32x128E,467.98,1885.18,0.0
256,64,6144,16384,21,0,27.112,_ZN5aiter41f4gemm_bf16_per1x32Fp4_BpreShuffle_32x128E,475.25,1904.78,0.0
256,64,6400,5120,21,0,15.5961,_ZN5aiter41f4gemm_bf16_per1x32Fp4_BpreShuffle_32x128E,268.93,1113.55,0.0
256,64,7168,2048,21,0,6.8112,_ZN5aiter41f4gemm_bf16_per1x32Fp4_BpreShuffle_32x128E,275.88,1221.97,0.0
256,64,7168,2304,0,0,10.2539,a4w4_blockscale_256x64x128x128_16x16_16x16_8x32x1_8x32x1_1x32x1x8_8_2x2_intrawave_v3,206.16,901.98,0.0
256,64,7168,8192,21,0,15.3196,_ZN5aiter41f4gemm_bf16_per1x32Fp4_BpreShuffle_32x128E,490.63,1993.51,0.0
256,64,7168,16384,21,0,27.6557,_ZN5aiter41f4gemm_bf16_per1x32Fp4_BpreShuffle_32x128E,543.55,2175.39,0.0
256,64,7168,18432,21,0,30.5745,_ZN5aiter41f4gemm_bf16_per1x32Fp4_BpreShuffle_32x128E,553.12,2209.93,0.0
256,64,8192,1024,21,0,5.6831,_ZN5aiter41f4gemm_bf16_per1x32Fp4_BpreShuffle_32x128E,188.94,928.3,0.0
256,64,8192,2048,21,0,7.7271,_ZN5aiter41f4gemm_bf16_per1x32Fp4_BpreShuffle_32x128E,277.92,1229.79,0.0
256,64,8192,3584,21,0,9.2243,_ZN5aiter41f4gemm_bf16_per1x32Fp4_BpreShuffle_32x128E,407.41,1717.56,0.0
256,64,8192,4096,29,0,9.9642,_ZN5aiter41f4gemm_bf16_per1x32Fp4_BpreShuffle_64x128E,431.04,1802.14,0.0
256,64,8192,7168,37,0,17.772,_ZN5aiter41f4gemm_bf16_per1x32Fp4_BpreShuffle_96x128E,422.92,1723.95,0.0
256,64,8192,8192,21,0,15.5361,_ZN5aiter41f4gemm_bf16_per1x32Fp4_BpreShuffle_32x128E,552.9,2244.14,0.0
256,64,8192,28672,21,0,48.3134,_ZN5aiter41f4gemm_bf16_per1x32Fp4_BpreShuffle_32x128E,622.29,2471.5,0.0
256,64,9216,16384,21,0,29.2875,_ZN5aiter41f4gemm_bf16_per1x32Fp4_BpreShuffle_32x128E,659.92,2635.98,0.0
256,64,10240,8192,21,0,16.349,_ZN5aiter41f4gemm_bf16_per1x32Fp4_BpreShuffle_32x128E,656.76,2661.69,0.0
256,64,12288,512,21,0,4.5808,_ZN5aiter41f4gemm_bf16_per1x32Fp4_BpreShuffle_32x128E,175.8,1033.66,0.0
256,64,12288,1536,21,0,6.3268,_ZN5aiter41f4gemm_bf16_per1x32Fp4_BpreShuffle_32x128E,381.85,1747.99,0.0
256,64,12288,4096,21,0,10.0,_ZN5aiter41f4gemm_bf16_per1x32Fp4_BpreShuffle_32x128E,644.25,2686.98,0.0
256,64,12288,6144,21,0,13.4251,_ZN5aiter41f4gemm_bf16_per1x32Fp4_BpreShuffle_32x128E,719.82,2943.61,0.0
256,64,12800,5120,21,0,16.7255,_ZN5aiter41f4gemm_bf16_per1x32Fp4_BpreShuffle_32x128E,501.55,2066.92,0.0
256,64,13312,16384,21,0,35.8494,_ZN5aiter41f4gemm_bf16_per1x32Fp4_BpreShuffle_32x128E,778.74,3104.1,0.0
256,64,14336,8192,21,0,18.4161,_ZN5aiter41f4gemm_bf16_per1x32Fp4_BpreShuffle_32x128E,816.26,3302.4,0.0
256,64,16384,512,21,0,5.3495,_ZN5aiter41f4gemm_bf16_per1x32Fp4_BpreShuffle_32x128E,200.72,1179.15,0.0
256,64,16384,2048,21,0,6.8013,_ZN5aiter41f4gemm_bf16_per1x32Fp4_BpreShuffle_32x128E,631.49,2784.75,0.0
256,64,16384,4096,21,0,14.4039,_ZN5aiter41f4gemm_bf16_per1x32Fp4_BpreShuffle_32x128E,596.36,2484.23,0.0
256,64,16384,6656,21,0,18.7155,_ZN5aiter41f4gemm_bf16_per1x32Fp4_BpreShuffle_32x128E,745.83,3036.85,0.0
256,64,16384,8192,21,0,20.7077,_ZN5aiter41f4gemm_bf16_per1x32Fp4_BpreShuffle_32x128E,829.64,3354.7,0.0
256,64,16384,13312,21,0,32.0337,_ZN5aiter41f4gemm_bf16_per1x32Fp4_BpreShuffle_32x128E,871.5,3483.05,0.0
256,64,16384,16384,21,0,32.8484,_ZN5aiter41f4gemm_bf16_per1x32Fp4_BpreShuffle_32x128E,1046.01,4165.78,0.0
256,64,16384,26624,21,0,51.1923,_ZN5aiter41f4gemm_bf16_per1x32Fp4_BpreShuffle_32x128E,1090.68,4318.09,0.0
256,64,16384,53248,21,0,96.564,_ZN5aiter41f4gemm_bf16_per1x32Fp4_BpreShuffle_32x128E,1156.43,4556.65,0.0
256,64,18432,7168,29,0,20.1172,_ZN5aiter41f4gemm_bf16_per1x32Fp4_BpreShuffle_64x128E,840.65,3412.45,0.0
256,64,18432,16384,22,0,63.2113,_ZN5aiter42f4gemm_bf16_per1x32Fp4_BpreShuffle_192x256E,611.52,2434.35,0.0
256,64,20480,16384,29,0,41.0443,_ZN5aiter41f4gemm_bf16_per1x32Fp4_BpreShuffle_64x128E,1046.42,4164.23,0.0
256,64,24576,1536,29,0,7.7228,_ZN5aiter41f4gemm_bf16_per1x32Fp4_BpreShuffle_64x128E,625.66,2857.67,0.0
256,64,26624,16384,29,0,46.4119,_ZN5aiter41f4gemm_bf16_per1x32Fp4_BpreShuffle_64x128E,1203.02,4784.03,0.0
256,64,28672,4096,29,0,16.0086,_ZN5aiter41f4gemm_bf16_per1x32Fp4_BpreShuffle_64x128E,939.02,3905.48,0.0
256,64,32768,512,46,0,5.601,_ZN5aiter42f4gemm_bf16_per1x32Fp4_BpreShuffle_160x128E,383.41,2249.47,0.0
256,64,51200,5120,0,0,28.5654,a4w4_blockscale_256x64x128x128_16x16_16x16_8x32x1_8x32x1_1x32x1x8_8_2x2_intrawave_v3,1174.65,4823.65,0.0
256,64,53248,16384,0,0,81.0859,a4w4_blockscale_256x64x128x128_16x16_16x16_8x32x1_8x32x1_1x32x1x8_8_2x2_intrawave_v3,1377.17,5470.1,0.0
256,64,57344,8192,12,0,48.14,a4w4_blockscale_256x64x128x128_16x16_16x16_8x32x1_8x32x1_1x16x1x16_8_2x2_intrawave_v3,1249.06,5037.04,0.0
256,64,59136,8192,1,0,50.0197,a4w4_blockscale_256x64x256x128_16x16_16x16_8x32x1_8x32x1_1x32x1x8_8_2x2_intrawave_v3,1239.68,4999.08,0.0
256,64,106496,16384,3,0,150.9403,a4w4_blockscale_256x64x512x128_16x16_16x16_8x32x1_8x32x1_1x32x1x8_8_2x2_intrawave_v3,1479.65,5873.65,0.0
256,65,1280,8192,0,0,23.9233,a4w4_blockscale_256x64x128x128_16x16_16x16_8x32x1_8x32x1_1x32x1x8_8_2x2_intrawave_v3,56.98,237.24,0.0
256,112,5120,1280,21,0,6.6107,_ZN5aiter41f4gemm_bf16_per1x32Fp4_BpreShuffle_32x128E,222.07,680.01,0.0
256,112,5120,5120,21,0,14.0483,_ZN5aiter41f4gemm_bf16_per1x32Fp4_BpreShuffle_32x128E,417.99,1035.06,0.0
256,112,5120,6400,29,0,14.1005,_ZN5aiter41f4gemm_bf16_per1x32Fp4_BpreShuffle_64x128E,520.55,1268.7,0.0
256,112,5120,25600,21,0,38.6535,_ZN5aiter41f4gemm_bf16_per1x32Fp4_BpreShuffle_32x128E,759.57,1762.23,0.0
256,112,6400,5120,21,0,14.4899,_ZN5aiter41f4gemm_bf16_per1x32Fp4_BpreShuffle_32x128E,506.56,1249.44,0.0
256,112,8192,7168,29,0,17.7127,_ZN5aiter41f4gemm_bf16_per1x32Fp4_BpreShuffle_64x128E,742.59,1783.84,0.0
256,112,12800,5120,37,0,17.1116,_ZN5aiter41f4gemm_bf16_per1x32Fp4_BpreShuffle_96x128E,857.9,2099.27,0.0
256,112,51200,5120,9,0,34.2442,a4w4_blockscale_256x128x256x128_16x16_16x16_8x32x1_8x32x1_1x32x1x8_8_2x2_intrawave_v3,1714.75,4170.85,0.0
256,127,1280,8192,0,0,24.5329,a4w4_blockscale_256x64x128x128_16x16_16x16_8x32x1_8x32x1_1x32x1x8_8_2x2_intrawave_v3,108.56,248.16,0.0
256,128,128,49920,21,0,72.1898,_ZN5aiter41f4gemm_bf16_per1x32Fp4_BpreShuffle_32x128E,22.66,88.97,0.0
256,128,128,322816,21,0,446.2108,_ZN5aiter41f4gemm_bf16_per1x32Fp4_BpreShuffle_32x128E,23.71,92.68,0.0
256,128,128,423168,21,0,583.2756,_ZN5aiter41f4gemm_bf16_per1x32Fp4_BpreShuffle_32x128E,23.77,92.92,0.0
256,128,256,256,29,0,3.4878,_ZN5aiter41f4gemm_bf16_per1x32Fp4_BpreShuffle_64x128E,4.81,32.88,0.0
256,128,256,1024,29,0,4.1218,_ZN5aiter41f4gemm_bf16_per1x32Fp4_BpreShuffle_64x128E,16.28,63.6,0.0
256,128,512,4096,21,0,6.4995,_ZN5aiter41f4gemm_bf16_per1x32Fp4_BpreShuffle_32x128E,82.6,221.83,0.0
256,128,512,7168,0,0,22.7857,a4w4_blockscale_256x64x128x128_16x16_16x16_8x32x1_8x32x1_1x32x1x8_8_2x2_intrawave_v3,41.23,106.42,0.0
256,128,800,5120,24,0,32.7867,_ZN5aiter42f4gemm_bf16_per1x32Fp4_BpreShuffle_256x256E,31.98,78.71,0.0
256,128,1024,3072,21,0,6.4269,_ZN5aiter41f4gemm_bf16_per1x32Fp4_BpreShuffle_32x128E,125.3,316.11,0.0
256,128,1024,4096,21,0,8.7663,_ZN5aiter41f4gemm_bf16_per1x32Fp4_BpreShuffle_32x128E,122.49,299.04,0.0
256,128,1280,8192,21,0,14.3547,_ZN5aiter41f4gemm_bf16_per1x32Fp4_BpreShuffle_32x128E,187.0,424.59,0.0
256,128,1536,3072,21,0,6.826,_ZN5aiter41f4gemm_bf16_per1x32Fp4_BpreShuffle_32x128E,176.96,432.04,0.0
256,128,1536,7168,21,0,13.0508,_ZN5aiter41f4gemm_bf16_per1x32Fp4_BpreShuffle_32x128E,215.97,487.1,0.0
256,128,2048,6144,21,0,11.6,_ZN5aiter41f4gemm_bf16_per1x32Fp4_BpreShuffle_32x128E,277.69,621.46,0.0
256,128,2048,7168,21,0,13.396,_ZN5aiter41f4gemm_bf16_per1x32Fp4_BpreShuffle_32x128E,280.54,621.31,0.0
256,128,2304,16384,21,0,26.3592,_ZN5aiter41f4gemm_bf16_per1x32Fp4_BpreShuffle_32x128E,366.61,778.2,0.0
256,128,2560,8192,21,0,17.4515,_ZN5aiter41f4gemm_bf16_per1x32Fp4_BpreShuffle_32x128E,307.64,668.45,0.0
256,128,3072,1536,21,0,6.1683,_ZN5aiter41f4gemm_bf16_per1x32Fp4_BpreShuffle_32x128E,195.83,525.92,0.0
256,128,3072,6144,21,0,11.183,_ZN5aiter41f4gemm_bf16_per1x32Fp4_BpreShuffle_32x128E,432.07,949.37,0.0
256,128,4096,1024,21,0,5.3851,_ZN5aiter41f4gemm_bf16_per1x32Fp4_BpreShuffle_32x128E,199.39,596.32,0.0
256,128,4096,4096,21,0,10.0526,_ZN5aiter41f4gemm_bf16_per1x32Fp4_BpreShuffle_32x128E,427.25,964.86,0.0
256,128,4096,8192,21,0,13.7904,_ZN5aiter41f4gemm_bf16_per1x32Fp4_BpreShuffle_32x128E,622.89,1330.64,0.0
256,128,4096,14336,21,0,22.8828,_ZN5aiter41f4gemm_bf16_per1x32Fp4_BpreShuffle_32x128E,656.93,1368.98,0.0
256,128,4608,7168,0,0,23.5505,a4w4_blockscale_256x64x128x128_16x16_16x16_8x32x1_8x32x1_1x32x1x8_8_2x2_intrawave_v3,359.05,770.83,0.0
256,128,4608,16384,21,0,26.1969,_ZN5aiter41f4gemm_bf16_per1x32Fp4_BpreShuffle_32x128E,737.77,1526.02,0.0
256,128,5120,1280,21,0,6.7817,_ZN5aiter41f4gemm_bf16_per1x32Fp4_BpreShuffle_32x128E,247.39,688.54,0.0
256,128,5120,5120,21,0,13.8116,_ZN5aiter41f4gemm_bf16_per1x32Fp4_BpreShuffle_32x128E,485.89,1067.62,0.0
256,128,5120,6400,21,0,15.856,_ZN5aiter41f4gemm_bf16_per1x32Fp4_BpreShuffle_32x128E,529.05,1141.8,0.0
256,128,5120,25600,21,0,40.0938,_ZN5aiter41f4gemm_bf16_per1x32Fp4_BpreShuffle_32x128E,836.9,1708.12,0.0
256,128,6144,2048,21,0,6.794,_ZN5aiter41f4gemm_bf16_per1x32Fp4_BpreShuffle_32x128E,474.13,1176.83,0.0
256,128,6144,3072,21,0,9.1419,_ZN5aiter41f4gemm_bf16_per1x32Fp4_BpreShuffle_32x128E,528.54,1225.86,0.0
256,128,6144,4096,21,0,10.2408,_ZN5aiter41f4gemm_bf16_per1x32Fp4_BpreShuffle_32x128E,629.1,1407.89,0.0
256,128,6144,12288,21,0,20.3662,_ZN5aiter41f4gemm_bf16_per1x32Fp4_BpreShuffle_32x128E,948.99,1969.34,0.0
256,128,6144,16384,21,0,26.9082,_ZN5aiter41f4gemm_bf16_per1x32Fp4_BpreShuffle_32x128E,957.69,1967.92,0.0
256,128,6400,5120,21,0,14.762,_ZN5aiter41f4gemm_bf16_per1x32Fp4_BpreShuffle_32x128E,568.26,1243.06,0.0
256,128,7168,2048,21,0,6.8857,_ZN5aiter41f4gemm_bf16_per1x32Fp4_BpreShuffle_32x128E,545.78,1351.51,0.0
256,128,7168,2304,0,0,10.3883,a4w4_blockscale_256x64x128x128_16x16_16x16_8x32x1_8x32x1_1x32x1x8_8_2x2_intrawave_v3,406.98,985.72,0.0
256,128,7168,8192,21,0,15.244,_ZN5aiter41f4gemm_bf16_per1x32Fp4_BpreShuffle_32x128E,986.12,2080.78,0.0
256,128,7168,16384,21,0,27.6111,_ZN5aiter41f4gemm_bf16_per1x32Fp4_BpreShuffle_32x128E,1088.87,2231.13,0.0
256,128,7168,18432,21,0,30.4024,_ZN5aiter41f4gemm_bf16_per1x32Fp4_BpreShuffle_32x128E,1112.51,2272.02,0.0
256,128,8192,1024,21,0,5.7823,_ZN5aiter41f4gemm_bf16_per1x32Fp4_BpreShuffle_32x128E,371.39,1099.39,0.0
256,128,8192,2048,21,0,7.5231,_ZN5aiter41f4gemm_bf16_per1x32Fp4_BpreShuffle_32x128E,570.9,1411.23,0.0
256,128,8192,3584,21,0,9.4332,_ZN5aiter41f4gemm_bf16_per1x32Fp4_BpreShuffle_32x128E,796.78,1802.84,0.0
256,128,8192,4096,21,0,9.9528,_ZN5aiter41f4gemm_bf16_per1x32Fp4_BpreShuffle_32x128E,863.07,1922.73,0.0
256,128,8192,7168,21,0,17.5883,_ZN5aiter41f4gemm_bf16_per1x32Fp4_BpreShuffle_32x128E,854.68,1814.62,0.0
256,128,8192,8192,21,0,15.5661,_ZN5aiter41f4gemm_bf16_per1x32Fp4_BpreShuffle_32x128E,1103.67,2324.02,0.0
256,128,8192,28672,21,0,48.4668,_ZN5aiter41f4gemm_bf16_per1x32Fp4_BpreShuffle_32x128E,1240.63,2504.24,0.0
256,128,9216,16384,29,0,33.3105,_ZN5aiter41f4gemm_bf16_per1x32Fp4_BpreShuffle_64x128E,1160.44,2368.78,0.0
256,128,10240,8192,29,0,18.6592,_ZN5aiter41f4gemm_bf16_per1x32Fp4_BpreShuffle_64x128E,1150.9,2416.44,0.0
256,128,12288,512,29,0,5.1498,_ZN5aiter41f4gemm_bf16_per1x32Fp4_BpreShuffle_64x128E,312.75,1228.05,0.0
256,128,12288,1536,37,0,6.7742,_ZN5aiter41f4gemm_bf16_per1x32Fp4_BpreShuffle_96x128E,713.27,1871.99,0.0
256,128,12288,4096,29,0,11.2189,_ZN5aiter41f4gemm_bf16_per1x32Fp4_BpreShuffle_64x128E,1148.5,2546.92,0.0
256,128,12288,6144,29,0,15.5916,_ZN5aiter41f4gemm_bf16_per1x32Fp4_BpreShuffle_64x128E,1239.6,2648.07,0.0
256,128,12800,5120,0,0,18.1526,a4w4_blockscale_256x64x128x128_16x16_16x16_8x32x1_8x32x1_1x32x1x8_8_2x2_intrawave_v3,924.23,2003.71,0.0
256,128,13312,16384,29,0,38.1269,_ZN5aiter41f4gemm_bf16_per1x32Fp4_BpreShuffle_64x128E,1464.44,2977.12,0.0
256,128,14336,8192,29,0,21.2529,_ZN5aiter41f4gemm_bf16_per1x32Fp4_BpreShuffle_64x128E,1414.62,2960.28,0.0
256,128,16384,512,29,0,5.3611,_ZN5aiter41f4gemm_bf16_per1x32Fp4_BpreShuffle_64x128E,400.57,1570.83,0.0
256,128,16384,2048,29,0,7.8866,_ZN5aiter41f4gemm_bf16_per1x32Fp4_BpreShuffle_64x128E,1089.18,2675.75,0.0
256,128,16384,4096,37,0,16.0283,_ZN5aiter41f4gemm_bf16_per1x32Fp4_BpreShuffle_96x128E,1071.85,2371.49,0.0
256,128,16384,6656,37,0,19.9661,_ZN5aiter41f4gemm_bf16_per1x32Fp4_BpreShuffle_96x128E,1398.23,2962.33,0.0
256,128,16384,8192,29,0,22.9523,_ZN5aiter41f4gemm_bf16_per1x32Fp4_BpreShuffle_64x128E,1497.01,3129.42,0.0
256,128,16384,13312,29,0,36.5127,_ZN5aiter41f4gemm_bf16_per1x32Fp4_BpreShuffle_64x128E,1529.18,3124.89,0.0
256,128,16384,16384,29,0,38.2318,_ZN5aiter41f4gemm_bf16_per1x32Fp4_BpreShuffle_64x128E,1797.44,3647.76,0.0
256,128,16384,26624,29,0,62.8972,_ZN5aiter41f4gemm_bf16_per1x32Fp4_BpreShuffle_64x128E,1775.42,3561.4,0.0
256,128,16384,53248,29,0,112.9144,_ZN5aiter41f4gemm_bf16_per1x32Fp4_BpreShuffle_64x128E,1977.94,3930.5,0.0
256,128,18432,7168,42,0,24.7415,_ZN5aiter42f4gemm_bf16_per1x32Fp4_BpreShuffle_128x128E,1367.05,2879.28,0.0
256,128,18432,16384,22,0,67.9262,_ZN5aiter42f4gemm_bf16_per1x32Fp4_BpreShuffle_192x256E,1138.14,2307.83,0.0
256,128,20480,16384,42,0,49.9568,_ZN5aiter42f4gemm_bf16_per1x32Fp4_BpreShuffle_128x128E,1719.47,3484.28,0.0
256,128,24576,1536,8,0,9.4678,a4w4_blockscale_256x128x128x128_16x16_16x16_8x32x1_8x32x1_1x32x1x8_8_2x2_intrawave_v3,1020.69,2668.43,0.0
256,128,26624,16384,42,0,55.1181,_ZN5aiter42f4gemm_bf16_per1x32Fp4_BpreShuffle_128x128E,2026.0,4099.71,0.0
256,128,28672,4096,0,0,18.1925,a4w4_blockscale_256x64x128x128_16x16_16x16_8x32x1_8x32x1_1x32x1x8_8_2x2_intrawave_v3,1652.59,3645.59,0.0
256,128,32768,512,42,0,7.0236,_ZN5aiter42f4gemm_bf16_per1x32Fp4_BpreShuffle_128x128E,611.51,2393.36,0.0
256,128,51200,5120,9,0,35.8651,a4w4_blockscale_256x128x256x128_16x16_16x16_8x32x1_8x32x1_1x32x1x8_8_2x2_intrawave_v3,1871.15,4029.18,0.0
256,128,53248,16384,9,0,98.9807,a4w4_blockscale_256x128x256x128_16x16_16x16_8x32x1_8x32x1_1x32x1x8_8_2x2_intrawave_v3,2256.38,4555.31,0.0
256,128,57344,8192,9,0,52.3976,a4w4_blockscale_256x128x256x128_16x16_16x16_8x32x1_8x32x1_1x32x1x8_8_2x2_intrawave_v3,2295.13,4772.84,0.0
256,128,59136,8192,9,0,54.1038,a4w4_blockscale_256x128x256x128_16x16_16x16_8x32x1_8x32x1_1x32x1x8_8_2x2_intrawave_v3,2292.21,4766.47,0.0
256,128,106496,16384,11,0,157.4506,a4w4_blockscale_256x128x512x128_16x16_16x16_8x32x1_8x32x1_1x32x1x8_8_2x2_intrawave_v3,2836.93,5720.69,0.0
256,129,1280,8192,0,0,24.2013,a4w4_blockscale_256x64x128x128_16x16_16x16_8x32x1_8x32x1_1x32x1x8_8_2x2_intrawave_v3,111.78,252.11,0.0
256,160,1280,8192,21,0,16.0131,_ZN5aiter41f4gemm_bf16_per1x32Fp4_BpreShuffle_32x128E,209.54,393.92,0.0
256,160,2304,16384,21,0,26.1975,_ZN5aiter41f4gemm_bf16_per1x32Fp4_BpreShuffle_32x128E,461.1,798.64,0.0
256,160,2560,8192,21,0,16.6775,_ZN5aiter41f4gemm_bf16_per1x32Fp4_BpreShuffle_32x128E,402.39,717.15,0.0
256,160,4608,16384,21,0,26.4423,_ZN5aiter41f4gemm_bf16_per1x32Fp4_BpreShuffle_32x128E,913.66,1532.92,0.0
256,160,5120,1280,21,0,6.7723,_ZN5aiter41f4gemm_bf16_per1x32Fp4_BpreShuffle_32x128E,309.67,740.9,0.0
256,160,5120,5120,21,0,14.1087,_ZN5aiter41f4gemm_bf16_per1x32Fp4_BpreShuffle_32x128E,594.57,1074.17,0.0
256,160,5120,6400,21,0,16.2285,_ZN5aiter41f4gemm_bf16_per1x32Fp4_BpreShuffle_32x128E,646.13,1142.09,0.0
256,160,5120,25600,21,0,39.9134,_ZN5aiter41f4gemm_bf16_per1x32Fp4_BpreShuffle_32x128E,1050.85,1734.31,0.0
256,160,6400,5120,21,0,15.0264,_ZN5aiter41f4gemm_bf16_per1x32Fp4_BpreShuffle_32x128E,697.82,1253.9,0.0
256,160,7168,8192,29,0,18.6767,_ZN5aiter41f4gemm_bf16_per1x32Fp4_BpreShuffle_64x128E,1006.09,1729.92,0.0
256,160,8192,1024,29,0,6.5603,_ZN5aiter41f4gemm_bf16_per1x32Fp4_BpreShuffle_64x128E,409.18,1051.43,0.0
256,160,8192,2048,29,0,7.7321,_ZN5aiter41f4gemm_bf16_per1x32Fp4_BpreShuffle_64x128E,694.34,1445.13,0.0
256,160,8192,3584,29,0,13.3701,_ZN5aiter41f4gemm_bf16_per1x32Fp4_BpreShuffle_64x128E,702.71,1315.49,0.0
256,160,8192,7168,37,0,19.1789,_ZN5aiter41f4gemm_bf16_per1x32Fp4_BpreShuffle_96x128E,979.75,1697.44,0.0
256,160,8192,8192,29,0,17.5633,_ZN5aiter41f4gemm_bf16_per1x32Fp4_BpreShuffle_64x128E,1222.71,2097.06,0.0
256,160,8192,28672,29,0,54.6667,_ZN5aiter41f4gemm_bf16_per1x32Fp4_BpreShuffle_64x128E,1374.91,2238.21,0.0
256,160,9216,16384,29,0,31.4915,_ZN5aiter41f4gemm_bf16_per1x32Fp4_BpreShuffle_64x128E,1534.33,2532.66,0.0
256,160,10240,8192,29,0,19.5071,_ZN5aiter41f4gemm_bf16_per1x32Fp4_BpreShuffle_64x128E,1376.09,2351.72,0.0
256,160,12800,5120,37,0,17.8875,_ZN5aiter41f4gemm_bf16_per1x32Fp4_BpreShuffle_96x128E,1172.41,2083.78,0.0
256,160,13312,16384,37,0,39.7609,_ZN5aiter41f4gemm_bf16_per1x32Fp4_BpreShuffle_96x128E,1755.32,2882.79,0.0
256,160,14336,8192,37,0,22.5625,_ZN5aiter41f4gemm_bf16_per1x32Fp4_BpreShuffle_96x128E,1665.64,2834.93,0.0
256,160,16384,2048,37,0,9.3976,_ZN5aiter41f4gemm_bf16_per1x32Fp4_BpreShuffle_96x128E,1142.57,2360.6,0.0
256,160,16384,4096,42,0,18.124,_ZN5aiter42f4gemm_bf16_per1x32Fp4_BpreShuffle_128x128E,1184.88,2158.74,0.0
256,160,16384,6656,37,0,21.2181,_ZN5aiter41f4gemm_bf16_per1x32Fp4_BpreShuffle_96x128E,1644.66,2841.98,0.0
256,160,16384,8192,37,0,25.055,_ZN5aiter41f4gemm_bf16_per1x32Fp4_BpreShuffle_96x128E,1714.22,2913.87,0.0
256,160,16384,13312,37,0,36.0049,_ZN5aiter41f4gemm_bf16_per1x32Fp4_BpreShuffle_96x128E,1938.44,3204.0,0.0
256,160,16384,26624,37,0,67.3608,_ZN5aiter41f4gemm_bf16_per1x32Fp4_BpreShuffle_96x128E,2072.22,3347.3,0.0
256,160,26624,16384,46,0,60.9834,_ZN5aiter42f4gemm_bf16_per1x32Fp4_BpreShuffle_160x128E,2288.93,3737.64,0.0
256,160,51200,5120,47,0,42.9748,_ZN5aiter42f4gemm_bf16_per1x32Fp4_BpreShuffle_160x256E,1951.98,3440.75,0.0
256,160,53248,16384,47,0,102.4961,_ZN5aiter42f4gemm_bf16_per1x32Fp4_BpreShuffle_160x256E,2723.74,4434.88,0.0
256,160,57344,8192,50,0,60.9337,_ZN5aiter42f4gemm_bf16_per1x32Fp4_BpreShuffle_192x256E,2467.01,4166.6,0.0
256,192,1280,8192,21,0,15.967,_ZN5aiter41f4gemm_bf16_per1x32Fp4_BpreShuffle_32x128E,252.18,408.39,0.0
256,192,2304,16384,21,0,26.2998,_ZN5aiter41f4gemm_bf16_per1x32Fp4_BpreShuffle_32x128E,551.16,811.11,0.0
256,192,2560,8192,21,0,16.9291,_ZN5aiter41f4gemm_bf16_per1x32Fp4_BpreShuffle_32x128E,475.69,723.92,0.0
256,192,4608,16384,21,0,26.5132,_ZN5aiter41f4gemm_bf16_per1x32Fp4_BpreShuffle_32x128E,1093.46,1549.83,0.0
256,192,5120,1280,21,0,6.3153,_ZN5aiter41f4gemm_bf16_per1x32Fp4_BpreShuffle_32x128E,398.49,849.64,0.0
256,192,5120,5120,21,0,14.2691,_ZN5aiter41f4gemm_bf16_per1x32Fp4_BpreShuffle_32x128E,705.46,1090.8,0.0
256,192,5120,6400,21,0,17.0747,_ZN5aiter41f4gemm_bf16_per1x32Fp4_BpreShuffle_32x128E,736.93,1110.68,0.0
256,192,5120,25600,21,0,39.9244,_ZN5aiter41f4gemm_bf16_per1x32Fp4_BpreShuffle_32x128E,1260.67,1752.3,0.0
256,192,6400,5120,29,0,17.6335,_ZN5aiter41f4gemm_bf16_per1x32Fp4_BpreShuffle_64x128E,713.58,1096.39,0.0
256,192,7168,8192,29,0,18.7241,_ZN5aiter41f4gemm_bf16_per1x32Fp4_BpreShuffle_64x128E,1204.25,1757.04,0.0
256,192,8192,1024,29,0,6.5502,_ZN5aiter41f4gemm_bf16_per1x32Fp4_BpreShuffle_64x128E,491.78,1135.59,0.0
256,192,8192,2048,29,0,8.5152,_ZN5aiter41f4gemm_bf16_per1x32Fp4_BpreShuffle_64x128E,756.58,1377.65,0.0
256,192,8192,3584,29,0,12.1015,_ZN5aiter41f4gemm_bf16_per1x32Fp4_BpreShuffle_64x128E,931.64,1501.45,0.0
256,192,8192,7168,29,0,18.3343,_ZN5aiter41f4gemm_bf16_per1x32Fp4_BpreShuffle_64x128E,1229.86,1810.49,0.0
256,192,8192,8192,29,0,18.9505,_ZN5aiter41f4gemm_bf16_per1x32Fp4_BpreShuffle_64x128E,1359.85,1978.13,0.0
256,192,8192,28672,29,0,56.8402,_ZN5aiter41f4gemm_bf16_per1x32Fp4_BpreShuffle_64x128E,1586.8,2169.92,0.0
256,192,9216,16384,29,0,33.7474,_ZN5aiter41f4gemm_bf16_per1x32Fp4_BpreShuffle_64x128E,1718.12,2388.61,0.0
256,192,10240,8192,29,0,19.2596,_ZN5aiter41f4gemm_bf16_per1x32Fp4_BpreShuffle_64x128E,1672.53,2422.77,0.0
256,192,12800,5120,37,0,18.4327,_ZN5aiter41f4gemm_bf16_per1x32Fp4_BpreShuffle_96x128E,1365.28,2071.03,0.0
256,192,13312,16384,37,0,41.6901,_ZN5aiter41f4gemm_bf16_per1x32Fp4_BpreShuffle_96x128E,2008.91,2776.12,0.0
256,192,14336,8192,37,0,23.7812,_ZN5aiter41f4gemm_bf16_per1x32Fp4_BpreShuffle_96x128E,1896.34,2733.74,0.0
256,192,16384,2048,37,0,11.3951,_ZN5aiter41f4gemm_bf16_per1x32Fp4_BpreShuffle_96x128E,1130.74,2041.69,0.0
256,192,16384,4096,46,0,18.5424,_ZN5aiter42f4gemm_bf16_per1x32Fp4_BpreShuffle_160x128E,1389.78,2170.11,0.0
256,192,16384,6656,37,0,21.9033,_ZN5aiter41f4gemm_bf16_per1x32Fp4_BpreShuffle_96x128E,1911.85,2805.8,0.0
256,192,16384,8192,37,0,25.9592,_ZN5aiter41f4gemm_bf16_per1x32Fp4_BpreShuffle_96x128E,1985.41,2857.82,0.0
256,192,16384,13312,37,0,38.9353,_ZN5aiter41f4gemm_bf16_per1x32Fp4_BpreShuffle_96x128E,2151.05,2995.26,0.0
256,192,16384,26624,37,0,69.5808,_ZN5aiter41f4gemm_bf16_per1x32Fp4_BpreShuffle_96x128E,2407.33,3261.69,0.0
256,192,26624,16384,49,0,66.9827,_ZN5aiter42f4gemm_bf16_per1x32Fp4_BpreShuffle_192x128E,2500.7,3432.23,0.0
256,192,51200,5120,54,0,46.5597,_ZN5aiter42f4gemm_bf16_per1x32Fp4_BpreShuffle_256x256E,2162.03,3247.97,0.0
256,192,53248,16384,50,0,112.2081,_ZN5aiter42f4gemm_bf16_per1x32Fp4_BpreShuffle_192x256E,2985.59,4083.73,0.0
256,192,57344,8192,50,0,63.3964,_ZN5aiter42f4gemm_bf16_per1x32Fp4_BpreShuffle_192x256E,2845.41,4064.7,0.0
256,256,512,4096,21,0,6.343,_ZN5aiter41f4gemm_bf16_per1x32Fp4_BpreShuffle_32x128E,169.28,289.3,0.0
256,256,512,7168,0,0,22.6525,a4w4_blockscale_256x64x128x128_16x16_16x16_8x32x1_8x32x1_1x32x1x8_8_2x2_intrawave_v3,82.95,133.08,0.0
256,256,800,5120,22,0,36.8477,_ZN5aiter42f4gemm_bf16_per1x32Fp4_BpreShuffle_192x256E,56.91,84.48,0.0
256,256,1024,3072,21,0,6.8291,_ZN5aiter41f4gemm_bf16_per1x32Fp4_BpreShuffle_32x128E,235.85,364.67,0.0
256,256,1024,4096,21,0,9.0711,_ZN5aiter41f4gemm_bf16_per1x32Fp4_BpreShuffle_32x128E,236.74,346.79,0.0
256,256,1280,8192,21,0,16.2987,_ZN5aiter41f4gemm_bf16_per1x32Fp4_BpreShuffle_32x128E,329.39,426.22,0.0
256,256,1536,3072,21,0,6.9951,_ZN5aiter41f4gemm_bf16_per1x32Fp4_BpreShuffle_32x128E,345.37,505.92,0.0
256,256,1536,7168,21,0,12.9576,_ZN5aiter41f4gemm_bf16_per1x32Fp4_BpreShuffle_32x128E,435.05,556.35,0.0
256,256,2048,6144,21,0,11.5572,_ZN5aiter41f4gemm_bf16_per1x32Fp4_BpreShuffle_32x128E,557.44,703.15,0.0
256,256,2048,7168,21,0,13.2113,_ZN5aiter41f4gemm_bf16_per1x32Fp4_BpreShuffle_32x128E,568.92,704.41,0.0
256,256,2048,8192,21,0,13.9675,_ZN5aiter41f4gemm_bf16_per1x32Fp4_BpreShuffle_32x128E,614.99,750.73,0.0
256,256,2304,16384,21,0,26.2627,_ZN5aiter41f4gemm_bf16_per1x32Fp4_BpreShuffle_32x128E,735.92,843.45,0.0
256,256,2560,8192,21,0,16.8359,_ZN5aiter41f4gemm_bf16_per1x32Fp4_BpreShuffle_32x128E,637.77,762.96,0.0
256,256,3072,1536,21,0,6.1771,_ZN5aiter41f4gemm_bf16_per1x32Fp4_BpreShuffle_32x128E,391.11,668.4,0.0
256,256,3072,6144,21,0,11.1632,_ZN5aiter41f4gemm_bf16_per1x32Fp4_BpreShuffle_32x128E,865.67,1056.73,0.0
256,256,4096,1024,21,0,5.5715,_ZN5aiter41f4gemm_bf16_per1x32Fp4_BpreShuffle_32x128E,385.44,776.34,0.0
256,256,4096,4096,21,0,10.1458,_ZN5aiter41f4gemm_bf16_per1x32Fp4_BpreShuffle_32x128E,846.65,1085.18,0.0
256,256,4096,8192,21,0,13.9413,_ZN5aiter41f4gemm_bf16_per1x32Fp4_BpreShuffle_32x128E,1232.3,1429.06,0.0
256,256,4096,14336,21,0,23.1245,_ZN5aiter41f4gemm_bf16_per1x32Fp4_BpreShuffle_32x128E,1300.13,1439.7,0.0
256,256,4608,7168,0,0,23.7653,a4w4_blockscale_256x64x128x128_16x16_16x16_8x32x1_8x32x1_1x32x1x8_8_2x2_intrawave_v3,711.6,832.81,0.0
256,256,4608,16384,29,0,30.6036,_ZN5aiter41f4gemm_bf16_per1x32Fp4_BpreShuffle_64x128E,1263.08,1379.09,0.0
256,256,5120,1280,29,0,6.8795,_ZN5aiter41f4gemm_bf16_per1x32Fp4_BpreShuffle_64x128E,487.75,881.18,0.0
256,256,5120,5120,29,0,15.988,_ZN5aiter41f4gemm_bf16_per1x32Fp4_BpreShuffle_64x128E,839.49,1024.77,0.0
256,256,5120,6400,29,0,14.7318,_ZN5aiter41f4gemm_bf16_per1x32Fp4_BpreShuffle_64x128E,1138.84,1345.7,0.0
256,256,5120,25600,29,0,47.1285,_ZN5aiter41f4gemm_bf16_per1x32Fp4_BpreShuffle_64x128E,1423.96,1515.73,0.0
256,256,6144,2048,29,0,7.1546,_ZN5aiter41f4gemm_bf16_per1x32Fp4_BpreShuffle_64x128E,900.46,1355.68,0.0
256,256,6144,3072,37,0,9.9868,_ZN5aiter41f4gemm_bf16_per1x32Fp4_BpreShuffle_96x128E,967.64,1299.33,0.0
256,256,6144,4096,29,0,10.2418,_ZN5aiter41f4gemm_bf16_per1x32Fp4_BpreShuffle_64x128E,1258.07,1586.92,0.0
256,256,6144,12288,29,0,24.2139,_ZN5aiter41f4gemm_bf16_per1x32Fp4_BpreShuffle_64x128E,1596.38,1753.84,0.0
256,256,6144,16384,29,0,31.4059,_ZN5aiter41f4gemm_bf16_per1x32Fp4_BpreShuffle_64x128E,1641.08,1769.56,0.0
256,256,6400,5120,29,0,17.2608,_ZN5aiter41f4gemm_bf16_per1x32Fp4_BpreShuffle_64x128E,971.98,1177.01,0.0
256,256,7168,2048,29,0,7.8351,_ZN5aiter41f4gemm_bf16_per1x32Fp4_BpreShuffle_64x128E,959.3,1438.68,0.0
256,256,7168,2304,0,0,10.6915,a4w4_blockscale_256x64x128x128_16x16_16x16_8x32x1_8x32x1_1x32x1x8_8_2x2_intrawave_v3,790.88,1143.19,0.0
256,256,7168,8192,29,0,17.9205,_ZN5aiter41f4gemm_bf16_per1x32Fp4_BpreShuffle_64x128E,1677.67,1901.66,0.0
256,256,7168,16384,29,0,32.5458,_ZN5aiter41f4gemm_bf16_per1x32Fp4_BpreShuffle_64x128E,1847.54,1981.44,0.0
256,256,7168,18432,29,0,36.2989,_ZN5aiter41f4gemm_bf16_per1x32Fp4_BpreShuffle_64x128E,1863.58,1986.0,0.0
256,256,8192,1024,29,0,6.5497,_ZN5aiter41f4gemm_bf16_per1x32Fp4_BpreShuffle_64x128E,655.75,1300.77,0.0
256,256,8192,2048,29,0,8.1011,_ZN5aiter41f4gemm_bf16_per1x32Fp4_BpreShuffle_64x128E,1060.34,1585.59,0.0
256,256,8192,3584,29,0,14.0739,_ZN5aiter41f4gemm_bf16_per1x32Fp4_BpreShuffle_64x128E,1068.1,1373.69,0.0
256,256,8192,4096,29,0,10.3885,_ZN5aiter41f4gemm_bf16_per1x32Fp4_BpreShuffle_64x128E,1653.74,2069.19,0.0
256,256,8192,7168,29,0,18.8783,_ZN5aiter41f4gemm_bf16_per1x32Fp4_BpreShuffle_64x128E,1592.56,1826.01,0.0
256,256,8192,8192,29,0,18.4185,_ZN5aiter41f4gemm_bf16_per1x32Fp4_BpreShuffle_64x128E,1865.5,2106.43,0.0
256,256,8192,28672,29,0,58.3537,_ZN5aiter41f4gemm_bf16_per1x32Fp4_BpreShuffle_64x128E,2060.86,2147.33,0.0
256,256,9216,16384,37,0,36.7985,_ZN5aiter41f4gemm_bf16_per1x32Fp4_BpreShuffle_96x128E,2100.88,2236.86,0.0
256,256,10240,8192,37,0,21.2222,_ZN5aiter41f4gemm_bf16_per1x32Fp4_BpreShuffle_96x128E,2023.81,2272.83,0.0
256,256,12288,512,38,0,6.3583,_ZN5aiter41f4gemm_bf16_per1x32Fp4_BpreShuffle_96x256E,506.62,1494.54,0.0
256,256,12288,1536,1,0,9.8009,a4w4_blockscale_256x64x256x128_16x16_16x16_8x32x1_8x32x1_1x32x1x8_8_2x2_intrawave_v3,986.0,1624.88,0.0
256,256,12288,4096,42,0,14.5442,_ZN5aiter42f4gemm_bf16_per1x32Fp4_BpreShuffle_128x128E,1771.83,2198.92,0.0
256,256,12288,6144,42,0,20.0605,_ZN5aiter42f4gemm_bf16_per1x32Fp4_BpreShuffle_128x128E,1926.91,2234.57,0.0
256,256,12800,5120,42,0,18.789,_ZN5aiter42f4gemm_bf16_per1x32Fp4_BpreShuffle_128x128E,1785.86,2127.68,0.0
256,256,13312,16384,42,0,46.7414,_ZN5aiter42f4gemm_bf16_per1x32Fp4_BpreShuffle_128x128E,2389.08,2523.78,0.0
256,256,14336,8192,42,0,26.5916,_ZN5aiter42f4gemm_bf16_per1x32Fp4_BpreShuffle_128x128E,2261.22,2523.69,0.0
256,256,16384,512,30,0,6.8027,_ZN5aiter41f4gemm_bf16_per1x32Fp4_BpreShuffle_64x256E,631.36,1859.33,0.0
256,256,16384,2048,42,0,10.4519,_ZN5aiter42f4gemm_bf16_per1x32Fp4_BpreShuffle_128x128E,1643.71,2432.86,0.0
256,256,16384,4096,38,0,19.0289,_ZN5aiter41f4gemm_bf16_per1x32Fp4_BpreShuffle_96x256E,1805.66,2231.73,0.0
256,256,16384,6656,42,0,24.1571,_ZN5aiter42f4gemm_bf16_per1x32Fp4_BpreShuffle_128x128E,2311.31,2639.66,0.0
256,256,16384,8192,42,0,28.2495,_ZN5aiter42f4gemm_bf16_per1x32Fp4_BpreShuffle_128x128E,2432.59,2709.64,0.0
256,256,16384,13312,42,0,43.2786,_ZN5aiter42f4gemm_bf16_per1x32Fp4_BpreShuffle_128x128E,2580.24,2752.96,0.0
256,256,16384,16384,42,0,49.8604,_ZN5aiter42f4gemm_bf16_per1x32Fp4_BpreShuffle_128x128E,2756.48,2902.17,0.0
256,256,16384,26624,42,0,78.9684,_ZN5aiter42f4gemm_bf16_per1x32Fp4_BpreShuffle_128x128E,2828.2,2911.29,0.0
256,256,16384,53248,42,0,145.1528,_ZN5aiter42f4gemm_bf16_per1x32Fp4_BpreShuffle_128x128E,3077.29,3109.91,0.0
256,256,18432,7168,38,0,30.4769,_ZN5aiter41f4gemm_bf16_per1x32Fp4_BpreShuffle_96x256E,2219.57,2507.31,0.0
256,256,18432,16384,2,0,97.5677,a4w4_blockscale_256x64x384x128_16x16_16x16_8x32x1_8x32x1_1x32x1x8_8_2x2_intrawave_v3,1584.73,1665.81,0.0
256,256,20480,16384,38,0,62.6988,_ZN5aiter41f4gemm_bf16_per1x32Fp4_BpreShuffle_96x256E,2740.06,2876.53,0.0
256,256,24576,1536,8,0,12.7275,a4w4_blockscale_256x128x128x128_16x16_16x16_8x32x1_8x32x1_1x32x1x8_8_2x2_intrawave_v3,1518.55,2487.05,0.0
256,256,26624,16384,43,0,73.3227,_ZN5aiter42f4gemm_bf16_per1x32Fp4_BpreShuffle_128x256E,3045.96,3189.09,0.0
256,256,28672,4096,43,0,24.4961,_ZN5aiter42f4gemm_bf16_per1x32Fp4_BpreShuffle_128x256E,2454.66,3017.81,0.0
256,256,32768,512,43,0,9.9975,_ZN5aiter42f4gemm_bf16_per1x32Fp4_BpreShuffle_128x256E,859.21,2523.77,0.0
256,256,51200,5120,54,0,50.4785,_ZN5aiter42f4gemm_bf16_per1x32Fp4_BpreShuffle_256x256E,2658.91,3128.89,0.0
256,256,53248,16384,54,0,132.8006,_ZN5aiter42f4gemm_bf16_per1x32Fp4_BpreShuffle_256x256E,3363.51,3505.77,0.0
256,256,57344,8192,18,0,71.2376,a4w4_blockscale_256x256x256x128_16x16_16x16_8x32x1_8x32x1_1x8x1x32_8_2x4_intrawave_v3,3376.28,3724.01,0.0
256,256,59136,8192,18,0,74.1445,a4w4_blockscale_256x256x256x128_16x16_16x16_8x32x1_8x32x1_1x8x1x32_8_2x4_intrawave_v3,3345.28,3689.38,0.0
256,256,106496,16384,18,0,249.1001,a4w4_blockscale_256x256x256x128_16x16_16x16_8x32x1_8x32x1_1x8x1x32_8_2x4_intrawave_v3,3586.32,3729.58,0.0
256,288,1280,8192,21,0,16.4719,_ZN5aiter41f4gemm_bf16_per1x32Fp4_BpreShuffle_32x128E,366.67,434.67,0.0
256,288,2304,16384,21,0,26.1796,_ZN5aiter41f4gemm_bf16_per1x32Fp4_BpreShuffle_32x128E,830.54,861.77,0.0
256,288,2560,8192,21,0,14.3768,_ZN5aiter41f4gemm_bf16_per1x32Fp4_BpreShuffle_32x128E,840.21,913.97,0.0
256,288,4608,16384,29,0,29.1664,_ZN5aiter41f4gemm_bf16_per1x32Fp4_BpreShuffle_64x128E,1490.98,1466.15,0.0
256,288,5120,1280,29,0,7.3211,_ZN5aiter41f4gemm_bf16_per1x32Fp4_BpreShuffle_64x128E,515.62,875.58,0.0
256,288,5120,5120,29,0,13.8399,_ZN5aiter41f4gemm_bf16_per1x32Fp4_BpreShuffle_64x128E,1091.01,1213.42,0.0
256,288,5120,6400,42,0,18.5633,_ZN5aiter42f4gemm_bf16_per1x32Fp4_BpreShuffle_128x128E,1016.76,1091.12,0.0
256,288,5120,25600,29,0,44.3246,_ZN5aiter41f4gemm_bf16_per1x32Fp4_BpreShuffle_64x128E,1703.29,1628.25,0.0
256,288,6400,5120,29,0,16.8247,_ZN5aiter41f4gemm_bf16_per1x32Fp4_BpreShuffle_64x128E,1121.82,1236.73,0.0
256,288,7168,8192,37,0,21.1725,_ZN5aiter41f4gemm_bf16_per1x32Fp4_BpreShuffle_96x128E,1597.49,1637.43,0.0
256,288,8192,1024,37,0,7.5191,_ZN5aiter41f4gemm_bf16_per1x32Fp4_BpreShuffle_96x128E,642.61,1204.98,0.0
256,288,8192,2048,42,0,10.6831,_ZN5aiter42f4gemm_bf16_per1x32Fp4_BpreShuffle_128x128E,904.58,1254.52,0.0
256,288,8192,3584,42,0,14.8917,_ZN5aiter42f4gemm_bf16_per1x32Fp4_BpreShuffle_128x128E,1135.63,1337.31,0.0
256,288,8192,7168,37,0,19.5302,_ZN5aiter41f4gemm_bf16_per1x32Fp4_BpreShuffle_96x128E,1731.82,1797.78,0.0
256,288,8192,8192,37,0,21.6423,_ZN5aiter41f4gemm_bf16_per1x32Fp4_BpreShuffle_96x128E,1786.07,1822.94,0.0
256,288,8192,28672,37,0,66.796,_ZN5aiter41f4gemm_bf16_per1x32Fp4_BpreShuffle_96x128E,2025.44,1890.65,0.0
256,288,9216,16384,37,0,39.9597,_ZN5aiter41f4gemm_bf16_per1x32Fp4_BpreShuffle_96x128E,2176.52,2081.23,0.0
256,288,10240,8192,37,0,22.4527,_ZN5aiter41f4gemm_bf16_per1x32Fp4_BpreShuffle_96x128E,2152.01,2183.3,0.0
256,288,12800,5120,46,0,20.6536,_ZN5aiter42f4gemm_bf16_per1x32Fp4_BpreShuffle_160x128E,1827.71,1979.22,0.0
256,288,13312,16384,46,0,50.3598,_ZN5aiter42f4gemm_bf16_per1x32Fp4_BpreShuffle_160x128E,2494.6,2364.56,0.0
256,288,14336,8192,46,0,28.4269,_ZN5aiter42f4gemm_bf16_per1x32Fp4_BpreShuffle_160x128E,2379.64,2397.64,0.0
256,288,16384,2048,46,0,14.2595,_ZN5aiter42f4gemm_bf16_per1x32Fp4_BpreShuffle_160x128E,1355.4,1859.06,0.0
256,288,16384,4096,46,0,18.264,_ZN5aiter42f4gemm_bf16_per1x32Fp4_BpreShuffle_160x128E,2116.44,2386.19,0.0
256,288,16384,6656,46,0,25.5322,_ZN5aiter42f4gemm_bf16_per1x32Fp4_BpreShuffle_160x128E,2460.18,2542.73,0.0
256,288,16384,8192,46,0,30.4004,_ZN5aiter42f4gemm_bf16_per1x32Fp4_BpreShuffle_160x128E,2543.04,2556.73,0.0
256,288,16384,13312,46,0,45.1824,_ZN5aiter42f4gemm_bf16_per1x32Fp4_BpreShuffle_160x128E,2780.46,2664.89,0.0
256,288,16384,26624,46,0,83.936,_ZN5aiter42f4gemm_bf16_per1x32Fp4_BpreShuffle_160x128E,2993.42,2756.56,0.0
256,288,26624,16384,47,0,77.0326,_ZN5aiter42f4gemm_bf16_per1x32Fp4_BpreShuffle_160x256E,3261.68,3061.02,0.0
256,288,51200,5120,41,0,54.2684,_ZN5aiter41f4gemm_bf16_per1x32Fp4_BpreShuffle_96x640E,2782.37,2972.27,0.0
256,288,53248,16384,41,0,147.3597,_ZN5aiter41f4gemm_bf16_per1x32Fp4_BpreShuffle_96x640E,3410.1,3184.3,0.0
256,288,57344,8192,47,0,87.9704,_ZN5aiter42f4gemm_bf16_per1x32Fp4_BpreShuffle_160x256E,3075.84,3058.88,0.0
256,320,2560,8192,21,0,16.4166,_ZN5aiter41f4gemm_bf16_per1x32Fp4_BpreShuffle_32x128E,817.57,818.37,0.0
256,320,5120,1280,29,0,7.4259,_ZN5aiter41f4gemm_bf16_per1x32Fp4_BpreShuffle_64x128E,564.82,910.11,0.0
256,320,5120,5120,22,0,16.5703,_ZN5aiter41f4gemm_bf16_per1x32Fp4_BpreShuffle_32x256E,1012.49,1038.19,0.0
256,320,5120,6400,29,0,18.0264,_ZN5aiter41f4gemm_bf16_per1x32Fp4_BpreShuffle_64x128E,1163.38,1147.47,0.0
256,320,5120,25600,29,0,47.2784,_ZN5aiter41f4gemm_bf16_per1x32Fp4_BpreShuffle_64x128E,1774.3,1542.12,0.0
256,320,6400,5120,29,0,16.745,_ZN5aiter41f4gemm_bf16_per1x32Fp4_BpreShuffle_64x128E,1252.4,1271.97,0.0
256,320,7168,8192,37,0,20.6963,_ZN5aiter41f4gemm_bf16_per1x32Fp4_BpreShuffle_96x128E,1815.83,1703.61,0.0
256,320,8192,1024,37,0,7.6808,_ZN5aiter41f4gemm_bf16_per1x32Fp4_BpreShuffle_96x128E,698.98,1250.0,0.0
256,320,8192,2048,37,0,8.971,_ZN5aiter41f4gemm_bf16_per1x32Fp4_BpreShuffle_96x128E,1196.9,1556.03,0.0
256,320,8192,3584,37,0,14.0025,_ZN5aiter41f4gemm_bf16_per1x32Fp4_BpreShuffle_96x128E,1341.94,1463.77,0.0
256,320,8192,7168,37,0,19.5769,_ZN5aiter41f4gemm_bf16_per1x32Fp4_BpreShuffle_96x128E,1919.66,1826.13,0.0
256,320,8192,8192,37,0,21.16,_ZN5aiter41f4gemm_bf16_per1x32Fp4_BpreShuffle_96x128E,2029.76,1895.46,0.0
256,320,8192,28672,37,0,70.3383,_ZN5aiter41f4gemm_bf16_per1x32Fp4_BpreShuffle_96x128E,2137.16,1809.41,0.0
256,320,10240,8192,42,0,24.4175,_ZN5aiter42f4gemm_bf16_per1x32Fp4_BpreShuffle_128x128E,2198.71,2039.82,0.0
256,320,14336,8192,46,0,30.445,_ZN5aiter42f4gemm_bf16_per1x32Fp4_BpreShuffle_160x128E,2468.78,2273.15,0.0
256,320,51200,5120,47,0,62.2725,_ZN5aiter42f4gemm_bf16_per1x32Fp4_BpreShuffle_160x256E,2694.16,2644.17,0.0
256,320,57344,8192,47,0,88.7921,_ZN5aiter42f4gemm_bf16_per1x32Fp4_BpreShuffle_160x256E,3385.97,3073.38,0.0
256,384,1280,8192,21,0,16.1226,_ZN5aiter41f4gemm_bf16_per1x32Fp4_BpreShuffle_32x128E,499.49,483.72,0.0
256,384,2304,16384,21,0,26.2829,_ZN5aiter41f4gemm_bf16_per1x32Fp4_BpreShuffle_32x128E,1103.04,905.13,0.0
256,384,2560,8192,21,0,17.85,_ZN5aiter41f4gemm_bf16_per1x32Fp4_BpreShuffle_32x128E,902.3,785.7,0.0
256,384,4608,16384,29,0,31.6982,_ZN5aiter41f4gemm_bf16_per1x32Fp4_BpreShuffle_64x128E,1829.19,1401.76,0.0
256,384,5120,1280,29,0,7.0087,_ZN5aiter41f4gemm_bf16_per1x32Fp4_BpreShuffle_64x128E,718.13,1063.64,0.0
256,384,5120,5120,29,0,17.1449,_ZN5aiter41f4gemm_bf16_per1x32Fp4_BpreShuffle_64x128E,1174.27,1051.18,0.0
256,384,5120,6400,29,0,18.6953,_ZN5aiter41f4gemm_bf16_per1x32Fp4_BpreShuffle_64x128E,1346.1,1152.43,0.0
256,384,5120,25600,29,0,48.0141,_ZN5aiter41f4gemm_bf16_per1x32Fp4_BpreShuffle_64x128E,2096.54,1549.2,0.0
256,384,6400,5120,37,0,18.0754,_ZN5aiter41f4gemm_bf16_per1x32Fp4_BpreShuffle_96x128E,1392.27,1232.74,0.0
256,384,7168,8192,37,0,21.6494,_ZN5aiter41f4gemm_bf16_per1x32Fp4_BpreShuffle_96x128E,2083.07,1683.1,0.0
256,384,8192,1024,37,0,7.5727,_ZN5aiter41f4gemm_bf16_per1x32Fp4_BpreShuffle_96x128E,850.75,1410.64,0.0
256,384,8192,2048,37,0,9.5408,_ZN5aiter41f4gemm_bf16_per1x32Fp4_BpreShuffle_96x128E,1350.51,1579.88,0.0
256,384,8192,3584,46,0,16.2207,_ZN5aiter42f4gemm_bf16_per1x32Fp4_BpreShuffle_160x128E,1390.11,1335.31,0.0
256,384,8192,7168,37,0,19.9731,_ZN5aiter41f4gemm_bf16_per1x32Fp4_BpreShuffle_96x128E,2257.89,1853.89,0.0
256,384,8192,8192,37,0,21.9654,_ZN5aiter41f4gemm_bf16_per1x32Fp4_BpreShuffle_96x128E,2346.4,1885.64,0.0
256,384,8192,28672,37,0,69.2615,_ZN5aiter41f4gemm_bf16_per1x32Fp4_BpreShuffle_96x128E,2604.46,1865.93,0.0
256,384,9216,16384,42,0,44.5812,_ZN5aiter42f4gemm_bf16_per1x32Fp4_BpreShuffle_128x128E,2601.19,1922.81,0.0
256,384,10240,8192,42,0,25.4148,_ZN5aiter42f4gemm_bf16_per1x32Fp4_BpreShuffle_128x128E,2534.92,2021.67,0.0
256,384,12800,5120,38,0,23.8257,_ZN5aiter41f4gemm_bf16_per1x32Fp4_BpreShuffle_96x256E,2112.49,1829.18,0.0
256,384,13312,16384,49,0,57.4449,_ZN5aiter42f4gemm_bf16_per1x32Fp4_BpreShuffle_192x128E,2915.9,2131.11,0.0
256,384,14336,8192,38,0,32.5471,_ZN5aiter41f4gemm_bf16_per1x32Fp4_BpreShuffle_96x256E,2771.19,2190.77,0.0
256,384,16384,2048,49,0,16.6778,_ZN5aiter42f4gemm_bf16_per1x32Fp4_BpreShuffle_192x128E,1545.16,1784.01,0.0
256,384,16384,4096,38,0,20.4734,_ZN5aiter41f4gemm_bf16_per1x32Fp4_BpreShuffle_96x256E,2517.39,2291.94,0.0
256,384,16384,6656,38,0,29.552,_ZN5aiter41f4gemm_bf16_per1x32Fp4_BpreShuffle_96x256E,2834.05,2314.12,0.0
256,384,16384,8192,38,0,34.6005,_ZN5aiter41f4gemm_bf16_per1x32Fp4_BpreShuffle_96x256E,2979.13,2348.66,0.0
256,384,16384,13312,38,0,53.2326,_ZN5aiter41f4gemm_bf16_per1x32Fp4_BpreShuffle_96x256E,3146.64,2332.98,0.0
256,384,16384,26624,49,0,95.913,_ZN5aiter42f4gemm_bf16_per1x32Fp4_BpreShuffle_192x128E,3492.83,2458.46,0.0
256,384,26624,16384,50,0,88.0544,_ZN5aiter42f4gemm_bf16_per1x32Fp4_BpreShuffle_192x256E,3804.55,2744.86,0.0
256,384,51200,5120,54,0,72.5351,_ZN5aiter42f4gemm_bf16_per1x32Fp4_BpreShuffle_256x256E,2775.57,2362.67,0.0
256,384,53248,16384,44,0,191.233,_ZN5aiter42f4gemm_bf16_per1x32Fp4_BpreShuffle_128x384E,3503.66,2511.32,0.0
256,384,57344,8192,10,0,105.5947,a4w4_blockscale_256x128x384x128_16x16_16x16_8x32x1_8x32x1_1x32x1x8_8_2x2_intrawave_v3,3416.62,2656.33,0.0
256,416,1280,8192,21,0,15.9344,_ZN5aiter41f4gemm_bf16_per1x32Fp4_BpreShuffle_32x128E,547.5,502.8,0.0
256,512,512,4096,21,0,7.2567,_ZN5aiter41f4gemm_bf16_per1x32Fp4_BpreShuffle_32x128E,295.93,361.24,0.0
256,512,512,7168,0,0,23.2885,a4w4_blockscale_256x64x128x128_16x16_16x16_8x32x1_8x32x1_1x32x1x8_8_2x2_intrawave_v3,161.37,180.1,0.0
256,512,800,5120,21,0,38.7761,_ZN5aiter42f4gemm_bf16_per1x32Fp4_BpreShuffle_128x512E,108.17,107.74,0.0
256,512,1024,3072,21,0,7.2108,_ZN5aiter41f4gemm_bf16_per1x32Fp4_BpreShuffle_32x128E,446.72,472.61,0.0
256,512,1280,8192,21,0,16.2544,_ZN5aiter41f4gemm_bf16_per1x32Fp4_BpreShuffle_32x128E,660.59,532.21,0.0
256,512,1536,7168,21,0,12.9046,_ZN5aiter41f4gemm_bf16_per1x32Fp4_BpreShuffle_32x128E,873.66,690.68,0.0
256,512,1792,7424,21,0,13.7827,_ZN5aiter41f4gemm_bf16_per1x32Fp4_BpreShuffle_32x128E,988.42,753.66,0.0
256,512,2048,6144,21,0,11.6892,_ZN5aiter41f4gemm_bf16_per1x32Fp4_BpreShuffle_32x128E,1102.29,852.19,0.0
256,512,2304,16384,29,0,30.5848,_ZN5aiter41f4gemm_bf16_per1x32Fp4_BpreShuffle_64x128E,1263.85,831.39,0.0
256,512,2560,8192,29,0,17.993,_ZN5aiter41f4gemm_bf16_per1x32Fp4_BpreShuffle_64x128E,1193.51,845.01,0.0
256,512,3072,1536,0,0,8.7335,a4w4_blockscale_256x64x128x128_16x16_16x16_8x32x1_8x32x1_1x32x1x8_8_2x2_intrawave_v3,553.25,675.36,0.0
256,512,3072,6144,29,0,13.6979,_ZN5aiter41f4gemm_bf16_per1x32Fp4_BpreShuffle_64x128E,1410.97,1033.43,0.0
256,512,4096,4096,29,0,10.0912,_ZN5aiter41f4gemm_bf16_per1x32Fp4_BpreShuffle_64x128E,1702.46,1350.83,0.0
256,512,4096,8192,29,0,16.949,_ZN5aiter41f4gemm_bf16_per1x32Fp4_BpreShuffle_64x128E,2027.24,1361.06,0.0
256,512,4096,14336,29,0,28.388,_ZN5aiter41f4gemm_bf16_per1x32Fp4_BpreShuffle_64x128E,2118.13,1311.27,0.0
256,512,4608,7168,4,0,29.4314,a4w4_blockscale_256x96x128x128_16x16_16x16_8x32x1_8x32x1_1x32x1x8_8_2x2_intrawave_v3,1149.21,783.81,0.0
256,512,4608,16384,37,0,35.2309,_ZN5aiter41f4gemm_bf16_per1x32Fp4_BpreShuffle_96x128E,2194.36,1324.45,0.0
256,512,5120,1280,37,0,8.2567,_ZN5aiter41f4gemm_bf16_per1x32Fp4_BpreShuffle_96x128E,812.78,1071.54,0.0
256,512,5120,5120,37,0,17.3284,_ZN5aiter41f4gemm_bf16_per1x32Fp4_BpreShuffle_96x128E,1549.11,1134.6,0.0
256,512,5120,6400,37,0,18.7412,_ZN5aiter41f4gemm_bf16_per1x32Fp4_BpreShuffle_96x128E,1790.41,1241.4,0.0
256,512,5120,25600,37,0,58.227,_ZN5aiter41f4gemm_bf16_per1x32Fp4_BpreShuffle_96x128E,2305.08,1328.12,0.0
256,512,6144,3072,42,0,12.4658,_ZN5aiter42f4gemm_bf16_per1x32Fp4_BpreShuffle_128x128E,1550.43,1324.83,0.0
256,512,6144,4096,42,0,14.0105,_ZN5aiter42f4gemm_bf16_per1x32Fp4_BpreShuffle_128x128E,1839.32,1422.0,0.0
256,512,6144,12288,42,0,33.2974,_ZN5aiter42f4gemm_bf16_per1x32Fp4_BpreShuffle_128x128E,2321.79,1417.11,0.0
256,512,6144,16384,42,0,42.6302,_ZN5aiter42f4gemm_bf16_per1x32Fp4_BpreShuffle_128x128E,2417.99,1426.63,0.0
256,512,6400,5120,42,0,19.2804,_ZN5aiter42f4gemm_bf16_per1x32Fp4_BpreShuffle_128x128E,1740.34,1257.67,0.0
256,512,7168,2048,1,0,13.0804,a4w4_blockscale_256x64x256x128_16x16_16x16_8x32x1_8x32x1_1x32x1x8_8_2x2_intrawave_v3,1149.23,1162.38,0.0
256,512,7168,2304,8,0,12.9047,a4w4_blockscale_256x128x128x128_16x16_16x16_8x32x1_8x32x1_1x32x1x8_8_2x2_intrawave_v3,1310.49,1254.38,0.0
256,512,7168,8192,42,0,24.4684,_ZN5aiter42f4gemm_bf16_per1x32Fp4_BpreShuffle_128x128E,2457.44,1585.61,0.0
256,512,7168,16384,42,0,43.582,_ZN5aiter42f4gemm_bf16_per1x32Fp4_BpreShuffle_128x128E,2759.38,1612.01,0.0
256,512,7168,18432,42,0,49.9132,_ZN5aiter42f4gemm_bf16_per1x32Fp4_BpreShuffle_128x128E,2710.53,1565.1,0.0
256,512,8192,1024,42,0,9.0616,_ZN5aiter42f4gemm_bf16_per1x32Fp4_BpreShuffle_128x128E,947.95,1417.53,0.0
256,512,8192,2048,46,0,13.7717,_ZN5aiter42f4gemm_bf16_per1x32Fp4_BpreShuffle_160x128E,1247.48,1256.31,0.0
256,512,8192,3584,46,0,16.8791,_ZN5aiter42f4gemm_bf16_per1x32Fp4_BpreShuffle_160x128E,1781.18,1421.06,0.0
256,512,8192,4096,42,0,14.6073,_ZN5aiter42f4gemm_bf16_per1x32Fp4_BpreShuffle_128x128E,2352.23,1794.61,0.0
256,512,8192,7168,42,0,22.9346,_ZN5aiter42f4gemm_bf16_per1x32Fp4_BpreShuffle_128x128E,2621.78,1725.94,0.0
256,512,8192,8192,42,0,25.2603,_ZN5aiter42f4gemm_bf16_per1x32Fp4_BpreShuffle_128x128E,2720.45,1743.45,0.0
256,512,8192,28672,42,0,77.5444,_ZN5aiter42f4gemm_bf16_per1x32Fp4_BpreShuffle_128x128E,3101.68,1717.33,0.0
256,512,9216,16384,49,0,53.7146,_ZN5aiter42f4gemm_bf16_per1x32Fp4_BpreShuffle_192x128E,2878.53,1659.31,0.0
256,512,10240,8192,38,0,30.4085,_ZN5aiter41f4gemm_bf16_per1x32Fp4_BpreShuffle_96x256E,2824.85,1793.12,0.0
256,512,12288,512,43,0,9.5274,_ZN5aiter42f4gemm_bf16_per1x32Fp4_BpreShuffle_128x256E,676.2,1664.64,0.0
256,512,12288,1536,8,0,12.1891,a4w4_blockscale_256x128x128x128_16x16_16x16_8x32x1_8x32x1_1x32x1x8_8_2x2_intrawave_v3,1585.63,1838.8,0.0
256,512,12288,4096,43,0,20.8203,_ZN5aiter42f4gemm_bf16_per1x32Fp4_BpreShuffle_128x256E,2475.45,1863.44,0.0
256,512,12288,6144,43,0,28.591,_ZN5aiter42f4gemm_bf16_per1x32Fp4_BpreShuffle_128x256E,2703.98,1815.41,0.0
256,512,12800,5120,47,0,26.9162,_ZN5aiter42f4gemm_bf16_per1x32Fp4_BpreShuffle_160x256E,2493.25,1753.07,0.0
256,512,13312,16384,43,0,65.6367,_ZN5aiter42f4gemm_bf16_per1x32Fp4_BpreShuffle_128x256E,3402.64,1933.03,0.0
256,512,14336,8192,43,0,38.0196,_ZN5aiter42f4gemm_bf16_per1x32Fp4_BpreShuffle_128x256E,3163.08,1985.75,0.0
256,512,16384,512,53,0,10.2901,_ZN5aiter42f4gemm_bf16_per1x32Fp4_BpreShuffle_256x128E,834.78,2050.77,0.0
256,512,16384,2048,43,0,14.9724,_ZN5aiter42f4gemm_bf16_per1x32Fp4_BpreShuffle_128x256E,2294.87,2276.1,0.0
256,512,16384,4096,43,0,22.894,_ZN5aiter42f4gemm_bf16_per1x32Fp4_BpreShuffle_128x256E,3001.64,2244.27,0.0
256,512,16384,6656,43,0,33.6862,_ZN5aiter42f4gemm_bf16_per1x32Fp4_BpreShuffle_128x256E,3314.98,2167.27,0.0
256,512,16384,8192,43,0,38.1581,_ZN5aiter42f4gemm_bf16_per1x32Fp4_BpreShuffle_128x256E,3601.83,2253.34,0.0
256,512,16384,13312,43,0,58.5844,_ZN5aiter42f4gemm_bf16_per1x32Fp4_BpreShuffle_128x256E,3812.25,2206.0,0.0
256,512,16384,16384,43,0,68.3178,_ZN5aiter42f4gemm_bf16_per1x32Fp4_BpreShuffle_128x256E,4023.52,2271.58,0.0
256,512,16384,26624,43,0,109.2596,_ZN5aiter42f4gemm_bf16_per1x32Fp4_BpreShuffle_128x256E,4088.21,2212.13,0.0
256,512,16384,53248,43,0,204.9689,_ZN5aiter42f4gemm_bf16_per1x32Fp4_BpreShuffle_128x256E,4358.48,2276.52,0.0
256,512,18432,7168,50,0,41.6828,_ZN5aiter42f4gemm_bf16_per1x32Fp4_BpreShuffle_192x256E,3245.74,2081.67,0.0
256,512,20480,16384,50,0,86.5746,_ZN5aiter42f4gemm_bf16_per1x32Fp4_BpreShuffle_192x256E,3968.8,2228.57,0.0
256,512,24576,1536,10,0,18.1666,a4w4_blockscale_256x128x384x128_16x16_16x16_8x32x1_8x32x1_1x32x1x8_8_2x2_intrawave_v3,2127.79,2445.88,0.0
256,512,26624,16384,54,0,104.3943,_ZN5aiter42f4gemm_bf16_per1x32Fp4_BpreShuffle_256x256E,4278.75,2390.56,0.0
256,512,28672,4096,54,0,36.5438,_ZN5aiter42f4gemm_bf16_per1x32Fp4_BpreShuffle_256x256E,3290.82,2438.96,0.0
256,512,32768,512,54,0,14.2158,_ZN5aiter42f4gemm_bf16_per1x32Fp4_BpreShuffle_256x256E,1208.51,2959.67,0.0
256,512,51200,5120,54,0,79.3531,_ZN5aiter42f4gemm_bf16_per1x32Fp4_BpreShuffle_256x256E,3382.8,2328.98,0.0
256,512,53248,16384,54,0,206.5008,_ZN5aiter42f4gemm_bf16_per1x32Fp4_BpreShuffle_256x256E,4326.15,2396.74,0.0
256,512,57344,8192,54,0,114.8863,_ZN5aiter42f4gemm_bf16_per1x32Fp4_BpreShuffle_256x256E,4187.06,2573.84,0.0
256,512,59136,8192,54,0,120.2706,_ZN5aiter42f4gemm_bf16_per1x32Fp4_BpreShuffle_256x256E,4124.61,2534.9,0.0
256,512,106496,16384,54,0,393.8495,_ZN5aiter42f4gemm_bf16_per1x32Fp4_BpreShuffle_256x256E,4536.52,2502.63,0.0
256,640,256,768,21,0,4.4726,_ZN5aiter41f4gemm_bf16_per1x32Fp4_BpreShuffle_32x128E,56.27,150.19,0.0
256,640,1280,8192,21,0,16.1806,_ZN5aiter41f4gemm_bf16_per1x32Fp4_BpreShuffle_32x128E,829.5,587.29,0.0
256,640,2304,16384,29,0,31.0486,_ZN5aiter41f4gemm_bf16_per1x32Fp4_BpreShuffle_64x128E,1556.22,871.74,0.0
256,640,2560,8192,29,0,18.3344,_ZN5aiter41f4gemm_bf16_per1x32Fp4_BpreShuffle_64x128E,1464.11,893.62,0.0
256,640,4608,16384,37,0,37.6937,_ZN5aiter41f4gemm_bf16_per1x32Fp4_BpreShuffle_96x128E,2563.74,1297.03,0.0
256,640,5120,1280,30,0,9.1065,_ZN5aiter41f4gemm_bf16_per1x32Fp4_BpreShuffle_64x256E,921.17,1124.47,0.0
256,640,5120,5120,42,0,18.2902,_ZN5aiter42f4gemm_bf16_per1x32Fp4_BpreShuffle_128x128E,1834.56,1164.51,0.0
256,640,5120,6400,42,0,20.0998,_ZN5aiter42f4gemm_bf16_per1x32Fp4_BpreShuffle_128x128E,2086.74,1243.08,0.0
256,640,5120,25600,42,0,65.8701,_ZN5aiter42f4gemm_bf16_per1x32Fp4_BpreShuffle_128x128E,2547.02,1218.79,0.0
256,640,6400,5120,42,0,19.3128,_ZN5aiter42f4gemm_bf16_per1x32Fp4_BpreShuffle_128x128E,2171.77,1357.36,0.0
256,640,7168,8192,46,0,28.4912,_ZN5aiter42f4gemm_bf16_per1x32Fp4_BpreShuffle_160x128E,2638.08,1444.54,0.0
256,640,7936,540672,46,0,1458.2397,_ZN5aiter42f4gemm_bf16_per1x32Fp4_BpreShuffle_160x128E,3766.31,1596.83,0.0
256,640,8192,1024,13,0,9.4548,a4w4_blockscale_256x96x128x128_16x16_16x16_8x32x1_8x32x1_1x16x1x16_8_2x2_intrawave_v3,1135.66,1587.31,0.0
256,640,8192,2048,46,0,15.5769,_ZN5aiter42f4gemm_bf16_per1x32Fp4_BpreShuffle_160x128E,1378.63,1253.76,0.0
256,640,8192,3584,38,0,18.5675,_ZN5aiter41f4gemm_bf16_per1x32Fp4_BpreShuffle_96x256E,2024.02,1417.14,0.0
256,640,8192,7168,46,0,26.2059,_ZN5aiter42f4gemm_bf16_per1x32Fp4_BpreShuffle_160x128E,2868.13,1608.02,0.0
256,640,8192,8192,46,0,29.5225,_ZN5aiter42f4gemm_bf16_per1x32Fp4_BpreShuffle_160x128E,2909.62,1580.54,0.0
256,640,8192,28672,46,0,88.2533,_ZN5aiter42f4gemm_bf16_per1x32Fp4_BpreShuffle_160x128E,3406.65,1553.5,0.0
256,640,9216,16384,38,0,61.2521,_ZN5aiter41f4gemm_bf16_per1x32Fp4_BpreShuffle_96x256E,3155.38,1510.75,0.0
256,640,10240,8192,51,0,34.6221,_ZN5aiter42f4gemm_bf16_per1x32Fp4_BpreShuffle_224x128E,3101.32,1665.75,0.0
256,640,12800,5120,43,0,29.0678,_ZN5aiter42f4gemm_bf16_per1x32Fp4_BpreShuffle_128x256E,2885.88,1747.31,0.0
256,640,13312,16384,47,0,74.153,_ZN5aiter42f4gemm_bf16_per1x32Fp4_BpreShuffle_160x256E,3764.82,1771.12,0.0
256,640,14336,8192,47,0,42.5891,_ZN5aiter42f4gemm_bf16_per1x32Fp4_BpreShuffle_160x256E,3529.63,1871.18,0.0
256,640,16384,2048,47,0,19.1148,_ZN5aiter42f4gemm_bf16_per1x32Fp4_BpreShuffle_160x256E,2246.93,2009.13,0.0
256,640,16384,4096,47,0,26.5896,_ZN5aiter42f4gemm_bf16_per1x32Fp4_BpreShuffle_160x256E,3230.56,2099.94,0.0
256,640,16384,6656,47,0,38.105,_ZN5aiter42f4gemm_bf16_per1x32Fp4_BpreShuffle_160x256E,3663.21,2037.2,0.0
256,640,16384,8192,47,0,45.9881,_ZN5aiter42f4gemm_bf16_per1x32Fp4_BpreShuffle_160x256E,3735.72,1972.29,0.0
256,640,16384,13312,47,0,69.754,_ZN5aiter42f4gemm_bf16_per1x32Fp4_BpreShuffle_160x256E,4002.25,1925.1,0.0
256,640,16384,26624,47,0,119.6467,_ZN5aiter42f4gemm_bf16_per1x32Fp4_BpreShuffle_160x256E,4666.62,2069.38,0.0
256,640,26624,16384,47,0,143.1188,_ZN5aiter42f4gemm_bf16_per1x32Fp4_BpreShuffle_160x256E,3901.27,1798.68,0.0
256,640,51200,5120,45,0,101.0597,_ZN5aiter42f4gemm_bf16_per1x32Fp4_BpreShuffle_128x512E,3320.26,1961.68,0.0
256,640,53248,16384,48,0,279.1174,_ZN5aiter42f4gemm_bf16_per1x32Fp4_BpreShuffle_160x384E,4000.79,1825.78,0.0
256,640,57344,8192,43,0,162.3674,_ZN5aiter42f4gemm_bf16_per1x32Fp4_BpreShuffle_128x256E,3703.3,1914.81,0.0
256,768,1280,8192,21,0,16.8204,_ZN5aiter41f4gemm_bf16_per1x32Fp4_BpreShuffle_32x128E,957.54,615.6,0.0
256,768,2304,16384,29,0,31.7907,_ZN5aiter41f4gemm_bf16_per1x32Fp4_BpreShuffle_64x128E,1823.87,902.93,0.0
256,768,2560,8192,29,0,18.2695,_ZN5aiter41f4gemm_bf16_per1x32Fp4_BpreShuffle_64x128E,1763.17,961.36,0.0
256,768,4608,16384,42,0,42.9379,_ZN5aiter42f4gemm_bf16_per1x32Fp4_BpreShuffle_128x128E,2700.74,1190.51,0.0
256,768,5120,1280,30,0,9.2191,_ZN5aiter41f4gemm_bf16_per1x32Fp4_BpreShuffle_64x256E,1091.9,1261.8,0.0
256,768,5120,5120,42,0,18.7867,_ZN5aiter42f4gemm_bf16_per1x32Fp4_BpreShuffle_128x128E,2143.29,1220.95,0.0
256,768,5120,6400,42,0,20.7759,_ZN5aiter42f4gemm_bf16_per1x32Fp4_BpreShuffle_128x128E,2422.6,1285.43,0.0
256,768,5120,25600,42,0,67.9876,_ZN5aiter42f4gemm_bf16_per1x32Fp4_BpreShuffle_128x128E,2961.23,1224.2,0.0
256,768,6400,5120,46,0,21.2145,_ZN5aiter42f4gemm_bf16_per1x32Fp4_BpreShuffle_160x128E,2372.51,1328.36,0.0
256,768,7168,8192,49,0,31.7305,_ZN5aiter42f4gemm_bf16_per1x32Fp4_BpreShuffle_192x128E,2842.51,1371.42,0.0
256,768,8192,1024,13,0,11.9823,a4w4_blockscale_256x96x128x128_16x16_16x16_8x32x1_8x32x1_1x16x1x16_8_2x2_intrawave_v3,1075.33,1432.98,0.0
256,768,8192,2048,49,0,16.0083,_ZN5aiter42f4gemm_bf16_per1x32Fp4_BpreShuffle_192x128E,1609.78,1359.17,0.0
256,768,8192,3584,49,0,18.1697,_ZN5aiter42f4gemm_bf16_per1x32Fp4_BpreShuffle_192x128E,2482.0,1576.21,0.0
256,768,8192,7168,49,0,29.5435,_ZN5aiter42f4gemm_bf16_per1x32Fp4_BpreShuffle_192x128E,3052.93,1512.87,0.0
256,768,8192,8192,49,0,32.5122,_ZN5aiter42f4gemm_bf16_per1x32Fp4_BpreShuffle_192x128E,3170.48,1515.83,0.0
256,768,8192,28672,49,0,97.7048,_ZN5aiter42f4gemm_bf16_per1x32Fp4_BpreShuffle_192x128E,3692.52,1443.47,0.0
256,768,9216,16384,43,0,65.8922,_ZN5aiter42f4gemm_bf16_per1x32Fp4_BpreShuffle_128x256E,3519.81,1456.09,0.0
256,768,10240,8192,43,0,37.1829,_ZN5aiter42f4gemm_bf16_per1x32Fp4_BpreShuffle_128x256E,3465.28,1635.63,0.0
256,768,12800,5120,47,0,32.7883,_ZN5aiter42f4gemm_bf16_per1x32Fp4_BpreShuffle_160x256E,3070.1,1658.97,0.0
256,768,13312,16384,52,0,85.5076,_ZN5aiter42f4gemm_bf16_per1x32Fp4_BpreShuffle_224x256E,3917.87,1588.05,0.0
256,768,14336,8192,50,0,49.5292,_ZN5aiter42f4gemm_bf16_per1x32Fp4_BpreShuffle_192x256E,3642.07,1693.67,0.0
256,768,16384,2048,50,0,20.4289,_ZN5aiter42f4gemm_bf16_per1x32Fp4_BpreShuffle_192x256E,2522.88,2091.62,0.0
256,768,16384,4096,50,0,30.2755,_ZN5aiter42f4gemm_bf16_per1x32Fp4_BpreShuffle_192x256E,3404.71,1991.48,0.0
256,768,16384,6656,50,0,45.6941,_ZN5aiter42f4gemm_bf16_per1x32Fp4_BpreShuffle_192x256E,3665.76,1799.96,0.0
256,768,16384,8192,50,0,52.9874,_ZN5aiter42f4gemm_bf16_per1x32Fp4_BpreShuffle_192x256E,3890.71,1800.81,0.0
256,768,16384,13312,52,0,77.5727,_ZN5aiter42f4gemm_bf16_per1x32Fp4_BpreShuffle_224x256E,4318.63,1796.12,0.0
256,768,16384,26624,50,0,138.9553,_ZN5aiter42f4gemm_bf16_per1x32Fp4_BpreShuffle_192x256E,4821.8,1824.28,0.0
256,768,26624,16384,50,0,165.2907,_ZN5aiter42f4gemm_bf16_per1x32Fp4_BpreShuffle_192x256E,4053.55,1604.99,0.0
256,768,51200,5120,54,0,111.9765,_ZN5aiter42f4gemm_bf16_per1x32Fp4_BpreShuffle_256x256E,3595.87,1890.41,0.0
256,768,53248,16384,54,0,289.4301,_ZN5aiter42f4gemm_bf16_per1x32Fp4_BpreShuffle_256x256E,4629.89,1811.45,0.0
256,768,57344,8192,54,0,167.4114,_ZN5aiter42f4gemm_bf16_per1x32Fp4_BpreShuffle_256x256E,4310.07,1947.94,0.0
256,768,547328,2048,54,0,526.8722,_ZN5aiter42f4gemm_bf16_per1x32Fp4_BpreShuffle_256x256E,3267.86,2660.88,0.0
256,832,1280,8192,29,0,18.4303,_ZN5aiter41f4gemm_bf16_per1x32Fp4_BpreShuffle_64x128E,946.72,584.94,0.0
256,864,1280,8192,29,0,18.3432,_ZN5aiter41f4gemm_bf16_per1x32Fp4_BpreShuffle_64x128E,987.8,599.33,0.0
256,896,13184,53504,44,0,276.8915,_ZN5aiter42f4gemm_bf16_per1x32Fp4_BpreShuffle_128x384E,4565.22,1445.67,0.0
256,1024,512,4096,21,0,9.3769,_ZN5aiter41f4gemm_bf16_per1x32Fp4_BpreShuffle_32x128E,458.04,447.3,0.0
256,1024,512,7168,0,0,24.5597,a4w4_blockscale_256x64x128x128_16x16_16x16_8x32x1_8x32x1_1x32x1x8_8_2x2_intrawave_v3,306.04,266.84,0.0
256,1024,800,5120,23,0,46.2669,_ZN5aiter42f4gemm_bf16_per1x32Fp4_BpreShuffle_224x256E,181.31,136.34,0.0
256,1024,1024,3072,21,0,9.0159,_ZN5aiter41f4gemm_bf16_per1x32Fp4_BpreShuffle_32x128E,714.57,581.51,0.0
256,1024,1280,8192,29,0,18.2932,_ZN5aiter41f4gemm_bf16_per1x32Fp4_BpreShuffle_64x128E,1173.92,659.19,0.0
256,1024,1536,7168,29,0,15.7978,_ZN5aiter41f4gemm_bf16_per1x32Fp4_BpreShuffle_64x128E,1427.32,779.9,0.0
256,1024,2048,6144,29,0,14.261,_ZN5aiter41f4gemm_bf16_per1x32Fp4_BpreShuffle_64x128E,1807.01,955.86,0.0
256,1024,2304,16384,37,0,36.3864,_ZN5aiter41f4gemm_bf16_per1x32Fp4_BpreShuffle_96x128E,2124.68,878.94,0.0
256,1024,2560,8192,37,0,21.1445,_ZN5aiter41f4gemm_bf16_per1x32Fp4_BpreShuffle_96x128E,2031.25,942.23,0.0
256,1024,3072,1536,8,0,10.7099,a4w4_blockscale_256x128x128x128_16x16_16x16_8x32x1_8x32x1_1x32x1x8_8_2x2_intrawave_v3,902.31,881.16,0.0
256,1024,3072,6144,42,0,19.4604,_ZN5aiter42f4gemm_bf16_per1x32Fp4_BpreShuffle_128x128E,1986.33,969.89,0.0
256,1024,4096,4096,42,0,14.6518,_ZN5aiter42f4gemm_bf16_per1x32Fp4_BpreShuffle_128x128E,2345.09,1288.19,0.0
256,1024,4096,8192,42,0,24.7357,_ZN5aiter42f4gemm_bf16_per1x32Fp4_BpreShuffle_128x128E,2778.15,1186.95,0.0
256,1024,4096,14336,42,0,41.0531,_ZN5aiter42f4gemm_bf16_per1x32Fp4_BpreShuffle_128x128E,2929.35,1098.3,0.0
256,1024,4608,7168,5,0,42.7675,a4w4_blockscale_256x96x256x128_16x16_16x16_8x32x1_8x32x1_1x32x1x8_8_2x2_intrawave_v3,1581.71,692.64,0.0
256,1024,4608,16384,46,0,49.665,_ZN5aiter42f4gemm_bf16_per1x32Fp4_BpreShuffle_160x128E,3113.24,1118.99,0.0
256,1024,5120,1280,38,0,10.8223,_ZN5aiter41f4gemm_bf16_per1x32Fp4_BpreShuffle_96x256E,1240.2,1332.24,0.0
256,1024,5120,5120,49,0,23.1664,_ZN5aiter42f4gemm_bf16_per1x32Fp4_BpreShuffle_192x128E,2317.46,1131.57,0.0
256,1024,5120,6400,49,0,25.3882,_ZN5aiter42f4gemm_bf16_per1x32Fp4_BpreShuffle_192x128E,2643.31,1187.42,0.0
256,1024,5120,25600,49,0,84.2335,_ZN5aiter42f4gemm_bf16_per1x32Fp4_BpreShuffle_192x128E,3186.8,1058.12,0.0
256,1024,6144,3072,51,0,17.8126,_ZN5aiter42f4gemm_bf16_per1x32Fp4_BpreShuffle_224x128E,2170.08,1324.51,0.0
256,1024,6144,4096,51,0,20.4317,_ZN5aiter42f4gemm_bf16_per1x32Fp4_BpreShuffle_224x128E,2522.53,1334.35,0.0
256,1024,6144,12288,51,0,49.6008,_ZN5aiter42f4gemm_bf16_per1x32Fp4_BpreShuffle_224x128E,3117.26,1141.58,0.0
256,1024,6144,16384,43,0,61.8487,_ZN5aiter42f4gemm_bf16_per1x32Fp4_BpreShuffle_128x256E,3333.27,1152.86,0.0
256,1024,6400,5120,51,0,26.509,_ZN5aiter42f4gemm_bf16_per1x32Fp4_BpreShuffle_224x128E,2531.55,1211.39,0.0
256,1024,7168,2048,8,0,19.98,a4w4_blockscale_256x128x128x128_16x16_16x16_8x32x1_8x32x1_1x32x1x8_8_2x2_intrawave_v3,1504.74,1154.59,0.0
256,1024,7168,2304,9,0,22.1345,a4w4_blockscale_256x128x256x128_16x16_16x16_8x32x1_8x32x1_1x32x1x8_8_2x2_intrawave_v3,1528.06,1089.58,0.0
256,1024,7168,8192,43,0,36.9755,_ZN5aiter42f4gemm_bf16_per1x32Fp4_BpreShuffle_128x256E,3252.4,1304.5,0.0
256,1024,7168,16384,43,0,67.0567,_ZN5aiter42f4gemm_bf16_per1x32Fp4_BpreShuffle_128x256E,3586.79,1219.7,0.0
256,1024,7168,18432,53,0,75.1228,_ZN5aiter42f4gemm_bf16_per1x32Fp4_BpreShuffle_256x128E,3601.88,1200.4,0.0
256,1024,8192,1024,8,0,14.3455,a4w4_blockscale_256x128x128x128_16x16_16x16_8x32x1_8x32x1_1x32x1x8_8_2x2_intrawave_v3,1197.58,1498.44,0.0
256,1024,8192,2048,43,0,18.0551,_ZN5aiter42f4gemm_bf16_per1x32Fp4_BpreShuffle_128x256E,1903.05,1451.91,0.0
256,1024,8192,3584,43,0,21.7992,_ZN5aiter42f4gemm_bf16_per1x32Fp4_BpreShuffle_128x256E,2758.34,1527.23,0.0
256,1024,8192,4096,43,0,21.6498,_ZN5aiter42f4gemm_bf16_per1x32Fp4_BpreShuffle_128x256E,3174.14,1646.74,0.0
256,1024,8192,7168,43,0,35.1762,_ZN5aiter42f4gemm_bf16_per1x32Fp4_BpreShuffle_128x256E,3418.76,1415.94,0.0
256,1024,8192,8192,53,0,38.144,_ZN5aiter42f4gemm_bf16_per1x32Fp4_BpreShuffle_256x128E,3603.16,1429.48,0.0
256,1024,8192,28672,43,0,111.089,_ZN5aiter42f4gemm_bf16_per1x32Fp4_BpreShuffle_128x256E,4330.19,1340.35,0.0
256,1024,9216,16384,47,0,73.6628,_ZN5aiter42f4gemm_bf16_per1x32Fp4_BpreShuffle_160x256E,4198.02,1395.01,0.0
256,1024,10240,8192,50,0,49.6385,_ZN5aiter42f4gemm_bf16_per1x32Fp4_BpreShuffle_192x256E,3461.0,1351.95,0.0
256,1024,10880,28416,54,0,149.9933,_ZN5aiter42f4gemm_bf16_per1x32Fp4_BpreShuffle_256x256E,4221.34,1276.15,0.0004
256,1024,12288,512,44,0,12.3061,_ZN5aiter42f4gemm_bf16_per1x32Fp4_BpreShuffle_128x384E,1047.03,2321.91,0.0
256,1024,12288,1536,44,0,17.9317,_ZN5aiter42f4gemm_bf16_per1x32Fp4_BpreShuffle_128x384E,2155.66,1973.57,0.0
256,1024,12288,4096,44,0,31.5117,_ZN5aiter42f4gemm_bf16_per1x32Fp4_BpreShuffle_128x384E,3271.14,1663.79,0.0
256,1024,12288,6144,44,0,43.5271,_ZN5aiter42f4gemm_bf16_per1x32Fp4_BpreShuffle_128x384E,3552.24,1517.68,0.0
256,1024,12800,5120,48,0,40.8113,_ZN5aiter42f4gemm_bf16_per1x32Fp4_BpreShuffle_160x384E,3288.74,1509.48,0.0
256,1024,13312,16384,54,0,97.7036,_ZN5aiter42f4gemm_bf16_per1x32Fp4_BpreShuffle_256x256E,4571.75,1481.05,0.0
256,1024,14336,8192,54,0,60.3453,_ZN5aiter42f4gemm_bf16_per1x32Fp4_BpreShuffle_256x256E,3985.7,1529.11,0.0
256,1024,16384,512,45,0,14.463,_ZN5aiter42f4gemm_bf16_per1x32Fp4_BpreShuffle_128x512E,1187.85,2628.15,0.0
256,1024,16384,2048,54,0,21.8036,_ZN5aiter42f4gemm_bf16_per1x32Fp4_BpreShuffle_256x256E,3151.75,2356.5,0.0
256,1024,16384,4096,54,0,34.1505,_ZN5aiter42f4gemm_bf16_per1x32Fp4_BpreShuffle_256x256E,4024.51,2026.5,0.0
256,1024,16384,6656,54,0,52.7494,_ZN5aiter42f4gemm_bf16_per1x32Fp4_BpreShuffle_256x256E,4233.95,1734.39,0.0
256,1024,16384,8192,54,0,59.9643,_ZN5aiter42f4gemm_bf16_per1x32Fp4_BpreShuffle_256x256E,4584.03,1748.67,0.0
256,1024,16384,13312,54,0,91.4984,_ZN5aiter42f4gemm_bf16_per1x32Fp4_BpreShuffle_256x256E,4881.8,1633.06,0.0
256,1024,16384,16384,54,0,111.7138,_ZN5aiter42f4gemm_bf16_per1x32Fp4_BpreShuffle_256x256E,4921.11,1576.89,0.0
256,1024,16384,26624,54,0,163.6572,_ZN5aiter42f4gemm_bf16_per1x32Fp4_BpreShuffle_256x256E,5458.69,1621.01,0.0
256,1024,16384,53248,54,0,330.6898,_ZN5aiter42f4gemm_bf16_per1x32Fp4_BpreShuffle_256x256E,5402.97,1502.99,0.0
256,1024,18432,7168,47,0,75.4356,_ZN5aiter42f4gemm_bf16_per1x32Fp4_BpreShuffle_160x256E,3586.94,1424.78,0.0
256,1024,20480,16384,50,0,165.8132,_ZN5aiter42f4gemm_bf16_per1x32Fp4_BpreShuffle_192x256E,4144.39,1315.36,0.0
256,1024,24576,1536,54,0,34.8437,_ZN5aiter42f4gemm_bf16_per1x32Fp4_BpreShuffle_256x256E,2218.75,2008.75,0.0
256,1024,26624,16384,54,0,189.7626,_ZN5aiter42f4gemm_bf16_per1x32Fp4_BpreShuffle_256x256E,4707.74,1480.89,0.0
256,1024,28672,4096,54,0,67.7295,_ZN5aiter42f4gemm_bf16_per1x32Fp4_BpreShuffle_256x256E,3551.16,1764.93,0.0
256,1024,32768,512,54,0,25.3249,_ZN5aiter42f4gemm_bf16_per1x32Fp4_BpreShuffle_256x256E,1356.76,2991.51,0.0
256,1024,51200,5120,48,0,143.817,_ZN5aiter42f4gemm_bf16_per1x32Fp4_BpreShuffle_160x384E,3733.01,1658.71,0.0
256,1024,53248,16384,54,0,375.89,_ZN5aiter42f4gemm_bf16_per1x32Fp4_BpreShuffle_256x256E,4753.27,1472.9,0.0
256,1024,57344,8192,54,0,212.8558,_ZN5aiter42f4gemm_bf16_per1x32Fp4_BpreShuffle_256x256E,4519.83,1674.92,0.0
256,1024,59136,8192,54,0,219.812,_ZN5aiter42f4gemm_bf16_per1x32Fp4_BpreShuffle_256x256E,4513.57,1672.0,0.0
256,1024,106496,16384,54,0,695.1664,_ZN5aiter42f4gemm_bf16_per1x32Fp4_BpreShuffle_256x256E,5140.37,1580.78,0.0
256,1152,1280,8192,29,0,18.0,_ZN5aiter41f4gemm_bf16_per1x32Fp4_BpreShuffle_64x128E,1342.18,717.26,0.0
256,1152,2304,16384,37,0,38.6497,_ZN5aiter41f4gemm_bf16_per1x32Fp4_BpreShuffle_96x128E,2250.29,869.86,0.0
256,1152,2560,8192,37,0,21.6324,_ZN5aiter41f4gemm_bf16_per1x32Fp4_BpreShuffle_96x128E,2233.61,975.51,0.0
256,1152,4608,16384,49,0,54.2861,_ZN5aiter42f4gemm_bf16_per1x32Fp4_BpreShuffle_192x128E,3204.25,1064.78,0.0
256,1152,5120,1280,38,0,13.5937,_ZN5aiter41f4gemm_bf16_per1x32Fp4_BpreShuffle_96x256E,1110.77,1163.08,0.0
256,1152,5120,5120,38,0,23.5739,_ZN5aiter41f4gemm_bf16_per1x32Fp4_BpreShuffle_96x256E,2562.07,1181.51,0.0
256,1152,5120,6400,49,0,26.6498,_ZN5aiter42f4gemm_bf16_per1x32Fp4_BpreShuffle_192x128E,2832.95,1195.76,0.0
256,1152,5120,25600,49,0,85.8163,_ZN5aiter42f4gemm_bf16_per1x32Fp4_BpreShuffle_192x128E,3519.03,1072.97,0.0
256,1152,6400,5120,53,0,29.0565,_ZN5aiter42f4gemm_bf16_per1x32Fp4_BpreShuffle_256x128E,2598.3,1172.84,0.0
256,1152,7168,8192,43,0,39.4724,_ZN5aiter42f4gemm_bf16_per1x32Fp4_BpreShuffle_128x256E,3427.5,1281.75,0.0
256,1152,8192,1024,47,0,14.4799,_ZN5aiter42f4gemm_bf16_per1x32Fp4_BpreShuffle_160x256E,1334.77,1633.89,0.0
256,1152,8192,2048,47,0,17.1527,_ZN5aiter42f4gemm_bf16_per1x32Fp4_BpreShuffle_160x256E,2253.56,1658.2,0.0
256,1152,8192,3584,47,0,23.2214,_ZN5aiter42f4gemm_bf16_per1x32Fp4_BpreShuffle_160x256E,2913.08,1533.88,0.0
256,1152,8192,7168,47,0,38.4727,_ZN5aiter42f4gemm_bf16_per1x32Fp4_BpreShuffle_160x256E,3516.56,1361.05,0.0
256,1152,8192,8192,47,0,41.1237,_ZN5aiter42f4gemm_bf16_per1x32Fp4_BpreShuffle_160x256E,3759.85,1389.65,0.0
256,1152,8192,28672,47,0,121.8771,_ZN5aiter42f4gemm_bf16_per1x32Fp4_BpreShuffle_160x256E,4440.26,1253.97,0.0
256,1152,9216,16384,50,0,85.6876,_ZN5aiter42f4gemm_bf16_per1x32Fp4_BpreShuffle_192x256E,4060.01,1239.02,0.0
256,1152,10240,8192,50,0,50.9078,_ZN5aiter42f4gemm_bf16_per1x32Fp4_BpreShuffle_192x256E,3796.54,1380.04,0.0
256,1152,12800,5120,54,0,43.4897,_ZN5aiter42f4gemm_bf16_per1x32Fp4_BpreShuffle_256x256E,3471.97,1499.4,0.0
256,1152,13312,16384,45,0,119.9853,_ZN5aiter42f4gemm_bf16_per1x32Fp4_BpreShuffle_128x512E,4188.11,1243.15,0.0
256,1152,14336,8192,45,0,66.8811,_ZN5aiter42f4gemm_bf16_per1x32Fp4_BpreShuffle_128x512E,4045.73,1442.4,0.0
256,1152,16384,2048,47,0,30.2016,_ZN5aiter42f4gemm_bf16_per1x32Fp4_BpreShuffle_160x256E,2559.78,1844.46,0.0
256,1152,16384,4096,47,0,46.9601,_ZN5aiter42f4gemm_bf16_per1x32Fp4_BpreShuffle_160x256E,3292.56,1568.62,0.0
256,1152,16384,6656,47,0,69.2029,_ZN5aiter42f4gemm_bf16_per1x32Fp4_BpreShuffle_160x256E,3630.71,1388.79,0.0
256,1152,16384,8192,47,0,81.3708,_ZN5aiter42f4gemm_bf16_per1x32Fp4_BpreShuffle_160x256E,3800.35,1346.63,0.0
256,1152,16384,13312,47,0,123.7448,_ZN5aiter42f4gemm_bf16_per1x32Fp4_BpreShuffle_160x256E,4060.87,1248.28,0.0
256,1152,16384,26624,47,0,232.4817,_ZN5aiter42f4gemm_bf16_per1x32Fp4_BpreShuffle_160x256E,4323.02,1166.49,0.0
256,1152,26624,16384,45,0,226.9321,_ZN5aiter42f4gemm_bf16_per1x32Fp4_BpreShuffle_128x512E,4428.74,1272.99,0.0
256,1152,51200,5120,54,0,155.4048,_ZN5aiter42f4gemm_bf16_per1x32Fp4_BpreShuffle_256x256E,3886.49,1621.48,0.0
256,1152,53248,16384,54,0,451.0597,_ZN5aiter42f4gemm_bf16_per1x32Fp4_BpreShuffle_256x256E,4456.27,1259.98,0.0
256,1152,57344,8192,54,0,254.8822,_ZN5aiter42f4gemm_bf16_per1x32Fp4_BpreShuffle_256x256E,4246.4,1458.4,0.0
256,1536,512,7168,0,0,25.5821,a4w4_blockscale_256x64x128x128_16x16_16x16_8x32x1_8x32x1_1x32x1x8_8_2x2_intrawave_v3,440.71,348.4,0.0
256,1536,1280,8192,29,0,17.9019,_ZN5aiter41f4gemm_bf16_per1x32Fp4_BpreShuffle_64x128E,1799.38,863.96,0.0
256,1536,1536,7168,4,0,29.9466,a4w4_blockscale_256x96x128x128_16x16_16x16_8x32x1_8x32x1_1x32x1x8_8_2x2_intrawave_v3,1129.44,525.22,0.0
256,1536,2304,16384,42,0,45.0414,_ZN5aiter42f4gemm_bf16_per1x32Fp4_BpreShuffle_128x128E,2574.61,855.55,0.0
256,1536,2560,8192,42,0,25.354,_ZN5aiter42f4gemm_bf16_per1x32Fp4_BpreShuffle_128x128E,2541.0,971.9,0.0
256,1536,3072,1536,4,0,12.9268,a4w4_blockscale_256x96x128x128_16x16_16x16_8x32x1_8x32x1_1x32x1x8_8_2x2_intrawave_v3,1121.35,1003.82,0.0
256,1536,3200,10496,46,0,37.9321,_ZN5aiter42f4gemm_bf16_per1x32Fp4_BpreShuffle_160x128E,2720.12,914.4,0.0
256,1536,3456,517376,38,0,1592.2596,_ZN5aiter41f4gemm_bf16_per1x32Fp4_BpreShuffle_96x256E,3449.75,817.7,0.0
256,1536,4608,7168,6,0,54.4245,a4w4_blockscale_256x96x384x128_16x16_16x16_8x32x1_8x32x1_1x32x1x8_8_2x2_intrawave_v3,1864.39,664.7,0.0
256,1536,4608,16384,51,0,65.3407,_ZN5aiter42f4gemm_bf16_per1x32Fp4_BpreShuffle_224x128E,3549.52,986.94,0.0
256,1536,5120,1280,43,0,15.6453,_ZN5aiter42f4gemm_bf16_per1x32Fp4_BpreShuffle_128x256E,1286.82,1277.6,0.0
256,1536,5120,5120,43,0,28.2912,_ZN5aiter42f4gemm_bf16_per1x32Fp4_BpreShuffle_128x256E,2846.49,1158.24,0.0
256,1536,5120,6400,43,0,31.8861,_ZN5aiter42f4gemm_bf16_per1x32Fp4_BpreShuffle_128x256E,3156.96,1161.25,0.0
256,1536,5120,25600,43,0,100.8438,_ZN5aiter42f4gemm_bf16_per1x32Fp4_BpreShuffle_128x256E,3992.84,1000.81,0.0
256,1536,6400,5120,47,0,33.9068,_ZN5aiter42f4gemm_bf16_per1x32Fp4_BpreShuffle_160x256E,2968.82,1179.02,0.0
256,1536,7168,2048,10,0,26.9209,a4w4_blockscale_256x128x384x128_16x16_16x16_8x32x1_8x32x1_1x32x1x8_8_2x2_intrawave_v3,1675.17,1149.03,0.0
256,1536,7168,2304,7,0,29.4102,a4w4_blockscale_256x96x512x128_16x16_16x16_8x32x1_8x32x1_1x32x1x8_8_2x2_intrawave_v3,1725.06,1089.66,0.0
256,1536,7168,8192,50,0,48.3249,_ZN5aiter42f4gemm_bf16_per1x32Fp4_BpreShuffle_192x256E,3732.83,1193.42,0.0
256,1536,8192,1024,45,0,17.5535,_ZN5aiter42f4gemm_bf16_per1x32Fp4_BpreShuffle_128x512E,1468.07,1717.41,0.0
256,1536,8192,2048,50,0,20.3498,_ZN5aiter42f4gemm_bf16_per1x32Fp4_BpreShuffle_192x256E,2532.68,1726.17,0.0
256,1536,8192,3584,54,0,28.3942,_ZN5aiter42f4gemm_bf16_per1x32Fp4_BpreShuffle_256x256E,3176.5,1500.25,0.0
256,1536,8192,7168,50,0,46.6282,_ZN5aiter42f4gemm_bf16_per1x32Fp4_BpreShuffle_192x256E,3868.66,1287.44,0.0
256,1536,8192,8192,52,0,53.7063,_ZN5aiter42f4gemm_bf16_per1x32Fp4_BpreShuffle_224x256E,3838.63,1210.5,0.0
256,1536,8192,28672,50,0,142.6752,_ZN5aiter42f4gemm_bf16_per1x32Fp4_BpreShuffle_192x256E,5057.32,1153.85,0.0
256,1536,9216,16384,54,0,101.515,_ZN5aiter42f4gemm_bf16_per1x32Fp4_BpreShuffle_256x256E,4569.34,1146.55,0.0
256,1536,10240,8192,54,0,59.7295,_ZN5aiter42f4gemm_bf16_per1x32Fp4_BpreShuffle_256x256E,4314.42,1334.21,0.0
256,1536,12800,5120,47,0,61.135,_ZN5aiter42f4gemm_bf16_per1x32Fp4_BpreShuffle_160x256E,3293.15,1243.51,0.0
256,1536,13312,16384,50,0,157.0373,_ZN5aiter42f4gemm_bf16_per1x32Fp4_BpreShuffle_192x256E,4266.6,1034.97,0.0
256,1536,14336,8192,54,0,93.3554,_ZN5aiter42f4gemm_bf16_per1x32Fp4_BpreShuffle_256x256E,3864.56,1168.14,0.0
256,1536,16384,2048,54,0,36.3137,_ZN5aiter42f4gemm_bf16_per1x32Fp4_BpreShuffle_256x256E,2838.58,1891.34,0.0
256,1536,16384,4096,54,0,58.7302,_ZN5aiter42f4gemm_bf16_per1x32Fp4_BpreShuffle_256x256E,3510.26,1481.89,0.0
256,1536,16384,6656,50,0,83.9826,_ZN5aiter42f4gemm_bf16_per1x32Fp4_BpreShuffle_192x256E,3989.01,1309.43,0.0
256,1536,16384,8192,50,0,99.0521,_ZN5aiter42f4gemm_bf16_per1x32Fp4_BpreShuffle_192x256E,4162.63,1249.16,0.0
256,1536,16384,13312,50,0,143.3822,_ZN5aiter42f4gemm_bf16_per1x32Fp4_BpreShuffle_192x256E,4672.93,1182.9,0.0
256,1536,16384,26624,50,0,259.8596,_ZN5aiter42f4gemm_bf16_per1x32Fp4_BpreShuffle_192x256E,5156.75,1111.69,0.0
256,1536,26624,16384,54,0,280.4802,_ZN5aiter42f4gemm_bf16_per1x32Fp4_BpreShuffle_256x256E,4777.63,1114.07,0.0
256,1536,51200,5120,54,0,185.6814,_ZN5aiter42f4gemm_bf16_per1x32Fp4_BpreShuffle_256x256E,4337.03,1574.15,0.0
256,1536,53248,16384,54,0,505.4454,_ZN5aiter42f4gemm_bf16_per1x32Fp4_BpreShuffle_256x256E,5302.37,1211.54,0.0
256,1536,57344,8192,54,0,323.7218,_ZN5aiter42f4gemm_bf16_per1x32Fp4_BpreShuffle_256x256E,4457.87,1289.17,0.0
256,1552,57344,8192,21,0,402.0203,_ZN5aiter42f4gemm_bf16_per1x32Fp4_BpreShuffle_128x512E,3627.03,1042.82,0.0
256,1600,1280,8192,29,0,18.8692,_ZN5aiter41f4gemm_bf16_per1x32Fp4_BpreShuffle_64x128E,1778.26,842.24,0.0
256,1600,2304,16384,42,0,45.0896,_ZN5aiter42f4gemm_bf16_per1x32Fp4_BpreShuffle_128x128E,2679.02,872.8,0.0
256,1600,2560,8192,46,0,27.4374,_ZN5aiter42f4gemm_bf16_per1x32Fp4_BpreShuffle_160x128E,2445.89,919.6,0.0
256,1600,4608,16384,43,0,67.3316,_ZN5aiter42f4gemm_bf16_per1x32Fp4_BpreShuffle_128x256E,3588.09,974.31,0.0
256,1600,5120,1280,39,0,15.9852,_ZN5aiter41f4gemm_bf16_per1x32Fp4_BpreShuffle_96x384E,1311.93,1294.0,0.0
256,1600,5120,5120,47,0,30.2039,_ZN5aiter42f4gemm_bf16_per1x32Fp4_BpreShuffle_160x256E,2777.33,1112.02,0.0
256,1600,5120,6400,47,0,34.0818,_ZN5aiter42f4gemm_bf16_per1x32Fp4_BpreShuffle_160x256E,3076.65,1111.68,0.0
256,1600,5120,25600,47,0,106.7869,_ZN5aiter42f4gemm_bf16_per1x32Fp4_BpreShuffle_160x256E,3927.73,958.92,0.0
256,1600,6400,5120,47,0,35.922,_ZN5aiter42f4gemm_bf16_per1x32Fp4_BpreShuffle_160x256E,2919.04,1140.25,0.0
256,1600,7168,8192,50,0,52.2949,_ZN5aiter42f4gemm_bf16_per1x32Fp4_BpreShuffle_192x256E,3593.18,1125.37,0.0
256,1600,8192,1024,45,0,17.4726,_ZN5aiter42f4gemm_bf16_per1x32Fp4_BpreShuffle_128x512E,1536.32,1787.25,0.0
256,1600,8192,2048,54,0,20.5068,_ZN5aiter42f4gemm_bf16_per1x32Fp4_BpreShuffle_256x256E,2618.01,1767.29,0.0
256,1600,8192,3584,54,0,29.2052,_ZN5aiter42f4gemm_bf16_per1x32Fp4_BpreShuffle_256x256E,3216.98,1498.42,0.0
256,1600,8192,7168,52,0,51.3594,_ZN5aiter42f4gemm_bf16_per1x32Fp4_BpreShuffle_224x256E,3658.63,1193.72,0.0
256,1600,8192,8192,52,0,57.7062,_ZN5aiter42f4gemm_bf16_per1x32Fp4_BpreShuffle_224x256E,3721.41,1149.31,0.0
256,1600,8192,28672,54,0,161.0625,_ZN5aiter42f4gemm_bf16_per1x32Fp4_BpreShuffle_256x256E,4666.63,1034.33,0.0
256,1600,9216,16384,48,0,105.4034,_ZN5aiter42f4gemm_bf16_per1x32Fp4_BpreShuffle_160x384E,4584.14,1120.42,0.0
256,1600,10240,8192,47,0,78.9556,_ZN5aiter42f4gemm_bf16_per1x32Fp4_BpreShuffle_160x256E,3399.83,1029.24,0.0
256,1600,12800,5120,47,0,63.5804,_ZN5aiter42f4gemm_bf16_per1x32Fp4_BpreShuffle_160x256E,3298.43,1224.03,0.0
256,1600,13312,16384,50,0,168.8251,_ZN5aiter42f4gemm_bf16_per1x32Fp4_BpreShuffle_192x256E,4134.05,975.91,0.0
256,1600,14336,8192,50,0,98.1944,_ZN5aiter42f4gemm_bf16_per1x32Fp4_BpreShuffle_192x256E,3827.2,1131.93,0.0
256,1600,16384,2048,54,0,37.0677,_ZN5aiter42f4gemm_bf16_per1x32Fp4_BpreShuffle_256x256E,2896.7,1911.22,0.0
256,1600,16384,4096,54,0,62.2458,_ZN5aiter42f4gemm_bf16_per1x32Fp4_BpreShuffle_256x256E,3450.01,1433.99,0.0
256,1600,16384,6656,54,0,91.2148,_ZN5aiter42f4gemm_bf16_per1x32Fp4_BpreShuffle_256x256E,3825.76,1230.94,0.0
256,1600,16384,8192,54,0,102.7525,_ZN5aiter42f4gemm_bf16_per1x32Fp4_BpreShuffle_256x256E,4179.92,1227.14,0.0
256,1600,16384,13312,54,0,155.5977,_ZN5aiter42f4gemm_bf16_per1x32Fp4_BpreShuffle_256x256E,4485.49,1106.25,0.0
256,1600,16384,26624,54,0,292.3706,_ZN5aiter42f4gemm_bf16_per1x32Fp4_BpreShuffle_256x256E,4774.3,998.16,0.0
256,1600,26624,16384,48,0,290.0493,_ZN5aiter42f4gemm_bf16_per1x32Fp4_BpreShuffle_160x384E,4812.51,1090.88,0.0
256,1600,51200,5120,54,0,209.092,_ZN5aiter42f4gemm_bf16_per1x32Fp4_BpreShuffle_256x256E,4011.92,1430.03,0.0
256,1600,53248,16384,54,0,576.4818,_ZN5aiter42f4gemm_bf16_per1x32Fp4_BpreShuffle_256x256E,4842.7,1074.98,0.0
256,1600,57344,8192,48,0,336.8595,_ZN5aiter42f4gemm_bf16_per1x32Fp4_BpreShuffle_160x384E,4462.51,1261.46,0.0
256,1664,57344,8192,21,0,410.6409,_ZN5aiter42f4gemm_bf16_per1x32Fp4_BpreShuffle_128x512E,3807.14,1053.32,0.0
256,1792,5376,4096,47,0,27.5359,_ZN5aiter42f4gemm_bf16_per1x32Fp4_BpreShuffle_160x256E,2866.08,1232.85,0.0
256,1792,57344,8192,26,0,432.9381,_ZN5aiter42f4gemm_bf16_per1x32Fp4_BpreShuffle_224x256E,3888.84,1034.19,0.0
256,2048,512,4096,21,0,10.1832,_ZN5aiter41f4gemm_bf16_per1x32Fp4_BpreShuffle_32x128E,843.54,720.8,0.0
256,2048,512,7168,0,0,26.4625,a4w4_blockscale_256x64x128x128_16x16_16x16_8x32x1_8x32x1_1x32x1x8_8_2x2_intrawave_v3,568.06,425.97,0.0
256,2048,1024,3072,29,0,10.2991,_ZN5aiter41f4gemm_bf16_per1x32Fp4_BpreShuffle_64x128E,1251.07,865.41,0.0
256,2048,1280,8192,37,0,21.633,_ZN5aiter41f4gemm_bf16_per1x32Fp4_BpreShuffle_96x128E,1985.38,872.48,0.0
256,2048,1536,7168,42,0,22.528,_ZN5aiter42f4gemm_bf16_per1x32Fp4_BpreShuffle_128x128E,2001.83,849.45,0.0
256,2048,2048,6144,42,0,20.8673,_ZN5aiter42f4gemm_bf16_per1x32Fp4_BpreShuffle_128x128E,2469.87,1004.99,0.0
256,2048,2304,16384,46,0,51.7314,_ZN5aiter42f4gemm_bf16_per1x32Fp4_BpreShuffle_160x128E,2988.88,871.59,0.0
256,2048,2560,8192,38,0,31.454,_ZN5aiter41f4gemm_bf16_per1x32Fp4_BpreShuffle_96x256E,2730.95,933.43,0.0
256,2048,3072,1536,9,0,16.228,a4w4_blockscale_256x128x256x128_16x16_16x16_8x32x1_8x32x1_1x32x1x8_8_2x2_intrawave_v3,1190.99,1017.69,0.0
256,2048,3072,6144,51,0,28.7334,_ZN5aiter42f4gemm_bf16_per1x32Fp4_BpreShuffle_224x128E,2690.58,985.32,0.0
256,2048,4096,4096,43,0,22.0307,_ZN5aiter42f4gemm_bf16_per1x32Fp4_BpreShuffle_128x256E,3119.26,1332.69,0.0
256,2048,4096,8192,43,0,38.7963,_ZN5aiter42f4gemm_bf16_per1x32Fp4_BpreShuffle_128x256E,3542.58,1081.11,0.0
256,2048,4096,14336,53,0,64.4578,_ZN5aiter42f4gemm_bf16_per1x32Fp4_BpreShuffle_256x128E,3731.41,943.52,0.0
256,2048,4608,7168,10,0,66.6546,a4w4_blockscale_256x128x384x128_16x16_16x16_8x32x1_8x32x1_1x32x1x8_8_2x2_intrawave_v3,2029.74,641.06,0.0
256,2048,4608,16384,47,0,77.7096,_ZN5aiter42f4gemm_bf16_per1x32Fp4_BpreShuffle_160x256E,3979.4,944.55,0.0
256,2048,5120,1280,10,0,17.0408,a4w4_blockscale_256x128x384x128_16x16_16x16_8x32x1_8x32x1_1x32x1x8_8_2x2_intrawave_v3,1575.25,1499.87,0.0
256,2048,5120,5120,50,0,34.7884,_ZN5aiter42f4gemm_bf16_per1x32Fp4_BpreShuffle_192x256E,3086.49,1130.31,0.0
256,2048,5120,6400,50,0,39.2433,_ZN5aiter42f4gemm_bf16_per1x32Fp4_BpreShuffle_192x256E,3420.14,1118.89,0.0
256,2048,5120,25600,50,0,127.207,_ZN5aiter42f4gemm_bf16_per1x32Fp4_BpreShuffle_192x256E,4220.45,886.13,0.0
256,2048,6144,3072,54,0,26.6042,_ZN5aiter42f4gemm_bf16_per1x32Fp4_BpreShuffle_256x256E,2905.91,1418.9,0.0
256,2048,6144,4096,44,0,31.413,_ZN5aiter42f4gemm_bf16_per1x32Fp4_BpreShuffle_128x384E,3281.42,1335.21,0.0
256,2048,6144,4608,44,0,34.4644,_ZN5aiter42f4gemm_bf16_per1x32Fp4_BpreShuffle_128x384E,3364.75,1277.85,0.0
256,2048,6144,12288,44,0,76.3642,_ZN5aiter42f4gemm_bf16_per1x32Fp4_BpreShuffle_128x384E,4049.51,988.65,0.0
256,2048,6144,16384,44,0,95.5177,_ZN5aiter42f4gemm_bf16_per1x32Fp4_BpreShuffle_128x384E,4316.65,966.05,0.0
256,2048,6400,5120,54,0,40.6593,_ZN5aiter42f4gemm_bf16_per1x32Fp4_BpreShuffle_256x256E,3301.03,1176.64,0.0
256,2048,7168,2048,9,0,40.0639,a4w4_blockscale_256x128x256x128_16x16_16x16_8x32x1_8x32x1_1x32x1x8_8_2x2_intrawave_v3,1500.84,968.39,0.0
256,2048,7168,2304,9,0,42.4075,a4w4_blockscale_256x128x256x128_16x16_16x16_8x32x1_8x32x1_1x32x1x8_8_2x2_intrawave_v3,1595.14,942.69,0.0
256,2048,7168,8192,54,0,57.2065,_ZN5aiter42f4gemm_bf16_per1x32Fp4_BpreShuffle_256x256E,4204.39,1173.1,0.0
256,2048,7168,16384,54,0,105.1191,_ZN5aiter42f4gemm_bf16_per1x32Fp4_BpreShuffle_256x256E,4576.11,997.51,0.0
256,2048,7168,18432,54,0,118.8045,_ZN5aiter42f4gemm_bf16_per1x32Fp4_BpreShuffle_256x256E,4555.1,962.04,0.0
256,2048,8192,1024,54,0,18.164,_ZN5aiter42f4gemm_bf16_per1x32Fp4_BpreShuffle_256x256E,1891.64,2135.95,0.0
256,2048,8192,2048,54,0,22.5974,_ZN5aiter42f4gemm_bf16_per1x32Fp4_BpreShuffle_256x256E,3041.03,1948.91,0.0
256,2048,8192,3584,54,0,32.4536,_ZN5aiter42f4gemm_bf16_per1x32Fp4_BpreShuffle_256x256E,3705.57,1599.35,0.0
256,2048,8192,4096,54,0,37.1442,_ZN5aiter42f4gemm_bf16_per1x32Fp4_BpreShuffle_256x256E,3700.15,1467.95,0.0
256,2048,8192,7168,54,0,55.2862,_ZN5aiter42f4gemm_bf16_per1x32Fp4_BpreShuffle_256x256E,4350.42,1270.74,0.0
256,2048,8192,8192,54,0,60.7364,_ZN5aiter42f4gemm_bf16_per1x32Fp4_BpreShuffle_256x256E,4525.75,1243.04,0.0
256,2048,8192,28672,54,0,181.0399,_ZN5aiter42f4gemm_bf16_per1x32Fp4_BpreShuffle_256x256E,5314.15,996.22,0.0
256,2048,9216,16384,47,0,144.1381,_ZN5aiter42f4gemm_bf16_per1x32Fp4_BpreShuffle_160x256E,4290.85,902.08,0.0
256,2048,10240,8192,50,0,93.3564,_ZN5aiter42f4gemm_bf16_per1x32Fp4_BpreShuffle_192x256E,3680.49,988.41,0.0
256,2048,12288,512,34,0,22.2856,_ZN5aiter41f4gemm_bf16_per1x32Fp4_BpreShuffle_64x768E,1156.34,2423.16,0.0
256,2048,12288,1536,54,0,35.0292,_ZN5aiter42f4gemm_bf16_per1x32Fp4_BpreShuffle_256x256E,2207.0,1751.16,0.0
256,2048,12288,4096,44,0,60.5778,_ZN5aiter42f4gemm_bf16_per1x32Fp4_BpreShuffle_128x384E,3403.2,1315.53,0.0
256,2048,12288,6144,44,0,83.0992,_ZN5aiter42f4gemm_bf16_per1x32Fp4_BpreShuffle_128x384E,3721.31,1135.65,0.0
256,2048,12800,5120,54,0,77.0353,_ZN5aiter42f4gemm_bf16_per1x32Fp4_BpreShuffle_256x256E,3484.58,1174.0,0.0
256,2048,13312,16384,54,0,181.8868,_ZN5aiter42f4gemm_bf16_per1x32Fp4_BpreShuffle_256x256E,4911.59,991.58,0.0
256,2048,14336,8192,54,0,111.0807,_ZN5aiter42f4gemm_bf16_per1x32Fp4_BpreShuffle_256x256E,4330.51,1132.77,0.0
256,2048,16384,512,54,0,23.7227,_ZN5aiter42f4gemm_bf16_per1x32Fp4_BpreShuffle_256x256E,1448.39,3027.79,0.0
256,2048,16384,2048,54,0,42.9001,_ZN5aiter42f4gemm_bf16_per1x32Fp4_BpreShuffle_256x256E,3203.7,2004.27,0.0
256,2048,16384,4096,54,0,65.2327,_ZN5aiter42f4gemm_bf16_per1x32Fp4_BpreShuffle_256x256E,4213.81,1607.44,0.0
256,2048,16384,6656,54,0,94.9655,_ZN5aiter42f4gemm_bf16_per1x32Fp4_BpreShuffle_256x256E,4703.57,1352.6,0.0
256,2048,16384,8192,54,0,118.9261,_ZN5aiter42f4gemm_bf16_per1x32Fp4_BpreShuffle_256x256E,4622.67,1199.12,0.0
256,2048,16384,13312,54,0,169.6998,_ZN5aiter42f4gemm_bf16_per1x32Fp4_BpreShuffle_256x256E,5264.31,1118.4,0.0
256,2048,16384,16384,54,0,216.0855,_ZN5aiter42f4gemm_bf16_per1x32Fp4_BpreShuffle_256x256E,5088.32,1009.34,0.0
256,2048,16384,26624,54,0,319.7683,_ZN5aiter42f4gemm_bf16_per1x32Fp4_BpreShuffle_256x256E,5587.5,977.19,0.0
256,2048,16384,53248,54,0,619.7511,_ZN5aiter42f4gemm_bf16_per1x32Fp4_BpreShuffle_256x256E,5765.88,900.11,0.0
256,2048,18432,7168,48,0,134.1723,_ZN5aiter42f4gemm_bf16_per1x32Fp4_BpreShuffle_160x384E,4033.37,1109.75,0.0
256,2048,20480,16384,54,0,281.7409,_ZN5aiter42f4gemm_bf16_per1x32Fp4_BpreShuffle_256x256E,4878.2,952.77,0.0
256,2048,24576,1536,54,0,56.4026,_ZN5aiter42f4gemm_bf16_per1x32Fp4_BpreShuffle_256x256E,2741.34,2147.25,0.0
256,2048,26624,16384,54,0,372.6865,_ZN5aiter42f4gemm_bf16_per1x32Fp4_BpreShuffle_256x256E,4794.13,922.85,0.0
256,2048,28672,4096,54,0,123.3527,_ZN5aiter42f4gemm_bf16_per1x32Fp4_BpreShuffle_256x256E,3899.68,1462.11,0.0
256,2048,32768,512,36,0,48.8553,_ZN5aiter42f4gemm_bf16_per1x32Fp4_BpreShuffle_64x1024E,1406.59,2929.68,0.0
256,2048,51200,5120,54,0,256.484,_ZN5aiter42f4gemm_bf16_per1x32Fp4_BpreShuffle_256x256E,4186.39,1349.13,0.0
256,2048,53248,16384,54,0,682.467,_ZN5aiter42f4gemm_bf16_per1x32Fp4_BpreShuffle_256x256E,5236.02,983.33,0.0
256,2048,57344,8192,54,0,393.2207,_ZN5aiter42f4gemm_bf16_per1x32Fp4_BpreShuffle_256x256E,4893.3,1215.99,0.0
256,2048,59136,8192,54,0,423.1209,_ZN5aiter42f4gemm_bf16_per1x32Fp4_BpreShuffle_256x256E,4689.62,1164.75,0.0
256,2048,106496,16384,54,0,1308.8308,_ZN5aiter42f4gemm_bf16_per1x32Fp4_BpreShuffle_256x256E,5460.47,1012.66,0.0
256,2432,3584,738560,47,0,2828.8778,_ZN5aiter42f4gemm_bf16_per1x32Fp4_BpreShuffle_160x256E,4551.28,791.49,0.0
256,2880,1280,8192,42,0,25.7621,_ZN5aiter42f4gemm_bf16_per1x32Fp4_BpreShuffle_128x128E,2344.45,947.6,0.0
256,2880,2304,16384,51,0,63.6883,_ZN5aiter42f4gemm_bf16_per1x32Fp4_BpreShuffle_224x128E,3414.01,875.17,0.0
256,2880,2560,8192,43,0,36.4457,_ZN5aiter42f4gemm_bf16_per1x32Fp4_BpreShuffle_128x256E,3314.41,1015.97,0.0
256,2880,4608,16384,52,0,96.5076,_ZN5aiter42f4gemm_bf16_per1x32Fp4_BpreShuffle_224x256E,4506.02,910.64,0.0
256,2880,5120,1280,54,0,17.8654,_ZN5aiter42f4gemm_bf16_per1x32Fp4_BpreShuffle_256x256E,2112.95,1937.33,0.0
256,2880,5120,5120,48,0,42.4121,_ZN5aiter42f4gemm_bf16_per1x32Fp4_BpreShuffle_160x384E,3560.19,1178.23,0.0
256,2880,5120,6400,54,0,48.4765,_ZN5aiter42f4gemm_bf16_per1x32Fp4_BpreShuffle_256x256E,3893.51,1136.45,0.0
256,2880,5120,25600,54,0,153.855,_ZN5aiter42f4gemm_bf16_per1x32Fp4_BpreShuffle_256x256E,4907.05,857.24,0.0
256,2880,6400,5120,54,0,65.797,_ZN5aiter42f4gemm_bf16_per1x32Fp4_BpreShuffle_256x256E,2868.58,921.33,0.0
256,2880,7168,8192,47,0,87.9683,_ZN5aiter42f4gemm_bf16_per1x32Fp4_BpreShuffle_160x256E,3844.89,937.2,0.0
256,2880,8192,1024,40,0,27.0418,_ZN5aiter41f4gemm_bf16_per1x32Fp4_BpreShuffle_96x512E,1786.8,1954.56,0.0
256,2880,8192,2048,50,0,38.258,_ZN5aiter42f4gemm_bf16_per1x32Fp4_BpreShuffle_192x256E,2525.92,1529.71,0.0
256,2880,8192,3584,50,0,56.3354,_ZN5aiter42f4gemm_bf16_per1x32Fp4_BpreShuffle_192x256E,3001.92,1189.78,0.0
256,2880,8192,7168,50,0,87.1289,_ZN5aiter42f4gemm_bf16_per1x32Fp4_BpreShuffle_192x256E,3881.93,997.01,0.0
256,2880,8192,8192,50,0,96.8561,_ZN5aiter42f4gemm_bf16_per1x32Fp4_BpreShuffle_192x256E,3990.94,955.41,0.0
256,2880,8192,28672,50,0,274.6138,_ZN5aiter42f4gemm_bf16_per1x32Fp4_BpreShuffle_192x256E,4926.61,749.83,0.0
256,2880,9216,16384,52,0,185.5243,_ZN5aiter42f4gemm_bf16_per1x32Fp4_BpreShuffle_224x256E,4687.96,820.24,0.0
256,2880,10240,8192,54,0,117.3484,_ZN5aiter42f4gemm_bf16_per1x32Fp4_BpreShuffle_256x256E,4117.52,960.57,0.0
256,2880,12800,5120,54,0,106.5865,_ZN5aiter42f4gemm_bf16_per1x32Fp4_BpreShuffle_256x256E,3541.61,1068.32,0.0
256,2880,13312,16384,52,0,269.9373,_ZN5aiter42f4gemm_bf16_per1x32Fp4_BpreShuffle_224x256E,4653.96,775.45,0.0
256,2880,14336,8192,54,0,155.6029,_ZN5aiter42f4gemm_bf16_per1x32Fp4_BpreShuffle_256x256E,4347.33,983.86,0.0
256,2880,16384,2048,54,0,61.497,_ZN5aiter42f4gemm_bf16_per1x32Fp4_BpreShuffle_256x256E,3142.81,1855.35,0.0
256,2880,16384,4096,54,0,95.895,_ZN5aiter42f4gemm_bf16_per1x32Fp4_BpreShuffle_256x256E,4030.94,1395.53,0.0
256,2880,16384,6656,54,0,138.9253,_ZN5aiter42f4gemm_bf16_per1x32Fp4_BpreShuffle_256x256E,4521.42,1140.77,0.0
256,2880,16384,8192,54,0,165.6418,_ZN5aiter42f4gemm_bf16_per1x32Fp4_BpreShuffle_256x256E,4667.26,1046.1,0.0
256,2880,16384,13312,54,0,247.3824,_ZN5aiter42f4gemm_bf16_per1x32Fp4_BpreShuffle_256x256E,5078.28,899.79,0.0
256,2880,16384,26624,54,0,473.6679,_ZN5aiter42f4gemm_bf16_per1x32Fp4_BpreShuffle_256x256E,5304.47,740.63,0.0
256,2880,26624,16384,48,0,523.2043,_ZN5aiter42f4gemm_bf16_per1x32Fp4_BpreShuffle_160x384E,4802.25,755.06,0.0
256,2880,51200,5120,54,0,344.4229,_ZN5aiter42f4gemm_bf16_per1x32Fp4_BpreShuffle_256x256E,4384.0,1258.21,0.0
256,2880,53248,16384,54,0,961.9976,_ZN5aiter42f4gemm_bf16_per1x32Fp4_BpreShuffle_256x256E,5223.62,796.79,0.0
256,2880,57344,8192,54,0,567.131,_ZN5aiter42f4gemm_bf16_per1x32Fp4_BpreShuffle_256x256E,4771.08,1017.36,0.0
256,2944,1792,8192,38,0,32.608,_ZN5aiter41f4gemm_bf16_per1x32Fp4_BpreShuffle_96x256E,2650.77,918.48,0.0
256,3000,512,7168,29,0,16.2854,_ZN5aiter41f4gemm_bf16_per1x32Fp4_BpreShuffle_64x128E,1352.14,961.54,0.0
256,3000,2112,7168,51,0,33.1164,_ZN5aiter42f4gemm_bf16_per1x32Fp4_BpreShuffle_224x128E,2742.84,935.89,0.0
256,3000,3072,1536,47,0,15.3407,_ZN5aiter42f4gemm_bf16_per1x32Fp4_BpreShuffle_160x256E,1845.52,1505.49,0.0
256,3000,7168,256,40,0,17.4695,_ZN5aiter41f4gemm_bf16_per1x32Fp4_BpreShuffle_96x512E,630.24,2536.39,0.0
256,3000,7168,2048,50,0,37.8602,_ZN5aiter42f4gemm_bf16_per1x32Fp4_BpreShuffle_192x256E,2326.46,1410.98,0.0
256,3072,57344,8192,21,0,735.2449,_ZN5aiter42f4gemm_bf16_per1x32Fp4_BpreShuffle_128x512E,3925.52,815.76,0.0
256,3200,1280,8192,42,0,26.6539,_ZN5aiter42f4gemm_bf16_per1x32Fp4_BpreShuffle_128x128E,2517.79,995.8,0.0
256,3200,2304,16384,43,0,69.1244,_ZN5aiter42f4gemm_bf16_per1x32Fp4_BpreShuffle_128x256E,3495.03,865.6,0.0
256,3200,2560,8192,43,0,39.9461,_ZN5aiter42f4gemm_bf16_per1x32Fp4_BpreShuffle_128x256E,3359.97,1000.77,0.0
256,3200,4608,16384,54,0,106.0754,_ZN5aiter42f4gemm_bf16_per1x32Fp4_BpreShuffle_256x256E,4555.1,881.02,0.0
256,3200,5120,1280,45,0,19.7857,_ZN5aiter42f4gemm_bf16_per1x32Fp4_BpreShuffle_128x512E,2119.87,1925.27,0.0
256,3200,5120,5120,45,0,47.9925,_ZN5aiter42f4gemm_bf16_per1x32Fp4_BpreShuffle_128x512E,3495.8,1126.58,0.0
256,3200,5120,6400,45,0,54.7726,_ZN5aiter42f4gemm_bf16_per1x32Fp4_BpreShuffle_128x512E,3828.83,1084.34,0.0
256,3200,5120,25600,45,0,176.123,_ZN5aiter42f4gemm_bf16_per1x32Fp4_BpreShuffle_128x512E,4762.93,790.72,0.0
256,3200,6400,5120,47,0,69.1363,_ZN5aiter42f4gemm_bf16_per1x32Fp4_BpreShuffle_160x256E,3033.36,947.92,0.0
256,3200,7168,8192,50,0,97.6826,_ZN5aiter42f4gemm_bf16_per1x32Fp4_BpreShuffle_192x256E,3847.25,904.38,0.0
256,3200,8192,1024,54,0,28.482,_ZN5aiter42f4gemm_bf16_per1x32Fp4_BpreShuffle_256x256E,1884.95,2045.56,0.0
256,3200,8192,2048,54,0,40.9605,_ZN5aiter42f4gemm_bf16_per1x32Fp4_BpreShuffle_256x256E,2621.41,1564.78,0.0
256,3200,8192,3584,54,0,57.3302,_ZN5aiter42f4gemm_bf16_per1x32Fp4_BpreShuffle_256x256E,3277.59,1270.59,0.0
256,3200,8192,7168,54,0,94.5081,_ZN5aiter42f4gemm_bf16_per1x32Fp4_BpreShuffle_256x256E,3976.48,986.77,0.0
256,3200,8192,8192,54,0,104.4674,_ZN5aiter42f4gemm_bf16_per1x32Fp4_BpreShuffle_256x256E,4111.3,948.53,0.0
256,3200,8192,28672,52,0,305.1042,_ZN5aiter42f4gemm_bf16_per1x32Fp4_BpreShuffle_224x256E,4926.97,707.12,0.0
256,3200,9216,16384,54,0,197.1671,_ZN5aiter42f4gemm_bf16_per1x32Fp4_BpreShuffle_256x256E,4901.26,815.02,0.0
256,3200,10240,8192,45,0,122.2919,_ZN5aiter42f4gemm_bf16_per1x32Fp4_BpreShuffle_128x512E,4390.08,986.05,0.0
256,3200,12800,5120,54,0,109.5218,_ZN5aiter42f4gemm_bf16_per1x32Fp4_BpreShuffle_256x256E,3829.65,1121.97,0.0
256,3200,13312,16384,54,0,287.2469,_ZN5aiter42f4gemm_bf16_per1x32Fp4_BpreShuffle_256x256E,4859.46,767.5,0.0
256,3200,14336,8192,54,0,162.3098,_ZN5aiter42f4gemm_bf16_per1x32Fp4_BpreShuffle_256x256E,4630.77,1007.81,0.0
256,3200,16384,2048,54,0,71.5292,_ZN5aiter42f4gemm_bf16_per1x32Fp4_BpreShuffle_256x256E,3002.25,1746.3,0.0
256,3200,16384,4096,54,0,111.6874,_ZN5aiter42f4gemm_bf16_per1x32Fp4_BpreShuffle_256x256E,3845.53,1297.96,0.0
256,3200,16384,6656,54,0,163.4773,_ZN5aiter42f4gemm_bf16_per1x32Fp4_BpreShuffle_256x256E,4269.29,1040.1,0.0
256,3200,16384,8192,47,0,196.8084,_ZN5aiter42f4gemm_bf16_per1x32Fp4_BpreShuffle_160x256E,4364.62,940.37,0.0
256,3200,16384,13312,47,0,292.815,_ZN5aiter42f4gemm_bf16_per1x32Fp4_BpreShuffle_160x256E,4767.05,803.27,0.0
256,3200,16384,26624,47,0,576.3884,_ZN5aiter42f4gemm_bf16_per1x32Fp4_BpreShuffle_160x256E,4843.49,634.22,0.0
256,3200,26624,16384,54,0,556.8581,_ZN5aiter42f4gemm_bf16_per1x32Fp4_BpreShuffle_256x256E,5013.36,744.74,0.0
256,3200,51200,5120,54,0,386.9368,_ZN5aiter42f4gemm_bf16_per1x32Fp4_BpreShuffle_256x256E,4335.91,1206.77,0.0
256,3200,53248,16384,48,0,1128.8789,_ZN5aiter42f4gemm_bf16_per1x32Fp4_BpreShuffle_160x384E,4946.02,711.51,0.0
256,3200,57344,8192,54,0,649.529,_ZN5aiter42f4gemm_bf16_per1x32Fp4_BpreShuffle_256x256E,4628.7,946.82,0.0
256,3712,951552,4352,54,0,6920.3238,_ZN5aiter42f4gemm_bf16_per1x32Fp4_BpreShuffle_256x256E,4442.56,1321.18,0.0
256,4096,512,4096,29,0,10.9658,_ZN5aiter41f4gemm_bf16_per1x32Fp4_BpreShuffle_64x128E,1566.68,1243.09,0.0
256,4096,512,7168,0,0,27.3037,a4w4_blockscale_256x64x128x128_16x16_16x16_8x32x1_8x32x1_1x32x1x8_8_2x2_intrawave_v3,1101.12,758.48,0.0
256,4096,800,5120,21,0,39.6258,_ZN5aiter42f4gemm_bf16_per1x32Fp4_BpreShuffle_128x512E,846.78,481.69,0.0
256,4096,1024,3072,30,0,14.0452,_ZN5aiter41f4gemm_bf16_per1x32Fp4_BpreShuffle_64x256E,1834.78,1157.19,0.0
256,4096,1280,8192,38,0,32.2517,_ZN5aiter41f4gemm_bf16_per1x32Fp4_BpreShuffle_96x256E,2663.41,1007.88,0.0
256,4096,1536,7168,51,0,33.603,_ZN5aiter42f4gemm_bf16_per1x32Fp4_BpreShuffle_224x128E,2684.11,975.15,0.0
256,4096,2048,6144,43,0,33.101,_ZN5aiter42f4gemm_bf16_per1x32Fp4_BpreShuffle_128x256E,3114.08,1077.05,0.0
256,4096,2304,16384,47,0,78.0812,_ZN5aiter42f4gemm_bf16_per1x32Fp4_BpreShuffle_160x256E,3960.46,913.19,0.0
256,4096,2560,8192,50,0,49.3258,_ZN5aiter42f4gemm_bf16_per1x32Fp4_BpreShuffle_192x256E,3482.94,977.88,0.0
256,4096,3072,1536,10,0,28.6765,a4w4_blockscale_256x128x384x128_16x16_16x16_8x32x1_8x32x1_1x32x1x8_8_2x2_intrawave_v3,1347.96,1069.55,0.0
256,4096,3072,6144,44,0,44.4912,_ZN5aiter42f4gemm_bf16_per1x32Fp4_BpreShuffle_128x384E,3475.27,1060.57,0.0
256,4096,4096,4096,54,0,37.9223,_ZN5aiter42f4gemm_bf16_per1x32Fp4_BpreShuffle_256x256E,3624.23,1327.23,0.0
256,4096,4096,8192,54,0,63.8634,_ZN5aiter42f4gemm_bf16_per1x32Fp4_BpreShuffle_256x256E,4304.15,1050.82,0.0
256,4096,4096,14336,54,0,104.59,_ZN5aiter42f4gemm_bf16_per1x32Fp4_BpreShuffle_256x256E,4599.26,882.25,0.0
256,4096,4608,7168,10,0,131.1566,a4w4_blockscale_256x128x384x128_16x16_16x16_8x32x1_8x32x1_1x32x1x8_8_2x2_intrawave_v3,2063.05,525.66,0.0
256,4096,4608,16384,47,0,144.7034,_ZN5aiter42f4gemm_bf16_per1x32Fp4_BpreShuffle_160x256E,4274.09,753.62,0.0
256,4096,5120,1280,33,0,30.2367,_ZN5aiter41f4gemm_bf16_per1x32Fp4_BpreShuffle_64x640E,1775.56,1582.23,0.0
256,4096,5120,5120,50,0,67.9041,_ZN5aiter42f4gemm_bf16_per1x32Fp4_BpreShuffle_192x256E,3162.52,965.13,0.0
256,4096,5120,6400,50,0,77.6951,_ZN5aiter42f4gemm_bf16_per1x32Fp4_BpreShuffle_192x256E,3454.99,919.42,0.0
256,4096,5120,25600,50,0,238.1354,_ZN5aiter42f4gemm_bf16_per1x32Fp4_BpreShuffle_192x256E,4508.96,671.5,0.0
256,4096,6144,3072,44,0,52.4445,_ZN5aiter42f4gemm_bf16_per1x32Fp4_BpreShuffle_128x384E,2948.24,1259.62,0.0
256,4096,6144,4096,44,0,61.9246,_ZN5aiter42f4gemm_bf16_per1x32Fp4_BpreShuffle_128x384E,3329.18,1151.45,0.0
256,4096,6144,12288,44,0,144.5997,_ZN5aiter42f4gemm_bf16_per1x32Fp4_BpreShuffle_128x384E,4277.15,783.17,0.0
256,4096,6144,16384,44,0,177.7384,_ZN5aiter42f4gemm_bf16_per1x32Fp4_BpreShuffle_128x384E,4639.59,755.14,0.0
256,4096,6400,5120,54,0,81.4407,_ZN5aiter42f4gemm_bf16_per1x32Fp4_BpreShuffle_256x256E,3296.08,973.7,0.0
256,4096,7168,2048,10,0,77.5343,a4w4_blockscale_256x128x384x128_16x16_16x16_8x32x1_8x32x1_1x32x1x8_8_2x2_intrawave_v3,1551.04,906.11,0.0
256,4096,7168,2304,5,0,80.8616,a4w4_blockscale_256x96x256x128_16x16_16x16_8x32x1_8x32x1_1x32x1x8_8_2x2_intrawave_v3,1673.12,886.66,0.0
256,4096,7168,8192,54,0,110.3777,_ZN5aiter42f4gemm_bf16_per1x32Fp4_BpreShuffle_256x256E,4358.09,949.99,0.0
256,4096,7168,16384,54,0,197.1971,_ZN5aiter42f4gemm_bf16_per1x32Fp4_BpreShuffle_256x256E,4878.74,765.71,0.0
256,4096,7168,18432,54,0,218.7404,_ZN5aiter42f4gemm_bf16_per1x32Fp4_BpreShuffle_256x256E,4948.02,743.02,0.0
256,4096,8192,1024,54,0,30.4329,_ZN5aiter42f4gemm_bf16_per1x32Fp4_BpreShuffle_256x256E,2258.07,2411.87,0.0
256,4096,8192,2048,54,0,43.3485,_ZN5aiter42f4gemm_bf16_per1x32Fp4_BpreShuffle_256x256E,3170.56,1838.4,0.0
256,4096,8192,3584,54,0,62.8575,_ZN5aiter42f4gemm_bf16_per1x32Fp4_BpreShuffle_256x256E,3826.4,1417.95,0.0
256,4096,8192,4096,54,0,68.705,_ZN5aiter42f4gemm_bf16_per1x32Fp4_BpreShuffle_256x256E,4000.84,1343.06,0.0
256,4096,8192,7168,54,0,104.1747,_ZN5aiter42f4gemm_bf16_per1x32Fp4_BpreShuffle_256x256E,4617.59,1066.95,0.0
256,4096,8192,8192,54,0,116.6368,_ZN5aiter42f4gemm_bf16_per1x32Fp4_BpreShuffle_256x256E,4713.4,1006.89,0.0
256,4096,8192,28672,54,0,345.2111,_ZN5aiter42f4gemm_bf16_per1x32Fp4_BpreShuffle_256x256E,5573.82,704.7,0.0
256,4096,9216,16384,44,0,253.5015,_ZN5aiter42f4gemm_bf16_per1x32Fp4_BpreShuffle_128x384E,4879.46,728.0,0.0
256,4096,10240,8192,54,0,156.2228,_ZN5aiter42f4gemm_bf16_per1x32Fp4_BpreShuffle_256x256E,4398.81,912.84,0.0
256,4096,12288,512,54,0,34.8007,_ZN5aiter42f4gemm_bf16_per1x32Fp4_BpreShuffle_256x256E,1480.99,3013.09,0.0
256,4096,12288,1536,54,0,57.2009,_ZN5aiter42f4gemm_bf16_per1x32Fp4_BpreShuffle_256x256E,2703.08,1979.8,0.0
256,4096,12288,4096,54,0,101.7739,_ZN5aiter42f4gemm_bf16_per1x32Fp4_BpreShuffle_256x256E,4051.3,1318.78,0.0
256,4096,12288,6144,54,0,138.7122,_ZN5aiter42f4gemm_bf16_per1x32Fp4_BpreShuffle_256x256E,4458.69,1088.55,0.0
256,4096,12800,5120,54,0,139.4543,_ZN5aiter42f4gemm_bf16_per1x32Fp4_BpreShuffle_256x256E,3849.8,1062.08,0.0
256,4096,13312,16384,54,0,367.441,_ZN5aiter42f4gemm_bf16_per1x32Fp4_BpreShuffle_256x256E,4862.57,684.89,0.0
256,4096,14336,8192,54,0,207.3872,_ZN5aiter42f4gemm_bf16_per1x32Fp4_BpreShuffle_256x256E,4639.02,930.33,0.0
256,4096,16384,512,54,0,45.8036,_ZN5aiter42f4gemm_bf16_per1x32Fp4_BpreShuffle_256x256E,1500.31,3044.75,0.0
256,4096,16384,2048,54,0,82.564,_ZN5aiter42f4gemm_bf16_per1x32Fp4_BpreShuffle_256x256E,3329.27,1879.62,0.0
256,4096,16384,4096,45,0,129.4044,_ZN5aiter42f4gemm_bf16_per1x32Fp4_BpreShuffle_128x512E,4248.35,1361.32,0.0
256,4096,16384,6656,54,0,186.3419,_ZN5aiter42f4gemm_bf16_per1x32Fp4_BpreShuffle_256x256E,4794.16,1086.04,0.0
256,4096,16384,8192,54,0,215.1571,_ZN5aiter42f4gemm_bf16_per1x32Fp4_BpreShuffle_256x256E,5110.27,1013.7,0.0
256,4096,16384,13312,54,0,335.7525,_ZN5aiter42f4gemm_bf16_per1x32Fp4_BpreShuffle_256x256E,5321.5,805.75,0.0
256,4096,16384,16384,54,0,394.8506,_ZN5aiter42f4gemm_bf16_per1x32Fp4_BpreShuffle_256x256E,5569.25,764.82,0.0
256,4096,16384,26624,54,0,626.5094,_ZN5aiter42f4gemm_bf16_per1x32Fp4_BpreShuffle_256x256E,5703.69,649.39,0.0
256,4096,16384,53248,54,0,1240.1583,_ZN5aiter42f4gemm_bf16_per1x32Fp4_BpreShuffle_256x256E,5762.83,547.9,0.0
256,4096,18432,7168,54,0,235.4389,_ZN5aiter42f4gemm_bf16_per1x32Fp4_BpreShuffle_256x256E,4597.08,984.27,0.0
256,4096,20480,16384,54,0,506.1778,_ZN5aiter42f4gemm_bf16_per1x32Fp4_BpreShuffle_256x256E,5430.46,729.19,0.0
256,4096,24576,1536,45,0,106.1324,_ZN5aiter42f4gemm_bf16_per1x32Fp4_BpreShuffle_128x512E,2913.7,2104.42,0.0
256,4096,26624,16384,54,0,656.538,_ZN5aiter42f4gemm_bf16_per1x32Fp4_BpreShuffle_256x256E,5442.81,715.51,0.0
256,4096,28672,4096,54,0,220.5013,_ZN5aiter42f4gemm_bf16_per1x32Fp4_BpreShuffle_256x256E,4363.12,1369.56,0.0
256,4096,32768,512,36,0,90.4435,_ZN5aiter42f4gemm_bf16_per1x32Fp4_BpreShuffle_64x1024E,1519.61,3072.33,0.0
256,4096,51200,5120,54,0,478.3978,_ZN5aiter42f4gemm_bf16_per1x32Fp4_BpreShuffle_256x256E,4488.91,1172.64,0.0
256,4096,53248,16384,54,0,1300.5576,_ZN5aiter42f4gemm_bf16_per1x32Fp4_BpreShuffle_256x256E,5495.2,696.6,0.0
256,4096,57344,8192,54,0,744.0942,_ZN5aiter42f4gemm_bf16_per1x32Fp4_BpreShuffle_256x256E,5171.78,969.53,0.0
256,4096,59136,8192,54,0,791.8357,_ZN5aiter42f4gemm_bf16_per1x32Fp4_BpreShuffle_256x256E,5011.83,938.88,0.0
256,4096,106496,16384,54,0,2568.3523,_ZN5aiter42f4gemm_bf16_per1x32Fp4_BpreShuffle_256x256E,5565.3,692.42,0.0
256,4224,4096,768,38,0,19.9861,_ZN5aiter41f4gemm_bf16_per1x32Fp4_BpreShuffle_96x256E,1329.68,1891.21,0.0
256,4736,44416,17920,54,0,1389.8884,_ZN5aiter42f4gemm_bf16_per1x32Fp4_BpreShuffle_256x256E,5424.24,619.55,0.0029
256,4992,4864,7168,50,0,96.904,_ZN5aiter42f4gemm_bf16_per1x32Fp4_BpreShuffle_192x256E,3592.15,865.66,0.0
256,5120,14336,8192,54,0,256.5179,_ZN5aiter42f4gemm_bf16_per1x32Fp4_BpreShuffle_256x256E,4688.14,882.95,0.0
256,5504,6144,5376,50,0,102.785,_ZN5aiter42f4gemm_bf16_per1x32Fp4_BpreShuffle_192x256E,3537.44,962.62,0.0
256,6016,4864,7168,54,0,106.812,_ZN5aiter42f4gemm_bf16_per1x32Fp4_BpreShuffle_256x256E,3927.44,912.98,0.0
256,6144,14336,8192,54,0,308.834,_ZN5aiter42f4gemm_bf16_per1x32Fp4_BpreShuffle_256x256E,4672.77,842.03,0.0
256,6272,2688,68096,47,0,535.6359,_ZN5aiter42f4gemm_bf16_per1x32Fp4_BpreShuffle_160x256E,4286.64,632.5,0.0
256,6528,7040,5632,54,0,128.2402,_ZN5aiter42f4gemm_bf16_per1x32Fp4_BpreShuffle_256x256E,4036.65,1014.67,0.0088
256,6656,2560,3328,47,0,44.3137,_ZN5aiter42f4gemm_bf16_per1x32Fp4_BpreShuffle_160x256E,2559.34,1115.1,0.0
256,7040,896,1280,43,0,11.9928,_ZN5aiter42f4gemm_bf16_per1x32Fp4_BpreShuffle_128x256E,1346.48,1475.45,0.0
256,7168,6272,5888,54,0,139.2251,_ZN5aiter42f4gemm_bf16_per1x32Fp4_BpreShuffle_256x256E,3802.63,930.02,0.0019
256,7680,14336,8192,54,0,371.2804,_ZN5aiter42f4gemm_bf16_per1x32Fp4_BpreShuffle_256x256E,4858.56,835.97,0.0
256,7808,5120,7168,54,0,141.1399,_ZN5aiter42f4gemm_bf16_per1x32Fp4_BpreShuffle_256x256E,4060.58,894.77,0.0
256,7808,7040,5376,54,0,150.5516,_ZN5aiter42f4gemm_bf16_per1x32Fp4_BpreShuffle_256x256E,3925.69,995.33,0.0112
256,8192,512,4096,42,0,16.4152,_ZN5aiter42f4gemm_bf16_per1x32Fp4_BpreShuffle_128x128E,2093.17,1596.96,0.0
256,8192,512,7168,1,0,37.1971,a4w4_blockscale_256x64x256x128_16x16_16x16_8x32x1_8x32x1_1x32x1x8_8_2x2_intrawave_v3,1616.51,1064.16,0.0
256,8192,800,5120,21,0,41.7607,_ZN5aiter42f4gemm_bf16_per1x32Fp4_BpreShuffle_128x512E,1606.99,865.09,0.0
256,8192,1024,3072,43,0,20.267,_ZN5aiter42f4gemm_bf16_per1x32Fp4_BpreShuffle_128x256E,2543.03,1526.27,0.0
256,8192,1280,8192,50,0,51.423,_ZN5aiter42f4gemm_bf16_per1x32Fp4_BpreShuffle_192x256E,3340.89,1162.3,0.0
256,8192,1536,7168,44,0,48.906,_ZN5aiter42f4gemm_bf16_per1x32Fp4_BpreShuffle_128x384E,3688.48,1227.48,0.0
256,8192,2048,6144,54,0,55.3677,_ZN5aiter42f4gemm_bf16_per1x32Fp4_BpreShuffle_256x256E,3723.44,1174.18,0.0
256,8192,2304,16384,47,0,151.5138,_ZN5aiter42f4gemm_bf16_per1x32Fp4_BpreShuffle_160x256E,4081.97,816.64,0.0
256,8192,2560,8192,50,0,96.5366,_ZN5aiter42f4gemm_bf16_per1x32Fp4_BpreShuffle_192x256E,3559.24,890.68,0.0
256,8192,3072,1536,10,0,50.2556,a4w4_blockscale_256x128x384x128_16x16_16x16_8x32x1_8x32x1_1x32x1x8_8_2x2_intrawave_v3,1538.32,1173.65,0.0
256,8192,3072,6144,44,0,86.0465,_ZN5aiter42f4gemm_bf16_per1x32Fp4_BpreShuffle_128x384E,3593.84,987.08,0.0
256,8192,4096,4096,54,0,70.1619,_ZN5aiter42f4gemm_bf16_per1x32Fp4_BpreShuffle_256x256E,3917.77,1315.17,0.0
256,8192,4096,8192,54,0,120.7533,_ZN5aiter42f4gemm_bf16_per1x32Fp4_BpreShuffle_256x256E,4552.72,972.57,0.0
256,8192,4096,14336,54,0,189.8393,_ZN5aiter42f4gemm_bf16_per1x32Fp4_BpreShuffle_256x256E,5067.83,817.48,0.0
256,8192,4608,7168,10,0,227.7773,a4w4_blockscale_256x128x384x128_16x16_16x16_8x32x1_8x32x1_1x32x1x8_8_2x2_intrawave_v3,2375.86,532.86,0.0
256,8192,4608,16384,44,0,262.9408,_ZN5aiter42f4gemm_bf16_per1x32Fp4_BpreShuffle_128x384E,4704.29,685.92,0.0
256,8192,5120,1280,45,0,49.1678,_ZN5aiter42f4gemm_bf16_per1x32Fp4_BpreShuffle_128x512E,2183.83,1879.4,0.0
256,8192,5120,5120,52,0,116.327,_ZN5aiter42f4gemm_bf16_per1x32Fp4_BpreShuffle_224x256E,3692.15,1014.08,0.0
256,8192,5120,6400,54,0,132.8247,_ZN5aiter42f4gemm_bf16_per1x32Fp4_BpreShuffle_256x256E,4041.95,952.27,0.0
256,8192,5120,25600,52,0,429.3911,_ZN5aiter42f4gemm_bf16_per1x32Fp4_BpreShuffle_224x256E,5001.23,592.19,0.0
256,8192,6144,3072,54,0,87.9918,_ZN5aiter42f4gemm_bf16_per1x32Fp4_BpreShuffle_256x256E,3514.39,1394.26,0.0
256,8192,6144,4096,45,0,106.5776,_ZN5aiter42f4gemm_bf16_per1x32Fp4_BpreShuffle_128x512E,3868.7,1219.99,0.0
256,8192,6144,12288,54,0,240.4063,_ZN5aiter42f4gemm_bf16_per1x32Fp4_BpreShuffle_256x256E,5145.25,785.1,0.0
256,8192,6144,16384,54,0,308.4804,_ZN5aiter42f4gemm_bf16_per1x32Fp4_BpreShuffle_256x256E,5346.43,707.03,0.0
256,8192,6400,5120,54,0,148.146,_ZN5aiter42f4gemm_bf16_per1x32Fp4_BpreShuffle_256x256E,3623.93,959.95,0.0
256,8192,7168,2048,10,0,135.959,a4w4_blockscale_256x128x384x128_16x16_16x16_8x32x1_8x32x1_1x32x1x8_8_2x2_intrawave_v3,1769.05,979.48,0.0
256,8192,7168,2304,10,0,145.1712,a4w4_blockscale_256x128x384x128_16x16_16x16_8x32x1_8x32x1_1x32x1x8_8_2x2_intrawave_v3,1863.89,930.87,0.0
256,8192,7168,8192,54,0,210.4687,_ZN5aiter42f4gemm_bf16_per1x32Fp4_BpreShuffle_256x256E,4571.1,856.92,0.0
256,8192,7168,16384,54,0,376.4758,_ZN5aiter42f4gemm_bf16_per1x32Fp4_BpreShuffle_256x256E,5110.94,646.18,0.0
256,8192,7168,18432,54,0,419.0895,_ZN5aiter42f4gemm_bf16_per1x32Fp4_BpreShuffle_256x256E,5165.16,618.0,0.0
256,8192,8192,1024,54,0,55.9419,_ZN5aiter42f4gemm_bf16_per1x32Fp4_BpreShuffle_256x256E,2456.82,2549.19,0.0
256,8192,8192,2048,54,0,84.2984,_ZN5aiter42f4gemm_bf16_per1x32Fp4_BpreShuffle_256x256E,3260.77,1791.2,0.0
256,8192,8192,3584,54,0,119.4879,_ZN5aiter42f4gemm_bf16_per1x32Fp4_BpreShuffle_256x256E,4025.82,1368.99,0.0
256,8192,8192,4096,54,0,129.4913,_ZN5aiter42f4gemm_bf16_per1x32Fp4_BpreShuffle_256x256E,4245.5,1295.62,0.0
256,8192,8192,7168,54,0,197.8445,_ZN5aiter42f4gemm_bf16_per1x32Fp4_BpreShuffle_256x256E,4862.77,975.2,0.0
256,8192,8192,8192,54,0,216.0155,_ZN5aiter42f4gemm_bf16_per1x32Fp4_BpreShuffle_256x256E,5089.97,932.0,0.0
256,8192,8192,28672,54,0,668.518,_ZN5aiter42f4gemm_bf16_per1x32Fp4_BpreShuffle_256x256E,5756.45,552.11,0.0
256,8192,9216,16384,54,0,475.0672,_ZN5aiter42f4gemm_bf16_per1x32Fp4_BpreShuffle_256x256E,5207.48,618.02,0.0
256,8192,10240,8192,45,0,277.173,_ZN5aiter42f4gemm_bf16_per1x32Fp4_BpreShuffle_128x512E,4958.6,877.68,0.0
256,8192,12288,512,45,0,66.5444,_ZN5aiter42f4gemm_bf16_per1x32Fp4_BpreShuffle_128x512E,1549.03,3104.24,0.0
256,8192,12288,1536,45,0,107.0387,_ZN5aiter42f4gemm_bf16_per1x32Fp4_BpreShuffle_128x512E,2889.03,2027.82,0.0
256,8192,12288,4096,45,0,190.4456,_ZN5aiter42f4gemm_bf16_per1x32Fp4_BpreShuffle_128x512E,4330.02,1277.37,0.0
256,8192,12288,6144,45,0,258.7637,_ZN5aiter42f4gemm_bf16_per1x32Fp4_BpreShuffle_128x512E,4780.23,1021.17,0.0
256,8192,12800,5120,54,0,257.7219,_ZN5aiter42f4gemm_bf16_per1x32Fp4_BpreShuffle_256x256E,4166.28,1022.24,0.0
256,8192,13312,16384,54,0,671.4716,_ZN5aiter42f4gemm_bf16_per1x32Fp4_BpreShuffle_256x256E,5321.76,587.16,0.0
256,8192,14336,8192,54,0,387.4984,_ZN5aiter42f4gemm_bf16_per1x32Fp4_BpreShuffle_256x256E,4965.56,844.28,0.0
256,8192,16384,512,54,0,86.6263,_ZN5aiter42f4gemm_bf16_per1x32Fp4_BpreShuffle_256x256E,1586.57,3171.4,0.0
256,8192,16384,2048,45,0,155.4501,_ZN5aiter42f4gemm_bf16_per1x32Fp4_BpreShuffle_128x512E,3536.54,1888.72,0.0
256,8192,16384,4096,54,0,242.0538,_ZN5aiter42f4gemm_bf16_per1x32Fp4_BpreShuffle_256x256E,4542.43,1316.93,0.0
256,8192,16384,6656,54,0,366.2828,_ZN5aiter42f4gemm_bf16_per1x32Fp4_BpreShuffle_256x256E,4877.94,956.16,0.0
256,8192,16384,8192,54,0,425.1217,_ZN5aiter42f4gemm_bf16_per1x32Fp4_BpreShuffle_256x256E,5172.69,868.22,0.0
256,8192,16384,13312,54,0,657.0434,_ZN5aiter42f4gemm_bf16_per1x32Fp4_BpreShuffle_256x256E,5438.63,657.51,0.0
256,8192,16384,16384,54,0,786.0032,_ZN5aiter42f4gemm_bf16_per1x32Fp4_BpreShuffle_256x256E,5595.46,597.66,0.0
256,8192,16384,26624,54,0,1246.495,_ZN5aiter42f4gemm_bf16_per1x32Fp4_BpreShuffle_256x256E,5733.54,477.81,0.0
256,8192,16384,53248,54,0,2463.2448,_ZN5aiter42f4gemm_bf16_per1x32Fp4_BpreShuffle_256x256E,5802.77,374.61,0.0
256,8192,18432,7168,54,0,435.3143,_ZN5aiter42f4gemm_bf16_per1x32Fp4_BpreShuffle_256x256E,4972.65,912.93,0.0
256,8192,20480,16384,54,0,982.1553,_ZN5aiter42f4gemm_bf16_per1x32Fp4_BpreShuffle_256x256E,5597.44,580.79,0.0
256,8192,24576,1536,45,0,208.6912,_ZN5aiter42f4gemm_bf16_per1x32Fp4_BpreShuffle_128x512E,2963.59,2050.01,0.0
256,8192,26624,16384,54,0,1399.3116,_ZN5aiter42f4gemm_bf16_per1x32Fp4_BpreShuffle_256x256E,5107.39,515.55,0.0
256,8192,28672,4096,54,0,433.7855,_ZN5aiter42f4gemm_bf16_per1x32Fp4_BpreShuffle_256x256E,4435.71,1256.98,0.0
256,8192,32768,512,36,0,172.7725,_ZN5aiter42f4gemm_bf16_per1x32Fp4_BpreShuffle_64x1024E,1590.98,3168.08,0.0
256,8192,51200,5120,54,0,926.9073,_ZN5aiter42f4gemm_bf16_per1x32Fp4_BpreShuffle_256x256E,4633.65,1069.04,0.0
256,8192,53248,16384,54,0,2561.6588,_ZN5aiter42f4gemm_bf16_per1x32Fp4_BpreShuffle_256x256E,5579.84,537.05,0.0
256,8192,57344,8192,54,0,1433.2252,_ZN5aiter42f4gemm_bf16_per1x32Fp4_BpreShuffle_256x256E,5370.11,842.83,0.0
256,8192,59136,8192,54,0,1525.5281,_ZN5aiter42f4gemm_bf16_per1x32Fp4_BpreShuffle_256x256E,5202.85,815.89,0.0
256,8192,106496,16384,54,0,5127.9293,_ZN5aiter42f4gemm_bf16_per1x32Fp4_BpreShuffle_256x256E,5574.82,523.48,0.0
256,9984,15360,13824,54,0,814.223,_ZN5aiter42f4gemm_bf16_per1x32Fp4_BpreShuffle_256x256E,5207.34,591.84,0.0
256,12416,8960,15360,54,0,651.6207,_ZN5aiter42f4gemm_bf16_per1x32Fp4_BpreShuffle_256x256E,5244.64,593.39,0.0
256,12416,11136,12544,54,0,686.4753,_ZN5aiter42f4gemm_bf16_per1x32Fp4_BpreShuffle_256x256E,5053.03,618.01,0.0115
256,12800,9344,12800,54,0,611.4549,_ZN5aiter42f4gemm_bf16_per1x32Fp4_BpreShuffle_256x256E,5007.47,622.99,0.0137
256,13056,43392,1792,54,0,607.1164,_ZN5aiter42f4gemm_bf16_per1x32Fp4_BpreShuffle_256x256E,3344.38,1949.59,0.0029
256,13568,13312,10240,54,0,733.9988,_ZN5aiter42f4gemm_bf16_per1x32Fp4_BpreShuffle_256x256E,5039.57,679.65,0.0
256,14720,13568,8704,54,0,727.3392,_ZN5aiter42f4gemm_bf16_per1x32Fp4_BpreShuffle_256x256E,4780.08,718.44,0.0
256,16384,512,4096,43,0,24.3647,_ZN5aiter42f4gemm_bf16_per1x32Fp4_BpreShuffle_128x256E,2820.45,2108.8,0.0
256,16384,512,7168,9,0,60.4461,a4w4_blockscale_256x128x256x128_16x16_16x16_8x32x1_8x32x1_1x32x1x8_8_2x2_intrawave_v3,1989.53,1279.36,0.0
256,16384,800,5120,21,0,48.5545,_ZN5aiter42f4gemm_bf16_per1x32Fp4_BpreShuffle_128x512E,2764.27,1445.91,0.0
256,16384,1024,3072,45,0,33.1376,_ZN5aiter42f4gemm_bf16_per1x32Fp4_BpreShuffle_128x512E,3110.64,1819.48,0.0
256,16384,1280,8192,50,0,98.537,_ZN5aiter42f4gemm_bf16_per1x32Fp4_BpreShuffle_192x256E,3486.99,1159.92,0.0
256,16384,1536,7168,44,0,94.2122,_ZN5aiter42f4gemm_bf16_per1x32Fp4_BpreShuffle_128x384E,3829.41,1215.95,0.0
256,16384,2048,6144,45,0,102.2609,_ZN5aiter42f4gemm_bf16_per1x32Fp4_BpreShuffle_128x512E,4032.01,1209.96,0.0
256,16384,2304,16384,44,0,264.3801,_ZN5aiter42f4gemm_bf16_per1x32Fp4_BpreShuffle_128x384E,4678.68,864.62,0.0
256,16384,2560,8192,45,0,164.9847,_ZN5aiter42f4gemm_bf16_per1x32Fp4_BpreShuffle_128x512E,4165.2,978.76,0.0
256,16384,3072,1536,10,0,97.6538,a4w4_blockscale_256x128x384x128_16x16_16x16_8x32x1_8x32x1_1x32x1x8_8_2x2_intrawave_v3,1583.34,1183.83,0.0
256,16384,3072,6144,54,0,141.9524,_ZN5aiter42f4gemm_bf16_per1x32Fp4_BpreShuffle_256x256E,4356.92,1130.18,0.0
256,16384,4096,4096,54,0,132.0097,_ZN5aiter42f4gemm_bf16_per1x32Fp4_BpreShuffle_256x256E,4164.51,1334.45,0.0
256,16384,4096,8192,54,0,226.9404,_ZN5aiter42f4gemm_bf16_per1x32Fp4_BpreShuffle_256x256E,4844.94,961.06,0.0
256,16384,4096,14336,54,0,363.6314,_ZN5aiter42f4gemm_bf16_per1x32Fp4_BpreShuffle_256x256E,5291.47,772.81,0.0
256,16384,4608,7168,10,0,454.2569,a4w4_blockscale_256x128x384x128_16x16_16x16_8x32x1_8x32x1_1x32x1x8_8_2x2_intrawave_v3,2382.64,498.02,0.0
256,16384,4608,16384,54,0,486.8838,_ZN5aiter42f4gemm_bf16_per1x32Fp4_BpreShuffle_256x256E,5081.09,663.32,0.0
256,16384,5120,1280,45,0,84.5625,_ZN5aiter42f4gemm_bf16_per1x32Fp4_BpreShuffle_128x512E,2539.52,2146.75,0.0
256,16384,5120,5120,45,0,200.0472,_ZN5aiter42f4gemm_bf16_per1x32Fp4_BpreShuffle_128x512E,4293.95,1113.85,0.0
256,16384,5120,6400,54,0,234.6066,_ZN5aiter42f4gemm_bf16_per1x32Fp4_BpreShuffle_256x256E,4576.78,1008.43,0.0
256,16384,5120,25600,54,0,815.9065,_ZN5aiter42f4gemm_bf16_per1x32Fp4_BpreShuffle_256x256E,5264.04,542.98,0.0
256,16384,6144,3072,45,0,161.8127,_ZN5aiter42f4gemm_bf16_per1x32Fp4_BpreShuffle_128x512E,3822.17,1458.04,0.0
256,16384,6144,4096,54,0,193.6462,_ZN5aiter42f4gemm_bf16_per1x32Fp4_BpreShuffle_256x256E,4258.46,1277.92,0.0
256,16384,6144,12288,54,0,467.7627,_ZN5aiter42f4gemm_bf16_per1x32Fp4_BpreShuffle_256x256E,5288.8,726.31,0.0
256,16384,6144,16384,54,0,600.1017,_ZN5aiter42f4gemm_bf16_per1x32Fp4_BpreShuffle_256x256E,5496.63,643.02,0.0
256,16384,6400,5120,45,0,268.7424,_ZN5aiter42f4gemm_bf16_per1x32Fp4_BpreShuffle_128x512E,3995.43,997.39,0.012499047
256,16384,7168,2048,10,0,269.441,a4w4_blockscale_256x128x384x128_16x16_16x16_8x32x1_8x32x1_1x32x1x8_8_2x2_intrawave_v3,1785.31,961.24,0.0
256,16384,7168,2304,10,0,288.9433,a4w4_blockscale_256x128x384x128_16x16_16x16_8x32x1_8x32x1_1x32x1x8_8_2x2_intrawave_v3,1872.91,906.8,0.0
256,16384,7168,8192,54,0,383.7231,_ZN5aiter42f4gemm_bf16_per1x32Fp4_BpreShuffle_256x256E,5014.41,863.51,0.0
256,16384,7168,16384,54,0,703.6728,_ZN5aiter42f4gemm_bf16_per1x32Fp4_BpreShuffle_256x256E,5468.86,607.98,0.0
256,16384,7168,18432,54,0,791.4978,_ZN5aiter42f4gemm_bf16_per1x32Fp4_BpreShuffle_256x256E,5469.79,570.99,0.0
256,16384,8192,1024,54,0,107.806,_ZN5aiter42f4gemm_bf16_per1x32Fp4_BpreShuffle_256x256E,2549.75,2606.7,0.0
256,16384,8192,2048,54,0,159.5154,_ZN5aiter42f4gemm_bf16_per1x32Fp4_BpreShuffle_256x256E,3446.41,1840.58,0.0
256,16384,8192,3584,54,0,233.3336,_ZN5aiter42f4gemm_bf16_per1x32Fp4_BpreShuffle_256x256E,4123.16,1339.18,0.0
256,16384,8192,4096,54,0,254.4673,_ZN5aiter42f4gemm_bf16_per1x32Fp4_BpreShuffle_256x256E,4320.84,1252.68,0.0
256,16384,8192,7168,54,0,398.3153,_ZN5aiter42f4gemm_bf16_per1x32Fp4_BpreShuffle_256x256E,4830.71,895.06,0.0
256,16384,8192,8192,54,0,429.289,_ZN5aiter42f4gemm_bf16_per1x32Fp4_BpreShuffle_256x256E,5122.48,859.79,0.0
256,16384,8192,28672,54,0,1325.5902,_ZN5aiter42f4gemm_bf16_per1x32Fp4_BpreShuffle_256x256E,5806.15,468.29,0.0
256,16384,9216,16384,54,0,901.7683,_ZN5aiter42f4gemm_bf16_per1x32Fp4_BpreShuffle_256x256E,5486.78,567.45,0.0
256,16384,10240,8192,54,0,544.3326,_ZN5aiter42f4gemm_bf16_per1x32Fp4_BpreShuffle_256x256E,5049.82,816.77,0.0
256,16384,12288,512,45,0,125.1737,_ZN5aiter42f4gemm_bf16_per1x32Fp4_BpreShuffle_128x512E,1646.98,3275.39,0.0
256,16384,12288,1536,45,0,206.8407,_ZN5aiter42f4gemm_bf16_per1x32Fp4_BpreShuffle_128x512E,2990.1,2053.14,0.0
256,16384,12288,4096,45,0,370.0402,_ZN5aiter42f4gemm_bf16_per1x32Fp4_BpreShuffle_128x512E,4457.0,1246.82,0.0
256,16384,12288,6144,54,0,509.7273,_ZN5aiter42f4gemm_bf16_per1x32Fp4_BpreShuffle_256x256E,4853.38,962.74,0.0
256,16384,12800,5120,54,0,486.651,_ZN5aiter42f4gemm_bf16_per1x32Fp4_BpreShuffle_256x256E,4412.78,1015.39,0.0
256,16384,13312,16384,54,0,1289.7301,_ZN5aiter42f4gemm_bf16_per1x32Fp4_BpreShuffle_256x256E,5541.33,526.84,0.0
256,16384,14336,8192,54,0,757.6926,_ZN5aiter42f4gemm_bf16_per1x32Fp4_BpreShuffle_256x256E,5078.96,786.06,0.0
256,16384,16384,512,54,0,156.2988,_ZN5aiter42f4gemm_bf16_per1x32Fp4_BpreShuffle_256x256E,1758.67,3488.57,0.0
256,16384,16384,2048,54,0,303.603,_ZN5aiter42f4gemm_bf16_per1x32Fp4_BpreShuffle_256x256E,3621.54,1878.85,0.0
256,16384,16384,4096,54,0,478.5568,_ZN5aiter42f4gemm_bf16_per1x32Fp4_BpreShuffle_256x256E,4595.11,1262.09,0.0
256,16384,16384,6656,54,0,721.8789,_ZN5aiter42f4gemm_bf16_per1x32Fp4_BpreShuffle_256x256E,4950.16,894.78,0.0
256,16384,16384,8192,54,0,832.934,_ZN5aiter42f4gemm_bf16_per1x32Fp4_BpreShuffle_256x256E,5280.19,805.69,0.0
256,16384,16384,13312,54,0,1296.2628,_ZN5aiter42f4gemm_bf16_per1x32Fp4_BpreShuffle_256x256E,5513.41,582.42,0.0
256,16384,16384,16384,54,0,1563.1208,_ZN5aiter42f4gemm_bf16_per1x32Fp4_BpreShuffle_256x256E,5627.26,515.19,0.0
256,16384,16384,26624,54,0,2485.1392,_ZN5aiter42f4gemm_bf16_per1x32Fp4_BpreShuffle_256x256E,5751.65,391.56,0.0
256,16384,16384,53248,54,0,5103.8959,_ZN5aiter42f4gemm_bf16_per1x32Fp4_BpreShuffle_256x256E,5601.07,276.12,0.0
256,16384,18432,7168,54,0,862.0836,_ZN5aiter42f4gemm_bf16_per1x32Fp4_BpreShuffle_256x256E,5021.93,845.35,0.0
256,16384,18432,16384,10,0,4031.1796,a4w4_blockscale_256x128x384x128_16x16_16x16_8x32x1_8x32x1_1x32x1x8_8_2x2_intrawave_v3,2454.77,220.58,0.0
256,16384,20480,16384,45,0,1960.3005,_ZN5aiter42f4gemm_bf16_per1x32Fp4_BpreShuffle_128x512E,5608.89,496.39,0.0
256,16384,24576,1536,45,0,399.9546,_ZN5aiter42f4gemm_bf16_per1x32Fp4_BpreShuffle_128x512E,3092.73,2092.15,0.0
256,16384,26624,16384,54,0,2587.5139,_ZN5aiter42f4gemm_bf16_per1x32Fp4_BpreShuffle_256x256E,5524.09,473.33,0.0
256,16384,28672,4096,54,0,861.417,_ZN5aiter42f4gemm_bf16_per1x32Fp4_BpreShuffle_256x256E,4467.4,1197.79,0.0
256,16384,32768,512,36,0,345.2436,_ZN5aiter42f4gemm_bf16_per1x32Fp4_BpreShuffle_64x1024E,1592.37,3146.55,0.0
256,16384,51200,5120,54,0,1983.796,_ZN5aiter42f4gemm_bf16_per1x32Fp4_BpreShuffle_256x256E,4330.05,932.93,0.0
256,16384,53248,16384,54,0,5172.8223,_ZN5aiter42f4gemm_bf16_per1x32Fp4_BpreShuffle_256x256E,5526.44,447.58,0.0
256,16384,57344,8192,54,0,2953.8423,_ZN5aiter42f4gemm_bf16_per1x32Fp4_BpreShuffle_256x256E,5211.23,738.37,0.0
256,16384,59136,8192,54,0,3103.1713,_ZN5aiter42f4gemm_bf16_per1x32Fp4_BpreShuffle_256x256E,5115.48,724.13,0.0
256,16384,106496,16384,54,0,10335.4736,_ZN5aiter42f4gemm_bf16_per1x32Fp4_BpreShuffle_256x256E,5531.88,435.04,0.0
256,16896,31104,7168,54,0,1565.4111,_ZN5aiter42f4gemm_bf16_per1x32Fp4_BpreShuffle_256x256E,4812.82,781.33,0.0041
256,20480,512,7168,7,0,72.5979,a4w4_blockscale_256x96x512x128_16x16_16x16_8x32x1_8x32x1_1x32x1x8_8_2x2_intrawave_v3,2070.64,1325.2,0.0
256,20480,1536,7168,10,0,199.649,a4w4_blockscale_256x128x384x128_16x16_16x16_8x32x1_8x32x1_1x32x1x8_8_2x2_intrawave_v3,2258.82,710.35,0.0
256,20480,3072,1536,10,0,118.3924,a4w4_blockscale_256x128x384x128_16x16_16x16_8x32x1_8x32x1_1x32x1x8_8_2x2_intrawave_v3,1632.48,1215.59,0.0
256,20480,4608,7168,10,0,572.5215,a4w4_blockscale_256x128x384x128_16x16_16x16_8x32x1_8x32x1_1x32x1x8_8_2x2_intrawave_v3,2363.08,486.72,0.0
256,20480,7168,2048,10,0,333.465,a4w4_blockscale_256x128x384x128_16x16_16x16_8x32x1_8x32x1_1x32x1x8_8_2x2_intrawave_v3,1803.17,965.36,0.0
256,20480,7168,2304,10,0,355.0349,a4w4_blockscale_256x128x384x128_16x16_16x16_8x32x1_8x32x1_1x32x1x8_8_2x2_intrawave_v3,1905.33,916.68,0.0
256,22784,1664,61696,52,0,1024.4489,_ZN5aiter42f4gemm_bf16_per1x32Fp4_BpreShuffle_224x256E,4566.46,810.19,0.0226
256,24192,32384,2304,45,0,1001.4336,_ZN5aiter42f4gemm_bf16_per1x32Fp4_BpreShuffle_128x512E,3604.89,1629.71,0.0043
256,32768,1024,3072,45,0,61.3382,_ZN5aiter42f4gemm_bf16_per1x32Fp4_BpreShuffle_128x512E,3361.01,1940.28,0.0
256,32768,1280,8192,54,0,167.5074,_ZN5aiter42f4gemm_bf16_per1x32Fp4_BpreShuffle_256x256E,4102.47,1333.35,0.0
256,32768,1536,7168,45,0,162.1303,_ZN5aiter42f4gemm_bf16_per1x32Fp4_BpreShuffle_128x512E,4450.46,1379.19,0.0
256,32768,2048,6144,45,0,190.7134,_ZN5aiter42f4gemm_bf16_per1x32Fp4_BpreShuffle_128x512E,4323.94,1264.58,0.0
256,32768,2112,7168,48,0,293.0219,_ZN5aiter42f4gemm_bf16_per1x32Fp4_BpreShuffle_160x384E,3385.88,898.98,0.0
256,32768,2304,16384,48,0,505.9259,_ZN5aiter42f4gemm_bf16_per1x32Fp4_BpreShuffle_160x384E,4889.85,866.34,0.0
256,32768,2560,8192,54,0,293.3453,_ZN5aiter42f4gemm_bf16_per1x32Fp4_BpreShuffle_256x256E,4685.23,1065.21,0.0
256,32768,3072,6144,45,0,272.8936,_ZN5aiter42f4gemm_bf16_per1x32Fp4_BpreShuffle_128x512E,4532.72,1141.2,0.0
256,32768,4096,4096,54,0,255.6975,_ZN5aiter42f4gemm_bf16_per1x32Fp4_BpreShuffle_256x256E,4300.05,1345.08,0.0
256,32768,4096,8192,54,0,444.8527,_ZN5aiter42f4gemm_bf16_per1x32Fp4_BpreShuffle_256x256E,4943.26,942.85,0.0
256,32768,4096,14336,54,0,721.3297,_ZN5aiter42f4gemm_bf16_per1x32Fp4_BpreShuffle_256x256E,5335.0,738.46,0.0
256,32768,4608,16384,54,0,906.1081,_ZN5aiter42f4gemm_bf16_per1x32Fp4_BpreShuffle_256x256E,5460.5,671.19,0.0
256,32768,5120,1280,45,0,163.3916,_ZN5aiter42f4gemm_bf16_per1x32Fp4_BpreShuffle_128x512E,2628.63,2202.03,0.0
256,32768,5120,5120,45,0,392.6814,_ZN5aiter42f4gemm_bf16_per1x32Fp4_BpreShuffle_128x512E,4375.01,1101.5,0.0
256,32768,5120,6400,54,0,457.7773,_ZN5aiter42f4gemm_bf16_per1x32Fp4_BpreShuffle_256x256E,4691.11,997.83,0.0
256,32768,5120,25600,54,0,1545.9348,_ZN5aiter42f4gemm_bf16_per1x32Fp4_BpreShuffle_256x256E,5556.47,530.75,0.0
256,32768,6144,3072,54,0,315.1874,_ZN5aiter42f4gemm_bf16_per1x32Fp4_BpreShuffle_256x256E,3924.49,1467.13,0.0
256,32768,6144,4096,54,0,377.8643,_ZN5aiter42f4gemm_bf16_per1x32Fp4_BpreShuffle_256x256E,4364.71,1276.5,0.0
256,32768,6144,12288,54,0,933.4489,_ZN5aiter42f4gemm_bf16_per1x32Fp4_BpreShuffle_256x256E,5300.56,687.48,0.0
256,32768,6144,16384,54,0,1198.9958,_ZN5aiter42f4gemm_bf16_per1x32Fp4_BpreShuffle_256x256E,5502.16,601.69,0.0
256,32768,6400,5120,45,0,518.2698,_ZN5aiter42f4gemm_bf16_per1x32Fp4_BpreShuffle_128x512E,4143.56,1002.76,0.016083188
256,32768,7168,8192,54,0,763.9579,_ZN5aiter42f4gemm_bf16_per1x32Fp4_BpreShuffle_256x256E,5037.31,829.02,0.0
256,32768,7168,16384,54,0,1414.8817,_ZN5aiter42f4gemm_bf16_per1x32Fp4_BpreShuffle_256x256E,5439.73,563.24,0.0
256,32768,7168,18432,54,0,1586.5235,_ZN5aiter42f4gemm_bf16_per1x32Fp4_BpreShuffle_256x256E,5457.63,528.08,0.0
256,32768,8192,1024,54,0,211.6275,_ZN5aiter42f4gemm_bf16_per1x32Fp4_BpreShuffle_256x256E,2597.75,2635.96,0.0
256,32768,8192,2048,45,0,315.6601,_ZN5aiter42f4gemm_bf16_per1x32Fp4_BpreShuffle_128x512E,3483.21,1833.66,0.0
256,32768,8192,3584,54,0,464.7093,_ZN5aiter42f4gemm_bf16_per1x32Fp4_BpreShuffle_256x256E,4140.54,1313.23,0.0
256,32768,8192,4096,54,0,483.3855,_ZN5aiter42f4gemm_bf16_per1x32Fp4_BpreShuffle_256x256E,4549.21,1284.19,0.0
256,32768,8192,7168,54,0,782.3144,_ZN5aiter42f4gemm_bf16_per1x32Fp4_BpreShuffle_256x256E,4919.11,873.91,0.0
256,32768,8192,8192,54,0,843.7771,_ZN5aiter42f4gemm_bf16_per1x32Fp4_BpreShuffle_256x256E,5212.33,835.11,0.0
256,32768,8192,28672,54,0,2654.9427,_ZN5aiter42f4gemm_bf16_per1x32Fp4_BpreShuffle_256x256E,5797.93,423.39,0.0
256,32768,9216,16384,54,0,1780.1369,_ZN5aiter42f4gemm_bf16_per1x32Fp4_BpreShuffle_256x256E,5558.9,532.49,0.0
256,32768,10240,8192,45,0,1088.4791,_ZN5aiter42f4gemm_bf16_per1x32Fp4_BpreShuffle_128x512E,5050.68,778.38,0.0
256,32768,12288,512,45,0,245.9473,_ZN5aiter42f4gemm_bf16_per1x32Fp4_BpreShuffle_128x512E,1676.44,3321.2,0.0
256,32768,12288,1536,45,0,400.2607,_ZN5aiter42f4gemm_bf16_per1x32Fp4_BpreShuffle_128x512E,3090.36,2098.41,0.0
256,32768,12288,4096,45,0,732.0118,_ZN5aiter42f4gemm_bf16_per1x32Fp4_BpreShuffle_128x512E,4506.12,1226.18,0.0
256,32768,12288,6144,45,0,1020.7607,_ZN5aiter42f4gemm_bf16_per1x32Fp4_BpreShuffle_128x512E,4847.17,924.52,0.0
256,32768,12800,5120,54,0,997.4188,_ZN5aiter42f4gemm_bf16_per1x32Fp4_BpreShuffle_256x256E,4306.08,957.99,0.0
256,32768,13312,16384,54,0,2590.6993,_ZN5aiter42f4gemm_bf16_per1x32Fp4_BpreShuffle_256x256E,5517.29,482.46,0.0
256,32768,14336,8192,54,0,1537.4579,_ZN5aiter42f4gemm_bf16_per1x32Fp4_BpreShuffle_256x256E,5006.04,736.58,0.0
256,32768,16384,512,54,0,319.1351,_ZN5aiter42f4gemm_bf16_per1x32Fp4_BpreShuffle_256x256E,1722.64,3403.97,0.0
256,32768,16384,2048,45,0,593.0636,_ZN5aiter42f4gemm_bf16_per1x32Fp4_BpreShuffle_128x512E,3707.9,1895.37,0.0
256,32768,16384,4096,54,0,958.7045,_ZN5aiter42f4gemm_bf16_per1x32Fp4_BpreShuffle_256x256E,4587.49,1224.99,0.0
256,32768,16384,6656,54,0,1434.6488,_ZN5aiter42f4gemm_bf16_per1x32Fp4_BpreShuffle_256x256E,4981.59,862.45,0.0
256,32768,16384,8192,54,0,1680.4113,_ZN5aiter42f4gemm_bf16_per1x32Fp4_BpreShuffle_256x256E,5234.49,758.78,0.0
256,32768,16384,13312,54,0,2618.0472,_ZN5aiter42f4gemm_bf16_per1x32Fp4_BpreShuffle_256x256E,5459.66,535.09,0.0
256,32768,16384,16384,45,0,3077.3314,_ZN5aiter42f4gemm_bf16_per1x32Fp4_BpreShuffle_128x512E,5716.7,479.76,0.0
256,32768,16384,26624,54,0,4978.7035,_ZN5aiter42f4gemm_bf16_per1x32Fp4_BpreShuffle_256x256E,5741.92,347.09,0.0
256,32768,16384,53248,54,0,9949.223,_ZN5aiter42f4gemm_bf16_per1x32Fp4_BpreShuffle_256x256E,5746.64,239.45,0.0
256,32768,18432,7168,45,0,1748.9945,_ZN5aiter42f4gemm_bf16_per1x32Fp4_BpreShuffle_128x512E,4950.65,795.58,0.0
256,32768,20480,16384,45,0,3960.5471,_ZN5aiter42f4gemm_bf16_per1x32Fp4_BpreShuffle_128x512E,5552.32,449.03,0.0
256,32768,24576,1536,45,0,800.9843,_ZN5aiter42f4gemm_bf16_per1x32Fp4_BpreShuffle_128x512E,3088.58,2065.77,0.0
256,32768,26624,16384,54,0,5494.2956,_ZN5aiter42f4gemm_bf16_per1x32Fp4_BpreShuffle_256x256E,5203.09,406.12,0.0
256,32768,28672,4096,45,0,1707.3148,_ZN5aiter42f4gemm_bf16_per1x32Fp4_BpreShuffle_128x512E,4508.0,1174.29,0.0
256,32768,32768,512,36,0,666.2533,_ZN5aiter42f4gemm_bf16_per1x32Fp4_BpreShuffle_64x1024E,1650.29,3248.41,0.0
256,32768,51200,5120,54,0,4066.2238,_ZN5aiter42f4gemm_bf16_per1x32Fp4_BpreShuffle_256x256E,4225.02,878.06,0.0
256,32768,53248,16384,54,0,10524.9535,_ZN5aiter42f4gemm_bf16_per1x32Fp4_BpreShuffle_256x256E,5432.29,398.51,0.0
256,32768,57344,8192,54,0,6141.7014,_ZN5aiter42f4gemm_bf16_per1x32Fp4_BpreShuffle_256x256E,5012.67,672.0,0.0
256,32768,59136,8192,54,0,6136.6529,_ZN5aiter42f4gemm_bf16_per1x32Fp4_BpreShuffle_256x256E,5173.57,692.88,0.0
256,32768,106496,16384,54,0,20606.9162,_ZN5aiter42f4gemm_bf16_per1x32Fp4_BpreShuffle_256x256E,5549.07,394.05,0.0
256,33280,7168,10752,54,0,999.5708,_ZN5aiter42f4gemm_bf16_per1x32Fp4_BpreShuffle_256x256E,5132.0,694.85,0.0
256,35200,256,19968,50,0,106.6743,_ZN5aiter42f4gemm_bf16_per1x32Fp4_BpreShuffle_192x256E,3373.55,3487.39,0.0
256,48256,61056,5376,45,0,7047.1599,_ZN5aiter42f4gemm_bf16_per1x32Fp4_BpreShuffle_128x512E,4495.26,877.87,0.0052
256,51712,14976,7680,54,0,2503.0596,_ZN5aiter42f4gemm_bf16_per1x32Fp4_BpreShuffle_256x256E,4752.34,721.1,0.0085
256,51968,61696,4608,54,0,6682.8336,_ZN5aiter42f4gemm_bf16_per1x32Fp4_BpreShuffle_256x256E,4421.55,998.73,0.0
256,56832,44416,1280,52,0,2488.2075,_ZN5aiter42f4gemm_bf16_per1x32Fp4_BpreShuffle_224x256E,2597.08,2055.01,0.0029
256,60000,4096,512,54,0,165.0566,_ZN5aiter42f4gemm_bf16_per1x32Fp4_BpreShuffle_256x256E,1524.68,3077.3,0.0
256,64896,1280,60672,54,0,2002.6549,_ZN5aiter42f4gemm_bf16_per1x32Fp4_BpreShuffle_256x256E,5033.15,1085.38,0.0
256,65536,2112,7168,48,0,575.6528,_ZN5aiter42f4gemm_bf16_per1x32Fp4_BpreShuffle_160x384E,3447.0,902.06,0.0
256,65536,16384,8192,54,0,3353.2726,_ZN5aiter42f4gemm_bf16_per1x32Fp4_BpreShuffle_256x256E,5246.27,740.48,0.0
256,168448,3200,6400,54,0,1573.7469,_ZN5aiter42f4gemm_bf16_per1x32Fp4_BpreShuffle_256x256E,4384.21,1034.05,0.0189
256,540544,7552,1024,54,0,3458.7874,_ZN5aiter42f4gemm_bf16_per1x32Fp4_BpreShuffle_256x256E,2417.13,2441.61,0.0082
256,721536,6016,1024,54,0,3558.6675,_ZN5aiter42f4gemm_bf16_per1x32Fp4_BpreShuffle_256x256E,2498.09,2544.22,0.0104
256,838784,5760,3584,45,0,8593.0777,_ZN5aiter42f4gemm_bf16_per1x32Fp4_BpreShuffle_128x512E,4030.16,1300.61,0.031
