aiter/configs/a8w8_tuned_gemm.csv
gfx,cu_num,M,N,K,q_dtype_w,kernelId,splitK,us,kernelName,tflops,bw,errRatio
gfx942,80,1,1280,8192,torch.int8,34,0,20.5611,a8w8_rowwise_256x16x64x512_16x16_1x1_32x8x1_32x8x1_1x16x1x16_4x4x1_1x1_intrawave_v3,1.02,510.5,0.0
gfx942,80,1,8192,1024,torch.int8,78,0,9.1327,a8w8_rowwise_64x16x16x128_16x16_1x1_8x8x1_8x8x1_1x16x1x4_4x4x1_1x1_interwave_v2,1.84,920.43,0.0
gfx942,80,32,1280,8192,torch.int8,34,0,19.9841,a8w8_rowwise_256x16x64x512_16x16_1x1_32x8x1_32x8x1_1x16x1x16_4x4x1_1x1_intrawave_v3,33.58,541.92,0.0
gfx942,80,32,8192,1024,torch.int8,28,0,9.9382,a8w8_rowwise_256x32x128x256_32x32_1x1_16x16x1_16x16x1_1x32x1x8_8x8x1_1x1_intrawave_v3,54.02,900.13,0.0
gfx942,80,64,1280,8192,torch.int8,34,0,19.6589,a8w8_rowwise_256x16x64x512_16x16_1x1_32x8x1_32x8x1_1x16x1x16_4x4x1_1x1_intrawave_v3,68.27,568.39,0.0
gfx942,80,64,8192,1024,torch.int8,21,0,13.6554,a8w8_rowwise_256x64x128x256_32x32_1x2_16x16x1_16x16x1_1x32x1x8_8x8x1_1x1_intrawave_v3,78.63,695.89,0.0
gfx942,80,128,1280,8192,torch.int8,30,0,23.3376,a8w8_rowwise_256x32x64x512_16x16_1x2_32x8x1_32x8x1_1x32x1x8_8x8x1_1x2_intrawave_v3,115.02,508.28,0.0
gfx942,80,128,8192,1024,torch.int8,45,0,20.3684,a8w8_rowwise_256x128x64x128_32x32_2x1_8x32x1_8x32x1_1x32x1x8_8x8x1_1x1_intrawave_v3,105.43,521.24,0.0
gfx942,80,192,1280,8192,torch.int8,23,0,33.0028,a8w8_rowwise_256x64x64x512_32x32_1x1_32x8x1_32x8x1_1x32x1x8_8x8x1_1x1_intrawave_v3,122.01,380.28,0.0
gfx942,80,192,8192,1024,torch.int8,47,0,26.1312,a8w8_rowwise_256x64x64x128_32x32_1x1_8x32x1_8x32x1_1x32x1x8_8x8x1_1x1_intrawave_v3,123.27,448.92,0.0
gfx942,80,256,1280,8192,torch.int8,23,0,33.3204,a8w8_rowwise_256x64x64x512_32x32_1x1_32x8x1_32x8x1_1x32x1x8_8x8x1_1x1_intrawave_v3,161.12,397.3,0.0
gfx942,80,256,8192,1024,torch.int8,13,0,29.7436,a8w8_rowwise_256x128x128x128_32x32_2x2_8x32x1_8x32x1_1x32x1x8_8x8x1_1x1_intrawave_v3,144.4,431.86,0.0
gfx942,80,320,1280,8192,torch.int8,21,0,54.4822,a8w8_rowwise_256x64x128x256_32x32_1x2_16x16x1_16x16x1_1x32x1x8_8x8x1_1x1_intrawave_v3,123.18,255.61,0.0
gfx942,80,320,8192,1024,torch.int8,47,0,39.6412,a8w8_rowwise_256x64x64x128_32x32_1x1_8x32x1_8x32x1_1x32x1x8_8x8x1_1x1_intrawave_v3,135.43,352.14,0.0
gfx942,80,512,1280,8192,torch.int8,21,0,55.0378,a8w8_rowwise_256x64x128x256_32x32_1x2_16x16x1_16x16x1_1x32x1x8_8x8x1_1x1_intrawave_v3,195.09,290.54,0.0
gfx942,80,512,8192,1024,torch.int8,13,0,52.947,a8w8_rowwise_256x128x128x128_32x32_2x2_8x32x1_8x32x1_1x32x1x8_8x8x1_1x1_intrawave_v3,162.24,326.77,0.0
gfx942,80,1024,1280,8192,torch.int8,13,0,88.6516,a8w8_rowwise_256x128x128x128_32x32_2x2_8x32x1_8x32x1_1x32x1x8_8x8x1_1x1_intrawave_v3,242.24,242.48,0.0
gfx942,80,1024,8192,1024,torch.int8,13,0,90.2628,a8w8_rowwise_256x128x128x128_32x32_2x2_8x32x1_8x32x1_1x32x1x8_8x8x1_1x1_intrawave_v3,190.33,290.42,0.0
gfx942,80,2048,1280,8192,torch.int8,13,0,140.7575,a8w8_rowwise_256x128x128x128_32x32_2x2_8x32x1_8x32x1_1x32x1x8_8x8x1_1x1_intrawave_v3,305.13,230.94,0.0
gfx942,80,2048,8192,1024,torch.int8,41,0,165.9552,a8w8_rowwise_256x128x128x128_32x32_2x2_8x32x1_8x32x1_1x32x1x8_8x8x1_1x1_intrawave_v5,207.04,265.37,0.0
gfx942,80,4096,1280,8192,torch.int8,13,0,275.3109,a8w8_rowwise_256x128x128x128_32x32_2x2_8x32x1_8x32x1_1x32x1x8_8x8x1_1x1_intrawave_v3,312.01,198.05,0.0
gfx942,80,4096,8192,1024,torch.int8,13,0,305.9089,a8w8_rowwise_256x128x128x128_32x32_2x2_8x32x1_8x32x1_1x32x1x8_8x8x1_1x1_intrawave_v3,224.64,260.51,0.0
gfx942,80,8192,1280,8192,torch.int8,13,0,545.0371,a8w8_rowwise_256x128x128x128_32x32_2x2_8x32x1_8x32x1_1x32x1x8_8x8x1_1x1_intrawave_v3,315.21,180.84,0.0
gfx942,80,8192,8192,1024,torch.int8,13,0,598.5803,a8w8_rowwise_256x128x128x128_32x32_2x2_8x32x1_8x32x1_1x32x1x8_8x8x1_1x1_intrawave_v3,229.61,252.26,0.0
gfx942,80,16384,1280,8192,torch.int8,13,0,1075.9373,a8w8_rowwise_256x128x128x128_32x32_2x2_8x32x1_8x32x1_1x32x1x8_8x8x1_1x1_intrawave_v3,319.35,173.47,0.0
gfx942,80,16384,8192,1024,torch.int8,13,0,1176.7808,a8w8_rowwise_256x128x128x128_32x32_2x2_8x32x1_8x32x1_1x32x1x8_8x8x1_1x1_intrawave_v3,233.58,249.5,0.0
gfx950,256,1,100,5120,torch.int8,34,0,8.7502,a8w8_rowwise_256x16x64x512_16x16_1x1_32x8x1_32x8x1_1x16x1x16_4x4x1_1x1_intrawave_v3,0.12,59.12,0.0
gfx950,256,1,200,5120,torch.int8,34,0,9.0193,a8w8_rowwise_256x16x64x512_16x16_1x1_32x8x1_32x8x1_1x16x1x16_4x4x1_1x1_intrawave_v3,0.23,114.15,0.0
gfx950,256,1,800,5120,torch.int8,34,0,11.5471,a8w8_rowwise_256x16x64x512_16x16_1x1_32x8x1_32x8x1_1x16x1x16_4x4x1_1x1_intrawave_v3,0.71,355.3,0.0
gfx950,256,1,1280,8192,torch.int8,34,0,17.6914,a8w8_rowwise_256x16x64x512_16x16_1x1_32x8x1_32x8x1_1x16x1x16_4x4x1_1x1_intrawave_v3,1.19,593.31,0.0
gfx950,256,1,1280,8192,torch.float8_e4m3fn,79,3,7.6797,a8w8_rowwise_128x16x32x128_16x16_1x1_8x16x1_8x16x1_1x16x1x8_4x4x1_1x1_interwave_v2,2.73,1366.79,0.1344
gfx950,256,1,2304,16384,torch.int8,34,0,28.7938,a8w8_rowwise_256x16x64x512_16x16_1x1_32x8x1_32x8x1_1x16x1x16_4x4x1_1x1_intrawave_v3,2.62,1311.73,0.0
gfx950,256,1,2560,8192,torch.int8,34,0,17.4658,a8w8_rowwise_256x16x64x512_16x16_1x1_32x8x1_32x8x1_1x16x1x16_4x4x1_1x1_intrawave_v3,2.4,1201.48,0.0
gfx950,256,1,4608,16384,torch.int8,34,0,30.4899,a8w8_rowwise_256x16x64x512_16x16_1x1_32x8x1_32x8x1_1x16x1x16_4x4x1_1x1_intrawave_v3,4.95,2476.99,0.0
gfx950,256,1,5120,640,torch.int8,79,0,4.3227,a8w8_rowwise_128x16x32x128_16x16_1x1_8x16x1_8x16x1_1x16x1x8_4x4x1_1x1_interwave_v2,1.52,760.56,0.0
gfx950,256,1,5120,1280,torch.int8,34,0,6.1049,a8w8_rowwise_256x16x64x512_16x16_1x1_32x8x1_32x8x1_1x16x1x16_4x4x1_1x1_intrawave_v3,2.15,1075.39,0.0
gfx950,256,1,5120,3200,torch.int8,30,0,9.8138,a8w8_rowwise_256x32x64x512_16x16_1x2_32x8x1_32x8x1_1x32x1x8_8x8x1_1x2_intrawave_v3,3.34,1670.86,0.0
gfx950,256,1,5120,5120,torch.int8,34,0,12.3186,a8w8_rowwise_256x16x64x512_16x16_1x1_32x8x1_32x8x1_1x16x1x16_4x4x1_1x1_intrawave_v3,4.26,2129.28,0.0
gfx950,256,1,5120,6400,torch.int8,34,0,14.5779,a8w8_rowwise_256x16x64x512_16x16_1x1_32x8x1_32x8x1_1x16x1x16_4x4x1_1x1_intrawave_v3,4.5,2248.93,0.0
gfx950,256,1,5120,25600,torch.int8,23,0,47.1407,a8w8_rowwise_256x64x64x512_32x32_1x1_32x8x1_32x8x1_1x32x1x8_8x8x1_1x1_intrawave_v3,5.56,2781.2,0.0
gfx950,256,1,6400,5120,torch.int8,34,0,12.7506,a8w8_rowwise_256x16x64x512_16x16_1x1_32x8x1_32x8x1_1x16x1x16_4x4x1_1x1_intrawave_v3,5.14,2571.32,0.0
gfx950,256,1,7168,8192,torch.int8,34,0,19.015,a8w8_rowwise_256x16x64x512_16x16_1x1_32x8x1_32x8x1_1x16x1x16_4x4x1_1x1_intrawave_v3,6.18,3089.29,0.0
gfx950,256,1,8192,1024,torch.int8,79,0,5.7218,a8w8_rowwise_128x16x32x128_16x16_1x1_8x16x1_8x16x1_1x16x1x8_4x4x1_1x1_interwave_v2,2.93,1469.12,0.0
gfx950,256,1,8192,1024,torch.float8_e4m3fn,60,0,6.3982,a8w8_rowwise_128x16x32x128_16x16_1x1_8x16x1_8x16x1_1x16x1x8_4x4x1_1x1_intrawave_v2,2.62,1313.81,0.0
gfx950,256,1,8192,2048,torch.int8,34,0,7.1625,a8w8_rowwise_256x16x64x512_16x16_1x1_32x8x1_32x8x1_1x16x1x16_4x4x1_1x1_intrawave_v3,4.68,2344.94,0.0
gfx950,256,1,8192,3584,torch.int8,34,0,11.2488,a8w8_rowwise_256x16x64x512_16x16_1x1_32x8x1_32x8x1_1x16x1x16_4x4x1_1x1_intrawave_v3,5.22,2611.84,0.0
gfx950,256,1,8192,7168,torch.int8,34,0,16.9371,a8w8_rowwise_256x16x64x512_16x16_1x1_32x8x1_32x8x1_1x16x1x16_4x4x1_1x1_intrawave_v3,6.93,3468.35,0.0
gfx950,256,1,8192,8192,torch.int8,34,0,19.4709,a8w8_rowwise_256x16x64x512_16x16_1x1_32x8x1_32x8x1_1x16x1x16_4x4x1_1x1_intrawave_v3,6.89,3447.89,0.0
gfx950,256,1,8192,28672,torch.int8,34,0,59.8294,a8w8_rowwise_256x16x64x512_16x16_1x1_32x8x1_32x8x1_1x16x1x16_4x4x1_1x1_intrawave_v3,7.85,3926.6,0.0
gfx950,256,1,9216,16384,torch.int8,34,0,34.1179,a8w8_rowwise_256x16x64x512_16x16_1x1_32x8x1_32x8x1_1x16x1x16_4x4x1_1x1_intrawave_v3,8.85,4426.7,0.0
gfx950,256,1,10240,8192,torch.int8,34,0,20.5574,a8w8_rowwise_256x16x64x512_16x16_1x1_32x8x1_32x8x1_1x16x1x16_4x4x1_1x1_intrawave_v3,8.16,4081.97,0.0
gfx950,256,1,12800,5120,torch.int8,34,0,14.7015,a8w8_rowwise_256x16x64x512_16x16_1x1_32x8x1_32x8x1_1x16x1x16_4x4x1_1x1_intrawave_v3,8.92,4459.87,0.0
gfx950,256,1,13312,16384,torch.int8,34,0,43.9839,a8w8_rowwise_256x16x64x512_16x16_1x1_32x8x1_32x8x1_1x16x1x16_4x4x1_1x1_intrawave_v3,9.92,4959.7,0.0
gfx950,256,1,16384,2048,torch.int8,34,0,8.2219,a8w8_rowwise_256x16x64x512_16x16_1x1_32x8x1_32x8x1_1x16x1x16_4x4x1_1x1_intrawave_v3,8.16,4085.34,0.0
gfx950,256,1,16384,4096,torch.int8,34,0,15.9093,a8w8_rowwise_256x16x64x512_16x16_1x1_32x8x1_32x8x1_1x16x1x16_4x4x1_1x1_intrawave_v3,8.44,4220.53,0.0
gfx950,256,1,16384,6656,torch.int8,34,0,22.3992,a8w8_rowwise_256x16x64x512_16x16_1x1_32x8x1_32x8x1_1x16x1x16_4x4x1_1x1_intrawave_v3,9.74,4870.32,0.0
gfx950,256,1,16384,8192,torch.int8,34,0,29.3945,a8w8_rowwise_256x16x64x512_16x16_1x1_32x8x1_32x8x1_1x16x1x16_4x4x1_1x1_intrawave_v3,9.13,4567.48,0.0
gfx950,256,1,16384,13312,torch.int8,34,0,39.0876,a8w8_rowwise_256x16x64x512_16x16_1x1_32x8x1_32x8x1_1x16x1x16_4x4x1_1x1_intrawave_v3,11.16,5581.05,0.0
gfx950,256,1,16384,26624,torch.int8,34,0,73.9812,a8w8_rowwise_256x16x64x512_16x16_1x1_32x8x1_32x8x1_1x16x1x16_4x4x1_1x1_intrawave_v3,11.79,5897.0,0.0
gfx950,256,1,26624,16384,torch.int8,34,0,88.2574,a8w8_rowwise_256x16x64x512_16x16_1x1_32x8x1_32x8x1_1x16x1x16_4x4x1_1x1_intrawave_v3,9.88,4943.24,0.0
gfx950,256,1,51200,5120,torch.int8,30,0,50.042,a8w8_rowwise_256x32x64x512_16x16_1x2_32x8x1_32x8x1_1x32x1x8_8x8x1_1x2_intrawave_v3,10.48,5240.63,0.0
gfx950,256,1,53248,16384,torch.int8,57,0,170.1222,a8w8_rowwise_128x32x16x128_16x16_1x1_8x16x1_8x16x1_1x16x1x8_2x2x1_1x1_intrawave_v2,10.26,5128.89,0.0
gfx950,256,1,57344,8192,torch.int8,76,0,88.899,a8w8_rowwise_128x32x16x128_16x16_1x1_8x16x1_8x16x1_1x16x1x8_2x2x1_1x1_interwave_v2,10.57,5285.6,0.0
gfx950,256,16,100,5120,torch.int8,34,0,8.7447,a8w8_rowwise_256x16x64x512_16x16_1x1_32x8x1_32x8x1_1x16x1x16_4x4x1_1x1_intrawave_v3,1.87,68.28,0.0
gfx950,256,16,200,5120,torch.int8,34,0,10.4705,a8w8_rowwise_256x16x64x512_16x16_1x1_32x8x1_32x8x1_1x16x1x16_4x4x1_1x1_intrawave_v3,3.13,106.23,0.0
gfx950,256,16,800,5120,torch.int8,34,0,11.7219,a8w8_rowwise_256x16x64x512_16x16_1x1_32x8x1_32x8x1_1x16x1x16_4x4x1_1x1_intrawave_v3,11.18,358.6,0.0
gfx950,256,16,1024,8192,torch.float8_e4m3fn,79,3,8.199,a8w8_rowwise_128x16x32x128_16x16_1x1_8x16x1_8x16x1_1x16x1x8_4x4x1_1x1_interwave_v2,32.74,1043.11,0.1616
gfx950,256,16,1280,8192,torch.int8,34,0,15.0987,a8w8_rowwise_256x16x64x512_16x16_1x1_32x8x1_32x8x1_1x16x1x16_4x4x1_1x1_intrawave_v3,22.22,705.87,0.0
gfx950,256,16,1280,8192,torch.float8_e4m3fn,79,3,8.8968,a8w8_rowwise_128x16x32x128_16x16_1x1_8x16x1_8x16x1_1x16x1x8_4x4x1_1x1_interwave_v2,37.72,1197.94,0.1643
gfx950,256,16,2304,16384,torch.int8,34,0,23.498,a8w8_rowwise_256x16x64x512_16x16_1x1_32x8x1_32x8x1_1x16x1x16_4x4x1_1x1_intrawave_v3,51.41,1620.76,0.0
gfx950,256,16,2560,8192,torch.int8,34,0,14.8202,a8w8_rowwise_256x16x64x512_16x16_1x1_32x8x1_32x8x1_1x16x1x16_4x4x1_1x1_intrawave_v3,45.28,1429.43,0.0
gfx950,256,16,3584,8192,torch.float8_e4m3fn,34,2,10.689,a8w8_rowwise_256x16x64x512_16x16_1x1_32x8x1_32x8x1_1x16x1x16_4x4x1_1x1_intrawave_v3,87.9,2769.75,0.1092
gfx950,256,16,4608,16384,torch.int8,34,0,25.7089,a8w8_rowwise_256x16x64x512_16x16_1x1_32x8x1_32x8x1_1x16x1x16_4x4x1_1x1_intrawave_v3,93.97,2952.56,0.0
gfx950,256,16,5120,640,torch.int8,60,0,4.3842,a8w8_rowwise_128x16x32x128_16x16_1x1_8x16x1_8x16x1_1x16x1x8_4x4x1_1x1_intrawave_v2,23.92,787.12,0.0
gfx950,256,16,5120,1280,torch.int8,79,0,6.1038,a8w8_rowwise_128x16x32x128_16x16_1x1_8x16x1_8x16x1_1x16x1x8_4x4x1_1x1_interwave_v2,34.36,1103.89,0.0
gfx950,256,16,5120,3200,torch.int8,79,0,9.1289,a8w8_rowwise_128x16x32x128_16x16_1x1_8x16x1_8x16x1_1x16x1x8_4x4x1_1x1_interwave_v2,57.43,1818.3,0.0
gfx950,256,16,5120,5120,torch.int8,34,0,11.1363,a8w8_rowwise_256x16x64x512_16x16_1x1_32x8x1_32x8x1_1x16x1x16_4x4x1_1x1_intrawave_v3,75.33,2376.03,0.0
gfx950,256,16,5120,6400,torch.int8,34,0,14.8838,a8w8_rowwise_256x16x64x512_16x16_1x1_32x8x1_32x8x1_1x16x1x16_4x4x1_1x1_intrawave_v3,70.45,2219.48,0.0
gfx950,256,16,5120,25600,torch.int8,34,0,38.7631,a8w8_rowwise_256x16x64x512_16x16_1x1_32x8x1_32x8x1_1x16x1x16_4x4x1_1x1_intrawave_v3,108.2,3396.15,0.0
gfx950,256,16,6400,5120,torch.int8,34,0,11.5523,a8w8_rowwise_256x16x64x512_16x16_1x1_32x8x1_32x8x1_1x16x1x16_4x4x1_1x1_intrawave_v3,90.77,2861.31,0.0
gfx950,256,16,7168,8192,torch.int8,34,0,16.6523,a8w8_rowwise_256x16x64x512_16x16_1x1_32x8x1_32x8x1_1x16x1x16_4x4x1_1x1_intrawave_v3,112.84,3547.9,0.0
gfx950,256,16,7168,8192,torch.float8_e4m3fn,80,2,15.5438,a8w8_rowwise_128x16x64x128_16x16_1x2_8x16x1_8x16x1_1x16x1x8_4x4x1_1x1_interwave_v2,120.89,3800.92,0.1089
gfx950,256,16,7424,8192,torch.float8_e4m3fn,60,2,16.1728,a8w8_rowwise_128x16x32x128_16x16_1x1_8x16x1_8x16x1_1x16x1x8_4x4x1_1x1_intrawave_v2,120.34,3783.27,0.1076
gfx950,256,16,8192,1024,torch.int8,79,0,5.4586,a8w8_rowwise_128x16x32x128_16x16_1x1_8x16x1_8x16x1_1x16x1x8_4x4x1_1x1_interwave_v2,49.18,1587.79,0.0
gfx950,256,16,8192,2048,torch.int8,79,0,7.2552,a8w8_rowwise_128x16x32x128_16x16_1x1_8x16x1_8x16x1_1x16x1x8_4x4x1_1x1_interwave_v2,74.0,2353.09,0.0
gfx950,256,16,8192,3584,torch.int8,34,0,10.6477,a8w8_rowwise_256x16x64x512_16x16_1x1_32x8x1_32x8x1_1x16x1x16_4x4x1_1x1_intrawave_v3,88.24,2787.42,0.0
gfx950,256,16,8192,7168,torch.int8,34,0,15.2131,a8w8_rowwise_256x16x64x512_16x16_1x1_32x8x1_32x8x1_1x16x1x16_4x4x1_1x1_intrawave_v3,123.52,3884.62,0.0
gfx950,256,16,8192,8192,torch.int8,34,0,17.2283,a8w8_rowwise_256x16x64x512_16x16_1x1_32x8x1_32x8x1_1x16x1x16_4x4x1_1x1_intrawave_v3,124.65,3918.09,0.0
gfx950,256,16,8192,8192,torch.float8_e4m3fn,80,2,17.7026,a8w8_rowwise_128x16x64x128_16x16_1x2_8x16x1_8x16x1_1x16x1x8_4x4x1_1x1_interwave_v2,121.31,3813.12,0.107
gfx950,256,16,8192,28672,torch.int8,34,0,55.9502,a8w8_rowwise_256x16x64x512_16x16_1x1_32x8x1_32x8x1_1x16x1x16_4x4x1_1x1_intrawave_v3,134.34,4210.92,0.0
gfx950,256,16,9216,16384,torch.int8,34,0,33.174,a8w8_rowwise_256x16x64x512_16x16_1x1_32x8x1_32x8x1_1x16x1x16_4x4x1_1x1_intrawave_v3,145.65,4568.4,0.0
gfx950,256,16,10240,8192,torch.int8,34,0,18.6072,a8w8_rowwise_256x16x64x512_16x16_1x1_32x8x1_32x8x1_1x16x1x16_4x4x1_1x1_intrawave_v3,144.26,4532.91,0.0
gfx950,256,16,10240,8192,torch.float8_e4m3fn,34,0,19.5591,a8w8_rowwise_256x16x64x512_16x16_1x1_32x8x1_32x8x1_1x16x1x16_4x4x1_1x1_intrawave_v3,137.24,4312.31,0.0
gfx950,256,16,12800,5120,torch.int8,34,0,14.2563,a8w8_rowwise_256x16x64x512_16x16_1x1_32x8x1_32x8x1_1x16x1x16_4x4x1_1x1_intrawave_v3,147.1,4631.46,0.0
gfx950,256,16,13312,16384,torch.int8,30,0,45.4589,a8w8_rowwise_256x32x64x512_16x16_1x2_32x8x1_32x8x1_1x32x1x8_8x8x1_1x2_intrawave_v3,153.53,4812.96,0.0
gfx950,256,16,16384,2048,torch.int8,34,0,8.2068,a8w8_rowwise_256x16x64x512_16x16_1x1_32x8x1_32x8x1_1x16x1x16_4x4x1_1x1_intrawave_v3,130.84,4156.49,0.0
gfx950,256,16,16384,4096,torch.int8,30,0,16.22,a8w8_rowwise_256x32x64x512_16x16_1x2_32x8x1_32x8x1_1x32x1x8_8x8x1_1x2_intrawave_v3,132.4,4173.78,0.0
gfx950,256,16,16384,6656,torch.int8,34,0,21.7401,a8w8_rowwise_256x16x64x512_16x16_1x1_32x8x1_32x8x1_1x16x1x16_4x4x1_1x1_intrawave_v3,160.52,5045.18,0.0
gfx950,256,16,16384,8192,torch.int8,30,0,29.6526,a8w8_rowwise_256x32x64x512_16x16_1x2_32x8x1_32x8x1_1x32x1x8_8x8x1_1x2_intrawave_v3,144.84,4548.44,0.0
gfx950,256,16,16384,13312,torch.int8,34,0,38.6763,a8w8_rowwise_256x16x64x512_16x16_1x1_32x8x1_32x8x1_1x16x1x16_4x4x1_1x1_intrawave_v3,180.45,5658.27,0.0
gfx950,256,16,16384,26624,torch.int8,34,0,73.7744,a8w8_rowwise_256x16x64x512_16x16_1x1_32x8x1_32x8x1_1x16x1x16_4x4x1_1x1_intrawave_v3,189.21,5925.6,0.0
gfx950,256,16,26624,16384,torch.int8,30,0,86.8898,a8w8_rowwise_256x32x64x512_16x16_1x2_32x8x1_32x8x1_1x32x1x8_8x8x1_1x2_intrawave_v3,160.65,5033.06,0.0
gfx950,256,16,28672,8192,torch.float8_e4m3fn,30,0,46.9441,a8w8_rowwise_256x32x64x512_16x16_1x2_32x8x1_32x8x1_1x32x1x8_8x8x1_1x2_intrawave_v3,160.11,5025.76,0.0
gfx950,256,16,51200,5120,torch.int8,30,0,51.7349,a8w8_rowwise_256x32x64x512_16x16_1x2_32x8x1_32x8x1_1x32x1x8_8x8x1_1x2_intrawave_v3,162.15,5100.32,0.0
gfx950,256,16,53248,16384,torch.int8,34,0,180.7857,a8w8_rowwise_256x16x64x512_16x16_1x1_32x8x1_32x8x1_1x16x1x16_4x4x1_1x1_intrawave_v3,154.42,4836.56,0.0
gfx950,256,16,57344,8192,torch.int8,80,0,90.9234,a8w8_rowwise_128x16x64x128_16x16_1x2_8x16x1_8x16x1_1x16x1x8_4x4x1_1x1_interwave_v2,165.33,5188.19,0.0
gfx950,256,16,57344,8192,torch.float8_e4m3fn,69,2,92.3442,a8w8_rowwise_128x16x32x128_16x16_1x1_8x16x1_8x16x1_1x16x1x8_4x4x1_1x1_interwave_v1,162.79,5108.37,0.1072
gfx950,256,32,100,5120,torch.int8,34,0,9.2459,a8w8_rowwise_256x16x64x512_16x16_1x1_32x8x1_32x8x1_1x16x1x16_4x4x1_1x1_intrawave_v3,3.54,73.79,0.0
gfx950,256,32,200,5120,torch.int8,34,0,10.4825,a8w8_rowwise_256x16x64x512_16x16_1x1_32x8x1_32x8x1_1x16x1x16_4x4x1_1x1_intrawave_v3,6.25,114.54,0.0
gfx950,256,32,800,5120,torch.int8,34,0,11.9874,a8w8_rowwise_256x16x64x512_16x16_1x1_32x8x1_32x8x1_1x16x1x16_4x4x1_1x1_intrawave_v3,21.87,359.63,0.0
gfx950,256,32,1024,8192,torch.float8_e4m3fn,79,3,8.7911,a8w8_rowwise_128x16x32x128_16x16_1x1_8x16x1_8x16x1_1x16x1x8_4x4x1_1x1_interwave_v2,61.07,991.49,0.1586
gfx950,256,32,1280,8192,torch.int8,34,0,14.9955,a8w8_rowwise_256x16x64x512_16x16_1x1_32x8x1_32x8x1_1x16x1x16_4x4x1_1x1_intrawave_v3,44.75,722.2,0.0
gfx950,256,32,1280,8192,torch.float8_e4m3fn,60,3,9.3466,a8w8_rowwise_128x16x32x128_16x16_1x1_8x16x1_8x16x1_1x16x1x8_4x4x1_1x1_intrawave_v2,71.8,1158.69,0.1581
gfx950,256,32,2304,16384,torch.int8,34,0,23.2436,a8w8_rowwise_256x16x64x512_16x16_1x1_32x8x1_32x8x1_1x16x1x16_4x4x1_1x1_intrawave_v3,103.94,1652.95,0.0
gfx950,256,32,2560,8192,torch.int8,34,0,14.7991,a8w8_rowwise_256x16x64x512_16x16_1x1_32x8x1_32x8x1_1x16x1x16_4x4x1_1x1_intrawave_v3,90.69,1445.87,0.0
gfx950,256,32,3584,8192,torch.float8_e4m3fn,34,2,12.64,a8w8_rowwise_256x16x64x512_16x16_1x1_32x8x1_32x8x1_1x16x1x16_4x4x1_1x1_intrawave_v3,148.66,2361.68,0.1084
gfx950,256,32,4608,16384,torch.int8,34,0,24.957,a8w8_rowwise_256x16x64x512_16x16_1x1_32x8x1_32x8x1_1x16x1x16_4x4x1_1x1_intrawave_v3,193.61,3057.93,0.0
gfx950,256,32,5120,640,torch.int8,79,0,4.5986,a8w8_rowwise_128x16x32x128_16x16_1x1_8x16x1_8x16x1_1x16x1x8_4x4x1_1x1_interwave_v2,45.6,788.27,0.0
gfx950,256,32,5120,1280,torch.int8,76,0,6.0464,a8w8_rowwise_128x32x16x128_16x16_1x1_8x16x1_8x16x1_1x16x1x8_2x2x1_1x1_interwave_v2,69.37,1144.85,0.0
gfx950,256,32,5120,3200,torch.int8,76,0,10.1191,a8w8_rowwise_128x32x16x128_16x16_1x1_8x16x1_8x16x1_1x16x1x8_2x2x1_1x1_interwave_v2,103.62,1661.62,0.0
gfx950,256,32,5120,5120,torch.int8,34,0,10.4248,a8w8_rowwise_256x16x64x512_16x16_1x1_32x8x1_32x8x1_1x16x1x16_4x4x1_1x1_intrawave_v3,160.94,2561.77,0.0
gfx950,256,32,5120,6400,torch.int8,34,0,15.0885,a8w8_rowwise_256x16x64x512_16x16_1x1_32x8x1_32x8x1_1x16x1x16_4x4x1_1x1_intrawave_v3,138.99,2207.01,0.0
gfx950,256,32,5120,25600,torch.int8,34,0,38.3258,a8w8_rowwise_256x16x64x512_16x16_1x1_32x8x1_32x8x1_1x16x1x16_4x4x1_1x1_intrawave_v3,218.88,3449.87,0.0
gfx950,256,32,6400,5120,torch.int8,34,0,10.9816,a8w8_rowwise_256x16x64x512_16x16_1x1_32x8x1_32x8x1_1x16x1x16_4x4x1_1x1_intrawave_v3,190.97,3036.12,0.0
gfx950,256,32,7168,8192,torch.int8,34,0,16.942,a8w8_rowwise_256x16x64x512_16x16_1x1_32x8x1_32x8x1_1x16x1x16_4x4x1_1x1_intrawave_v3,221.82,3508.51,0.0
gfx950,256,32,7168,8192,torch.float8_e4m3fn,34,0,17.4961,a8w8_rowwise_256x16x64x512_16x16_1x1_32x8x1_32x8x1_1x16x1x16_4x4x1_1x1_intrawave_v3,214.8,3397.39,0.0
gfx950,256,32,7424,8192,torch.float8_e4m3fn,34,0,17.6324,a8w8_rowwise_256x16x64x512_16x16_1x1_32x8x1_32x8x1_1x16x1x16_4x4x1_1x1_intrawave_v3,220.75,3491.0,0.0
gfx950,256,32,8192,1024,torch.int8,79,0,5.6281,a8w8_rowwise_128x16x32x128_16x16_1x1_8x16x1_8x16x1_1x16x1x8_4x4x1_1x1_interwave_v2,95.39,1589.46,0.0
gfx950,256,32,8192,1024,torch.float8_e4m3fn,79,0,6.5212,a8w8_rowwise_128x16x32x128_16x16_1x1_8x16x1_8x16x1_1x16x1x8_4x4x1_1x1_interwave_v2,82.33,1371.78,0.0
gfx950,256,32,8192,2048,torch.int8,76,0,7.2889,a8w8_rowwise_128x32x16x128_16x16_1x1_8x16x1_8x16x1_1x16x1x8_2x2x1_1x1_interwave_v2,147.31,2382.67,0.0
gfx950,256,32,8192,3584,torch.int8,34,0,9.4243,a8w8_rowwise_256x16x64x512_16x16_1x1_32x8x1_32x8x1_1x16x1x16_4x4x1_1x1_intrawave_v3,199.38,3183.17,0.0
gfx950,256,32,8192,7168,torch.int8,34,0,16.2902,a8w8_rowwise_256x16x64x512_16x16_1x1_32x8x1_32x8x1_1x16x1x16_4x4x1_1x1_intrawave_v3,230.7,3650.9,0.0
gfx950,256,32,8192,8192,torch.int8,34,0,17.4586,a8w8_rowwise_256x16x64x512_16x16_1x1_32x8x1_32x8x1_1x16x1x16_4x4x1_1x1_intrawave_v3,246.01,3888.93,0.0
gfx950,256,32,8192,8192,torch.float8_e4m3fn,34,0,18.0338,a8w8_rowwise_256x16x64x512_16x16_1x1_32x8x1_32x8x1_1x16x1x16_4x4x1_1x1_intrawave_v3,238.16,3764.89,0.0
gfx950,256,32,8192,28672,torch.int8,34,0,54.7382,a8w8_rowwise_256x16x64x512_16x16_1x1_32x8x1_32x8x1_1x16x1x16_4x4x1_1x1_intrawave_v3,274.62,4317.33,0.0
gfx950,256,32,9216,16384,torch.int8,30,0,34.6699,a8w8_rowwise_256x32x64x512_16x16_1x2_32x8x1_32x8x1_1x32x1x8_8x8x1_1x2_intrawave_v3,278.73,4387.35,0.0
gfx950,256,32,10240,8192,torch.int8,30,0,20.8953,a8w8_rowwise_256x32x64x512_16x16_1x2_32x8x1_32x8x1_1x32x1x8_8x8x1_1x2_intrawave_v3,256.93,4058.5,0.0
gfx950,256,32,10240,8192,torch.float8_e4m3fn,30,0,21.4049,a8w8_rowwise_256x32x64x512_16x16_1x2_32x8x1_32x8x1_1x32x1x8_8x8x1_1x2_intrawave_v3,250.82,3961.88,0.0
gfx950,256,32,12800,5120,torch.int8,30,0,14.9578,a8w8_rowwise_256x32x64x512_16x16_1x2_32x8x1_32x8x1_1x32x1x8_8x8x1_1x2_intrawave_v3,280.41,4447.11,0.0
gfx950,256,32,13312,16384,torch.int8,30,0,46.5921,a8w8_rowwise_256x32x64x512_16x16_1x2_32x8x1_32x8x1_1x32x1x8_8x8x1_1x2_intrawave_v3,299.59,4710.67,0.0
gfx950,256,32,16384,2048,torch.int8,30,0,10.4352,a8w8_rowwise_256x32x64x512_16x16_1x2_32x8x1_32x8x1_1x32x1x8_8x8x1_1x2_intrawave_v3,205.79,3322.27,0.0
gfx950,256,32,16384,4096,torch.int8,30,0,16.4693,a8w8_rowwise_256x32x64x512_16x16_1x2_32x8x1_32x8x1_1x32x1x8_8x8x1_1x2_intrawave_v3,260.79,4146.41,0.0
gfx950,256,32,16384,6656,torch.int8,30,0,22.4014,a8w8_rowwise_256x32x64x512_16x16_1x2_32x8x1_32x8x1_1x32x1x8_8x8x1_1x2_intrawave_v3,311.56,4924.4,0.0
gfx950,256,32,16384,8192,torch.int8,30,0,30.4324,a8w8_rowwise_256x32x64x512_16x16_1x2_32x8x1_32x8x1_1x32x1x8_8x8x1_1x2_intrawave_v3,282.26,4453.43,0.0
gfx950,256,32,16384,13312,torch.int8,30,0,39.8351,a8w8_rowwise_256x32x64x512_16x16_1x2_32x8x1_32x8x1_1x32x1x8_8x8x1_1x2_intrawave_v3,350.41,5512.18,0.0
gfx950,256,32,16384,26624,torch.int8,30,0,74.3742,a8w8_rowwise_256x32x64x512_16x16_1x2_32x8x1_32x8x1_1x32x1x8_8x8x1_1x2_intrawave_v3,375.36,5890.59,0.0
gfx950,256,32,26624,16384,torch.int8,30,0,89.3239,a8w8_rowwise_256x32x64x512_16x16_1x2_32x8x1_32x8x1_1x32x1x8_8x8x1_1x2_intrawave_v3,312.54,4908.38,0.0
gfx950,256,32,28672,8192,torch.float8_e4m3fn,23,0,47.2467,a8w8_rowwise_256x64x64x512_32x32_1x1_32x8x1_32x8x1_1x32x1x8_8x8x1_1x1_intrawave_v3,318.17,5015.76,0.0
gfx950,256,32,51200,5120,torch.int8,30,0,53.9026,a8w8_rowwise_256x32x64x512_16x16_1x2_32x8x1_32x8x1_1x32x1x8_8x8x1_1x2_intrawave_v3,311.25,4927.12,0.0
gfx950,256,32,53248,16384,torch.int8,34,0,168.8762,a8w8_rowwise_256x16x64x512_16x16_1x1_32x8x1_32x8x1_1x16x1x16_4x4x1_1x1_intrawave_v3,330.62,5189.29,0.0
gfx950,256,32,57344,8192,torch.int8,81,0,93.0943,a8w8_rowwise_128x32x64x128_32x32_1x1_8x16x1_8x16x1_1x16x1x8_8x8x1_1x1_interwave_v2,322.95,5088.33,0.0
gfx950,256,32,57344,8192,torch.float8_e4m3fn,62,0,92.8953,a8w8_rowwise_128x32x64x128_32x32_1x1_8x16x1_8x16x1_1x16x1x8_8x8x1_1x1_intrawave_v2,323.64,5099.23,0.0
gfx950,256,48,7424,8192,torch.float8_e4m3fn,74,2,20.2638,a8w8_rowwise_128x64x32x128_32x32_1x1_8x16x1_8x16x1_1x16x1x8_4x4x1_1x1_interwave_v2,288.12,3055.86,0.1076
gfx950,256,64,100,5120,torch.int8,34,0,9.6716,a8w8_rowwise_256x16x64x512_16x16_1x1_32x8x1_32x8x1_1x16x1x16_4x4x1_1x1_intrawave_v3,6.78,88.14,0.0
gfx950,256,64,192,1024,torch.int8,77,0,4.1582,a8w8_rowwise_64x16x16x64_16x16_1x1_4x16x1_4x16x1_1x16x1x4_4x4x1_1x1_interwave_v2,6.05,68.95,0.0
gfx950,256,64,200,5120,torch.int8,34,0,9.9254,a8w8_rowwise_256x16x64x512_16x16_1x1_32x8x1_32x8x1_1x16x1x16_4x4x1_1x1_intrawave_v3,13.21,138.76,0.0
gfx950,256,64,800,5120,torch.int8,34,0,12.0241,a8w8_rowwise_256x16x64x512_16x16_1x1_32x8x1_32x8x1_1x16x1x16_4x4x1_1x1_intrawave_v3,43.6,376.42,0.0
gfx950,256,64,1024,8192,torch.float8_e4m3fn,34,2,9.0741,a8w8_rowwise_256x16x64x512_16x16_1x1_32x8x1_32x8x1_1x16x1x16_4x4x1_1x1_intrawave_v3,118.33,996.68,0.1083
gfx950,256,64,1280,8192,torch.int8,34,0,14.7691,a8w8_rowwise_256x16x64x512_16x16_1x1_32x8x1_32x8x1_1x16x1x16_4x4x1_1x1_intrawave_v3,90.88,756.57,0.0
gfx950,256,64,1280,8192,torch.float8_e4m3fn,79,2,11.0767,a8w8_rowwise_128x16x32x128_16x16_1x1_8x16x1_8x16x1_1x16x1x8_4x4x1_1x1_interwave_v2,121.17,1008.77,0.1076
gfx950,256,64,2304,16384,torch.int8,34,0,23.2558,a8w8_rowwise_256x16x64x512_16x16_1x1_32x8x1_32x8x1_1x16x1x16_4x4x1_1x1_intrawave_v3,207.77,1680.97,0.0
gfx950,256,64,2560,8192,torch.int8,34,0,14.5967,a8w8_rowwise_256x16x64x512_16x16_1x1_32x8x1_32x8x1_1x16x1x16_4x4x1_1x1_intrawave_v3,183.9,1495.1,0.0
gfx950,256,64,3584,8192,torch.float8_e4m3fn,55,2,15.5912,a8w8_rowwise_128x64x32x128_32x32_1x1_8x16x1_8x16x1_1x16x1x8_4x4x1_1x1_intrawave_v2,241.04,1946.17,0.1078
gfx950,256,64,4608,16384,torch.int8,30,0,27.9735,a8w8_rowwise_256x32x64x512_16x16_1x2_32x8x1_32x8x1_1x32x1x8_8x8x1_1x2_intrawave_v3,345.46,2757.46,0.0
gfx950,256,64,5120,640,torch.int8,77,0,5.0956,a8w8_rowwise_64x16x16x64_16x16_1x1_4x16x1_4x16x1_1x16x1x4_4x4x1_1x1_interwave_v2,82.31,779.72,0.0
gfx950,256,64,5120,1280,torch.int8,76,0,6.4203,a8w8_rowwise_128x32x16x128_16x16_1x1_8x16x1_8x16x1_1x16x1x8_2x2x1_1x1_interwave_v2,130.66,1135.6,0.0
gfx950,256,64,5120,3200,torch.int8,76,0,10.7687,a8w8_rowwise_128x32x16x128_16x16_1x1_8x16x1_8x16x1_1x16x1x8_2x2x1_1x1_interwave_v2,194.75,1601.32,0.0
gfx950,256,64,5120,5120,torch.int8,30,0,11.7059,a8w8_rowwise_256x32x64x512_16x16_1x2_32x8x1_32x8x1_1x32x1x8_8x8x1_1x2_intrawave_v3,286.65,2323.4,0.0
gfx950,256,64,5120,6400,torch.int8,30,0,16.907,a8w8_rowwise_256x32x64x512_16x16_1x2_32x8x1_32x8x1_1x32x1x8_8x8x1_1x2_intrawave_v3,248.08,2001.12,0.0
gfx950,256,64,5120,25600,torch.int8,30,0,43.5801,a8w8_rowwise_256x32x64x512_16x16_1x2_32x8x1_32x8x1_1x32x1x8_8x8x1_1x2_intrawave_v3,384.97,3060.24,0.0
gfx950,256,64,6400,5120,torch.int8,30,0,12.4817,a8w8_rowwise_256x32x64x512_16x16_1x2_32x8x1_32x8x1_1x32x1x8_8x8x1_1x2_intrawave_v3,336.04,2717.17,0.0
gfx950,256,64,7168,8192,torch.int8,30,0,18.4286,a8w8_rowwise_256x32x64x512_16x16_1x2_32x8x1_32x8x1_1x32x1x8_8x8x1_1x2_intrawave_v3,407.85,3264.6,0.0
gfx950,256,64,7168,8192,torch.float8_e4m3fn,30,0,19.78,a8w8_rowwise_256x32x64x512_16x16_1x2_32x8x1_32x8x1_1x32x1x8_8x8x1_1x2_intrawave_v3,379.99,3041.56,0.0
gfx950,256,64,7424,8192,torch.float8_e4m3fn,30,0,20.8916,a8w8_rowwise_256x32x64x512_16x16_1x2_32x8x1_32x8x1_1x32x1x8_8x8x1_1x2_intrawave_v3,372.62,2981.68,0.0
gfx950,256,64,8192,1024,torch.float8_e4m3fn,79,0,7.3716,a8w8_rowwise_128x16x32x128_16x16_1x1_8x16x1_8x16x1_1x16x1x8_4x4x1_1x1_interwave_v2,145.66,1289.1,0.0
gfx950,256,64,8192,2048,torch.int8,30,0,7.5798,a8w8_rowwise_256x32x64x512_16x16_1x2_32x8x1_32x8x1_1x32x1x8_8x8x1_1x2_intrawave_v3,283.32,2369.04,0.0
gfx950,256,64,8192,3584,torch.int8,30,0,11.279,a8w8_rowwise_256x32x64x512_16x16_1x2_32x8x1_32x8x1_1x32x1x8_8x8x1_1x2_intrawave_v3,333.19,2716.38,0.0
gfx950,256,64,8192,7168,torch.int8,30,0,17.495,a8w8_rowwise_256x32x64x512_16x16_1x2_32x8x1_32x8x1_1x32x1x8_8x8x1_1x2_intrawave_v3,429.62,3442.56,0.0
gfx950,256,64,8192,8192,torch.int8,30,0,19.4045,a8w8_rowwise_256x32x64x512_16x16_1x2_32x8x1_32x8x1_1x32x1x8_8x8x1_1x2_intrawave_v3,442.68,3539.47,0.0
gfx950,256,64,8192,8192,torch.float8_e4m3fn,30,0,19.8829,a8w8_rowwise_256x32x64x512_16x16_1x2_32x8x1_32x8x1_1x32x1x8_8x8x1_1x2_intrawave_v3,432.03,3454.31,0.0
gfx950,256,64,8192,28672,torch.int8,30,0,61.7622,a8w8_rowwise_256x32x64x512_16x16_1x2_32x8x1_32x8x1_1x32x1x8_8x8x1_1x2_intrawave_v3,486.78,3849.68,0.0
gfx950,256,64,9216,16384,torch.int8,23,0,41.0647,a8w8_rowwise_256x64x64x512_32x32_1x1_32x8x1_32x8x1_1x32x1x8_8x8x1_1x1_intrawave_v3,470.66,3731.26,0.0
gfx950,256,64,10240,8192,torch.int8,28,0,27.6213,a8w8_rowwise_256x32x128x256_32x32_1x1_16x16x1_16x16x1_1x32x1x8_8x8x1_1x1_intrawave_v3,388.74,3103.44,0.0
gfx950,256,64,10240,8192,torch.float8_e4m3fn,23,0,24.8931,a8w8_rowwise_256x64x64x512_32x32_1x1_32x8x1_32x8x1_1x32x1x8_8x8x1_1x1_intrawave_v3,431.34,3443.57,0.0
gfx950,256,64,12800,5120,torch.int8,23,0,18.5404,a8w8_rowwise_256x64x64x512_32x32_1x1_32x8x1_32x8x1_1x32x1x8_8x8x1_1x1_intrawave_v3,452.45,3640.81,0.0
gfx950,256,64,13312,16384,torch.int8,23,0,50.0251,a8w8_rowwise_256x64x64x512_32x32_1x1_32x8x1_32x8x1_1x32x1x8_8x8x1_1x1_intrawave_v3,558.07,4414.91,0.0
gfx950,256,64,16384,2048,torch.int8,23,0,11.4046,a8w8_rowwise_256x64x64x512_32x32_1x1_32x8x1_32x8x1_1x32x1x8_8x8x1_1x1_intrawave_v3,376.6,3137.56,0.0
gfx950,256,64,16384,4096,torch.int8,23,0,19.0989,a8w8_rowwise_256x64x64x512_32x32_1x1_32x8x1_32x8x1_1x32x1x8_8x8x1_1x1_intrawave_v3,449.76,3637.29,0.0
gfx950,256,64,16384,6656,torch.int8,23,0,26.4384,a8w8_rowwise_256x64x64x512_32x32_1x1_32x8x1_32x8x1_1x32x1x8_8x8x1_1x1_intrawave_v3,527.97,4220.19,0.0
gfx950,256,64,16384,8192,torch.int8,23,0,33.8597,a8w8_rowwise_256x64x64x512_32x32_1x1_32x8x1_32x8x1_1x32x1x8_8x8x1_1x1_intrawave_v3,507.38,4041.36,0.0
gfx950,256,64,16384,13312,torch.int8,23,0,46.8247,a8w8_rowwise_256x64x64x512_32x32_1x1_32x8x1_32x8x1_1x32x1x8_8x8x1_1x1_intrawave_v3,596.21,4720.86,0.0
gfx950,256,64,16384,26624,torch.int8,23,0,89.8884,a8w8_rowwise_256x64x64x512_32x32_1x1_32x8x1_32x8x1_1x32x1x8_8x8x1_1x1_intrawave_v3,621.15,4895.06,0.0
gfx950,256,64,26624,16384,torch.int8,23,0,91.2922,a8w8_rowwise_256x64x64x512_32x32_1x1_32x8x1_32x8x1_1x32x1x8_8x8x1_1x1_intrawave_v3,611.6,4826.96,0.0
gfx950,256,64,28672,8192,torch.float8_e4m3fn,23,0,52.7168,a8w8_rowwise_256x64x64x512_32x32_1x1_32x8x1_32x8x1_1x32x1x8_8x8x1_1x1_intrawave_v3,570.31,4535.09,0.0
gfx950,256,64,51200,5120,torch.int8,23,0,61.5287,a8w8_rowwise_256x64x64x512_32x32_1x1_32x8x1_32x8x1_1x32x1x8_8x8x1_1x1_intrawave_v3,545.35,4372.35,0.0
gfx950,256,64,53248,16384,torch.int8,23,0,184.3385,a8w8_rowwise_256x64x64x512_32x32_1x1_32x8x1_32x8x1_1x32x1x8_8x8x1_1x1_intrawave_v3,605.78,4775.34,0.0
gfx950,256,64,57344,8192,torch.int8,46,0,99.6635,a8w8_rowwise_256x64x128x128_32x32_1x2_8x32x1_8x32x1_1x32x1x8_8x8x1_1x1_intrawave_v3,603.33,4792.39,0.0
gfx950,256,64,57344,8192,torch.float8_e4m3fn,17,0,98.9474,a8w8_rowwise_256x64x224x128_16x16_2x7_8x32x1_8x32x1_1x64x1x4_8x8x1_2x1_intrawave_v3,607.69,4827.07,0.0
gfx950,256,128,100,5120,torch.int8,34,0,10.6683,a8w8_rowwise_256x16x64x512_16x16_1x1_32x8x1_32x8x1_1x16x1x16_4x4x1_1x1_intrawave_v3,12.29,111.82,0.0
gfx950,256,128,128,49920,torch.float8_e4m3fn,34,0,75.6047,a8w8_rowwise_256x16x64x512_16x16_1x1_32x8x1_32x8x1_1x16x1x16_4x4x1_1x1_intrawave_v3,21.64,169.46,0.0
gfx950,256,128,128,80000,torch.float8_e4m3fn,34,0,119.6585,a8w8_rowwise_256x16x64x512_16x16_1x1_32x8x1_32x8x1_1x16x1x16_4x4x1_1x1_intrawave_v3,21.91,171.43,0.0
gfx950,256,128,128,222336,torch.float8_e4m3fn,34,0,324.8197,a8w8_rowwise_256x16x64x512_16x16_1x1_32x8x1_32x8x1_1x16x1x16_4x4x1_1x1_intrawave_v3,22.43,175.33,0.0001
gfx950,256,128,128,254848,torch.float8_e4m3fn,34,0,371.2338,a8w8_rowwise_256x16x64x512_16x16_1x1_32x8x1_32x8x1_1x16x1x16_4x4x1_1x1_intrawave_v3,22.49,175.83,0.0002
gfx950,256,128,128,322816,torch.float8_e4m3fn,34,0,466.5241,a8w8_rowwise_256x16x64x512_16x16_1x1_32x8x1_32x8x1_1x16x1x16_4x4x1_1x1_intrawave_v3,22.67,177.21,0.0001
gfx950,256,128,128,423168,torch.float8_e4m3fn,34,0,611.0012,a8w8_rowwise_256x16x64x512_16x16_1x1_32x8x1_32x8x1_1x16x1x16_4x4x1_1x1_intrawave_v3,22.69,177.35,0.0002
gfx950,256,128,128,620160,torch.float8_e4m3fn,34,0,897.8064,a8w8_rowwise_256x16x64x512_16x16_1x1_32x8x1_32x8x1_1x16x1x16_4x4x1_1x1_intrawave_v3,22.63,176.87,0.0002
gfx950,256,128,128,659584,torch.float8_e4m3fn,34,0,953.0292,a8w8_rowwise_256x16x64x512_16x16_1x1_32x8x1_32x8x1_1x16x1x16_4x4x1_1x1_intrawave_v3,22.68,177.21,0.0002
gfx950,256,128,128,796544,torch.float8_e4m3fn,34,0,1151.3783,a8w8_rowwise_256x16x64x512_16x16_1x1_32x8x1_32x8x1_1x16x1x16_4x4x1_1x1_intrawave_v3,22.67,177.13,0.0004
gfx950,256,128,128,941696,torch.float8_e4m3fn,34,0,1362.3745,a8w8_rowwise_256x16x64x512_16x16_1x1_32x8x1_32x8x1_1x16x1x16_4x4x1_1x1_intrawave_v3,22.65,176.98,0.0002
gfx950,256,128,200,5120,torch.int8,34,0,9.652,a8w8_rowwise_256x16x64x512_16x16_1x1_32x8x1_32x8x1_1x16x1x16_4x4x1_1x1_intrawave_v3,27.16,179.3,0.0
gfx950,256,128,256,256,torch.float8_e4m3fn,68,0,3.1268,a8w8_rowwise_64x16x16x128_16x16_1x1_8x8x1_8x8x1_1x16x1x4_4x4x1_1x1_interwave_v1,5.37,52.4,0.0
gfx950,256,128,256,1024,torch.float8_e4m3fn,79,0,4.0962,a8w8_rowwise_128x16x32x128_16x16_1x1_8x16x1_8x16x1_1x16x1x8_4x4x1_1x1_interwave_v2,16.38,111.99,0.0
gfx950,256,128,800,5120,torch.int8,34,0,11.5628,a8w8_rowwise_256x16x64x512_16x16_1x1_32x8x1_32x8x1_1x16x1x16_4x4x1_1x1_intrawave_v3,90.69,428.63,0.0
gfx950,256,128,1024,8192,torch.float8_e4m3fn,34,2,12.0372,a8w8_rowwise_256x16x64x512_16x16_1x1_32x8x1_32x8x1_1x16x1x16_4x4x1_1x1_intrawave_v3,178.4,805.78,0.1084
gfx950,256,128,1280,8192,torch.int8,34,0,13.9827,a8w8_rowwise_256x16x64x512_16x16_1x1_32x8x1_32x8x1_1x16x1x16_4x4x1_1x1_intrawave_v3,191.98,848.34,0.0
gfx950,256,128,1280,8192,torch.float8_e4m3fn,29,3,13.1684,a8w8_rowwise_256x32x96x256_16x16_1x3_16x16x1_16x16x1_1x32x1x8_4x4x1_1x1_intrawave_v3,203.85,900.79,0.1595
gfx950,256,128,2304,16384,torch.int8,30,0,26.5035,a8w8_rowwise_256x32x64x512_16x16_1x2_32x8x1_32x8x1_1x32x1x8_8x8x1_1x2_intrawave_v3,364.62,1525.67,0.0
gfx950,256,128,2560,8192,torch.int8,30,0,16.5177,a8w8_rowwise_256x32x64x512_16x16_1x2_32x8x1_32x8x1_1x32x1x8_8x8x1_1x2_intrawave_v3,325.03,1372.8,0.0
gfx950,256,128,3584,8192,torch.float8_e4m3fn,30,0,17.8922,a8w8_rowwise_256x32x64x512_16x16_1x2_32x8x1_32x8x1_1x32x1x8_8x8x1_1x2_intrawave_v3,420.08,1750.83,0.0
gfx950,256,128,4608,16384,torch.int8,23,0,33.4047,a8w8_rowwise_256x64x64x512_32x32_1x1_32x8x1_32x8x1_1x32x1x8_8x8x1_1x1_intrawave_v3,578.58,2358.18,0.0
gfx950,256,128,5120,640,torch.int8,79,0,5.566,a8w8_rowwise_128x16x32x128_16x16_1x1_8x16x1_8x16x1_1x16x1x8_4x4x1_1x1_interwave_v2,150.71,838.92,0.0
gfx950,256,128,5120,1280,torch.int8,23,0,7.6695,a8w8_rowwise_256x64x64x512_32x32_1x1_32x8x1_32x8x1_1x32x1x8_8x8x1_1x1_intrawave_v3,218.75,1046.76,0.0
gfx950,256,128,5120,3200,torch.int8,23,0,11.8363,a8w8_rowwise_256x64x64x512_32x32_1x1_32x8x1_32x8x1_1x32x1x8_8x8x1_1x1_intrawave_v3,354.36,1529.56,0.0
gfx950,256,128,5120,5120,torch.int8,23,0,14.1859,a8w8_rowwise_256x64x64x512_32x32_1x1_32x8x1_32x8x1_1x32x1x8_8x8x1_1x1_intrawave_v3,473.07,1986.51,0.0
gfx950,256,128,5120,6400,torch.int8,23,0,18.7826,a8w8_rowwise_256x64x64x512_32x32_1x1_32x8x1_32x8x1_1x32x1x8_8x8x1_1x1_intrawave_v3,446.62,1857.99,0.0
gfx950,256,128,5120,25600,torch.int8,23,0,54.0309,a8w8_rowwise_256x64x64x512_32x32_1x1_32x8x1_32x8x1_1x32x1x8_8x8x1_1x1_intrawave_v3,621.02,2510.78,0.0
gfx950,256,128,6400,5120,torch.int8,23,0,14.96,a8w8_rowwise_256x64x64x512_32x32_1x1_32x8x1_32x8x1_1x32x1x8_8x8x1_1x1_intrawave_v3,560.74,2343.7,0.0
gfx950,256,128,7168,8192,torch.int8,28,0,26.0097,a8w8_rowwise_256x32x128x256_32x32_1x1_16x16x1_16x16x1_1x32x1x8_8x8x1_1x1_intrawave_v3,577.95,2368.49,0.0
gfx950,256,128,7168,8192,torch.float8_e4m3fn,23,0,22.197,a8w8_rowwise_256x64x64x512_32x32_1x1_32x8x1_32x8x1_1x32x1x8_8x8x1_1x1_intrawave_v3,677.23,2775.32,0.0
gfx950,256,128,8192,1024,torch.int8,28,0,7.1186,a8w8_rowwise_256x32x128x256_32x32_1x1_16x16x1_16x16x1_1x32x1x8_8x8x1_1x1_intrawave_v3,301.67,1491.42,0.0
gfx950,256,128,8192,1024,torch.float8_e4m3fn,15,0,8.3628,a8w8_rowwise_256x128x64x256_32x32_2x1_16x16x1_16x16x1_1x32x1x8_8x8x1_1x1_intrawave_v3,256.79,1269.53,0.0
gfx950,256,128,8192,2048,torch.int8,23,0,10.2945,a8w8_rowwise_256x64x64x512_32x32_1x1_32x8x1_32x8x1_1x32x1x8_8x8x1_1x1_intrawave_v3,417.21,1858.91,0.0
gfx950,256,128,8192,3584,torch.int8,28,0,13.8708,a8w8_rowwise_256x32x128x256_32x32_1x1_16x16x1_16x16x1_1x32x1x8_8x8x1_1x1_intrawave_v3,541.87,2300.95,0.0
gfx950,256,128,8192,7168,torch.int8,28,0,24.2653,a8w8_rowwise_256x32x128x256_32x32_1x1_16x16x1_16x16x1_1x32x1x8_8x8x1_1x1_intrawave_v3,619.5,2544.16,0.0
gfx950,256,128,8192,8192,torch.int8,28,0,26.3513,a8w8_rowwise_256x32x128x256_32x32_1x1_16x16x1_16x16x1_1x32x1x8_8x8x1_1x1_intrawave_v3,651.96,2666.08,0.0
gfx950,256,128,8192,8192,torch.float8_e4m3fn,23,0,23.2545,a8w8_rowwise_256x64x64x512_32x32_1x1_32x8x1_32x8x1_1x32x1x8_8x8x1_1x1_intrawave_v3,738.78,3021.12,0.0
gfx950,256,128,8192,28672,torch.int8,28,0,87.5085,a8w8_rowwise_256x32x128x256_32x32_1x1_16x16x1_16x16x1_1x32x1x8_8x8x1_1x1_intrawave_v3,687.13,2750.0,0.0
gfx950,256,128,9216,16384,torch.int8,23,0,59.454,a8w8_rowwise_256x64x64x512_32x32_1x1_32x8x1_32x8x1_1x32x1x8_8x8x1_1x1_intrawave_v3,650.16,2614.65,0.0
gfx950,256,128,10240,8192,torch.int8,15,0,31.2683,a8w8_rowwise_256x128x64x256_32x32_2x1_16x16x1_16x16x1_1x32x1x8_8x8x1_1x1_intrawave_v3,686.79,2800.16,0.0
gfx950,256,128,10240,8192,torch.float8_e4m3fn,22,0,30.8204,a8w8_rowwise_256x64x96x256_16x16_2x3_16x16x1_16x16x1_1x64x1x4_8x8x1_2x1_intrawave_v3,696.77,2840.85,0.0
gfx950,256,128,12800,5120,torch.int8,23,0,25.5896,a8w8_rowwise_256x64x64x512_32x32_1x1_32x8x1_32x8x1_1x32x1x8_8x8x1_1x1_intrawave_v3,655.63,2714.7,0.0
gfx950,256,128,13312,16384,torch.int8,23,0,65.9651,a8w8_rowwise_256x64x64x512_32x32_1x1_32x8x1_32x8x1_1x32x1x8_8x8x1_1x1_intrawave_v3,846.43,3389.81,0.0
gfx950,256,128,16384,2048,torch.int8,23,0,14.5668,a8w8_rowwise_256x64x64x512_32x32_1x1_32x8x1_32x8x1_1x32x1x8_8x8x1_1x1_intrawave_v3,589.69,2609.42,0.0
gfx950,256,128,16384,4096,torch.int8,23,0,23.3525,a8w8_rowwise_256x64x64x512_32x32_1x1_32x8x1_32x8x1_1x32x1x8_8x8x1_1x1_intrawave_v3,735.68,3075.79,0.0
gfx950,256,128,16384,6656,torch.int8,23,0,34.0329,a8w8_rowwise_256x64x64x512_32x32_1x1_32x8x1_32x8x1_1x32x1x8_8x8x1_1x1_intrawave_v3,820.3,3352.58,0.0
gfx950,256,128,16384,8192,torch.int8,23,0,45.1385,a8w8_rowwise_256x64x64x512_32x32_1x1_32x8x1_32x8x1_1x32x1x8_8x8x1_1x1_intrawave_v3,761.21,3089.62,0.0
gfx950,256,128,16384,13312,torch.int8,23,0,61.6432,a8w8_rowwise_256x64x64x512_32x32_1x1_32x8x1_32x8x1_1x32x1x8_8x8x1_1x1_intrawave_v3,905.77,3633.85,0.0
gfx950,256,128,16384,26624,torch.int8,23,0,118.3409,a8w8_rowwise_256x64x64x512_32x32_1x1_32x8x1_32x8x1_1x32x1x8_8x8x1_1x1_intrawave_v3,943.62,3750.27,0.0
gfx950,256,128,26624,16384,torch.int8,23,0,129.1529,a8w8_rowwise_256x64x64x512_32x32_1x1_32x8x1_32x8x1_1x32x1x8_8x8x1_1x1_intrawave_v3,864.63,3446.46,0.0
gfx950,256,128,28672,8192,torch.float8_e4m3fn,41,0,60.0008,a8w8_rowwise_256x128x128x128_32x32_2x2_8x32x1_8x32x1_1x32x1x8_8x8x1_1x1_intrawave_v5,1002.15,4054.44,0.0
gfx950,256,128,51200,5120,torch.int8,23,0,82.0559,a8w8_rowwise_256x64x64x512_32x32_1x1_32x8x1_32x8x1_1x32x1x8_8x8x1_1x1_intrawave_v3,817.84,3362.42,0.0
gfx950,256,128,53248,16384,torch.int8,23,0,230.1893,a8w8_rowwise_256x64x64x512_32x32_1x1_32x8x1_32x8x1_1x32x1x8_8x8x1_1x1_intrawave_v3,970.24,3858.32,0.0
gfx950,256,128,57344,8192,torch.int8,13,0,108.1045,a8w8_rowwise_256x128x128x128_32x32_2x2_8x32x1_8x32x1_1x32x1x8_8x8x1_1x1_intrawave_v3,1112.43,4490.94,0.0
gfx950,256,128,57344,8192,torch.float8_e4m3fn,35,0,111.2293,a8w8_rowwise_256x128x128x128_32x32_2x2_8x32x1_8x32x1_1x32x1x8_8x8x1_1x1_intrawave_v4,1081.18,4364.77,0.0
gfx950,256,128,105984,128,torch.float8_e4m3fn,44,0,15.537,a8w8_rowwise_256x128x128x128_32x32_2x2_8x32x1_8x32x1_1x32x1x8_8x8x1_1x1_interwave_v1,223.52,2620.47,0.0
gfx950,256,128,207616,128,torch.float8_e4m3fn,44,0,25.7878,a8w8_rowwise_256x128x128x128_32x32_2x2_8x32x1_8x32x1_1x32x1x8_8x8x1_1x1_interwave_v1,263.81,3092.2,0.0
gfx950,256,128,270080,128,torch.float8_e4m3fn,44,0,32.2348,a8w8_rowwise_256x128x128x128_32x32_2x2_8x32x1_8x32x1_1x32x1x8_8x8x1_1x1_interwave_v1,274.55,3217.86,0.0
gfx950,256,128,430336,128,torch.float8_e4m3fn,44,0,46.5205,a8w8_rowwise_256x128x128x128_32x32_2x2_8x32x1_8x32x1_1x32x1x8_8x8x1_1x1_interwave_v1,303.12,3552.53,0.0
gfx950,256,128,450560,128,torch.float8_e4m3fn,44,0,48.3917,a8w8_rowwise_256x128x128x128_32x32_2x2_8x32x1_8x32x1_1x32x1x8_8x8x1_1x1_interwave_v1,305.09,3575.64,0.0
gfx950,256,128,452352,128,torch.float8_e4m3fn,44,0,49.0249,a8w8_rowwise_256x128x128x128_32x32_2x2_8x32x1_8x32x1_1x32x1x8_8x8x1_1x1_interwave_v1,302.35,3543.5,0.0
gfx950,256,128,691968,128,torch.float8_e4m3fn,44,0,71.2418,a8w8_rowwise_256x128x128x128_32x32_2x2_8x32x1_8x32x1_1x32x1x8_8x8x1_1x1_interwave_v1,318.27,3730.0,0.0
gfx950,256,128,772736,128,torch.float8_e4m3fn,44,0,79.0658,a8w8_rowwise_256x128x128x128_32x32_2x2_8x32x1_8x32x1_1x32x1x8_8x8x1_1x1_interwave_v1,320.25,3753.17,0.0
gfx950,256,128,855424,128,torch.float8_e4m3fn,44,0,86.4286,a8w8_rowwise_256x128x128x128_32x32_2x2_8x32x1_8x32x1_1x32x1x8_8x8x1_1x1_interwave_v1,324.32,3800.82,0.0
gfx950,256,128,911744,128,torch.float8_e4m3fn,44,0,91.8719,a8w8_rowwise_256x128x128x128_32x32_2x2_8x32x1_8x32x1_1x32x1x8_8x8x1_1x1_interwave_v1,325.19,3811.02,0.0
gfx950,256,192,1280,8192,torch.float8_e4m3fn,34,0,15.3959,a8w8_rowwise_256x16x64x512_16x16_1x1_32x8x1_32x8x1_1x16x1x16_4x4x1_1x1_intrawave_v3,261.53,815.16,0.0
gfx950,256,192,8192,1024,torch.float8_e4m3fn,21,0,8.6496,a8w8_rowwise_256x64x128x256_32x32_1x2_16x16x1_16x16x1_1x32x1x8_8x8x1_1x1_intrawave_v3,372.41,1356.24,0.0
gfx950,256,256,100,5120,torch.int8,34,0,10.9556,a8w8_rowwise_256x16x64x512_16x16_1x1_32x8x1_32x8x1_1x16x1x16_4x4x1_1x1_intrawave_v3,23.93,171.05,0.0
gfx950,256,256,200,5120,torch.int8,34,0,9.8147,a8w8_rowwise_256x16x64x512_16x16_1x1_32x8x1_32x8x1_1x16x1x16_4x4x1_1x1_intrawave_v3,53.42,248.31,0.0
gfx950,256,256,256,128,torch.float8_e4m3fn,49,0,2.7541,a8w8_rowwise_64x16x16x128_16x16_1x1_8x8x1_8x8x1_1x16x1x4_4x4x1_1x1_intrawave_v1,6.09,71.39,0.0
gfx950,256,256,512,640,torch.float8_e4m3fn,79,0,3.6844,a8w8_rowwise_128x16x32x128_16x16_1x1_8x16x1_8x16x1_1x16x1x8_4x4x1_1x1_interwave_v2,45.54,204.56,0.0
gfx950,256,256,800,5120,torch.int8,34,0,11.8423,a8w8_rowwise_256x16x64x512_16x16_1x1_32x8x1_32x8x1_1x16x1x16_4x4x1_1x1_intrawave_v3,177.09,491.15,0.0
gfx950,256,256,1024,8192,torch.float8_e4m3fn,34,0,14.7059,a8w8_rowwise_256x16x64x512_16x16_1x1_32x8x1_32x8x1_1x16x1x16_4x4x1_1x1_intrawave_v3,292.06,748.68,0.0
gfx950,256,256,1280,8192,torch.int8,30,0,16.2863,a8w8_rowwise_256x32x64x512_16x16_1x2_32x8x1_32x8x1_1x32x1x8_8x8x1_1x2_intrawave_v3,329.65,812.85,0.0
gfx950,256,256,1280,8192,torch.float8_e4m3fn,30,0,17.037,a8w8_rowwise_256x32x64x512_16x16_1x2_32x8x1_32x8x1_1x32x1x8_8x8x1_1x2_intrawave_v3,315.12,777.03,0.0
gfx950,256,256,2304,16384,torch.int8,23,0,32.4817,a8w8_rowwise_256x64x64x512_32x32_1x1_32x8x1_32x8x1_1x32x1x8_8x8x1_1x1_intrawave_v3,595.02,1327.6,0.0
gfx950,256,256,2560,8192,torch.int8,28,0,23.112,a8w8_rowwise_256x32x128x256_32x32_1x1_16x16x1_16x16x1_1x32x1x8_8x8x1_1x1_intrawave_v3,464.58,1054.84,0.0
gfx950,256,256,3584,8192,torch.float8_e4m3fn,23,0,20.9257,a8w8_rowwise_256x64x64x512_32x32_1x1_32x8x1_32x8x1_1x32x1x8_8x8x1_1x1_intrawave_v3,718.37,1590.98,0.0
gfx950,256,256,4608,16384,torch.int8,23,0,55.0189,a8w8_rowwise_256x64x64x512_32x32_1x1_32x8x1_32x8x1_1x32x1x8_8x8x1_1x1_intrawave_v3,702.57,1491.33,0.0
gfx950,256,256,5120,640,torch.int8,81,0,6.6084,a8w8_rowwise_128x32x64x128_32x32_1x1_8x16x1_8x16x1_1x16x1x8_8x8x1_1x1_interwave_v2,253.88,917.33,0.0
gfx950,256,256,5120,1280,torch.int8,15,0,8.2757,a8w8_rowwise_256x128x64x256_32x32_2x1_16x16x1_16x16x1_1x32x1x8_8x8x1_1x1_intrawave_v3,405.46,1148.27,0.0
gfx950,256,256,5120,3200,torch.int8,15,0,15.7837,a8w8_rowwise_256x128x64x256_32x32_2x1_16x16x1_16x16x1_1x32x1x8_8x8x1_1x1_intrawave_v3,531.47,1256.02,0.0
gfx950,256,256,5120,5120,torch.int8,23,0,21.8405,a8w8_rowwise_256x64x64x512_32x32_1x1_32x8x1_32x8x1_1x32x1x8_8x8x1_1x1_intrawave_v3,614.54,1380.31,0.0
gfx950,256,256,5120,6400,torch.int8,21,0,23.7832,a8w8_rowwise_256x64x128x256_32x32_1x2_16x16x1_16x16x1_1x32x1x8_8x8x1_1x1_intrawave_v3,705.42,1556.89,0.0
gfx950,256,256,5120,25600,torch.int8,23,0,86.0166,a8w8_rowwise_256x64x64x512_32x32_1x1_32x8x1_32x8x1_1x32x1x8_8x8x1_1x1_intrawave_v3,780.19,1630.46,0.0
gfx950,256,256,6400,5120,torch.int8,23,0,22.7861,a8w8_rowwise_256x64x64x512_32x32_1x1_32x8x1_32x8x1_1x32x1x8_8x8x1_1x1_intrawave_v3,736.29,1639.4,0.0
gfx950,256,256,7168,8192,torch.int8,15,0,30.291,a8w8_rowwise_256x128x64x256_32x32_2x1_16x16x1_16x16x1_1x32x1x8_8x8x1_1x1_intrawave_v3,992.53,2128.93,0.0
gfx950,256,256,7168,8192,torch.float8_e4m3fn,15,0,30.0111,a8w8_rowwise_256x128x64x256_32x32_2x1_16x16x1_16x16x1_1x32x1x8_8x8x1_1x1_intrawave_v3,1001.79,2148.79,0.0
gfx950,256,256,8192,1024,torch.int8,21,0,8.6043,a8w8_rowwise_256x64x128x256_32x32_1x2_16x16x1_16x16x1_1x32x1x8_8x8x1_1x1_intrawave_v3,499.17,1492.86,0.0
gfx950,256,256,8192,1024,torch.float8_e4m3fn,15,0,9.1986,a8w8_rowwise_256x128x64x256_32x32_2x1_16x16x1_16x16x1_1x32x1x8_8x8x1_1x1_intrawave_v3,466.92,1396.41,0.0
gfx950,256,256,8192,2048,torch.int8,15,0,10.9387,a8w8_rowwise_256x128x64x256_32x32_2x1_16x16x1_16x16x1_1x32x1x8_8x8x1_1x1_intrawave_v3,785.28,1965.12,0.0
gfx950,256,256,8192,3584,torch.int8,15,0,16.5846,a8w8_rowwise_256x128x64x256_32x32_2x1_16x16x1_16x16x1_1x32x1x8_8x8x1_1x1_intrawave_v3,906.41,2078.55,0.0
gfx950,256,256,8192,7168,torch.int8,21,0,29.138,a8w8_rowwise_256x64x128x256_32x32_1x2_16x16x1_16x16x1_1x32x1x8_8x8x1_1x1_intrawave_v3,1031.81,2222.17,0.0
gfx950,256,256,8192,8192,torch.int8,15,0,31.6256,a8w8_rowwise_256x128x64x256_32x32_2x1_16x16x1_16x16x1_1x32x1x8_8x8x1_1x1_intrawave_v3,1086.45,2320.91,0.0
gfx950,256,256,8192,8192,torch.float8_e4m3fn,15,0,31.0706,a8w8_rowwise_256x128x64x256_32x32_2x1_16x16x1_16x16x1_1x32x1x8_8x8x1_1x1_intrawave_v3,1105.86,2362.37,0.0
gfx950,256,256,8192,28672,torch.int8,15,0,102.0397,a8w8_rowwise_256x128x64x256_32x32_2x1_16x16x1_16x16x1_1x32x1x8_8x8x1_1x1_intrawave_v3,1178.55,2414.9,0.0
gfx950,256,256,9216,16384,torch.int8,23,0,86.8248,a8w8_rowwise_256x64x64x512_32x32_1x1_32x8x1_32x8x1_1x32x1x8_8x8x1_1x1_intrawave_v3,890.41,1841.73,0.0
gfx950,256,256,10240,8192,torch.int8,41,0,42.9954,a8w8_rowwise_256x128x128x128_32x32_2x2_8x32x1_8x32x1_1x32x1x8_8x8x1_1x1_intrawave_v5,998.94,2121.76,0.0
gfx950,256,256,10240,8192,torch.float8_e4m3fn,14,0,37.6153,a8w8_rowwise_256x128x96x256_32x32_1x3_16x16x1_16x16x1_1x64x1x4_8x8x1_1x1_intrawave_v3,1141.81,2425.24,0.0
gfx950,256,256,12800,5120,torch.int8,15,0,42.5463,a8w8_rowwise_256x128x64x256_32x32_2x1_16x16x1_16x16x1_1x32x1x8_8x8x1_1x1_intrawave_v3,788.66,1725.19,0.0
gfx950,256,256,13312,16384,torch.int8,23,0,113.4219,a8w8_rowwise_256x64x64x512_32x32_1x1_32x8x1_32x8x1_1x32x1x8_8x8x1_1x1_intrawave_v3,984.55,2020.01,0.0
gfx950,256,256,16384,2048,torch.int8,15,0,22.0982,a8w8_rowwise_256x128x64x256_32x32_2x1_16x16x1_16x16x1_1x32x1x8_8x8x1_1x1_intrawave_v3,777.43,1921.76,0.0
gfx950,256,256,16384,4096,torch.int8,15,0,39.8495,a8w8_rowwise_256x128x64x256_32x32_2x1_16x16x1_16x16x1_1x32x1x8_8x8x1_1x1_intrawave_v3,862.24,1920.88,0.0
gfx950,256,256,16384,6656,torch.int8,23,0,57.6756,a8w8_rowwise_256x64x64x512_32x32_1x1_32x8x1_32x8x1_1x32x1x8_8x8x1_1x1_intrawave_v3,968.08,2065.77,0.0
gfx950,256,256,16384,8192,torch.int8,15,0,72.9104,a8w8_rowwise_256x128x64x256_32x32_2x1_16x16x1_16x16x1_1x32x1x8_8x8x1_1x1_intrawave_v3,942.52,1984.68,0.0
gfx950,256,256,16384,13312,torch.int8,23,0,106.2833,a8w8_rowwise_256x64x64x512_32x32_1x1_32x8x1_32x8x1_1x32x1x8_8x8x1_1x1_intrawave_v3,1050.67,2163.09,0.0
gfx950,256,256,16384,26624,torch.int8,23,0,202.2465,a8w8_rowwise_256x64x64x512_32x32_1x1_32x8x1_32x8x1_1x32x1x8_8x8x1_1x1_intrawave_v3,1104.29,2231.99,0.0
gfx950,256,256,26624,16384,torch.int8,23,0,206.2403,a8w8_rowwise_256x64x64x512_32x32_1x1_32x8x1_32x8x1_1x32x1x8_8x8x1_1x1_intrawave_v3,1082.9,2201.48,0.0
gfx950,256,256,28672,8192,torch.float8_e4m3fn,4,0,80.7001,a8w8_rowwise_256x256x160x128_32x32_2x5_8x32x1_8x32x1_1x64x1x4_8x8x1_2x1_intrawave_v3,1490.2,3118.44,0.0
gfx950,256,256,51200,5120,torch.int8,40,0,120.9285,a8w8_rowwise_256x256x224x128_16x16_8x7_8x32x1_8x32x1_1x64x1x4_8x8x1_2x1_intrawave_v3,1109.89,2395.38,0.0
gfx950,256,256,53248,16384,torch.int8,40,0,368.0253,a8w8_rowwise_256x256x224x128_16x16_8x7_8x32x1_8x32x1_1x64x1x4_8x8x1_2x1_intrawave_v3,1213.71,2456.01,0.0
gfx950,256,256,57344,8192,torch.int8,2,0,135.372,a8w8_rowwise_256x256x224x128_32x32_2x7_8x32x1_8x32x1_1x64x1x4_8x8x1_2x1_intrawave_v3,1776.72,3702.53,0.0
gfx950,256,256,57344,8192,torch.float8_e4m3fn,2,0,140.7498,a8w8_rowwise_256x256x224x128_32x32_2x7_8x32x1_8x32x1_1x64x1x4_8x8x1_2x1_intrawave_v3,1708.83,3561.07,0.0
gfx950,256,320,1280,8192,torch.float8_e4m3fn,30,0,17.4934,a8w8_rowwise_256x32x64x512_16x16_1x2_32x8x1_32x8x1_1x32x1x8_8x8x1_1x2_intrawave_v3,383.62,796.09,0.0
gfx950,256,320,8192,1024,torch.float8_e4m3fn,62,0,12.0692,a8w8_rowwise_128x32x64x128_32x32_1x1_8x16x1_8x16x1_1x16x1x8_8x8x1_1x1_intrawave_v2,444.83,1156.59,0.0
gfx950,256,384,8448,30080,torch.float8_e4m3fn,41,0,147.1478,a8w8_rowwise_256x128x128x128_32x32_2x2_8x32x1_8x32x1_1x32x1x8_8x8x1_1x1_intrawave_v5,1326.29,1849.53,0.0
gfx950,256,512,100,5120,torch.int8,34,0,11.1055,a8w8_rowwise_256x16x64x512_16x16_1x1_32x8x1_32x8x1_1x16x1x16_4x4x1_1x1_intrawave_v3,47.21,291.37,0.0
gfx950,256,512,200,5120,torch.int8,34,0,11.8774,a8w8_rowwise_256x16x64x512_16x16_1x1_32x8x1_32x8x1_1x16x1x16_4x4x1_1x1_intrawave_v3,88.28,324.17,0.0
gfx950,256,512,800,5120,torch.int8,30,0,13.1908,a8w8_rowwise_256x32x64x512_16x16_1x2_32x8x1_32x8x1_1x32x1x8_8x8x1_1x2_intrawave_v3,317.97,571.36,0.0
gfx950,256,512,1280,8192,torch.int8,28,0,23.2059,a8w8_rowwise_256x32x128x256_32x32_1x1_16x16x1_16x16x1_1x32x1x8_8x8x1_1x1_intrawave_v3,462.7,689.08,0.0
gfx950,256,512,1280,8192,torch.float8_e4m3fn,23,0,21.2265,a8w8_rowwise_256x64x64x512_32x32_1x1_32x8x1_32x8x1_1x32x1x8_8x8x1_1x1_intrawave_v3,505.85,753.34,0.0
gfx950,256,512,1792,7424,torch.float8_e4m3fn,23,0,20.9911,a8w8_rowwise_256x64x64x512_32x32_1x1_32x8x1_32x8x1_1x32x1x8_8x8x1_1x1_intrawave_v3,648.99,902.28,0.0
gfx950,256,512,1920,6784,torch.float8_e4m3fn,23,0,19.552,a8w8_rowwise_256x64x64x512_32x32_1x1_32x8x1_32x8x1_1x32x1x8_8x8x1_1x1_intrawave_v3,682.18,944.39,0.0
gfx950,256,512,2304,16384,torch.int8,23,0,54.2058,a8w8_rowwise_256x64x64x512_32x32_1x1_32x8x1_32x8x1_1x32x1x8_8x8x1_1x1_intrawave_v3,713.11,894.68,0.0
gfx950,256,512,2560,8192,torch.int8,21,0,27.6646,a8w8_rowwise_256x64x128x256_32x32_1x2_16x16x1_16x16x1_1x32x1x8_8x8x1_1x1_intrawave_v3,776.26,1004.43,0.0
gfx950,256,512,4608,16384,torch.int8,23,0,87.1647,a8w8_rowwise_256x64x64x512_32x32_1x1_32x8x1_32x8x1_1x32x1x8_8x8x1_1x1_intrawave_v3,886.93,1016.52,0.0
gfx950,256,512,5120,640,torch.int8,47,0,8.4036,a8w8_rowwise_256x64x64x128_32x32_1x1_8x32x1_8x32x1_1x32x1x8_8x8x1_1x1_intrawave_v3,399.29,1052.81,0.0
gfx950,256,512,5120,1280,torch.int8,22,0,12.2285,a8w8_rowwise_256x64x96x256_16x16_2x3_16x16x1_16x16x1_1x64x1x4_8x8x1_2x1_intrawave_v3,548.79,1018.26,0.0
gfx950,256,512,5120,3200,torch.int8,13,0,21.8498,a8w8_rowwise_256x128x128x128_32x32_2x2_8x32x1_8x32x1_1x32x1x8_8x8x1_1x1_intrawave_v3,767.84,1064.78,0.0
gfx950,256,512,5120,5120,torch.int8,23,0,33.1376,a8w8_rowwise_256x64x64x512_32x32_1x1_32x8x1_32x8x1_1x32x1x8_8x8x1_1x1_intrawave_v3,810.06,1028.4,0.0
gfx950,256,512,5120,6400,torch.int8,15,0,38.8017,a8w8_rowwise_256x128x64x256_32x32_2x1_16x16x1_16x16x1_1x32x1x8_8x8x1_1x1_intrawave_v3,864.77,1064.07,0.0
gfx950,256,512,5120,25600,torch.int8,23,0,131.897,a8w8_rowwise_256x64x64x512_32x32_1x1_32x8x1_32x8x1_1x32x1x8_8x8x1_1x1_intrawave_v3,1017.6,1132.87,0.0
gfx950,256,512,6400,5120,torch.int8,15,0,41.3468,a8w8_rowwise_256x128x64x256_32x32_2x1_16x16x1_16x16x1_1x32x1x8_8x8x1_1x1_intrawave_v3,811.54,1014.42,0.0
gfx950,256,512,7168,8192,torch.int8,41,0,47.5197,a8w8_rowwise_256x128x128x128_32x32_2x2_8x32x1_8x32x1_1x32x1x8_8x8x1_1x1_intrawave_v5,1265.36,1478.43,0.0
gfx950,256,512,8192,1024,torch.int8,13,0,11.7749,a8w8_rowwise_256x128x128x128_32x32_2x2_8x32x1_8x32x1_1x32x1x8_8x8x1_1x1_intrawave_v3,729.51,1469.35,0.0
gfx950,256,512,8192,1024,torch.float8_e4m3fn,13,0,12.6356,a8w8_rowwise_256x128x128x128_32x32_2x2_8x32x1_8x32x1_1x32x1x8_8x8x1_1x1_intrawave_v3,679.82,1369.27,0.0
gfx950,256,512,8192,2048,torch.int8,41,0,16.8904,a8w8_rowwise_256x128x128x128_32x32_2x2_8x32x1_8x32x1_1x32x1x8_8x8x1_1x1_intrawave_v5,1017.14,1552.03,0.0
gfx950,256,512,8192,3584,torch.int8,41,0,24.9561,a8w8_rowwise_256x128x128x128_32x32_2x2_8x32x1_8x32x1_1x32x1x8_8x8x1_1x1_intrawave_v5,1204.71,1586.14,0.0
gfx950,256,512,8192,7168,torch.int8,41,0,44.168,a8w8_rowwise_256x128x128x128_32x32_2x2_8x32x1_8x32x1_1x32x1x8_8x8x1_1x1_intrawave_v5,1361.38,1602.49,0.0
gfx950,256,512,8192,8192,torch.int8,13,0,51.209,a8w8_rowwise_256x128x128x128_32x32_2x2_8x32x1_8x32x1_1x32x1x8_8x8x1_1x1_intrawave_v3,1341.94,1556.21,0.0
gfx950,256,512,8192,28672,torch.int8,41,0,150.8316,a8w8_rowwise_256x128x128x128_32x32_2x2_8x32x1_8x32x1_1x32x1x8_8x8x1_1x1_intrawave_v5,1594.61,1710.18,0.0
gfx950,256,512,9216,16384,torch.int8,23,0,141.9471,a8w8_rowwise_256x64x64x512_32x32_1x1_32x8x1_32x8x1_1x32x1x8_8x8x1_1x1_intrawave_v3,1089.27,1189.32,0.0
gfx950,256,512,10240,8192,torch.int8,11,0,61.9597,a8w8_rowwise_256x128x160x128_32x32_1x5_8x32x1_8x32x1_1x64x1x4_8x8x1_1x1_intrawave_v3,1386.37,1590.81,0.0
gfx950,256,512,12800,5120,torch.int8,23,0,74.3061,a8w8_rowwise_256x64x64x512_32x32_1x1_32x8x1_32x8x1_1x32x1x8_8x8x1_1x1_intrawave_v3,903.14,1093.65,0.0
gfx950,256,512,13312,16384,torch.int8,23,0,199.0315,a8w8_rowwise_256x64x64x512_32x32_1x1_32x8x1_32x8x1_1x32x1x8_8x8x1_1x1_intrawave_v3,1122.13,1206.46,0.0
gfx950,256,512,16384,2048,torch.int8,15,0,38.4305,a8w8_rowwise_256x128x64x256_32x32_2x1_16x16x1_16x16x1_1x32x1x8_8x8x1_1x1_intrawave_v3,894.07,1336.96,0.0
gfx950,256,512,16384,4096,torch.int8,15,0,65.4454,a8w8_rowwise_256x128x64x256_32x32_2x1_16x16x1_16x16x1_1x32x1x8_8x8x1_1x1_intrawave_v3,1050.03,1313.82,0.0
gfx950,256,512,16384,6656,torch.int8,15,0,102.3241,a8w8_rowwise_256x128x64x256_32x32_2x1_16x16x1_16x16x1_1x32x1x8_8x8x1_1x1_intrawave_v3,1091.33,1263.02,0.0
gfx950,256,512,16384,8192,torch.int8,15,0,123.6929,a8w8_rowwise_256x128x64x256_32x32_2x1_16x16x1_16x16x1_1x32x1x8_8x8x1_1x1_intrawave_v3,1111.13,1254.63,0.0
gfx950,256,512,16384,13312,torch.int8,15,0,191.2442,a8w8_rowwise_256x128x64x256_32x32_2x1_16x16x1_16x16x1_1x32x1x8_8x8x1_1x1_intrawave_v3,1167.82,1263.81,0.0
gfx950,256,512,16384,26624,torch.int8,15,0,365.7012,a8w8_rowwise_256x128x64x256_32x32_2x1_16x16x1_16x16x1_1x32x1x8_8x8x1_1x1_intrawave_v3,1221.43,1275.95,0.0
gfx950,256,512,26624,16384,torch.int8,15,0,349.3418,a8w8_rowwise_256x128x64x256_32x32_2x1_16x16x1_16x16x1_1x32x1x8_8x8x1_1x1_intrawave_v3,1278.62,1350.71,0.0
gfx950,256,512,51200,5120,torch.int8,40,0,223.8159,a8w8_rowwise_256x256x224x128_16x16_8x7_8x32x1_8x32x1_1x64x1x4_8x8x1_2x1_intrawave_v3,1199.36,1417.21,0.0
gfx950,256,512,53248,16384,torch.int8,15,0,651.6344,a8w8_rowwise_256x128x64x256_32x32_2x1_16x16x1_16x16x1_1x32x1x8_8x8x1_1x1_intrawave_v3,1370.94,1435.36,0.0
gfx950,256,512,57344,8192,torch.int8,2,0,233.9286,a8w8_rowwise_256x256x224x128_32x32_2x7_8x32x1_8x32x1_1x64x1x4_8x8x1_2x1_intrawave_v3,2056.34,2277.09,0.0
gfx950,256,640,128,128,torch.float8_e4m3fn,50,0,2.799,a8w8_rowwise_128x16x32x128_16x16_1x1_8x16x1_8x16x1_1x16x1x8_4x4x1_1x1_intrawave_v1,7.49,93.66,0.0
gfx950,256,640,256,768,torch.float8_e4m3fn,79,0,3.9362,a8w8_rowwise_128x16x32x128_16x16_1x1_8x16x1_8x16x1_1x16x1x8_4x4x1_1x1_interwave_v2,63.93,258.07,0.0
gfx950,256,640,384,128,torch.float8_e4m3fn,49,0,2.9702,a8w8_rowwise_64x16x16x128_16x16_1x1_8x8x1_8x8x1_1x16x1x4_4x4x1_1x1_intrawave_v1,21.18,209.61,0.0
gfx950,256,640,768,896,torch.float8_e4m3fn,76,0,5.2439,a8w8_rowwise_128x32x16x128_16x16_1x1_8x16x1_8x16x1_1x16x1x8_2x2x1_1x1_interwave_v2,167.97,428.04,0.0
gfx950,256,1024,100,5120,torch.int8,34,0,11.6746,a8w8_rowwise_256x16x64x512_16x16_1x1_32x8x1_32x8x1_1x16x1x16_4x4x1_1x1_intrawave_v3,89.82,510.48,0.0
gfx950,256,1024,200,5120,torch.int8,34,0,12.0055,a8w8_rowwise_256x16x64x512_16x16_1x1_32x8x1_32x8x1_1x16x1x16_4x4x1_1x1_intrawave_v3,174.68,556.12,0.0
gfx950,256,1024,800,5120,torch.int8,23,0,15.5235,a8w8_rowwise_256x64x64x512_32x32_1x1_32x8x1_32x8x1_1x32x1x8_8x8x1_1x1_intrawave_v3,540.38,707.14,0.0
gfx950,256,1024,1280,8192,torch.int8,21,0,27.7294,a8w8_rowwise_256x64x128x256_32x32_1x2_16x16x1_16x16x1_1x32x1x8_8x8x1_1x1_intrawave_v3,774.44,775.2,0.0
gfx950,256,1024,1280,8192,torch.float8_e4m3fn,21,0,28.4599,a8w8_rowwise_256x64x128x256_32x32_1x2_16x16x1_16x16x1_1x32x1x8_8x8x1_1x1_intrawave_v3,754.56,755.3,0.0
gfx950,256,1024,2304,16384,torch.int8,23,0,86.7135,a8w8_rowwise_256x64x64x512_32x32_1x1_32x8x1_32x8x1_1x32x1x8_8x8x1_1x1_intrawave_v3,891.55,683.22,0.0
gfx950,256,1024,2560,8192,torch.int8,41,0,42.1202,a8w8_rowwise_256x128x128x128_32x32_2x2_8x32x1_8x32x1_1x32x1x8_8x8x1_1x1_intrawave_v5,1019.69,821.53,0.0
gfx950,256,1024,4608,16384,torch.int8,23,0,143.2677,a8w8_rowwise_256x64x64x512_32x32_1x1_32x8x1_32x8x1_1x32x1x8_8x8x1_1x1_intrawave_v3,1079.23,709.94,0.0
gfx950,256,1024,5120,640,torch.int8,11,0,11.7704,a8w8_rowwise_256x128x160x128_32x32_1x5_8x32x1_8x32x1_1x64x1x4_8x8x1_1x1_intrawave_v3,570.15,1224.93,0.0
gfx950,256,1024,5120,1280,torch.int8,11,0,17.5871,a8w8_rowwise_256x128x160x128_32x32_1x5_8x32x1_8x32x1_1x64x1x4_8x8x1_1x1_intrawave_v3,763.16,1043.38,0.0
gfx950,256,1024,5120,3200,torch.int8,11,0,27.688,a8w8_rowwise_256x128x160x128_32x32_1x5_8x32x1_8x32x1_1x64x1x4_8x8x1_1x1_intrawave_v3,1211.88,1088.8,0.0
gfx950,256,1024,5120,5120,torch.int8,23,0,55.7649,a8w8_rowwise_256x64x64x512_32x32_1x1_32x8x1_32x8x1_1x32x1x8_8x8x1_1x1_intrawave_v3,962.74,752.14,0.0
gfx950,256,1024,5120,6400,torch.int8,11,0,57.5786,a8w8_rowwise_256x128x160x128_32x32_1x5_8x32x1_8x32x1_1x64x1x4_8x8x1_1x1_intrawave_v3,1165.52,865.03,0.0
gfx950,256,1024,5120,25600,torch.int8,23,0,227.1849,a8w8_rowwise_256x64x64x512_32x32_1x1_32x8x1_32x8x1_1x32x1x8_8x8x1_1x1_intrawave_v3,1181.57,738.48,0.0
gfx950,256,1024,6400,5120,torch.int8,23,0,72.0506,a8w8_rowwise_256x64x64x512_32x32_1x1_32x8x1_32x8x1_1x32x1x8_8x8x1_1x1_intrawave_v3,931.41,709.47,0.0
gfx950,256,1024,7168,8192,torch.int8,13,0,82.6278,a8w8_rowwise_256x128x128x128_32x32_2x2_8x32x1_8x32x1_1x32x1x8_8x8x1_1x1_intrawave_v3,1455.43,989.85,0.0
gfx950,256,1024,8192,1024,torch.int8,13,0,17.3848,a8w8_rowwise_256x128x128x128_32x32_2x2_8x32x1_8x32x1_1x32x1x8_8x8x1_1x1_intrawave_v3,988.21,1507.89,0.0
gfx950,256,1024,8192,1024,torch.float8_e4m3fn,13,0,18.4495,a8w8_rowwise_256x128x128x128_32x32_2x2_8x32x1_8x32x1_1x32x1x8_8x8x1_1x1_intrawave_v3,931.18,1420.87,0.0
gfx950,256,1024,8192,2048,torch.int8,41,0,27.2285,a8w8_rowwise_256x128x128x128_32x32_2x2_8x32x1_8x32x1_1x32x1x8_8x8x1_1x1_intrawave_v5,1261.9,1309.35,0.0
gfx950,256,1024,8192,3584,torch.int8,13,0,43.9928,a8w8_rowwise_256x128x128x128_32x32_2x2_8x32x1_8x32x1_1x32x1x8_8x8x1_1x1_intrawave_v3,1366.8,1132.17,0.0
gfx950,256,1024,8192,7168,torch.int8,13,0,79.3336,a8w8_rowwise_256x128x128x128_32x32_2x2_8x32x1_8x32x1_1x32x1x8_8x8x1_1x1_intrawave_v3,1515.87,1044.17,0.0
gfx950,256,1024,8192,8192,torch.int8,13,0,88.9386,a8w8_rowwise_256x128x128x128_32x32_2x2_8x32x1_8x32x1_1x32x1x8_8x8x1_1x1_intrawave_v3,1545.32,1037.51,0.0
gfx950,256,1024,8192,28672,torch.int8,41,0,274.6402,a8w8_rowwise_256x128x128x128_32x32_2x2_8x32x1_8x32x1_1x32x1x8_8x8x1_1x1_intrawave_v5,1751.51,1023.22,0.0
gfx950,256,1024,9216,16384,torch.int8,15,0,243.9282,a8w8_rowwise_256x128x64x256_32x32_2x1_16x16x1_16x16x1_1x32x1x8_8x8x1_1x1_intrawave_v3,1267.74,765.17,0.0
gfx950,256,1024,10240,8192,torch.int8,4,0,89.391,a8w8_rowwise_256x256x160x128_32x32_2x5_8x32x1_8x32x1_1x64x1x4_8x8x1_2x1_intrawave_v3,1921.88,1266.86,0.0
gfx950,256,1024,12800,5120,torch.int8,40,0,104.2861,a8w8_rowwise_256x256x224x128_16x16_8x7_8x32x1_8x32x1_1x64x1x4_8x8x1_2x1_intrawave_v3,1287.01,930.07,0.0
gfx950,256,1024,13312,16384,torch.int8,40,0,306.5211,a8w8_rowwise_256x256x224x128_16x16_8x7_8x32x1_8x32x1_1x64x1x4_8x8x1_2x1_intrawave_v3,1457.25,855.22,0.0
gfx950,256,1024,16384,2048,torch.int8,1,0,61.8687,a8w8_rowwise_256x256x256x128_32x32_4x4_8x32x1_8x32x1_1x32x1x8_8x8x1_1x1_intrawave_v3,1110.73,1118.59,0.0
gfx950,256,1024,16384,4096,torch.int8,1,0,108.4683,a8w8_rowwise_256x256x256x128_32x32_4x4_8x32x1_8x32x1_1x32x1x8_8x8x1_1x1_intrawave_v3,1267.09,966.71,0.0
gfx950,256,1024,16384,6656,torch.int8,1,0,165.4754,a8w8_rowwise_256x256x256x128_32x32_4x4_8x32x1_8x32x1_1x32x1x8_8x8x1_1x1_intrawave_v3,1349.68,902.99,0.0
gfx950,256,1024,16384,8192,torch.int8,1,0,202.2384,a8w8_rowwise_256x256x256x128_32x32_4x4_8x32x1_8x32x1_1x32x1x8_8x8x1_1x1_intrawave_v3,1359.18,871.05,0.0
gfx950,256,1024,16384,13312,torch.int8,1,0,307.7016,a8w8_rowwise_256x256x256x128_32x32_4x4_8x32x1_8x32x1_1x32x1x8_8x8x1_1x1_intrawave_v3,1451.66,862.17,0.0
gfx950,256,1024,16384,26624,torch.int8,1,0,603.8507,a8w8_rowwise_256x256x256x128_32x32_4x4_8x32x1_8x32x1_1x32x1x8_8x8x1_1x1_intrawave_v3,1479.43,823.09,0.0
gfx950,256,1024,26624,16384,torch.int8,15,0,630.2527,a8w8_rowwise_256x128x64x256_32x32_2x1_16x16x1_16x16x1_1x32x1x8_8x8x1_1x1_intrawave_v3,1417.45,805.25,0.0
gfx950,256,1024,51200,5120,torch.int8,39,0,396.7395,a8w8_rowwise_256x224x256x128_16x16_7x8_8x32x1_8x32x1_1x32x1x8_8x8x1_1x2_intrawave_v3,1353.21,938.26,0.0
gfx950,256,1024,53248,16384,torch.int8,40,0,1195.3563,a8w8_rowwise_256x256x224x128_16x16_8x7_8x32x1_8x32x1_1x64x1x4_8x8x1_2x1_intrawave_v3,1494.71,835.1,0.0
gfx950,256,1024,57344,8192,torch.int8,2,0,438.8629,a8w8_rowwise_256x256x224x128_32x32_2x7_8x32x1_8x32x1_1x64x1x4_8x8x1_2x1_intrawave_v3,2192.19,1357.12,0.0
gfx950,256,2048,100,5120,torch.int8,34,0,11.6595,a8w8_rowwise_256x16x64x512_16x16_1x1_32x8x1_32x8x1_1x16x1x16_4x4x1_1x1_intrawave_v3,179.87,978.37,0.0
gfx950,256,2048,200,5120,torch.int8,30,0,13.0876,a8w8_rowwise_256x32x64x512_16x16_1x2_32x8x1_32x8x1_1x32x1x8_8x8x1_1x2_intrawave_v3,320.48,942.03,0.0
gfx950,256,2048,800,5120,torch.int8,23,0,24.3923,a8w8_rowwise_256x64x64x512_32x32_1x1_32x8x1_32x8x1_1x32x1x8_8x8x1_1x1_intrawave_v3,687.81,732.14,0.0
gfx950,256,2048,1280,8192,torch.int8,41,0,42.0169,a8w8_rowwise_256x128x128x128_32x32_2x2_8x32x1_8x32x1_1x32x1x8_8x8x1_1x1_intrawave_v5,1022.2,773.64,0.0
gfx950,256,2048,1280,8192,torch.float8_e4m3fn,14,0,36.1844,a8w8_rowwise_256x128x96x256_32x32_1x3_16x16x1_16x16x1_1x64x1x4_8x8x1_1x1_intrawave_v3,1186.97,898.34,0.0
gfx950,256,2048,2304,16384,torch.int8,23,0,145.2155,a8w8_rowwise_256x64x64x512_32x32_1x1_32x8x1_32x8x1_1x32x1x8_8x8x1_1x1_intrawave_v3,1064.75,556.0,0.0
gfx950,256,2048,2560,8192,torch.int8,11,0,61.0366,a8w8_rowwise_256x128x160x128_32x32_1x5_8x32x1_8x32x1_1x64x1x4_8x8x1_1x1_intrawave_v3,1407.34,790.26,0.0
gfx950,256,2048,4608,16384,torch.int8,11,0,247.0665,a8w8_rowwise_256x128x160x128_32x32_1x5_8x32x1_8x32x1_1x64x1x4_8x8x1_1x1_intrawave_v3,1251.64,517.78,0.0
gfx950,256,2048,5120,640,torch.int8,10,0,17.6749,a8w8_rowwise_256x128x192x128_32x32_2x3_8x32x1_8x32x1_1x32x1x8_8x8x1_1x1_intrawave_v3,759.37,1446.06,0.0
gfx950,256,2048,5120,1280,torch.int8,4,0,27.4475,a8w8_rowwise_256x256x160x128_32x32_2x5_8x32x1_8x32x1_1x64x1x4_8x8x1_2x1_intrawave_v3,978.0,1098.34,0.0
gfx950,256,2048,5120,3200,torch.int8,4,0,44.9517,a8w8_rowwise_256x256x160x128_32x32_2x5_8x32x1_8x32x1_1x64x1x4_8x8x1_2x1_intrawave_v3,1492.91,976.81,0.0
gfx950,256,2048,5120,5120,torch.int8,15,0,96.048,a8w8_rowwise_256x128x64x256_32x32_2x1_16x16x1_16x16x1_1x32x1x8_8x8x1_1x1_intrawave_v3,1117.92,600.45,0.0
gfx950,256,2048,5120,6400,torch.int8,4,0,90.0028,a8w8_rowwise_256x256x160x128_32x32_2x5_8x32x1_8x32x1_1x64x1x4_8x8x1_2x1_intrawave_v3,1491.26,742.72,0.0
gfx950,256,2048,5120,25600,torch.int8,15,0,419.2679,a8w8_rowwise_256x128x64x256_32x32_2x1_16x16x1_16x16x1_1x32x1x8_8x8x1_1x1_intrawave_v3,1280.5,487.69,0.0
gfx950,256,2048,6400,5120,torch.int8,39,0,107.5421,a8w8_rowwise_256x224x256x128_16x16_7x8_8x32x1_8x32x1_1x32x1x8_8x8x1_1x2_intrawave_v3,1248.05,645.96,0.0
gfx950,256,2048,7168,8192,torch.int8,2,0,116.6871,a8w8_rowwise_256x256x224x128_32x32_2x7_8x32x1_8x32x1_1x64x1x4_8x8x1_2x1_intrawave_v3,2061.22,898.62,0.0
gfx950,256,2048,8192,1024,torch.int8,1,0,29.7892,a8w8_rowwise_256x256x256x128_32x32_4x4_8x32x1_8x32x1_1x32x1x8_8x8x1_1x1_intrawave_v3,1153.43,1478.39,0.0
gfx950,256,2048,8192,1024,torch.float8_e4m3fn,43,0,31.5009,a8w8_rowwise_256x256x128x64_32x32_4x2_4x64x1_4x64x1_1x32x1x8_8x8x1_1x1_interwave_v1,1090.75,1398.06,0.0
gfx950,256,2048,8192,2048,torch.int8,1,0,42.7444,a8w8_rowwise_256x256x256x128_32x32_4x4_8x32x1_8x32x1_1x32x1x8_8x8x1_1x1_intrawave_v3,1607.68,1275.63,0.0
gfx950,256,2048,8192,3584,torch.int8,1,0,65.1518,a8w8_rowwise_256x256x256x128_32x32_4x4_8x32x1_8x32x1_1x32x1x8_8x8x1_1x1_intrawave_v3,1845.83,1078.32,0.0
gfx950,256,2048,8192,7168,torch.int8,1,0,113.2102,a8w8_rowwise_256x256x256x128_32x32_4x4_8x32x1_8x32x1_1x32x1x8_8x8x1_1x1_intrawave_v3,2124.53,944.74,0.0
gfx950,256,2048,8192,8192,torch.int8,1,0,125.3472,a8w8_rowwise_256x256x256x128_32x32_4x4_8x32x1_8x32x1_1x32x1x8_8x8x1_1x1_intrawave_v3,2192.93,936.92,0.0
gfx950,256,2048,8192,28672,torch.int8,1,0,387.0603,a8w8_rowwise_256x256x256x128_32x32_4x4_8x32x1_8x32x1_1x32x1x8_8x8x1_1x1_intrawave_v3,2485.59,845.23,0.0
gfx950,256,2048,9216,16384,torch.int8,15,0,431.0243,a8w8_rowwise_256x128x64x256_32x32_2x1_16x16x1_16x16x1_1x32x1x8_8x8x1_1x1_intrawave_v3,1434.9,515.74,0.0
gfx950,256,2048,10240,8192,torch.int8,4,0,170.1034,a8w8_rowwise_256x256x160x128_32x32_2x5_8x32x1_8x32x1_1x64x1x4_8x8x1_2x1_intrawave_v3,2019.93,838.35,0.0
gfx950,256,2048,12800,5120,torch.int8,39,0,188.6903,a8w8_rowwise_256x224x256x128_16x16_7x8_8x32x1_8x32x1_1x32x1x8_8x8x1_1x2_intrawave_v3,1422.62,680.75,0.0
gfx950,256,2048,13312,16384,torch.int8,40,0,609.7983,a8w8_rowwise_256x256x224x128_16x16_8x7_8x32x1_8x32x1_1x64x1x4_8x8x1_2x1_intrawave_v3,1465.0,502.11,0.0
gfx950,256,2048,16384,2048,torch.int8,1,0,109.435,a8w8_rowwise_256x256x256x128_32x32_4x4_8x32x1_8x32x1_1x32x1x8_8x8x1_1x1_intrawave_v3,1255.9,958.17,0.0
gfx950,256,2048,16384,4096,torch.int8,1,0,192.1657,a8w8_rowwise_256x256x256x128_32x32_4x4_8x32x1_8x32x1_1x32x1x8_8x8x1_1x1_intrawave_v3,1430.42,742.1,0.0
gfx950,256,2048,16384,6656,torch.int8,1,0,297.4271,a8w8_rowwise_256x256x256x128_32x32_4x4_8x32x1_8x32x1_1x32x1x8_8x8x1_1x1_intrawave_v3,1501.8,638.11,0.0
gfx950,256,2048,16384,8192,torch.int8,1,0,351.3779,a8w8_rowwise_256x256x256x128_32x32_4x4_8x32x1_8x32x1_1x32x1x8_8x8x1_1x1_intrawave_v3,1564.57,620.71,0.0
gfx950,256,2048,16384,13312,torch.int8,1,0,562.4285,a8w8_rowwise_256x256x256x128_32x32_4x4_8x32x1_8x32x1_1x32x1x8_8x8x1_1x1_intrawave_v3,1588.39,555.58,0.0
gfx950,256,2048,16384,26624,torch.int8,1,0,1159.8861,a8w8_rowwise_256x256x256x128_32x32_4x4_8x32x1_8x32x1_1x32x1x8_8x8x1_1x1_intrawave_v3,1540.42,480.95,0.0
gfx950,256,2048,26624,16384,torch.int8,40,0,1145.701,a8w8_rowwise_256x256x224x128_16x16_8x7_8x32x1_8x32x1_1x64x1x4_8x8x1_2x1_intrawave_v3,1559.49,505.21,0.0
gfx950,256,2048,51200,5120,torch.int8,39,0,756.332,a8w8_rowwise_256x224x256x128_16x16_7x8_8x32x1_8x32x1_1x32x1x8_8x8x1_1x2_intrawave_v3,1419.67,637.74,0.0
gfx950,256,2048,53248,16384,torch.int8,1,0,2196.6099,a8w8_rowwise_256x256x256x128_32x32_4x4_8x32x1_8x32x1_1x32x1x8_8x8x1_1x1_intrawave_v3,1626.79,511.73,0.0
gfx950,256,2048,57344,8192,torch.int8,1,0,814.7053,a8w8_rowwise_256x256x256x128_32x32_4x4_8x32x1_8x32x1_1x32x1x8_8x8x1_1x1_intrawave_v3,2361.77,885.5,0.0
gfx950,256,4096,100,5120,torch.int8,34,0,16.1651,a8w8_rowwise_256x16x64x512_16x16_1x1_32x8x1_32x8x1_1x16x1x16_4x4x1_1x1_intrawave_v3,259.47,1379.68,0.0
gfx950,256,4096,200,5120,torch.int8,23,0,15.2341,a8w8_rowwise_256x64x64x512_32x32_1x1_32x8x1_32x8x1_1x32x1x8_8x8x1_1x1_intrawave_v3,550.65,1551.38,0.0
gfx950,256,4096,800,5120,torch.int8,15,0,36.4711,a8w8_rowwise_256x128x64x256_32x32_2x1_16x16x1_16x16x1_1x32x1x8_8x8x1_1x1_intrawave_v3,920.03,867.02,0.0
gfx950,256,4096,1280,8192,torch.int8,11,0,59.932,a8w8_rowwise_256x128x160x128_32x32_1x5_8x32x1_8x32x1_1x64x1x4_8x8x1_1x1_intrawave_v3,1433.28,909.8,0.0
gfx950,256,4096,1280,8192,torch.float8_e4m3fn,11,0,51.722,a8w8_rowwise_256x128x160x128_32x32_1x5_8x32x1_8x32x1_1x64x1x4_8x8x1_1x1_intrawave_v3,1660.79,1054.21,0.0
gfx950,256,4096,2304,16384,torch.int8,11,0,246.424,a8w8_rowwise_256x128x160x128_32x32_1x5_8x32x1_8x32x1_1x64x1x4_8x8x1_1x1_intrawave_v3,1254.9,502.11,0.0
gfx950,256,4096,2560,8192,torch.int8,4,0,90.7509,a8w8_rowwise_256x256x160x128_32x32_2x5_8x32x1_8x32x1_1x64x1x4_8x8x1_2x1_intrawave_v3,1893.08,831.92,0.0
gfx950,256,4096,4608,16384,torch.int8,15,0,433.3975,a8w8_rowwise_256x128x64x256_32x32_2x1_16x16x1_16x16x1_1x32x1x8_8x8x1_1x1_intrawave_v3,1427.04,416.14,0.0
gfx950,256,4096,5120,640,torch.int8,13,0,32.4583,a8w8_rowwise_256x128x128x128_32x32_2x2_8x32x1_8x32x1_1x32x1x8_8x8x1_1x1_intrawave_v3,827.02,1473.93,0.0
gfx950,256,4096,5120,1280,torch.int8,13,0,50.6317,a8w8_rowwise_256x128x128x128_32x32_2x2_8x32x1_8x32x1_1x32x1x8_8x8x1_1x1_intrawave_v3,1060.35,1061.38,0.0
gfx950,256,4096,5120,3200,torch.int8,4,0,86.6115,a8w8_rowwise_256x256x160x128_32x32_2x5_8x32x1_8x32x1_1x64x1x4_8x8x1_2x1_intrawave_v3,1549.65,824.77,0.0
gfx950,256,4096,5120,5120,torch.int8,15,0,177.0814,a8w8_rowwise_256x128x64x256_32x32_2x1_16x16x1_16x16x1_1x32x1x8_8x8x1_1x1_intrawave_v3,1212.71,503.32,0.0
gfx950,256,4096,5120,6400,torch.int8,4,0,162.2341,a8w8_rowwise_256x256x160x128_32x32_2x5_8x32x1_8x32x1_1x64x1x4_8x8x1_2x1_intrawave_v3,1654.62,622.1,0.0
gfx950,256,4096,5120,25600,torch.int8,15,0,782.4893,a8w8_rowwise_256x128x64x256_32x32_2x1_16x16x1_16x16x1_1x32x1x8_8x8x1_1x1_intrawave_v3,1372.21,355.11,0.0
gfx950,256,4096,6400,5120,torch.int8,39,0,188.523,a8w8_rowwise_256x224x256x128_16x16_7x8_8x32x1_8x32x1_1x32x1x8_8x8x1_1x2_intrawave_v3,1423.89,563.16,0.0
gfx950,256,4096,7168,8192,torch.int8,2,0,219.2844,a8w8_rowwise_256x256x224x128_32x32_2x7_8x32x1_8x32x1_1x64x1x4_8x8x1_2x1_intrawave_v3,2193.66,688.58,0.0
gfx950,256,4096,7424,8192,torch.float8_e4m3fn,1,0,232.7657,a8w8_rowwise_256x256x256x128_32x32_4x4_8x32x1_8x32x1_1x32x1x8_8x8x1_1x1_intrawave_v3,2140.42,666.72,0.0
gfx950,256,4096,8192,1024,torch.int8,1,0,55.6305,a8w8_rowwise_256x256x256x128_32x32_4x4_8x32x1_8x32x1_1x32x1x8_8x8x1_1x1_intrawave_v3,1235.28,1432.52,0.0
gfx950,256,4096,8192,1024,torch.float8_e4m3fn,43,0,59.9656,a8w8_rowwise_256x256x128x64_32x32_4x2_4x64x1_4x64x1_1x32x1x8_8x8x1_1x1_interwave_v1,1145.98,1328.96,0.0
gfx950,256,4096,8192,2048,torch.int8,1,0,83.0059,a8w8_rowwise_256x256x256x128_32x32_4x4_8x32x1_8x32x1_1x32x1x8_8x8x1_1x1_intrawave_v3,1655.77,1111.66,0.0
gfx950,256,4096,8192,3584,torch.int8,1,0,122.3648,a8w8_rowwise_256x256x256x128_32x32_4x4_8x32x1_8x32x1_1x32x1x8_8x8x1_1x1_intrawave_v3,1965.58,908.34,0.0
gfx950,256,4096,8192,7168,torch.int8,1,0,215.6239,a8w8_rowwise_256x256x256x128_32x32_4x4_8x32x1_8x32x1_1x32x1x8_8x8x1_1x1_intrawave_v3,2230.9,719.72,0.0
gfx950,256,4096,8192,8192,torch.int8,1,0,240.0438,a8w8_rowwise_256x256x256x128_32x32_4x4_8x32x1_8x32x1_1x32x1x8_8x8x1_1x1_intrawave_v3,2290.23,698.92,0.0
gfx950,256,4096,8192,28672,torch.int8,1,0,764.1022,a8w8_rowwise_256x256x256x128_32x32_4x4_8x32x1_8x32x1_1x32x1x8_8x8x1_1x1_intrawave_v3,2518.18,548.92,0.0
gfx950,256,4096,9216,16384,torch.int8,39,0,778.6417,a8w8_rowwise_256x224x256x128_16x16_7x8_8x32x1_8x32x1_1x32x1x8_8x8x1_1x2_intrawave_v3,1588.6,377.07,0.0
gfx950,256,4096,10240,8192,torch.int8,1,0,318.603,a8w8_rowwise_256x256x256x128_32x32_4x4_8x32x1_8x32x1_1x32x1x8_8x8x1_1x1_intrawave_v3,2156.9,631.9,0.0
gfx950,256,4096,12800,5120,torch.int8,39,0,356.6531,a8w8_rowwise_256x224x256x128_16x16_7x8_8x32x1_8x32x1_1x32x1x8_8x8x1_1x2_intrawave_v3,1505.3,536.56,0.0
gfx950,256,4096,13312,16384,torch.int8,10,0,1114.1158,a8w8_rowwise_256x128x192x128_32x32_2x3_8x32x1_8x32x1_1x32x1x8_8x8x1_1x1_intrawave_v3,1603.7,353.88,0.0
gfx950,256,4096,16384,2048,torch.int8,1,0,205.0841,a8w8_rowwise_256x256x256x128_32x32_4x4_8x32x1_8x32x1_1x32x1x8_8x8x1_1x1_intrawave_v3,1340.32,858.97,0.0
gfx950,256,4096,16384,4096,torch.int8,39,0,353.73,a8w8_rowwise_256x224x256x128_16x16_7x8_8x32x1_8x32x1_1x32x1x8_8x8x1_1x2_intrawave_v3,1554.17,616.58,0.0
gfx950,256,4096,16384,6656,torch.int8,39,0,561.0198,a8w8_rowwise_256x224x256x128_16x16_7x8_8x32x1_8x32x1_1x32x1x8_8x8x1_1x2_intrawave_v3,1592.37,482.22,0.0
gfx950,256,4096,16384,8192,torch.int8,39,0,657.0519,a8w8_rowwise_256x224x256x128_16x16_7x8_8x32x1_8x32x1_1x32x1x8_8x8x1_1x2_intrawave_v3,1673.4,459.61,0.0
gfx950,256,4096,16384,13312,torch.int8,1,0,1080.1678,a8w8_rowwise_256x256x256x128_32x32_4x4_8x32x1_8x32x1_1x32x1x8_8x8x1_1x1_intrawave_v3,1654.1,376.65,0.0
gfx950,256,4096,16384,26624,torch.int8,1,0,2197.8702,a8w8_rowwise_256x256x256x128_32x32_4x4_8x32x1_8x32x1_1x32x1x8_8x8x1_1x1_intrawave_v3,1625.85,309.15,0.0
gfx950,256,4096,26624,16384,torch.int8,10,0,2199.7579,a8w8_rowwise_256x128x192x128_32x32_2x3_8x32x1_8x32x1_1x32x1x8_8x8x1_1x1_intrawave_v3,1624.46,327.95,0.0
gfx950,256,4096,51200,5120,torch.int8,1,0,1418.8126,a8w8_rowwise_256x256x256x128_32x32_4x4_8x32x1_8x32x1_1x32x1x8_8x8x1_1x1_intrawave_v3,1513.58,495.16,0.0
gfx950,256,4096,53248,16384,torch.int8,1,0,4075.2597,a8w8_rowwise_256x256x256x128_32x32_4x4_8x32x1_8x32x1_1x32x1x8_8x8x1_1x1_intrawave_v3,1753.71,337.58,0.0
gfx950,256,4096,57344,8192,torch.int8,1,0,1617.8989,a8w8_rowwise_256x256x256x128_32x32_4x4_8x32x1_8x32x1_1x32x1x8_8x8x1_1x1_intrawave_v3,2378.57,601.45,0.0
gfx950,256,5120,7424,8192,torch.float8_e4m3fn,2,0,308.3064,a8w8_rowwise_256x256x224x128_32x32_2x7_8x32x1_8x32x1_1x64x1x4_8x8x1_2x1_intrawave_v3,2019.97,579.88,0.0
gfx950,256,8192,100,5120,torch.int8,29,0,27.2037,a8w8_rowwise_256x32x96x256_16x16_1x3_16x16x1_16x16x1_1x32x1x8_4x4x1_1x1_intrawave_v3,308.36,1620.86,0.0
gfx950,256,8192,200,5120,torch.int8,21,0,25.2734,a8w8_rowwise_256x64x128x256_32x32_1x2_16x16x1_16x16x1_1x32x1x8_8x8x1_1x1_intrawave_v3,663.83,1829.74,0.0
gfx950,256,8192,800,5120,torch.int8,41,0,65.9722,a8w8_rowwise_256x128x128x128_32x32_2x2_8x32x1_8x32x1_1x32x1x8_8x8x1_1x1_intrawave_v5,1017.23,896.53,0.0
gfx950,256,8192,1280,8192,torch.int8,4,0,95.3807,a8w8_rowwise_256x256x160x128_32x32_2x5_8x32x1_8x32x1_1x64x1x4_8x8x1_2x1_intrawave_v3,1801.19,1033.4,0.0
gfx950,256,8192,1280,8192,torch.float8_e4m3fn,4,0,81.7243,a8w8_rowwise_256x256x160x128_32x32_2x5_8x32x1_8x32x1_1x64x1x4_8x8x1_2x1_intrawave_v3,2102.17,1206.08,0.0
gfx950,256,8192,2304,16384,torch.int8,15,0,463.8213,a8w8_rowwise_256x128x64x256_32x32_2x1_16x16x1_16x16x1_1x32x1x8_8x8x1_1x1_intrawave_v3,1333.43,452.15,0.0
gfx950,256,8192,2560,8192,torch.int8,4,0,173.6356,a8w8_rowwise_256x256x160x128_32x32_2x5_8x32x1_8x32x1_1x64x1x4_8x8x1_2x1_intrawave_v3,1978.84,748.83,0.0
gfx950,256,8192,4608,16384,torch.int8,39,0,844.5637,a8w8_rowwise_256x224x256x128_16x16_7x8_8x32x1_8x32x1_1x32x1x8_8x8x1_1x2_intrawave_v3,1464.6,337.7,0.0
gfx950,256,8192,5120,640,torch.int8,42,0,55.1814,a8w8_rowwise_256x128x256x64_32x32_2x4_4x64x1_4x64x1_1x32x1x8_8x8x1_1x1_interwave_v1,972.92,1674.58,0.0
gfx950,256,8192,5120,1280,torch.int8,39,0,86.4091,a8w8_rowwise_256x224x256x128_16x16_7x8_8x32x1_8x32x1_1x32x1x8_8x8x1_1x2_intrawave_v3,1242.63,1168.0,0.0
gfx950,256,8192,5120,3200,torch.int8,40,0,149.3935,a8w8_rowwise_256x256x224x128_16x16_8x7_8x32x1_8x32x1_1x64x1x4_8x8x1_2x1_intrawave_v3,1796.83,846.65,0.0
gfx950,256,8192,5120,5120,torch.int8,39,0,277.9848,a8w8_rowwise_256x224x256x128_16x16_7x8_8x32x1_8x32x1_1x32x1x8_8x8x1_1x2_intrawave_v3,1545.04,546.95,0.0
gfx950,256,8192,5120,6400,torch.int8,40,0,276.3348,a8w8_rowwise_256x256x224x128_16x16_8x7_8x32x1_8x32x1_1x64x1x4_8x8x1_2x1_intrawave_v3,1942.83,611.88,0.0
gfx950,256,8192,5120,25600,torch.int8,39,0,1513.1737,a8w8_rowwise_256x224x256x128_16x16_7x8_8x32x1_8x32x1_1x32x1x8_8x8x1_1x2_intrawave_v3,1419.19,280.65,0.0
gfx950,256,8192,6400,5120,torch.int8,39,0,359.0195,a8w8_rowwise_256x224x256x128_16x16_7x8_8x32x1_8x32x1_1x32x1x8_8x8x1_1x2_intrawave_v3,1495.38,500.16,0.0
gfx950,256,8192,7168,8192,torch.int8,2,0,420.8889,a8w8_rowwise_256x256x224x128_32x32_2x7_8x32x1_8x32x1_1x64x1x4_8x8x1_2x1_intrawave_v3,2285.81,577.99,0.0
gfx950,256,8192,7424,8192,torch.float8_e4m3fn,1,0,441.2013,a8w8_rowwise_256x256x256x128_32x32_4x4_8x32x1_8x32x1_1x32x1x8_8x8x1_1x1_intrawave_v3,2258.45,565.64,0.0
gfx950,256,8192,8192,1024,torch.int8,1,0,105.9654,a8w8_rowwise_256x256x256x128_32x32_4x4_8x32x1_8x32x1_1x32x1x8_8x8x1_1x1_intrawave_v3,1297.02,1424.95,0.0
gfx950,256,8192,8192,1024,torch.float8_e4m3fn,10,0,119.8588,a8w8_rowwise_256x128x192x128_32x32_2x3_8x32x1_8x32x1_1x32x1x8_8x8x1_1x1_intrawave_v3,1146.67,1259.77,0.0
gfx950,256,8192,8192,2048,torch.int8,1,0,159.9883,a8w8_rowwise_256x256x256x128_32x32_4x4_8x32x1_8x32x1_1x32x1x8_8x8x1_1x1_intrawave_v3,1718.11,1048.65,0.0
gfx950,256,8192,8192,3584,torch.int8,1,0,232.9396,a8w8_rowwise_256x256x256x128_32x32_4x4_8x32x1_8x32x1_1x32x1x8_8x8x1_1x1_intrawave_v3,2065.07,828.27,0.0
gfx950,256,8192,8192,7168,torch.int8,1,0,412.978,a8w8_rowwise_256x256x256x128_32x32_4x4_8x32x1_8x32x1_1x32x1x8_8x8x1_1x1_intrawave_v3,2329.6,609.37,0.0
gfx950,256,8192,8192,8192,torch.int8,1,0,469.2882,a8w8_rowwise_256x256x256x128_32x32_4x4_8x32x1_8x32x1_1x32x1x8_8x8x1_1x1_intrawave_v3,2342.93,572.01,0.0
gfx950,256,8192,8192,28672,torch.int8,1,0,1532.6908,a8w8_rowwise_256x256x256x128_32x32_4x4_8x32x1_8x32x1_1x32x1x8_8x8x1_1x1_intrawave_v3,2510.81,394.06,0.0
gfx950,256,8192,9216,16384,torch.int8,43,0,1557.3892,a8w8_rowwise_256x256x128x64_32x32_4x2_4x64x1_4x64x1_1x32x1x8_8x8x1_1x1_interwave_v1,1588.49,280.09,0.0
gfx950,256,8192,10240,8192,torch.int8,1,0,575.9516,a8w8_rowwise_256x256x256x128_32x32_4x4_8x32x1_8x32x1_1x32x1x8_8x8x1_1x1_intrawave_v3,2386.29,553.46,0.0
gfx950,256,8192,12800,5120,torch.int8,39,0,683.3672,a8w8_rowwise_256x224x256x128_16x16_7x8_8x32x1_8x32x1_1x32x1x8_8x8x1_1x2_intrawave_v3,1571.25,464.16,0.0
gfx950,256,8192,13312,16384,torch.int8,40,0,2189.1084,a8w8_rowwise_256x256x224x128_16x16_8x7_8x32x1_8x32x1_1x64x1x4_8x8x1_2x1_intrawave_v3,1632.36,260.57,0.0
gfx950,256,8192,16384,2048,torch.int8,39,0,392.4492,a8w8_rowwise_256x224x256x128_16x16_7x8_8x32x1_8x32x1_1x32x1x8_8x8x1_1x2_intrawave_v3,1400.83,812.25,0.0
gfx950,256,8192,16384,4096,torch.int8,39,0,678.4652,a8w8_rowwise_256x224x256x128_16x16_7x8_8x32x1_8x32x1_1x32x1x8_8x8x1_1x2_intrawave_v3,1620.59,544.02,0.0
gfx950,256,8192,16384,6656,torch.int8,39,0,1094.0621,a8w8_rowwise_256x224x256x128_16x16_7x8_8x32x1_8x32x1_1x32x1x8_8x8x1_1x2_intrawave_v3,1633.09,394.87,0.0
gfx950,256,8192,16384,8192,torch.int8,1,0,1288.1354,a8w8_rowwise_256x256x256x128_32x32_4x4_8x32x1_8x32x1_1x32x1x8_8x8x1_1x1_intrawave_v3,1707.14,364.68,0.0
gfx950,256,8192,16384,13312,torch.int8,1,0,2091.5748,a8w8_rowwise_256x256x256x128_32x32_4x4_8x32x1_8x32x1_1x32x1x8_8x8x1_1x1_intrawave_v3,1708.48,284.76,0.0
gfx950,256,8192,16384,26624,torch.int8,1,0,4736.0103,a8w8_rowwise_256x256x256x128_32x32_4x4_8x32x1_8x32x1_1x32x1x8_8x8x1_1x1_intrawave_v3,1509.04,194.84,0.0
gfx950,256,8192,26624,16384,torch.int8,40,0,4074.1172,a8w8_rowwise_256x256x224x128_16x16_8x7_8x32x1_8x32x1_1x64x1x4_8x8x1_2x1_intrawave_v3,1754.2,247.08,0.0
gfx950,256,8192,51200,5120,torch.int8,1,0,2639.7599,a8w8_rowwise_256x256x256x128_32x32_4x4_8x32x1_8x32x1_1x32x1x8_8x8x1_1x1_intrawave_v3,1627.03,432.97,0.0
gfx950,256,8192,53248,16384,torch.int8,40,0,8028.0784,a8w8_rowwise_256x256x224x128_16x16_8x7_8x32x1_8x32x1_1x64x1x4_8x8x1_2x1_intrawave_v3,1780.46,234.06,0.0
gfx950,256,8192,57344,8192,torch.int8,1,0,3164.0659,a8w8_rowwise_256x256x256x128_32x32_4x4_8x32x1_8x32x1_1x32x1x8_8x8x1_1x1_intrawave_v3,2432.5,466.61,0.0
gfx950,256,16384,100,5120,torch.int8,27,0,42.6746,a8w8_rowwise_256x32x160x256_16x16_1x5_16x16x1_16x16x1_1x32x1x8_4x4x1_1x1_intrawave_v3,393.14,2054.5,0.0
gfx950,256,16384,200,5120,torch.int8,21,0,44.0772,a8w8_rowwise_256x64x128x256_32x32_1x2_16x16x1_16x16x1_1x32x1x8_8x8x1_1x1_intrawave_v3,761.27,2075.08,0.0
gfx950,256,16384,800,5120,torch.int8,1,0,111.2384,a8w8_rowwise_256x256x256x128_32x32_4x4_8x32x1_8x32x1_1x32x1x8_8x8x1_1x1_intrawave_v3,1206.58,1026.59,0.0
gfx950,256,16384,1280,8192,torch.int8,4,0,178.1119,a8w8_rowwise_256x256x160x128_32x32_2x5_8x32x1_8x32x1_1x64x1x4_8x8x1_2x1_intrawave_v3,1929.11,1047.92,0.0
gfx950,256,16384,1280,8192,torch.float8_e4m3fn,4,0,174.2513,a8w8_rowwise_256x256x160x128_32x32_2x5_8x32x1_8x32x1_1x64x1x4_8x8x1_2x1_intrawave_v3,1971.85,1071.13,0.0
gfx950,256,16384,2304,16384,torch.int8,15,0,878.7062,a8w8_rowwise_256x128x64x256_32x32_2x1_16x16x1_16x16x1_1x32x1x8_8x8x1_1x1_intrawave_v3,1407.7,434.37,0.0
gfx950,256,16384,2560,8192,torch.int8,1,0,329.1334,a8w8_rowwise_256x256x256x128_32x32_4x4_8x32x1_8x32x1_1x32x1x8_8x8x1_1x1_intrawave_v3,2087.89,726.38,0.0
gfx950,256,16384,4608,16384,torch.int8,40,0,1632.4516,a8w8_rowwise_256x256x224x128_16x16_8x7_8x32x1_8x32x1_1x64x1x4_8x8x1_2x1_intrawave_v3,1515.45,303.18,0.0
gfx950,256,16384,5120,640,torch.int8,43,0,99.8836,a8w8_rowwise_256x256x128x64_32x32_4x2_4x64x1_4x64x1_1x32x1x8_8x8x1_1x1_interwave_v1,1074.99,1817.46,0.0
gfx950,256,16384,5120,1280,torch.int8,1,0,153.6015,a8w8_rowwise_256x256x256x128_32x32_4x4_8x32x1_8x32x1_1x32x1x8_8x8x1_1x1_intrawave_v3,1398.09,1271.45,0.0
gfx950,256,16384,5120,3200,torch.int8,1,0,271.2735,a8w8_rowwise_256x256x256x128_32x32_4x4_8x32x1_8x32x1_1x32x1x8_8x8x1_1x1_intrawave_v3,1979.08,872.13,0.0
gfx950,256,16384,5120,5120,torch.int8,1,0,518.1604,a8w8_rowwise_256x256x256x128_32x32_4x4_8x32x1_8x32x1_1x32x1x8_8x8x1_1x1_intrawave_v3,1657.78,536.27,0.0
gfx950,256,16384,5120,6400,torch.int8,1,0,543.7765,a8w8_rowwise_256x256x256x128_32x32_4x4_8x32x1_8x32x1_1x32x1x8_8x8x1_1x1_intrawave_v3,1974.6,561.62,0.0
gfx950,256,16384,5120,25600,torch.int8,1,0,2869.8056,a8w8_rowwise_256x256x256x128_32x32_4x4_8x32x1_8x32x1_1x32x1x8_8x8x1_1x1_intrawave_v3,1496.61,250.29,0.0
gfx950,256,16384,6400,5120,torch.int8,40,0,690.0605,a8w8_rowwise_256x256x224x128_16x16_8x7_8x32x1_8x32x1_1x64x1x4_8x8x1_2x1_intrawave_v3,1556.01,472.96,0.0
gfx950,256,16384,7168,8192,torch.int8,1,0,815.6995,a8w8_rowwise_256x256x256x128_32x32_4x4_8x32x1_8x32x1_1x32x1x8_8x8x1_1x1_intrawave_v3,2358.89,524.48,0.0
gfx950,256,16384,8192,1024,torch.int8,10,0,198.2601,a8w8_rowwise_256x128x192x128_32x32_2x3_8x32x1_8x32x1_1x32x1x8_8x8x1_1x1_intrawave_v3,1386.45,1480.89,0.0
gfx950,256,16384,8192,1024,torch.float8_e4m3fn,10,0,221.8588,a8w8_rowwise_256x128x192x128_32x32_2x3_8x32x1_8x32x1_1x32x1x8_8x8x1_1x1_intrawave_v3,1238.98,1323.37,0.0
gfx950,256,16384,8192,2048,torch.int8,1,0,299.7045,a8w8_rowwise_256x256x256x128_32x32_4x4_8x32x1_8x32x1_1x32x1x8_8x8x1_1x1_intrawave_v3,1834.33,1063.6,0.0
gfx950,256,16384,8192,3584,torch.int8,1,0,463.2471,a8w8_rowwise_256x256x256x128_32x32_4x4_8x32x1_8x32x1_1x32x1x8_8x8x1_1x1_intrawave_v3,2076.8,769.6,0.0
gfx950,256,16384,8192,7168,torch.int8,1,0,819.3844,a8w8_rowwise_256x256x256x128_32x32_4x4_8x32x1_8x32x1_1x32x1x8_8x8x1_1x1_intrawave_v3,2348.28,542.6,0.0
gfx950,256,16384,8192,8192,torch.int8,1,0,933.9446,a8w8_rowwise_256x256x256x128_32x32_4x4_8x32x1_8x32x1_1x32x1x8_8x8x1_1x1_intrawave_v3,2354.55,502.99,0.0
gfx950,256,16384,8192,28672,torch.int8,1,0,3088.0838,a8w8_rowwise_256x256x256x128_32x32_4x4_8x32x1_8x32x1_1x32x1x8_8x8x1_1x1_intrawave_v3,2492.35,315.11,0.0
gfx950,256,16384,9216,16384,torch.int8,1,0,2949.0967,a8w8_rowwise_256x256x256x128_32x32_4x4_8x32x1_8x32x1_1x32x1x8_8x8x1_1x1_intrawave_v3,1677.73,244.62,0.0
gfx950,256,16384,10240,8192,torch.int8,1,0,1149.3883,a8w8_rowwise_256x256x256x128_32x32_4x4_8x32x1_8x32x1_1x32x1x8_8x8x1_1x1_intrawave_v3,2391.51,481.69,0.0
gfx950,256,16384,12800,5120,torch.int8,39,0,1303.8826,a8w8_rowwise_256x224x256x128_16x16_7x8_8x32x1_8x32x1_1x32x1x8_8x8x1_1x2_intrawave_v3,1646.99,436.28,0.0
gfx950,256,16384,13312,16384,torch.int8,1,0,4134.6494,a8w8_rowwise_256x256x256x128_32x32_4x4_8x32x1_8x32x1_1x32x1x8_8x8x1_1x1_intrawave_v3,1728.52,223.17,0.0
gfx950,256,16384,16384,2048,torch.int8,1,0,719.1952,a8w8_rowwise_256x256x256x128_32x32_4x4_8x32x1_8x32x1_1x32x1x8_8x8x1_1x1_intrawave_v3,1528.81,839.8,0.0
gfx950,256,16384,16384,4096,torch.int8,39,0,1327.6342,a8w8_rowwise_256x224x256x128_16x16_7x8_8x32x1_8x32x1_1x32x1x8_8x8x1_1x2_intrawave_v3,1656.35,505.48,0.0
gfx950,256,16384,16384,6656,torch.int8,39,0,2120.7951,a8w8_rowwise_256x224x256x128_16x16_7x8_8x32x1_8x32x1_1x32x1x8_8x8x1_1x2_intrawave_v3,1684.94,355.99,0.0
gfx950,256,16384,16384,8192,torch.int8,1,0,2555.2385,a8w8_rowwise_256x256x256x128_32x32_4x4_8x32x1_8x32x1_1x32x1x8_8x8x1_1x1_intrawave_v3,1721.19,315.16,0.0
gfx950,256,16384,16384,13312,torch.int8,1,0,4157.4955,a8w8_rowwise_256x256x256x128_32x32_4x4_8x32x1_8x32x1_1x32x1x8_8x8x1_1x1_intrawave_v3,1719.02,234.05,0.0
gfx950,256,16384,16384,26624,torch.int8,1,0,9368.503,a8w8_rowwise_256x256x256x128_32x32_4x4_8x32x1_8x32x1_1x32x1x8_8x8x1_1x1_intrawave_v3,1525.71,150.43,0.0
gfx950,256,16384,26624,16384,torch.int8,40,0,8090.2903,a8w8_rowwise_256x256x224x128_16x16_8x7_8x32x1_8x32x1_1x64x1x4_8x8x1_2x1_intrawave_v3,1766.77,194.93,0.0
gfx950,256,16384,51200,5120,torch.int8,1,0,5290.8019,a8w8_rowwise_256x256x256x128_32x32_4x4_8x32x1_8x32x1_1x32x1x8_8x8x1_1x1_intrawave_v3,1623.56,382.5,0.0
gfx950,256,16384,53248,16384,torch.int8,40,0,15996.8357,a8w8_rowwise_256x256x224x128_16x16_8x7_8x32x1_8x32x1_1x64x1x4_8x8x1_2x1_intrawave_v3,1787.06,180.39,0.0
gfx950,256,16384,57344,8192,torch.int8,1,0,6467.762,a8w8_rowwise_256x256x256x128_32x32_4x4_8x32x1_8x32x1_1x32x1x8_8x8x1_1x1_intrawave_v3,2379.98,383.91,0.0
gfx950,256,32768,100,5120,torch.int8,27,0,78.5325,a8w8_rowwise_256x32x160x256_16x16_1x5_16x16x1_16x16x1_1x32x1x8_4x4x1_1x1_intrawave_v3,427.27,2226.31,0.0
gfx950,256,32768,200,5120,torch.int8,21,0,82.0643,a8w8_rowwise_256x64x128x256_32x32_1x2_16x16x1_16x16x1_1x32x1x8_8x8x1_1x1_intrawave_v3,817.76,2216.6,0.0
gfx950,256,32768,800,5120,torch.int8,1,0,216.0528,a8w8_rowwise_256x256x256x128_32x32_4x4_8x32x1_8x32x1_1x32x1x8_8x8x1_1x1_intrawave_v3,1242.45,1038.16,0.0
gfx950,256,32768,1280,8192,torch.int8,1,0,339.8668,a8w8_rowwise_256x256x256x128_32x32_4x4_8x32x1_8x32x1_1x32x1x8_8x8x1_1x1_intrawave_v3,2021.95,1067.5,0.0
gfx950,256,32768,2304,16384,torch.int8,1,0,1717.9546,a8w8_rowwise_256x256x256x128_32x32_4x4_8x32x1_8x32x1_1x32x1x8_8x8x1_1x1_intrawave_v3,1440.03,422.37,0.0
gfx950,256,32768,2560,8192,torch.int8,1,0,599.612,a8w8_rowwise_256x256x256x128_32x32_4x4_8x32x1_8x32x1_1x32x1x8_8x8x1_1x1_intrawave_v3,2292.13,762.46,0.0
gfx950,256,32768,4608,16384,torch.int8,40,0,3026.9648,a8w8_rowwise_256x256x224x128_16x16_8x7_8x32x1_8x32x1_1x64x1x4_8x8x1_2x1_intrawave_v3,1634.58,302.07,0.0
gfx950,256,32768,5120,640,torch.int8,43,0,191.0117,a8w8_rowwise_256x256x128x64_32x32_4x2_4x64x1_4x64x1_1x32x1x8_8x8x1_1x1_interwave_v1,1124.27,1883.62,0.0
gfx950,256,32768,5120,1280,torch.int8,1,0,299.0856,a8w8_rowwise_256x256x256x128_32x32_4x4_8x32x1_8x32x1_1x32x1x8_8x8x1_1x1_intrawave_v3,1436.03,1284.05,0.0
gfx950,256,32768,5120,3200,torch.int8,1,0,538.4921,a8w8_rowwise_256x256x256x128_32x32_4x4_8x32x1_8x32x1_1x32x1x8_8x8x1_1x1_intrawave_v3,1993.98,848.27,0.0
gfx950,256,32768,5120,5120,torch.int8,40,0,999.0598,a8w8_rowwise_256x256x224x128_16x16_8x7_8x32x1_8x32x1_1x64x1x4_8x8x1_2x1_intrawave_v3,1719.6,530.03,0.0
gfx950,256,32768,5120,6400,torch.int8,1,0,1028.2651,a8w8_rowwise_256x256x256x128_32x32_4x4_8x32x1_8x32x1_1x32x1x8_8x8x1_1x1_intrawave_v3,2088.45,562.14,0.0
gfx950,256,32768,5120,25600,torch.int8,1,0,5734.5832,a8w8_rowwise_256x256x256x128_32x32_4x4_8x32x1_8x32x1_1x32x1x8_8x8x1_1x1_intrawave_v3,1497.92,227.65,0.0
gfx950,256,32768,6400,5120,torch.int8,40,0,1274.1106,a8w8_rowwise_256x256x224x128_16x16_8x7_8x32x1_8x32x1_1x64x1x4_8x8x1_2x1_intrawave_v3,1685.48,486.59,0.0
gfx950,256,32768,7168,8192,torch.int8,1,0,1620.6254,a8w8_rowwise_256x256x256x128_32x32_4x4_8x32x1_8x32x1_1x32x1x8_8x8x1_1x1_intrawave_v3,2374.57,491.73,0.0
gfx950,256,32768,8192,1024,torch.int8,10,0,379.9256,a8w8_rowwise_256x128x192x128_32x32_2x3_8x32x1_8x32x1_1x32x1x8_8x8x1_1x1_intrawave_v3,1447.01,1523.49,0.0
gfx950,256,32768,8192,2048,torch.int8,1,0,594.1387,a8w8_rowwise_256x256x256x128_32x32_4x4_8x32x1_8x32x1_1x32x1x8_8x8x1_1x1_intrawave_v3,1850.6,1044.8,0.0
gfx950,256,32768,8192,3584,torch.int8,1,0,899.1908,a8w8_rowwise_256x256x256x128_32x32_4x4_8x32x1_8x32x1_1x32x1x8_8x8x1_1x1_intrawave_v3,2139.86,760.32,0.0
gfx950,256,32768,8192,7168,torch.int8,1,0,1640.4404,a8w8_rowwise_256x256x256x128_32x32_4x4_8x32x1_8x32x1_1x32x1x8_8x8x1_1x1_intrawave_v3,2345.89,506.25,0.0
gfx950,256,32768,8192,8192,torch.int8,1,0,1837.7153,a8w8_rowwise_256x256x256x128_32x32_4x4_8x32x1_8x32x1_1x32x1x8_8x8x1_1x1_intrawave_v3,2393.21,474.73,0.0
gfx950,256,32768,8192,28672,torch.int8,1,0,6209.7387,a8w8_rowwise_256x256x256x128_32x32_4x4_8x32x1_8x32x1_1x32x1x8_8x8x1_1x1_intrawave_v3,2478.87,275.58,0.0
gfx950,256,32768,9216,16384,torch.int8,1,0,5884.19,a8w8_rowwise_256x256x256x128_32x32_4x4_8x32x1_8x32x1_1x32x1x8_8x8x1_1x1_intrawave_v3,1681.73,219.55,0.0
gfx950,256,32768,10240,8192,torch.int8,1,0,2299.333,a8w8_rowwise_256x256x256x128_32x32_4x4_8x32x1_8x32x1_1x32x1x8_8x8x1_1x1_intrawave_v3,2390.94,445.09,0.0
gfx950,256,32768,12800,5120,torch.int8,39,0,2481.3683,a8w8_rowwise_256x224x256x128_16x16_7x8_8x32x1_8x32x1_1x32x1x8_8x8x1_1x2_intrawave_v3,1730.89,432.09,0.0
gfx950,256,32768,13312,16384,torch.int8,40,0,8230.5195,a8w8_rowwise_256x256x224x128_16x16_8x7_8x32x1_8x32x1_1x64x1x4_8x8x1_2x1_intrawave_v3,1736.66,197.73,0.0
gfx950,256,32768,16384,2048,torch.int8,1,0,1409.7173,a8w8_rowwise_256x256x256x128_32x32_4x4_8x32x1_8x32x1_1x32x1x8_8x8x1_1x1_intrawave_v3,1559.9,833.08,0.0
gfx950,256,32768,16384,4096,torch.int8,39,0,2546.0869,a8w8_rowwise_256x224x256x128_16x16_7x8_8x32x1_8x32x1_1x32x1x8_8x8x1_1x2_intrawave_v3,1727.37,500.8,0.0
gfx950,256,32768,16384,6656,torch.int8,39,0,4073.3594,a8w8_rowwise_256x224x256x128_16x16_7x8_8x32x1_8x32x1_1x32x1x8_8x8x1_1x2_intrawave_v3,1754.53,343.92,0.0
gfx950,256,32768,16384,8192,torch.int8,39,0,4965.434,a8w8_rowwise_256x224x256x128_16x16_7x8_8x32x1_8x32x1_1x32x1x8_8x8x1_1x2_intrawave_v3,1771.47,297.33,0.0
gfx950,256,32768,16384,13312,torch.int8,1,0,8271.2663,a8w8_rowwise_256x256x256x128_32x32_4x4_8x32x1_8x32x1_1x32x1x8_8x8x1_1x1_intrawave_v3,1728.11,208.92,0.0
gfx950,256,32768,16384,26624,torch.int8,1,0,19064.3766,a8w8_rowwise_256x256x256x128_32x32_4x4_8x32x1_8x32x1_1x32x1x8_8x8x1_1x1_intrawave_v3,1499.51,124.96,0.0
gfx950,256,32768,26624,16384,torch.int8,40,0,16029.2644,a8w8_rowwise_256x256x224x128_16x16_8x7_8x32x1_8x32x1_1x64x1x4_8x8x1_2x1_intrawave_v3,1783.44,169.56,0.0
gfx950,256,32768,51200,5120,torch.int8,1,0,10610.0611,a8w8_rowwise_256x256x256x128_32x32_4x4_8x32x1_8x32x1_1x32x1x8_8x8x1_1x1_intrawave_v3,1619.21,356.77,0.0
gfx950,256,32768,53248,16384,torch.int8,40,0,31823.1958,a8w8_rowwise_256x256x224x128_16x16_8x7_8x32x1_8x32x1_1x64x1x4_8x8x1_2x1_intrawave_v3,1796.63,153.94,0.0
gfx950,256,32768,57344,8192,torch.int8,1,0,12840.4952,a8w8_rowwise_256x256x256x128_32x32_4x4_8x32x1_8x32x1_1x32x1x8_8x8x1_1x1_intrawave_v3,2397.6,350.17,0.0
gfx950,256,35200,256,19968,torch.float8_e4m3fn,1,0,245.3664,a8w8_rowwise_256x256x256x128_32x32_4x4_8x32x1_8x32x1_1x32x1x8_8x8x1_1x1_intrawave_v3,1466.67,2958.87,0.0
