aiter/ops/triton/configs/gemm/gfx1250-BATCHED_GEMM-A8W8-A_PER_TOKEN_GROUP_PREQUANT_W_PER_BATCHED_TENSOR_QUANT.json
{
    "M_LEQ_16": {
        "BLOCK_SIZE_M": 16,
        "BLOCK_SIZE_N": 128,
        "GROUP_SIZE_M": 1,
        "num_warps": 8,
        "num_stages": 2,
        "waves_per_eu": 2,
        "matrix_instr_nonkdim": 16,
        "kpack": 1,
        "cache_modifier": ".cg"
    },
    "M_LEQ_32": {
        "BLOCK_SIZE_M": 32,
        "BLOCK_SIZE_N": 128,
        "GROUP_SIZE_M": 1,
        "num_warps": 8,
        "num_stages": 2,
        "waves_per_eu": 2,
        "matrix_instr_nonkdim": 16,
        "kpack": 1,
        "cache_modifier": ".cg"
    },
    "M_LEQ_64": {
        "BLOCK_SIZE_M": 32,
        "BLOCK_SIZE_N": 128,
        "GROUP_SIZE_M": 1,
        "num_warps": 8,
        "num_stages": 2,
        "waves_per_eu": 2,
        "matrix_instr_nonkdim": 16,
        "kpack": 1,
        "cache_modifier": ".cg"
    },
    "M_LEQ_128": {
        "BLOCK_SIZE_M": 32,
        "BLOCK_SIZE_N": 128,
        "GROUP_SIZE_M": 1,
        "num_warps": 8,
        "num_stages": 2,
        "waves_per_eu": 2,
        "matrix_instr_nonkdim": 16,
        "kpack": 1,
        "cache_modifier": ".cg"
    },
    "M_LEQ_256": {
        "BLOCK_SIZE_M": 32,
        "BLOCK_SIZE_N": 128,
        "GROUP_SIZE_M": 1,
        "num_warps": 8,
        "num_stages": 2,
        "waves_per_eu": 2,
        "matrix_instr_nonkdim": 16,
        "kpack": 1,
        "cache_modifier": ".cg"
    },
    "any": {
        "BLOCK_SIZE_M": 32,
        "BLOCK_SIZE_N": 128,
        "GROUP_SIZE_M": 1,
        "num_warps": 8,
        "num_stages": 2,
        "waves_per_eu": 2,
        "matrix_instr_nonkdim": 16,
        "kpack": 1,
        "cache_modifier": ".cg"
    }
}
