aiter/ops/triton/configs/gemm/gfx1250-GEMM-A16WFP4.json
{
    "M_LEQ_8": {
        "BLOCK_SIZE_M": 4,
        "BLOCK_SIZE_N": 128,
        "BLOCK_SIZE_K": 512,
        "GROUP_SIZE_M": 1,
        "num_warps": 4,
        "num_stages": 1,
        "waves_per_eu": 2,
        "matrix_instr_nonkdim": 16,
        "cache_modifier": ".cg",
        "NUM_KSPLIT": 1
    },
    "M_LEQ_16": {
        "BLOCK_SIZE_M": 4,
        "BLOCK_SIZE_N": 128,
        "BLOCK_SIZE_K": 512,
        "GROUP_SIZE_M": 1,
        "num_warps": 4,
        "num_stages": 1,
        "waves_per_eu": 2,
        "matrix_instr_nonkdim": 16,
        "cache_modifier": ".cg",
        "NUM_KSPLIT": 1
    },
    "M_LEQ_32": {
        "BLOCK_SIZE_M": 8,
        "BLOCK_SIZE_N": 128,
        "BLOCK_SIZE_K": 512,
        "GROUP_SIZE_M": 1,
        "num_warps": 8,
        "num_stages": 1,
        "waves_per_eu": 2,
        "matrix_instr_nonkdim": 16,
        "cache_modifier": ".cg",
        "NUM_KSPLIT": 1
    },
    "M_LEQ_64": {
        "BLOCK_SIZE_M": 8,
        "BLOCK_SIZE_N": 128,
        "BLOCK_SIZE_K": 512,
        "GROUP_SIZE_M": 1,
        "num_warps": 8,
        "num_stages": 1,
        "waves_per_eu": 2,
        "matrix_instr_nonkdim": 16,
        "cache_modifier": ".cg",
        "NUM_KSPLIT": 1
    },
    "M_LEQ_128": {
        "BLOCK_SIZE_M": 8,
        "BLOCK_SIZE_N": 128,
        "BLOCK_SIZE_K": 512,
        "GROUP_SIZE_M": 1,
        "num_warps": 8,
        "num_stages": 1,
        "waves_per_eu": 2,
        "matrix_instr_nonkdim": 16,
        "cache_modifier": ".cg",
        "NUM_KSPLIT": 1
    },
    "M_LEQ_256": {
        "BLOCK_SIZE_M": 8,
        "BLOCK_SIZE_N": 128,
        "BLOCK_SIZE_K": 512,
        "GROUP_SIZE_M": 1,
        "num_warps": 8,
        "num_stages": 1,
        "waves_per_eu": 2,
        "matrix_instr_nonkdim": 16,
        "cache_modifier": ".cg",
        "NUM_KSPLIT": 1
    },
    "any": {
        "BLOCK_SIZE_M": 8,
        "BLOCK_SIZE_N": 128,
        "BLOCK_SIZE_K": 512,
        "GROUP_SIZE_M": 1,
        "num_warps": 8,
        "num_stages": 1,
        "waves_per_eu": 2,
        "matrix_instr_nonkdim": 16,
        "cache_modifier": null,
        "NUM_KSPLIT": 1
    }
}
