aiter/ops/triton/configs/gemm/gfx942-GEMM-A8W8-N=128-K=2048.json
{
  "M_LEQ_16": {
    "BLOCK_SIZE_M": 4,
    "BLOCK_SIZE_N": 16,
    "BLOCK_SIZE_K": 1024,
    "GROUP_SIZE_M": 1,
    "num_warps": 4,
    "num_stages": 2,
    "waves_per_eu": 1,
    "matrix_instr_nonkdim": 16,
    "cache_modifier": null,
    "NUM_KSPLIT": 1
  },
  "M_LEQ_64": {
    "BLOCK_SIZE_M": 16,
    "BLOCK_SIZE_N": 16,
    "BLOCK_SIZE_K": 1024,
    "GROUP_SIZE_M": 1,
    "num_warps": 4,
    "num_stages": 2,
    "waves_per_eu": 2,
    "matrix_instr_nonkdim": 16,
    "cache_modifier": null,
    "NUM_KSPLIT": 1
  },
  "any": {
    "BLOCK_SIZE_M": 4,
    "BLOCK_SIZE_N": 16,
    "BLOCK_SIZE_K": 1024,
    "GROUP_SIZE_M": 1,
    "num_warps": 4,
    "num_stages": 2,
    "waves_per_eu": 1,
    "matrix_instr_nonkdim": 16,
    "cache_modifier": null,
    "NUM_KSPLIT": 1
  }
}
