aiter/configs/model_configs/a8w8_blockscale_tuned_gemm_ds_v3.csv
cu_num,M,N,K,libtype,kernelId,splitK,us,kernelName,tflops,bw,errRatio
256,1,128,7168,ck,8,0,15.3942,a8w8_blockscale_1x128x128_256x16x64x256_16x16_16x16_1x1_16x16x1_16x16x1_1x16x1x16_4_1x1_intrawave_v1,0.12,60.08,0.0
256,1,512,7168,ck,8,0,22.2417,a8w8_blockscale_1x128x128_256x16x64x256_16x16_16x16_1x1_16x16x1_16x16x1_1x16x1x16_4_1x1_intrawave_v1,0.33,165.37,0.0
256,1,1024,7168,ck,8,0,22.7838,a8w8_blockscale_1x128x128_256x16x64x256_16x16_16x16_1x1_16x16x1_16x16x1_1x16x1x16_4_1x1_intrawave_v1,0.64,322.56,0.0
256,1,2112,7168,ck,8,0,22.4396,a8w8_blockscale_1x128x128_256x16x64x256_16x16_16x16_1x1_16x16x1_16x16x1_1x16x1x16_4_1x1_intrawave_v1,1.35,675.15,0.0
256,1,2240,7168,ck,8,0,22.4289,a8w8_blockscale_1x128x128_256x16x64x256_16x16_16x16_1x1_16x16x1_16x16x1_1x16x1x16_4_1x1_intrawave_v1,1.43,716.4,0.0
256,1,3072,1536,ck,8,0,6.5611,a8w8_blockscale_1x128x128_256x16x64x256_16x16_16x16_1x1_16x16x1_16x16x1_1x16x1x16_4_1x1_intrawave_v1,1.44,720.35,0.0
256,1,4096,512,ck,8,0,3.3798,a8w8_blockscale_1x128x128_256x16x64x256_16x16_16x16_1x1_16x16x1_16x16x1_1x16x1x16_4_1x1_intrawave_v1,1.24,623.07,0.0
256,1,4096,7168,ck,8,0,22.7643,a8w8_blockscale_1x128x128_256x16x64x256_16x16_16x16_1x1_16x16x1_16x16x1_1x16x1x16_4_1x1_intrawave_v1,2.58,1290.42,0.0
256,1,4608,7168,ck,8,0,22.7223,a8w8_blockscale_1x128x128_256x16x64x256_16x16_16x16_1x1_16x16x1_16x16x1_1x16x1x16_4_1x1_intrawave_v1,2.91,1454.37,0.0
256,1,7168,256,ck,8,0,2.9182,a8w8_blockscale_1x128x128_256x16x64x256_16x16_16x16_1x1_16x16x1_16x16x1_1x16x1x16_4_1x1_intrawave_v1,1.26,633.82,0.0
256,1,7168,512,ck,13,0,4.049,a8w8_blockscale_1x128x128_256x32x64x256_16x16_16x16_2x1_16x16x1_16x16x1_1x32x1x8_8_2x1_intrawave_v1,1.81,910.07,0.0
256,1,7168,2048,ck,8,0,7.9966,a8w8_blockscale_1x128x128_256x16x64x256_16x16_16x16_1x1_16x16x1_16x16x1_1x16x1x16_4_1x1_intrawave_v1,3.67,1837.84,0.0
256,1,7168,2304,ck,8,0,9.5203,a8w8_blockscale_1x128x128_256x16x64x256_16x16_16x16_1x1_16x16x1_16x16x1_1x16x1x16_4_1x1_intrawave_v1,3.47,1736.47,0.0
256,1,7168,4096,ck,8,0,14.5736,a8w8_blockscale_1x128x128_256x16x64x256_16x16_16x16_1x1_16x16x1_16x16x1_1x16x1x16_4_1x1_intrawave_v1,4.03,2015.88,0.0
256,1,7168,4608,ck,8,0,15.7127,a8w8_blockscale_1x128x128_256x16x64x256_16x16_16x16_1x1_16x16x1_16x16x1_1x16x1x16_4_1x1_intrawave_v1,4.2,2103.34,0.0
256,1,7168,16384,ck,8,0,50.6751,a8w8_blockscale_1x128x128_256x16x64x256_16x16_16x16_1x1_16x16x1_16x16x1_1x16x1x16_4_1x1_intrawave_v1,4.64,2318.13,0.0
256,1,7168,18432,ck,8,0,57.4061,a8w8_blockscale_1x128x128_256x16x64x256_16x16_16x16_1x1_16x16x1_16x16x1_1x16x1x16_4_1x1_intrawave_v1,4.6,2302.08,0.0
256,1,8192,512,ck,13,0,4.0954,a8w8_blockscale_1x128x128_256x32x64x256_16x16_16x16_2x1_16x16x1_16x16x1_1x32x1x8_8_2x1_intrawave_v1,2.05,1028.28,0.0
256,1,8192,1536,ck,8,0,6.2908,a8w8_blockscale_1x128x128_256x16x64x256_16x16_16x16_1x1_16x16x1_16x16x1_1x16x1x16_4_1x1_intrawave_v1,4.0,2003.06,0.0
256,1,9216,7168,ck,8,0,24.1893,a8w8_blockscale_1x128x128_256x16x64x256_16x16_16x16_1x1_16x16x1_16x16x1_1x16x1x16_4_1x1_intrawave_v1,5.46,2732.03,0.0
256,1,11264,1536,ck,8,0,7.5534,a8w8_blockscale_1x128x128_256x16x64x256_16x16_16x16_1x1_16x16x1_16x16x1_1x16x1x16_4_1x1_intrawave_v1,4.58,2293.74,0.0
256,1,12288,1536,ck,8,0,7.7799,a8w8_blockscale_1x128x128_256x16x64x256_16x16_16x16_1x1_16x16x1_16x16x1_1x16x1x16_4_1x1_intrawave_v1,4.85,2429.4,0.0
256,1,14336,1536,ck,8,0,8.0858,a8w8_blockscale_1x128x128_256x16x64x256_16x16_16x16_1x1_16x16x1_16x16x1_1x16x1x16_4_1x1_intrawave_v1,5.45,2727.04,0.0
256,1,16384,512,ck,8,0,4.6738,a8w8_blockscale_1x128x128_256x16x64x256_16x16_16x16_1x1_16x16x1_16x16x1_1x16x1x16_4_1x1_intrawave_v1,3.59,1801.94,0.0
256,1,20480,1536,ck,7,0,8.6493,a8w8_blockscale_1x128x128_256x16x128x256_16x16_16x16_1x2_16x16x1_16x16x1_1x16x1x16_8_1x2_intrawave_v1,7.27,3641.89,0.0
256,1,24576,1536,ck,8,0,9.3079,a8w8_blockscale_1x128x128_256x16x64x256_16x16_16x16_1x1_16x16x1_16x16x1_1x16x1x16_4_1x1_intrawave_v1,8.11,4061.0,0.0
256,1,32768,512,ck,8,0,5.2866,a8w8_blockscale_1x128x128_256x16x64x256_16x16_16x16_1x1_16x16x1_16x16x1_1x16x1x16_4_1x1_intrawave_v1,6.35,3186.03,0.0
256,1,32768,1536,ck,8,0,11.0399,a8w8_blockscale_1x128x128_256x16x64x256_16x16_16x16_1x1_16x16x1_16x16x1_1x16x1x16_4_1x1_intrawave_v1,9.12,4565.14,0.0
256,1,36864,7168,ck,8,0,51.5672,a8w8_blockscale_1x128x128_256x16x64x256_16x16_16x16_1x1_16x16x1_16x16x1_1x16x1x16_4_1x1_intrawave_v1,10.25,5125.78,0.0
256,2,128,7168,ck,8,0,15.3762,a8w8_blockscale_1x128x128_256x16x64x256_16x16_16x16_1x1_16x16x1_16x16x1_1x16x1x16_4_1x1_intrawave_v1,0.24,60.64,0.0
256,2,512,7168,ck,8,0,22.2604,a8w8_blockscale_1x128x128_256x16x64x256_16x16_16x16_1x1_16x16x1_16x16x1_1x16x1x16_4_1x1_intrawave_v1,0.66,165.6,0.0
256,2,1024,7168,ck,8,0,22.8521,a8w8_blockscale_1x128x128_256x16x64x256_16x16_16x16_1x1_16x16x1_16x16x1_1x16x1x16_4_1x1_intrawave_v1,1.28,322.0,0.0
256,2,2112,7168,ck,8,0,22.4493,a8w8_blockscale_1x128x128_256x16x64x256_16x16_16x16_1x1_16x16x1_16x16x1_1x16x1x16_4_1x1_intrawave_v1,2.7,675.37,0.0
256,2,2240,7168,ck,8,0,22.4022,a8w8_blockscale_1x128x128_256x16x64x256_16x16_16x16_1x1_16x16x1_16x16x1_1x16x1x16_4_1x1_intrawave_v1,2.87,717.77,0.0
256,2,3072,1536,ck,8,0,6.4642,a8w8_blockscale_1x128x128_256x16x64x256_16x16_16x16_1x1_16x16x1_16x16x1_1x16x1x16_4_1x1_intrawave_v1,2.92,732.33,0.0
256,2,4096,512,ck,8,0,3.401,a8w8_blockscale_1x128x128_256x16x64x256_16x16_16x16_1x1_16x16x1_16x16x1_1x16x1x16_4_1x1_intrawave_v1,2.47,621.75,0.0
256,2,4096,7168,ck,8,0,22.7895,a8w8_blockscale_1x128x128_256x16x64x256_16x16_16x16_1x1_16x16x1_16x16x1_1x16x1x16_4_1x1_intrawave_v1,5.15,1289.67,0.0
256,2,4608,7168,ck,8,0,22.751,a8w8_blockscale_1x128x128_256x16x64x256_16x16_16x16_1x1_16x16x1_16x16x1_1x16x1x16_4_1x1_intrawave_v1,5.81,1453.25,0.0
256,2,7168,256,ck,8,0,2.908,a8w8_blockscale_1x128x128_256x16x64x256_16x16_16x16_1x1_16x16x1_16x16x1_1x16x1x16_4_1x1_intrawave_v1,2.52,641.06,0.0
256,2,7168,512,ck,13,0,4.0902,a8w8_blockscale_1x128x128_256x32x64x256_16x16_16x16_2x1_16x16x1_16x16x1_1x32x1x8_8_2x1_intrawave_v1,3.59,904.53,0.0
256,2,7168,2048,ck,8,0,8.4117,a8w8_blockscale_1x128x128_256x16x64x256_16x16_16x16_1x1_16x16x1_16x16x1_1x16x1x16_4_1x1_intrawave_v1,6.98,1749.09,0.0
256,2,7168,2304,ck,8,0,8.8052,a8w8_blockscale_1x128x128_256x16x64x256_16x16_16x16_1x1_16x16x1_16x16x1_1x16x1x16_4_1x1_intrawave_v1,7.5,1879.38,0.0
256,2,7168,4096,ck,8,0,14.5727,a8w8_blockscale_1x128x128_256x16x64x256_16x16_16x16_1x1_16x16x1_16x16x1_1x16x1x16_4_1x1_intrawave_v1,8.06,2017.26,0.0
256,2,7168,4608,ck,8,0,15.7396,a8w8_blockscale_1x128x128_256x16x64x256_16x16_16x16_1x1_16x16x1_16x16x1_1x16x1x16_4_1x1_intrawave_v1,8.39,2100.94,0.0
256,2,7168,16384,ck,8,0,50.6878,a8w8_blockscale_1x128x128_256x16x64x256_16x16_16x16_1x1_16x16x1_16x16x1_1x16x1x16_4_1x1_intrawave_v1,9.27,2318.15,0.0
256,2,7168,18432,ck,8,0,57.2045,a8w8_blockscale_1x128x128_256x16x64x256_16x16_16x16_1x1_16x16x1_16x16x1_1x16x1x16_4_1x1_intrawave_v1,9.24,2310.76,0.0
256,2,8192,512,ck,13,0,4.117,a8w8_blockscale_1x128x128_256x32x64x256_16x16_16x16_2x1_16x16x1_16x16x1_1x32x1x8_8_2x1_intrawave_v1,4.08,1026.98,0.0
256,2,8192,1536,ck,8,0,7.3302,a8w8_blockscale_1x128x128_256x16x64x256_16x16_16x16_1x1_16x16x1_16x16x1_1x16x1x16_4_1x1_intrawave_v1,6.87,1721.47,0.0
256,2,9216,7168,ck,8,0,24.268,a8w8_blockscale_1x128x128_256x16x64x256_16x16_16x16_1x1_16x16x1_16x16x1_1x16x1x16_4_1x1_intrawave_v1,10.89,2724.22,0.0
256,2,11264,1536,ck,8,0,6.4805,a8w8_blockscale_1x128x128_256x16x64x256_16x16_16x16_1x1_16x16x1_16x16x1_1x16x1x16_4_1x1_intrawave_v1,10.68,2677.21,0.0
256,2,12288,1536,ck,8,0,6.5398,a8w8_blockscale_1x128x128_256x16x64x256_16x16_16x16_1x1_16x16x1_16x16x1_1x16x1x16_4_1x1_intrawave_v1,11.54,2894.06,0.0
256,2,14336,1536,ck,8,0,8.0887,a8w8_blockscale_1x128x128_256x16x64x256_16x16_16x16_1x1_16x16x1_16x16x1_1x16x1x16_4_1x1_intrawave_v1,10.89,2729.8,0.0
256,2,16384,512,ck,8,0,4.7294,a8w8_blockscale_1x128x128_256x16x64x256_16x16_16x16_1x1_16x16x1_16x16x1_1x16x1x16_4_1x1_intrawave_v1,7.09,1787.79,0.0
256,2,20480,1536,ck,7,0,8.6736,a8w8_blockscale_1x128x128_256x16x128x256_16x16_16x16_1x2_16x16x1_16x16x1_1x16x1x16_8_1x2_intrawave_v1,14.51,3636.58,0.0
256,2,24576,1536,ck,8,0,9.316,a8w8_blockscale_1x128x128_256x16x64x256_16x16_16x16_1x1_16x16x1_16x16x1_1x16x1x16_4_1x1_intrawave_v1,16.21,4062.91,0.0
256,2,32768,512,ck,8,0,5.3243,a8w8_blockscale_1x128x128_256x16x64x256_16x16_16x16_1x1_16x16x1_16x16x1_1x16x1x16_4_1x1_intrawave_v1,12.6,3175.88,0.0
256,2,32768,1536,ck,8,0,11.0733,a8w8_blockscale_1x128x128_256x16x64x256_16x16_16x16_1x1_16x16x1_16x16x1_1x16x1x16_4_1x1_intrawave_v1,18.18,4557.43,0.0
256,2,36864,7168,ck,8,0,51.4438,a8w8_blockscale_1x128x128_256x16x64x256_16x16_16x16_1x1_16x16x1_16x16x1_1x16x1x16_4_1x1_intrawave_v1,20.55,5139.65,0.0
256,4,128,7168,ck,8,0,15.4615,a8w8_blockscale_1x128x128_256x16x64x256_16x16_16x16_1x1_16x16x1_16x16x1_1x16x1x16_4_1x1_intrawave_v1,0.47,61.26,0.0
256,4,512,7168,ck,8,0,22.3068,a8w8_blockscale_1x128x128_256x16x64x256_16x16_16x16_1x1_16x16x1_16x16x1_1x16x1x16_4_1x1_intrawave_v1,1.32,165.99,0.0
256,4,1024,7168,ck,8,0,22.8322,a8w8_blockscale_1x128x128_256x16x64x256_16x16_16x16_1x1_16x16x1_16x16x1_1x16x1x16_4_1x1_intrawave_v1,2.57,323.09,0.0
256,4,2112,7168,ck,8,0,22.473,a8w8_blockscale_1x128x128_256x16x64x256_16x16_16x16_1x1_16x16x1_16x16x1_1x16x1x16_4_1x1_intrawave_v1,5.39,675.67,0.0
256,4,2240,7168,ck,8,0,22.434,a8w8_blockscale_1x128x128_256x16x64x256_16x16_16x16_1x1_16x16x1_16x16x1_1x16x1x16_4_1x1_intrawave_v1,5.73,717.79,0.0
256,4,3072,1536,ck,8,0,6.7718,a8w8_blockscale_1x128x128_256x16x64x256_16x16_16x16_1x1_16x16x1_16x16x1_1x16x1x16_4_1x1_intrawave_v1,5.57,701.34,0.0
256,4,4096,512,ck,8,0,3.411,a8w8_blockscale_1x128x128_256x16x64x256_16x16_16x16_1x1_16x16x1_16x16x1_1x16x1x16_4_1x1_intrawave_v1,4.92,625.03,0.0
256,4,4096,7168,ck,8,0,22.7401,a8w8_blockscale_1x128x128_256x16x64x256_16x16_16x16_1x1_16x16x1_16x16x1_1x16x1x16_4_1x1_intrawave_v1,10.33,1293.82,0.0
256,4,4608,7168,ck,8,0,22.8359,a8w8_blockscale_1x128x128_256x16x64x256_16x16_16x16_1x1_16x16x1_16x16x1_1x16x1x16_4_1x1_intrawave_v1,11.57,1449.28,0.0
256,4,7168,256,ck,8,0,2.9298,a8w8_blockscale_1x128x128_256x16x64x256_16x16_16x16_1x1_16x16x1_16x16x1_1x16x1x16_4_1x1_intrawave_v1,5.01,646.25,0.0
256,4,7168,512,ck,13,0,4.0665,a8w8_blockscale_1x128x128_256x32x64x256_16x16_16x16_2x1_16x16x1_16x16x1_1x32x1x8_8_2x1_intrawave_v1,7.22,917.11,0.0
256,4,7168,2048,ck,8,0,8.3038,a8w8_blockscale_1x128x128_256x16x64x256_16x16_16x16_1x1_16x16x1_16x16x1_1x16x1x16_4_1x1_intrawave_v1,14.14,1775.77,0.0
256,4,7168,2304,ck,8,0,8.8224,a8w8_blockscale_1x128x128_256x16x64x256_16x16_16x16_1x1_16x16x1_16x16x1_1x16x1x16_4_1x1_intrawave_v1,14.98,1879.49,0.0
256,4,7168,4096,ck,8,0,14.5954,a8w8_blockscale_1x128x128_256x16x64x256_16x16_16x16_1x1_16x16x1_16x16x1_1x16x1x16_4_1x1_intrawave_v1,16.09,2016.65,0.0
256,4,7168,4608,ck,8,0,15.7107,a8w8_blockscale_1x128x128_256x16x64x256_16x16_16x16_1x1_16x16x1_16x16x1_1x16x1x16_4_1x1_intrawave_v1,16.82,2107.22,0.0
256,4,7168,16384,ck,8,0,50.7328,a8w8_blockscale_1x128x128_256x16x64x256_16x16_16x16_1x1_16x16x1_16x16x1_1x16x1x16_4_1x1_intrawave_v1,18.52,2317.31,0.0
256,4,7168,18432,ck,8,0,57.5155,a8w8_blockscale_1x128x128_256x16x64x256_16x16_16x16_1x1_16x16x1_16x16x1_1x16x1x16_4_1x1_intrawave_v1,18.38,2299.41,0.0
256,4,8192,512,ck,13,0,4.1178,a8w8_blockscale_1x128x128_256x32x64x256_16x16_16x16_2x1_16x16x1_16x16x1_1x32x1x8_8_2x1_intrawave_v1,8.15,1034.99,0.0
256,4,8192,1536,ck,8,0,6.5931,a8w8_blockscale_1x128x128_256x16x64x256_16x16_16x16_1x1_16x16x1_16x16x1_1x16x1x16_4_1x1_intrawave_v1,15.27,1919.37,0.0
256,4,9216,7168,ck,8,0,24.2612,a8w8_blockscale_1x128x128_256x16x64x256_16x16_16x16_1x1_16x16x1_16x16x1_1x16x1x16_4_1x1_intrawave_v1,21.78,2727.1,0.0
256,4,11264,1536,ck,8,0,6.5359,a8w8_blockscale_1x128x128_256x16x64x256_16x16_16x16_1x1_16x16x1_16x16x1_1x16x1x16_4_1x1_intrawave_v1,21.18,2661.88,0.0
256,4,12288,1536,ck,8,0,7.7422,a8w8_blockscale_1x128x128_256x16x64x256_16x16_16x16_1x1_16x16x1_16x16x1_1x16x1x16_4_1x1_intrawave_v1,19.5,2451.35,0.0
256,4,14336,1536,ck,8,0,8.0317,a8w8_blockscale_1x128x128_256x16x64x256_16x16_16x16_1x1_16x16x1_16x16x1_1x16x1x16_4_1x1_intrawave_v1,21.93,2756.69,0.0
256,4,16384,512,ck,8,0,4.6944,a8w8_blockscale_1x128x128_256x16x64x256_16x16_16x16_1x1_16x16x1_16x16x1_1x16x1x16_4_1x1_intrawave_v1,14.3,1815.3,0.0
256,4,20480,1536,ck,7,0,8.7372,a8w8_blockscale_1x128x128_256x16x128x256_16x16_16x16_1x2_16x16x1_16x16x1_1x16x1x16_8_1x2_intrawave_v1,28.8,3619.84,0.0
256,4,24576,1536,ck,8,0,9.41,a8w8_blockscale_1x128x128_256x16x64x256_16x16_16x16_1x1_16x16x1_16x16x1_1x16x1x16_4_1x1_intrawave_v1,32.09,4033.1,0.0
256,4,32768,512,ck,8,0,5.3284,a8w8_blockscale_1x128x128_256x16x64x256_16x16_16x16_1x1_16x16x1_16x16x1_1x16x1x16_4_1x1_intrawave_v1,25.19,3198.22,0.0
256,4,32768,1536,ck,8,0,11.1225,a8w8_blockscale_1x128x128_256x16x64x256_16x16_16x16_1x1_16x16x1_16x16x1_1x16x1x16_4_1x1_intrawave_v1,36.2,4549.33,0.0
256,4,36864,7168,ck,8,0,51.9106,a8w8_blockscale_1x128x128_256x16x64x256_16x16_16x16_1x1_16x16x1_16x16x1_1x16x1x16_4_1x1_intrawave_v1,40.72,5096.55,0.0
256,8,128,7168,ck,8,0,15.5627,a8w8_blockscale_1x128x128_256x16x64x256_16x16_16x16_1x1_16x16x1_16x16x1_1x16x1x16_4_1x1_intrawave_v1,0.94,62.77,0.0
256,8,512,7168,ck,8,0,22.3452,a8w8_blockscale_1x128x128_256x16x64x256_16x16_16x16_1x1_16x16x1_16x16x1_1x16x1x16_4_1x1_intrawave_v1,2.63,167.17,0.0
256,8,1024,7168,ck,8,0,22.9843,a8w8_blockscale_1x128x128_256x16x64x256_16x16_16x16_1x1_16x16x1_16x16x1_1x16x1x16_4_1x1_intrawave_v1,5.11,322.56,0.0
256,8,2112,7168,ck,8,0,22.4589,a8w8_blockscale_1x128x128_256x16x64x256_16x16_16x16_1x1_16x16x1_16x16x1_1x16x1x16_4_1x1_intrawave_v1,10.79,678.13,0.0
256,8,2240,7168,ck,8,0,22.4802,a8w8_blockscale_1x128x128_256x16x64x256_16x16_16x16_1x1_16x16x1_16x16x1_1x16x1x16_4_1x1_intrawave_v1,11.43,718.39,0.0
256,8,3072,1536,ck,8,0,6.482,a8w8_blockscale_1x128x128_256x16x64x256_16x16_16x16_1x1_16x16x1_16x16x1_1x16x1x16_4_1x1_intrawave_v1,11.65,737.43,0.0
256,8,4096,512,ck,8,0,3.4272,a8w8_blockscale_1x128x128_256x16x64x256_16x16_16x16_1x1_16x16x1_16x16x1_1x16x1x16_4_1x1_intrawave_v1,9.79,632.23,0.0
256,8,4096,7168,ck,8,0,22.9113,a8w8_blockscale_1x128x128_256x16x64x256_16x16_16x16_1x1_16x16x1_16x16x1_1x16x1x16_4_1x1_intrawave_v1,20.5,1286.83,0.0
256,8,4608,7168,ck,8,0,22.808,a8w8_blockscale_1x128x128_256x16x64x256_16x16_16x16_1x1_16x16x1_16x16x1_1x16x1x16_4_1x1_intrawave_v1,23.17,1453.93,0.0
256,8,7168,256,ck,8,0,2.9146,a8w8_blockscale_1x128x128_256x16x64x256_16x16_16x16_1x1_16x16x1_16x16x1_1x16x1x16_4_1x1_intrawave_v1,10.07,669.64,0.0
256,8,7168,512,ck,13,0,4.1122,a8w8_blockscale_1x128x128_256x32x64x256_16x16_16x16_2x1_16x16x1_16x16x1_1x32x1x8_8_2x1_intrawave_v1,14.28,921.36,0.0
256,8,7168,2048,ck,8,0,8.1857,a8w8_blockscale_1x128x128_256x16x64x256_16x16_16x16_1x1_16x16x1_16x16x1_1x16x1x16_4_1x1_intrawave_v1,28.69,1809.39,0.0
256,8,7168,2304,ck,8,0,8.8267,a8w8_blockscale_1x128x128_256x16x64x256_16x16_16x16_1x1_16x16x1_16x16x1_1x16x1x16_4_1x1_intrawave_v1,29.94,1886.12,0.0
256,8,7168,4096,ck,8,0,14.65,a8w8_blockscale_1x128x128_256x16x64x256_16x16_16x16_1x1_16x16x1_16x16x1_1x16x1x16_4_1x1_intrawave_v1,32.07,2014.17,0.0
256,8,7168,4608,ck,8,0,15.796,a8w8_blockscale_1x128x128_256x16x64x256_16x16_16x16_1x1_16x16x1_16x16x1_1x16x1x16_4_1x1_intrawave_v1,33.46,2100.64,0.0
256,8,7168,16384,ck,8,0,50.8429,a8w8_blockscale_1x128x128_256x16x64x256_16x16_16x16_1x1_16x16x1_16x16x1_1x16x1x16_4_1x1_intrawave_v1,36.96,2314.7,0.0
256,8,7168,18432,ck,8,0,57.4158,a8w8_blockscale_1x128x128_256x16x64x256_16x16_16x16_1x1_16x16x1_16x16x1_1x16x1x16_4_1x1_intrawave_v1,36.82,2305.68,0.0
256,8,8192,512,ck,13,0,4.1533,a8w8_blockscale_1x128x128_256x32x64x256_16x16_16x16_2x1_16x16x1_16x16x1_1x32x1x8_8_2x1_intrawave_v1,16.16,1042.42,0.0
256,8,8192,1536,ck,8,0,6.4583,a8w8_blockscale_1x128x128_256x16x64x256_16x16_16x16_1x1_16x16x1_16x16x1_1x16x1x16_4_1x1_intrawave_v1,31.17,1970.53,0.0
256,8,9216,7168,ck,8,0,24.3102,a8w8_blockscale_1x128x128_256x16x64x256_16x16_16x16_1x1_16x16x1_16x16x1_1x16x1x16_4_1x1_intrawave_v1,43.48,2725.81,0.0
256,8,11264,1536,ck,8,0,6.624,a8w8_blockscale_1x128x128_256x16x64x256_16x16_16x16_1x1_16x16x1_16x16x1_1x16x1x16_4_1x1_intrawave_v1,41.79,2641.0,0.0
256,8,12288,1536,ck,8,0,7.0261,a8w8_blockscale_1x128x128_256x16x64x256_16x16_16x16_1x1_16x16x1_16x16x1_1x16x1x16_4_1x1_intrawave_v1,42.98,2716.05,0.0
256,8,14336,1536,ck,8,0,8.0884,a8w8_blockscale_1x128x128_256x16x64x256_16x16_16x16_1x1_16x16x1_16x16x1_1x16x1x16_4_1x1_intrawave_v1,43.56,2752.31,0.0
256,8,16384,512,ck,8,0,4.6609,a8w8_blockscale_1x128x128_256x16x64x256_16x16_16x16_1x1_16x16x1_16x16x1_1x16x1x16_4_1x1_intrawave_v1,28.8,1856.9,0.0
256,8,20480,1536,ck,7,0,8.8663,a8w8_blockscale_1x128x128_256x16x128x256_16x16_16x16_1x2_16x16x1_16x16x1_1x16x1x16_8_1x2_intrawave_v1,56.77,3586.3,0.0
256,8,24576,1536,ck,8,0,9.4837,a8w8_blockscale_1x128x128_256x16x64x256_16x16_16x16_1x1_16x16x1_16x16x1_1x16x1x16_4_1x1_intrawave_v1,63.69,4023.14,0.0
256,8,32768,512,ck,8,0,5.3293,a8w8_blockscale_1x128x128_256x16x64x256_16x16_16x16_1x1_16x16x1_16x16x1_1x16x1x16_4_1x1_intrawave_v1,50.37,3247.26,0.0
256,8,32768,1536,ck,8,0,11.1791,a8w8_blockscale_1x128x128_256x16x64x256_16x16_16x16_1x1_16x16x1_16x16x1_1x16x1x16_4_1x1_intrawave_v1,72.04,4550.3,0.0
256,8,36864,7168,ck,8,0,52.7222,a8w8_blockscale_1x128x128_256x16x64x256_16x16_16x16_1x1_16x16x1_16x16x1_1x16x1x16_4_1x1_intrawave_v1,80.19,5024.23,0.0
256,16,64,7168,ck,8,0,13.753,a8w8_blockscale_1x128x128_256x16x64x256_16x16_16x16_1x1_16x16x1_16x16x1_1x16x1x16_4_1x1_intrawave_v1,1.07,41.84,0.0
256,16,128,7168,ck,8,0,13.8217,a8w8_blockscale_1x128x128_256x16x64x256_16x16_16x16_1x1_16x16x1_16x16x1_1x16x1x16_4_1x1_intrawave_v1,2.12,74.98,0.0
256,16,512,7168,ck,8,0,20.9785,a8w8_blockscale_1x128x128_256x16x64x256_16x16_16x16_1x1_16x16x1_16x16x1_1x16x1x16_4_1x1_intrawave_v1,5.6,181.19,0.0
256,16,576,7168,ck,8,0,21.1695,a8w8_blockscale_1x128x128_256x16x64x256_16x16_16x16_1x1_16x16x1_16x16x1_1x16x1x16_4_1x1_intrawave_v1,6.24,201.32,0.0
256,16,1024,7168,ck,8,0,21.4879,a8w8_blockscale_1x128x128_256x16x64x256_16x16_16x16_1x1_16x16x1_16x16x1_1x16x1x16_4_1x1_intrawave_v1,10.93,348.45,0.0
256,16,1536,7168,ck,8,0,21.2635,a8w8_blockscale_1x128x128_256x16x64x256_16x16_16x16_1x1_16x16x1_16x16x1_1x16x1x16_4_1x1_intrawave_v1,16.57,525.5,0.0
256,16,2112,7168,ck,8,0,21.0289,a8w8_blockscale_1x128x128_256x16x64x256_16x16_16x16_1x1_16x16x1_16x16x1_1x16x1x16_4_1x1_intrawave_v1,23.04,728.57,0.0
256,16,2240,7168,ck,8,0,21.0862,a8w8_blockscale_1x128x128_256x16x64x256_16x16_16x16_1x1_16x16x1_16x16x1_1x16x1x16_4_1x1_intrawave_v1,24.37,770.3,0.0
256,16,3072,1536,ck,8,0,6.5418,a8w8_blockscale_1x128x128_256x16x64x256_16x16_16x16_1x1_16x16x1_16x16x1_1x16x1x16_4_1x1_intrawave_v1,23.08,740.08,0.0
256,16,4096,512,ck,8,0,3.4235,a8w8_blockscale_1x128x128_256x16x64x256_16x16_16x16_1x1_16x16x1_16x16x1_1x16x1x16_4_1x1_intrawave_v1,19.6,653.25,0.0
256,16,4096,7168,ck,8,0,21.5063,a8w8_blockscale_1x128x128_256x16x64x256_16x16_16x16_1x1_16x16x1_16x16x1_1x16x1x16_4_1x1_intrawave_v1,43.69,1376.61,0.0
256,16,4608,7168,ck,8,0,21.4253,a8w8_blockscale_1x128x128_256x16x64x256_16x16_16x16_1x1_16x16x1_16x16x1_1x16x1x16_4_1x1_intrawave_v1,49.33,1553.88,0.0
256,16,7168,256,ck,8,0,2.9668,a8w8_blockscale_1x128x128_256x16x64x256_16x16_16x16_1x1_16x16x1_16x16x1_1x16x1x16_4_1x1_intrawave_v1,19.79,697.21,0.0
256,16,7168,512,ck,8,0,4.1538,a8w8_blockscale_1x128x128_256x16x64x256_16x16_16x16_1x1_16x16x1_16x16x1_1x16x1x16_4_1x1_intrawave_v1,28.27,940.73,0.0
256,16,7168,2048,ck,8,0,8.5525,a8w8_blockscale_1x128x128_256x16x64x256_16x16_16x16_1x1_16x16x1_16x16x1_1x16x1x16_4_1x1_intrawave_v1,54.93,1747.12,0.0
256,16,7168,2304,ck,8,0,8.5986,a8w8_blockscale_1x128x128_256x16x64x256_16x16_16x16_1x1_16x16x1_16x16x1_1x16x1x16_4_1x1_intrawave_v1,61.46,1951.63,0.0
256,16,7168,4096,ck,8,0,14.2602,a8w8_blockscale_1x128x128_256x16x64x256_16x16_16x16_1x1_16x16x1_16x16x1_1x16x1x16_4_1x1_intrawave_v1,65.88,2079.57,0.0
256,16,7168,4608,ck,8,0,14.92,a8w8_blockscale_1x128x128_256x16x64x256_16x16_16x16_1x1_16x16x1_16x16x1_1x16x1x16_4_1x1_intrawave_v1,70.84,2234.13,0.0
256,16,7168,16384,ck,8,0,49.2174,a8w8_blockscale_1x128x128_256x16x64x256_16x16_16x16_1x1_16x16x1_16x16x1_1x16x1x16_4_1x1_intrawave_v1,76.36,2396.15,0.0
256,16,7168,18432,ck,8,0,54.4636,a8w8_blockscale_1x128x128_256x16x64x256_16x16_16x16_1x1_16x16x1_16x16x1_1x16x1x16_4_1x1_intrawave_v1,77.63,2435.48,0.0
256,16,8192,512,ck,8,0,4.1546,a8w8_blockscale_1x128x128_256x16x64x256_16x16_16x16_1x1_16x16x1_16x16x1_1x16x1x16_4_1x1_intrawave_v1,32.31,1074.63,0.0
256,16,8192,1536,ck,8,0,6.991,a8w8_blockscale_1x128x128_256x16x64x256_16x16_16x16_1x1_16x16x1_16x16x1_1x16x1x16_4_1x1_intrawave_v1,57.6,1840.89,0.0
256,16,9216,7168,ck,8,0,23.3394,a8w8_blockscale_1x128x128_256x16x64x256_16x16_16x16_1x1_16x16x1_16x16x1_1x16x1x16_4_1x1_intrawave_v1,90.57,2847.97,0.0
256,16,11264,1536,ck,8,0,6.5361,a8w8_blockscale_1x128x128_256x16x64x256_16x16_16x16_1x1_16x16x1_16x16x1_1x16x1x16_4_1x1_intrawave_v1,84.71,2705.98,0.0
256,16,12288,1536,ck,8,0,7.8318,a8w8_blockscale_1x128x128_256x16x64x256_16x16_16x16_1x1_16x16x1_16x16x1_1x16x1x16_4_1x1_intrawave_v1,77.12,2463.31,0.0
256,16,14336,1536,ck,8,0,8.0559,a8w8_blockscale_1x128x128_256x16x64x256_16x16_16x16_1x1_16x16x1_16x16x1_1x16x1x16_4_1x1_intrawave_v1,87.47,2793.41,0.0
256,16,16384,512,ck,8,0,4.6334,a8w8_blockscale_1x128x128_256x16x64x256_16x16_16x16_1x1_16x16x1_16x16x1_1x16x1x16_4_1x1_intrawave_v1,57.93,1925.39,0.0
256,16,20480,1536,ck,7,0,9.1661,a8w8_blockscale_1x128x128_256x16x128x256_16x16_16x16_1x2_16x16x1_16x16x1_1x16x1x16_8_1x2_intrawave_v1,109.82,3506.09,0.0
256,16,24576,1536,ck,8,0,9.7004,a8w8_blockscale_1x128x128_256x16x64x256_16x16_16x16_1x1_16x16x1_16x16x1_1x16x1x16_4_1x1_intrawave_v1,124.53,3975.07,0.0
256,16,32768,512,ck,7,0,5.5119,a8w8_blockscale_1x128x128_256x16x128x256_16x16_16x16_1x2_16x16x1_16x16x1_1x16x1x16_8_1x2_intrawave_v1,97.4,3235.54,0.0
256,16,32768,1536,ck,8,0,11.4461,a8w8_blockscale_1x128x128_256x16x64x256_16x16_16x16_1x1_16x16x1_16x16x1_1x16x1x16_4_1x1_intrawave_v1,140.71,4491.03,0.0
256,16,36864,7168,ck,8,0,53.9674,a8w8_blockscale_1x128x128_256x16x64x256_16x16_16x16_1x1_16x16x1_16x16x1_1x16x1x16_4_1x1_intrawave_v1,156.68,4920.29,0.0
256,32,64,7168,ck,8,0,13.8569,a8w8_blockscale_1x128x128_256x16x64x256_16x16_16x16_1x1_16x16x1_16x16x1_1x16x1x16_4_1x1_intrawave_v1,2.12,49.96,0.0
256,32,128,7168,ck,8,0,14.288,a8w8_blockscale_1x128x128_256x16x64x256_16x16_16x16_1x1_16x16x1_16x16x1_1x16x1x16_4_1x1_intrawave_v1,4.11,80.84,0.0
256,32,512,7168,ck,8,0,20.8284,a8w8_blockscale_1x128x128_256x16x64x256_16x16_16x16_1x1_16x16x1_16x16x1_1x16x1x16_4_1x1_intrawave_v1,11.28,188.79,0.0
256,32,576,7168,ck,8,0,20.9741,a8w8_blockscale_1x128x128_256x16x64x256_16x16_16x16_1x1_16x16x1_16x16x1_1x16x1x16_4_1x1_intrawave_v1,12.6,209.54,0.0
256,32,1024,7168,ck,8,0,21.3011,a8w8_blockscale_1x128x128_256x16x64x256_16x16_16x16_1x1_16x16x1_16x16x1_1x16x1x16_4_1x1_intrawave_v1,22.05,358.43,0.0
256,32,1536,7168,ck,8,0,21.328,a8w8_blockscale_1x128x128_256x16x64x256_16x16_16x16_1x1_16x16x1_16x16x1_1x16x1x16_4_1x1_intrawave_v1,33.04,531.59,0.0
256,32,2112,7168,ck,8,0,20.8386,a8w8_blockscale_1x128x128_256x16x64x256_16x16_16x16_1x1_16x16x1_16x16x1_1x16x1x16_4_1x1_intrawave_v1,46.49,743.97,0.0
256,32,2240,7168,ck,8,0,20.8898,a8w8_blockscale_1x128x128_256x16x64x256_16x16_16x16_1x1_16x16x1_16x16x1_1x16x1x16_4_1x1_intrawave_v1,49.19,786.46,0.0
256,32,3072,1536,ck,8,0,6.5986,a8w8_blockscale_1x128x128_256x16x64x256_16x16_16x16_1x1_16x16x1_16x16x1_1x16x1x16_4_1x1_intrawave_v1,45.77,752.33,0.0
256,32,4096,512,ck,13,0,3.5718,a8w8_blockscale_1x128x128_256x32x64x256_16x16_16x16_2x1_16x16x1_16x16x1_1x32x1x8_8_2x1_intrawave_v1,37.58,665.12,0.0
256,32,4096,7168,ck,8,0,21.3382,a8w8_blockscale_1x128x128_256x16x64x256_16x16_16x16_1x1_16x16x1_16x16x1_1x16x1x16_4_1x1_intrawave_v1,88.06,1398.98,0.0
256,32,4608,7168,ck,8,0,21.3536,a8w8_blockscale_1x128x128_256x16x64x256_16x16_16x16_1x1_16x16x1_16x16x1_1x16x1x16_4_1x1_intrawave_v1,99.0,1571.37,0.0
256,32,7168,256,ck,13,0,3.239,a8w8_blockscale_1x128x128_256x32x64x256_16x16_16x16_2x1_16x16x1_16x16x1_1x32x1x8_8_2x1_intrawave_v1,36.26,710.7,0.0
256,32,7168,512,ck,13,0,4.2078,a8w8_blockscale_1x128x128_256x32x64x256_16x16_16x16_2x1_16x16x1_16x16x1_1x32x1x8_8_2x1_intrawave_v1,55.82,985.11,0.0
256,32,7168,2048,ck,8,0,8.0391,a8w8_blockscale_1x128x128_256x16x64x256_16x16_16x16_1x1_16x16x1_16x16x1_1x16x1x16_4_1x1_intrawave_v1,116.87,1891.3,0.0
256,32,7168,2304,ck,8,0,8.7013,a8w8_blockscale_1x128x128_256x16x64x256_16x16_16x16_1x1_16x16x1_16x16x1_1x16x1x16_4_1x1_intrawave_v1,121.47,1959.2,0.0
256,32,7168,4096,ck,8,0,14.1521,a8w8_blockscale_1x128x128_256x16x64x256_16x16_16x16_1x1_16x16x1_16x16x1_1x16x1x16_4_1x1_intrawave_v1,132.78,2116.29,0.0
256,32,7168,4608,ck,8,0,14.9953,a8w8_blockscale_1x128x128_256x16x64x256_16x16_16x16_1x1_16x16x1_16x16x1_1x16x1x16_4_1x1_intrawave_v1,140.97,2243.13,0.0
256,32,7168,16384,ck,8,0,48.4226,a8w8_blockscale_1x128x128_256x16x64x256_16x16_16x16_1x1_16x16x1_16x16x1_1x16x1x16_4_1x1_intrawave_v1,155.22,2445.63,0.0
256,32,7168,18432,ck,8,0,54.0238,a8w8_blockscale_1x128x128_256x16x64x256_16x16_16x16_1x1_16x16x1_16x16x1_1x16x1x16_4_1x1_intrawave_v1,156.52,2465.01,0.0
256,32,8192,512,ck,13,0,4.2239,a8w8_blockscale_1x128x128_256x32x64x256_16x16_16x16_2x1_16x16x1_16x16x1_1x32x1x8_8_2x1_intrawave_v1,63.55,1121.0,0.0
256,32,8192,1536,ck,8,0,6.8782,a8w8_blockscale_1x128x128_256x16x64x256_16x16_16x16_1x1_16x16x1_16x16x1_1x16x1x16_4_1x1_intrawave_v1,117.08,1912.76,0.0
256,32,9216,7168,ck,7,0,25.0083,a8w8_blockscale_1x128x128_256x16x128x256_16x16_16x16_1x2_16x16x1_16x16x1_1x16x1x16_8_1x2_intrawave_v1,169.06,2674.29,0.0
256,32,11264,1536,ck,18,0,8.6616,a8w8_blockscale_1x128x128_256x64x64x256_16x16_32x32_1x1_16x16x1_16x16x1_1x32x1x8_8_1x1_intrawave_v1,127.84,2086.4,0.0
256,32,12288,1536,ck,18,0,8.3515,a8w8_blockscale_1x128x128_256x64x64x256_16x16_32x32_1x1_16x16x1_16x16x1_1x32x1x8_8_1x1_intrawave_v1,144.64,2360.05,0.0
256,32,14336,1536,ck,7,0,8.7538,a8w8_blockscale_1x128x128_256x16x128x256_16x16_16x16_1x2_16x16x1_16x16x1_1x16x1x16_8_1x2_intrawave_v1,160.99,2625.92,0.0
256,32,16384,512,ck,13,0,4.8406,a8w8_blockscale_1x128x128_256x32x64x256_16x16_16x16_2x1_16x16x1_16x16x1_1x32x1x8_8_2x1_intrawave_v1,110.91,1952.97,0.0
256,32,20480,1536,ck,12,0,10.5564,a8w8_blockscale_1x128x128_256x32x128x256_16x16_32x32_1x1_16x16x1_16x16x1_1x32x1x8_8_1x1_intrawave_v1,190.72,3108.74,0.0
256,32,24576,1536,ck,12,0,11.298,a8w8_blockscale_1x128x128_256x32x128x256_16x16_32x32_1x1_16x16x1_16x16x1_1x32x1x8_8_1x1_intrawave_v1,213.84,3484.75,0.0
256,32,32768,512,ck,13,0,5.5756,a8w8_blockscale_1x128x128_256x32x64x256_16x16_16x16_2x1_16x16x1_16x16x1_1x32x1x8_8_2x1_intrawave_v1,192.58,3388.11,0.0
256,32,32768,1536,ck,12,0,12.8162,a8w8_blockscale_1x128x128_256x32x128x256_16x16_32x32_1x1_16x16x1_16x16x1_1x32x1x8_8_1x1_intrawave_v1,251.34,4094.66,0.0
256,32,36864,7168,ck,9,0,63.4973,a8w8_blockscale_1x128x128_256x32x256x128_16x16_32x32_1x2_8x32x1_8x32x1_1x32x1x8_8_1x1_intrawave_v1,266.33,4202.22,0.0
256,64,64,7168,ck,8,0,14.0983,a8w8_blockscale_1x128x128_256x16x64x256_16x16_16x16_1x1_16x16x1_16x16x1_1x16x1x16_4_1x1_intrawave_v1,4.17,65.66,0.0
256,64,128,7168,ck,8,0,14.5236,a8w8_blockscale_1x128x128_256x16x64x256_16x16_16x16_1x1_16x16x1_16x16x1_1x16x1x16_4_1x1_intrawave_v1,8.09,95.89,0.0
256,64,512,7168,ck,8,0,20.5969,a8w8_blockscale_1x128x128_256x16x64x256_16x16_16x16_1x1_16x16x1_16x16x1_1x16x1x16_4_1x1_intrawave_v1,22.81,203.64,0.0
256,64,576,7168,ck,8,0,20.6636,a8w8_blockscale_1x128x128_256x16x64x256_16x16_16x16_1x1_16x16x1_16x16x1_1x16x1x16_4_1x1_intrawave_v1,25.58,225.58,0.0
256,64,1024,7168,ck,8,0,20.9843,a8w8_blockscale_1x128x128_256x16x64x256_16x16_16x16_1x1_16x16x1_16x16x1_1x16x1x16_4_1x1_intrawave_v1,44.77,377.89,0.0
256,64,1536,7168,ck,8,0,21.2119,a8w8_blockscale_1x128x128_256x16x64x256_16x16_16x16_1x1_16x16x1_16x16x1_1x16x1x16_4_1x1_intrawave_v1,66.44,549.95,0.0
256,64,2112,7168,ck,8,0,20.6114,a8w8_blockscale_1x128x128_256x16x64x256_16x16_16x16_1x1_16x16x1_16x16x1_1x16x1x16_4_1x1_intrawave_v1,94.01,769.86,0.0
256,64,2240,7168,ck,8,0,20.6316,a8w8_blockscale_1x128x128_256x16x64x256_16x16_16x16_1x1_16x16x1_16x16x1_1x16x1x16_4_1x1_intrawave_v1,99.61,814.37,0.0
256,64,3072,1536,ck,8,0,6.5488,a8w8_blockscale_1x128x128_256x16x64x256_16x16_16x16_1x1_16x16x1_16x16x1_1x16x1x16_4_1x1_intrawave_v1,92.23,795.58,0.0
256,64,4096,512,ck,8,0,3.9182,a8w8_blockscale_1x128x128_256x16x64x256_16x16_16x16_1x1_16x16x1_16x16x1_1x16x1x16_4_1x1_intrawave_v1,68.51,677.4,0.0
256,64,4096,7168,ck,8,0,21.2311,a8w8_blockscale_1x128x128_256x16x64x256_16x16_16x16_1x1_16x16x1_16x16x1_1x16x1x16_4_1x1_intrawave_v1,177.01,1429.18,0.0
256,64,4608,7168,ck,7,0,23.1112,a8w8_blockscale_1x128x128_256x16x128x256_16x16_16x16_1x2_16x16x1_16x16x1_1x16x1x16_8_1x2_intrawave_v1,182.94,1474.55,0.0
256,64,7168,256,ck,13,0,3.713,a8w8_blockscale_1x128x128_256x32x64x256_16x16_16x16_2x1_16x16x1_16x16x1_1x32x1x8_8_2x1_intrawave_v1,63.26,745.73,0.0
256,64,7168,512,ck,13,0,4.4706,a8w8_blockscale_1x128x128_256x32x64x256_16x16_16x16_2x1_16x16x1_16x16x1_1x32x1x8_8_2x1_intrawave_v1,105.08,1033.48,0.0
256,64,7168,2048,ck,7,0,8.8766,a8w8_blockscale_1x128x128_256x16x128x256_16x16_16x16_1x2_16x16x1_16x16x1_1x16x1x16_8_1x2_intrawave_v1,211.69,1771.92,0.0
256,64,7168,2304,ck,7,0,9.7303,a8w8_blockscale_1x128x128_256x16x128x256_16x16_16x16_1x2_16x16x1_16x16x1_1x16x1x16_8_1x2_intrawave_v1,217.25,1806.73,0.0
256,64,7168,4096,ck,7,0,15.6595,a8w8_blockscale_1x128x128_256x16x128x256_16x16_16x16_1x2_16x16x1_16x16x1_1x16x1x16_8_1x2_intrawave_v1,239.99,1950.24,0.0
256,64,7168,4608,ck,7,0,16.6612,a8w8_blockscale_1x128x128_256x16x128x256_16x16_16x16_1x2_16x16x1_16x16x1_1x16x1x16_8_1x2_intrawave_v1,253.75,2055.23,0.0
256,64,7168,16384,ck,18,0,53.066,a8w8_blockscale_1x128x128_256x64x64x256_16x16_32x32_1x1_16x16x1_16x16x1_1x32x1x8_8_1x1_intrawave_v1,283.28,2250.15,0.0
256,64,7168,18432,ck,18,0,58.5515,a8w8_blockscale_1x128x128_256x64x64x256_16x16_32x32_1x1_16x16x1_16x16x1_1x32x1x8_8_1x1_intrawave_v1,288.83,2292.3,0.0
256,64,8192,512,ck,13,0,4.4992,a8w8_blockscale_1x128x128_256x32x64x256_16x16_16x16_2x1_16x16x1_16x16x1_1x32x1x8_8_2x1_intrawave_v1,119.33,1172.57,0.0
256,64,8192,1536,ck,18,0,8.3243,a8w8_blockscale_1x128x128_256x64x64x256_16x16_32x32_1x1_16x16x1_16x16x1_1x32x1x8_8_1x1_intrawave_v1,193.48,1649.36,0.0
256,64,9216,7168,ck,18,0,25.8746,a8w8_blockscale_1x128x128_256x64x64x256_16x16_32x32_1x1_16x16x1_16x16x1_1x32x1x8_8_1x1_intrawave_v1,326.8,2616.41,0.0
256,64,11264,1536,ck,18,0,8.4093,a8w8_blockscale_1x128x128_256x64x64x256_16x16_32x32_1x1_16x16x1_16x16x1_1x32x1x8_8_1x1_intrawave_v1,263.35,2240.57,0.0
256,64,12288,1536,ck,18,0,8.4019,a8w8_blockscale_1x128x128_256x64x64x256_16x16_32x32_1x1_16x16x1_16x16x1_1x32x1x8_8_1x1_intrawave_v1,287.54,2445.34,0.0
256,64,14336,1536,ck,18,0,8.8597,a8w8_blockscale_1x128x128_256x64x64x256_16x16_32x32_1x1_16x16x1_16x16x1_1x32x1x8_8_1x1_intrawave_v1,318.13,2703.64,0.0
256,64,16384,512,ck,18,0,5.5061,a8w8_blockscale_1x128x128_256x64x64x256_16x16_32x32_1x1_16x16x1_16x16x1_1x32x1x8_8_1x1_intrawave_v1,195.01,1910.34,0.0
256,64,20480,1536,ck,18,0,13.129,a8w8_blockscale_1x128x128_256x64x64x256_16x16_32x32_1x1_16x16x1_16x16x1_1x32x1x8_8_1x1_intrawave_v1,306.69,2603.17,0.0
256,64,24576,1536,ck,18,0,13.7416,a8w8_blockscale_1x128x128_256x64x64x256_16x16_32x32_1x1_16x16x1_16x16x1_1x32x1x8_8_1x1_intrawave_v1,351.62,2983.11,0.0
256,64,32768,512,ck,2,0,7.9558,a8w8_blockscale_1x128x128_256x64x128x128_16x16_32x32_1x2_8x32x1_8x32x1_1x32x1x8_8_1x1_intrawave_v3,269.93,2640.12,0.0
256,64,32768,1536,ck,18,0,14.825,a8w8_blockscale_1x128x128_256x64x64x256_16x16_32x32_1x1_16x16x1_16x16x1_1x32x1x8_8_1x1_intrawave_v1,434.57,3684.6,0.0
256,64,36864,7168,ck,14,0,75.9499,a8w8_blockscale_1x128x128_256x64x256x128_16x16_32x32_2x2_8x32x1_8x32x1_1x32x1x8_8_1x1_intrawave_v1,445.33,3547.32,0.0
256,96,128,7168,ck,8,0,14.4064,a8w8_blockscale_1x128x128_256x16x64x256_16x16_16x16_1x1_16x16x1_16x16x1_1x16x1x16_4_1x1_intrawave_v1,12.23,113.16,0.0
256,96,512,7168,ck,8,0,20.2501,a8w8_blockscale_1x128x128_256x16x64x256_16x16_16x16_1x1_16x16x1_16x16x1_1x16x1x16_4_1x1_intrawave_v1,34.8,220.07,0.0
256,96,1024,7168,ck,8,0,20.6839,a8w8_blockscale_1x128x128_256x16x64x256_16x16_16x16_1x1_16x16x1_16x16x1_1x16x1x16_4_1x1_intrawave_v1,68.13,397.64,0.0
256,96,2112,7168,ck,8,0,20.5046,a8w8_blockscale_1x128x128_256x16x64x256_16x16_16x16_1x1_16x16x1_16x16x1_1x16x1x16_4_1x1_intrawave_v1,141.76,791.65,0.0
256,96,2240,7168,ck,8,0,20.4717,a8w8_blockscale_1x128x128_256x16x64x256_16x16_16x16_1x1_16x16x1_16x16x1_1x16x1x16_4_1x1_intrawave_v1,150.59,838.94,0.0
256,96,3072,1536,ck,8,0,7.8324,a8w8_blockscale_1x128x128_256x16x64x256_16x16_16x16_1x1_16x16x1_16x16x1_1x16x1x16_4_1x1_intrawave_v1,115.67,696.58,0.0
256,96,4096,512,ck,13,0,4.2826,a8w8_blockscale_1x128x128_256x32x64x256_16x16_16x16_2x1_16x16x1_16x16x1_1x32x1x8_8_2x1_intrawave_v1,94.02,684.8,0.0
256,96,4096,7168,ck,7,0,23.3977,a8w8_blockscale_1x128x128_256x16x128x256_16x16_16x16_1x2_16x16x1_16x16x1_1x16x1x16_8_1x2_intrawave_v1,240.93,1317.85,0.0
256,96,4608,7168,ck,7,0,23.8202,a8w8_blockscale_1x128x128_256x16x128x256_16x16_16x16_1x2_16x16x1_16x16x1_1x16x1x16_8_1x2_intrawave_v1,266.24,1452.67,0.0
256,96,7168,256,ck,8,0,4.3182,a8w8_blockscale_1x128x128_256x16x64x256_16x16_16x16_1x1_16x16x1_16x16x1_1x16x1x16_4_1x1_intrawave_v1,81.59,749.35,0.0
256,96,7168,512,ck,13,0,5.319,a8w8_blockscale_1x128x128_256x32x64x256_16x16_16x16_2x1_16x16x1_16x16x1_1x32x1x8_8_2x1_intrawave_v1,132.48,957.97,0.0
256,96,7168,2048,ck,18,0,9.6386,a8w8_blockscale_1x128x128_256x64x64x256_16x16_32x32_1x1_16x16x1_16x16x1_1x32x1x8_8_1x1_intrawave_v1,292.43,1686.23,0.0
256,96,7168,2304,ck,18,0,10.3846,a8w8_blockscale_1x128x128_256x64x64x256_16x16_32x32_1x1_16x16x1_16x16x1_1x32x1x8_8_1x1_intrawave_v1,305.35,1744.17,0.0
256,96,7168,4096,ck,18,0,16.1889,a8w8_blockscale_1x128x128_256x64x64x256_16x16_32x32_1x1_16x16x1_16x16x1_1x32x1x8_8_1x1_intrawave_v1,348.21,1922.9,0.0
256,96,7168,4608,ck,18,0,17.2691,a8w8_blockscale_1x128x128_256x64x64x256_16x16_32x32_1x1_16x16x1_16x16x1_1x32x1x8_8_1x1_intrawave_v1,367.23,2017.98,0.0
256,96,7168,16384,ck,18,0,55.0061,a8w8_blockscale_1x128x128_256x64x64x256_16x16_32x32_1x1_16x16x1_16x16x1_1x32x1x8_8_1x1_intrawave_v1,409.93,2188.66,0.0
256,96,7168,18432,ck,18,0,61.6242,a8w8_blockscale_1x128x128_256x64x64x256_16x16_32x32_1x1_16x16x1_16x16x1_1x32x1x8_8_1x1_intrawave_v1,411.64,2195.02,0.0
256,96,8192,512,ck,13,0,5.3545,a8w8_blockscale_1x128x128_256x32x64x256_16x16_16x16_2x1_16x16x1_16x16x1_1x32x1x8_8_2x1_intrawave_v1,150.4,1086.25,0.0
256,96,8192,1536,ck,18,0,8.203,a8w8_blockscale_1x128x128_256x64x64x256_16x16_32x32_1x1_16x16x1_16x16x1_1x32x1x8_8_1x1_intrawave_v1,294.52,1743.66,0.0
256,96,9216,7168,ck,12,0,28.2134,a8w8_blockscale_1x128x128_256x32x128x256_16x16_32x32_1x1_16x16x1_16x16x1_1x32x1x8_8_1x1_intrawave_v1,449.56,2428.56,0.0
256,96,11264,1536,ck,18,0,11.0633,a8w8_blockscale_1x128x128_256x64x64x256_16x16_32x32_1x1_16x16x1_16x16x1_1x32x1x8_8_1x1_intrawave_v1,300.26,1772.68,0.0
256,96,12288,1536,ck,18,0,11.286,a8w8_blockscale_1x128x128_256x64x64x256_16x16_32x32_1x1_16x16x1_16x16x1_1x32x1x8_8_1x1_intrawave_v1,321.1,1894.48,0.0
256,96,14336,1536,ck,18,0,11.6314,a8w8_blockscale_1x128x128_256x64x64x256_16x16_32x32_1x1_16x16x1_16x16x1_1x32x1x8_8_1x1_intrawave_v1,363.49,2142.48,0.0
256,96,16384,512,ck,13,0,6.1392,a8w8_blockscale_1x128x128_256x32x64x256_16x16_16x16_2x1_16x16x1_16x16x1_1x32x1x8_8_2x1_intrawave_v1,262.35,1886.81,0.0
256,96,20480,1536,ck,12,0,14.4047,a8w8_blockscale_1x128x128_256x32x128x256_16x16_32x32_1x1_16x16x1_16x16x1_1x32x1x8_8_1x1_intrawave_v1,419.29,2467.03,0.0
256,96,24576,1536,ck,18,0,16.4815,a8w8_blockscale_1x128x128_256x64x64x256_16x16_32x32_1x1_16x16x1_16x16x1_1x32x1x8_8_1x1_intrawave_v1,439.75,2585.61,0.0
256,96,32768,512,ck,13,0,9.4586,a8w8_blockscale_1x128x128_256x32x64x256_16x16_16x16_2x1_16x16x1_16x16x1_1x32x1x8_8_2x1_intrawave_v1,340.56,2444.11,0.0
256,96,32768,1536,ck,0,0,19.4557,a8w8_blockscale_1x128x128_256x128x128x128_16x16_32x32_2x2_8x32x1_8x32x1_1x32x1x8_8_1x1_intrawave_v3,496.7,2917.94,0.0
256,96,36864,7168,ck,12,0,95.4929,a8w8_blockscale_1x128x128_256x32x128x256_16x16_32x32_1x1_16x16x1_16x16x1_1x32x1x8_8_1x1_intrawave_v1,531.29,2848.45,0.0
256,128,64,7168,ck,8,0,14.4734,a8w8_blockscale_1x128x128_256x16x64x256_16x16_16x16_1x1_16x16x1_16x16x1_1x16x1x16_4_1x1_intrawave_v1,8.11,96.22,0.0
256,128,128,7168,ck,8,0,14.3264,a8w8_blockscale_1x128x128_256x16x64x256_16x16_16x16_1x1_16x16x1_16x16x1_1x16x1x16_4_1x1_intrawave_v1,16.39,130.37,0.0
256,128,512,7168,ck,8,0,19.8912,a8w8_blockscale_1x128x128_256x16x64x256_16x16_16x16_1x1_16x16x1_16x16x1_1x16x1x16_4_1x1_intrawave_v1,47.23,237.22,0.0
256,128,576,7168,ck,8,0,20.1014,a8w8_blockscale_1x128x128_256x16x64x256_16x16_16x16_1x1_16x16x1_16x16x1_1x16x1x16_4_1x1_intrawave_v1,52.58,258.38,0.0
256,128,1024,7168,ck,8,0,20.4235,a8w8_blockscale_1x128x128_256x16x64x256_16x16_16x16_1x1_16x16x1_16x16x1_1x16x1x16_4_1x1_intrawave_v1,92.0,417.15,0.0
256,128,1536,7168,ck,8,0,19.9837,a8w8_blockscale_1x128x128_256x16x64x256_16x16_16x16_1x1_16x16x1_16x16x1_1x16x1x16_4_1x1_intrawave_v1,141.04,616.54,0.0
256,128,2112,7168,ck,8,0,21.1709,a8w8_blockscale_1x128x128_256x16x64x256_16x16_16x16_1x1_16x16x1_16x16x1_1x16x1x16_4_1x1_intrawave_v1,183.06,783.95,0.0
256,128,2240,7168,ck,18,0,23.1376,a8w8_blockscale_1x128x128_256x64x64x256_16x16_32x32_1x1_16x16x1_16x16x1_1x32x1x8_8_1x1_intrawave_v1,177.65,758.39,0.0
256,128,3072,1536,ck,7,0,7.2074,a8w8_blockscale_1x128x128_256x16x128x256_16x16_16x16_1x2_16x16x1_16x16x1_1x16x1x16_8_1x2_intrawave_v1,167.6,791.08,0.0
256,128,4096,512,ck,13,0,4.3212,a8w8_blockscale_1x128x128_256x32x64x256_16x16_16x16_2x1_16x16x1_16x16x1_1x32x1x8_8_2x1_intrawave_v1,124.24,743.14,0.0
256,128,4096,7168,ck,7,0,23.6181,a8w8_blockscale_1x128x128_256x16x128x256_16x16_16x16_1x2_16x16x1_16x16x1_1x16x1x16_8_1x2_intrawave_v1,318.24,1326.36,0.0
256,128,4608,7168,ck,18,0,23.9089,a8w8_blockscale_1x128x128_256x64x64x256_16x16_32x32_1x1_16x16x1_16x16x1_1x32x1x8_8_1x1_intrawave_v1,353.66,1469.21,0.0
256,128,7168,256,ck,18,0,4.5079,a8w8_blockscale_1x128x128_256x64x64x256_16x16_32x32_1x1_16x16x1_16x16x1_1x32x1x8_8_1x1_intrawave_v1,104.21,821.4,0.0
256,128,7168,512,ck,13,0,5.3366,a8w8_blockscale_1x128x128_256x32x64x256_16x16_16x16_2x1_16x16x1_16x16x1_1x32x1x8_8_2x1_intrawave_v1,176.05,1043.84,0.0
256,128,7168,2048,ck,18,0,9.4978,a8w8_blockscale_1x128x128_256x64x64x256_16x16_32x32_1x1_16x16x1_16x16x1_1x32x1x8_8_1x1_intrawave_v1,395.68,1766.43,0.0
256,128,7168,2304,ck,18,0,10.3456,a8w8_blockscale_1x128x128_256x64x64x256_16x16_32x32_1x1_16x16x1_16x16x1_1x32x1x8_8_1x1_intrawave_v1,408.66,1802.21,0.0
256,128,7168,4096,ck,18,0,16.0184,a8w8_blockscale_1x128x128_256x64x64x256_16x16_32x32_1x1_16x16x1_16x16x1_1x32x1x8_8_1x1_intrawave_v1,469.22,1980.19,0.0
256,128,7168,4608,ck,18,0,17.0629,a8w8_blockscale_1x128x128_256x64x64x256_16x16_32x32_1x1_16x16x1_16x16x1_1x32x1x8_8_1x1_intrawave_v1,495.56,2077.9,0.0
256,128,7168,16384,ck,18,0,56.7734,a8w8_blockscale_1x128x128_256x64x64x256_16x16_32x32_1x1_16x16x1_16x16x1_1x32x1x8_8_1x1_intrawave_v1,529.56,2137.84,0.0
256,128,7168,18432,ck,18,0,62.4818,a8w8_blockscale_1x128x128_256x64x64x256_16x16_32x32_1x1_16x16x1_16x16x1_1x32x1x8_8_1x1_intrawave_v1,541.32,2181.67,0.0
256,128,8192,512,ck,13,0,5.3945,a8w8_blockscale_1x128x128_256x32x64x256_16x16_16x16_2x1_16x16x1_16x16x1_1x32x1x8_8_2x1_intrawave_v1,199.04,1178.42,0.0
256,128,8192,1536,ck,18,0,8.2154,a8w8_blockscale_1x128x128_256x64x64x256_16x16_32x32_1x1_16x16x1_16x16x1_1x32x1x8_8_1x1_intrawave_v1,392.1,1810.83,0.0
256,128,9216,7168,ck,18,0,40.6919,a8w8_blockscale_1x128x128_256x64x64x256_16x16_32x32_1x1_16x16x1_16x16x1_1x32x1x8_8_1x1_intrawave_v1,415.6,1703.95,0.0
256,128,11264,1536,ck,18,0,11.7531,a8w8_blockscale_1x128x128_256x64x64x256_16x16_32x32_1x1_16x16x1_16x16x1_1x32x1x8_8_1x1_intrawave_v1,376.85,1734.15,0.0
256,128,12288,1536,ck,18,0,12.0014,a8w8_blockscale_1x128x128_256x64x64x256_16x16_32x32_1x1_16x16x1_16x16x1_1x32x1x8_8_1x1_intrawave_v1,402.61,1851.18,0.0
256,128,14336,1536,ck,18,0,12.3486,a8w8_blockscale_1x128x128_256x64x64x256_16x16_32x32_1x1_16x16x1_16x16x1_1x32x1x8_8_1x1_intrawave_v1,456.5,2096.33,0.0
256,128,16384,512,ck,9,0,8.0448,a8w8_blockscale_1x128x128_256x32x256x128_16x16_32x32_1x2_8x32x1_8x32x1_1x32x1x8_8_1x1_intrawave_v1,266.94,1572.25,0.0
256,128,20480,1536,ck,18,0,16.796,a8w8_blockscale_1x128x128_256x64x64x256_16x16_32x32_1x1_16x16x1_16x16x1_1x32x1x8_8_1x1_intrawave_v1,479.46,2196.76,0.0
256,128,24576,1536,ck,18,0,17.3757,a8w8_blockscale_1x128x128_256x64x64x256_16x16_32x32_1x1_16x16x1_16x16x1_1x32x1x8_8_1x1_intrawave_v1,556.16,2545.9,0.0
256,128,32768,512,ck,2,0,10.8423,a8w8_blockscale_1x128x128_256x64x128x128_16x16_32x32_1x2_8x32x1_8x32x1_1x32x1x8_8_1x1_intrawave_v3,396.13,2327.12,0.0
256,128,32768,1536,ck,0,0,19.2926,a8w8_blockscale_1x128x128_256x128x128x128_16x16_32x32_2x2_8x32x1_8x32x1_1x32x1x8_8_1x1_intrawave_v3,667.87,3053.86,0.0
256,128,36864,7168,ck,18,0,105.9408,a8w8_blockscale_1x128x128_256x64x64x256_16x16_32x32_1x1_16x16x1_16x16x1_1x32x1x8_8_1x1_intrawave_v1,638.52,2591.97,0.0
256,160,128,7168,ck,8,0,17.1227,a8w8_blockscale_1x128x128_256x16x64x256_16x16_16x16_1x1_16x16x1_16x16x1_1x16x1x16_4_1x1_intrawave_v1,17.15,122.96,0.0
256,160,512,7168,ck,8,0,20.0008,a8w8_blockscale_1x128x128_256x16x64x256_16x16_16x16_1x1_16x16x1_16x16x1_1x16x1x16_4_1x1_intrawave_v1,58.72,249.03,0.0
256,160,1024,7168,ck,8,0,20.4675,a8w8_blockscale_1x128x128_256x16x64x256_16x16_16x16_1x1_16x16x1_16x16x1_1x16x1x16_4_1x1_intrawave_v1,114.76,430.66,0.0
256,160,2112,7168,ck,8,0,23.2184,a8w8_blockscale_1x128x128_256x16x64x256_16x16_16x16_1x1_16x16x1_16x16x1_1x16x1x16_4_1x1_intrawave_v1,208.65,730.52,0.0
256,160,2240,7168,ck,18,0,23.4811,a8w8_blockscale_1x128x128_256x64x64x256_16x16_32x32_1x1_16x16x1_16x16x1_1x32x1x8_8_1x1_intrawave_v1,218.82,763.17,0.0
256,160,3072,1536,ck,7,0,7.4447,a8w8_blockscale_1x128x128_256x16x128x256_16x16_16x16_1x2_16x16x1_16x16x1_1x16x1x16_8_1x2_intrawave_v1,202.82,798.88,0.0
256,160,4096,512,ck,13,0,5.1861,a8w8_blockscale_1x128x128_256x32x64x256_16x16_16x16_2x1_16x16x1_16x16x1_1x32x1x8_8_2x1_intrawave_v1,129.4,672.91,0.0
256,160,4096,7168,ck,18,0,24.2819,a8w8_blockscale_1x128x128_256x64x64x256_16x16_32x32_1x1_16x16x1_16x16x1_1x32x1x8_8_1x1_intrawave_v1,386.92,1310.35,0.0
256,160,4608,7168,ck,18,0,25.144,a8w8_blockscale_1x128x128_256x64x64x256_16x16_32x32_1x1_16x16x1_16x16x1_1x32x1x8_8_1x1_intrawave_v1,420.36,1417.9,0.0
256,160,7168,256,ck,13,0,5.0474,a8w8_blockscale_1x128x128_256x32x64x256_16x16_16x16_2x1_16x16x1_16x16x1_1x32x1x8_8_2x1_intrawave_v1,116.34,826.11,0.0
256,160,7168,512,ck,13,0,5.7215,a8w8_blockscale_1x128x128_256x32x64x256_16x16_16x16_2x1_16x16x1_16x16x1_1x32x1x8_8_2x1_intrawave_v1,205.26,1056.66,0.0
256,160,7168,2048,ck,18,0,12.9511,a8w8_blockscale_1x128x128_256x64x64x256_16x16_32x32_1x1_16x16x1_16x16x1_1x32x1x8_8_1x1_intrawave_v1,362.72,1335.91,0.0
256,160,7168,2304,ck,18,0,14.0589,a8w8_blockscale_1x128x128_256x64x64x256_16x16_32x32_1x1_16x16x1_16x16x1_1x32x1x8_8_1x1_intrawave_v1,375.91,1364.08,0.0
256,160,7168,4096,ck,18,0,22.8022,a8w8_blockscale_1x128x128_256x64x64x256_16x16_32x32_1x1_16x16x1_16x16x1_1x32x1x8_8_1x1_intrawave_v1,412.03,1416.94,0.0
256,160,7168,4608,ck,18,0,25.9107,a8w8_blockscale_1x128x128_256x64x64x256_16x16_32x32_1x1_16x16x1_16x16x1_1x32x1x8_8_1x1_intrawave_v1,407.93,1391.75,0.0
256,160,7168,16384,ck,18,0,80.0493,a8w8_blockscale_1x128x128_256x64x64x256_16x16_32x32_1x1_16x16x1_16x16x1_1x32x1x8_8_1x1_intrawave_v1,469.47,1528.5,0.0
256,160,7168,18432,ck,18,0,89.0583,a8w8_blockscale_1x128x128_256x64x64x256_16x16_32x32_1x1_16x16x1_16x16x1_1x32x1x8_8_1x1_intrawave_v1,474.73,1542.4,0.0
256,160,8192,512,ck,13,0,6.3784,a8w8_blockscale_1x128x128_256x32x64x256_16x16_16x16_2x1_16x16x1_16x16x1_1x32x1x8_8_2x1_intrawave_v1,210.43,1081.41,0.0
256,160,8192,1536,ck,18,0,11.0356,a8w8_blockscale_1x128x128_256x64x64x256_16x16_32x32_1x1_16x16x1_16x16x1_1x32x1x8_8_1x1_intrawave_v1,364.87,1400.02,0.0
256,160,9216,7168,ck,18,0,42.7828,a8w8_blockscale_1x128x128_256x64x64x256_16x16_32x32_1x1_16x16x1_16x16x1_1x32x1x8_8_1x1_intrawave_v1,494.11,1639.82,0.0
256,160,11264,1536,ck,12,0,14.0267,a8w8_blockscale_1x128x128_256x32x128x256_16x16_32x32_1x1_16x16x1_16x16x1_1x32x1x8_8_1x1_intrawave_v1,394.71,1507.96,0.0
256,160,12288,1536,ck,12,0,14.4605,a8w8_blockscale_1x128x128_256x32x128x256_16x16_32x32_1x1_16x16x1_16x16x1_1x32x1x8_8_1x1_intrawave_v1,417.68,1594.16,0.0
256,160,14336,1536,ck,18,0,15.5241,a8w8_blockscale_1x128x128_256x64x64x256_16x16_32x32_1x1_16x16x1_16x16x1_1x32x1x8_8_1x1_intrawave_v1,453.9,1729.79,0.0
256,160,16384,512,ck,13,0,8.5655,a8w8_blockscale_1x128x128_256x32x64x256_16x16_16x16_2x1_16x16x1_16x16x1_1x32x1x8_8_2x1_intrawave_v1,313.39,1601.0,0.0
256,160,20480,1536,ck,2,0,18.3532,a8w8_blockscale_1x128x128_256x64x128x128_16x16_32x32_1x2_8x32x1_8x32x1_1x32x1x8_8_1x1_intrawave_v3,548.48,2084.47,0.0
256,160,24576,1536,ck,18,0,23.7575,a8w8_blockscale_1x128x128_256x64x64x256_16x16_32x32_1x1_16x16x1_16x16x1_1x32x1x8_8_1x1_intrawave_v1,508.45,1930.29,0.0
256,160,32768,512,ck,18,0,13.356,a8w8_blockscale_1x128x128_256x64x64x256_16x16_32x32_1x1_16x16x1_16x16x1_1x32x1x8_8_1x1_intrawave_v1,401.97,2047.39,0.0
256,160,32768,1536,ck,2,0,27.1819,a8w8_blockscale_1x128x128_256x64x128x128_16x16_32x32_1x2_8x32x1_8x32x1_1x32x1x8_8_1x1_intrawave_v3,592.53,2246.46,0.0
256,160,36864,7168,ck,14,0,124.1542,a8w8_blockscale_1x128x128_256x64x256x128_16x16_32x32_2x2_8x32x1_8x32x1_1x32x1x8_8_1x1_intrawave_v1,681.07,2232.58,0.0
256,192,128,7168,ck,8,0,16.9935,a8w8_blockscale_1x128x128_256x16x64x256_16x16_16x16_1x1_16x16x1_16x16x1_1x16x1x16_4_1x1_intrawave_v1,20.73,137.87,0.0
256,192,512,7168,ck,8,0,19.9037,a8w8_blockscale_1x128x128_256x16x64x256_16x16_16x16_1x1_16x16x1_16x16x1_1x16x1x16_4_1x1_intrawave_v1,70.81,263.41,0.0
256,192,1024,7168,ck,8,0,20.4827,a8w8_blockscale_1x128x128_256x16x64x256_16x16_16x16_1x1_16x16x1_16x16x1_1x16x1x16_4_1x1_intrawave_v1,137.61,444.74,0.0
256,192,2112,7168,ck,18,0,22.9699,a8w8_blockscale_1x128x128_256x64x64x256_16x16_32x32_1x1_16x16x1_16x16x1_1x32x1x8_8_1x1_intrawave_v1,253.08,754.29,0.0
256,192,2240,7168,ck,18,0,23.148,a8w8_blockscale_1x128x128_256x64x64x256_16x16_32x32_1x1_16x16x1_16x16x1_1x32x1x8_8_1x1_intrawave_v1,266.36,790.25,0.0
256,192,3072,1536,ck,18,0,8.4458,a8w8_blockscale_1x128x128_256x64x64x256_16x16_32x32_1x1_16x16x1_16x16x1_1x32x1x8_8_1x1_intrawave_v1,214.54,733.28,0.0
256,192,4096,512,ck,13,0,5.1841,a8w8_blockscale_1x128x128_256x32x64x256_16x16_16x16_2x1_16x16x1_16x16x1_1x32x1x8_8_2x1_intrawave_v1,155.34,726.9,0.0
256,192,4096,7168,ck,18,0,23.8819,a8w8_blockscale_1x128x128_256x64x64x256_16x16_32x32_1x1_16x16x1_16x16x1_1x32x1x8_8_1x1_intrawave_v1,472.09,1352.88,0.0
256,192,4608,7168,ck,18,0,24.2883,a8w8_blockscale_1x128x128_256x64x64x256_16x16_32x32_1x1_16x16x1_16x16x1_1x32x1x8_8_1x1_intrawave_v1,522.21,1489.44,0.0
256,192,7168,256,ck,13,0,5.1944,a8w8_blockscale_1x128x128_256x32x64x256_16x16_16x16_2x1_16x16x1_16x16x1_1x32x1x8_8_2x1_intrawave_v1,135.65,892.63,0.0
256,192,7168,512,ck,13,0,6.009,a8w8_blockscale_1x128x128_256x32x64x256_16x16_16x16_2x1_16x16x1_16x16x1_1x32x1x8_8_2x1_intrawave_v1,234.53,1085.18,0.0
256,192,7168,2048,ck,18,0,13.2851,a8w8_blockscale_1x128x128_256x64x64x256_16x16_32x32_1x1_16x16x1_16x16x1_1x32x1x8_8_1x1_intrawave_v1,424.32,1341.79,0.0
256,192,7168,2304,ck,18,0,14.6467,a8w8_blockscale_1x128x128_256x64x64x256_16x16_32x32_1x1_16x16x1_16x16x1_1x32x1x8_8_1x1_intrawave_v1,432.98,1345.69,0.0
256,192,7168,4096,ck,18,0,24.2362,a8w8_blockscale_1x128x128_256x64x64x256_16x16_32x32_1x1_16x16x1_16x16x1_1x32x1x8_8_1x1_intrawave_v1,465.18,1357.44,0.0
256,192,7168,4608,ck,18,0,25.7255,a8w8_blockscale_1x128x128_256x64x64x256_16x16_32x32_1x1_16x16x1_16x16x1_1x32x1x8_8_1x1_intrawave_v1,493.04,1425.33,0.0
256,192,7168,16384,ck,18,0,84.2651,a8w8_blockscale_1x128x128_256x64x64x256_16x16_32x32_1x1_16x16x1_16x16x1_1x32x1x8_8_1x1_intrawave_v1,535.18,1463.7,0.0
256,192,7168,18432,ck,18,0,93.2472,a8w8_blockscale_1x128x128_256x64x64x256_16x16_32x32_1x1_16x16x1_16x16x1_1x32x1x8_8_1x1_intrawave_v1,544.08,1484.36,0.0
256,192,8192,512,ck,13,0,6.479,a8w8_blockscale_1x128x128_256x32x64x256_16x16_16x16_2x1_16x16x1_16x16x1_1x32x1x8_8_2x1_intrawave_v1,248.59,1148.07,0.0
256,192,8192,1536,ck,18,0,11.4405,a8w8_blockscale_1x128x128_256x64x64x256_16x16_32x32_1x1_16x16x1_16x16x1_1x32x1x8_8_1x1_intrawave_v1,422.35,1400.6,0.0
256,192,9216,7168,ck,18,0,43.0984,a8w8_blockscale_1x128x128_256x64x64x256_16x16_32x32_1x1_16x16x1_16x16x1_1x32x1x8_8_1x1_intrawave_v1,588.59,1646.82,0.0
256,192,11264,1536,ck,18,0,14.8667,a8w8_blockscale_1x128x128_256x64x64x256_16x16_32x32_1x1_16x16x1_16x16x1_1x32x1x8_8_1x1_intrawave_v1,446.89,1474.56,0.0
256,192,12288,1536,ck,18,0,15.56,a8w8_blockscale_1x128x128_256x64x64x256_16x16_32x32_1x1_16x16x1_16x16x1_1x32x1x8_8_1x1_intrawave_v1,465.79,1535.21,0.0
256,192,14336,1536,ck,18,0,16.0769,a8w8_blockscale_1x128x128_256x64x64x256_16x16_32x32_1x1_16x16x1_16x16x1_1x32x1x8_8_1x1_intrawave_v1,525.95,1730.44,0.0
256,192,16384,512,ck,18,0,8.9495,a8w8_blockscale_1x128x128_256x64x64x256_16x16_32x32_1x1_16x16x1_16x16x1_1x32x1x8_8_1x1_intrawave_v1,359.93,1651.31,0.0
256,192,20480,1536,ck,2,0,19.8064,a8w8_blockscale_1x128x128_256x64x128x128_16x16_32x32_1x2_8x32x1_8x32x1_1x32x1x8_8_1x1_intrawave_v3,609.88,2000.19,0.0
256,192,24576,1536,ck,18,0,25.1336,a8w8_blockscale_1x128x128_256x64x64x256_16x16_32x32_1x1_16x16x1_16x16x1_1x32x1x8_8_1x1_intrawave_v1,576.74,1889.14,0.0
256,192,32768,512,ck,17,0,14.141,a8w8_blockscale_1x128x128_256x64x128x256_16x16_32x32_2x1_16x16x1_16x16x1_1x32x1x8_8_1x1_intrawave_v1,455.59,2083.19,0.0
256,192,32768,1536,ck,2,0,28.3939,a8w8_blockscale_1x128x128_256x64x128x128_16x16_32x32_1x2_8x32x1_8x32x1_1x32x1x8_8_1x1_intrawave_v3,680.69,2226.16,0.0
256,192,36864,7168,ck,14,0,126.8721,a8w8_blockscale_1x128x128_256x64x256x128_16x16_32x32_2x2_8x32x1_8x32x1_1x32x1x8_8_1x1_intrawave_v1,799.77,2205.16,0.0
256,224,128,7168,ck,8,0,17.8184,a8w8_blockscale_1x128x128_256x16x64x256_16x16_16x16_1x1_16x16x1_16x16x1_1x16x1x16_4_1x1_intrawave_v1,23.07,144.82,0.0
256,224,512,7168,ck,8,0,20.3114,a8w8_blockscale_1x128x128_256x16x64x256_16x16_16x16_1x1_16x16x1_16x16x1_1x16x1x16_4_1x1_intrawave_v1,80.95,271.03,0.0
256,224,1024,7168,ck,8,0,20.7811,a8w8_blockscale_1x128x128_256x16x64x256_16x16_16x16_1x1_16x16x1_16x16x1_1x16x1x16_4_1x1_intrawave_v1,158.24,452.55,0.0
256,224,2112,7168,ck,18,0,23.6685,a8w8_blockscale_1x128x128_256x64x64x256_16x16_32x32_1x1_16x16x1_16x16x1_1x32x1x8_8_1x1_intrawave_v1,286.55,747.43,0.0
256,224,2240,7168,ck,18,0,23.7107,a8w8_blockscale_1x128x128_256x64x64x256_16x16_32x32_1x1_16x16x1_16x16x1_1x32x1x8_8_1x1_intrawave_v1,303.37,787.22,0.0
256,224,3072,1536,ck,18,0,8.2059,a8w8_blockscale_1x128x128_256x64x64x256_16x16_32x32_1x1_16x16x1_16x16x1_1x32x1x8_8_1x1_intrawave_v1,257.61,784.67,0.0
256,224,4096,512,ck,13,0,5.3431,a8w8_blockscale_1x128x128_256x32x64x256_16x16_16x16_2x1_16x16x1_16x16x1_1x32x1x8_8_2x1_intrawave_v1,175.84,757.4,0.0
256,224,4096,7168,ck,18,0,25.5505,a8w8_blockscale_1x128x128_256x64x64x256_16x16_32x32_1x1_16x16x1_16x16x1_1x32x1x8_8_1x1_intrawave_v1,514.8,1283.76,0.0
256,224,4608,7168,ck,12,0,26.9231,a8w8_blockscale_1x128x128_256x32x128x256_16x16_32x32_1x1_16x16x1_16x16x1_1x32x1x8_8_1x1_intrawave_v1,549.62,1363.15,0.0
256,224,7168,256,ck,18,0,5.6461,a8w8_blockscale_1x128x128_256x64x64x256_16x16_32x32_1x1_16x16x1_16x16x1_1x32x1x8_8_1x1_intrawave_v1,145.6,903.92,0.0
256,224,7168,512,ck,18,0,6.4236,a8w8_blockscale_1x128x128_256x64x64x256_16x16_32x32_1x1_16x16x1_16x16x1_1x32x1x8_8_1x1_intrawave_v1,255.96,1089.1,0.0
256,224,7168,2048,ck,18,0,13.3235,a8w8_blockscale_1x128x128_256x64x64x256_16x16_32x32_1x1_16x16x1_16x16x1_1x32x1x8_8_1x1_intrawave_v1,493.61,1377.27,0.0
256,224,7168,2304,ck,18,0,14.4191,a8w8_blockscale_1x128x128_256x64x64x256_16x16_32x32_1x1_16x16x1_16x16x1_1x32x1x8_8_1x1_intrawave_v1,513.12,1403.86,0.0
256,224,7168,4096,ck,18,0,23.8325,a8w8_blockscale_1x128x128_256x64x64x256_16x16_32x32_1x1_16x16x1_16x16x1_1x32x1x8_8_1x1_intrawave_v1,551.91,1405.18,0.0
256,224,7168,4608,ck,18,0,27.3172,a8w8_blockscale_1x128x128_256x64x64x256_16x16_32x32_1x1_16x16x1_16x16x1_1x32x1x8_8_1x1_intrawave_v1,541.69,1364.47,0.0
256,224,7168,16384,ck,18,0,87.6811,a8w8_blockscale_1x128x128_256x64x64x256_16x16_32x32_1x1_16x16x1_16x16x1_1x32x1x8_8_1x1_intrawave_v1,600.05,1417.89,0.0
256,224,7168,18432,ck,18,0,99.6528,a8w8_blockscale_1x128x128_256x64x64x256_16x16_32x32_1x1_16x16x1_16x16x1_1x32x1x8_8_1x1_intrawave_v1,593.96,1399.47,0.0
256,224,8192,512,ck,17,0,6.4757,a8w8_blockscale_1x128x128_256x64x128x256_16x16_32x32_2x1_16x16x1_16x16x1_1x32x1x8_8_1x1_intrawave_v1,290.17,1232.15,0.0
256,224,8192,1536,ck,18,0,11.52,a8w8_blockscale_1x128x128_256x64x64x256_16x16_32x32_1x1_16x16x1_16x16x1_1x32x1x8_8_1x1_intrawave_v1,489.34,1440.71,0.0
256,224,9216,7168,ck,12,0,52.8597,a8w8_blockscale_1x128x128_256x32x128x256_16x16_32x32_1x1_16x16x1_16x16x1_1x32x1x8_8_1x1_intrawave_v1,559.88,1358.21,0.0
256,224,11264,1536,ck,18,0,15.2931,a8w8_blockscale_1x128x128_256x64x64x256_16x16_32x32_1x1_16x16x1_16x16x1_1x32x1x8_8_1x1_intrawave_v1,506.83,1483.8,0.0
256,224,12288,1536,ck,18,0,16.4055,a8w8_blockscale_1x128x128_256x64x64x256_16x16_32x32_1x1_16x16x1_16x16x1_1x32x1x8_8_1x1_intrawave_v1,515.42,1507.02,0.0
256,224,14336,1536,ck,0,0,17.5524,a8w8_blockscale_1x128x128_256x128x128x128_16x16_32x32_2x2_8x32x1_8x32x1_1x32x1x8_8_1x1_intrawave_v3,562.03,1640.04,0.0
256,224,16384,512,ck,18,0,10.2555,a8w8_blockscale_1x128x128_256x64x64x256_16x16_32x32_1x1_16x16x1_16x16x1_1x32x1x8_8_1x1_intrawave_v1,366.45,1544.86,0.0
256,224,20480,1536,ck,18,0,24.9844,a8w8_blockscale_1x128x128_256x64x64x256_16x16_32x32_1x1_16x16x1_16x16x1_1x32x1x8_8_1x1_intrawave_v1,564.07,1640.08,0.0
256,224,24576,1536,ck,2,0,26.2172,a8w8_blockscale_1x128x128_256x64x128x128_16x16_32x32_1x2_8x32x1_8x32x1_1x32x1x8_8_1x1_intrawave_v3,645.05,1872.92,0.0
256,224,32768,512,ck,0,0,16.1208,a8w8_blockscale_1x128x128_256x128x128x128_16x16_32x32_2x2_8x32x1_8x32x1_1x32x1x8_8_1x1_intrawave_v3,466.24,1958.46,0.0
256,224,32768,1536,ck,0,0,29.6624,a8w8_blockscale_1x128x128_256x128x128x128_16x16_32x32_2x2_8x32x1_8x32x1_1x32x1x8_8_1x1_intrawave_v3,760.17,2203.32,0.0
256,224,36864,7168,ck,0,0,153.8167,a8w8_blockscale_1x128x128_256x128x128x128_16x16_32x32_2x2_8x32x1_8x32x1_1x32x1x8_8_1x1_intrawave_v3,769.62,1835.7,0.0
256,256,64,7168,ck,8,0,16.0919,a8w8_blockscale_1x128x128_256x16x64x256_16x16_16x16_1x1_16x16x1_16x16x1_1x16x1x16_4_1x1_intrawave_v1,14.6,144.58,0.0
256,256,128,7168,ck,8,0,18.917,a8w8_blockscale_1x128x128_256x16x64x256_16x16_16x16_1x1_16x16x1_16x16x1_1x16x1x16_4_1x1_intrawave_v1,24.83,148.97,0.0
256,256,512,7168,ck,8,0,20.1783,a8w8_blockscale_1x128x128_256x16x64x256_16x16_16x16_1x1_16x16x1_16x16x1_1x16x1x16_4_1x1_intrawave_v1,93.12,285.81,0.0
256,256,576,7168,ck,8,0,20.4521,a8w8_blockscale_1x128x128_256x16x64x256_16x16_16x16_1x1_16x16x1_16x16x1_1x16x1x16_4_1x1_intrawave_v1,103.36,306.02,0.0
256,256,1024,7168,ck,8,0,20.8683,a8w8_blockscale_1x128x128_256x16x64x256_16x16_16x16_1x1_16x16x1_16x16x1_1x16x1x16_4_1x1_intrawave_v1,180.09,464.79,0.0
256,256,1536,7168,ck,7,0,22.5366,a8w8_blockscale_1x128x128_256x16x128x256_16x16_16x16_1x2_16x16x1_16x16x1_1x16x1x16_8_1x2_intrawave_v1,250.13,604.86,0.0
256,256,2112,7168,ck,18,0,23.0603,a8w8_blockscale_1x128x128_256x64x64x256_16x16_32x32_1x1_16x16x1_16x16x1_1x32x1x8_8_1x1_intrawave_v1,336.12,782.95,0.0
256,256,2240,7168,ck,18,0,23.1962,a8w8_blockscale_1x128x128_256x64x64x256_16x16_32x32_1x1_16x16x1_16x16x1_1x32x1x8_8_1x1_intrawave_v1,354.4,820.75,0.0
256,256,3072,1536,ck,18,0,8.6547,a8w8_blockscale_1x128x128_256x64x64x256_16x16_32x32_1x1_16x16x1_16x16x1_1x32x1x8_8_1x1_intrawave_v1,279.15,772.37,0.0
256,256,4096,512,ck,13,0,5.143,a8w8_blockscale_1x128x128_256x32x64x256_16x16_16x16_2x1_16x16x1_16x16x1_1x32x1x8_8_2x1_intrawave_v1,208.78,841.02,0.0
256,256,4096,7168,ck,18,0,24.9567,a8w8_blockscale_1x128x128_256x64x64x256_16x16_32x32_1x1_16x16x1_16x16x1_1x32x1x8_8_1x1_intrawave_v1,602.34,1334.0,0.0
256,256,4608,7168,ck,18,0,36.0444,a8w8_blockscale_1x128x128_256x64x64x256_16x16_32x32_1x1_16x16x1_16x16x1_1x32x1x8_8_1x1_intrawave_v1,469.18,1032.74,0.0
256,256,7168,256,cktile,6,0,5.3481,a8w8_blockscale_cktile_32x128x128_1x4x1_16x16x64_intrawave_0x1x0_1,175.67,1041.6,0.0
256,256,7168,512,ck,18,0,6.913,a8w8_blockscale_1x128x128_256x64x64x256_16x16_32x32_1x1_16x16x1_16x16x1_1x32x1x8_8_1x1_intrawave_v1,271.81,1080.73,0.0
256,256,7168,2048,ck,18,0,13.6951,a8w8_blockscale_1x128x128_256x64x64x256_16x16_32x32_1x1_16x16x1_16x16x1_1x32x1x8_8_1x1_intrawave_v1,548.82,1378.18,0.0
256,256,7168,2304,ck,18,0,15.2977,a8w8_blockscale_1x128x128_256x64x64x256_16x16_32x32_1x1_16x16x1_16x16x1_1x32x1x8_8_1x1_intrawave_v1,552.74,1358.04,0.0
256,256,7168,4096,ck,18,0,25.2675,a8w8_blockscale_1x128x128_256x64x64x256_16x16_32x32_1x1_16x16x1_16x16x1_1x32x1x8_8_1x1_intrawave_v1,594.93,1348.72,0.0
256,256,7168,4608,ck,18,0,27.5468,a8w8_blockscale_1x128x128_256x64x64x256_16x16_32x32_1x1_16x16x1_16x16x1_1x32x1x8_8_1x1_intrawave_v1,613.92,1375.11,0.0
256,256,7168,16384,ck,18,0,89.7873,a8w8_blockscale_1x128x128_256x64x64x256_16x16_32x32_1x1_16x16x1_16x16x1_1x32x1x8_8_1x1_intrawave_v1,669.69,1395.57,0.0
256,256,7168,18432,ck,18,0,99.4348,a8w8_blockscale_1x128x128_256x64x64x256_16x16_32x32_1x1_16x16x1_16x16x1_1x32x1x8_8_1x1_intrawave_v1,680.3,1413.08,0.0
256,256,8192,512,ck,18,0,7.299,a8w8_blockscale_1x128x128_256x64x64x256_16x16_32x32_1x1_16x16x1_16x16x1_1x32x1x8_8_1x1_intrawave_v1,294.22,1167.24,0.0
256,256,8192,1536,ck,18,0,11.8143,a8w8_blockscale_1x128x128_256x64x64x256_16x16_32x32_1x1_16x16x1_16x16x1_1x32x1x8_8_1x1_intrawave_v1,545.31,1453.36,0.0
256,256,9216,7168,ck,0,0,56.4314,a8w8_blockscale_1x128x128_256x128x128x128_16x16_32x32_2x2_8x32x1_8x32x1_1x32x1x8_8_1x1_intrawave_v3,599.36,1286.76,0.0
256,256,11264,1536,ck,18,0,15.893,a8w8_blockscale_1x128x128_256x64x64x256_16x16_32x32_1x1_16x16x1_16x16x1_1x32x1x8_8_1x1_intrawave_v1,557.38,1476.24,0.0
256,256,12288,1536,ck,0,0,16.6451,a8w8_blockscale_1x128x128_256x128x128x128_16x16_32x32_2x2_8x32x1_8x32x1_1x32x1x8_8_1x1_intrawave_v3,580.57,1535.53,0.0
256,256,14336,1536,ck,0,0,17.292,a8w8_blockscale_1x128x128_256x128x128x128_16x16_32x32_2x2_8x32x1_8x32x1_1x32x1x8_8_1x1_intrawave_v3,651.99,1720.64,0.0
256,256,16384,512,ck,0,0,10.4597,a8w8_blockscale_1x128x128_256x128x128x128_16x16_32x32_2x2_8x32x1_8x32x1_1x32x1x8_8_1x1_intrawave_v3,410.62,1616.52,0.0
256,256,20480,1536,ck,18,0,23.7982,a8w8_blockscale_1x128x128_256x64x64x256_16x16_32x32_1x1_16x16x1_16x16x1_1x32x1x8_8_1x1_intrawave_v1,676.78,1778.97,0.0
256,256,24576,1536,ck,2,0,27.2881,a8w8_blockscale_1x128x128_256x64x128x128_16x16_32x32_1x2_8x32x1_8x32x1_1x32x1x8_8_1x1_intrawave_v3,708.27,1858.86,0.0
256,256,32768,512,ck,0,0,16.3211,a8w8_blockscale_1x128x128_256x128x128x128_16x16_32x32_2x2_8x32x1_8x32x1_1x32x1x8_8_1x1_intrawave_v3,526.31,2063.92,0.0
256,256,32768,1536,ck,0,0,31.1808,a8w8_blockscale_1x128x128_256x128x128x128_16x16_32x32_2x2_8x32x1_8x32x1_1x32x1x8_8_1x1_intrawave_v3,826.46,2164.86,0.0
256,256,36864,7168,ck,0,0,160.9084,a8w8_blockscale_1x128x128_256x128x128x128_16x16_32x32_2x2_8x32x1_8x32x1_1x32x1x8_8_1x1_intrawave_v3,840.8,1770.89,0.0
256,288,128,7168,ck,8,0,19.0991,a8w8_blockscale_1x128x128_256x16x64x256_16x16_16x16_1x1_16x16x1_16x16x1_1x16x1x16_4_1x1_intrawave_v1,27.67,159.99,0.0
256,288,512,7168,ck,8,0,20.3923,a8w8_blockscale_1x128x128_256x16x64x256_16x16_16x16_1x1_16x16x1_16x16x1_1x16x1x16_4_1x1_intrawave_v1,103.66,295.67,0.0
256,288,1024,7168,ck,8,0,21.7244,a8w8_blockscale_1x128x128_256x16x64x256_16x16_16x16_1x1_16x16x1_16x16x1_1x16x1x16_4_1x1_intrawave_v1,194.61,460.05,0.0
256,288,2112,7168,ck,18,0,24.2926,a8w8_blockscale_1x128x128_256x64x64x256_16x16_32x32_1x1_16x16x1_16x16x1_1x32x1x8_8_1x1_intrawave_v1,358.96,758.24,0.0
256,288,2240,7168,ck,18,0,24.2274,a8w8_blockscale_1x128x128_256x64x64x256_16x16_32x32_1x1_16x16x1_16x16x1_1x32x1x8_8_1x1_intrawave_v1,381.73,801.2,0.0
256,288,3072,1536,ck,12,0,8.9072,a8w8_blockscale_1x128x128_256x32x128x256_16x16_32x32_1x1_16x16x1_16x16x1_1x32x1x8_8_1x1_intrawave_v1,305.14,778.07,0.0
256,288,4096,512,ck,13,0,5.4656,a8w8_blockscale_1x128x128_256x32x64x256_16x16_16x16_2x1_16x16x1_16x16x1_1x32x1x8_8_2x1_intrawave_v1,221.01,842.34,0.0
256,288,4096,7168,ck,18,0,36.2776,a8w8_blockscale_1x128x128_256x64x64x256_16x16_32x32_1x1_16x16x1_16x16x1_1x32x1x8_8_1x1_intrawave_v1,466.17,931.26,0.0
256,288,4608,7168,ck,18,0,34.9489,a8w8_blockscale_1x128x128_256x64x64x256_16x16_32x32_1x1_16x16x1_16x16x1_1x32x1x8_8_1x1_intrawave_v1,544.38,1080.11,0.0
256,288,7168,256,ck,13,0,5.8969,a8w8_blockscale_1x128x128_256x32x64x256_16x16_16x16_2x1_16x16x1_16x16x1_1x32x1x8_8_2x1_intrawave_v1,179.24,1023.84,0.0
256,288,7168,512,ck,12,0,7.8664,a8w8_blockscale_1x128x128_256x32x128x256_16x16_32x32_1x1_16x16x1_16x16x1_1x32x1x8_8_1x1_intrawave_v1,268.73,1010.15,0.0
256,288,7168,2048,ck,12,0,16.1075,a8w8_blockscale_1x128x128_256x32x128x256_16x16_32x32_1x1_16x16x1_16x16x1_1x32x1x8_8_1x1_intrawave_v1,524.96,1204.32,0.0
256,288,7168,2304,ck,12,0,17.6223,a8w8_blockscale_1x128x128_256x32x128x256_16x16_32x32_1x1_16x16x1_16x16x1_1x32x1x8_8_1x1_intrawave_v1,539.81,1209.12,0.0
256,288,7168,4096,ck,12,0,29.9438,a8w8_blockscale_1x128x128_256x32x128x256_16x16_32x32_1x1_16x16x1_16x16x1_1x32x1x8_8_1x1_intrawave_v1,564.77,1157.79,0.0
256,288,7168,4608,ck,12,0,34.1004,a8w8_blockscale_1x128x128_256x32x128x256_16x16_32x32_1x1_16x16x1_16x16x1_1x32x1x8_8_1x1_intrawave_v1,557.92,1128.61,0.0
256,288,7168,16384,ck,12,0,111.0457,a8w8_blockscale_1x128x128_256x32x128x256_16x16_32x32_1x1_16x16x1_16x16x1_1x32x1x8_8_1x1_intrawave_v1,609.17,1137.26,0.0
256,288,7168,18432,ck,12,0,123.9056,a8w8_blockscale_1x128x128_256x32x128x256_16x16_32x32_1x1_16x16x1_16x16x1_1x32x1x8_8_1x1_intrawave_v1,614.19,1142.46,0.0
256,288,8192,512,ck,13,0,8.3615,a8w8_blockscale_1x128x128_256x32x64x256_16x16_16x16_2x1_16x16x1_16x16x1_1x32x1x8_8_2x1_intrawave_v1,288.93,1083.58,0.0
256,288,8192,1536,ck,18,0,15.326,a8w8_blockscale_1x128x128_256x64x64x256_16x16_32x32_1x1_16x16x1_16x16x1_1x32x1x8_8_1x1_intrawave_v1,472.91,1157.76,0.0
256,288,9216,7168,ck,0,0,60.4578,a8w8_blockscale_1x128x128_256x128x128x128_16x16_32x32_2x2_8x32x1_8x32x1_1x32x1x8_8_1x1_intrawave_v3,629.38,1214.62,0.0
256,288,11264,1536,ck,2,0,18.8467,a8w8_blockscale_1x128x128_256x64x128x128_16x16_32x32_1x2_8x32x1_8x32x1_1x32x1x8_8_1x1_intrawave_v3,528.78,1285.74,0.0
256,288,12288,1536,ck,2,0,19.4542,a8w8_blockscale_1x128x128_256x64x128x128_16x16_32x32_1x2_8x32x1_8x32x1_1x32x1x8_8_1x1_intrawave_v3,558.83,1356.76,0.0
256,288,14336,1536,ck,18,0,23.6832,a8w8_blockscale_1x128x128_256x64x64x256_16x16_32x32_1x1_16x16x1_16x16x1_1x32x1x8_8_1x1_intrawave_v1,535.55,1297.12,0.0
256,288,16384,512,ck,18,0,12.3165,a8w8_blockscale_1x128x128_256x64x64x256_16x16_32x32_1x1_16x16x1_16x16x1_1x32x1x8_8_1x1_intrawave_v1,392.31,1459.28,0.0
256,288,20480,1536,ck,0,0,28.7904,a8w8_blockscale_1x128x128_256x128x128x128_16x16_32x32_2x2_8x32x1_8x32x1_1x32x1x8_8_1x1_intrawave_v3,629.36,1517.73,0.0
256,288,24576,1536,ck,14,0,34.4764,a8w8_blockscale_1x128x128_256x64x256x128_16x16_32x32_2x2_8x32x1_8x32x1_1x32x1x8_8_1x1_intrawave_v1,630.67,1518.34,0.0
256,288,32768,512,ck,17,0,20.5268,a8w8_blockscale_1x128x128_256x64x128x256_16x16_32x32_2x1_16x16x1_16x16x1_1x32x1x8_8_1x1_intrawave_v1,470.78,1744.01,0.0
256,288,32768,1536,ck,0,0,44.1873,a8w8_blockscale_1x128x128_256x128x128x128_16x16_32x32_2x2_8x32x1_8x32x1_1x32x1x8_8_1x1_intrawave_v3,656.09,1576.21,0.0
256,288,36864,7168,ck,14,0,185.2145,a8w8_blockscale_1x128x128_256x64x256x128_16x16_32x32_2x2_8x32x1_8x32x1_1x32x1x8_8_1x1_intrawave_v1,821.77,1552.47,0.0
256,320,128,7168,ck,8,0,19.3483,a8w8_blockscale_1x128x128_256x16x64x256_16x16_16x16_1x1_16x16x1_16x16x1_1x16x1x16_4_1x1_intrawave_v1,30.35,170.21,0.0
256,320,512,7168,ck,8,0,20.4108,a8w8_blockscale_1x128x128_256x16x64x256_16x16_16x16_1x1_16x16x1_16x16x1_1x16x1x16_4_1x1_intrawave_v1,115.08,308.24,0.0
256,320,1024,7168,ck,8,0,21.7255,a8w8_blockscale_1x128x128_256x16x64x256_16x16_16x16_1x1_16x16x1_16x16x1_1x16x1x16_4_1x1_intrawave_v1,216.23,473.6,0.0
256,320,2112,7168,ck,18,0,23.4441,a8w8_blockscale_1x128x128_256x64x64x256_16x16_32x32_1x1_16x16x1_16x16x1_1x32x1x8_8_1x1_intrawave_v1,413.27,801.24,0.0
256,320,2240,7168,ck,18,0,23.4986,a8w8_blockscale_1x128x128_256x64x64x256_16x16_32x32_1x1_16x16x1_16x16x1_1x32x1x8_8_1x1_intrawave_v1,437.3,841.91,0.0
256,320,3072,1536,ck,12,0,8.7907,a8w8_blockscale_1x128x128_256x32x128x256_16x16_32x32_1x1_16x16x1_16x16x1_1x32x1x8_8_1x1_intrawave_v1,343.53,816.34,0.0
256,320,4096,512,ck,13,0,6.1473,a8w8_blockscale_1x128x128_256x32x64x256_16x16_16x16_2x1_16x16x1_16x16x1_1x32x1x8_8_2x1_intrawave_v1,218.34,794.24,0.0
256,320,4096,7168,ck,18,0,36.1058,a8w8_blockscale_1x128x128_256x64x64x256_16x16_32x32_1x1_16x16x1_16x16x1_1x32x1x8_8_1x1_intrawave_v1,520.43,949.3,0.0
256,320,4608,7168,ck,18,0,37.9116,a8w8_blockscale_1x128x128_256x64x64x256_16x16_32x32_1x1_16x16x1_16x16x1_1x32x1x8_8_1x1_intrawave_v1,557.59,1009.53,0.0
256,320,7168,256,ck,18,0,6.0807,a8w8_blockscale_1x128x128_256x64x64x256_16x16_32x32_1x1_16x16x1_16x16x1_1x32x1x8_8_1x1_intrawave_v1,193.14,1069.69,0.0
256,320,7168,512,ck,13,0,8.1355,a8w8_blockscale_1x128x128_256x32x64x256_16x16_16x16_2x1_16x16x1_16x16x1_1x32x1x8_8_2x1_intrawave_v1,288.71,1035.14,0.0
256,320,7168,2048,ck,18,0,17.897,a8w8_blockscale_1x128x128_256x64x64x256_16x16_32x32_1x1_16x16x1_16x16x1_1x32x1x8_8_1x1_intrawave_v1,524.96,1113.2,0.0
256,320,7168,2304,ck,18,0,20.2519,a8w8_blockscale_1x128x128_256x64x64x256_16x16_32x32_1x1_16x16x1_16x16x1_1x32x1x8_8_1x1_intrawave_v1,521.91,1078.41,0.0
256,320,7168,4096,ck,18,0,33.2548,a8w8_blockscale_1x128x128_256x64x64x256_16x16_32x32_1x1_16x16x1_16x16x1_1x32x1x8_8_1x1_intrawave_v1,565.05,1060.25,0.0
256,320,7168,4608,ck,18,0,34.9015,a8w8_blockscale_1x128x128_256x64x64x256_16x16_32x32_1x1_16x16x1_16x16x1_1x32x1x8_8_1x1_intrawave_v1,605.68,1120.07,0.0
256,320,7168,16384,ck,2,0,114.1333,a8w8_blockscale_1x128x128_256x64x128x128_16x16_32x32_1x2_8x32x1_8x32x1_1x32x1x8_8_1x1_intrawave_v3,658.55,1115.11,0.0
256,320,7168,18432,ck,2,0,129.9128,a8w8_blockscale_1x128x128_256x64x128x128_16x16_32x32_1x2_8x32x1_8x32x1_1x32x1x8_8_1x1_intrawave_v3,650.88,1097.71,0.0
256,320,8192,512,ck,13,0,8.9484,a8w8_blockscale_1x128x128_256x32x64x256_16x16_16x16_2x1_16x16x1_16x16x1_1x32x1x8_8_2x1_intrawave_v1,299.98,1072.93,0.0
256,320,8192,1536,ck,18,0,15.3877,a8w8_blockscale_1x128x128_256x64x64x256_16x16_32x32_1x1_16x16x1_16x16x1_1x32x1x8_8_1x1_intrawave_v1,523.34,1190.39,0.0
256,320,9216,7168,ck,0,0,60.0342,a8w8_blockscale_1x128x128_256x128x128x128_16x16_32x32_2x2_8x32x1_8x32x1_1x32x1x8_8_1x1_intrawave_v3,704.24,1236.83,0.0
256,320,11264,1536,ck,2,0,18.2441,a8w8_blockscale_1x128x128_256x64x128x128_16x16_32x32_1x2_8x32x1_8x32x1_1x32x1x8_8_1x1_intrawave_v3,606.93,1370.41,0.0
256,320,12288,1536,ck,14,0,19.4937,a8w8_blockscale_1x128x128_256x64x256x128_16x16_32x32_2x2_8x32x1_8x32x1_1x32x1x8_8_1x1_intrawave_v1,619.67,1396.87,0.0
256,320,14336,1536,ck,18,0,24.0771,a8w8_blockscale_1x128x128_256x64x64x256_16x16_32x32_1x1_16x16x1_16x16x1_1x32x1x8_8_1x1_intrawave_v1,585.32,1316.05,0.0
256,320,16384,512,ck,18,0,12.5931,a8w8_blockscale_1x128x128_256x64x64x256_16x16_32x32_1x1_16x16x1_16x16x1_1x32x1x8_8_1x1_intrawave_v1,426.32,1511.8,0.0
256,320,20480,1536,ck,0,0,29.2128,a8w8_blockscale_1x128x128_256x128x128x128_16x16_32x32_2x2_8x32x1_8x32x1_1x32x1x8_8_1x1_intrawave_v3,689.17,1542.34,0.0
256,320,24576,1536,ck,14,0,34.3884,a8w8_blockscale_1x128x128_256x64x256x128_16x16_32x32_2x2_8x32x1_8x32x1_1x32x1x8_8_1x1_intrawave_v1,702.54,1569.39,0.0
256,320,32768,512,ck,2,0,21.6599,a8w8_blockscale_1x128x128_256x64x128x128_16x16_32x32_1x2_8x32x1_8x32x1_1x32x1x8_8_1x1_intrawave_v3,495.73,1750.36,0.0
256,320,32768,1536,ck,0,0,44.3889,a8w8_blockscale_1x128x128_256x128x128x128_16x16_32x32_2x2_8x32x1_8x32x1_1x32x1x8_8_1x1_intrawave_v3,725.68,1617.4,0.0
256,320,36864,7168,ck,0,0,196.9898,a8w8_blockscale_1x128x128_256x128x128x128_16x16_32x32_2x2_8x32x1_8x32x1_1x32x1x8_8_1x1_intrawave_v3,858.49,1472.81,0.0
256,352,128,7168,ck,8,0,19.7316,a8w8_blockscale_1x128x128_256x16x64x256_16x16_16x16_1x1_16x16x1_16x16x1_1x16x1x16_4_1x1_intrawave_v1,32.74,178.94,0.0
256,352,512,7168,ck,8,0,20.4097,a8w8_blockscale_1x128x128_256x16x64x256_16x16_16x16_1x1_16x16x1_16x16x1_1x16x1x16_4_1x1_intrawave_v1,126.59,321.1,0.0
256,352,1024,7168,ck,8,0,22.0666,a8w8_blockscale_1x128x128_256x16x64x256_16x16_16x16_1x1_16x16x1_16x16x1_1x16x1x16_4_1x1_intrawave_v1,234.17,479.64,0.0
256,352,2112,7168,ck,18,0,24.9136,a8w8_blockscale_1x128x128_256x64x64x256_16x16_32x32_1x1_16x16x1_16x16x1_1x32x1x8_8_1x1_intrawave_v1,427.79,768.61,0.0
256,352,2240,7168,ck,18,0,24.7563,a8w8_blockscale_1x128x128_256x64x64x256_16x16_32x32_1x1_16x16x1_16x16x1_1x32x1x8_8_1x1_intrawave_v1,456.6,814.19,0.0
256,352,3072,1536,ck,18,0,10.6109,a8w8_blockscale_1x128x128_256x64x64x256_16x16_32x32_1x1_16x16x1_16x16x1_1x32x1x8_8_1x1_intrawave_v1,313.06,699.46,0.0
256,352,4096,512,ck,17,0,6.2324,a8w8_blockscale_1x128x128_256x64x128x256_16x16_32x32_2x1_16x16x1_16x16x1_1x32x1x8_8_1x1_intrawave_v1,236.89,828.09,0.0
256,352,4096,7168,ck,18,0,39.6236,a8w8_blockscale_1x128x128_256x64x64x256_16x16_32x32_1x1_16x16x1_16x16x1_1x32x1x8_8_1x1_intrawave_v1,521.65,877.43,0.0
256,352,4608,7168,ck,18,0,35.2899,a8w8_blockscale_1x128x128_256x64x64x256_16x16_32x32_1x1_16x16x1_16x16x1_1x32x1x8_8_1x1_intrawave_v1,658.92,1099.39,0.0
256,352,7168,256,ck,13,0,6.2709,a8w8_blockscale_1x128x128_256x32x64x256_16x16_16x16_2x1_16x16x1_16x16x1_1x32x1x8_8_2x1_intrawave_v1,206.01,1111.71,0.0
256,352,7168,512,ck,13,0,8.2786,a8w8_blockscale_1x128x128_256x32x64x256_16x16_16x16_2x1_16x16x1_16x16x1_1x32x1x8_8_2x1_intrawave_v1,312.09,1074.64,0.0
256,352,7168,2048,ck,18,0,18.526,a8w8_blockscale_1x128x128_256x64x64x256_16x16_32x32_1x1_16x16x1_16x16x1_1x32x1x8_8_1x1_intrawave_v1,557.85,1103.7,0.0
256,352,7168,2304,ck,18,0,20.7383,a8w8_blockscale_1x128x128_256x64x64x256_16x16_32x32_1x1_16x16x1_16x16x1_1x32x1x8_8_1x1_intrawave_v1,560.63,1078.79,0.0
256,352,7168,4096,ck,0,0,34.4901,a8w8_blockscale_1x128x128_256x128x128x128_16x16_32x32_2x2_8x32x1_8x32x1_1x32x1x8_8_1x1_intrawave_v3,599.29,1039.38,0.0
256,352,7168,4608,ck,18,0,37.1048,a8w8_blockscale_1x128x128_256x64x64x256_16x16_32x32_1x1_16x16x1_16x16x1_1x32x1x8_8_1x1_intrawave_v1,626.69,1069.9,0.0
256,352,7168,16384,ck,0,0,120.4757,a8w8_blockscale_1x128x128_256x128x128x128_16x16_32x32_2x2_8x32x1_8x32x1_1x32x1x8_8_1x1_intrawave_v3,686.26,1064.56,0.0
256,352,7168,18432,ck,0,0,135.6072,a8w8_blockscale_1x128x128_256x128x128x128_16x16_32x32_2x2_8x32x1_8x32x1_1x32x1x8_8_1x1_intrawave_v3,685.9,1059.35,0.0
256,352,8192,512,ck,18,0,8.9245,a8w8_blockscale_1x128x128_256x64x64x256_16x16_32x32_1x1_16x16x1_16x16x1_1x32x1x8_8_1x1_intrawave_v1,330.86,1136.39,0.0
256,352,8192,1536,ck,18,0,15.8912,a8w8_blockscale_1x128x128_256x64x64x256_16x16_32x32_1x1_16x16x1_16x16x1_1x32x1x8_8_1x1_intrawave_v1,557.44,1188.76,0.0
256,352,9216,7168,ck,0,0,62.6434,a8w8_blockscale_1x128x128_256x128x128x128_16x16_32x32_2x2_8x32x1_8x32x1_1x32x1x8_8_1x1_intrawave_v3,742.4,1198.39,0.0
256,352,11264,1536,ck,18,0,23.2507,a8w8_blockscale_1x128x128_256x64x64x256_16x16_32x32_1x1_16x16x1_16x16x1_1x32x1x8_8_1x1_intrawave_v1,523.87,1108.44,0.0
256,352,12288,1536,ck,18,0,23.3287,a8w8_blockscale_1x128x128_256x64x64x256_16x16_32x32_1x1_16x16x1_16x16x1_1x32x1x8_8_1x1_intrawave_v1,569.58,1203.06,0.0
256,352,14336,1536,ck,2,0,25.9576,a8w8_blockscale_1x128x128_256x64x128x128_16x16_32x32_1x2_8x32x1_8x32x1_1x32x1x8_8_1x1_intrawave_v3,597.21,1257.95,0.0
256,352,16384,512,ck,18,0,13.8423,a8w8_blockscale_1x128x128_256x64x64x256_16x16_32x32_1x1_16x16x1_16x16x1_1x32x1x8_8_1x1_intrawave_v1,426.63,1452.3,0.0
256,352,20480,1536,ck,0,0,29.7336,a8w8_blockscale_1x128x128_256x128x128x128_16x16_32x32_2x2_8x32x1_8x32x1_1x32x1x8_8_1x1_intrawave_v3,744.81,1561.06,0.0
256,352,24576,1536,ck,0,0,40.5204,a8w8_blockscale_1x128x128_256x128x128x128_16x16_32x32_2x2_8x32x1_8x32x1_1x32x1x8_8_1x1_intrawave_v3,655.85,1371.92,0.0
256,352,32768,512,ck,0,0,22.2946,a8w8_blockscale_1x128x128_256x128x128x128_16x16_32x32_2x2_8x32x1_8x32x1_1x32x1x8_8_1x1_intrawave_v3,529.78,1795.33,0.0
256,352,32768,1536,ck,0,0,46.5849,a8w8_blockscale_1x128x128_256x128x128x128_16x16_32x32_2x2_8x32x1_8x32x1_1x32x1x8_8_1x1_intrawave_v3,760.62,1587.23,0.0
256,352,36864,7168,ck,0,0,200.695,a8w8_blockscale_1x128x128_256x128x128x128_16x16_32x32_2x2_8x32x1_8x32x1_1x32x1x8_8_1x1_intrawave_v3,926.91,1458.51,0.0
256,384,128,7168,ck,8,0,19.7154,a8w8_blockscale_1x128x128_256x16x64x256_16x16_16x16_1x1_16x16x1_16x16x1_1x16x1x16_4_1x1_intrawave_v1,35.74,191.14,0.0
256,384,512,7168,ck,8,0,20.3983,a8w8_blockscale_1x128x128_256x16x64x256_16x16_16x16_1x1_16x16x1_16x16x1_1x16x1x16_4_1x1_intrawave_v1,138.18,334.13,0.0
256,384,1024,7168,ck,8,0,22.3438,a8w8_blockscale_1x128x128_256x16x64x256_16x16_16x16_1x1_16x16x1_16x16x1_1x16x1x16_4_1x1_intrawave_v1,252.29,486.89,0.0
256,384,2112,7168,ck,18,0,23.7978,a8w8_blockscale_1x128x128_256x64x64x256_16x16_32x32_1x1_16x16x1_16x16x1_1x32x1x8_8_1x1_intrawave_v1,488.56,819.96,0.0
256,384,2240,7168,ck,18,0,23.7826,a8w8_blockscale_1x128x128_256x64x64x256_16x16_32x32_1x1_16x16x1_16x16x1_1x32x1x8_8_1x1_intrawave_v1,518.5,863.2,0.0
256,384,3072,1536,ck,18,0,10.5698,a8w8_blockscale_1x128x128_256x64x64x256_16x16_32x32_1x1_16x16x1_16x16x1_1x32x1x8_8_1x1_intrawave_v1,342.85,725.44,0.0
256,384,4096,512,ck,13,0,6.3161,a8w8_blockscale_1x128x128_256x32x64x256_16x16_16x16_2x1_16x16x1_16x16x1_1x32x1x8_8_2x1_intrawave_v1,255.0,861.21,0.0
256,384,4096,7168,ck,18,0,34.9755,a8w8_blockscale_1x128x128_256x64x64x256_16x16_32x32_1x1_16x16x1_16x16x1_1x32x1x8_8_1x1_intrawave_v1,644.7,1008.09,0.0
256,384,4608,7168,ck,18,0,42.9873,a8w8_blockscale_1x128x128_256x64x64x256_16x16_32x32_1x1_16x16x1_16x16x1_1x32x1x8_8_1x1_intrawave_v1,590.11,914.73,0.0
256,384,7168,256,ck,18,0,6.5069,a8w8_blockscale_1x128x128_256x64x64x256_16x16_32x32_1x1_16x16x1_16x16x1_1x32x1x8_8_1x1_intrawave_v1,216.58,1143.15,0.0
256,384,7168,512,ck,18,0,8.5934,a8w8_blockscale_1x128x128_256x64x64x256_16x16_32x32_1x1_16x16x1_16x16x1_1x32x1x8_8_1x1_intrawave_v1,327.99,1090.56,0.0
256,384,7168,2048,ck,18,0,18.9583,a8w8_blockscale_1x128x128_256x64x64x256_16x16_32x32_1x1_16x16x1_16x16x1_1x32x1x8_8_1x1_intrawave_v1,594.69,1106.19,0.0
256,384,7168,2304,ck,0,0,20.7129,a8w8_blockscale_1x128x128_256x128x128x128_16x16_32x32_2x2_8x32x1_8x32x1_1x32x1x8_8_1x1_intrawave_v3,612.35,1105.82,0.0
256,384,7168,4096,ck,0,0,34.1125,a8w8_blockscale_1x128x128_256x128x128x128_16x16_32x32_2x2_8x32x1_8x32x1_1x32x1x8_8_1x1_intrawave_v3,661.01,1068.17,0.0
256,384,7168,4608,ck,0,0,37.3568,a8w8_blockscale_1x128x128_256x128x128x128_16x16_32x32_2x2_8x32x1_8x32x1_1x32x1x8_8_1x1_intrawave_v3,679.05,1078.91,0.0
256,384,7168,16384,ck,0,0,116.6161,a8w8_blockscale_1x128x128_256x128x128x128_16x16_32x32_2x2_8x32x1_8x32x1_1x32x1x8_8_1x1_intrawave_v3,773.43,1108.23,0.0
256,384,7168,18432,ck,0,0,137.0626,a8w8_blockscale_1x128x128_256x128x128x128_16x16_32x32_2x2_8x32x1_8x32x1_1x32x1x8_8_1x1_intrawave_v3,740.31,1055.75,0.0
256,384,8192,512,ck,18,0,8.908,a8w8_blockscale_1x128x128_256x64x64x256_16x16_32x32_1x1_16x16x1_16x16x1_1x32x1x8_8_1x1_intrawave_v1,361.61,1199.19,0.0
256,384,8192,1536,ck,18,0,15.9312,a8w8_blockscale_1x128x128_256x64x64x256_16x16_32x32_1x1_16x16x1_16x16x1_1x32x1x8_8_1x1_intrawave_v1,606.59,1221.77,0.0
256,384,9216,7168,ck,0,0,62.323,a8w8_blockscale_1x128x128_256x128x128x128_16x16_32x32_2x2_8x32x1_8x32x1_1x32x1x8_8_1x1_intrawave_v3,814.05,1217.7,0.0
256,384,11264,1536,ck,18,0,22.6307,a8w8_blockscale_1x128x128_256x64x64x256_16x16_32x32_1x1_16x16x1_16x16x1_1x32x1x8_8_1x1_intrawave_v1,587.15,1172.84,0.0
256,384,12288,1536,ck,18,0,23.4391,a8w8_blockscale_1x128x128_256x64x64x256_16x16_32x32_1x1_16x16x1_16x16x1_1x32x1x8_8_1x1_intrawave_v1,618.43,1233.04,0.0
256,384,14336,1536,ck,2,0,25.7776,a8w8_blockscale_1x128x128_256x64x128x128_16x16_32x32_1x2_8x32x1_8x32x1_1x32x1x8_8_1x1_intrawave_v3,656.05,1304.23,0.0
256,384,16384,512,ck,17,0,13.9619,a8w8_blockscale_1x128x128_256x64x128x256_16x16_32x32_2x1_16x16x1_16x16x1_1x32x1x8_8_1x1_intrawave_v1,461.43,1516.14,0.0
256,384,20480,1536,ck,0,0,28.7288,a8w8_blockscale_1x128x128_256x128x128x128_16x16_32x32_2x2_8x32x1_8x32x1_1x32x1x8_8_1x1_intrawave_v3,840.94,1662.99,0.0
256,384,24576,1536,ck,0,0,40.8108,a8w8_blockscale_1x128x128_256x128x128x128_16x16_32x32_2x2_8x32x1_8x32x1_1x32x1x8_8_1x1_intrawave_v3,710.38,1401.91,0.0
256,384,32768,512,ck,0,0,23.0787,a8w8_blockscale_1x128x128_256x128x128x128_16x16_32x32_2x2_8x32x1_8x32x1_1x32x1x8_8_1x1_intrawave_v3,558.3,1825.91,0.0
256,384,32768,1536,ck,0,0,45.8993,a8w8_blockscale_1x128x128_256x128x128x128_16x16_32x32_2x2_8x32x1_8x32x1_1x32x1x8_8_1x1_intrawave_v3,842.16,1657.7,0.0
256,384,36864,7168,ck,0,0,210.4362,a8w8_blockscale_1x128x128_256x128x128x128_16x16_32x32_2x2_8x32x1_8x32x1_1x32x1x8_8_1x1_intrawave_v3,964.36,1403.3,0.0
256,416,128,7168,ck,8,0,20.0269,a8w8_blockscale_1x128x128_256x16x64x256_16x16_16x16_1x1_16x16x1_16x16x1_1x16x1x16_4_1x1_intrawave_v1,38.12,200.03,0.0
256,416,512,7168,ck,8,0,20.6355,a8w8_blockscale_1x128x128_256x16x64x256_16x16_16x16_1x1_16x16x1_16x16x1_1x16x1x16_4_1x1_intrawave_v1,147.97,343.0,0.0
256,416,1024,7168,ck,8,0,22.7135,a8w8_blockscale_1x128x128_256x16x64x256_16x16_16x16_1x1_16x16x1_16x16x1_1x16x1x16_4_1x1_intrawave_v1,268.87,491.95,0.0
256,416,2112,7168,ck,18,0,25.1696,a8w8_blockscale_1x128x128_256x64x64x256_16x16_32x32_1x1_16x16x1_16x16x1_1x32x1x8_8_1x1_intrawave_v1,500.42,789.76,0.0
256,416,2240,7168,ck,18,0,26.0516,a8w8_blockscale_1x128x128_256x64x64x256_16x16_32x32_1x1_16x16x1_16x16x1_1x32x1x8_8_1x1_intrawave_v1,512.78,802.33,0.0
256,416,3072,1536,ck,18,0,10.8287,a8w8_blockscale_1x128x128_256x64x64x256_16x16_32x32_1x1_16x16x1_16x16x1_1x32x1x8_8_1x1_intrawave_v1,362.54,730.79,0.0
256,416,4096,512,ck,17,0,6.4007,a8w8_blockscale_1x128x128_256x64x128x256_16x16_32x32_2x1_16x16x1_16x16x1_1x32x1x8_8_1x1_intrawave_v1,272.6,893.34,0.0
256,416,4096,7168,ck,18,0,38.7328,a8w8_blockscale_1x128x128_256x64x64x256_16x16_32x32_1x1_16x16x1_16x16x1_1x32x1x8_8_1x1_intrawave_v1,630.67,922.99,0.0
256,416,4608,7168,ck,18,0,40.166,a8w8_blockscale_1x128x128_256x64x64x256_16x16_32x32_1x1_16x16x1_16x16x1_1x32x1x8_8_1x1_intrawave_v1,684.19,992.03,0.0
256,416,7168,256,ck,13,0,6.5711,a8w8_blockscale_1x128x128_256x32x64x256_16x16_16x16_2x1_16x16x1_16x16x1_1x32x1x8_8_2x1_intrawave_v1,232.34,1203.04,0.0
256,416,7168,512,ck,13,0,9.2876,a8w8_blockscale_1x128x128_256x32x64x256_16x16_16x16_2x1_16x16x1_16x16x1_1x32x1x8_8_2x1_intrawave_v1,328.77,1060.21,0.0
256,416,7168,2048,ck,0,0,21.113,a8w8_blockscale_1x128x128_256x128x128x128_16x16_32x32_2x2_8x32x1_8x32x1_1x32x1x8_8_1x1_intrawave_v3,578.5,1018.13,0.0
256,416,7168,2304,ck,0,0,22.2607,a8w8_blockscale_1x128x128_256x128x128x128_16x16_32x32_2x2_8x32x1_8x32x1_1x32x1x8_8_1x1_intrawave_v3,617.26,1052.86,0.0
256,416,7168,4096,ck,0,0,37.3648,a8w8_blockscale_1x128x128_256x128x128x128_16x16_32x32_2x2_8x32x1_8x32x1_1x32x1x8_8_1x1_intrawave_v3,653.76,990.98,0.0
256,416,7168,4608,ck,0,0,37.6687,a8w8_blockscale_1x128x128_256x128x128x128_16x16_32x32_2x2_8x32x1_8x32x1_1x32x1x8_8_1x1_intrawave_v3,729.55,1086.07,0.0
256,416,7168,16384,ck,0,0,127.2482,a8w8_blockscale_1x128x128_256x128x128x128_16x16_32x32_2x2_8x32x1_8x32x1_1x32x1x8_8_1x1_intrawave_v3,767.87,1023.35,0.0
256,416,7168,18432,ck,0,0,140.696,a8w8_blockscale_1x128x128_256x128x128x128_16x16_32x32_2x2_8x32x1_8x32x1_1x32x1x8_8_1x1_intrawave_v3,781.29,1035.94,0.0
256,416,8192,512,ck,0,0,10.1211,a8w8_blockscale_1x128x128_256x128x128x128_16x16_32x32_2x2_8x32x1_8x32x1_1x32x1x8_8_1x1_intrawave_v3,344.79,1108.88,0.0
256,416,8192,1536,ck,0,0,17.5627,a8w8_blockscale_1x128x128_256x128x128x128_16x16_32x32_2x2_8x32x1_8x32x1_1x32x1x8_8_1x1_intrawave_v3,596.09,1140.92,0.0
256,416,9216,7168,ck,14,0,69.5662,a8w8_blockscale_1x128x128_256x64x256x128_16x16_32x32_2x2_8x32x1_8x32x1_1x32x1x8_8_1x1_intrawave_v1,790.07,1102.69,0.0
256,416,11264,1536,ck,18,0,25.0123,a8w8_blockscale_1x128x128_256x64x64x256_16x16_32x32_1x1_16x16x1_16x16x1_1x32x1x8_8_1x1_intrawave_v1,575.51,1091.95,0.0
256,416,12288,1536,ck,2,0,25.9648,a8w8_blockscale_1x128x128_256x64x128x128_16x16_32x32_1x2_8x32x1_8x32x1_1x32x1x8_8_1x1_intrawave_v3,604.8,1145.28,0.0
256,416,14336,1536,ck,0,0,27.6412,a8w8_blockscale_1x128x128_256x128x128x128_16x16_32x32_2x2_8x32x1_8x32x1_1x32x1x8_8_1x1_intrawave_v3,662.8,1251.27,0.0
256,416,16384,512,ck,18,0,15.1957,a8w8_blockscale_1x128x128_256x64x64x256_16x16_32x32_1x1_16x16x1_16x16x1_1x32x1x8_8_1x1_intrawave_v1,459.3,1463.12,0.0
256,416,20480,1536,ck,0,0,39.6024,a8w8_blockscale_1x128x128_256x128x128x128_16x16_32x32_2x2_8x32x1_8x32x1_1x32x1x8_8_1x1_intrawave_v3,660.88,1240.72,0.0
256,416,24576,1536,ck,0,0,43.5537,a8w8_blockscale_1x128x128_256x128x128x128_16x16_32x32_2x2_8x32x1_8x32x1_1x32x1x8_8_1x1_intrawave_v3,721.11,1350.86,0.0
256,416,32768,512,ck,0,0,27.9556,a8w8_blockscale_1x128x128_256x128x128x128_16x16_32x32_2x2_8x32x1_8x32x1_1x32x1x8_8_1x1_intrawave_v3,499.31,1582.98,0.0
256,416,32768,1536,ck,0,0,57.2349,a8w8_blockscale_1x128x128_256x128x128x128_16x16_32x32_2x2_8x32x1_8x32x1_1x32x1x8_8_1x1_intrawave_v3,731.65,1366.89,0.0
256,416,36864,7168,ck,0,0,241.3958,a8w8_blockscale_1x128x128_256x128x128x128_16x16_32x32_2x2_8x32x1_8x32x1_1x32x1x8_8_1x1_intrawave_v3,910.74,1234.05,0.0
256,448,128,7168,ck,8,0,19.9415,a8w8_blockscale_1x128x128_256x16x64x256_16x16_16x16_1x1_16x16x1_16x16x1_1x16x1x16_4_1x1_intrawave_v1,41.22,212.8,0.0
256,448,512,7168,ck,8,0,20.6355,a8w8_blockscale_1x128x128_256x16x64x256_16x16_16x16_1x1_16x16x1_16x16x1_1x16x1x16_4_1x1_intrawave_v1,159.35,355.7,0.0
256,448,1024,7168,ck,18,0,23.1171,a8w8_blockscale_1x128x128_256x64x64x256_16x16_32x32_1x1_16x16x1_16x16x1_1x32x1x8_8_1x1_intrawave_v1,284.49,496.12,0.0
256,448,2112,7168,ck,18,0,23.7136,a8w8_blockscale_1x128x128_256x64x64x256_16x16_32x32_1x1_16x16x1_16x16x1_1x32x1x8_8_1x1_intrawave_v1,572.01,853.62,0.0
256,448,2240,7168,ck,18,0,25.0899,a8w8_blockscale_1x128x128_256x64x64x256_16x16_32x32_1x1_16x16x1_16x16x1_1x32x1x8_8_1x1_intrawave_v1,573.4,847.94,0.0
256,448,3072,1536,ck,18,0,10.8713,a8w8_blockscale_1x128x128_256x64x64x256_16x16_32x32_1x1_16x16x1_16x16x1_1x32x1x8_8_1x1_intrawave_v1,388.9,750.53,0.0
256,448,4096,512,ck,13,0,6.8369,a8w8_blockscale_1x128x128_256x32x64x256_16x16_16x16_2x1_16x16x1_16x16x1_1x32x1x8_8_2x1_intrawave_v1,274.84,877.09,0.0
256,448,4096,7168,ck,18,0,42.0773,a8w8_blockscale_1x128x128_256x64x64x256_16x16_32x32_1x1_16x16x1_16x16x1_1x32x1x8_8_1x1_intrawave_v1,625.2,861.31,0.0
256,448,4608,7168,ck,18,0,44.0377,a8w8_blockscale_1x128x128_256x64x64x256_16x16_32x32_1x1_16x16x1_16x16x1_1x32x1x8_8_1x1_intrawave_v1,672.04,916.72,0.0
256,448,7168,256,ck,18,0,7.088,a8w8_blockscale_1x128x128_256x64x64x256_16x16_32x32_1x1_16x16x1_16x16x1_1x32x1x8_8_1x1_intrawave_v1,231.96,1181.18,0.0
256,448,7168,512,ck,2,0,9.9265,a8w8_blockscale_1x128x128_256x64x128x128_16x16_32x32_1x2_8x32x1_8x32x1_1x32x1x8_8_1x1_intrawave_v3,331.27,1039.83,0.0
256,448,7168,2048,ck,0,0,21.0124,a8w8_blockscale_1x128x128_256x128x128x128_16x16_32x32_2x2_8x32x1_8x32x1_1x32x1x8_8_1x1_intrawave_v3,625.98,1047.96,0.0
256,448,7168,2304,ck,0,0,21.9519,a8w8_blockscale_1x128x128_256x128x128x128_16x16_32x32_2x2_8x32x1_8x32x1_1x32x1x8_8_1x1_intrawave_v3,674.09,1091.92,0.0
256,448,7168,4096,ck,0,0,37.988,a8w8_blockscale_1x128x128_256x128x128x128_16x16_32x32_2x2_8x32x1_8x32x1_1x32x1x8_8_1x1_intrawave_v3,692.5,990.25,0.0
256,448,7168,4608,ck,0,0,39.782,a8w8_blockscale_1x128x128_256x128x128x128_16x16_32x32_2x2_8x32x1_8x32x1_1x32x1x8_8_1x1_intrawave_v3,743.93,1043.61,0.0
256,448,7168,16384,ck,0,0,127.2333,a8w8_blockscale_1x128x128_256x128x128x128_16x16_32x32_2x2_8x32x1_8x32x1_1x32x1x8_8_1x1_intrawave_v3,827.04,1031.2,0.0
256,448,7168,18432,ck,0,0,141.5706,a8w8_blockscale_1x128x128_256x128x128x128_16x16_32x32_2x2_8x32x1_8x32x1_1x32x1x8_8_1x1_intrawave_v3,836.19,1036.94,0.0
256,448,8192,512,ck,0,0,10.2386,a8w8_blockscale_1x128x128_256x128x128x128_16x16_32x32_2x2_8x32x1_8x32x1_1x32x1x8_8_1x1_intrawave_v3,367.05,1148.96,0.0
256,448,8192,1536,ck,0,0,17.232,a8w8_blockscale_1x128x128_256x128x128x128_16x16_32x32_2x2_8x32x1_8x32x1_1x32x1x8_8_1x1_intrawave_v3,654.26,1196.09,0.0
256,448,9216,7168,ck,14,0,69.6246,a8w8_blockscale_1x128x128_256x64x256x128_16x16_32x32_2x2_8x32x1_8x32x1_1x32x1x8_8_1x1_intrawave_v1,850.13,1113.53,0.0
256,448,11264,1536,ck,18,0,24.1979,a8w8_blockscale_1x128x128_256x64x64x256_16x16_32x32_1x1_16x16x1_16x16x1_1x32x1x8_8_1x1_intrawave_v1,640.64,1160.52,0.0
256,448,12288,1536,ck,2,0,25.5359,a8w8_blockscale_1x128x128_256x64x128x128_16x16_32x32_1x2_8x32x1_8x32x1_1x32x1x8_8_1x1_intrawave_v3,662.26,1197.24,0.0
256,448,14336,1536,ck,0,0,27.4252,a8w8_blockscale_1x128x128_256x128x128x128_16x16_32x32_2x2_8x32x1_8x32x1_1x32x1x8_8_1x1_intrawave_v3,719.41,1296.37,0.0
256,448,16384,512,ck,18,0,15.8837,a8w8_blockscale_1x128x128_256x64x64x256_16x16_32x32_1x1_16x16x1_16x16x1_1x32x1x8_8_1x1_intrawave_v1,473.2,1466.79,0.0
256,448,20480,1536,ck,2,0,40.9444,a8w8_blockscale_1x128x128_256x64x128x128_16x16_32x32_1x2_8x32x1_8x32x1_1x32x1x8_8_1x1_intrawave_v3,688.39,1233.27,0.0
256,448,24576,1536,ck,0,0,45.0677,a8w8_blockscale_1x128x128_256x128x128x128_16x16_32x32_2x2_8x32x1_8x32x1_1x32x1x8_8_1x1_intrawave_v3,750.49,1341.47,0.0
256,448,32768,512,ck,0,0,27.7693,a8w8_blockscale_1x128x128_256x128x128x128_16x16_32x32_2x2_8x32x1_8x32x1_1x32x1x8_8_1x1_intrawave_v3,541.33,1669.71,0.0
256,448,32768,1536,ck,0,0,58.9473,a8w8_blockscale_1x128x128_256x128x128x128_16x16_32x32_2x2_8x32x1_8x32x1_1x32x1x8_8_1x1_intrawave_v3,765.04,1363.59,0.0
256,448,36864,7168,ck,0,0,244.4989,a8w8_blockscale_1x128x128_256x128x128x128_16x16_32x32_2x2_8x32x1_8x32x1_1x32x1x8_8_1x1_intrawave_v3,968.35,1228.97,0.0
256,480,128,7168,ck,8,0,20.0486,a8w8_blockscale_1x128x128_256x16x64x256_16x16_16x16_1x1_16x16x1_16x16x1_1x16x1x16_4_1x1_intrawave_v1,43.93,223.51,0.0
256,480,512,7168,ck,8,0,20.5967,a8w8_blockscale_1x128x128_256x16x64x256_16x16_16x16_1x1_16x16x1_16x16x1_1x16x1x16_4_1x1_intrawave_v1,171.06,369.1,0.0
256,480,1024,7168,ck,7,0,23.5657,a8w8_blockscale_1x128x128_256x16x128x256_16x16_16x16_1x2_16x16x1_16x16x1_1x16x1x16_8_1x2_intrawave_v1,299.01,499.19,0.0
256,480,2112,7168,ck,18,0,32.4638,a8w8_blockscale_1x128x128_256x64x64x256_16x16_32x32_1x1_16x16x1_16x16x1_1x32x1x8_8_1x1_intrawave_v1,447.68,634.77,0.0
256,480,2240,7168,ck,18,0,34.7895,a8w8_blockscale_1x128x128_256x64x64x256_16x16_32x32_1x1_16x16x1_16x16x1_1x32x1x8_8_1x1_intrawave_v1,443.07,622.24,0.0
256,480,3072,1536,ck,18,0,11.1376,a8w8_blockscale_1x128x128_256x64x64x256_16x16_32x32_1x1_16x16x1_16x16x1_1x32x1x8_8_1x1_intrawave_v1,406.72,754.65,0.0
256,480,4096,512,ck,18,0,6.3449,a8w8_blockscale_1x128x128_256x64x64x256_16x16_32x32_1x1_16x16x1_16x16x1_1x32x1x8_8_1x1_intrawave_v1,317.3,988.99,0.0
256,480,4096,7168,ck,2,0,44.0884,a8w8_blockscale_1x128x128_256x64x128x128_16x16_32x32_1x2_8x32x1_8x32x1_1x32x1x8_8_1x1_intrawave_v3,639.3,833.17,0.0
256,480,4608,7168,ck,18,0,52.5105,a8w8_blockscale_1x128x128_256x64x64x256_16x16_32x32_1x1_16x16x1_16x16x1_1x32x1x8_8_1x1_intrawave_v1,603.86,778.79,0.0
256,480,7168,256,ck,13,0,7.4843,a8w8_blockscale_1x128x128_256x32x64x256_16x16_16x16_2x1_16x16x1_16x16x1_1x32x1x8_8_2x1_intrawave_v1,235.37,1181.03,0.0
256,480,7168,512,ck,18,0,10.0728,a8w8_blockscale_1x128x128_256x64x64x256_16x16_32x32_1x1_16x16x1_16x16x1_1x32x1x8_8_1x1_intrawave_v1,349.78,1071.9,0.0
256,480,7168,2048,ck,0,0,21.2321,a8w8_blockscale_1x128x128_256x128x128x128_16x16_32x32_2x2_8x32x1_8x32x1_1x32x1x8_8_1x1_intrawave_v3,663.75,1061.81,0.0
256,480,7168,2304,ck,0,0,22.08,a8w8_blockscale_1x128x128_256x128x128x128_16x16_32x32_2x2_8x32x1_8x32x1_1x32x1x8_8_1x1_intrawave_v3,718.05,1109.7,0.0
256,480,7168,4096,ck,0,0,39.2544,a8w8_blockscale_1x128x128_256x128x128x128_16x16_32x32_2x2_8x32x1_8x32x1_1x32x1x8_8_1x1_intrawave_v3,718.03,973.33,0.0
256,480,7168,4608,ck,0,0,40.9212,a8w8_blockscale_1x128x128_256x128x128x128_16x16_32x32_2x2_8x32x1_8x32x1_1x32x1x8_8_1x1_intrawave_v3,774.88,1029.38,0.0
256,480,7168,16384,ck,0,0,129.3282,a8w8_blockscale_1x128x128_256x128x128x128_16x16_32x32_2x2_8x32x1_8x32x1_1x32x1x8_8_1x1_intrawave_v3,871.76,1022.1,0.0
256,480,7168,18432,ck,0,0,144.4652,a8w8_blockscale_1x128x128_256x128x128x128_16x16_32x32_2x2_8x32x1_8x32x1_1x32x1x8_8_1x1_intrawave_v3,877.97,1023.42,0.0
256,480,8192,512,ck,0,0,10.3243,a8w8_blockscale_1x128x128_256x128x128x128_16x16_32x32_2x2_8x32x1_8x32x1_1x32x1x8_8_1x1_intrawave_v3,390.01,1191.79,0.0
256,480,8192,1536,ck,0,0,17.4656,a8w8_blockscale_1x128x128_256x128x128x128_16x16_32x32_2x2_8x32x1_8x32x1_1x32x1x8_8_1x1_intrawave_v3,691.62,1212.93,0.0
256,480,9216,7168,ck,0,0,92.5317,a8w8_blockscale_1x128x128_256x128x128x128_16x16_32x32_2x2_8x32x1_8x32x1_1x32x1x8_8_1x1_intrawave_v3,685.36,846.72,0.0
256,480,11264,1536,ck,2,0,26.6676,a8w8_blockscale_1x128x128_256x64x128x128_16x16_32x32_1x2_8x32x1_8x32x1_1x32x1x8_8_1x1_intrawave_v3,622.83,1081.92,0.0
256,480,12288,1536,ck,0,0,26.8339,a8w8_blockscale_1x128x128_256x128x128x128_16x16_32x32_2x2_8x32x1_8x32x1_1x32x1x8_8_1x1_intrawave_v3,675.24,1170.46,0.0
256,480,14336,1536,ck,0,0,27.936,a8w8_blockscale_1x128x128_256x128x128x128_16x16_32x32_2x2_8x32x1_8x32x1_1x32x1x8_8_1x1_intrawave_v3,756.7,1307.27,0.0
256,480,16384,512,ck,0,0,16.0696,a8w8_blockscale_1x128x128_256x128x128x128_16x16_32x32_2x2_8x32x1_8x32x1_1x32x1x8_8_1x1_intrawave_v3,501.14,1516.09,0.0
256,480,20480,1536,ck,0,0,41.1788,a8w8_blockscale_1x128x128_256x128x128x128_16x16_32x32_2x2_8x32x1_8x32x1_1x32x1x8_8_1x1_intrawave_v3,733.36,1259.27,0.0
256,480,24576,1536,ck,0,0,46.2753,a8w8_blockscale_1x128x128_256x128x128x128_16x16_32x32_2x2_8x32x1_8x32x1_1x32x1x8_8_1x1_intrawave_v3,783.11,1341.51,0.0
256,480,32768,512,ck,0,0,29.29,a8w8_blockscale_1x128x128_256x128x128x128_16x16_32x32_2x2_8x32x1_8x32x1_1x32x1x8_8_1x1_intrawave_v3,549.88,1655.18,0.0
256,480,32768,1536,ck,0,0,57.6721,a8w8_blockscale_1x128x128_256x128x128x128_16x16_32x32_2x2_8x32x1_8x32x1_1x32x1x8_8_1x1_intrawave_v3,837.81,1430.96,0.0
256,480,36864,7168,ck,0,0,266.025,a8w8_blockscale_1x128x128_256x128x128x128_16x16_32x32_2x2_8x32x1_8x32x1_1x32x1x8_8_1x1_intrawave_v3,953.56,1139.26,0.0
256,512,64,7168,ck,8,0,19.8437,a8w8_blockscale_1x128x128_256x16x64x256_16x16_16x16_1x1_16x16x1_16x16x1_1x16x1x16_4_1x1_intrawave_v1,23.67,211.37,0.0
256,512,128,7168,ck,8,0,19.9742,a8w8_blockscale_1x128x128_256x16x64x256_16x16_16x16_1x1_16x16x1_16x16x1_1x16x1x16_4_1x1_intrawave_v1,47.04,236.23,0.0
256,512,512,7168,ck,8,0,20.7315,a8w8_blockscale_1x128x128_256x16x64x256_16x16_16x16_1x1_16x16x1_16x16x1_1x16x1x16_4_1x1_intrawave_v1,181.27,379.34,0.0
256,512,576,7168,ck,18,0,22.9789,a8w8_blockscale_1x128x128_256x64x64x256_16x16_32x32_1x1_16x16x1_16x16x1_1x32x1x8_8_1x1_intrawave_v1,183.99,365.06,0.0
256,512,1024,7168,ck,18,0,23.1935,a8w8_blockscale_1x128x128_256x64x64x256_16x16_32x32_1x1_16x16x1_16x16x1_1x32x1x8_8_1x1_intrawave_v1,324.06,519.91,0.0
256,512,1536,7168,ck,18,0,23.3788,a8w8_blockscale_1x128x128_256x64x64x256_16x16_32x32_1x1_16x16x1_16x16x1_1x32x1x8_8_1x1_intrawave_v1,482.24,695.2,0.0
256,512,2112,7168,ck,18,0,32.0652,a8w8_blockscale_1x128x128_256x64x64x256_16x16_32x32_1x1_16x16x1_16x16x1_1x32x1x8_8_1x1_intrawave_v1,483.46,654.03,0.0
256,512,2240,7168,ck,18,0,34.4425,a8w8_blockscale_1x128x128_256x64x64x256_16x16_32x32_1x1_16x16x1_16x16x1_1x32x1x8_8_1x1_intrawave_v1,477.37,639.33,0.0
256,512,3072,1536,ck,18,0,11.2304,a8w8_blockscale_1x128x128_256x64x64x256_16x16_32x32_1x1_16x16x1_16x16x1_1x32x1x8_8_1x1_intrawave_v1,430.25,770.3,0.0
256,512,4096,512,ck,18,0,6.7823,a8w8_blockscale_1x128x128_256x64x64x256_16x16_32x32_1x1_16x16x1_16x16x1_1x32x1x8_8_1x1_intrawave_v1,316.63,966.28,0.0
256,512,4096,7168,ck,18,0,44.5905,a8w8_blockscale_1x128x128_256x64x64x256_16x16_32x32_1x1_16x16x1_16x16x1_1x32x1x8_8_1x1_intrawave_v1,674.24,834.81,0.0
256,512,4608,7168,ck,18,0,53.8717,a8w8_blockscale_1x128x128_256x64x64x256_16x16_32x32_1x1_16x16x1_16x16x1_1x32x1x8_8_1x1_intrawave_v1,627.84,768.84,0.0
256,512,7168,256,cktile,10,0,7.6955,a8w8_blockscale_cktile_128x128x128_2x2x1_16x16x128_intrawave_0x1x0_2,244.17,1209.29,0.0
256,512,7168,512,ck,0,0,9.9586,a8w8_blockscale_1x128x128_256x128x128x128_16x16_32x32_2x2_8x32x1_8x32x1_1x32x1x8_8_1x1_intrawave_v3,377.37,1131.91,0.0
256,512,7168,2048,ck,0,0,20.7712,a8w8_blockscale_1x128x128_256x128x128x128_16x16_32x32_2x2_8x32x1_8x32x1_1x32x1x8_8_1x1_intrawave_v3,723.71,1110.61,0.0
256,512,7168,2304,ck,0,0,22.3331,a8w8_blockscale_1x128x128_256x128x128x128_16x16_32x32_2x2_8x32x1_8x32x1_1x32x1x8_8_1x1_intrawave_v3,757.24,1120.97,0.0
256,512,7168,4096,ck,0,0,37.9824,a8w8_blockscale_1x128x128_256x128x128x128_16x16_32x32_2x2_8x32x1_8x32x1_1x32x1x8_8_1x1_intrawave_v3,791.54,1021.45,0.0
256,512,7168,4608,ck,0,0,38.6734,a8w8_blockscale_1x128x128_256x128x128x128_16x16_32x32_2x2_8x32x1_8x32x1_1x32x1x8_8_1x1_intrawave_v3,874.58,1104.88,0.0
256,512,7168,16384,ck,0,0,126.7885,a8w8_blockscale_1x128x128_256x128x128x128_16x16_32x32_2x2_8x32x1_8x32x1_1x32x1x8_8_1x1_intrawave_v3,948.5,1050.33,0.0
256,512,7168,18432,ck,0,0,140.2762,a8w8_blockscale_1x128x128_256x128x128x128_16x16_32x32_2x2_8x32x1_8x32x1_1x32x1x8_8_1x1_intrawave_v3,964.46,1061.46,0.0
256,512,8192,512,ck,0,0,10.2043,a8w8_blockscale_1x128x128_256x128x128x128_16x16_32x32_2x2_8x32x1_8x32x1_1x32x1x8_8_1x1_intrawave_v3,420.9,1258.79,0.0
256,512,8192,1536,ck,0,0,17.0218,a8w8_blockscale_1x128x128_256x128x128x128_16x16_32x32_2x2_8x32x1_8x32x1_1x32x1x8_8_1x1_intrawave_v3,756.96,1278.24,0.0
256,512,9216,7168,ck,18,0,93.1119,a8w8_blockscale_1x128x128_256x64x64x256_16x16_32x32_1x1_16x16x1_16x16x1_1x32x1x8_8_1x1_intrawave_v1,726.5,850.24,0.0
256,512,11264,1536,ck,0,0,26.045,a8w8_blockscale_1x128x128_256x128x128x128_16x16_32x32_2x2_8x32x1_8x32x1_1x32x1x8_8_1x1_intrawave_v3,680.24,1137.35,0.0
256,512,12288,1536,ck,2,0,26.2594,a8w8_blockscale_1x128x128_256x64x128x128_16x16_32x32_1x2_8x32x1_8x32x1_1x32x1x8_8_1x1_intrawave_v3,736.02,1227.89,0.0
256,512,14336,1536,ck,0,0,27.3124,a8w8_blockscale_1x128x128_256x128x128x128_16x16_32x32_2x2_8x32x1_8x32x1_1x32x1x8_8_1x1_intrawave_v3,825.58,1372.51,0.0
256,512,16384,512,ck,0,0,16.3731,a8w8_blockscale_1x128x128_256x128x128x128_16x16_32x32_2x2_8x32x1_8x32x1_1x32x1x8_8_1x1_intrawave_v3,524.64,1553.03,0.0
256,512,20480,1536,ck,0,0,41.542,a8w8_blockscale_1x128x128_256x128x128x128_16x16_32x32_2x2_8x32x1_8x32x1_1x32x1x8_8_1x1_intrawave_v3,775.41,1281.0,0.0
256,512,24576,1536,ck,0,0,46.3688,a8w8_blockscale_1x128x128_256x128x128x128_16x16_32x32_2x2_8x32x1_8x32x1_1x32x1x8_8_1x1_intrawave_v3,833.64,1373.79,0.0
256,512,32768,512,ck,0,0,29.3632,a8w8_blockscale_1x128x128_256x128x128x128_16x16_32x32_2x2_8x32x1_8x32x1_1x32x1x8_8_1x1_intrawave_v3,585.08,1723.03,0.0
256,512,32768,1536,ck,0,0,58.6281,a8w8_blockscale_1x128x128_256x128x128x128_16x16_32x32_2x2_8x32x1_8x32x1_1x32x1x8_8_1x1_intrawave_v3,879.09,1444.23,0.0
256,512,36864,7168,ck,0,0,256.8593,a8w8_blockscale_1x128x128_256x128x128x128_16x16_32x32_2x2_8x32x1_8x32x1_1x32x1x8_8_1x1_intrawave_v3,1053.43,1189.99,0.0
256,1024,64,7168,ck,8,0,20.1439,a8w8_blockscale_1x128x128_256x16x64x256_16x16_16x16_1x1_16x16x1_16x16x1_1x16x1x16_4_1x1_intrawave_v1,46.64,393.66,0.0
256,1024,128,7168,ck,8,0,20.3747,a8w8_blockscale_1x128x128_256x16x64x256_16x16_16x16_1x1_16x16x1_16x16x1_1x16x1x16_4_1x1_intrawave_v1,92.22,418.15,0.0
256,1024,512,7168,ck,7,0,22.8839,a8w8_blockscale_1x128x128_256x16x128x256_16x16_16x16_1x2_16x16x1_16x16x1_1x16x1x16_8_1x2_intrawave_v1,328.45,526.95,0.0
256,1024,576,7168,ck,18,0,23.2238,a8w8_blockscale_1x128x128_256x64x64x256_16x16_32x32_1x1_16x16x1_16x16x1_1x32x1x8_8_1x1_intrawave_v1,364.1,544.63,0.0
256,1024,1024,7168,ck,18,0,24.4927,a8w8_blockscale_1x128x128_256x64x64x256_16x16_32x32_1x1_16x16x1_16x16x1_1x32x1x8_8_1x1_intrawave_v1,613.75,684.99,0.0
256,1024,1536,7168,ck,18,0,38.4168,a8w8_blockscale_1x128x128_256x64x64x256_16x16_32x32_1x1_16x16x1_16x16x1_1x32x1x8_8_1x1_intrawave_v1,586.95,559.54,0.0
256,1024,2112,7168,ck,18,0,51.2969,a8w8_blockscale_1x128x128_256x64x64x256_16x16_32x32_1x1_16x16x1_16x16x1_1x32x1x8_8_1x1_intrawave_v1,604.41,522.53,0.0
256,1024,2240,7168,ck,18,0,53.7053,a8w8_blockscale_1x128x128_256x64x64x256_16x16_32x32_1x1_16x16x1_16x16x1_1x32x1x8_8_1x1_intrawave_v1,612.29,521.06,0.0
256,1024,3072,1536,ck,18,0,16.0053,a8w8_blockscale_1x128x128_256x64x64x256_16x16_32x32_1x1_16x16x1_16x16x1_1x32x1x8_8_1x1_intrawave_v1,603.78,786.17,0.0
256,1024,4096,512,ck,0,0,10.0853,a8w8_blockscale_1x128x128_256x128x128x128_16x16_32x32_2x2_8x32x1_8x32x1_1x32x1x8_8_1x1_intrawave_v3,425.86,1091.69,0.0
256,1024,4096,7168,ck,0,0,63.9434,a8w8_blockscale_1x128x128_256x128x128x128_16x16_32x32_2x2_8x32x1_8x32x1_1x32x1x8_8_1x1_intrawave_v3,940.36,705.14,0.0
256,1024,4608,7168,cktile,11,0,85.0782,a8w8_blockscale_cktile_192x256x128_4x2x1_16x16x128_intrawave_0x1x0_1,795.1,585.43,0.0
256,1024,7168,256,cktile,10,0,11.2282,a8w8_blockscale_cktile_128x128x128_2x2x1_16x16x128_intrawave_0x1x0_2,334.7,1494.2,0.0
256,1024,7168,512,ck,0,0,15.4877,a8w8_blockscale_1x128x128_256x128x128x128_16x16_32x32_2x2_8x32x1_8x32x1_1x32x1x8_8_1x1_intrawave_v3,485.3,1218.67,0.0
256,1024,7168,2048,ck,0,0,34.0461,a8w8_blockscale_1x128x128_256x128x128x128_16x16_32x32_2x2_8x32x1_8x32x1_1x32x1x8_8_1x1_intrawave_v3,883.06,923.96,0.0
256,1024,7168,2304,ck,0,0,35.8476,a8w8_blockscale_1x128x128_256x128x128x128_16x16_32x32_2x2_8x32x1_8x32x1_1x32x1x8_8_1x1_intrawave_v3,943.52,936.03,0.0
256,1024,7168,4096,ck,0,0,63.147,a8w8_blockscale_1x128x128_256x128x128x128_16x16_32x32_2x2_8x32x1_8x32x1_1x32x1x8_8_1x1_intrawave_v3,952.22,763.84,0.0
256,1024,7168,4608,ck,0,0,71.2174,a8w8_blockscale_1x128x128_256x128x128x128_16x16_32x32_2x2_8x32x1_8x32x1_1x32x1x8_8_1x1_intrawave_v3,949.85,736.18,0.0
256,1024,7168,16384,ck,0,0,216.3222,a8w8_blockscale_1x128x128_256x128x128x128_16x16_32x32_2x2_8x32x1_8x32x1_1x32x1x8_8_1x1_intrawave_v3,1111.85,688.31,0.0
256,1024,7168,18432,ck,0,0,254.6017,a8w8_blockscale_1x128x128_256x128x128x128_16x16_32x32_2x2_8x32x1_8x32x1_1x32x1x8_8_1x1_intrawave_v3,1062.77,650.72,0.0
256,1024,8192,512,ck,0,0,15.952,a8w8_blockscale_1x128x128_256x128x128x128_16x16_32x32_2x2_8x32x1_8x32x1_1x32x1x8_8_1x1_intrawave_v3,538.49,1347.53,0.0
256,1024,8192,1536,ck,0,0,29.156,a8w8_blockscale_1x128x128_256x128x128x128_16x16_32x32_2x2_8x32x1_8x32x1_1x32x1x8_8_1x1_intrawave_v3,883.86,1060.95,0.0
256,1024,9216,7168,ck,0,0,145.827,a8w8_blockscale_1x128x128_256x128x128x128_16x16_32x32_2x2_8x32x1_8x32x1_1x32x1x8_8_1x1_intrawave_v3,927.75,632.77,0.0
256,1024,11264,1536,ck,0,0,42.788,a8w8_blockscale_1x128x128_256x128x128x128_16x16_32x32_2x2_8x32x1_8x32x1_1x32x1x8_8_1x1_intrawave_v3,828.12,980.25,0.0
256,1024,12288,1536,ck,0,0,45.7325,a8w8_blockscale_1x128x128_256x128x128x128_16x16_32x32_2x2_8x32x1_8x32x1_1x32x1x8_8_1x1_intrawave_v3,845.23,997.39,0.0
256,1024,14336,1536,ck,0,0,54.4605,a8w8_blockscale_1x128x128_256x128x128x128_16x16_32x32_2x2_8x32x1_8x32x1_1x32x1x8_8_1x1_intrawave_v3,828.07,972.32,0.0
256,1024,16384,512,ck,0,0,29.472,a8w8_blockscale_1x128x128_256x128x128x128_16x16_32x32_2x2_8x32x1_8x32x1_1x32x1x8_8_1x1_intrawave_v3,582.92,1440.94,0.0
256,1024,20480,1536,ck,0,0,74.004,a8w8_blockscale_1x128x128_256x128x128x128_16x16_32x32_2x2_8x32x1_8x32x1_1x32x1x8_8_1x1_intrawave_v3,870.55,1013.1,0.0
256,1024,24576,1536,ck,0,0,84.1555,a8w8_blockscale_1x128x128_256x128x128x128_16x16_32x32_2x2_8x32x1_8x32x1_1x32x1x8_8_1x1_intrawave_v3,918.65,1065.33,0.0
256,1024,32768,512,ck,0,0,54.7645,a8w8_blockscale_1x128x128_256x128x128x128_16x16_32x32_2x2_8x32x1_8x32x1_1x32x1x8_8_1x1_intrawave_v3,627.41,1541.33,0.0
256,1024,32768,1536,ck,0,0,109.5044,a8w8_blockscale_1x128x128_256x128x128x128_16x16_32x32_2x2_8x32x1_8x32x1_1x32x1x8_8_1x1_intrawave_v3,941.32,1086.84,0.0
256,1024,36864,7168,ck,0,0,454.1379,a8w8_blockscale_1x128x128_256x128x128x128_16x16_32x32_2x2_8x32x1_8x32x1_1x32x1x8_8_1x1_intrawave_v3,1191.63,764.26,0.0
256,1536,512,7168,ck,18,0,23.412,a8w8_blockscale_1x128x128_256x64x64x256_16x16_32x32_1x1_16x16x1_16x16x1_1x32x1x8_8_1x1_intrawave_v1,481.56,694.21,0.0
256,1536,576,7168,ck,18,0,24.205,a8w8_blockscale_1x128x128_256x64x64x256_16x16_32x32_1x1_16x16x1_16x16x1_1x32x1x8_8_1x1_intrawave_v1,524.01,698.55,0.0
256,1536,1536,7168,ck,18,0,52.7469,a8w8_blockscale_1x128x128_256x64x64x256_16x16_32x32_1x1_16x16x1_16x16x1_1x32x1x8_8_1x1_intrawave_v1,641.23,506.92,0.0
256,1536,3072,1536,ck,18,0,23.0151,a8w8_blockscale_1x128x128_256x64x64x256_16x16_32x32_1x1_16x16x1_16x16x1_1x32x1x8_8_1x1_intrawave_v1,629.83,717.58,0.0
256,1536,4096,512,ck,18,0,13.642,a8w8_blockscale_1x128x128_256x64x64x256_16x16_32x32_1x1_16x16x1_16x16x1_1x32x1x8_8_1x1_intrawave_v1,472.25,1133.74,0.0
256,1536,4608,7168,cktile,11,0,90.2343,a8w8_blockscale_cktile_192x256x128_4x2x1_16x16x128_intrawave_0x1x0_1,1124.5,644.94,0.0
256,1536,7168,256,cktile,10,0,13.3199,a8w8_blockscale_cktile_128x128x128_2x2x1_16x16x128_intrawave_0x1x0_2,423.21,1820.46,0.0
256,1536,7168,2048,ck,0,0,51.7061,a8w8_blockscale_1x128x128_256x128x128x128_16x16_32x32_2x2_8x32x1_8x32x1_1x32x1x8_8_1x1_intrawave_v3,872.18,770.62,0.0
256,1536,7168,2304,cktile,11,0,43.5424,a8w8_blockscale_cktile_192x256x128_4x2x1_16x16x128_intrawave_0x1x0_1,1165.17,966.28,0.0
256,2048,64,7168,ck,8,0,19.7903,a8w8_blockscale_1x128x128_256x16x64x256_16x16_16x16_1x1_16x16x1_16x16x1_1x16x1x16_4_1x1_intrawave_v1,94.95,778.21,0.0
256,2048,128,7168,ck,8,0,20.2497,a8w8_blockscale_1x128x128_256x16x64x256_16x16_16x16_1x1_16x16x1_16x16x1_1x16x1x16_4_1x1_intrawave_v1,185.59,796.15,0.0
256,2048,512,7168,ck,18,0,24.9633,a8w8_blockscale_1x128x128_256x64x64x256_16x16_32x32_1x1_16x16x1_16x16x1_1x32x1x8_8_1x1_intrawave_v1,602.18,819.09,0.0
256,2048,576,7168,ck,18,0,33.9564,a8w8_blockscale_1x128x128_256x64x64x256_16x16_32x32_1x1_16x16x1_16x16x1_1x32x1x8_8_1x1_intrawave_v1,498.03,623.39,0.0
256,2048,1024,7168,ck,18,0,42.9028,a8w8_blockscale_1x128x128_256x64x64x256_16x16_32x32_1x1_16x16x1_16x16x1_1x32x1x8_8_1x1_intrawave_v1,700.76,611.02,0.0
256,2048,1536,7168,ck,0,0,57.9353,a8w8_blockscale_1x128x128_256x128x128x128_16x16_32x32_2x2_8x32x1_8x32x1_1x32x1x8_8_1x1_intrawave_v3,778.41,552.02,0.0
256,2048,2112,7168,ck,2,0,88.3043,a8w8_blockscale_1x128x128_256x64x128x128_16x16_32x32_1x2_8x32x1_8x32x1_1x32x1x8_8_1x1_intrawave_v3,702.21,435.65,0.0
256,2048,2240,7168,ck,2,0,89.9975,a8w8_blockscale_1x128x128_256x64x128x128_16x16_32x32_1x2_8x32x1_8x32x1_1x32x1x8_8_1x1_intrawave_v3,730.76,443.47,0.0
256,2048,3072,1536,ck,0,0,25.9919,a8w8_blockscale_1x128x128_256x128x128x128_16x16_32x32_2x2_8x32x1_8x32x1_1x32x1x8_8_1x1_intrawave_v3,743.59,786.68,0.0
256,2048,4096,512,ck,0,0,15.9389,a8w8_blockscale_1x128x128_256x128x128x128_16x16_32x32_2x2_8x32x1_8x32x1_1x32x1x8_8_1x1_intrawave_v3,538.93,1249.96,0.0
256,2048,4096,7168,ck,0,0,114.7033,a8w8_blockscale_1x128x128_256x128x128x128_16x16_32x32_2x2_8x32x1_8x32x1_1x32x1x8_8_1x1_intrawave_v3,1048.44,530.21,0.0
256,2048,4608,7168,cktile,11,0,97.1032,a8w8_blockscale_cktile_192x256x128_4x2x1_16x16x128_intrawave_0x1x0_1,1393.28,685.71,0.0
256,2048,7168,256,cktile,10,0,18.4391,a8w8_blockscale_cktile_128x128x128_2x2x1_16x16x128_intrawave_0x1x0_2,407.62,1720.23,0.0
256,2048,7168,512,ck,0,0,27.0315,a8w8_blockscale_1x128x128_256x128x128x128_16x16_32x32_2x2_8x32x1_8x32x1_1x32x1x8_8_1x1_intrawave_v3,556.11,1260.7,0.0
256,2048,7168,2048,ck,0,0,68.5722,a8w8_blockscale_1x128x128_256x128x128x128_16x16_32x32_2x2_8x32x1_8x32x1_1x32x1x8_8_1x1_intrawave_v3,876.88,703.41,0.0
256,2048,7168,2304,ck,0,0,69.6842,a8w8_blockscale_1x128x128_256x128x128x128_16x16_32x32_2x2_8x32x1_8x32x1_1x32x1x8_8_1x1_intrawave_v3,970.75,726.04,0.0
256,2048,7168,4096,ck,0,0,118.0138,a8w8_blockscale_1x128x128_256x128x128x128_16x16_32x32_2x2_8x32x1_8x32x1_1x32x1x8_8_1x1_intrawave_v3,1019.03,568.65,0.0
256,2048,7168,4608,ck,0,0,128.9241,a8w8_blockscale_1x128x128_256x128x128x128_16x16_32x32_2x2_8x32x1_8x32x1_1x32x1x8_8_1x1_intrawave_v3,1049.39,557.13,0.0
256,2048,7168,16384,ck,0,0,415.9935,a8w8_blockscale_1x128x128_256x128x128x128_16x16_32x32_2x2_8x32x1_8x32x1_1x32x1x8_8_1x1_intrawave_v3,1156.36,433.55,0.0
256,2048,7168,18432,ck,0,0,473.0973,a8w8_blockscale_1x128x128_256x128x128x128_16x16_32x32_2x2_8x32x1_8x32x1_1x32x1x8_8_1x1_intrawave_v3,1143.88,421.12,0.0
256,2048,8192,512,ck,0,0,29.4968,a8w8_blockscale_1x128x128_256x128x128x128_16x16_32x32_2x2_8x32x1_8x32x1_1x32x1x8_8_1x1_intrawave_v3,582.43,1315.31,0.0
256,2048,8192,1536,ck,0,0,56.6629,a8w8_blockscale_1x128x128_256x128x128x128_16x16_32x32_2x2_8x32x1_8x32x1_1x32x1x8_8_1x1_intrawave_v3,909.58,869.76,0.0
256,2048,9216,7168,ck,0,0,243.3316,a8w8_blockscale_1x128x128_256x128x128x128_16x16_32x32_2x2_8x32x1_8x32x1_1x32x1x8_8_1x1_intrawave_v3,1111.99,486.94,0.0
256,2048,11264,1536,ck,0,0,78.2006,a8w8_blockscale_1x128x128_256x128x128x128_16x16_32x32_2x2_8x32x1_8x32x1_1x32x1x8_8_1x1_intrawave_v3,906.22,851.46,0.0
256,2048,12288,1536,ck,0,0,83.8143,a8w8_blockscale_1x128x128_256x128x128x128_16x16_32x32_2x2_8x32x1_8x32x1_1x32x1x8_8_1x1_intrawave_v3,922.39,863.24,0.0
256,2048,14336,1536,ck,0,0,96.0698,a8w8_blockscale_1x128x128_256x128x128x128_16x16_32x32_2x2_8x32x1_8x32x1_1x32x1x8_8_1x1_intrawave_v3,938.84,873.18,0.0
256,2048,16384,512,ck,0,0,55.3461,a8w8_blockscale_1x128x128_256x128x128x128_16x16_32x32_2x2_8x32x1_8x32x1_1x32x1x8_8_1x1_intrawave_v3,620.82,1383.04,0.0
256,2048,20480,1536,ck,0,0,132.3682,a8w8_blockscale_1x128x128_256x128x128x128_16x16_32x32_2x2_8x32x1_8x32x1_1x32x1x8_8_1x1_intrawave_v3,973.41,895.15,0.0
256,2048,24576,1536,ck,0,0,153.4331,a8w8_blockscale_1x128x128_256x128x128x128_16x16_32x32_2x2_8x32x1_8x32x1_1x32x1x8_8_1x1_intrawave_v3,1007.73,922.6,0.0
256,2048,32768,512,ck,0,0,103.5934,a8w8_blockscale_1x128x128_256x128x128x128_16x16_32x32_2x2_8x32x1_8x32x1_1x32x1x8_8_1x1_intrawave_v3,663.36,1467.7,0.0
256,2048,32768,1536,ck,0,0,196.9804,a8w8_blockscale_1x128x128_256x128x128x128_16x16_32x32_2x2_8x32x1_8x32x1_1x32x1x8_8_1x1_intrawave_v3,1046.59,952.86,0.0
256,2048,36864,7168,ck,0,0,870.6369,a8w8_blockscale_1x128x128_256x128x128x128_16x16_32x32_2x2_8x32x1_8x32x1_1x32x1x8_8_1x1_intrawave_v3,1243.15,493.8,0.0
256,4096,64,7168,ck,8,0,21.3467,a8w8_blockscale_1x128x128_256x16x64x256_16x16_16x16_1x1_16x16x1_16x16x1_1x16x1x16_4_1x1_intrawave_v1,176.05,1421.45,0.0
256,4096,128,7168,ck,18,0,23.7564,a8w8_blockscale_1x128x128_256x64x64x256_16x16_32x32_1x1_16x16x1_16x16x1_1x32x1x8_8_1x1_intrawave_v1,316.39,1318.64,0.0
256,4096,512,7168,ck,18,0,44.3253,a8w8_blockscale_1x128x128_256x64x64x256_16x16_32x32_1x1_16x16x1_16x16x1_1x32x1x8_8_1x1_intrawave_v1,678.28,839.8,0.0
256,4096,576,7168,ck,18,0,55.4301,a8w8_blockscale_1x128x128_256x64x64x256_16x16_32x32_1x1_16x16x1_16x16x1_1x32x1x8_8_1x1_intrawave_v1,610.19,689.29,0.0
256,4096,1024,7168,ck,0,0,66.6998,a8w8_blockscale_1x128x128_256x128x128x128_16x16_32x32_2x2_8x32x1_8x32x1_1x32x1x8_8_1x1_intrawave_v3,901.5,676.0,0.0
256,4096,1536,7168,cktile,11,0,90.0488,a8w8_blockscale_cktile_192x256x128_4x2x1_16x16x128_intrawave_0x1x0_1,1001.62,588.05,0.0
256,4096,2112,7168,ck,0,0,147.1835,a8w8_blockscale_1x128x128_256x128x128x128_16x16_32x32_2x2_8x32x1_8x32x1_1x32x1x8_8_1x1_intrawave_v3,842.6,419.89,0.0
256,4096,2240,7168,ck,0,0,147.1795,a8w8_blockscale_1x128x128_256x128x128x128_16x16_32x32_2x2_8x32x1_8x32x1_1x32x1x8_8_1x1_intrawave_v3,893.69,433.26,0.0
256,4096,3072,1536,ck,0,0,42.2397,a8w8_blockscale_1x128x128_256x128x128x128_16x16_32x32_2x2_8x32x1_8x32x1_1x32x1x8_8_1x1_intrawave_v3,915.13,856.44,0.0
256,4096,4096,512,ck,0,0,28.9648,a8w8_blockscale_1x128x128_256x128x128x128_16x16_32x32_2x2_8x32x1_8x32x1_1x32x1x8_8_1x1_intrawave_v3,593.13,1303.26,0.0
256,4096,4096,7168,ck,0,0,209.3355,a8w8_blockscale_1x128x128_256x128x128x128_16x16_32x32_2x2_8x32x1_8x32x1_1x32x1x8_8_1x1_intrawave_v3,1148.96,440.8,0.0
256,4096,4608,7168,cktile,11,0,186.6265,a8w8_blockscale_cktile_192x256x128_4x2x1_16x16x128_intrawave_0x1x0_1,1449.86,536.57,0.0
256,4096,7168,256,cktile,10,0,29.5555,a8w8_blockscale_cktile_128x128x128_2x2x1_16x16x128_intrawave_0x1x0_2,508.62,2084.34,0.0
256,4096,7168,512,ck,0,0,46.6829,a8w8_blockscale_1x128x128_256x128x128x128_16x16_32x32_2x2_8x32x1_8x32x1_1x32x1x8_8_1x1_intrawave_v3,644.02,1381.39,0.0
256,4096,7168,2048,ck,0,0,120.1982,a8w8_blockscale_1x128x128_256x128x128x128_16x16_32x32_2x2_8x32x1_8x32x1_1x32x1x8_8_1x1_intrawave_v3,1000.51,680.45,0.0
256,4096,7168,2304,cktile,11,0,117.9301,a8w8_blockscale_cktile_192x256x128_4x2x1_16x16x128_intrawave_0x1x0_1,1147.22,717.99,0.0
256,4096,7168,4096,ck,0,0,214.4016,a8w8_blockscale_1x128x128_256x128x128x128_16x16_32x32_2x2_8x32x1_8x32x1_1x32x1x8_8_1x1_intrawave_v3,1121.81,489.07,0.0
256,4096,7168,4608,ck,0,0,228.59,a8w8_blockscale_1x128x128_256x128x128x128_16x16_32x32_2x2_8x32x1_8x32x1_1x32x1x8_8_1x1_intrawave_v3,1183.7,483.94,0.0
256,4096,7168,16384,ck,0,0,765.3806,a8w8_blockscale_1x128x128_256x128x128x128_16x16_32x32_2x2_8x32x1_8x32x1_1x32x1x8_8_1x1_intrawave_v3,1256.99,317.84,0.0
256,4096,7168,18432,ck,0,0,881.3469,a8w8_blockscale_1x128x128_256x128x128x128_16x16_32x32_2x2_8x32x1_8x32x1_1x32x1x8_8_1x1_intrawave_v3,1228.04,302.19,0.0
256,4096,8192,512,ck,0,0,56.3409,a8w8_blockscale_1x128x128_256x128x128x128_16x16_32x32_2x2_8x32x1_8x32x1_1x32x1x8_8_1x1_intrawave_v3,609.85,1302.79,0.0
256,4096,8192,1536,ck,0,0,105.2588,a8w8_blockscale_1x128x128_256x128x128x128_16x16_32x32_2x2_8x32x1_8x32x1_1x32x1x8_8_1x1_intrawave_v3,979.29,816.87,0.0
256,4096,9216,7168,ck,0,0,442.5351,a8w8_blockscale_1x128x128_256x128x128x128_16x16_32x32_2x2_8x32x1_8x32x1_1x32x1x8_8_1x1_intrawave_v3,1222.88,386.22,0.0
256,4096,11264,1536,ck,0,0,142.0615,a8w8_blockscale_1x128x128_256x128x128x128_16x16_32x32_2x2_8x32x1_8x32x1_1x32x1x8_8_1x1_intrawave_v3,997.69,815.62,0.0
256,4096,12288,1536,ck,0,0,152.3699,a8w8_blockscale_1x128x128_256x128x128x128_16x16_32x32_2x2_8x32x1_8x32x1_1x32x1x8_8_1x1_intrawave_v3,1014.76,825.81,0.0
256,4096,14336,1536,ck,0,0,176.1737,a8w8_blockscale_1x128x128_256x128x128x128_16x16_32x32_2x2_8x32x1_8x32x1_1x32x1x8_8_1x1_intrawave_v3,1023.92,827.32,0.0
256,4096,16384,512,ck,0,0,103.9428,a8w8_blockscale_1x128x128_256x128x128x128_16x16_32x32_2x2_8x32x1_8x32x1_1x32x1x8_8_1x1_intrawave_v3,661.13,1392.15,0.0
256,4096,20480,1536,ck,0,0,238.3449,a8w8_blockscale_1x128x128_256x128x128x128_16x16_32x32_2x2_8x32x1_8x32x1_1x32x1x8_8_1x1_intrawave_v3,1081.2,862.28,0.0
256,4096,24576,1536,ck,0,0,282.6274,a8w8_blockscale_1x128x128_256x128x128x128_16x16_32x32_2x2_8x32x1_8x32x1_1x32x1x8_8_1x1_intrawave_v3,1094.15,868.16,0.0
256,4096,32768,512,ck,14,0,207.1159,a8w8_blockscale_1x128x128_256x64x256x128_16x16_32x32_2x2_8x32x1_8x32x1_1x32x1x8_8_1x1_intrawave_v1,663.58,1387.19,0.0
256,4096,32768,1536,ck,0,0,374.8153,a8w8_blockscale_1x128x128_256x128x128x128_16x16_32x32_2x2_8x32x1_8x32x1_1x32x1x8_8_1x1_intrawave_v3,1100.05,867.25,0.0
256,4096,36864,7168,ck,0,0,1703.9635,a8w8_blockscale_1x128x128_256x128x128x128_16x16_32x32_2x2_8x32x1_8x32x1_1x32x1x8_8_1x1_intrawave_v3,1270.37,349.53,0.0
256,6144,128,7168,ck,18,0,25.0579,a8w8_blockscale_1x128x128_256x64x64x256_16x16_32x32_1x1_16x16x1_16x16x1_1x32x1x8_8_1x1_intrawave_v1,449.93,1856.92,0.0
256,6144,512,7168,ck,0,0,59.4018,a8w8_blockscale_1x128x128_256x128x128x128_16x16_32x32_2x2_8x32x1_8x32x1_1x32x1x8_8_1x1_intrawave_v3,759.19,909.09,0.0
256,6144,1024,7168,ck,0,0,101.4656,a8w8_blockscale_1x128x128_256x128x128x128_16x16_32x32_2x2_8x32x1_8x32x1_1x32x1x8_8_1x1_intrawave_v3,888.92,630.39,0.0
256,6144,2112,7168,ck,0,0,191.3022,a8w8_blockscale_1x128x128_256x128x128x128_16x16_32x32_2x2_8x32x1_8x32x1_1x32x1x8_8_1x1_intrawave_v3,972.42,445.01,0.0
256,6144,2240,7168,ck,0,0,196.646,a8w8_blockscale_1x128x128_256x128x128x128_16x16_32x32_2x2_8x32x1_8x32x1_1x32x1x8_8_1x1_intrawave_v3,1003.33,445.58,0.0
256,6144,3072,1536,ck,0,0,67.303,a8w8_blockscale_1x128x128_256x128x128x128_16x16_32x32_2x2_8x32x1_8x32x1_1x32x1x8_8_1x1_intrawave_v3,861.51,771.21,0.0
256,6144,4096,512,ck,0,0,37.6611,a8w8_blockscale_1x128x128_256x128x128x128_16x16_32x32_2x2_8x32x1_8x32x1_1x32x1x8_8_1x1_intrawave_v3,684.26,1475.65,0.0
256,6144,4096,7168,ck,0,0,301.3996,a8w8_blockscale_1x128x128_256x128x128x128_16x16_32x32_2x2_8x32x1_8x32x1_1x32x1x8_8_1x1_intrawave_v3,1197.01,410.52,0.0
256,6144,4608,7168,ck,0,0,343.9947,a8w8_blockscale_1x128x128_256x128x128x128_16x16_32x32_2x2_8x32x1_8x32x1_1x32x1x8_8_1x1_intrawave_v3,1179.89,388.65,0.0
256,6144,7168,256,ck,17,0,51.0329,a8w8_blockscale_1x128x128_256x64x128x256_16x16_32x32_2x1_16x16x1_16x16x1_1x32x1x8_8_1x1_intrawave_v1,441.84,1792.73,0.0
256,6144,7168,512,ck,0,0,70.5242,a8w8_blockscale_1x128x128_256x128x128x128_16x16_32x32_2x2_8x32x1_8x32x1_1x32x1x8_8_1x1_intrawave_v3,639.46,1345.58,0.0
256,6144,7168,2048,ck,0,0,173.8221,a8w8_blockscale_1x128x128_256x128x128x128_16x16_32x32_2x2_8x32x1_8x32x1_1x32x1x8_8_1x1_intrawave_v3,1037.78,663.57,0.0
256,6144,7168,2304,ck,0,0,188.2806,a8w8_blockscale_1x128x128_256x128x128x128_16x16_32x32_2x2_8x32x1_8x32x1_1x32x1x8_8_1x1_intrawave_v3,1077.84,630.71,0.0
256,6144,7168,4096,ck,0,0,308.4794,a8w8_blockscale_1x128x128_256x128x128x128_16x16_32x32_2x2_8x32x1_8x32x1_1x32x1x8_8_1x1_intrawave_v3,1169.53,462.29,0.0
256,6144,7168,4608,ck,0,0,335.112,a8w8_blockscale_1x128x128_256x128x128x128_16x16_32x32_2x2_8x32x1_8x32x1_1x32x1x8_8_1x1_intrawave_v3,1211.16,445.89,0.0
256,6144,7168,16384,ck,0,0,1168.1975,a8w8_blockscale_1x128x128_256x128x128x128_16x16_32x32_2x2_8x32x1_8x32x1_1x32x1x8_8_1x1_intrawave_v3,1235.33,262.1,0.0
256,6144,7168,18432,ck,0,0,1354.1477,a8w8_blockscale_1x128x128_256x128x128x128_16x16_32x32_2x2_8x32x1_8x32x1_1x32x1x8_8_1x1_intrawave_v3,1198.91,246.24,0.0
256,6144,8192,512,ck,0,0,76.3779,a8w8_blockscale_1x128x128_256x128x128x128_16x16_32x32_2x2_8x32x1_8x32x1_1x32x1x8_8_1x1_intrawave_v3,674.8,1414.07,0.0
256,6144,8192,1536,ck,0,0,147.4517,a8w8_blockscale_1x128x128_256x128x128x128_16x16_32x32_2x2_8x32x1_8x32x1_1x32x1x8_8_1x1_intrawave_v3,1048.61,832.02,0.0
256,6144,9216,7168,ck,0,0,656.1595,a8w8_blockscale_1x128x128_256x128x128x128_16x16_32x32_2x2_8x32x1_8x32x1_1x32x1x8_8_1x1_intrawave_v3,1237.12,340.38,0.0
256,6144,11264,1536,ck,0,0,206.4783,a8w8_blockscale_1x128x128_256x128x128x128_16x16_32x32_2x2_8x32x1_8x32x1_1x32x1x8_8_1x1_intrawave_v3,1029.65,799.85,0.0
256,6144,12288,1536,ck,0,0,216.1487,a8w8_blockscale_1x128x128_256x128x128x128_16x16_32x32_2x2_8x32x1_8x32x1_1x32x1x8_8_1x1_intrawave_v3,1073.0,829.55,0.0
256,6144,14336,1536,ck,0,0,253.0583,a8w8_blockscale_1x128x128_256x128x128x128_16x16_32x32_2x2_8x32x1_8x32x1_1x32x1x8_8_1x1_intrawave_v3,1069.25,820.44,0.0
256,6144,16384,512,ck,0,0,141.5297,a8w8_blockscale_1x128x128_256x128x128x128_16x16_32x32_2x2_8x32x1_8x32x1_1x32x1x8_8_1x1_intrawave_v3,728.32,1504.0,0.0
256,6144,20480,1536,ck,0,0,353.1291,a8w8_blockscale_1x128x128_256x128x128x128_16x16_32x32_2x2_8x32x1_8x32x1_1x32x1x8_8_1x1_intrawave_v3,1094.63,828.46,0.0
256,6144,24576,1536,ck,0,0,417.451,a8w8_blockscale_1x128x128_256x128x128x128_16x16_32x32_2x2_8x32x1_8x32x1_1x32x1x8_8_1x1_intrawave_v3,1111.16,836.45,0.0
256,6144,32768,512,ck,0,0,270.6067,a8w8_blockscale_1x128x128_256x128x128x128_16x16_32x32_2x2_8x32x1_8x32x1_1x32x1x8_8_1x1_intrawave_v3,761.84,1561.59,0.0
256,6144,32768,1536,ck,0,0,552.4767,a8w8_blockscale_1x128x128_256x128x128x128_16x16_32x32_2x2_8x32x1_8x32x1_1x32x1x8_8_1x1_intrawave_v3,1119.46,837.0,0.0
256,6144,36864,7168,ck,0,0,2624.7153,a8w8_blockscale_1x128x128_256x128x128x128_16x16_32x32_2x2_8x32x1_8x32x1_1x32x1x8_8_1x1_intrawave_v3,1237.08,290.04,0.0
256,8192,64,7168,ck,18,0,25.7151,a8w8_blockscale_1x128x128_256x64x64x256_16x16_32x32_1x1_16x16x1_16x16x1_1x32x1x8_8_1x1_intrawave_v1,292.29,2342.11,0.0
256,8192,128,7168,ck,18,0,26.8171,a8w8_blockscale_1x128x128_256x64x64x256_16x16_32x32_1x1_16x16x1_16x16x1_1x32x1x8_8_1x1_intrawave_v1,560.55,2302.07,0.0
256,8192,576,7168,ck,0,0,89.2735,a8w8_blockscale_1x128x128_256x128x128x128_16x16_32x32_2x2_8x32x1_8x32x1_1x32x1x8_8_1x1_intrawave_v3,757.74,809.72,0.0
256,8192,1024,7168,ck,0,0,119.4233,a8w8_blockscale_1x128x128_256x128x128x128_16x16_32x32_2x2_8x32x1_8x32x1_1x32x1x8_8_1x1_intrawave_v3,1007.0,693.65,0.0
256,8192,1536,7168,cktile,11,0,158.9815,a8w8_blockscale_cktile_192x256x128_4x2x1_16x16x128_intrawave_0x1x0_1,1134.65,596.9,0.0
256,8192,2112,7168,ck,0,0,244.6785,a8w8_blockscale_1x128x128_256x128x128x128_16x16_32x32_2x2_8x32x1_8x32x1_1x32x1x8_8_1x1_intrawave_v3,1013.72,443.28,0.0
256,8192,2240,7168,ck,0,0,251.3925,a8w8_blockscale_1x128x128_256x128x128x128_16x16_32x32_2x2_8x32x1_8x32x1_1x32x1x8_8_1x1_intrawave_v3,1046.44,443.44,0.0
256,8192,3072,1536,ck,0,0,82.3211,a8w8_blockscale_1x128x128_256x128x128x128_16x16_32x32_2x2_8x32x1_8x32x1_1x32x1x8_8_1x1_intrawave_v3,939.12,821.58,0.0
256,8192,4096,512,ck,0,0,52.9601,a8w8_blockscale_1x128x128_256x128x128x128_16x16_32x32_2x2_8x32x1_8x32x1_1x32x1x8_8_1x1_intrawave_v3,648.79,1385.96,0.0
256,8192,4096,7168,ck,0,0,397.1364,a8w8_blockscale_1x128x128_256x128x128x128_16x16_32x32_2x2_8x32x1_8x32x1_1x32x1x8_8_1x1_intrawave_v3,1211.26,390.77,0.0
256,8192,4608,7168,cktile,11,0,328.9546,a8w8_blockscale_cktile_192x256x128_4x2x1_16x16x128_intrawave_0x1x0_1,1645.11,508.42,0.0
256,8192,7168,256,cktile,10,0,54.7017,a8w8_blockscale_cktile_128x128x128_2x2x1_16x16x128_intrawave_0x1x0_2,549.61,2218.81,0.0
256,8192,7168,512,ck,0,0,85.2883,a8w8_blockscale_1x128x128_256x128x128x128_16x16_32x32_2x2_8x32x1_8x32x1_1x32x1x8_8_1x1_intrawave_v3,705.02,1469.19,0.0
256,8192,7168,2048,ck,0,0,221.4286,a8w8_blockscale_1x128x128_256x128x128x128_16x16_32x32_2x2_8x32x1_8x32x1_1x32x1x8_8_1x1_intrawave_v3,1086.21,672.44,0.0
256,8192,7168,2304,cktile,11,0,199.6737,a8w8_blockscale_cktile_192x256x128_4x2x1_16x16x128_intrawave_0x1x0_1,1355.13,765.4,0.0
256,8192,7168,4096,ck,0,0,400.2668,a8w8_blockscale_1x128x128_256x128x128x128_16x16_32x32_2x2_8x32x1_8x32x1_1x32x1x8_8_1x1_intrawave_v3,1201.79,450.59,0.0
256,8192,7168,4608,ck,0,0,429.6035,a8w8_blockscale_1x128x128_256x128x128x128_16x16_32x32_2x2_8x32x1_8x32x1_1x32x1x8_8_1x1_intrawave_v3,1259.69,438.12,0.0
256,8192,7168,16384,ck,0,0,1550.6927,a8w8_blockscale_1x128x128_256x128x128x128_16x16_32x32_2x2_8x32x1_8x32x1_1x32x1x8_8_1x1_intrawave_v3,1240.83,238.02,0.0
256,8192,7168,18432,ck,0,0,1772.5296,a8w8_blockscale_1x128x128_256x128x128x128_16x16_32x32_2x2_8x32x1_8x32x1_1x32x1x8_8_1x1_intrawave_v3,1221.23,225.98,0.0
256,8192,8192,512,ck,0,0,102.7856,a8w8_blockscale_1x128x128_256x128x128x128_16x16_32x32_2x2_8x32x1_8x32x1_1x32x1x8_8_1x1_intrawave_v3,668.57,1387.42,0.0
256,8192,8192,1536,ck,0,0,195.7465,a8w8_blockscale_1x128x128_256x128x128x128_16x16_32x32_2x2_8x32x1_8x32x1_1x32x1x8_8_1x1_intrawave_v3,1053.19,814.23,0.0
256,8192,9216,7168,ck,0,0,854.4123,a8w8_blockscale_1x128x128_256x128x128x128_16x16_32x32_2x2_8x32x1_8x32x1_1x32x1x8_8_1x1_intrawave_v3,1266.76,322.77,0.0
256,8192,11264,1536,ck,0,0,258.0178,a8w8_blockscale_1x128x128_256x128x128x128_16x16_32x32_2x2_8x32x1_8x32x1_1x32x1x8_8_1x1_intrawave_v3,1098.64,831.08,0.0
256,8192,12288,1536,ck,0,0,285.766,a8w8_blockscale_1x128x128_256x128x128x128_16x16_32x32_2x2_8x32x1_8x32x1_1x32x1x8_8_1x1_intrawave_v3,1082.14,814.6,0.0
256,8192,14336,1536,ck,0,0,326.789,a8w8_blockscale_1x128x128_256x128x128x128_16x16_32x32_2x2_8x32x1_8x32x1_1x32x1x8_8_1x1_intrawave_v3,1104.01,824.64,0.0
256,8192,16384,512,ck,0,0,186.7906,a8w8_blockscale_1x128x128_256x128x128x128_16x16_32x32_2x2_8x32x1_8x32x1_1x32x1x8_8_1x1_intrawave_v3,735.79,1504.46,0.0
256,8192,20480,1536,ck,0,0,462.2371,a8w8_blockscale_1x128x128_256x128x128x128_16x16_32x32_2x2_8x32x1_8x32x1_1x32x1x8_8_1x1_intrawave_v3,1115.0,821.19,0.0
256,8192,24576,1536,ck,0,0,554.2004,a8w8_blockscale_1x128x128_256x128x128x128_16x16_32x32_2x2_8x32x1_8x32x1_1x32x1x8_8_1x1_intrawave_v3,1115.98,817.37,0.0
256,8192,32768,512,ck,0,0,369.0041,a8w8_blockscale_1x128x128_256x128x128x128_16x16_32x32_2x2_8x32x1_8x32x1_1x32x1x8_8_1x1_intrawave_v3,744.92,1511.75,0.0
256,8192,32768,1536,ck,0,0,733.9936,a8w8_blockscale_1x128x128_256x128x128x128_16x16_32x32_2x2_8x32x1_8x32x1_1x32x1x8_8_1x1_intrawave_v3,1123.49,817.15,0.0
256,8192,36864,7168,ck,0,0,3422.9083,a8w8_blockscale_1x128x128_256x128x128x128_16x16_32x32_2x2_8x32x1_8x32x1_1x32x1x8_8_1x1_intrawave_v3,1264.81,270.81,0.0
256,10240,128,7168,ck,18,0,42.6021,a8w8_blockscale_1x128x128_256x64x64x256_16x16_32x32_1x1_16x16x1_16x16x1_1x32x1x8_8_1x1_intrawave_v1,441.07,1806.0,0.0
256,10240,512,7168,ck,0,0,96.4596,a8w8_blockscale_1x128x128_256x128x128x128_16x16_32x32_2x2_8x32x1_8x32x1_1x32x1x8_8_1x1_intrawave_v3,779.21,907.7,0.0
256,10240,1024,7168,ck,0,0,152.8292,a8w8_blockscale_1x128x128_256x128x128x128_16x16_32x32_2x2_8x32x1_8x32x1_1x32x1x8_8_1x1_intrawave_v3,983.61,665.53,0.0
256,10240,2112,7168,ck,0,0,293.8003,a8w8_blockscale_1x128x128_256x128x128x128_16x16_32x32_2x2_8x32x1_8x32x1_1x32x1x8_8_1x1_intrawave_v3,1055.28,448.58,0.0
256,10240,2240,7168,ck,0,0,299.4981,a8w8_blockscale_1x128x128_256x128x128x128_16x16_32x32_2x2_8x32x1_8x32x1_1x32x1x8_8_1x1_intrawave_v3,1097.95,451.86,0.0
256,10240,3072,1536,ck,0,0,102.0072,a8w8_blockscale_1x128x128_256x128x128x128_16x16_32x32_2x2_8x32x1_8x32x1_1x32x1x8_8_1x1_intrawave_v3,947.35,817.21,0.0
256,10240,4096,512,ck,0,0,65.3698,a8w8_blockscale_1x128x128_256x128x128x128_16x16_32x32_2x2_8x32x1_8x32x1_1x32x1x8_8_1x1_intrawave_v3,657.03,1395.54,0.0
256,10240,4096,7168,ck,0,0,489.7941,a8w8_blockscale_1x128x128_256x128x128x128_16x16_32x32_2x2_8x32x1_8x32x1_1x32x1x8_8_1x1_intrawave_v3,1227.65,381.07,0.0
256,10240,4608,7168,ck,0,0,559.8326,a8w8_blockscale_1x128x128_256x128x128x128_16x16_32x32_2x2_8x32x1_8x32x1_1x32x1x8_8_1x1_intrawave_v3,1208.32,358.68,0.0
256,10240,7168,256,ck,18,0,81.5831,a8w8_blockscale_1x128x128_256x64x64x256_16x16_32x32_1x1_16x16x1_16x16x1_1x32x1x8_8_1x1_intrawave_v1,460.65,1854.02,0.0
256,10240,7168,512,ck,0,0,103.3089,a8w8_blockscale_1x128x128_256x128x128x128_16x16_32x32_2x2_8x32x1_8x32x1_1x32x1x8_8_1x1_intrawave_v3,727.55,1507.26,0.0
256,10240,7168,2048,ck,0,0,271.7203,a8w8_blockscale_1x128x128_256x128x128x128_16x16_32x32_2x2_8x32x1_8x32x1_1x32x1x8_8_1x1_intrawave_v3,1106.46,671.47,0.0
256,10240,7168,2304,ck,0,0,291.7057,a8w8_blockscale_1x128x128_256x128x128x128_16x16_32x32_2x2_8x32x1_8x32x1_1x32x1x8_8_1x1_intrawave_v3,1159.49,640.74,0.0
256,10240,7168,4096,ck,0,0,495.9389,a8w8_blockscale_1x128x128_256x128x128x128_16x16_32x32_2x2_8x32x1_8x32x1_1x32x1x8_8_1x1_intrawave_v3,1212.44,439.78,0.0
256,10240,7168,4608,ck,0,0,539.0377,a8w8_blockscale_1x128x128_256x128x128x128_16x16_32x32_2x2_8x32x1_8x32x1_1x32x1x8_8_1x1_intrawave_v3,1254.94,421.15,0.0
256,10240,7168,16384,ck,0,0,1973.8216,a8w8_blockscale_1x128x128_256x128x128x128_16x16_32x32_2x2_8x32x1_8x32x1_1x32x1x8_8_1x1_intrawave_v3,1218.54,218.87,0.0
256,10240,7168,18432,ck,0,0,2254.1382,a8w8_blockscale_1x128x128_256x128x128x128_16x16_32x32_2x2_8x32x1_8x32x1_1x32x1x8_8_1x1_intrawave_v3,1200.38,207.47,0.0
256,10240,8192,512,ck,0,0,118.4046,a8w8_blockscale_1x128x128_256x128x128x128_16x16_32x32_2x2_8x32x1_8x32x1_1x32x1x8_8_1x1_intrawave_v3,725.47,1496.64,0.0
256,10240,8192,1536,ck,0,0,238.501,a8w8_blockscale_1x128x128_256x128x128x128_16x16_32x32_2x2_8x32x1_8x32x1_1x32x1x8_8_1x1_intrawave_v3,1080.49,822.15,0.0
256,10240,9216,7168,ck,0,0,1079.1,a8w8_blockscale_1x128x128_256x128x128x128_16x16_32x32_2x2_8x32x1_8x32x1_1x32x1x8_8_1x1_intrawave_v3,1253.74,304.15,0.0
256,10240,11264,1536,ck,0,0,323.467,a8w8_blockscale_1x128x128_256x128x128x128_16x16_32x32_2x2_8x32x1_8x32x1_1x32x1x8_8_1x1_intrawave_v3,1095.43,815.28,0.0
256,10240,12288,1536,ck,0,0,353.3679,a8w8_blockscale_1x128x128_256x128x128x128_16x16_32x32_2x2_8x32x1_8x32x1_1x32x1x8_8_1x1_intrawave_v3,1093.89,810.09,0.0
256,10240,14336,1536,ck,0,0,409.667,a8w8_blockscale_1x128x128_256x128x128x128_16x16_32x32_2x2_8x32x1_8x32x1_1x32x1x8_8_1x1_intrawave_v3,1100.82,808.83,0.0
256,10240,16384,512,ck,0,0,225.2848,a8w8_blockscale_1x128x128_256x128x128x128_16x16_32x32_2x2_8x32x1_8x32x1_1x32x1x8_8_1x1_intrawave_v3,762.58,1549.93,0.0
256,10240,20480,1536,ck,0,0,576.4526,a8w8_blockscale_1x128x128_256x128x128x128_16x16_32x32_2x2_8x32x1_8x32x1_1x32x1x8_8_1x1_intrawave_v3,1117.6,809.46,0.0
256,10240,24576,1536,ck,0,0,688.7802,a8w8_blockscale_1x128x128_256x128x128x128_16x16_32x32_2x2_8x32x1_8x32x1_1x32x1x8_8_1x1_intrawave_v3,1122.41,808.38,0.0
256,10240,32768,512,ck,0,0,442.473,a8w8_blockscale_1x128x128_256x128x128x128_16x16_32x32_2x2_8x32x1_8x32x1_1x32x1x8_8_1x1_intrawave_v3,776.54,1566.44,0.0
256,10240,32768,1536,ck,0,0,917.7738,a8w8_blockscale_1x128x128_256x128x128x128_16x16_32x32_2x2_8x32x1_8x32x1_1x32x1x8_8_1x1_intrawave_v3,1123.14,803.19,0.0
256,10240,36864,7168,ck,0,0,4379.8448,a8w8_blockscale_1x128x128_256x128x128x128_16x16_32x32_2x2_8x32x1_8x32x1_1x32x1x8_8_1x1_intrawave_v3,1235.58,249.46,0.0
256,12288,128,7168,ck,18,0,44.9391,a8w8_blockscale_1x128x128_256x64x64x256_16x16_32x32_1x1_16x16x1_16x16x1_1x32x1x8_8_1x1_intrawave_v1,501.76,2050.41,0.0
256,12288,512,7168,ck,0,0,102.6049,a8w8_blockscale_1x128x128_256x128x128x128_16x16_32x32_2x2_8x32x1_8x32x1_1x32x1x8_8_1x1_intrawave_v3,879.04,1016.85,0.0
256,12288,1024,7168,ck,0,0,169.2973,a8w8_blockscale_1x128x128_256x128x128x128_16x16_32x32_2x2_8x32x1_8x32x1_1x32x1x8_8_1x1_intrawave_v3,1065.51,712.28,0.0
256,12288,2112,7168,ck,0,0,345.8506,a8w8_blockscale_1x128x128_256x128x128x128_16x16_32x32_2x2_8x32x1_8x32x1_1x32x1x8_8_1x1_intrawave_v3,1075.76,448.53,0.0
256,12288,2240,7168,ck,0,0,355.0943,a8w8_blockscale_1x128x128_256x128x128x128_16x16_32x32_2x2_8x32x1_8x32x1_1x32x1x8_8_1x1_intrawave_v3,1111.25,448.29,0.0
256,12288,3072,1536,ck,0,0,119.017,a8w8_blockscale_1x128x128_256x128x128x128_16x16_32x32_2x2_8x32x1_8x32x1_1x32x1x8_8_1x1_intrawave_v3,974.35,832.57,0.0
256,12288,4096,512,ck,0,0,77.2939,a8w8_blockscale_1x128x128_256x128x128x128_16x16_32x32_2x2_8x32x1_8x32x1_1x32x1x8_8_1x1_intrawave_v3,666.8,1410.87,0.0
256,12288,4096,7168,ck,0,0,579.5379,a8w8_blockscale_1x128x128_256x128x128x128_16x16_32x32_2x2_8x32x1_8x32x1_1x32x1x8_8_1x1_intrawave_v3,1245.05,376.34,0.0
256,12288,4608,7168,ck,0,0,655.5386,a8w8_blockscale_1x128x128_256x128x128x128_16x16_32x32_2x2_8x32x1_8x32x1_1x32x1x8_8_1x1_intrawave_v3,1238.29,357.5,0.0
256,12288,7168,256,cktile,6,0,94.972,a8w8_blockscale_cktile_128x128x128_2x2x1_16x16x32_intrawave_0x0x0x0_1,474.85,1907.31,0.0
256,12288,7168,512,ck,0,0,124.0238,a8w8_blockscale_1x128x128_256x128x128x128_16x16_32x32_2x2_8x32x1_8x32x1_1x32x1x8_8_1x1_intrawave_v3,727.23,1500.7,0.0
256,12288,7168,2048,ck,0,0,316.8378,a8w8_blockscale_1x128x128_256x128x128x128_16x16_32x32_2x2_8x32x1_8x32x1_1x32x1x8_8_1x1_intrawave_v3,1138.68,681.76,0.0
256,12288,7168,2304,ck,0,0,339.0438,a8w8_blockscale_1x128x128_256x128x128x128_16x16_32x32_2x2_8x32x1_8x32x1_1x32x1x8_8_1x1_intrawave_v3,1197.11,651.8,0.0
256,12288,7168,4096,ck,0,0,589.7397,a8w8_blockscale_1x128x128_256x128x128x128_16x16_32x32_2x2_8x32x1_8x32x1_1x32x1x8_8_1x1_intrawave_v3,1223.51,433.84,0.0
256,12288,7168,4608,ck,0,0,641.4615,a8w8_blockscale_1x128x128_256x128x128x128_16x16_32x32_2x2_8x32x1_8x32x1_1x32x1x8_8_1x1_intrawave_v3,1265.47,414.39,0.0
256,12288,7168,16384,ck,0,0,2340.9172,a8w8_blockscale_1x128x128_256x128x128x128_16x16_32x32_2x2_8x32x1_8x32x1_1x32x1x8_8_1x1_intrawave_v3,1232.94,211.42,0.0
256,12288,7168,18432,ck,0,0,2659.6084,a8w8_blockscale_1x128x128_256x128x128x128_16x16_32x32_2x2_8x32x1_8x32x1_1x32x1x8_8_1x1_intrawave_v3,1220.85,201.07,0.0
256,12288,8192,512,ck,0,0,138.724,a8w8_blockscale_1x128x128_256x128x128x128_16x16_32x32_2x2_8x32x1_8x32x1_1x32x1x8_8_1x1_intrawave_v3,743.05,1526.86,0.0
256,12288,8192,1536,ck,0,0,284.452,a8w8_blockscale_1x128x128_256x128x128x128_16x16_32x32_2x2_8x32x1_8x32x1_1x32x1x8_8_1x1_intrawave_v3,1087.13,818.36,0.0
256,12288,9216,7168,ck,0,0,1274.9958,a8w8_blockscale_1x128x128_256x128x128x128_16x16_32x32_2x2_8x32x1_8x32x1_1x32x1x8_8_1x1_intrawave_v3,1273.34,298.54,0.0
256,12288,11264,1536,ck,0,0,383.3207,a8w8_blockscale_1x128x128_256x128x128x128_16x16_32x32_2x2_8x32x1_8x32x1_1x32x1x8_8_1x1_intrawave_v3,1109.26,816.55,0.0
256,12288,12288,1536,ck,0,0,419.245,a8w8_blockscale_1x128x128_256x128x128x128_16x16_32x32_2x2_8x32x1_8x32x1_1x32x1x8_8_1x1_intrawave_v3,1106.41,810.36,0.0
256,12288,14336,1536,ck,0,0,485.2263,a8w8_blockscale_1x128x128_256x128x128x128_16x16_32x32_2x2_8x32x1_8x32x1_1x32x1x8_8_1x1_intrawave_v3,1115.29,810.38,0.0
256,12288,16384,512,ck,0,0,271.3271,a8w8_blockscale_1x128x128_256x128x128x128_16x16_32x32_2x2_8x32x1_8x32x1_1x32x1x8_8_1x1_intrawave_v3,759.82,1538.12,0.0
256,12288,20480,1536,ck,0,0,688.6851,a8w8_blockscale_1x128x128_256x128x128x128_16x16_32x32_2x2_8x32x1_8x32x1_1x32x1x8_8_1x1_intrawave_v3,1122.57,803.92,0.0
256,12288,24576,1536,ck,0,0,822.4186,a8w8_blockscale_1x128x128_256x128x128x128_16x16_32x32_2x2_8x32x1_8x32x1_1x32x1x8_8_1x1_intrawave_v3,1128.03,803.24,0.0
256,12288,32768,512,ck,0,0,530.0213,a8w8_blockscale_1x128x128_256x128x128x128_16x16_32x32_2x2_8x32x1_8x32x1_1x32x1x8_8_1x1_intrawave_v3,777.93,1562.91,0.0
256,12288,32768,1536,ck,0,0,1098.3661,a8w8_blockscale_1x128x128_256x128x128x128_16x16_32x32_2x2_8x32x1_8x32x1_1x32x1x8_8_1x1_intrawave_v3,1126.17,796.19,0.0
256,12288,36864,7168,ck,0,0,5132.2775,a8w8_blockscale_1x128x128_256x128x128x128_16x16_32x32_2x2_8x32x1_8x32x1_1x32x1x8_8_1x1_intrawave_v3,1265.32,245.17,0.0
256,14336,128,7168,ck,18,0,45.8225,a8w8_blockscale_1x128x128_256x64x64x256_16x16_32x32_1x1_16x16x1_16x16x1_1x32x1x8_8_1x1_intrawave_v1,574.1,2342.69,0.0
256,14336,512,7168,ck,0,0,117.1634,a8w8_blockscale_1x128x128_256x128x128x128_16x16_32x32_2x2_8x32x1_8x32x1_1x32x1x8_8_1x1_intrawave_v3,898.12,1033.69,0.0
256,14336,1024,7168,ck,0,0,203.2423,a8w8_blockscale_1x128x128_256x128x128x128_16x16_32x32_2x2_8x32x1_8x32x1_1x32x1x8_8_1x1_intrawave_v3,1035.48,686.18,0.0
256,14336,2112,7168,ck,0,0,392.9669,a8w8_blockscale_1x128x128_256x128x128x128_16x16_32x32_2x2_8x32x1_8x32x1_1x32x1x8_8_1x1_intrawave_v3,1104.57,454.12,0.0
256,14336,2240,7168,ck,0,0,405.9152,a8w8_blockscale_1x128x128_256x128x128x128_16x16_32x32_2x2_8x32x1_8x32x1_1x32x1x8_8_1x1_intrawave_v3,1134.15,450.94,0.0
256,14336,3072,1536,ck,0,0,140.8499,a8w8_blockscale_1x128x128_256x128x128x128_16x16_32x32_2x2_8x32x1_8x32x1_1x32x1x8_8_1x1_intrawave_v3,960.54,815.19,0.0
256,14336,4096,512,ck,0,0,89.2808,a8w8_blockscale_1x128x128_256x128x128x128_16x16_32x32_2x2_8x32x1_8x32x1_1x32x1x8_8_1x1_intrawave_v3,673.49,1421.11,0.0
256,14336,4096,7168,ck,0,0,673.4261,a8w8_blockscale_1x128x128_256x128x128x128_16x16_32x32_2x2_8x32x1_8x32x1_1x32x1x8_8_1x1_intrawave_v3,1250.05,370.58,0.0
256,14336,4608,7168,ck,0,0,761.4916,a8w8_blockscale_1x128x128_256x128x128x128_16x16_32x32_2x2_8x32x1_8x32x1_1x32x1x8_8_1x1_intrawave_v3,1243.66,351.82,0.0
256,14336,7168,256,ck,17,0,110.8353,a8w8_blockscale_1x128x128_256x64x128x256_16x16_32x32_2x1_16x16x1_16x16x1_1x32x1x8_8_1x1_intrawave_v1,474.7,1903.96,0.0
256,14336,7168,512,ck,0,0,143.1255,a8w8_blockscale_1x128x128_256x128x128x128_16x16_32x32_2x2_8x32x1_8x32x1_1x32x1x8_8_1x1_intrawave_v3,735.21,1512.87,0.0
256,14336,7168,2048,ck,0,0,373.5706,a8w8_blockscale_1x128x128_256x128x128x128_16x16_32x32_2x2_8x32x1_8x32x1_1x32x1x8_8_1x1_intrawave_v3,1126.71,668.04,0.0
256,14336,7168,2304,ck,0,0,401.7208,a8w8_blockscale_1x128x128_256x128x128x128_16x16_32x32_2x2_8x32x1_8x32x1_1x32x1x8_8_1x1_intrawave_v3,1178.73,634.93,0.0
256,14336,7168,4096,ck,0,0,693.9465,a8w8_blockscale_1x128x128_256x128x128x128_16x16_32x32_2x2_8x32x1_8x32x1_1x32x1x8_8_1x1_intrawave_v3,1213.08,423.09,0.0
256,14336,7168,4608,ck,0,0,749.6293,a8w8_blockscale_1x128x128_256x128x128x128_16x16_32x32_2x2_8x32x1_8x32x1_1x32x1x8_8_1x1_intrawave_v3,1263.34,406.35,0.0
256,14336,7168,16384,ck,14,0,2757.5464,a8w8_blockscale_1x128x128_256x64x256x128_16x16_32x32_2x2_8x32x1_8x32x1_1x32x1x8_8_1x1_intrawave_v1,1221.11,202.3,0.0
256,14336,7168,18432,ck,14,0,3142.0711,a8w8_blockscale_1x128x128_256x64x256x128_16x16_32x32_2x2_8x32x1_8x32x1_1x32x1x8_8_1x1_intrawave_v1,1205.63,191.56,0.0
256,14336,8192,512,ck,0,0,160.1493,a8w8_blockscale_1x128x128_256x128x128x128_16x16_32x32_2x2_8x32x1_8x32x1_1x32x1x8_8_1x1_intrawave_v3,750.92,1538.66,0.0
256,14336,8192,1536,ck,0,0,330.5132,a8w8_blockscale_1x128x128_256x128x128x128_16x16_32x32_2x2_8x32x1_8x32x1_1x32x1x8_8_1x1_intrawave_v3,1091.57,815.35,0.0
256,14336,9216,7168,ck,0,0,1501.6827,a8w8_blockscale_1x128x128_256x128x128x128_16x16_32x32_2x2_8x32x1_8x32x1_1x32x1x8_8_1x1_intrawave_v3,1261.31,288.38,0.0
256,14336,11264,1536,ck,0,0,446.7232,a8w8_blockscale_1x128x128_256x128x128x128_16x16_32x32_2x2_8x32x1_8x32x1_1x32x1x8_8_1x1_intrawave_v3,1110.46,810.98,0.0
256,14336,12288,1536,ck,0,0,485.1467,a8w8_blockscale_1x128x128_256x128x128x128_16x16_32x32_2x2_8x32x1_8x32x1_1x32x1x8_8_1x1_intrawave_v3,1115.47,810.51,0.0
256,14336,14336,1536,ck,0,0,568.5764,a8w8_blockscale_1x128x128_256x128x128x128_16x16_32x32_2x2_8x32x1_8x32x1_1x32x1x8_8_1x1_intrawave_v3,1110.42,800.39,0.0
256,14336,16384,512,ck,0,0,311.9278,a8w8_blockscale_1x128x128_256x128x128x128_16x16_32x32_2x2_8x32x1_8x32x1_1x32x1x8_8_1x1_intrawave_v3,771.07,1556.42,0.0
256,14336,20480,1536,ck,0,0,805.6795,a8w8_blockscale_1x128x128_256x128x128x128_16x16_32x32_2x2_8x32x1_8x32x1_1x32x1x8_8_1x1_intrawave_v3,1119.48,795.2,0.0
256,14336,24576,1536,ck,0,0,961.2433,a8w8_blockscale_1x128x128_256x128x128x128_16x16_32x32_2x2_8x32x1_8x32x1_1x32x1x8_8_1x1_intrawave_v3,1125.97,795.23,0.0
256,14336,32768,512,ck,0,0,610.1813,a8w8_blockscale_1x128x128_256x128x128x128_16x16_32x32_2x2_8x32x1_8x32x1_1x32x1x8_8_1x1_intrawave_v3,788.35,1579.27,0.0
256,14336,32768,1536,ck,0,0,1286.8515,a8w8_blockscale_1x128x128_256x128x128x128_16x16_32x32_2x2_8x32x1_8x32x1_1x32x1x8_8_1x1_intrawave_v3,1121.43,786.32,0.0
256,14336,36864,7168,ck,0,0,6133.919,a8w8_blockscale_1x128x128_256x128x128x128_16x16_32x32_2x2_8x32x1_8x32x1_1x32x1x8_8_1x1_intrawave_v3,1235.15,232.15,0.0
256,16384,64,7168,ck,18,0,32.1288,a8w8_blockscale_1x128x128_256x64x64x256_16x16_32x32_1x1_16x16x1_16x16x1_1x32x1x8_8_1x1_intrawave_v1,467.88,3734.86,0.0
256,16384,128,7168,ck,18,0,49.2013,a8w8_blockscale_1x128x128_256x64x64x256_16x16_32x32_1x1_16x16x1_16x16x1_1x32x1x8_8_1x1_intrawave_v1,611.06,2490.83,0.0
256,16384,576,7168,ck,0,0,153.6456,a8w8_blockscale_1x128x128_256x128x128x128_16x16_32x32_2x2_8x32x1_8x32x1_1x32x1x8_8_1x1_intrawave_v3,880.54,914.08,0.0
256,16384,1024,7168,ck,0,0,216.1688,a8w8_blockscale_1x128x128_256x128x128x128_16x16_32x32_2x2_8x32x1_8x32x1_1x32x1x8_8_1x1_intrawave_v3,1112.64,732.46,0.0
256,16384,1536,7168,cktile,11,0,256.6513,a8w8_blockscale_cktile_192x256x128_4x2x1_16x16x128_intrawave_0x1x0_1,1405.71,696.6,0.0
256,16384,2112,7168,ck,0,0,440.004,a8w8_blockscale_1x128x128_256x128x128x128_16x16_32x32_2x2_8x32x1_8x32x1_1x32x1x8_8_1x1_intrawave_v3,1127.42,458.6,0.0
256,16384,2240,7168,ck,0,0,460.4833,a8w8_blockscale_1x128x128_256x128x128x128_16x16_32x32_2x2_8x32x1_8x32x1_1x32x1x8_8_1x1_intrawave_v3,1142.57,449.3,0.0
256,16384,3072,1536,ck,0,0,155.5478,a8w8_blockscale_1x128x128_256x128x128x128_16x16_32x32_2x2_8x32x1_8x32x1_1x32x1x8_8_1x1_intrawave_v3,994.03,839.28,0.0
256,16384,4096,512,ck,0,0,101.0461,a8w8_blockscale_1x128x128_256x128x128x128_16x16_32x32_2x2_8x32x1_8x32x1_1x32x1x8_8_1x1_intrawave_v3,680.08,1432.05,0.0
256,16384,4096,7168,ck,0,0,766.1485,a8w8_blockscale_1x128x128_256x128x128x128_16x16_32x32_2x2_8x32x1_8x32x1_1x32x1x8_8_1x1_intrawave_v3,1255.73,366.79,0.0
256,16384,4608,7168,cktile,11,0,611.6269,a8w8_blockscale_cktile_192x256x128_4x2x1_16x16x128_intrawave_0x1x0_1,1769.59,492.89,0.0
256,16384,6144,1536,ck,0,0,292.1834,a8w8_blockscale_1x128x128_256x128x128x128_16x16_32x32_2x2_8x32x1_8x32x1_1x32x1x8_8_1x1_intrawave_v3,1058.37,807.47,0.0
256,16384,7168,256,cktile,10,0,101.2722,a8w8_blockscale_cktile_128x128x128_2x2x1_16x16x128_intrawave_0x1x0_2,593.74,2378.84,0.0
256,16384,7168,512,ck,0,0,164.8841,a8w8_blockscale_1x128x128_256x128x128x128_16x16_32x32_2x2_8x32x1_8x32x1_1x32x1x8_8_1x1_intrawave_v3,729.36,1497.66,0.0
256,16384,7168,2048,ck,0,0,421.5322,a8w8_blockscale_1x128x128_256x128x128x128_16x16_32x32_2x2_8x32x1_8x32x1_1x32x1x8_8_1x1_intrawave_v3,1141.16,671.63,0.0
256,16384,7168,2304,cktile,11,0,371.4356,a8w8_blockscale_cktile_192x256x128_4x2x1_16x16x128_intrawave_0x1x0_1,1456.96,778.45,0.0
256,16384,7168,4096,ck,0,0,781.7941,a8w8_blockscale_1x128x128_256x128x128x128_16x16_32x32_2x2_8x32x1_8x32x1_1x32x1x8_8_1x1_intrawave_v3,1230.6,423.83,0.0
256,16384,7168,4608,ck,0,0,849.4648,a8w8_blockscale_1x128x128_256x128x128x128_16x16_32x32_2x2_8x32x1_8x32x1_1x32x1x8_8_1x1_intrawave_v3,1274.13,404.26,0.0
256,16384,7168,16384,ck,14,0,3120.5605,a8w8_blockscale_1x128x128_256x64x256x128_16x16_32x32_2x2_8x32x1_8x32x1_1x32x1x8_8_1x1_intrawave_v1,1233.2,198.92,0.0
256,16384,7168,18432,ck,0,0,3571.7879,a8w8_blockscale_1x128x128_256x128x128x128_16x16_32x32_2x2_8x32x1_8x32x1_1x32x1x8_8_1x1_intrawave_v3,1212.09,187.3,0.0
256,16384,8192,512,ck,0,0,187.5611,a8w8_blockscale_1x128x128_256x128x128x128_16x16_32x32_2x2_8x32x1_8x32x1_1x32x1x8_8_1x1_intrawave_v3,732.77,1498.28,0.0
256,16384,8192,1536,ck,0,0,379.4481,a8w8_blockscale_1x128x128_256x128x128x128_16x16_32x32_2x2_8x32x1_8x32x1_1x32x1x8_8_1x1_intrawave_v3,1086.62,806.92,0.0
256,16384,9216,7168,ck,0,0,1691.9163,a8w8_blockscale_1x128x128_256x128x128x128_16x16_32x32_2x2_8x32x1_8x32x1_1x32x1x8_8_1x1_intrawave_v3,1279.42,286.95,0.0
256,16384,11264,1536,ck,0,0,507.1159,a8w8_blockscale_1x128x128_256x128x128x128_16x16_32x32_2x2_8x32x1_8x32x1_1x32x1x8_8_1x1_intrawave_v3,1117.96,811.58,0.0
256,16384,12288,1536,ck,14,0,631.8107,a8w8_blockscale_1x128x128_256x64x256x128_16x16_32x32_2x2_8x32x1_8x32x1_1x32x1x8_8_1x1_intrawave_v1,978.89,707.01,0.0
256,16384,14336,1536,ck,0,0,643.287,a8w8_blockscale_1x128x128_256x128x128x128_16x16_32x32_2x2_8x32x1_8x32x1_1x32x1x8_8_1x1_intrawave_v3,1121.67,803.6,0.0
256,16384,16384,512,ck,0,0,353.2954,a8w8_blockscale_1x128x128_256x128x128x128_16x16_32x32_2x2_8x32x1_8x32x1_1x32x1x8_8_1x1_intrawave_v3,778.04,1567.1,0.0
256,16384,20480,1536,ck,0,0,912.096,a8w8_blockscale_1x128x128_256x128x128x128_16x16_32x32_2x2_8x32x1_8x32x1_1x32x1x8_8_1x1_intrawave_v3,1130.14,797.85,0.0
256,16384,24576,1536,ck,0,0,1102.0997,a8w8_blockscale_1x128x128_256x128x128x128_16x16_32x32_2x2_8x32x1_8x32x1_1x32x1x8_8_1x1_intrawave_v3,1122.36,787.79,0.0
256,16384,32768,512,ck,0,0,709.5617,a8w8_blockscale_1x128x128_256x128x128x128_16x16_32x32_2x2_8x32x1_8x32x1_1x32x1x8_8_1x1_intrawave_v3,774.78,1548.71,0.0
256,16384,32768,1536,ck,0,0,1460.4078,a8w8_blockscale_1x128x128_256x128x128x128_16x16_32x32_2x2_8x32x1_8x32x1_1x32x1x8_8_1x1_intrawave_v3,1129.32,786.93,0.0
256,16384,36864,7168,ck,0,0,6870.8568,a8w8_blockscale_1x128x128_256x128x128x128_16x16_32x32_2x2_8x32x1_8x32x1_1x32x1x8_8_1x1_intrawave_v3,1260.2,231.36,0.0
256,20480,576,7168,cktile,11,0,181.5841,a8w8_blockscale_cktile_192x256x128_4x2x1_16x16x128_intrawave_0x1x0_1,931.33,961.11,0.0
256,20480,1536,7168,cktile,11,0,295.5655,a8w8_blockscale_cktile_192x256x128_4x2x1_16x16x128_intrawave_0x1x0_1,1525.79,746.79,0.0
256,20480,3072,1536,ck,0,0,186.8642,a8w8_blockscale_1x128x128_256x128x128x128_16x16_32x32_2x2_8x32x1_8x32x1_1x32x1x8_8_1x1_intrawave_v3,1034.3,866.97,0.0
256,20480,4096,512,ck,0,0,119.3033,a8w8_blockscale_1x128x128_256x128x128x128_16x16_32x32_2x2_8x32x1_8x32x1_1x32x1x8_8_1x1_intrawave_v3,720.01,1511.74,0.0
256,20480,4608,7168,cktile,11,0,772.5376,a8w8_blockscale_cktile_192x256x128_4x2x1_16x16x128_intrawave_0x1x0_1,1751.26,477.1,0.0
256,20480,7168,256,cktile,10,0,125.313,a8w8_blockscale_cktile_128x128x128_2x2x1_16x16x128_intrawave_0x1x0_2,599.79,2399.43,0.0
256,20480,7168,2048,ck,0,0,525.1612,a8w8_blockscale_1x128x128_256x128x128x128_16x16_32x32_2x2_8x32x1_8x32x1_1x32x1x8_8_1x1_intrawave_v3,1144.97,666.89,0.0
256,20480,7168,2304,cktile,11,0,470.5953,a8w8_blockscale_cktile_192x256x128_4x2x1_16x16x128_intrawave_0x1x0_1,1437.45,759.26,0.0
256,32768,64,7168,ck,18,0,58.767,a8w8_blockscale_1x128x128_256x64x64x256_16x16_32x32_1x1_16x16x1_16x16x1_1x32x1x8_8_1x1_intrawave_v1,511.59,4076.0,0.0
256,32768,128,7168,ck,0,0,74.5115,a8w8_blockscale_1x128x128_256x128x128x128_16x16_32x32_2x2_8x32x1_8x32x1_1x32x1x8_8_1x1_intrawave_v3,806.98,3277.17,0.0
256,32768,512,7168,ck,0,0,221.9247,a8w8_blockscale_1x128x128_256x128x128x128_16x16_32x32_2x2_8x32x1_8x32x1_1x32x1x8_8_1x1_intrawave_v3,1083.78,1226.12,0.0
256,32768,576,7168,ck,0,0,283.1964,a8w8_blockscale_1x128x128_256x128x128x128_16x16_32x32_2x2_8x32x1_8x32x1_1x32x1x8_8_1x1_intrawave_v3,955.46,977.27,0.0
256,32768,1024,7168,ck,0,0,408.8626,a8w8_blockscale_1x128x128_256x128x128x128_16x16_32x32_2x2_8x32x1_8x32x1_1x32x1x8_8_1x1_intrawave_v3,1176.52,756.56,0.0
256,32768,1536,7168,ck,0,0,603.4327,a8w8_blockscale_1x128x128_256x128x128x128_16x16_32x32_2x2_8x32x1_8x32x1_1x32x1x8_8_1x1_intrawave_v3,1195.75,574.3,0.0
256,32768,2112,7168,ck,0,0,871.7423,a8w8_blockscale_1x128x128_256x128x128x128_16x16_32x32_2x2_8x32x1_8x32x1_1x32x1x8_8_1x1_intrawave_v3,1138.11,445.58,0.0
256,32768,2240,7168,ck,0,0,908.3959,a8w8_blockscale_1x128x128_256x128x128x128_16x16_32x32_2x2_8x32x1_8x32x1_1x32x1x8_8_1x1_intrawave_v3,1158.38,437.85,0.0
256,32768,3072,1536,ck,0,0,287.9805,a8w8_blockscale_1x128x128_256x128x128x128_16x16_32x32_2x2_8x32x1_8x32x1_1x32x1x8_8_1x1_intrawave_v3,1073.81,890.26,0.0
256,32768,4096,512,ck,0,0,185.2578,a8w8_blockscale_1x128x128_256x128x128x128_16x16_32x32_2x2_8x32x1_8x32x1_1x32x1x8_8_1x1_intrawave_v3,741.88,1550.86,0.0
256,32768,4096,7168,ck,0,0,1522.6814,a8w8_blockscale_1x128x128_256x128x128x128_16x16_32x32_2x2_8x32x1_8x32x1_1x32x1x8_8_1x1_intrawave_v3,1263.66,349.83,0.0
256,32768,4608,7168,ck,0,0,1718.1765,a8w8_blockscale_1x128x128_256x128x128x128_16x16_32x32_2x2_8x32x1_8x32x1_1x32x1x8_8_1x1_intrawave_v3,1259.86,331.69,0.0
256,32768,6144,1536,ck,0,0,556.7669,a8w8_blockscale_1x128x128_256x128x128x128_16x16_32x32_2x2_8x32x1_8x32x1_1x32x1x8_8_1x1_intrawave_v3,1110.83,830.55,0.0
256,32768,7168,256,ck,17,0,239.5893,a8w8_blockscale_1x128x128_256x64x128x256_16x16_32x32_2x1_16x16x1_16x16x1_1x32x1x8_8_1x1_intrawave_v1,501.94,2003.37,0.0
256,32768,7168,512,ck,0,0,312.6371,a8w8_blockscale_1x128x128_256x128x128x128_16x16_32x32_2x2_8x32x1_8x32x1_1x32x1x8_8_1x1_intrawave_v3,769.32,1567.98,0.0
256,32768,7168,2048,ck,0,0,839.2502,a8w8_blockscale_1x128x128_256x128x128x128_16x16_32x32_2x2_8x32x1_8x32x1_1x32x1x8_8_1x1_intrawave_v3,1146.35,657.19,0.0
256,32768,7168,2304,ck,0,0,901.4207,a8w8_blockscale_1x128x128_256x128x128x128_16x16_32x32_2x2_8x32x1_8x32x1_1x32x1x8_8_1x1_intrawave_v3,1200.7,623.21,0.0
256,32768,7168,4096,ck,0,0,1563.4291,a8w8_blockscale_1x128x128_256x128x128x128_16x16_32x32_2x2_8x32x1_8x32x1_1x32x1x8_8_1x1_intrawave_v3,1230.72,405.1,0.0
256,32768,7168,4608,ck,0,0,1698.1904,a8w8_blockscale_1x128x128_256x128x128x128_16x16_32x32_2x2_8x32x1_8x32x1_1x32x1x8_8_1x1_intrawave_v3,1274.69,384.99,0.0
256,32768,7168,16384,ck,14,0,6284.8226,a8w8_blockscale_1x128x128_256x64x256x128_16x16_32x32_2x2_8x32x1_8x32x1_1x32x1x8_8_1x1_intrawave_v1,1224.63,178.86,0.0
256,32768,7168,18432,ck,0,0,7164.9308,a8w8_blockscale_1x128x128_256x128x128x128_16x16_32x32_2x2_8x32x1_8x32x1_1x32x1x8_8_1x1_intrawave_v3,1208.48,168.3,0.0
256,32768,8192,512,ck,0,0,360.9476,a8w8_blockscale_1x128x128_256x128x128x128_16x16_32x32_2x2_8x32x1_8x32x1_1x32x1x8_8_1x1_intrawave_v3,761.55,1545.49,0.0
256,32768,8192,1536,ck,0,0,737.4624,a8w8_blockscale_1x128x128_256x128x128x128_16x16_32x32_2x2_8x32x1_8x32x1_1x32x1x8_8_1x1_intrawave_v3,1118.2,813.31,0.0
256,32768,9216,7168,ck,0,0,3390.3276,a8w8_blockscale_1x128x128_256x128x128x128_16x16_32x32_2x2_8x32x1_8x32x1_1x32x1x8_8_1x1_intrawave_v3,1276.96,266.91,0.0
256,32768,11264,1536,ck,0,0,1005.4332,a8w8_blockscale_1x128x128_256x128x128x128_16x16_32x32_2x2_8x32x1_8x32x1_1x32x1x8_8_1x1_intrawave_v3,1127.74,801.48,0.0
256,32768,12288,1536,ck,0,0,1102.1362,a8w8_blockscale_1x128x128_256x128x128x128_16x16_32x32_2x2_8x32x1_8x32x1_1x32x1x8_8_1x1_intrawave_v3,1122.32,793.47,0.0
256,32768,14336,1536,ck,0,0,1285.2161,a8w8_blockscale_1x128x128_256x128x128x128_16x16_32x32_2x2_8x32x1_8x32x1_1x32x1x8_8_1x1_intrawave_v3,1122.85,787.32,0.0
256,32768,16384,512,ck,0,0,696.8117,a8w8_blockscale_1x128x128_256x128x128x128_16x16_32x32_2x2_8x32x1_8x32x1_1x32x1x8_8_1x1_intrawave_v3,788.96,1577.05,0.0
256,32768,20480,1536,ck,0,0,1826.5515,a8w8_blockscale_1x128x128_256x128x128x128_16x16_32x32_2x2_8x32x1_8x32x1_1x32x1x8_8_1x1_intrawave_v3,1128.68,779.59,0.0
256,32768,24576,1536,ck,0,0,2191.9056,a8w8_blockscale_1x128x128_256x128x128x128_16x16_32x32_2x2_8x32x1_8x32x1_1x32x1x8_8_1x1_intrawave_v3,1128.65,774.98,0.0
256,32768,32768,512,ck,0,0,1385.222,a8w8_blockscale_1x128x128_256x128x128x128_16x16_32x32_2x2_8x32x1_8x32x1_1x32x1x8_8_1x1_intrawave_v3,793.74,1574.5,0.0
256,32768,32768,1536,ck,0,0,2918.4955,a8w8_blockscale_1x128x128_256x128x128x128_16x16_32x32_2x2_8x32x1_8x32x1_1x32x1x8_8_1x1_intrawave_v3,1130.22,770.31,0.0
256,32768,36864,7168,ck,0,0,13742.3403,a8w8_blockscale_1x128x128_256x128x128x128_16x16_32x32_2x2_8x32x1_8x32x1_1x32x1x8_8_1x1_intrawave_v3,1260.14,212.12,0.0
256,65536,64,7168,ck,18,0,116.7699,a8w8_blockscale_1x128x128_256x64x64x256_16x16_32x32_1x1_16x16x1_16x16x1_1x32x1x8_8_1x1_intrawave_v1,514.94,4098.74,0.0
256,65536,128,7168,ck,0,0,150.0461,a8w8_blockscale_1x128x128_256x128x128x128_16x16_32x32_2x2_8x32x1_8x32x1_1x32x1x8_8_1x1_intrawave_v3,801.48,3248.71,0.0
256,65536,512,7168,ck,0,0,433.8532,a8w8_blockscale_1x128x128_256x128x128x128_16x16_32x32_2x2_8x32x1_8x32x1_1x32x1x8_8_1x1_intrawave_v3,1108.75,1245.91,0.0
256,65536,576,7168,ck,0,0,549.1106,a8w8_blockscale_1x128x128_256x128x128x128_16x16_32x32_2x2_8x32x1_8x32x1_1x32x1x8_8_1x1_intrawave_v3,985.53,1000.51,0.0
256,65536,1024,7168,ck,0,0,811.0309,a8w8_blockscale_1x128x128_256x128x128x128_16x16_32x32_2x2_8x32x1_8x32x1_1x32x1x8_8_1x1_intrawave_v3,1186.23,753.76,0.0
256,65536,1536,7168,ck,0,0,1197.6396,a8w8_blockscale_1x128x128_256x128x128x128_16x16_32x32_2x2_8x32x1_8x32x1_1x32x1x8_8_1x1_intrawave_v3,1204.96,569.54,0.0
256,65536,2112,7168,ck,0,0,1747.6676,a8w8_blockscale_1x128x128_256x128x128x128_16x16_32x32_2x2_8x32x1_8x32x1_1x32x1x8_8_1x1_intrawave_v3,1135.38,435.85,0.0
256,65536,2240,7168,ck,0,0,1819.0292,a8w8_blockscale_1x128x128_256x128x128x128_16x16_32x32_2x2_8x32x1_8x32x1_1x32x1x8_8_1x1_intrawave_v3,1156.95,428.48,0.0
256,65536,3072,1536,ck,0,0,566.2254,a8w8_blockscale_1x128x128_256x128x128x128_16x16_32x32_2x2_8x32x1_8x32x1_1x32x1x8_8_1x1_intrawave_v3,1092.28,897.23,0.0
256,65536,4096,512,ck,0,0,357.1801,a8w8_blockscale_1x128x128_256x128x128x128_16x16_32x32_2x2_8x32x1_8x32x1_1x32x1x8_8_1x1_intrawave_v3,769.58,1602.9,0.0
256,65536,4096,7168,ck,0,0,3044.3696,a8w8_blockscale_1x128x128_256x128x128x128_16x16_32x32_2x2_8x32x1_8x32x1_1x32x1x8_8_1x1_intrawave_v3,1264.07,340.3,0.0
256,65536,4608,7168,ck,0,0,3440.3879,a8w8_blockscale_1x128x128_256x128x128x128_16x16_32x32_2x2_8x32x1_8x32x1_1x32x1x8_8_1x1_intrawave_v3,1258.38,321.7,0.0
256,65536,6144,1536,ck,0,0,1111.303,a8w8_blockscale_1x128x128_256x128x128x128_16x16_32x32_2x2_8x32x1_8x32x1_1x32x1x8_8_1x1_intrawave_v3,1113.06,823.72,0.0
256,65536,7168,256,ck,17,0,469.6057,a8w8_blockscale_1x128x128_256x64x128x256_16x16_32x32_2x1_16x16x1_16x16x1_1x32x1x8_8_1x1_intrawave_v1,512.17,2040.3,0.0
256,65536,7168,512,ck,0,0,621.2778,a8w8_blockscale_1x128x128_256x128x128x128_16x16_32x32_2x2_8x32x1_8x32x1_1x32x1x8_8_1x1_intrawave_v3,774.27,1572.16,0.0
256,65536,7168,2048,ck,0,0,1669.8174,a8w8_blockscale_1x128x128_256x128x128x128_16x16_32x32_2x2_8x32x1_8x32x1_1x32x1x8_8_1x1_intrawave_v3,1152.31,651.82,0.0
256,65536,7168,2304,ck,0,0,1801.7363,a8w8_blockscale_1x128x128_256x128x128x128_16x16_32x32_2x2_8x32x1_8x32x1_1x32x1x8_8_1x1_intrawave_v3,1201.43,614.43,0.0
256,65536,7168,4096,ck,0,0,3121.4763,a8w8_blockscale_1x128x128_256x128x128x128_16x16_32x32_2x2_8x32x1_8x32x1_1x32x1x8_8_1x1_intrawave_v3,1232.84,396.39,0.0
256,65536,7168,4608,ck,0,0,3396.9431,a8w8_blockscale_1x128x128_256x128x128x128_16x16_32x32_2x2_8x32x1_8x32x1_1x32x1x8_8_1x1_intrawave_v3,1274.48,375.2,0.0
256,65536,7168,9216,ck,0,0,6850.537,a8w8_blockscale_1x128x128_256x128x128x128_16x16_32x32_2x2_8x32x1_8x32x1_1x32x1x8_8_1x1_intrawave_v3,1263.94,234.95,0.0
256,65536,7168,16384,ck,14,0,12648.1959,a8w8_blockscale_1x128x128_256x64x256x128_16x16_32x32_2x2_8x32x1_8x32x1_1x32x1x8_8_1x1_intrawave_v1,1217.02,168.46,0.0
256,65536,7168,18432,ck,0,0,14487.0676,a8w8_blockscale_1x128x128_256x128x128x128_16x16_32x32_2x2_8x32x1_8x32x1_1x32x1x8_8_1x1_intrawave_v3,1195.36,157.35,0.0
256,65536,8192,512,ck,0,0,704.0693,a8w8_blockscale_1x128x128_256x128x128x128_16x16_32x32_2x2_8x32x1_8x32x1_1x32x1x8_8_1x1_intrawave_v3,780.83,1578.67,0.0
256,65536,8192,1536,ck,0,0,1473.86,a8w8_blockscale_1x128x128_256x128x128x128_16x16_32x32_2x2_8x32x1_8x32x1_1x32x1x8_8_1x1_intrawave_v3,1119.01,805.36,0.0
256,65536,9216,7168,ck,0,0,6801.622,a8w8_blockscale_1x128x128_256x128x128x128_16x16_32x32_2x2_8x32x1_8x32x1_1x32x1x8_8_1x1_intrawave_v3,1273.03,256.38,0.0
256,65536,11264,1536,ck,0,0,2012.9804,a8w8_blockscale_1x128x128_256x128x128x128_16x16_32x32_2x2_8x32x1_8x32x1_1x32x1x8_8_1x1_intrawave_v3,1126.56,792.04,0.0
256,65536,12288,1536,ck,0,0,2193.6639,a8w8_blockscale_1x128x128_256x128x128x128_16x16_32x32_2x2_8x32x1_8x32x1_1x32x1x8_8_1x1_intrawave_v3,1127.75,788.7,0.0
256,65536,14336,1536,ck,0,0,2557.2449,a8w8_blockscale_1x128x128_256x128x128x128_16x16_32x32_2x2_8x32x1_8x32x1_1x32x1x8_8_1x1_intrawave_v3,1128.64,782.77,0.0
256,65536,16384,512,ck,0,0,1381.4369,a8w8_blockscale_1x128x128_256x128x128x128_16x16_32x32_2x2_8x32x1_8x32x1_1x32x1x8_8_1x1_intrawave_v3,795.92,1584.89,0.0
256,65536,20480,1536,ck,0,0,3667.0687,a8w8_blockscale_1x128x128_256x128x128x128_16x16_32x32_2x2_8x32x1_8x32x1_1x32x1x8_8_1x1_intrawave_v3,1124.38,768.05,0.0
256,65536,24576,1536,ck,0,0,4395.2438,a8w8_blockscale_1x128x128_256x128x128x128_16x16_32x32_2x2_8x32x1_8x32x1_1x32x1x8_8_1x1_intrawave_v3,1125.72,764.38,0.0
256,98304,7168,4096,ck,0,0,4674.1788,a8w8_blockscale_1x128x128_256x128x128x128_16x16_32x32_2x2_8x32x1_8x32x1_1x32x1x8_8_1x1_intrawave_v3,1234.96,393.93,0.0
256,98304,7168,4608,ck,0,0,5109.5656,a8w8_blockscale_1x128x128_256x128x128x128_16x16_32x32_2x2_8x32x1_8x32x1_1x32x1x8_8_1x1_intrawave_v3,1270.95,370.93,0.0
256,98304,7168,9216,ck,0,0,10298.6381,a8w8_blockscale_1x128x128_256x128x128x128_16x16_32x32_2x2_8x32x1_8x32x1_1x32x1x8_8_1x1_intrawave_v3,1261.14,231.23,0.0
256,98304,7168,16384,ck,14,0,18988.0904,a8w8_blockscale_1x128x128_256x64x256x128_16x16_32x32_2x2_8x32x1_8x32x1_1x32x1x8_8_1x1_intrawave_v1,1216.01,165.23,0.0
256,98304,7168,18432,ck,0,0,21900.1658,a8w8_blockscale_1x128x128_256x128x128x128_16x16_32x32_2x2_8x32x1_8x32x1_1x32x1x8_8_1x1_intrawave_v3,1186.11,153.12,0.0
256,98304,8192,512,ck,0,0,1045.7319,a8w8_blockscale_1x128x128_256x128x128x128_16x16_32x32_2x2_8x32x1_8x32x1_1x32x1x8_8_1x1_intrawave_v3,788.57,1592.32,0.0
256,98304,8192,1536,ck,0,0,2210.3452,a8w8_blockscale_1x128x128_256x128x128x128_16x16_32x32_2x2_8x32x1_8x32x1_1x32x1x8_8_1x1_intrawave_v3,1119.24,802.68,0.0
256,98304,9216,7168,ck,0,0,11103.0243,a8w8_blockscale_1x128x128_256x128x128x128_16x16_32x32_2x2_8x32x1_8x32x1_1x32x1x8_8_1x1_intrawave_v3,1169.77,232.61,0.0
256,98304,11264,1536,ck,0,0,3016.2181,a8w8_blockscale_1x128x128_256x128x128x128_16x16_32x32_2x2_8x32x1_8x32x1_1x32x1x8_8_1x1_intrawave_v3,1127.77,790.03,0.0
256,98304,12288,1536,ck,0,0,3304.3299,a8w8_blockscale_1x128x128_256x128x128x128_16x16_32x32_2x2_8x32x1_8x32x1_1x32x1x8_8_1x1_intrawave_v3,1123.03,782.55,0.0
256,98304,14336,1536,ck,0,0,3862.1384,a8w8_blockscale_1x128x128_256x128x128x128_16x16_32x32_2x2_8x32x1_8x32x1_1x32x1x8_8_1x1_intrawave_v3,1120.97,774.59,0.0
256,98304,16384,512,ck,0,0,2069.8943,a8w8_blockscale_1x128x128_256x128x128x128_16x16_32x32_2x2_8x32x1_8x32x1_1x32x1x8_8_1x1_intrawave_v3,796.79,1584.6,0.0
256,98304,20480,1536,ck,0,0,5509.1484,a8w8_blockscale_1x128x128_256x128x128x128_16x16_32x32_2x2_8x32x1_8x32x1_1x32x1x8_8_1x1_intrawave_v3,1122.63,764.0,0.0
256,131072,128,7168,ck,0,0,293.0508,a8w8_blockscale_1x128x128_256x128x128x128_16x16_32x32_2x2_8x32x1_8x32x1_1x32x1x8_8_1x1_intrawave_v3,820.74,3323.64,0.0
256,131072,512,7168,ck,0,0,868.8764,a8w8_blockscale_1x128x128_256x128x128x128_16x16_32x32_2x2_8x32x1_8x32x1_1x32x1x8_8_1x1_intrawave_v3,1107.26,1240.01,0.0
256,131072,576,7168,ck,0,0,1098.2965,a8w8_blockscale_1x128x128_256x128x128x128_16x16_32x32_2x2_8x32x1_8x32x1_1x32x1x8_8_1x1_intrawave_v3,985.46,996.68,0.0
256,131072,1024,7168,ck,0,0,1621.9678,a8w8_blockscale_1x128x128_256x128x128x128_16x16_32x32_2x2_8x32x1_8x32x1_1x32x1x8_8_1x1_intrawave_v3,1186.3,749.27,0.0
256,131072,1536,7168,ck,0,0,2398.578,a8w8_blockscale_1x128x128_256x128x128x128_16x16_32x32_2x2_8x32x1_8x32x1_1x32x1x8_8_1x1_intrawave_v3,1203.3,564.16,0.0
256,131072,2112,7168,ck,0,0,3554.4907,a8w8_blockscale_1x128x128_256x128x128x128_16x16_32x32_2x2_8x32x1_8x32x1_1x32x1x8_8_1x1_intrawave_v3,1116.49,424.34,0.0
256,131072,2240,7168,ck,0,0,3661.3121,a8w8_blockscale_1x128x128_256x128x128x128_16x16_32x32_2x2_8x32x1_8x32x1_1x32x1x8_8_1x1_intrawave_v3,1149.61,421.37,0.0
256,131072,3072,1536,ck,0,0,1129.3765,a8w8_blockscale_1x128x128_256x128x128x128_16x16_32x32_2x2_8x32x1_8x32x1_1x32x1x8_8_1x1_intrawave_v3,1095.25,895.5,0.0
256,131072,4096,512,ck,0,0,712.1968,a8w8_blockscale_1x128x128_256x128x128x128_16x16_32x32_2x2_8x32x1_8x32x1_1x32x1x8_8_1x1_intrawave_v3,771.92,1604.82,0.0
256,131072,4096,7168,ck,0,0,6120.1777,a8w8_blockscale_1x128x128_256x128x128x128_16x16_32x32_2x2_8x32x1_8x32x1_1x32x1x8_8_1x1_intrawave_v3,1257.57,333.75,0.0
256,131072,6144,1536,ck,0,0,2213.8353,a8w8_blockscale_1x128x128_256x128x128x128_16x16_32x32_2x2_8x32x1_8x32x1_1x32x1x8_8_1x1_intrawave_v3,1117.47,822.72,0.0
256,131072,7168,256,ck,17,0,935.1344,a8w8_blockscale_1x128x128_256x64x128x256_16x16_32x32_2x1_16x16x1_16x16x1_1x32x1x8_8_1x1_intrawave_v1,514.4,2047.23,0.0
256,131072,7168,512,ck,0,0,1234.1151,a8w8_blockscale_1x128x128_256x128x128x128_16x16_32x32_2x2_8x32x1_8x32x1_1x32x1x8_8_1x1_intrawave_v3,779.56,1579.94,0.0
256,131072,7168,2048,ck,0,0,3347.1523,a8w8_blockscale_1x128x128_256x128x128x128_16x16_32x32_2x2_8x32x1_8x32x1_1x32x1x8_8_1x1_intrawave_v3,1149.72,645.97,0.0
256,131072,7168,4096,ck,0,0,6253.5457,a8w8_blockscale_1x128x128_256x128x128x128_16x16_32x32_2x2_8x32x1_8x32x1_1x32x1x8_8_1x1_intrawave_v3,1230.75,391.02,0.0
256,131072,7168,4608,ck,0,0,6804.0431,a8w8_blockscale_1x128x128_256x128x128x128_16x16_32x32_2x2_8x32x1_8x32x1_1x32x1x8_8_1x1_intrawave_v3,1272.57,369.79,0.0
256,131072,7168,9216,ck,0,0,13765.4546,a8w8_blockscale_1x128x128_256x128x128x128_16x16_32x32_2x2_8x32x1_8x32x1_1x32x1x8_8_1x1_intrawave_v3,1258.03,229.06,0.0
256,131072,7168,16384,ck,14,0,25466.2799,a8w8_blockscale_1x128x128_256x64x256x128_16x16_32x32_2x2_8x32x1_8x32x1_1x32x1x8_8_1x1_intrawave_v1,1208.91,162.72,0.0
256,131072,7168,18432,ck,0,0,29448.4781,a8w8_blockscale_1x128x128_256x128x128x128_16x16_32x32_2x2_8x32x1_8x32x1_1x32x1x8_8_1x1_intrawave_v3,1176.11,150.33,0.0
256,131072,8192,512,ck,0,0,1408.0054,a8w8_blockscale_1x128x128_256x128x128x128_16x16_32x32_2x2_8x32x1_8x32x1_1x32x1x8_8_1x1_intrawave_v3,780.9,1575.84,0.0
256,131072,8192,1536,ck,0,0,2939.9522,a8w8_blockscale_1x128x128_256x128x128x128_16x16_32x32_2x2_8x32x1_8x32x1_1x32x1x8_8_1x1_intrawave_v3,1121.97,803.21,0.0
256,131072,9216,7168,ck,0,0,13718.4065,a8w8_blockscale_1x128x128_256x128x128x128_16x16_32x32_2x2_8x32x1_8x32x1_1x32x1x8_8_1x1_intrawave_v3,1262.34,249.41,0.0
256,131072,12288,1536,ck,0,0,4404.9134,a8w8_blockscale_1x128x128_256x128x128x128_16x16_32x32_2x2_8x32x1_8x32x1_1x32x1x8_8_1x1_intrawave_v3,1123.25,781.27,0.0
256,131072,14336,1536,ck,0,0,5136.8917,a8w8_blockscale_1x128x128_256x128x128x128_16x16_32x32_2x2_8x32x1_8x32x1_1x32x1x8_8_1x1_intrawave_v3,1123.72,775.07,0.0
