aiter/configs/model_configs/a8w8_blockscale_bpreshuffle_tuned_gemm_dsv3.csv
gfx,cu_num,M,N,K,libtype,kernelId,splitK,us,kernelName,tflops,bw,errRatio
gfx950,256,16,128,7168,asm,6,7,6.1485,_ZN5aiter42fp8gemm_bf16_blockscale_BpreShuffle_32x128E,4.78,168.54,0.0073
gfx950,256,32,128,7168,asm,7,8,6.3047,_ZN5aiter42fp8gemm_bf16_blockscale_BpreShuffle_32x128E,9.31,183.21,0.0012
gfx950,256,48,128,7168,asm,6,7,6.5243,_ZN5aiter42fp8gemm_bf16_blockscale_BpreShuffle_32x128E,13.5,195.25,0.0073
gfx950,256,64,128,7168,asm,7,8,6.337,_ZN5aiter42fp8gemm_bf16_blockscale_BpreShuffle_32x128E,18.53,219.76,0.0098
gfx950,256,80,128,7168,asm,7,8,8.0249,_ZN5aiter42fp8gemm_bf16_blockscale_BpreShuffle_32x128E,18.29,188.34,0.0045
gfx950,256,96,128,7168,asm,15,8,8.8365,_ZN5aiter42fp8gemm_bf16_blockscale_BpreShuffle_48x128E,19.94,184.49,0.0107
gfx950,256,112,128,7168,asm,6,7,7.6026,_ZN5aiter42fp8gemm_bf16_blockscale_BpreShuffle_32x128E,27.03,230.05,0.0042
gfx950,256,128,128,7168,asm,6,7,8.8728,_ZN5aiter42fp8gemm_bf16_blockscale_BpreShuffle_32x128E,26.47,210.51,0.0092
gfx950,256,144,128,7168,asm,7,8,8.0541,_ZN5aiter42fp8gemm_bf16_blockscale_BpreShuffle_32x128E,32.81,246.65,0.0111
gfx950,256,160,128,7168,asm,7,8,8.4521,_ZN5aiter42fp8gemm_bf16_blockscale_BpreShuffle_32x128E,34.74,249.09,0.0076
gfx950,256,176,128,7168,asm,23,8,7.9649,_ZN5aiter42fp8gemm_bf16_blockscale_BpreShuffle_64x128E,40.55,279.24,0.0048
gfx950,256,192,128,7168,asm,7,8,8.7548,_ZN5aiter42fp8gemm_bf16_blockscale_BpreShuffle_32x128E,40.24,267.61,0.0093
gfx950,256,208,128,7168,asm,7,8,7.5139,_ZN5aiter42fp8gemm_bf16_blockscale_BpreShuffle_32x128E,50.8,327.62,0.0117
gfx950,256,224,128,7168,asm,30,7,9.2902,_ZN5aiter42fp8gemm_bf16_blockscale_BpreShuffle_80x128E,44.24,277.76,0.0085
gfx950,256,240,128,7168,asm,7,8,9.2722,_ZN5aiter42fp8gemm_bf16_blockscale_BpreShuffle_32x128E,47.5,291.11,0.0119
gfx950,256,256,128,7168,asm,15,8,9.4713,_ZN5aiter42fp8gemm_bf16_blockscale_BpreShuffle_48x128E,49.6,297.54,0.0047
gfx950,256,288,128,7168,asm,15,8,8.3144,_ZN5aiter42fp8gemm_bf16_blockscale_BpreShuffle_48x128E,63.56,367.51,0.0025
gfx950,256,320,128,7168,asm,7,8,9.8117,_ZN5aiter42fp8gemm_bf16_blockscale_BpreShuffle_32x128E,59.85,335.64,0.0078
gfx950,256,352,128,7168,asm,7,8,9.4965,_ZN5aiter42fp8gemm_bf16_blockscale_BpreShuffle_32x128E,68.02,371.8,0.0046
gfx950,256,384,128,7168,asm,7,8,10.0883,_ZN5aiter42fp8gemm_bf16_blockscale_BpreShuffle_32x128E,69.85,373.53,0.0139
gfx950,256,416,128,7168,asm,7,8,10.1166,_ZN5aiter42fp8gemm_bf16_blockscale_BpreShuffle_32x128E,75.46,395.97,0.0081
gfx950,256,448,128,7168,asm,5,6,10.0989,_ZN5aiter42fp8gemm_bf16_blockscale_BpreShuffle_32x128E,81.4,420.19,0.0065
gfx950,256,480,128,7168,asm,31,8,9.5986,_ZN5aiter42fp8gemm_bf16_blockscale_BpreShuffle_80x128E,91.76,466.84,0.0125
gfx950,256,512,128,7168,asm,7,8,10.208,_ZN5aiter42fp8gemm_bf16_blockscale_BpreShuffle_32x128E,92.04,462.24,0.0076
gfx950,256,544,128,7168,asm,7,8,9.4877,_ZN5aiter42fp8gemm_bf16_blockscale_BpreShuffle_32x128E,105.21,522.38,0.0042
gfx950,256,576,128,7168,asm,7,8,9.4869,_ZN5aiter42fp8gemm_bf16_blockscale_BpreShuffle_32x128E,111.41,547.46,0.0102
gfx950,256,608,128,7168,asm,7,8,10.3885,_ZN5aiter42fp8gemm_bf16_blockscale_BpreShuffle_32x128E,107.4,522.82,0.0071
gfx950,256,640,128,7168,asm,7,8,9.5917,_ZN5aiter42fp8gemm_bf16_blockscale_BpreShuffle_32x128E,122.44,591.02,0.0014
gfx950,256,672,128,7168,asm,7,8,9.8577,_ZN5aiter42fp8gemm_bf16_blockscale_BpreShuffle_32x128E,125.09,599.17,0.005
gfx950,256,704,128,7168,asm,7,8,10.3689,_ZN5aiter42fp8gemm_bf16_blockscale_BpreShuffle_32x128E,124.59,592.54,0.0098
gfx950,256,736,128,7168,asm,7,8,10.5103,_ZN5aiter42fp8gemm_bf16_blockscale_BpreShuffle_32x128E,128.5,607.17,0.0015
gfx950,256,768,128,7168,asm,15,8,10.7333,_ZN5aiter42fp8gemm_bf16_blockscale_BpreShuffle_48x128E,131.3,616.69,0.002
gfx950,256,800,128,7168,asm,15,8,10.554,_ZN5aiter42fp8gemm_bf16_blockscale_BpreShuffle_48x128E,139.09,649.68,0.0109
gfx950,256,832,128,7168,asm,7,8,9.7953,_ZN5aiter42fp8gemm_bf16_blockscale_BpreShuffle_32x128E,155.86,724.25,0.0094
gfx950,256,864,128,7168,asm,7,8,10.7375,_ZN5aiter42fp8gemm_bf16_blockscale_BpreShuffle_32x128E,147.66,682.83,0.0101
gfx950,256,896,128,7168,asm,7,8,10.8442,_ZN5aiter42fp8gemm_bf16_blockscale_BpreShuffle_32x128E,151.62,698.01,0.0089
gfx950,256,928,128,7168,asm,15,8,11.0012,_ZN5aiter42fp8gemm_bf16_blockscale_BpreShuffle_48x128E,154.79,709.65,0.0108
gfx950,256,960,128,7168,asm,7,8,10.8867,_ZN5aiter42fp8gemm_bf16_blockscale_BpreShuffle_32x128E,161.81,738.93,0.0155
gfx950,256,992,128,7168,asm,7,8,11.0077,_ZN5aiter42fp8gemm_bf16_blockscale_BpreShuffle_32x128E,165.37,752.39,0.0145
gfx950,256,1024,128,7168,asm,7,8,9.6737,_ZN5aiter42fp8gemm_bf16_blockscale_BpreShuffle_32x128E,194.24,880.71,0.013
gfx950,256,1088,128,7168,asm,15,8,10.5533,_ZN5aiter42fp8gemm_bf16_blockscale_BpreShuffle_48x128E,189.18,852.32,0.0056
gfx950,256,1152,128,7168,asm,15,8,11.1072,_ZN5aiter42fp8gemm_bf16_blockscale_BpreShuffle_48x128E,190.32,852.6,0.0109
gfx950,256,1216,128,7168,asm,15,8,11.6079,_ZN5aiter42fp8gemm_bf16_blockscale_BpreShuffle_48x128E,192.23,856.75,0.0121
gfx950,256,1280,128,7168,asm,31,8,10.9477,_ZN5aiter42fp8gemm_bf16_blockscale_BpreShuffle_80x128E,214.55,951.82,0.0098
gfx950,256,1344,128,7168,asm,39,8,10.7369,_ZN5aiter42fp8gemm_bf16_blockscale_BpreShuffle_96x128E,229.7,1014.76,0.0017
gfx950,256,1408,128,7168,asm,15,8,10.2201,_ZN5aiter42fp8gemm_bf16_blockscale_BpreShuffle_48x128E,252.8,1112.56,0.009
gfx950,256,1472,128,7168,asm,14,7,11.8021,_ZN5aiter42fp8gemm_bf16_blockscale_BpreShuffle_48x128E,228.87,1003.69,0.0082
gfx950,256,1536,128,7168,asm,15,8,10.5213,_ZN5aiter42fp8gemm_bf16_blockscale_BpreShuffle_48x128E,267.89,1171.03,0.0109
gfx950,256,1600,128,7168,asm,22,7,12.0077,_ZN5aiter42fp8gemm_bf16_blockscale_BpreShuffle_64x128E,244.51,1065.64,0.0032
gfx950,256,1664,128,7168,asm,14,7,12.3669,_ZN5aiter42fp8gemm_bf16_blockscale_BpreShuffle_48x128E,246.91,1073.11,0.0067
gfx950,256,1728,128,7168,asm,31,8,12.5593,_ZN5aiter42fp8gemm_bf16_blockscale_BpreShuffle_80x128E,252.47,1094.5,0.0063
gfx950,256,1792,128,7168,asm,21,6,12.5025,_ZN5aiter42fp8gemm_bf16_blockscale_BpreShuffle_64x128E,263.01,1137.48,0.0064
gfx950,256,1856,128,7168,asm,13,6,12.1277,_ZN5aiter42fp8gemm_bf16_blockscale_BpreShuffle_48x128E,280.83,1211.81,0.0011
gfx950,256,1920,128,7168,asm,22,7,12.0941,_ZN5aiter42fp8gemm_bf16_blockscale_BpreShuffle_64x128E,291.32,1254.46,0.0058
gfx950,256,1984,128,7168,asm,29,6,12.2402,_ZN5aiter42fp8gemm_bf16_blockscale_BpreShuffle_80x128E,297.43,1278.31,0.0057
gfx950,256,2048,128,7168,asm,31,8,11.5875,_ZN5aiter42fp8gemm_bf16_blockscale_BpreShuffle_80x128E,324.32,1391.31,0.0105
gfx950,256,4096,128,7168,asm,18,3,16.9007,_ZN5aiter42fp8gemm_bf16_blockscale_BpreShuffle_64x128E,444.73,1853.55,0.0002
gfx950,256,8192,128,7168,ck,17,1,22.7549,a8w8_blockscale_bpreshuffle_1x128x128_256x64x64x256_16x16_16x16_16x16x1_16x16x1_1x32x1x8_8_2x1_intrawave_v1,660.62,2713.04,0.0
gfx950,256,16384,128,7168,asm,16,1,36.8278,_ZN5aiter42fp8gemm_bf16_blockscale_BpreShuffle_64x128E,816.36,3327.71,0.0
gfx950,256,32768,128,7168,asm,40,1,57.9434,_ZN5aiter43fp8gemm_bf16_blockscale_BpreShuffle_128x128E,1037.73,4214.24,0.0
gfx950,256,16,2112,7168,ck,7,3,17.369,a8w8_blockscale_bpreshuffle_1x128x128_256x16x64x256_16x16_16x16_16x16x1_16x16x1_1x16x1x16_4_1x1_intrawave_v1,27.89,882.09,0.0
gfx950,256,32,2112,7168,ck,7,1,17.1099,a8w8_blockscale_bpreshuffle_1x128x128_256x16x64x256_16x16_16x16_16x16x1_16x16x1_1x16x1x16_4_1x1_intrawave_v1,56.63,906.1,0.0
gfx950,256,48,2112,7168,ck,7,3,17.0967,a8w8_blockscale_bpreshuffle_1x128x128_256x16x64x256_16x16_16x16_16x16x1_16x16x1_1x16x1x16_4_1x1_intrawave_v1,85.01,917.47,0.0
gfx950,256,64,2112,7168,ck,7,1,16.6867,a8w8_blockscale_bpreshuffle_1x128x128_256x16x64x256_16x16_16x16_16x16x1_16x16x1_1x16x1x16_4_1x1_intrawave_v1,116.13,950.93,0.0
gfx950,256,80,2112,7168,ck,7,1,17.0679,a8w8_blockscale_bpreshuffle_1x128x128_256x16x64x256_16x16_16x16_16x16x1_16x16x1_1x16x1x16_4_1x1_intrawave_v1,141.92,940.37,0.0
gfx950,256,96,2112,7168,ck,7,2,16.9001,a8w8_blockscale_bpreshuffle_1x128x128_256x16x64x256_16x16_16x16_16x16x1_16x16x1_1x16x1x16_4_1x1_intrawave_v1,171.99,960.49,0.0
gfx950,256,112,2112,7168,ck,7,1,16.7774,a8w8_blockscale_bpreshuffle_1x128x128_256x16x64x256_16x16_16x16_16x16x1_16x16x1_1x16x1x16_4_1x1_intrawave_v1,202.12,978.38,0.0
gfx950,256,128,2112,7168,ck,7,1,16.8979,a8w8_blockscale_bpreshuffle_1x128x128_256x16x64x256_16x16_16x16_16x16x1_16x16x1_1x16x1x16_4_1x1_intrawave_v1,229.35,982.19,0.0
gfx950,256,144,2112,7168,ck,7,0,17.4362,a8w8_blockscale_bpreshuffle_1x128x128_256x16x64x256_16x16_16x16_16x16x1_16x16x1_1x16x1x16_4_1x1_intrawave_v1,250.05,962.32,0.0
gfx950,256,160,2112,7168,ck,12,3,18.1582,a8w8_blockscale_bpreshuffle_1x128x128_256x32x64x256_16x16_16x16_16x16x1_16x16x1_1x32x1x8_8_2x1_intrawave_v1,266.79,934.1,0.0
gfx950,256,176,2112,7168,ck,7,2,19.2838,a8w8_blockscale_bpreshuffle_1x128x128_256x16x64x256_16x16_16x16_16x16x1_16x16x1_1x16x1x16_4_1x1_intrawave_v1,276.34,889.03,0.0
gfx950,256,192,2112,7168,ck,12,2,18.0709,a8w8_blockscale_bpreshuffle_1x128x128_256x32x64x256_16x16_16x16_16x16x1_16x16x1_1x32x1x8_8_2x1_intrawave_v1,321.69,958.78,0.0
gfx950,256,208,2112,7168,ck,7,2,19.4853,a8w8_blockscale_bpreshuffle_1x128x128_256x16x64x256_16x16_16x16_16x16x1_16x16x1_1x16x1x16_4_1x1_intrawave_v1,323.21,898.54,0.0
gfx950,256,224,2112,7168,ck,12,1,18.1425,a8w8_blockscale_bpreshuffle_1x128x128_256x32x64x256_16x16_16x16_16x16x1_16x16x1_1x32x1x8_8_2x1_intrawave_v1,373.83,975.09,0.0
gfx950,256,240,2112,7168,ck,7,1,20.222,a8w8_blockscale_bpreshuffle_1x128x128_256x16x64x256_16x16_16x16_16x16x1_16x16x1_1x16x1x16_4_1x1_intrawave_v1,359.34,883.83,0.0
gfx950,256,256,2112,7168,ck,12,3,19.3304,a8w8_blockscale_bpreshuffle_1x128x128_256x32x64x256_16x16_16x16_16x16x1_16x16x1_1x32x1x8_8_2x1_intrawave_v1,400.98,934.03,0.0
gfx950,256,288,2112,7168,ck,12,0,19.761,a8w8_blockscale_bpreshuffle_1x128x128_256x32x64x256_16x16_16x16_16x16x1_16x16x1_1x32x1x8_8_2x1_intrawave_v1,441.27,932.12,0.0
gfx950,256,320,2112,7168,ck,17,1,21.3295,a8w8_blockscale_bpreshuffle_1x128x128_256x64x64x256_16x16_16x16_16x16x1_16x16x1_1x32x1x8_8_2x1_intrawave_v1,454.25,880.67,0.0
gfx950,256,352,2112,7168,ck,17,0,22.1299,a8w8_blockscale_bpreshuffle_1x128x128_256x64x64x256_16x16_16x16_16x16x1_16x16x1_1x32x1x8_8_2x1_intrawave_v1,481.6,865.29,0.0
gfx950,256,384,2112,7168,ck,17,3,21.2294,a8w8_blockscale_bpreshuffle_1x128x128_256x64x64x256_16x16_16x16_16x16x1_16x16x1_1x32x1x8_8_2x1_intrawave_v1,547.67,919.17,0.0
gfx950,256,416,2112,7168,ck,17,2,22.3197,a8w8_blockscale_bpreshuffle_1x128x128_256x64x64x256_16x16_16x16_16x16x1_16x16x1_1x32x1x8_8_2x1_intrawave_v1,564.32,890.6,0.0
gfx950,256,448,2112,7168,ck,17,3,21.3596,a8w8_blockscale_bpreshuffle_1x128x128_256x64x64x256_16x16_16x16_16x16x1_16x16x1_1x32x1x8_8_2x1_intrawave_v1,635.05,947.7,0.0
gfx950,256,480,2112,7168,ck,12,1,23.7782,a8w8_blockscale_bpreshuffle_1x128x128_256x32x64x256_16x16_16x16_16x16x1_16x16x1_1x32x1x8_8_2x1_intrawave_v1,611.2,866.63,0.0
gfx950,256,512,2112,7168,ck,17,1,28.0778,a8w8_blockscale_bpreshuffle_1x128x128_256x64x64x256_16x16_16x16_16x16x1_16x16x1_1x32x1x8_8_2x1_intrawave_v1,552.11,746.91,0.0
gfx950,256,544,2112,7168,ck,17,0,29.6478,a8w8_blockscale_bpreshuffle_1x128x128_256x64x64x256_16x16_16x16_16x16x1_16x16x1_1x32x1x8_8_2x1_intrawave_v1,555.56,719.65,0.0
gfx950,256,576,2112,7168,ck,17,0,28.8581,a8w8_blockscale_bpreshuffle_1x128x128_256x64x64x256_16x16_16x16_16x16x1_16x16x1_1x32x1x8_8_2x1_intrawave_v1,604.33,751.98,0.0
gfx950,256,608,2112,7168,ck,12,0,30.6611,a8w8_blockscale_bpreshuffle_1x128x128_256x32x64x256_16x16_16x16_16x16x1_16x16x1_1x32x1x8_8_2x1_intrawave_v1,600.4,719.65,0.0
gfx950,256,640,2112,7168,ck,10,2,30.8536,a8w8_blockscale_bpreshuffle_1x128x128_256x32x64x128_16x16_16x16_8x32x1_8x32x1_1x32x1x8_8_2x1_intrawave_v1,628.05,726.97,0.0201
gfx950,256,672,2112,7168,ck,17,0,32.1211,a8w8_blockscale_bpreshuffle_1x128x128_256x64x64x256_16x16_16x16_16x16x1_16x16x1_1x32x1x8_8_2x1_intrawave_v1,633.43,709.63,0.0
gfx950,256,704,2112,7168,ck,17,0,31.5718,a8w8_blockscale_bpreshuffle_1x128x128_256x64x64x256_16x16_16x16_16x16x1_16x16x1_1x32x1x8_8_2x1_intrawave_v1,675.14,733.53,0.0
gfx950,256,736,2112,7168,ck,17,1,31.4913,a8w8_blockscale_bpreshuffle_1x128x128_256x64x64x256_16x16_16x16_16x16x1_16x16x1_1x32x1x8_8_2x1_intrawave_v1,707.63,746.98,0.0
gfx950,256,768,2112,7168,ck,17,3,31.0549,a8w8_blockscale_bpreshuffle_1x128x128_256x64x64x256_16x16_16x16_16x16x1_16x16x1_1x32x1x8_8_2x1_intrawave_v1,748.78,769.21,0.0
gfx950,256,800,2112,7168,ck,17,3,32.8542,a8w8_blockscale_bpreshuffle_1x128x128_256x64x64x256_16x16_16x16_16x16x1_16x16x1_1x32x1x8_8_2x1_intrawave_v1,737.26,738.18,0.0
gfx950,256,832,2112,7168,ck,17,0,32.1611,a8w8_blockscale_bpreshuffle_1x128x128_256x64x64x256_16x16_16x16_16x16x1_16x16x1_1x32x1x8_8_2x1_intrawave_v1,783.28,765.43,0.0
gfx950,256,864,2112,7168,ck,17,0,33.1831,a8w8_blockscale_bpreshuffle_1x128x128_256x64x64x256_16x16_16x16_16x16x1_16x16x1_1x32x1x8_8_2x1_intrawave_v1,788.35,752.84,0.0
gfx950,256,896,2112,7168,ck,17,3,32.5403,a8w8_blockscale_bpreshuffle_1x128x128_256x64x64x256_16x16_16x16_16x16x1_16x16x1_1x32x1x8_8_2x1_intrawave_v1,833.7,778.91,0.0
gfx950,256,928,2112,7168,ck,17,1,34.0573,a8w8_blockscale_bpreshuffle_1x128x128_256x64x64x256_16x16_16x16_16x16x1_16x16x1_1x32x1x8_8_2x1_intrawave_v1,825.01,754.92,0.0
gfx950,256,960,2112,7168,ck,17,0,33.349,a8w8_blockscale_bpreshuffle_1x128x128_256x64x64x256_16x16_16x16_16x16x1_16x16x1_1x32x1x8_8_2x1_intrawave_v1,871.59,781.89,0.0
gfx950,256,992,2112,7168,ck,15,2,41.9166,a8w8_blockscale_bpreshuffle_1x128x128_256x64x64x128_16x16_16x16_8x32x1_8x32x1_1x32x1x8_8_2x1_intrawave_v1,716.55,630.77,0.0175
gfx950,256,1024,2112,7168,ck,15,2,41.7085,a8w8_blockscale_bpreshuffle_1x128x128_256x64x64x128_16x16_16x16_8x32x1_8x32x1_1x32x1x8_8_2x1_intrawave_v1,743.36,642.66,0.0022
gfx950,256,1088,2112,7168,ck,15,1,40.9809,a8w8_blockscale_bpreshuffle_1x128x128_256x64x64x128_16x16_16x16_8x32x1_8x32x1_1x32x1x8_8_2x1_intrawave_v1,803.84,671.86,0.0036
gfx950,256,1152,2112,7168,ck,15,0,40.8235,a8w8_blockscale_bpreshuffle_1x128x128_256x64x64x128_16x16_16x16_8x32x1_8x32x1_1x32x1x8_8_2x1_intrawave_v1,854.41,692.31,0.0036
gfx950,256,1216,2112,7168,ck,15,3,42.2342,a8w8_blockscale_bpreshuffle_1x128x128_256x64x64x128_16x16_16x16_8x32x1_8x32x1_1x32x1x8_8_2x1_intrawave_v1,871.75,686.45,0.0044
gfx950,256,1280,2112,7168,ck,15,1,43.6734,a8w8_blockscale_bpreshuffle_1x128x128_256x64x64x128_16x16_16x16_8x32x1_8x32x1_1x32x1x8_8_2x1_intrawave_v1,887.39,680.52,0.0042
gfx950,256,1344,2112,7168,ck,15,1,45.0358,a8w8_blockscale_bpreshuffle_1x128x128_256x64x64x128_16x16_16x16_8x32x1_8x32x1_1x32x1x8_8_2x1_intrawave_v1,903.57,676.12,0.0055
gfx950,256,1408,2112,7168,ck,15,0,46.1981,a8w8_blockscale_bpreshuffle_1x128x128_256x64x64x128_16x16_16x16_8x32x1_8x32x1_1x32x1x8_8_2x1_intrawave_v1,922.78,674.89,0.0058
gfx950,256,1472,2112,7168,ck,15,0,46.921,a8w8_blockscale_bpreshuffle_1x128x128_256x64x64x128_16x16_16x16_8x32x1_8x32x1_1x32x1x8_8_2x1_intrawave_v1,949.87,680.03,0.0064
gfx950,256,1536,2112,7168,ck,17,0,55.8902,a8w8_blockscale_bpreshuffle_1x128x128_256x64x64x256_16x16_16x16_16x16x1_16x16x1_1x32x1x8_8_2x1_intrawave_v1,832.1,583.95,0.0
gfx950,256,1600,2112,7168,ck,15,2,56.4283,a8w8_blockscale_bpreshuffle_1x128x128_256x64x64x128_16x16_16x16_8x32x1_8x32x1_1x32x1x8_8_2x1_intrawave_v1,858.51,591.3,0.0067
gfx950,256,1664,2112,7168,ck,2,2,57.368,a8w8_blockscale_bpreshuffle_1x128x128_256x64x64x128_16x16_16x16_8x32x1_8x32x1_1x32x1x8_8_2x1_intrawave_v3,878.22,594.32,0.0004
gfx950,256,1728,2112,7168,ck,15,1,57.7674,a8w8_blockscale_bpreshuffle_1x128x128_256x64x64x128_16x16_16x16_8x32x1_8x32x1_1x32x1x8_8_2x1_intrawave_v1,905.7,602.83,0.0078
gfx950,256,1792,2112,7168,ck,2,1,59.3469,a8w8_blockscale_bpreshuffle_1x128x128_256x64x64x128_16x16_16x16_8x32x1_8x32x1_1x32x1x8_8_2x1_intrawave_v3,914.24,599.08,0.0006
gfx950,256,1856,2112,7168,ck,15,3,60.2407,a8w8_blockscale_bpreshuffle_1x128x128_256x64x64x128_16x16_16x16_8x32x1_8x32x1_1x32x1x8_8_2x1_intrawave_v1,932.85,602.29,0.0081
gfx950,256,1920,2112,7168,ck,15,1,62.5154,a8w8_blockscale_bpreshuffle_1x128x128_256x64x64x128_16x16_16x16_8x32x1_8x32x1_1x32x1x8_8_2x1_intrawave_v1,929.9,592.04,0.008
gfx950,256,1984,2112,7168,ck,15,3,64.5853,a8w8_blockscale_bpreshuffle_1x128x128_256x64x64x128_16x16_16x16_8x32x1_8x32x1_1x32x1x8_8_2x1_intrawave_v1,930.1,584.35,0.0082
gfx950,256,2048,2112,7168,ck,17,1,73.8185,a8w8_blockscale_bpreshuffle_1x128x128_256x64x64x256_16x16_16x16_16x16x1_16x16x1_1x32x1x8_8_2x1_intrawave_v1,840.01,521.14,0.0
gfx950,256,4096,2112,7168,ck,15,0,122.5407,a8w8_blockscale_bpreshuffle_1x128x128_256x64x64x128_16x16_16x16_8x32x1_8x32x1_1x32x1x8_8_2x1_intrawave_v1,1012.05,504.33,0.0085
gfx950,256,8192,2112,7168,ck,15,3,223.4002,a8w8_blockscale_bpreshuffle_1x128x128_256x64x64x128_16x16_16x16_8x32x1_8x32x1_1x32x1x8_8_2x1_intrawave_v1,1110.27,485.51,0.0091
gfx950,256,16384,2112,7168,ck,15,1,411.1387,a8w8_blockscale_bpreshuffle_1x128x128_256x64x64x128_16x16_16x16_8x32x1_8x32x1_1x32x1x8_8_2x1_intrawave_v1,1206.57,490.8,0.0095
gfx950,256,32768,2112,7168,ck,17,0,804.4843,a8w8_blockscale_bpreshuffle_1x128x128_256x64x64x256_16x16_16x16_16x16x1_16x16x1_1x32x1x8_8_2x1_intrawave_v1,1233.26,482.83,0.0
gfx950,256,16,2240,7168,ck,7,2,17.3187,a8w8_blockscale_bpreshuffle_1x128x128_256x16x64x256_16x16_16x16_16x16x1_16x16x1_1x16x1x16_4_1x1_intrawave_v1,29.67,937.87,0.0
gfx950,256,32,2240,7168,ck,7,1,17.2052,a8w8_blockscale_bpreshuffle_1x128x128_256x16x64x256_16x16_16x16_16x16x1_16x16x1_1x16x1x16_4_1x1_intrawave_v1,59.73,954.89,0.0
gfx950,256,48,2240,7168,ck,7,0,17.1856,a8w8_blockscale_bpreshuffle_1x128x128_256x16x64x256_16x16_16x16_16x16x1_16x16x1_1x16x1x16_4_1x1_intrawave_v1,89.69,966.82,0.0
gfx950,256,64,2240,7168,ck,7,2,17.1082,a8w8_blockscale_bpreshuffle_1x128x128_256x16x64x256_16x16_16x16_16x16x1_16x16x1_1x16x1x16_4_1x1_intrawave_v1,120.13,982.09,0.0
gfx950,256,80,2240,7168,ck,7,1,17.1957,a8w8_blockscale_bpreshuffle_1x128x128_256x16x64x256_16x16_16x16_16x16x1_16x16x1_1x16x1x16_4_1x1_intrawave_v1,149.4,987.93,0.0
gfx950,256,96,2240,7168,ck,7,0,17.0763,a8w8_blockscale_bpreshuffle_1x128x128_256x16x64x256_16x16_16x16_16x16x1_16x16x1_1x16x1x16_4_1x1_intrawave_v1,180.53,1005.75,0.0
gfx950,256,112,2240,7168,ck,7,2,17.0073,a8w8_blockscale_bpreshuffle_1x128x128_256x16x64x256_16x16_16x16_16x16x1_16x16x1_1x16x1x16_4_1x1_intrawave_v1,211.47,1020.79,0.0
gfx950,256,128,2240,7168,ck,12,3,18.3162,a8w8_blockscale_bpreshuffle_1x128x128_256x32x64x256_16x16_16x16_16x16x1_16x16x1_1x32x1x8_8_2x1_intrawave_v1,224.41,958.02,0.0
gfx950,256,144,2240,7168,ck,7,1,17.4925,a8w8_blockscale_bpreshuffle_1x128x128_256x16x64x256_16x16_16x16_16x16x1_16x16x1_1x16x1x16_4_1x1_intrawave_v1,264.35,1013.78,0.0
gfx950,256,160,2240,7168,ck,12,0,18.2215,a8w8_blockscale_bpreshuffle_1x128x128_256x32x64x256_16x16_16x16_16x16x1_16x16x1_1x32x1x8_8_2x1_intrawave_v1,281.98,983.45,0.0
gfx950,256,176,2240,7168,ck,7,0,19.5377,a8w8_blockscale_bpreshuffle_1x128x128_256x16x64x256_16x16_16x16_16x16x1_16x16x1_1x16x1x16_4_1x1_intrawave_v1,289.28,926.74,0.0
gfx950,256,192,2240,7168,ck,12,3,18.244,a8w8_blockscale_bpreshuffle_1x128x128_256x32x64x256_16x16_16x16_16x16x1_16x16x1_1x32x1x8_8_2x1_intrawave_v1,337.95,1002.67,0.0
gfx950,256,208,2240,7168,ck,7,1,19.7375,a8w8_blockscale_bpreshuffle_1x128x128_256x16x64x256_16x16_16x16_16x16x1_16x16x1_1x16x1x16_4_1x1_intrawave_v1,338.41,936.24,0.0
gfx950,256,224,2240,7168,ck,12,3,18.0754,a8w8_blockscale_bpreshuffle_1x128x128_256x32x64x256_16x16_16x16_16x16x1_16x16x1_1x32x1x8_8_2x1_intrawave_v1,397.96,1032.65,0.0
gfx950,256,240,2240,7168,ck,17,1,22.0355,a8w8_blockscale_bpreshuffle_1x128x128_256x64x64x256_16x16_16x16_16x16x1_16x16x1_1x32x1x8_8_2x1_intrawave_v1,349.76,855.52,0.0
gfx950,256,256,2240,7168,ck,17,1,21.1511,a8w8_blockscale_bpreshuffle_1x128x128_256x64x64x256_16x16_16x16_16x16x1_16x16x1_1x32x1x8_8_2x1_intrawave_v1,388.67,900.1,0.0
gfx950,256,288,2240,7168,ck,12,0,19.8488,a8w8_blockscale_bpreshuffle_1x128x128_256x32x64x256_16x16_16x16_16x16x1_16x16x1_1x32x1x8_8_2x1_intrawave_v1,465.94,977.94,0.0
gfx950,256,320,2240,7168,ck,17,2,21.2632,a8w8_blockscale_bpreshuffle_1x128x128_256x64x64x256_16x16_16x16_16x16x1_16x16x1_1x32x1x8_8_2x1_intrawave_v1,483.28,930.42,0.0
gfx950,256,352,2240,7168,ck,17,1,22.208,a8w8_blockscale_bpreshuffle_1x128x128_256x64x64x256_16x16_16x16_16x16x1_16x16x1_1x32x1x8_8_2x1_intrawave_v1,508.99,907.62,0.0
gfx950,256,384,2240,7168,ck,17,2,21.4024,a8w8_blockscale_bpreshuffle_1x128x128_256x64x64x256_16x16_16x16_16x16x1_16x16x1_1x32x1x8_8_2x1_intrawave_v1,576.16,959.2,0.0
gfx950,256,416,2240,7168,ck,17,1,22.4706,a8w8_blockscale_bpreshuffle_1x128x128_256x64x64x256_16x16_16x16_16x16x1_16x16x1_1x32x1x8_8_2x1_intrawave_v1,594.5,930.19,0.0
gfx950,256,448,2240,7168,ck,17,2,21.5077,a8w8_blockscale_bpreshuffle_1x128x128_256x64x64x256_16x16_16x16_16x16x1_16x16x1_1x32x1x8_8_2x1_intrawave_v1,668.9,989.16,0.0
gfx950,256,480,2240,7168,ck,10,3,29.6061,a8w8_blockscale_bpreshuffle_1x128x128_256x32x64x128_16x16_16x16_8x32x1_8x32x1_1x32x1x8_8_2x1_intrawave_v1,520.64,731.18,0.0197
gfx950,256,512,2240,7168,ck,15,2,31.3316,a8w8_blockscale_bpreshuffle_1x128x128_256x64x64x128_16x16_16x16_8x32x1_8x32x1_1x32x1x8_8_2x1_intrawave_v1,524.76,702.81,0.0005
gfx950,256,544,2240,7168,ck,17,2,29.8347,a8w8_blockscale_bpreshuffle_1x128x128_256x64x64x256_16x16_16x16_16x16x1_16x16x1_1x32x1x8_8_2x1_intrawave_v1,585.54,750.56,0.0
gfx950,256,576,2240,7168,ck,17,0,29.2116,a8w8_blockscale_bpreshuffle_1x128x128_256x64x64x256_16x16_16x16_16x16x1_16x16x1_1x32x1x8_8_2x1_intrawave_v1,633.2,779.33,0.0
gfx950,256,608,2240,7168,ck,12,3,31.1053,a8w8_blockscale_bpreshuffle_1x128x128_256x32x64x256_16x16_16x16_16x16x1_16x16x1_1x32x1x8_8_2x1_intrawave_v1,627.69,743.87,0.0
gfx950,256,640,2240,7168,ck,17,3,31.3436,a8w8_blockscale_bpreshuffle_1x128x128_256x64x64x256_16x16_16x16_16x16x1_16x16x1_1x32x1x8_8_2x1_intrawave_v1,655.7,750.11,0.0
gfx950,256,672,2240,7168,ck,17,2,32.4726,a8w8_blockscale_bpreshuffle_1x128x128_256x64x64x256_16x16_16x16_16x16x1_16x16x1_1x32x1x8_8_2x1_intrawave_v1,664.55,735.51,0.0
gfx950,256,704,2240,7168,ck,17,3,31.5542,a8w8_blockscale_bpreshuffle_1x128x128_256x64x64x256_16x16_16x16_16x16x1_16x16x1_1x32x1x8_8_2x1_intrawave_v1,716.46,768.73,0.0
gfx950,256,736,2240,7168,ck,17,1,32.7615,a8w8_blockscale_bpreshuffle_1x128x128_256x64x64x256_16x16_16x16_16x16x1_16x16x1_1x32x1x8_8_2x1_intrawave_v1,721.42,751.77,0.0
gfx950,256,768,2240,7168,ck,17,0,31.996,a8w8_blockscale_bpreshuffle_1x128x128_256x64x64x256_16x16_16x16_16x16x1_16x16x1_1x32x1x8_8_2x1_intrawave_v1,770.8,781.41,0.0
gfx950,256,800,2240,7168,ck,17,2,33.3508,a8w8_blockscale_bpreshuffle_1x128x128_256x64x64x256_16x16_16x16_16x16x1_16x16x1_1x32x1x8_8_2x1_intrawave_v1,770.3,760.84,0.0
gfx950,256,832,2240,7168,ck,17,1,32.6843,a8w8_blockscale_bpreshuffle_1x128x128_256x64x64x256_16x16_16x16_16x16x1_16x16x1_1x32x1x8_8_2x1_intrawave_v1,817.45,787.76,0.0
gfx950,256,864,2240,7168,ck,17,2,34.2322,a8w8_blockscale_bpreshuffle_1x128x128_256x64x64x256_16x16_16x16_16x16x1_16x16x1_1x32x1x8_8_2x1_intrawave_v1,810.5,763.03,0.0
gfx950,256,896,2240,7168,ck,17,1,33.0197,a8w8_blockscale_bpreshuffle_1x128x128_256x64x64x256_16x16_16x16_16x16x1_16x16x1_1x32x1x8_8_2x1_intrawave_v1,871.39,802.34,0.0
gfx950,256,928,2240,7168,ck,15,2,41.585,a8w8_blockscale_bpreshuffle_1x128x128_256x64x64x128_16x16_16x16_8x32x1_8x32x1_1x32x1x8_8_2x1_intrawave_v1,716.62,646.04,0.0173
gfx950,256,960,2240,7168,ck,15,1,39.9713,a8w8_blockscale_bpreshuffle_1x128x128_256x64x64x128_16x16_16x16_8x32x1_8x32x1_1x32x1x8_8_2x1_intrawave_v1,771.26,681.45,0.0025
gfx950,256,992,2240,7168,ck,15,1,43.5147,a8w8_blockscale_bpreshuffle_1x128x128_256x64x64x128_16x16_16x16_8x32x1_8x32x1_1x32x1x8_8_2x1_intrawave_v1,732.07,634.52,0.0179
gfx950,256,1024,2240,7168,ck,2,2,44.5432,a8w8_blockscale_bpreshuffle_1x128x128_256x64x64x128_16x16_16x16_8x32x1_8x32x1_1x32x1x8_8_2x1_intrawave_v3,738.23,628.24,0.0001
gfx950,256,1088,2240,7168,ck,15,2,41.8467,a8w8_blockscale_bpreshuffle_1x128x128_256x64x64x128_16x16_16x16_8x32x1_8x32x1_1x32x1x8_8_2x1_intrawave_v1,834.92,686.54,0.0035
gfx950,256,1152,2240,7168,ck,15,1,42.3981,a8w8_blockscale_bpreshuffle_1x128x128_256x64x64x128_16x16_16x16_8x32x1_8x32x1_1x32x1x8_8_2x1_intrawave_v1,872.53,695.19,0.0043
gfx950,256,1216,2240,7168,ck,15,1,44.3198,a8w8_blockscale_bpreshuffle_1x128x128_256x64x64x128_16x16_16x16_8x32x1_8x32x1_1x32x1x8_8_2x1_intrawave_v1,881.07,681.87,0.0047
gfx950,256,1280,2240,7168,ck,15,0,46.0014,a8w8_blockscale_bpreshuffle_1x128x128_256x64x64x128_16x16_16x16_8x32x1_8x32x1_1x32x1x8_8_2x1_intrawave_v1,893.54,673.15,0.0057
gfx950,256,1344,2240,7168,ck,15,3,46.7258,a8w8_blockscale_bpreshuffle_1x128x128_256x64x64x128_16x16_16x16_8x32x1_8x32x1_1x32x1x8_8_2x1_intrawave_v1,923.67,678.67,0.006
gfx950,256,1408,2240,7168,ck,15,3,55.5671,a8w8_blockscale_bpreshuffle_1x128x128_256x64x64x128_16x16_16x16_8x32x1_8x32x1_1x32x1x8_8_2x1_intrawave_v1,813.69,584.1,0.0061
gfx950,256,1472,2240,7168,ck,17,0,56.1099,a8w8_blockscale_bpreshuffle_1x128x128_256x64x64x256_16x16_16x16_16x16x1_16x16x1_1x32x1x8_8_2x1_intrawave_v1,842.45,591.73,0.0
gfx950,256,1536,2240,7168,ck,15,0,57.0356,a8w8_blockscale_bpreshuffle_1x128x128_256x64x64x128_16x16_16x16_8x32x1_8x32x1_1x32x1x8_8_2x1_intrawave_v1,864.81,595.2,0.0071
gfx950,256,1600,2240,7168,ck,15,0,57.9207,a8w8_blockscale_bpreshuffle_1x128x128_256x64x64x128_16x16_16x16_8x32x1_8x32x1_1x32x1x8_8_2x1_intrawave_v1,887.08,598.98,0.0072
gfx950,256,1664,2240,7168,ck,15,0,58.3656,a8w8_blockscale_bpreshuffle_1x128x128_256x64x64x128_16x16_16x16_8x32x1_8x32x1_1x32x1x8_8_2x1_intrawave_v1,915.53,607.18,0.008
gfx950,256,1728,2240,7168,ck,15,0,59.5866,a8w8_blockscale_bpreshuffle_1x128x128_256x64x64x128_16x16_16x16_8x32x1_8x32x1_1x32x1x8_8_2x1_intrawave_v1,931.26,607.25,0.0078
gfx950,256,1792,2240,7168,ck,15,1,60.5927,a8w8_blockscale_bpreshuffle_1x128x128_256x64x64x128_16x16_16x16_8x32x1_8x32x1_1x32x1x8_8_2x1_intrawave_v1,949.72,609.47,0.0083
gfx950,256,1856,2240,7168,ck,17,1,62.6283,a8w8_blockscale_bpreshuffle_1x128x128_256x64x64x256_16x16_16x16_16x16x1_16x16x1_1x32x1x8_8_2x1_intrawave_v1,951.66,601.57,0.0
gfx950,256,1920,2240,7168,ck,17,2,69.6783,a8w8_blockscale_bpreshuffle_1x128x128_256x64x64x256_16x16_16x16_16x16x1_16x16x1_1x32x1x8_8_2x1_intrawave_v1,884.87,551.4,0.0
gfx950,256,1984,2240,7168,ck,15,0,69.3874,a8w8_blockscale_bpreshuffle_1x128x128_256x64x64x128_16x16_16x16_8x32x1_8x32x1_1x32x1x8_8_2x1_intrawave_v1,918.2,564.45,0.0079
gfx950,256,2048,2240,7168,ck,17,0,75.0354,a8w8_blockscale_bpreshuffle_1x128x128_256x64x64x256_16x16_16x16_16x16x1_16x16x1_1x32x1x8_8_2x1_intrawave_v1,876.48,531.9,0.0
gfx950,256,4096,2240,7168,ck,15,0,125.1988,a8w8_blockscale_bpreshuffle_1x128x128_256x64x64x128_16x16_16x16_8x32x1_8x32x1_1x32x1x8_8_2x1_intrawave_v1,1050.6,509.32,0.0092
gfx950,256,8192,2240,7168,ck,15,0,228.9556,a8w8_blockscale_bpreshuffle_1x128x128_256x64x64x128_16x16_16x16_8x32x1_8x32x1_1x32x1x8_8_2x1_intrawave_v1,1148.99,486.89,0.0096
gfx950,256,16384,2240,7168,ck,15,3,434.2124,a8w8_blockscale_bpreshuffle_1x128x128_256x64x64x128_16x16_16x16_8x32x1_8x32x1_1x32x1x8_8_2x1_intrawave_v1,1211.7,476.49,0.0095
gfx950,256,32768,2240,7168,ck,15,2,834.7736,a8w8_blockscale_bpreshuffle_1x128x128_256x64x64x128_16x16_16x16_8x32x1_8x32x1_1x32x1x8_8_2x1_intrawave_v1,1260.54,476.46,0.0099
gfx950,256,16,3072,1536,ck,7,3,6.4633,a8w8_blockscale_bpreshuffle_1x128x128_256x16x64x256_16x16_16x16_16x16x1_16x16x1_1x16x1x16_4_1x1_intrawave_v1,23.36,749.07,0.0
gfx950,256,16,3072,3072,asm,5,6,7.3727,_ZN5aiter42fp8gemm_bf16_blockscale_BpreShuffle_32x128E,40.96,1300.02,0.0003
gfx950,256,32,3072,1536,ck,7,3,6.5001,a8w8_blockscale_bpreshuffle_1x128x128_256x16x64x256_16x16_16x16_16x16x1_16x16x1_1x16x1x16_4_1x1_intrawave_v1,46.46,763.73,0.0
gfx950,256,32,3072,3072,asm,15,8,8.2748,_ZN5aiter42fp8gemm_bf16_blockscale_BpreShuffle_48x128E,72.99,1176.11,0.0006
gfx950,256,48,3072,1536,ck,7,0,6.5182,a8w8_blockscale_bpreshuffle_1x128x128_256x16x64x256_16x16_16x16_16x16x1_16x16x1_1x16x1x16_4_1x1_intrawave_v1,69.5,780.47,0.0
gfx950,256,48,3072,3072,asm,4,5,9.5269,_ZN5aiter42fp8gemm_bf16_blockscale_BpreShuffle_32x128E,95.1,1037.02,0.0001
gfx950,256,64,3072,1536,ck,6,3,6.4157,a8w8_blockscale_bpreshuffle_1x128x128_256x16x128x256_16x16_16x16_16x16x1_16x16x1_1x16x1x16_8_1x2_intrawave_v1,94.14,812.09,0.0
gfx950,256,64,3072,3072,asm,3,4,9.2705,_ZN5aiter42fp8gemm_bf16_blockscale_BpreShuffle_32x128E,130.3,1081.6,0.0001
gfx950,256,80,3072,1536,ck,7,1,6.2015,a8w8_blockscale_bpreshuffle_1x128x128_256x16x64x256_16x16_16x16_16x16x1_16x16x1_1x16x1x16_4_1x1_intrawave_v1,121.74,859.95,0.0
gfx950,256,80,3072,3072,asm,12,5,9.6381,_ZN5aiter42fp8gemm_bf16_blockscale_BpreShuffle_48x128E,156.66,1055.65,0.0001
gfx950,256,96,3072,1536,ck,7,1,6.1725,a8w8_blockscale_bpreshuffle_1x128x128_256x16x64x256_16x16_16x16_16x16x1_16x16x1_1x16x1x16_4_1x1_intrawave_v1,146.78,883.9,0.0
gfx950,256,96,3072,3072,asm,19,4,9.2652,_ZN5aiter42fp8gemm_bf16_blockscale_BpreShuffle_64x128E,195.56,1114.05,0.0001
gfx950,256,112,3072,1536,ck,7,3,6.5959,a8w8_blockscale_bpreshuffle_1x128x128_256x16x64x256_16x16_16x16_16x16x1_16x16x1_1x16x1x16_4_1x1_intrawave_v1,160.25,845.79,0.0
gfx950,256,112,3072,3072,ck,7,0,9.9923,a8w8_blockscale_bpreshuffle_1x128x128_256x16x64x256_16x16_16x16_16x16x1_16x16x1_1x16x1x16_4_1x1_intrawave_v1,211.56,1047.74,0.0
gfx950,256,128,3072,1536,ck,7,0,6.2613,a8w8_blockscale_bpreshuffle_1x128x128_256x16x64x256_16x16_16x16_16x16x1_16x16x1_1x16x1x16_4_1x1_intrawave_v1,192.92,910.61,0.0
gfx950,256,128,3072,3072,ck,7,0,10.3718,a8w8_blockscale_bpreshuffle_1x128x128_256x16x64x256_16x16_16x16_16x16x1_16x16x1_1x16x1x16_4_1x1_intrawave_v1,232.93,1023.62,0.0
gfx950,256,144,3072,1536,ck,12,1,6.338,a8w8_blockscale_bpreshuffle_1x128x128_256x32x64x256_16x16_16x16_16x16x1_16x16x1_1x32x1x8_8_2x1_intrawave_v1,214.41,918.98,0.0
gfx950,256,144,3072,3072,ck,7,0,10.2283,a8w8_blockscale_bpreshuffle_1x128x128_256x16x64x256_16x16_16x16_16x16x1_16x16x1_1x16x1x16_4_1x1_intrawave_v1,265.72,1052.4,0.0
gfx950,256,160,3072,1536,ck,12,0,6.0824,a8w8_blockscale_bpreshuffle_1x128x128_256x32x64x256_16x16_16x16_16x16x1_16x16x1_1x32x1x8_8_2x1_intrawave_v1,248.25,977.8,0.0
gfx950,256,160,3072,3072,ck,12,1,9.8728,a8w8_blockscale_bpreshuffle_1x128x128_256x32x64x256_16x16_16x16_16x16x1_16x16x1_1x32x1x8_8_2x1_intrawave_v1,305.88,1105.23,0.0
gfx950,256,176,3072,1536,ck,6,3,7.3433,a8w8_blockscale_bpreshuffle_1x128x128_256x16x128x256_16x16_16x16_16x16x1_16x16x1_1x16x1x16_8_1x2_intrawave_v1,226.19,826.64,0.0
gfx950,256,176,3072,3072,ck,12,1,11.0912,a8w8_blockscale_bpreshuffle_1x128x128_256x32x64x256_16x16_16x16_16x16x1_16x16x1_1x32x1x8_8_2x1_intrawave_v1,299.51,997.11,0.0
gfx950,256,192,3072,1536,ck,6,0,6.9211,a8w8_blockscale_bpreshuffle_1x128x128_256x16x128x256_16x16_16x16_16x16x1_16x16x1_1x16x1x16_8_1x2_intrawave_v1,261.8,894.82,0.0
gfx950,256,192,3072,3072,ck,12,3,10.5231,a8w8_blockscale_bpreshuffle_1x128x128_256x32x64x256_16x16_16x16_16x16x1_16x16x1_1x32x1x8_8_2x1_intrawave_v1,344.37,1064.96,0.0
gfx950,256,208,3072,1536,ck,12,1,7.2509,a8w8_blockscale_bpreshuffle_1x128x128_256x32x64x256_16x16_16x16_16x16x1_16x16x1_1x32x1x8_8_2x1_intrawave_v1,270.72,871.07,0.0
gfx950,256,208,3072,3072,ck,17,2,11.654,a8w8_blockscale_bpreshuffle_1x128x128_256x64x64x256_16x16_16x16_16x16x1_16x16x1_1x32x1x8_8_2x1_intrawave_v1,336.87,974.27,0.0
gfx950,256,224,3072,1536,ck,12,1,7.2036,a8w8_blockscale_bpreshuffle_1x128x128_256x32x64x256_16x16_16x16_16x16x1_16x16x1_1x32x1x8_8_2x1_intrawave_v1,293.45,893.85,0.0
gfx950,256,224,3072,3072,ck,12,3,11.5304,a8w8_blockscale_bpreshuffle_1x128x128_256x32x64x256_16x16_16x16_16x16x1_16x16x1_1x32x1x8_8_2x1_intrawave_v1,366.67,997.5,0.0
gfx950,256,240,3072,1536,ck,11,1,7.2241,a8w8_blockscale_bpreshuffle_1x128x128_256x32x128x256_16x16_16x16_16x16x1_16x16x1_1x32x1x8_8_2x1_intrawave_v1,313.52,908.32,0.0
gfx950,256,240,3072,3072,ck,17,3,11.735,a8w8_blockscale_bpreshuffle_1x128x128_256x64x64x256_16x16_16x16_16x16x1_16x16x1_1x32x1x8_8_2x1_intrawave_v1,386.01,992.67,0.0
gfx950,256,256,3072,1536,ck,11,3,7.3204,a8w8_blockscale_bpreshuffle_1x128x128_256x32x128x256_16x16_16x16_16x16x1_16x16x1_1x32x1x8_8_2x1_intrawave_v1,330.03,913.16,0.0
gfx950,256,256,3072,3072,ck,17,2,11.4432,a8w8_blockscale_bpreshuffle_1x128x128_256x64x64x256_16x16_16x16_16x16x1_16x16x1_1x32x1x8_8_2x1_intrawave_v1,422.25,1030.87,0.0
gfx950,256,288,3072,1536,ck,12,3,7.4073,a8w8_blockscale_bpreshuffle_1x128x128_256x32x64x256_16x16_16x16_16x16x1_16x16x1_1x32x1x8_8_2x1_intrawave_v1,366.92,935.62,0.0
gfx950,256,288,3072,3072,ck,12,0,11.9257,a8w8_blockscale_bpreshuffle_1x128x128_256x32x64x256_16x16_16x16_16x16x1_16x16x1_1x32x1x8_8_2x1_intrawave_v1,455.81,1013.89,0.0
gfx950,256,320,3072,1536,ck,17,0,7.4931,a8w8_blockscale_bpreshuffle_1x128x128_256x64x64x256_16x16_16x16_16x16x1_16x16x1_1x32x1x8_8_2x1_intrawave_v1,403.02,957.71,0.0
gfx950,256,320,3072,3072,ck,17,0,11.7025,a8w8_blockscale_bpreshuffle_1x128x128_256x64x64x256_16x16_16x16_16x16x1_16x16x1_1x32x1x8_8_2x1_intrawave_v1,516.11,1058.43,0.0
gfx950,256,352,3072,1536,ck,10,0,9.4059,a8w8_blockscale_bpreshuffle_1x128x128_256x32x64x128_16x16_16x16_8x32x1_8x32x1_1x32x1x8_8_2x1_intrawave_v1,353.17,789.07,0.0212
gfx950,256,352,3072,3072,asm,8,1,14.6095,_ZN5aiter42fp8gemm_bf16_blockscale_BpreShuffle_48x128E,454.76,868.01,0.0
gfx950,256,384,3072,1536,ck,12,3,9.3019,a8w8_blockscale_bpreshuffle_1x128x128_256x32x64x256_16x16_16x16_16x16x1_16x16x1_1x32x1x8_8_2x1_intrawave_v1,389.58,824.32,0.0
gfx950,256,384,3072,3072,asm,8,1,14.6577,_ZN5aiter42fp8gemm_bf16_blockscale_BpreShuffle_48x128E,494.47,885.28,0.0
gfx950,256,416,3072,1536,asm,8,1,9.7878,_ZN5aiter42fp8gemm_bf16_blockscale_BpreShuffle_48x128E,401.1,808.5,0.0
gfx950,256,416,3072,3072,asm,8,1,14.702,_ZN5aiter42fp8gemm_bf16_blockscale_BpreShuffle_48x128E,534.06,902.67,0.0
gfx950,256,448,3072,1536,ck,12,1,9.7709,a8w8_blockscale_bpreshuffle_1x128x128_256x32x64x256_16x16_16x16_16x16x1_16x16x1_1x32x1x8_8_2x1_intrawave_v1,432.7,835.05,0.0
gfx950,256,448,3072,3072,asm,8,1,14.7225,_ZN5aiter42fp8gemm_bf16_blockscale_BpreShuffle_48x128E,574.34,921.44,0.0
gfx950,256,480,3072,1536,ck,12,3,10.0889,a8w8_blockscale_bpreshuffle_1x128x128_256x32x64x256_16x16_16x16_16x16x1_16x16x1_1x32x1x8_8_2x1_intrawave_v1,448.99,833.09,0.0
gfx950,256,480,3072,3072,asm,8,1,14.8006,_ZN5aiter42fp8gemm_bf16_blockscale_BpreShuffle_48x128E,612.12,936.51,0.0
gfx950,256,512,3072,1536,ck,12,2,10.3534,a8w8_blockscale_bpreshuffle_1x128x128_256x32x64x256_16x16_16x16_16x16x1_16x16x1_1x32x1x8_8_2x1_intrawave_v1,466.69,835.55,0.0
gfx950,256,512,3072,3072,asm,16,1,15.8579,_ZN5aiter42fp8gemm_bf16_blockscale_BpreShuffle_64x128E,609.39,892.66,0.0
gfx950,256,544,3072,1536,ck,11,3,10.5019,a8w8_blockscale_bpreshuffle_1x128x128_256x32x128x256_16x16_16x16_16x16x1_16x16x1_1x32x1x8_8_2x1_intrawave_v1,488.85,847.13,0.0
gfx950,256,544,3072,3072,asm,16,1,15.8752,_ZN5aiter42fp8gemm_bf16_blockscale_BpreShuffle_64x128E,646.77,910.27,0.0
gfx950,256,576,3072,1536,ck,17,1,10.5455,a8w8_blockscale_bpreshuffle_1x128x128_256x64x64x256_16x16_16x16_16x16x1_16x16x1_1x32x1x8_8_2x1_intrawave_v1,515.46,866.94,0.0
gfx950,256,576,3072,3072,asm,16,1,15.9596,_ZN5aiter42fp8gemm_bf16_blockscale_BpreShuffle_64x128E,681.2,923.93,0.0
gfx950,256,608,3072,1536,ck,11,0,10.6701,a8w8_blockscale_bpreshuffle_1x128x128_256x32x128x256_16x16_16x16_16x16x1_16x16x1_1x32x1x8_8_2x1_intrawave_v1,537.75,879.84,0.0
gfx950,256,608,3072,3072,asm,16,1,16.0084,_ZN5aiter42fp8gemm_bf16_blockscale_BpreShuffle_64x128E,716.85,939.54,0.0
gfx950,256,640,3072,1536,ck,17,1,10.7885,a8w8_blockscale_bpreshuffle_1x128x128_256x64x64x256_16x16_16x16_16x16x1_16x16x1_1x32x1x8_8_2x1_intrawave_v1,559.84,892.97,0.0
gfx950,256,640,3072,3072,asm,16,1,16.2216,_ZN5aiter42fp8gemm_bf16_blockscale_BpreShuffle_64x128E,744.66,945.37,0.0
gfx950,256,672,3072,1536,ck,11,3,10.9913,a8w8_blockscale_bpreshuffle_1x128x128_256x32x128x256_16x16_16x16_16x16x1_16x16x1_1x32x1x8_8_2x1_intrawave_v1,576.98,898.85,0.0
gfx950,256,672,3072,3072,asm,24,1,17.2482,_ZN5aiter42fp8gemm_bf16_blockscale_BpreShuffle_80x128E,735.36,906.2,0.0
gfx950,256,704,3072,1536,asm,24,1,12.1215,_ZN5aiter42fp8gemm_bf16_blockscale_BpreShuffle_80x128E,548.1,835.32,0.0
gfx950,256,704,3072,3072,asm,24,1,17.5391,_ZN5aiter42fp8gemm_bf16_blockscale_BpreShuffle_80x128E,757.6,907.99,0.0
gfx950,256,736,3072,1536,asm,24,1,11.7277,_ZN5aiter42fp8gemm_bf16_blockscale_BpreShuffle_80x128E,592.25,884.32,0.0
gfx950,256,736,3072,3072,asm,24,1,17.5502,_ZN5aiter42fp8gemm_bf16_blockscale_BpreShuffle_80x128E,791.53,924.22,0.0
gfx950,256,768,3072,1536,asm,24,1,11.8225,_ZN5aiter42fp8gemm_bf16_blockscale_BpreShuffle_80x128E,613.05,898.02,0.0
gfx950,256,768,3072,3072,asm,24,1,17.4237,_ZN5aiter42fp8gemm_bf16_blockscale_BpreShuffle_80x128E,831.94,947.85,0.0
gfx950,256,800,3072,1536,asm,24,1,12.0428,_ZN5aiter42fp8gemm_bf16_blockscale_BpreShuffle_80x128E,626.91,902.0,0.0
gfx950,256,800,3072,3072,asm,24,1,17.7973,_ZN5aiter42fp8gemm_bf16_blockscale_BpreShuffle_80x128E,848.41,944.52,0.0
gfx950,256,832,3072,1536,asm,32,1,13.235,_ZN5aiter42fp8gemm_bf16_blockscale_BpreShuffle_96x128E,593.26,839.32,0.0
gfx950,256,832,3072,3072,asm,32,1,19.303,_ZN5aiter42fp8gemm_bf16_blockscale_BpreShuffle_96x128E,813.53,886.13,0.0
gfx950,256,864,3072,1536,asm,32,1,13.3818,_ZN5aiter42fp8gemm_bf16_blockscale_BpreShuffle_96x128E,609.31,848.47,0.0
gfx950,256,864,3072,3072,asm,32,1,19.4672,_ZN5aiter42fp8gemm_bf16_blockscale_BpreShuffle_96x128E,837.69,893.8,0.0
gfx950,256,896,3072,1536,asm,32,1,12.9966,_ZN5aiter42fp8gemm_bf16_blockscale_BpreShuffle_96x128E,650.61,892.53,0.0
gfx950,256,896,3072,3072,asm,32,1,19.4031,_ZN5aiter42fp8gemm_bf16_blockscale_BpreShuffle_96x128E,871.58,911.95,0.0
gfx950,256,928,3072,1536,asm,32,1,13.4375,_ZN5aiter42fp8gemm_bf16_blockscale_BpreShuffle_96x128E,651.74,881.54,0.0
gfx950,256,928,3072,3072,asm,32,1,19.6687,_ZN5aiter42fp8gemm_bf16_blockscale_BpreShuffle_96x128E,890.52,914.63,0.0
gfx950,256,960,3072,1536,asm,32,1,13.6336,_ZN5aiter42fp8gemm_bf16_blockscale_BpreShuffle_96x128E,664.51,886.88,0.0
gfx950,256,960,3072,3072,asm,32,1,19.8975,_ZN5aiter42fp8gemm_bf16_blockscale_BpreShuffle_96x128E,910.64,918.94,0.0
gfx950,256,992,3072,1536,ck,15,1,14.2672,a8w8_blockscale_bpreshuffle_1x128x128_256x64x64x128_16x16_16x16_8x32x1_8x32x1_1x32x1x8_8_2x1_intrawave_v1,656.17,864.72,0.0137
gfx950,256,992,3072,3072,ck,14,3,22.8957,a8w8_blockscale_bpreshuffle_1x128x128_256x64x128x128_16x16_16x16_8x32x1_8x32x1_1x32x1x8_8_2x1_intrawave_v1,817.77,811.48,0.0001
gfx950,256,1024,3072,1536,ck,15,3,14.2212,a8w8_blockscale_bpreshuffle_1x128x128_256x64x64x128_16x16_16x16_8x32x1_8x32x1_1x32x1x8_8_2x1_intrawave_v1,679.53,884.8,0.0014
gfx950,256,1024,3072,3072,ck,14,3,22.9132,a8w8_blockscale_bpreshuffle_1x128x128_256x64x128x128_16x16_16x16_8x32x1_8x32x1_1x32x1x8_8_2x1_intrawave_v1,843.5,823.73,0.0001
gfx950,256,1088,3072,1536,ck,14,0,14.3467,a8w8_blockscale_bpreshuffle_1x128x128_256x64x128x128_16x16_16x16_8x32x1_8x32x1_1x32x1x8_8_2x1_intrawave_v1,715.68,911.32,0.0
gfx950,256,1088,3072,3072,ck,14,3,22.4901,a8w8_blockscale_bpreshuffle_1x128x128_256x64x128x128_16x16_16x16_8x32x1_8x32x1_1x32x1x8_8_2x1_intrawave_v1,913.08,865.46,0.0001
gfx950,256,1152,3072,1536,ck,14,3,14.3806,a8w8_blockscale_bpreshuffle_1x128x128_256x64x128x128_16x16_16x16_8x32x1_8x32x1_1x32x1x8_8_2x1_intrawave_v1,755.99,943.35,0.0
gfx950,256,1152,3072,3072,ck,14,0,22.6081,a8w8_blockscale_bpreshuffle_1x128x128_256x64x128x128_16x16_16x16_8x32x1_8x32x1_1x32x1x8_8_2x1_intrawave_v1,961.75,887.03,0.0001
gfx950,256,1216,3072,1536,ck,14,3,14.6973,a8w8_blockscale_bpreshuffle_1x128x128_256x64x128x128_16x16_16x16_8x32x1_8x32x1_1x32x1x8_8_2x1_intrawave_v1,780.8,956.47,0.0
gfx950,256,1216,3072,3072,ck,14,2,23.0364,a8w8_blockscale_bpreshuffle_1x128x128_256x64x128x128_16x16_16x16_8x32x1_8x32x1_1x32x1x8_8_2x1_intrawave_v1,996.3,896.14,0.0001
gfx950,256,1280,3072,1536,ck,14,1,14.8836,a8w8_blockscale_bpreshuffle_1x128x128_256x64x128x128_16x16_16x16_8x32x1_8x32x1_1x32x1x8_8_2x1_intrawave_v1,811.6,977.52,0.0
gfx950,256,1280,3072,3072,ck,14,1,23.4477,a8w8_blockscale_bpreshuffle_1x128x128_256x64x128x128_16x16_16x16_8x32x1_8x32x1_1x32x1x8_8_2x1_intrawave_v1,1030.34,905.58,0.0001
gfx950,256,1344,3072,1536,ck,14,3,15.1183,a8w8_blockscale_bpreshuffle_1x128x128_256x64x128x128_16x16_16x16_8x32x1_8x32x1_1x32x1x8_8_2x1_intrawave_v1,838.96,994.85,0.0
gfx950,256,1344,3072,3072,ck,14,0,23.8751,a8w8_blockscale_bpreshuffle_1x128x128_256x64x128x128_16x16_16x16_8x32x1_8x32x1_1x32x1x8_8_2x1_intrawave_v1,1062.49,914.07,0.0001
gfx950,256,1408,3072,1536,ck,14,0,18.3176,a8w8_blockscale_bpreshuffle_1x128x128_256x64x128x128_16x16_16x16_8x32x1_8x32x1_1x32x1x8_8_2x1_intrawave_v1,725.4,847.93,0.0
gfx950,256,1408,3072,3072,ck,14,3,29.2608,a8w8_blockscale_bpreshuffle_1x128x128_256x64x128x128_16x16_16x16_8x32x1_8x32x1_1x32x1x8_8_2x1_intrawave_v1,908.22,765.98,0.0001
gfx950,256,1472,3072,1536,ck,14,1,18.5424,a8w8_blockscale_bpreshuffle_1x128x128_256x64x128x128_16x16_16x16_8x32x1_8x32x1_1x32x1x8_8_2x1_intrawave_v1,749.18,864.16,0.0001
gfx950,256,1472,3072,3072,ck,14,3,29.6273,a8w8_blockscale_bpreshuffle_1x128x128_256x64x128x128_16x16_16x16_8x32x1_8x32x1_1x32x1x8_8_2x1_intrawave_v1,937.75,776.42,0.0001
gfx950,256,1536,3072,1536,ck,14,0,18.6045,a8w8_blockscale_bpreshuffle_1x128x128_256x64x128x128_16x16_16x16_8x32x1_8x32x1_1x32x1x8_8_2x1_intrawave_v1,779.14,887.69,0.0001
gfx950,256,1536,3072,3072,ck,14,1,29.4698,a8w8_blockscale_bpreshuffle_1x128x128_256x64x128x128_16x16_16x16_8x32x1_8x32x1_1x32x1x8_8_2x1_intrawave_v1,983.75,800.58,0.0002
gfx950,256,1600,3072,1536,ck,14,2,18.8,a8w8_blockscale_bpreshuffle_1x128x128_256x64x128x128_16x16_16x16_8x32x1_8x32x1_1x32x1x8_8_2x1_intrawave_v1,803.16,904.61,0.0001
gfx950,256,1600,3072,3072,ck,14,3,29.7895,a8w8_blockscale_bpreshuffle_1x128x128_256x64x128x128_16x16_16x16_8x32x1_8x32x1_1x32x1x8_8_2x1_intrawave_v1,1013.75,811.79,0.0002
gfx950,256,1664,3072,1536,ck,14,0,18.9387,a8w8_blockscale_bpreshuffle_1x128x128_256x64x128x128_16x16_16x16_8x32x1_8x32x1_1x32x1x8_8_2x1_intrawave_v1,829.17,923.93,0.0001
gfx950,256,1664,3072,3072,ck,14,0,30.0458,a8w8_blockscale_bpreshuffle_1x128x128_256x64x128x128_16x16_16x16_8x32x1_8x32x1_1x32x1x8_8_2x1_intrawave_v1,1045.3,824.49,0.0001
gfx950,256,1728,3072,1536,ck,14,3,19.2012,a8w8_blockscale_bpreshuffle_1x128x128_256x64x128x128_16x16_16x16_8x32x1_8x32x1_1x32x1x8_8_2x1_intrawave_v1,849.29,936.9,0.0002
gfx950,256,1728,3072,3072,ck,14,2,30.4353,a8w8_blockscale_bpreshuffle_1x128x128_256x64x128x128_16x16_16x16_8x32x1_8x32x1_1x32x1x8_8_2x1_intrawave_v1,1071.61,833.32,0.0002
gfx950,256,1792,3072,1536,ck,14,1,19.3448,a8w8_blockscale_bpreshuffle_1x128x128_256x64x128x128_16x16_16x16_8x32x1_8x32x1_1x32x1x8_8_2x1_intrawave_v1,874.21,955.36,0.0001
gfx950,256,1792,3072,3072,ck,14,0,30.8284,a8w8_blockscale_bpreshuffle_1x128x128_256x64x128x128_16x16_16x16_8x32x1_8x32x1_1x32x1x8_8_2x1_intrawave_v1,1097.13,841.83,0.0002
gfx950,256,1856,3072,1536,ck,14,1,19.4996,a8w8_blockscale_bpreshuffle_1x128x128_256x64x128x128_16x16_16x16_8x32x1_8x32x1_1x32x1x8_8_2x1_intrawave_v1,898.24,972.98,0.0002
gfx950,256,1856,3072,3072,ck,14,0,31.8273,a8w8_blockscale_bpreshuffle_1x128x128_256x64x128x128_16x16_16x16_8x32x1_8x32x1_1x32x1x8_8_2x1_intrawave_v1,1100.65,833.94,0.0002
gfx950,256,1920,3072,1536,ck,14,2,19.5725,a8w8_blockscale_bpreshuffle_1x128x128_256x64x128x128_16x16_16x16_8x32x1_8x32x1_1x32x1x8_8_2x1_intrawave_v1,925.76,994.47,0.0002
gfx950,256,1920,3072,3072,ck,14,0,31.7613,a8w8_blockscale_bpreshuffle_1x128x128_256x64x128x128_16x16_16x16_8x32x1_8x32x1_1x32x1x8_8_2x1_intrawave_v1,1140.97,854.24,0.0002
gfx950,256,1984,3072,1536,ck,14,1,20.1808,a8w8_blockscale_bpreshuffle_1x128x128_256x64x128x128_16x16_16x16_8x32x1_8x32x1_1x32x1x8_8_2x1_intrawave_v1,927.78,988.85,0.0002
gfx950,256,1984,3072,3072,ck,14,3,33.9609,a8w8_blockscale_bpreshuffle_1x128x128_256x64x128x128_16x16_16x16_8x32x1_8x32x1_1x32x1x8_8_2x1_intrawave_v1,1102.64,816.28,0.0002
gfx950,256,2048,3072,1536,ck,14,2,20.3677,a8w8_blockscale_bpreshuffle_1x128x128_256x64x128x128_16x16_16x16_8x32x1_8x32x1_1x32x1x8_8_2x1_intrawave_v1,948.92,1003.9,0.0001
gfx950,256,2048,3072,3072,ck,14,3,33.9279,a8w8_blockscale_bpreshuffle_1x128x128_256x64x128x128_16x16_16x16_8x32x1_8x32x1_1x32x1x8_8_2x1_intrawave_v1,1139.32,834.46,0.0002
gfx950,256,4096,3072,1536,ck,13,0,32.8903,a8w8_blockscale_bpreshuffle_1x128x128_256x64x256x128_16x16_16x16_8x32x1_8x32x1_1x32x1x8_8_2x1_intrawave_v1,1175.26,1099.89,0.0
gfx950,256,4096,3072,3072,ck,13,1,56.2027,a8w8_blockscale_bpreshuffle_1x128x128_256x64x256x128_16x16_16x16_8x32x1_8x32x1_1x32x1x8_8_2x1_intrawave_v1,1375.55,839.57,0.0
gfx950,256,8192,3072,1536,ck,13,0,60.7603,a8w8_blockscale_bpreshuffle_1x128x128_256x64x256x128_16x16_16x16_8x32x1_8x32x1_1x32x1x8_8_2x1_intrawave_v1,1272.37,1113.11,0.0
gfx950,256,8192,3072,3072,ck,13,0,98.9536,a8w8_blockscale_bpreshuffle_1x128x128_256x64x256x128_16x16_16x16_8x32x1_8x32x1_1x32x1x8_8_2x1_intrawave_v1,1562.54,858.33,0.0
gfx950,256,16384,3072,1536,ck,13,2,113.3639,a8w8_blockscale_bpreshuffle_1x128x128_256x64x256x128_16x16_16x16_8x32x1_8x32x1_1x32x1x8_8_2x1_intrawave_v1,1363.92,1151.58,0.0
gfx950,256,16384,3072,3072,ck,13,1,188.8317,a8w8_blockscale_bpreshuffle_1x128x128_256x64x256x128_16x16_16x16_8x32x1_8x32x1_1x32x1x8_8_2x1_intrawave_v1,1637.64,849.6,0.0
gfx950,256,32768,3072,1536,ck,13,0,206.2023,a8w8_blockscale_bpreshuffle_1x128x128_256x64x256x128_16x16_16x16_8x32x1_8x32x1_1x32x1x8_8_2x1_intrawave_v1,1499.68,1243.33,0.0
gfx950,256,32768,3072,3072,ck,13,1,358.9075,a8w8_blockscale_bpreshuffle_1x128x128_256x64x256x128_16x16_16x16_8x32x1_8x32x1_1x32x1x8_8_2x1_intrawave_v1,1723.22,867.71,0.0
gfx950,256,16,4096,512,ck,7,3,3.0553,a8w8_blockscale_bpreshuffle_1x128x128_256x16x64x256_16x16_16x16_16x16x1_16x16x1_1x16x1x16_4_1x1_intrawave_v1,21.96,731.98,0.0
gfx950,256,16,4096,3072,asm,5,6,8.5265,_ZN5aiter42fp8gemm_bf16_blockscale_BpreShuffle_32x128E,47.22,1496.88,0.0001
gfx950,256,32,4096,512,ck,7,1,3.352,a8w8_blockscale_bpreshuffle_1x128x128_256x16x64x256_16x16_16x16_16x16x1_16x16x1_1x16x1x16_4_1x1_intrawave_v1,40.04,708.74,0.0
gfx950,256,32,4096,3072,asm,5,6,9.3323,_ZN5aiter42fp8gemm_bf16_blockscale_BpreShuffle_32x128E,86.29,1386.94,0.0001
gfx950,256,48,4096,512,ck,7,2,3.4163,a8w8_blockscale_bpreshuffle_1x128x128_256x16x64x256_16x16_16x16_16x16x1_16x16x1_1x16x1x16_4_1x1_intrawave_v1,58.93,736.16,0.0
gfx950,256,48,4096,3072,asm,13,6,9.3261,_ZN5aiter42fp8gemm_bf16_blockscale_BpreShuffle_48x128E,129.52,1407.19,0.0002
gfx950,256,64,4096,512,ck,7,0,3.5282,a8w8_blockscale_bpreshuffle_1x128x128_256x16x64x256_16x16_16x16_16x16x1_16x16x1_1x16x1x16_4_1x1_intrawave_v1,76.08,752.28,0.0
gfx950,256,64,4096,3072,ck,12,0,9.8624,a8w8_blockscale_bpreshuffle_1x128x128_256x32x64x256_16x16_16x16_16x16x1_16x16x1_1x32x1x8_8_2x1_intrawave_v1,163.31,1348.94,0.0
gfx950,256,80,4096,512,ck,7,1,3.9461,a8w8_blockscale_bpreshuffle_1x128x128_256x16x64x256_16x16_16x16_16x16x1_16x16x1_1x16x1x16_4_1x1_intrawave_v1,85.03,707.91,0.0
gfx950,256,80,4096,3072,asm,11,4,10.0921,_ZN5aiter42fp8gemm_bf16_blockscale_BpreShuffle_48x128E,199.49,1336.1,0.0001
gfx950,256,96,4096,512,ck,7,1,3.9483,a8w8_blockscale_bpreshuffle_1x128x128_256x16x64x256_16x16_16x16_16x16x1_16x16x1_1x16x1x16_4_1x1_intrawave_v1,101.98,742.78,0.0
gfx950,256,96,4096,3072,ck,12,0,9.741,a8w8_blockscale_bpreshuffle_1x128x128_256x32x64x256_16x16_16x16_16x16x1_16x16x1_1x32x1x8_8_2x1_intrawave_v1,248.02,1402.76,0.0
gfx950,256,112,4096,512,ck,6,1,4.0039,a8w8_blockscale_bpreshuffle_1x128x128_256x16x128x256_16x16_16x16_16x16x1_16x16x1_1x16x1x16_8_1x2_intrawave_v1,117.33,767.25,0.0
gfx950,256,112,4096,3072,ck,7,0,10.2261,a8w8_blockscale_bpreshuffle_1x128x128_256x16x64x256_16x16_16x16_16x16x1_16x16x1_1x16x1x16_4_1x1_intrawave_v1,275.63,1353.84,0.0
gfx950,256,128,4096,512,ck,7,0,3.933,a8w8_blockscale_bpreshuffle_1x128x128_256x16x64x256_16x16_16x16_16x16x1_16x16x1_1x16x1x16_4_1x1_intrawave_v1,136.5,816.49,0.0
gfx950,256,128,4096,3072,ck,12,1,9.764,a8w8_blockscale_bpreshuffle_1x128x128_256x32x64x256_16x16_16x16_16x16x1_16x16x1_1x32x1x8_8_2x1_intrawave_v1,329.91,1436.37,0.0
gfx950,256,144,4096,512,ck,7,1,4.6145,a8w8_blockscale_bpreshuffle_1x128x128_256x16x64x256_16x16_16x16_16x16x1_16x16x1_1x16x1x16_4_1x1_intrawave_v1,130.89,726.09,0.0
gfx950,256,144,4096,3072,ck,17,0,11.6095,a8w8_blockscale_bpreshuffle_1x128x128_256x64x64x256_16x16_16x16_16x16x1_16x16x1_1x32x1x8_8_2x1_intrawave_v1,312.15,1223.56,0.0
gfx950,256,160,4096,512,ck,7,0,4.7158,a8w8_blockscale_bpreshuffle_1x128x128_256x16x64x256_16x16_16x16_16x16x1_16x16x1_1x16x1x16_4_1x1_intrawave_v1,142.31,740.02,0.0
gfx950,256,160,4096,3072,ck,17,0,11.648,a8w8_blockscale_bpreshuffle_1x128x128_256x64x64x256_16x16_16x16_16x16x1_16x16x1_1x32x1x8_8_2x1_intrawave_v1,345.68,1234.99,0.0
gfx950,256,176,4096,512,ck,7,1,4.6429,a8w8_blockscale_bpreshuffle_1x128x128_256x16x64x256_16x16_16x16_16x16x1_16x16x1_1x16x1x16_4_1x1_intrawave_v1,158.99,781.64,0.0
gfx950,256,176,4096,3072,ck,17,1,11.723,a8w8_blockscale_bpreshuffle_1x128x128_256x64x64x256_16x16_16x16_16x16x1_16x16x1_1x32x1x8_8_2x1_intrawave_v1,377.82,1242.46,0.0
gfx950,256,192,4096,512,ck,7,0,4.6761,a8w8_blockscale_bpreshuffle_1x128x128_256x16x64x256_16x16_16x16_16x16x1_16x16x1_1x16x1x16_4_1x1_intrawave_v1,172.22,805.87,0.0
gfx950,256,192,4096,3072,ck,17,0,11.4303,a8w8_blockscale_bpreshuffle_1x128x128_256x64x64x256_16x16_16x16_16x16x1_16x16x1_1x32x1x8_8_2x1_intrawave_v1,422.72,1290.04,0.0
gfx950,256,208,4096,512,ck,11,2,4.762,a8w8_blockscale_bpreshuffle_1x128x128_256x32x128x256_16x16_16x16_16x16x1_16x16x1_1x32x1x8_8_2x1_intrawave_v1,183.2,820.58,0.0
gfx950,256,208,4096,3072,ck,17,2,11.7962,a8w8_blockscale_bpreshuffle_1x128x128_256x64x64x256_16x16_16x16_16x16x1_16x16x1_1x32x1x8_8_2x1_intrawave_v1,443.74,1265.31,0.0
gfx950,256,224,4096,512,ck,11,2,4.8073,a8w8_blockscale_bpreshuffle_1x128x128_256x32x128x256_16x16_16x16_16x16x1_16x16x1_1x32x1x8_8_2x1_intrawave_v1,195.44,841.81,0.0
gfx950,256,224,4096,3072,ck,17,3,11.8189,a8w8_blockscale_bpreshuffle_1x128x128_256x64x64x256_16x16_16x16_16x16x1_16x16x1_1x32x1x8_8_2x1_intrawave_v1,476.96,1278.13,0.0
gfx950,256,240,4096,512,ck,11,1,4.7521,a8w8_blockscale_bpreshuffle_1x128x128_256x32x128x256_16x16_16x16_16x16x1_16x16x1_1x32x1x8_8_2x1_intrawave_v1,211.83,880.9,0.0
gfx950,256,240,4096,3072,ck,17,1,11.8801,a8w8_blockscale_bpreshuffle_1x128x128_256x64x64x256_16x16_16x16_16x16x1_16x16x1_1x32x1x8_8_2x1_intrawave_v1,508.4,1286.71,0.0
gfx950,256,256,4096,512,ck,11,2,4.7337,a8w8_blockscale_bpreshuffle_1x128x128_256x32x128x256_16x16_16x16_16x16x1_16x16x1_1x32x1x8_8_2x1_intrawave_v1,226.83,913.74,0.0
gfx950,256,256,4096,3072,ck,17,2,11.5786,a8w8_blockscale_bpreshuffle_1x128x128_256x64x64x256_16x16_16x16_16x16x1_16x16x1_1x32x1x8_8_2x1_intrawave_v1,556.41,1335.78,0.0
gfx950,256,288,4096,512,ck,12,2,5.7243,a8w8_blockscale_bpreshuffle_1x128x128_256x32x64x256_16x16_16x16_16x16x1_16x16x1_1x32x1x8_8_2x1_intrawave_v1,211.02,804.27,0.0
gfx950,256,288,4096,3072,asm,8,1,14.4923,_ZN5aiter42fp8gemm_bf16_blockscale_BpreShuffle_48x128E,500.11,1092.09,0.0
gfx950,256,320,4096,512,ck,12,3,5.7755,a8w8_blockscale_bpreshuffle_1x128x128_256x32x64x256_16x16_16x16_16x16x1_16x16x1_1x32x1x8_8_2x1_intrawave_v1,232.39,845.37,0.0
gfx950,256,320,4096,3072,asm,8,1,14.6266,_ZN5aiter42fp8gemm_bf16_blockscale_BpreShuffle_48x128E,550.58,1106.71,0.0
gfx950,256,352,4096,512,ck,12,0,5.8203,a8w8_blockscale_bpreshuffle_1x128x128_256x32x64x256_16x16_16x16_16x16x1_16x16x1_1x32x1x8_8_2x1_intrawave_v1,253.66,886.72,0.0
gfx950,256,352,4096,3072,asm,8,1,14.722,_ZN5aiter42fp8gemm_bf16_blockscale_BpreShuffle_48x128E,601.71,1124.02,0.0
gfx950,256,384,4096,512,ck,12,0,5.8685,a8w8_blockscale_bpreshuffle_1x128x128_256x32x64x256_16x16_16x16_16x16x1_16x16x1_1x32x1x8_8_2x1_intrawave_v1,274.45,926.9,0.0
gfx950,256,384,4096,3072,asm,8,1,14.8001,_ZN5aiter42fp8gemm_bf16_blockscale_BpreShuffle_48x128E,652.95,1142.44,0.0
gfx950,256,416,4096,512,ck,7,0,6.0603,a8w8_blockscale_bpreshuffle_1x128x128_256x16x64x256_16x16_16x16_16x16x1_16x16x1_1x16x1x16_4_1x1_intrawave_v1,287.91,943.52,0.0
gfx950,256,416,4096,3072,asm,16,1,15.6767,_ZN5aiter42fp8gemm_bf16_blockscale_BpreShuffle_64x128E,667.81,1101.55,0.0
gfx950,256,448,4096,512,ck,15,0,6.0223,a8w8_blockscale_bpreshuffle_1x128x128_256x64x64x128_16x16_16x16_8x32x1_8x32x1_1x32x1x8_8_2x1_intrawave_v1,312.02,995.72,0.0001
gfx950,256,448,4096,3072,asm,16,1,15.7201,_ZN5aiter42fp8gemm_bf16_blockscale_BpreShuffle_64x128E,717.19,1121.44,0.0
gfx950,256,480,4096,512,ck,15,1,6.0166,a8w8_blockscale_bpreshuffle_1x128x128_256x64x64x128_16x16_16x16_8x32x1_8x32x1_1x32x1x8_8_2x1_intrawave_v1,334.62,1042.96,0.0122
gfx950,256,480,4096,3072,asm,16,1,15.7477,_ZN5aiter42fp8gemm_bf16_blockscale_BpreShuffle_64x128E,767.07,1142.37,0.0
gfx950,256,512,4096,512,ck,9,2,6.0597,a8w8_blockscale_bpreshuffle_1x128x128_256x32x128x128_16x16_16x16_8x32x1_8x32x1_1x32x1x8_8_2x1_intrawave_v1,354.39,1081.51,0.0
gfx950,256,512,4096,3072,asm,16,1,15.937,_ZN5aiter42fp8gemm_bf16_blockscale_BpreShuffle_64x128E,808.49,1151.41,0.0
gfx950,256,544,4096,512,ck,11,2,6.3309,a8w8_blockscale_bpreshuffle_1x128x128_256x32x128x256_16x16_16x16_16x16x1_16x16x1_1x32x1x8_8_2x1_intrawave_v1,360.41,1079.17,0.0
gfx950,256,544,4096,3072,asm,24,1,17.1008,_ZN5aiter42fp8gemm_bf16_blockscale_BpreShuffle_80x128E,800.56,1094.13,0.0
gfx950,256,576,4096,512,ck,9,3,6.3106,a8w8_blockscale_bpreshuffle_1x128x128_256x32x128x128_16x16_16x16_8x32x1_8x32x1_1x32x1x8_8_2x1_intrawave_v1,382.84,1126.78,0.0
gfx950,256,576,4096,3072,asm,24,1,17.4405,_ZN5aiter42fp8gemm_bf16_blockscale_BpreShuffle_80x128E,831.14,1093.49,0.0
gfx950,256,608,4096,512,ck,9,3,6.3107,a8w8_blockscale_bpreshuffle_1x128x128_256x32x128x128_16x16_16x16_8x32x1_8x32x1_1x32x1x8_8_2x1_intrawave_v1,404.1,1170.9,0.0
gfx950,256,608,4096,3072,asm,24,1,17.2655,_ZN5aiter42fp8gemm_bf16_blockscale_BpreShuffle_80x128E,886.21,1125.45,0.0
gfx950,256,640,4096,512,ck,12,1,6.5354,a8w8_blockscale_bpreshuffle_1x128x128_256x32x64x256_16x16_16x16_16x16x1_16x16x1_1x32x1x8_8_2x1_intrawave_v1,410.74,1173.26,0.0
gfx950,256,640,4096,3072,asm,24,1,17.8108,_ZN5aiter42fp8gemm_bf16_blockscale_BpreShuffle_80x128E,904.29,1111.23,0.0
gfx950,256,672,4096,512,ck,9,2,6.5833,a8w8_blockscale_bpreshuffle_1x128x128_256x32x128x128_16x16_16x16_8x32x1_8x32x1_1x32x1x8_8_2x1_intrawave_v1,428.14,1207.03,0.0
gfx950,256,672,4096,3072,asm,32,1,19.4713,_ZN5aiter42fp8gemm_bf16_blockscale_BpreShuffle_96x128E,868.53,1034.98,0.0
gfx950,256,704,4096,512,ck,11,2,6.711,a8w8_blockscale_bpreshuffle_1x128x128_256x32x128x256_16x16_16x16_16x16x1_16x16x1_1x32x1x8_8_2x1_intrawave_v1,439.99,1225.57,0.0
gfx950,256,704,4096,3072,asm,32,1,19.1316,_ZN5aiter42fp8gemm_bf16_blockscale_BpreShuffle_96x128E,926.05,1072.19,0.0
gfx950,256,736,4096,512,ck,11,2,7.0987,a8w8_blockscale_bpreshuffle_1x128x128_256x32x128x256_16x16_16x16_16x16x1_16x16x1_1x32x1x8_8_2x1_intrawave_v1,434.87,1197.87,0.0
gfx950,256,736,4096,3072,asm,32,1,19.2547,_ZN5aiter42fp8gemm_bf16_blockscale_BpreShuffle_96x128E,961.95,1084.06,0.0
gfx950,256,768,4096,512,ck,9,0,6.8799,a8w8_blockscale_bpreshuffle_1x128x128_256x32x128x128_16x16_16x16_8x32x1_8x32x1_1x32x1x8_8_2x1_intrawave_v1,468.21,1276.45,0.0
gfx950,256,768,4096,3072,asm,32,1,19.3192,_ZN5aiter42fp8gemm_bf16_blockscale_BpreShuffle_96x128E,1000.42,1099.1,0.0
gfx950,256,800,4096,512,ck,9,3,8.1419,a8w8_blockscale_bpreshuffle_1x128x128_256x32x128x128_16x16_16x16_8x32x1_8x32x1_1x32x1x8_8_2x1_intrawave_v1,412.12,1112.81,0.0
gfx950,256,800,4096,3072,asm,40,1,23.1091,_ZN5aiter43fp8gemm_bf16_blockscale_BpreShuffle_128x128E,871.2,934.44,0.0
gfx950,256,832,4096,512,ck,16,0,8.2291,a8w8_blockscale_bpreshuffle_1x128x128_256x64x128x256_16x16_16x16_16x16x1_16x16x1_1x32x1x8_8_2x1_intrawave_v1,424.06,1134.86,0.0
gfx950,256,832,4096,3072,ck,14,2,22.6787,a8w8_blockscale_bpreshuffle_1x128x128_256x64x128x128_16x16_16x16_8x32x1_8x32x1_1x32x1x8_8_2x1_intrawave_v1,923.24,968.07,0.0001
gfx950,256,864,4096,512,ck,14,2,8.1323,a8w8_blockscale_bpreshuffle_1x128x128_256x64x128x128_16x16_16x16_8x32x1_8x32x1_1x32x1x8_8_2x1_intrawave_v1,445.62,1182.62,0.0
gfx950,256,864,4096,3072,ck,14,3,23.4387,a8w8_blockscale_bpreshuffle_1x128x128_256x64x128x128_16x16_16x16_8x32x1_8x32x1_1x32x1x8_8_2x1_intrawave_v1,927.67,952.06,0.0001
gfx950,256,896,4096,512,ck,12,1,8.2695,a8w8_blockscale_bpreshuffle_1x128x128_256x32x64x256_16x16_16x16_16x16x1_16x16x1_1x32x1x8_8_2x1_intrawave_v1,454.45,1196.68,0.0
gfx950,256,896,4096,3072,ck,14,1,23.3659,a8w8_blockscale_bpreshuffle_1x128x128_256x64x128x128_16x16_16x16_8x32x1_8x32x1_1x32x1x8_8_2x1_intrawave_v1,965.02,970.45,0.0001
gfx950,256,928,4096,512,ck,16,2,8.5579,a8w8_blockscale_bpreshuffle_1x128x128_256x64x128x256_16x16_16x16_16x16x1_16x16x1_1x32x1x8_8_2x1_intrawave_v1,454.82,1188.9,0.0
gfx950,256,928,4096,3072,asm,40,1,23.5093,_ZN5aiter43fp8gemm_bf16_blockscale_BpreShuffle_128x128E,993.39,979.86,0.0
gfx950,256,960,4096,512,ck,16,1,8.4661,a8w8_blockscale_bpreshuffle_1x128x128_256x64x128x256_16x16_16x16_16x16x1_16x16x1_1x32x1x8_8_2x1_intrawave_v1,475.61,1234.69,0.0
gfx950,256,960,4096,3072,ck,14,3,23.7112,a8w8_blockscale_bpreshuffle_1x128x128_256x64x128x128_16x16_16x16_8x32x1_8x32x1_1x32x1x8_8_2x1_intrawave_v1,1018.89,986.72,0.0001
gfx950,256,992,4096,512,ck,16,2,8.7551,a8w8_blockscale_bpreshuffle_1x128x128_256x64x128x256_16x16_16x16_16x16x1_16x16x1_1x32x1x8_8_2x1_intrawave_v1,475.24,1225.74,0.0
gfx950,256,992,4096,3072,asm,40,1,23.5538,_ZN5aiter43fp8gemm_bf16_blockscale_BpreShuffle_128x128E,1059.89,1008.62,0.0
gfx950,256,1024,4096,512,ck,16,3,8.7835,a8w8_blockscale_bpreshuffle_1x128x128_256x64x128x256_16x16_16x16_16x16x1_16x16x1_1x32x1x8_8_2x1_intrawave_v1,488.98,1253.49,0.0
gfx950,256,1024,4096,3072,asm,40,1,23.8252,_ZN5aiter43fp8gemm_bf16_blockscale_BpreShuffle_128x128E,1081.62,1012.26,0.0
gfx950,256,1088,4096,512,ck,11,3,10.1949,a8w8_blockscale_bpreshuffle_1x128x128_256x32x128x256_16x16_16x16_16x16x1_16x16x1_1x32x1x8_8_2x1_intrawave_v1,447.62,1134.6,0.0
gfx950,256,1088,4096,3072,ck,14,1,29.8181,a8w8_blockscale_bpreshuffle_1x128x128_256x64x128x128_16x16_16x16_8x32x1_8x32x1_1x32x1x8_8_2x1_intrawave_v1,918.25,832.99,0.0002
gfx950,256,1152,4096,512,ck,11,1,10.1493,a8w8_blockscale_bpreshuffle_1x128x128_256x32x128x256_16x16_16x16_16x16x1_16x16x1_1x32x1x8_8_2x1_intrawave_v1,476.08,1194.58,0.0
gfx950,256,1152,4096,3072,ck,14,2,29.8302,a8w8_blockscale_bpreshuffle_1x128x128_256x64x128x128_16x16_16x16_8x32x1_8x32x1_1x32x1x8_8_2x1_intrawave_v1,971.87,856.82,0.0002
gfx950,256,1216,4096,512,ck,9,0,10.3706,a8w8_blockscale_bpreshuffle_1x128x128_256x32x128x128_16x16_16x16_8x32x1_8x32x1_1x32x1x8_8_2x1_intrawave_v1,491.8,1222.8,0.0
gfx950,256,1216,4096,3072,ck,14,2,29.9089,a8w8_blockscale_bpreshuffle_1x128x128_256x64x128x128_16x16_16x16_8x32x1_8x32x1_1x32x1x8_8_2x1_intrawave_v1,1023.16,878.67,0.0001
gfx950,256,1280,4096,512,ck,11,1,10.1941,a8w8_blockscale_bpreshuffle_1x128x128_256x32x128x256_16x16_16x16_16x16x1_16x16x1_1x32x1x8_8_2x1_intrawave_v1,526.65,1298.62,0.0
gfx950,256,1280,4096,3072,ck,14,0,30.2437,a8w8_blockscale_bpreshuffle_1x128x128_256x64x128x128_16x16_16x16_8x32x1_8x32x1_1x32x1x8_8_2x1_intrawave_v1,1065.09,892.78,0.0002
gfx950,256,1344,4096,512,ck,11,3,10.9237,a8w8_blockscale_bpreshuffle_1x128x128_256x32x128x256_16x16_16x16_16x16x1_16x16x1_1x32x1x8_8_2x1_intrawave_v1,516.05,1262.88,0.0
gfx950,256,1344,4096,3072,ck,14,0,31.1831,a8w8_blockscale_bpreshuffle_1x128x128_256x64x128x128_16x16_16x16_8x32x1_8x32x1_1x32x1x8_8_2x1_intrawave_v1,1084.65,889.0,0.0001
gfx950,256,1408,4096,512,ck,14,3,11.0822,a8w8_blockscale_bpreshuffle_1x128x128_256x64x128x128_16x16_16x16_8x32x1_8x32x1_1x32x1x8_8_2x1_intrawave_v1,532.89,1295.08,0.0001
gfx950,256,1408,4096,3072,ck,14,1,31.7025,a8w8_blockscale_bpreshuffle_1x128x128_256x64x128x128_16x16_16x16_8x32x1_8x32x1_1x32x1x8_8_2x1_intrawave_v1,1117.69,897.17,0.0002
gfx950,256,1472,4096,512,ck,14,1,11.2016,a8w8_blockscale_bpreshuffle_1x128x128_256x64x128x128_16x16_16x16_8x32x1_8x32x1_1x32x1x8_8_2x1_intrawave_v1,551.17,1331.01,0.0001
gfx950,256,1472,4096,3072,ck,14,1,31.8961,a8w8_blockscale_bpreshuffle_1x128x128_256x64x128x128_16x16_16x16_8x32x1_8x32x1_1x32x1x8_8_2x1_intrawave_v1,1161.4,914.33,0.0002
gfx950,256,1536,4096,512,ck,14,3,11.3212,a8w8_blockscale_bpreshuffle_1x128x128_256x64x128x128_16x16_16x16_8x32x1_8x32x1_1x32x1x8_8_2x1_intrawave_v1,569.06,1366.15,0.0002
gfx950,256,1536,4096,3072,ck,13,1,32.3752,a8w8_blockscale_bpreshuffle_1x128x128_256x64x256x128_16x16_16x16_8x32x1_8x32x1_1x32x1x8_8_2x1_intrawave_v1,1193.96,923.07,0.0
gfx950,256,1600,4096,512,ck,11,1,12.1644,a8w8_blockscale_bpreshuffle_1x128x128_256x32x128x256_16x16_16x16_16x16x1_16x16x1_1x32x1x8_8_2x1_intrawave_v1,551.68,1317.25,0.0
gfx950,256,1600,4096,3072,ck,13,3,33.1053,a8w8_blockscale_bpreshuffle_1x128x128_256x64x256x128_16x16_16x16_8x32x1_8x32x1_1x32x1x8_8_2x1_intrawave_v1,1216.28,924.48,0.0
gfx950,256,1664,4096,512,ck,11,1,12.2937,a8w8_blockscale_bpreshuffle_1x128x128_256x32x128x256_16x16_16x16_16x16x1_16x16x1_1x32x1x8_8_2x1_intrawave_v1,567.72,1348.71,0.0
gfx950,256,1664,4096,3072,ck,13,3,33.6312,a8w8_blockscale_bpreshuffle_1x128x128_256x64x256x128_16x16_16x16_8x32x1_8x32x1_1x32x1x8_8_2x1_intrawave_v1,1245.15,931.46,0.0
gfx950,256,1728,4096,512,ck,11,1,12.4573,a8w8_blockscale_bpreshuffle_1x128x128_256x32x128x256_16x16_16x16_16x16x1_16x16x1_1x32x1x8_8_2x1_intrawave_v1,581.81,1375.71,0.0
gfx950,256,1728,4096,3072,ck,13,3,33.2495,a8w8_blockscale_bpreshuffle_1x128x128_256x64x256x128_16x16_16x16_8x32x1_8x32x1_1x32x1x8_8_2x1_intrawave_v1,1307.89,963.84,0.0
gfx950,256,1792,4096,512,ck,11,3,12.5727,a8w8_blockscale_bpreshuffle_1x128x128_256x32x128x256_16x16_16x16_16x16x1_16x16x1_1x32x1x8_8_2x1_intrawave_v1,597.82,1407.39,0.0
gfx950,256,1792,4096,3072,ck,13,3,33.6704,a8w8_blockscale_bpreshuffle_1x128x128_256x64x256x128_16x16_16x16_8x32x1_8x32x1_1x32x1x8_8_2x1_intrawave_v1,1339.37,973.2,0.0
gfx950,256,1856,4096,512,ck,11,0,13.3033,a8w8_blockscale_bpreshuffle_1x128x128_256x32x128x256_16x16_16x16_16x16x1_16x16x1_1x32x1x8_8_2x1_intrawave_v1,585.17,1371.97,0.0
gfx950,256,1856,4096,3072,ck,13,2,35.6071,a8w8_blockscale_bpreshuffle_1x128x128_256x64x256x128_16x16_16x16_8x32x1_8x32x1_1x32x1x8_8_2x1_intrawave_v1,1311.75,940.51,0.0
gfx950,256,1920,4096,512,ck,11,3,13.6155,a8w8_blockscale_bpreshuffle_1x128x128_256x32x128x256_16x16_16x16_16x16x1_16x16x1_1x32x1x8_8_2x1_intrawave_v1,591.46,1381.43,0.0
gfx950,256,1920,4096,3072,ck,13,3,37.0853,a8w8_blockscale_bpreshuffle_1x128x128_256x64x256x128_16x16_16x16_8x32x1_8x32x1_1x32x1x8_8_2x1_intrawave_v1,1302.9,922.46,0.0
gfx950,256,1984,4096,512,ck,16,0,13.8619,a8w8_blockscale_bpreshuffle_1x128x128_256x64x128x256_16x16_16x16_16x16x1_16x16x1_1x32x1x8_8_2x1_intrawave_v1,600.31,1397.06,0.0
gfx950,256,1984,4096,3072,ck,13,3,38.9825,a8w8_blockscale_bpreshuffle_1x128x128_256x64x256x128_16x16_16x16_8x32x1_8x32x1_1x32x1x8_8_2x1_intrawave_v1,1280.81,896.06,0.0
gfx950,256,2048,4096,512,ck,9,2,14.4383,a8w8_blockscale_bpreshuffle_1x128x128_256x32x128x128_16x16_16x16_8x32x1_8x32x1_1x32x1x8_8_2x1_intrawave_v1,594.94,1379.87,0.0
gfx950,256,2048,4096,3072,ck,13,1,39.4437,a8w8_blockscale_bpreshuffle_1x128x128_256x64x256x128_16x16_16x16_8x32x1_8x32x1_1x32x1x8_8_2x1_intrawave_v1,1306.66,903.86,0.0
gfx950,256,4096,4096,512,ck,16,3,23.585,a8w8_blockscale_bpreshuffle_1x128x128_256x64x128x256_16x16_16x16_16x16x1_16x16x1_1x32x1x8_8_2x1_intrawave_v1,728.42,1600.54,0.0
gfx950,256,4096,4096,3072,ck,13,2,71.402,a8w8_blockscale_bpreshuffle_1x128x128_256x64x256x128_16x16_16x16_8x32x1_8x32x1_1x32x1x8_8_2x1_intrawave_v1,1443.65,822.39,0.0
gfx950,256,8192,4096,512,ck,16,1,41.9105,a8w8_blockscale_bpreshuffle_1x128x128_256x64x128x256_16x16_16x16_16x16x1_16x16x1_1x32x1x8_8_2x1_intrawave_v1,819.84,1751.36,0.0
gfx950,256,8192,4096,3072,ck,13,2,132.4593,a8w8_blockscale_bpreshuffle_1x128x128_256x64x256x128_16x16_16x16_8x32x1_8x32x1_1x32x1x8_8_2x1_intrawave_v1,1556.39,791.62,0.0
gfx950,256,16384,4096,512,ck,16,2,78.2029,a8w8_blockscale_bpreshuffle_1x128x128_256x64x128x256_16x16_16x16_16x16x1_16x16x1_1x32x1x8_8_2x1_intrawave_v1,878.73,1850.36,0.0
gfx950,256,16384,4096,3072,ck,13,3,248.0474,a8w8_blockscale_bpreshuffle_1x128x128_256x64x256x128_16x16_16x16_8x32x1_8x32x1_1x32x1x8_8_2x1_intrawave_v1,1662.25,794.74,0.0
gfx950,256,32768,4096,512,ck,16,2,143.2204,a8w8_blockscale_bpreshuffle_1x128x128_256x64x128x256_16x16_16x16_16x16x1_16x16x1_1x32x1x8_8_2x1_intrawave_v1,959.63,2006.07,0.0
gfx950,256,32768,4096,3072,ck,13,3,481.3425,a8w8_blockscale_bpreshuffle_1x128x128_256x64x256x128_16x16_16x16_8x32x1_8x32x1_1x32x1x8_8_2x1_intrawave_v1,1713.2,792.95,0.0
gfx950,256,16,4608,7168,asm,22,7,10.2718,_ZN5aiter42fp8gemm_bf16_blockscale_BpreShuffle_64x128E,102.9,3241.13,0.0059
gfx950,256,32,4608,7168,asm,29,6,11.6205,_ZN5aiter42fp8gemm_bf16_blockscale_BpreShuffle_80x128E,181.91,2887.52,0.004
gfx950,256,48,4608,7168,asm,13,6,13.7652,_ZN5aiter42fp8gemm_bf16_blockscale_BpreShuffle_48x128E,230.36,2456.67,0.0037
gfx950,256,64,4608,7168,asm,29,6,12.857,_ZN5aiter42fp8gemm_bf16_blockscale_BpreShuffle_80x128E,328.84,2650.6,0.0036
gfx950,256,80,4608,7168,asm,37,6,14.7725,_ZN5aiter42fp8gemm_bf16_blockscale_BpreShuffle_96x128E,357.75,2324.65,0.0047
gfx950,256,96,4608,7168,asm,37,6,15.4561,_ZN5aiter42fp8gemm_bf16_blockscale_BpreShuffle_96x128E,410.31,2238.79,0.0039
gfx950,256,112,4608,7168,asm,18,3,17.8925,_ZN5aiter42fp8gemm_bf16_blockscale_BpreShuffle_64x128E,413.51,1948.59,0.0004
gfx950,256,128,4608,7168,asm,18,3,18.0058,_ZN5aiter42fp8gemm_bf16_blockscale_BpreShuffle_64x128E,469.61,1950.89,0.0004
gfx950,256,144,4608,7168,asm,26,3,20.2285,_ZN5aiter42fp8gemm_bf16_blockscale_BpreShuffle_80x128E,470.26,1749.48,0.0004
gfx950,256,160,4608,7168,asm,26,3,20.8025,_ZN5aiter42fp8gemm_bf16_blockscale_BpreShuffle_80x128E,508.09,1713.81,0.0004
gfx950,256,176,4608,7168,asm,34,3,21.847,_ZN5aiter42fp8gemm_bf16_blockscale_BpreShuffle_96x128E,532.18,1643.87,0.0004
gfx950,256,192,4608,7168,ck,17,3,21.9076,a8w8_blockscale_bpreshuffle_1x128x128_256x64x64x256_16x16_16x16_16x16x1_16x16x1_1x32x1x8_8_2x1_intrawave_v1,578.96,1651.29,0.0
gfx950,256,208,4608,7168,asm,42,3,23.3806,_ZN5aiter43fp8gemm_bf16_blockscale_BpreShuffle_128x128E,587.69,1558.47,0.0004
gfx950,256,224,4608,7168,ck,11,3,23.044,a8w8_blockscale_bpreshuffle_1x128x128_256x32x128x256_16x16_16x16_16x16x1_16x16x1_1x32x1x8_8_2x1_intrawave_v1,642.14,1592.61,0.0
gfx950,256,240,4608,7168,asm,25,2,25.8285,_ZN5aiter42fp8gemm_bf16_blockscale_BpreShuffle_80x128E,613.84,1431.07,0.0
gfx950,256,256,4608,7168,asm,33,2,26.9625,_ZN5aiter42fp8gemm_bf16_blockscale_BpreShuffle_96x128E,627.22,1380.6,0.0
gfx950,256,288,4608,7168,asm,33,2,27.8307,_ZN5aiter42fp8gemm_bf16_blockscale_BpreShuffle_96x128E,683.61,1356.37,0.0
gfx950,256,320,4608,7168,asm,8,1,29.3886,_ZN5aiter42fp8gemm_bf16_blockscale_BpreShuffle_48x128E,719.3,1302.31,0.0
gfx950,256,352,4608,7168,asm,41,2,30.6762,_ZN5aiter43fp8gemm_bf16_blockscale_BpreShuffle_128x128E,758.02,1264.74,0.0
gfx950,256,384,4608,7168,asm,16,1,30.5188,_ZN5aiter42fp8gemm_bf16_blockscale_BpreShuffle_64x128E,831.2,1288.44,0.0
gfx950,256,416,4608,7168,asm,16,1,30.6272,_ZN5aiter42fp8gemm_bf16_blockscale_BpreShuffle_64x128E,897.28,1301.0,0.0
gfx950,256,448,4608,7168,asm,16,1,31.1697,_ZN5aiter42fp8gemm_bf16_blockscale_BpreShuffle_64x128E,949.48,1295.17,0.0
gfx950,256,480,4608,7168,asm,24,1,33.299,_ZN5aiter42fp8gemm_bf16_blockscale_BpreShuffle_80x128E,952.25,1228.1,0.0
gfx950,256,512,4608,7168,asm,24,1,33.577,_ZN5aiter42fp8gemm_bf16_blockscale_BpreShuffle_80x128E,1007.32,1233.55,0.0
gfx950,256,544,4608,7168,asm,24,1,33.9623,_ZN5aiter42fp8gemm_bf16_blockscale_BpreShuffle_80x128E,1058.14,1234.99,0.0
gfx950,256,576,4608,7168,asm,32,1,36.4667,_ZN5aiter42fp8gemm_bf16_blockscale_BpreShuffle_96x128E,1043.44,1164.55,0.0
gfx950,256,608,4608,7168,asm,32,1,39.2737,_ZN5aiter42fp8gemm_bf16_blockscale_BpreShuffle_96x128E,1022.69,1094.67,0.0
gfx950,256,640,4608,7168,asm,32,1,37.7105,_ZN5aiter42fp8gemm_bf16_blockscale_BpreShuffle_96x128E,1121.14,1153.95,0.0
gfx950,256,672,4608,7168,asm,32,1,38.6714,_ZN5aiter42fp8gemm_bf16_blockscale_BpreShuffle_96x128E,1147.94,1138.83,0.0
gfx950,256,704,4608,7168,asm,40,1,45.5781,_ZN5aiter43fp8gemm_bf16_blockscale_BpreShuffle_128x128E,1020.37,977.76,0.0
gfx950,256,736,4608,7168,asm,40,1,47.3086,_ZN5aiter43fp8gemm_bf16_blockscale_BpreShuffle_128x128E,1027.73,953.08,0.0
gfx950,256,768,4608,7168,asm,40,1,46.0129,_ZN5aiter43fp8gemm_bf16_blockscale_BpreShuffle_128x128E,1102.61,991.31,0.0
gfx950,256,800,4608,7168,asm,40,1,47.395,_ZN5aiter43fp8gemm_bf16_blockscale_BpreShuffle_128x128E,1115.06,973.46,0.0
gfx950,256,832,4608,7168,ck,13,1,48.1976,a8w8_blockscale_bpreshuffle_1x128x128_256x64x256x128_16x16_16x16_8x32x1_8x32x1_1x32x1x8_8_2x1_intrawave_v1,1140.35,968.13,0.0
gfx950,256,864,4608,7168,asm,40,1,49.4742,_ZN5aiter43fp8gemm_bf16_blockscale_BpreShuffle_128x128E,1153.65,953.75,0.0
gfx950,256,896,4608,7168,ck,13,0,49.2493,a8w8_blockscale_bpreshuffle_1x128x128_256x64x256x128_16x16_16x16_8x32x1_8x32x1_1x32x1x8_8_2x1_intrawave_v1,1201.84,968.75,0.0
gfx950,256,928,4608,7168,ck,14,2,61.0416,a8w8_blockscale_bpreshuffle_1x128x128_256x64x128x128_16x16_16x16_8x32x1_8x32x1_1x32x1x8_8_2x1_intrawave_v1,1004.3,790.19,0.0001
gfx950,256,960,4608,7168,ck,13,2,60.7415,a8w8_blockscale_bpreshuffle_1x128x128_256x64x256x128_16x16_16x16_8x32x1_8x32x1_1x32x1x8_8_2x1_intrawave_v1,1044.06,802.73,0.0
gfx950,256,992,4608,7168,ck,14,2,64.9887,a8w8_blockscale_bpreshuffle_1x128x128_256x64x128x128_16x16_16x16_8x32x1_8x32x1_1x32x1x8_8_2x1_intrawave_v1,1008.36,758.33,0.0001
gfx950,256,1024,4608,7168,ck,14,3,64.9234,a8w8_blockscale_bpreshuffle_1x128x128_256x64x128x128_16x16_16x16_8x32x1_8x32x1_1x32x1x8_8_2x1_intrawave_v1,1041.93,767.17,0.0001
gfx950,256,1088,4608,7168,ck,14,0,62.6762,a8w8_blockscale_bpreshuffle_1x128x128_256x64x128x128_16x16_16x16_8x32x1_8x32x1_1x32x1x8_8_2x1_intrawave_v1,1146.74,811.41,0.0002
gfx950,256,1152,4608,7168,ck,13,2,63.8589,a8w8_blockscale_bpreshuffle_1x128x128_256x64x256x128_16x16_16x16_8x32x1_8x32x1_1x32x1x8_8_2x1_intrawave_v1,1191.71,812.8,0.0
gfx950,256,1216,4608,7168,ck,14,3,64.0235,a8w8_blockscale_bpreshuffle_1x128x128_256x64x128x128_16x16_16x16_8x32x1_8x32x1_1x32x1x8_8_2x1_intrawave_v1,1254.68,827.09,0.0001
gfx950,256,1280,4608,7168,ck,13,3,65.4649,a8w8_blockscale_bpreshuffle_1x128x128_256x64x256x128_16x16_16x16_8x32x1_8x32x1_1x32x1x8_8_2x1_intrawave_v1,1291.64,824.89,0.0
gfx950,256,1344,4608,7168,ck,14,2,68.5828,a8w8_blockscale_bpreshuffle_1x128x128_256x64x128x128_16x16_16x16_8x32x1_8x32x1_1x32x1x8_8_2x1_intrawave_v1,1294.57,802.68,0.0002
gfx950,256,1408,4608,7168,ck,13,1,65.8692,a8w8_blockscale_bpreshuffle_1x128x128_256x64x256x128_16x16_16x16_8x32x1_8x32x1_1x32x1x8_8_2x1_intrawave_v1,1412.08,851.67,0.0
gfx950,256,1472,4608,7168,ck,13,3,69.1204,a8w8_blockscale_bpreshuffle_1x128x128_256x64x256x128_16x16_16x16_8x32x1_8x32x1_1x32x1x8_8_2x1_intrawave_v1,1406.83,826.78,0.0
gfx950,256,1536,4608,7168,ck,13,3,73.8412,a8w8_blockscale_bpreshuffle_1x128x128_256x64x256x128_16x16_16x16_8x32x1_8x32x1_1x32x1x8_8_2x1_intrawave_v1,1374.15,788.12,0.0
gfx950,256,1600,4608,7168,ck,13,2,74.9489,a8w8_blockscale_bpreshuffle_1x128x128_256x64x256x128_16x16_16x16_8x32x1_8x32x1_1x32x1x8_8_2x1_intrawave_v1,1410.25,790.47,0.0
gfx950,256,1664,4608,7168,ck,13,0,76.3776,a8w8_blockscale_bpreshuffle_1x128x128_256x64x256x128_16x16_16x16_8x32x1_8x32x1_1x32x1x8_8_2x1_intrawave_v1,1439.22,789.41,0.0
gfx950,256,1728,4608,7168,ck,13,1,77.1936,a8w8_blockscale_bpreshuffle_1x128x128_256x64x256x128_16x16_16x16_8x32x1_8x32x1_1x32x1x8_8_2x1_intrawave_v1,1478.78,794.65,0.0
gfx950,256,1792,4608,7168,ck,13,0,78.3613,a8w8_blockscale_bpreshuffle_1x128x128_256x64x256x128_16x16_16x16_8x32x1_8x32x1_1x32x1x8_8_2x1_intrawave_v1,1510.7,796.19,0.0
gfx950,256,1856,4608,7168,ck,14,1,99.0642,a8w8_blockscale_bpreshuffle_1x128x128_256x64x128x128_16x16_16x16_8x32x1_8x32x1_1x32x1x8_8_2x1_intrawave_v1,1237.66,640.38,0.0002
gfx950,256,1920,4608,7168,ck,14,2,99.9722,a8w8_blockscale_bpreshuffle_1x128x128_256x64x128x128_16x16_16x16_8x32x1_8x32x1_1x32x1x8_8_2x1_intrawave_v1,1268.71,645.05,0.0001
gfx950,256,1984,4608,7168,ck,13,3,101.9007,a8w8_blockscale_bpreshuffle_1x128x128_256x64x256x128_16x16_16x16_8x32x1_8x32x1_1x32x1x8_8_2x1_intrawave_v1,1286.19,643.14,0.0
gfx950,256,2048,4608,7168,ck,14,2,105.2531,a8w8_blockscale_bpreshuffle_1x128x128_256x64x128x128_16x16_16x16_8x32x1_8x32x1_1x32x1x8_8_2x1_intrawave_v1,1285.39,632.61,0.0002
gfx950,256,4096,4608,7168,ck,13,2,171.4096,a8w8_blockscale_bpreshuffle_1x128x128_256x64x256x128_16x16_16x16_8x32x1_8x32x1_1x32x1x8_8_2x1_intrawave_v1,1578.58,584.21,0.0
gfx950,256,8192,4608,7168,ck,13,0,305.5678,a8w8_blockscale_bpreshuffle_1x128x128_256x64x256x128_16x16_16x16_8x32x1_8x32x1_1x32x1x8_8_2x1_intrawave_v1,1771.02,547.33,0.0
gfx950,256,16384,4608,7168,ck,13,3,574.1814,a8w8_blockscale_bpreshuffle_1x128x128_256x64x256x128_16x16_16x16_8x32x1_8x32x1_1x32x1x8_8_2x1_intrawave_v1,1885.0,525.04,0.0
gfx950,256,32768,4608,7168,ck,13,2,1114.2846,a8w8_blockscale_bpreshuffle_1x128x128_256x64x256x128_16x16_16x16_8x32x1_8x32x1_1x32x1x8_8_2x1_intrawave_v1,1942.65,511.45,0.0
gfx950,256,16,7168,2048,ck,7,3,7.2132,a8w8_blockscale_bpreshuffle_1x128x128_256x16x64x256_16x16_16x16_16x16x1_16x16x1_1x16x1x16_4_1x1_intrawave_v1,65.13,2071.51,0.0
gfx950,256,16,7168,2304,ck,7,0,8.067,a8w8_blockscale_bpreshuffle_1x128x128_256x16x64x256_16x16_16x16_16x16x1_16x16x1_1x16x1x16_4_1x1_intrawave_v1,65.51,2080.24,0.0
gfx950,256,32,7168,2048,ck,7,0,7.222,a8w8_blockscale_bpreshuffle_1x128x128_256x16x64x256_16x16_16x16_16x16x1_16x16x1_1x16x1x16_4_1x1_intrawave_v1,130.09,2105.28,0.0
gfx950,256,32,7168,2304,ck,7,3,8.253,a8w8_blockscale_bpreshuffle_1x128x128_256x16x64x256_16x16_16x16_16x16x1_16x16x1_1x16x1x16_4_1x1_intrawave_v1,128.07,2065.62,0.0
gfx950,256,48,7168,2048,ck,6,3,7.9865,a8w8_blockscale_bpreshuffle_1x128x128_256x16x128x256_16x16_16x16_16x16x1_16x16x1_1x16x1x16_8_1x2_intrawave_v1,176.46,1936.58,0.0
gfx950,256,48,7168,2304,ck,7,0,9.4657,a8w8_blockscale_bpreshuffle_1x128x128_256x16x64x256_16x16_16x16_16x16x1_16x16x1_1x16x1x16_4_1x1_intrawave_v1,167.49,1829.11,0.0
gfx950,256,64,7168,2048,ck,6,1,8.335,a8w8_blockscale_bpreshuffle_1x128x128_256x16x128x256_16x16_16x16_16x16x1_16x16x1_1x16x1x16_8_1x2_intrawave_v1,225.44,1887.06,0.0
gfx950,256,64,7168,2304,ck,12,0,9.5781,a8w8_blockscale_bpreshuffle_1x128x128_256x32x64x256_16x16_16x16_16x16x1_16x16x1_1x32x1x8_8_2x1_intrawave_v1,220.7,1835.44,0.0
gfx950,256,80,7168,2048,ck,11,1,9.4105,a8w8_blockscale_bpreshuffle_1x128x128_256x32x128x256_16x16_16x16_16x16x1_16x16x1_1x32x1x8_8_2x1_intrawave_v1,249.59,1699.25,0.0
gfx950,256,80,7168,2304,ck,17,2,9.9321,a8w8_blockscale_bpreshuffle_1x128x128_256x64x64x256_16x16_16x16_16x16x1_16x16x1_1x32x1x8_8_2x1_intrawave_v1,266.05,1796.83,0.0
gfx950,256,96,7168,2048,ck,11,2,9.625,a8w8_blockscale_bpreshuffle_1x128x128_256x32x128x256_16x16_16x16_16x16x1_16x16x1_1x32x1x8_8_2x1_intrawave_v1,292.84,1688.62,0.0
gfx950,256,96,7168,2304,ck,17,1,9.9563,a8w8_blockscale_bpreshuffle_1x128x128_256x64x64x256_16x16_16x16_16x16x1_16x16x1_1x32x1x8_8_2x1_intrawave_v1,318.48,1819.2,0.0
gfx950,256,112,7168,2048,ck,11,1,9.4953,a8w8_blockscale_bpreshuffle_1x128x128_256x32x128x256_16x16_16x16_16x16x1_16x16x1_1x32x1x8_8_2x1_intrawave_v1,346.31,1739.29,0.0
gfx950,256,112,7168,2304,ck,17,0,10.0093,a8w8_blockscale_bpreshuffle_1x128x128_256x64x64x256_16x16_16x16_16x16x1_16x16x1_1x32x1x8_8_2x1_intrawave_v1,369.59,1836.17,0.0
gfx950,256,128,7168,2048,ck,11,0,9.471,a8w8_blockscale_bpreshuffle_1x128x128_256x32x128x256_16x16_16x16_16x16x1_16x16x1_1x32x1x8_8_2x1_intrawave_v1,396.8,1771.43,0.0
gfx950,256,128,7168,2304,ck,17,3,10.0901,a8w8_blockscale_bpreshuffle_1x128x128_256x64x64x256_16x16_16x16_16x16x1_16x16x1_1x32x1x8_8_2x1_intrawave_v1,419.01,1847.85,0.0
gfx950,256,144,7168,2048,asm,8,1,11.1728,_ZN5aiter42fp8gemm_bf16_blockscale_BpreShuffle_48x128E,378.41,1525.08,0.0
gfx950,256,144,7168,2304,asm,8,1,12.1844,_ZN5aiter42fp8gemm_bf16_blockscale_BpreShuffle_48x128E,390.36,1552.09,0.0
gfx950,256,160,7168,2048,asm,8,1,11.2214,_ZN5aiter42fp8gemm_bf16_blockscale_BpreShuffle_48x128E,418.63,1541.83,0.0
gfx950,256,160,7168,2304,asm,8,1,12.1653,_ZN5aiter42fp8gemm_bf16_blockscale_BpreShuffle_48x128E,434.42,1576.41,0.0
gfx950,256,176,7168,2048,asm,8,1,11.5129,_ZN5aiter42fp8gemm_bf16_blockscale_BpreShuffle_48x128E,448.83,1525.56,0.0
gfx950,256,176,7168,2304,asm,8,1,12.5851,_ZN5aiter42fp8gemm_bf16_blockscale_BpreShuffle_48x128E,461.92,1544.98,0.0
gfx950,256,192,7168,2048,asm,8,1,11.6453,_ZN5aiter42fp8gemm_bf16_blockscale_BpreShuffle_48x128E,484.07,1530.73,0.0
gfx950,256,192,7168,2304,asm,8,1,12.6184,_ZN5aiter42fp8gemm_bf16_blockscale_BpreShuffle_48x128E,502.58,1562.0,0.0
gfx950,256,208,7168,2048,asm,16,1,12.0625,_ZN5aiter42fp8gemm_bf16_blockscale_BpreShuffle_64x128E,506.27,1499.52,0.0
gfx950,256,208,7168,2304,asm,16,1,13.1559,_ZN5aiter42fp8gemm_bf16_blockscale_BpreShuffle_64x128E,522.22,1518.42,0.0
gfx950,256,224,7168,2048,ck,17,0,12.3478,a8w8_blockscale_bpreshuffle_1x128x128_256x64x64x256_16x16_16x16_16x16x1_16x16x1_1x32x1x8_8_2x1_intrawave_v1,532.62,1486.1,0.0
gfx950,256,224,7168,2304,asm,16,1,13.3633,_ZN5aiter42fp8gemm_bf16_blockscale_BpreShuffle_64x128E,553.66,1514.78,0.0
gfx950,256,240,7168,2048,asm,16,1,12.4016,_ZN5aiter42fp8gemm_bf16_blockscale_BpreShuffle_64x128E,568.19,1500.79,0.0
gfx950,256,240,7168,2304,asm,16,1,13.2042,_ZN5aiter42fp8gemm_bf16_blockscale_BpreShuffle_64x128E,600.36,1553.19,0.0
gfx950,256,256,7168,2048,asm,16,1,12.2335,_ZN5aiter42fp8gemm_bf16_blockscale_BpreShuffle_64x128E,614.39,1542.84,0.0
gfx950,256,256,7168,2304,asm,16,1,13.6382,_ZN5aiter42fp8gemm_bf16_blockscale_BpreShuffle_64x128E,620.0,1523.29,0.0
gfx950,256,288,7168,2048,asm,24,1,13.7055,_ZN5aiter42fp8gemm_bf16_blockscale_BpreShuffle_80x128E,616.96,1415.39,0.0
gfx950,256,288,7168,2304,asm,24,1,14.4966,_ZN5aiter42fp8gemm_bf16_blockscale_BpreShuffle_80x128E,656.2,1469.82,0.0
gfx950,256,320,7168,2048,asm,24,1,13.4623,_ZN5aiter42fp8gemm_bf16_blockscale_BpreShuffle_80x128E,697.89,1479.91,0.0
gfx950,256,320,7168,2304,asm,24,1,14.5582,_ZN5aiter42fp8gemm_bf16_blockscale_BpreShuffle_80x128E,726.03,1500.18,0.0
gfx950,256,352,7168,2048,asm,32,1,14.96,_ZN5aiter42fp8gemm_bf16_blockscale_BpreShuffle_96x128E,690.83,1366.79,0.0
gfx950,256,352,7168,2304,asm,32,1,15.663,_ZN5aiter42fp8gemm_bf16_blockscale_BpreShuffle_96x128E,742.3,1428.36,0.0
gfx950,256,384,7168,2048,asm,32,1,14.6886,_ZN5aiter42fp8gemm_bf16_blockscale_BpreShuffle_96x128E,767.55,1427.74,0.0
gfx950,256,384,7168,2304,asm,32,1,16.4306,_ZN5aiter42fp8gemm_bf16_blockscale_BpreShuffle_96x128E,771.95,1394.04,0.0
gfx950,256,416,7168,2048,ck,14,3,16.8019,a8w8_blockscale_bpreshuffle_1x128x128_256x64x128x128_16x16_16x16_8x32x1_8x32x1_1x32x1x8_8_2x1_intrawave_v1,726.93,1279.37,0.0001
gfx950,256,416,7168,2304,ck,14,0,18.9316,a8w8_blockscale_bpreshuffle_1x128x128_256x64x128x128_16x16_16x16_8x32x1_8x32x1_1x32x1x8_8_2x1_intrawave_v1,725.8,1238.0,0.0
gfx950,256,448,7168,2048,ck,14,0,16.6168,a8w8_blockscale_bpreshuffle_1x128x128_256x64x128x128_16x16_16x16_8x32x1_8x32x1_1x32x1x8_8_2x1_intrawave_v1,791.57,1325.17,0.0001
gfx950,256,448,7168,2304,ck,14,2,18.9489,a8w8_blockscale_bpreshuffle_1x128x128_256x64x128x128_16x16_16x16_8x32x1_8x32x1_1x32x1x8_8_2x1_intrawave_v1,780.92,1264.97,0.0
gfx950,256,480,7168,2048,ck,14,2,17.1416,a8w8_blockscale_bpreshuffle_1x128x128_256x64x128x128_16x16_16x16_8x32x1_8x32x1_1x32x1x8_8_2x1_intrawave_v1,822.14,1315.19,0.0001
gfx950,256,480,7168,2304,asm,40,1,19.1807,_ZN5aiter43fp8gemm_bf16_blockscale_BpreShuffle_128x128E,826.58,1277.44,0.0
gfx950,256,512,7168,2048,ck,14,0,17.088,a8w8_blockscale_bpreshuffle_1x128x128_256x64x128x128_16x16_16x16_8x32x1_8x32x1_1x32x1x8_8_2x1_intrawave_v1,879.7,1349.99,0.0002
gfx950,256,512,7168,2304,ck,14,0,19.4496,a8w8_blockscale_bpreshuffle_1x128x128_256x64x128x128_16x16_16x16_8x32x1_8x32x1_1x32x1x8_8_2x1_intrawave_v1,869.5,1287.16,0.0
gfx950,256,544,7168,2048,ck,14,1,17.8708,a8w8_blockscale_bpreshuffle_1x128x128_256x64x128x128_16x16_16x16_8x32x1_8x32x1_1x32x1x8_8_2x1_intrawave_v1,893.74,1320.2,0.0001
gfx950,256,544,7168,2304,ck,14,1,20.1182,a8w8_blockscale_bpreshuffle_1x128x128_256x64x128x128_16x16_16x16_8x32x1_8x32x1_1x32x1x8_8_2x1_intrawave_v1,893.14,1270.85,0.0
gfx950,256,576,7168,2048,ck,14,3,17.8731,a8w8_blockscale_bpreshuffle_1x128x128_256x64x128x128_16x16_16x16_8x32x1_8x32x1_1x32x1x8_8_2x1_intrawave_v1,946.19,1349.36,0.0002
gfx950,256,576,7168,2304,ck,14,2,20.0657,a8w8_blockscale_bpreshuffle_1x128x128_256x64x128x128_16x16_16x16_8x32x1_8x32x1_1x32x1x8_8_2x1_intrawave_v1,948.15,1300.71,0.0
gfx950,256,608,7168,2048,ck,14,0,21.9319,a8w8_blockscale_bpreshuffle_1x128x128_256x64x128x128_16x16_16x16_8x32x1_8x32x1_1x32x1x8_8_2x1_intrawave_v1,813.93,1123.55,0.0001
gfx950,256,608,7168,2304,ck,14,0,24.7891,a8w8_blockscale_bpreshuffle_1x128x128_256x64x128x128_16x16_16x16_8x32x1_8x32x1_1x32x1x8_8_2x1_intrawave_v1,810.13,1074.35,0.0001
gfx950,256,640,7168,2048,ck,14,3,21.8952,a8w8_blockscale_bpreshuffle_1x128x128_256x64x128x128_16x16_16x16_8x32x1_8x32x1_1x32x1x8_8_2x1_intrawave_v1,858.2,1149.38,0.0002
gfx950,256,640,7168,2304,ck,14,1,24.582,a8w8_blockscale_bpreshuffle_1x128x128_256x64x128x128_16x16_16x16_8x32x1_8x32x1_1x32x1x8_8_2x1_intrawave_v1,859.95,1105.06,0.0001
gfx950,256,672,7168,2048,ck,14,0,22.3856,a8w8_blockscale_bpreshuffle_1x128x128_256x64x128x128_16x16_16x16_8x32x1_8x32x1_1x32x1x8_8_2x1_intrawave_v1,881.37,1147.62,0.0001
gfx950,256,672,7168,2304,ck,14,0,25.3952,a8w8_blockscale_bpreshuffle_1x128x128_256x64x128x128_16x16_16x16_8x32x1_8x32x1_1x32x1x8_8_2x1_intrawave_v1,874.03,1090.65,0.0001
gfx950,256,704,7168,2048,ck,14,0,22.1673,a8w8_blockscale_bpreshuffle_1x128x128_256x64x128x128_16x16_16x16_8x32x1_8x32x1_1x32x1x8_8_2x1_intrawave_v1,932.43,1182.57,0.0001
gfx950,256,704,7168,2304,ck,14,2,24.9362,a8w8_blockscale_bpreshuffle_1x128x128_256x64x128x128_16x16_16x16_8x32x1_8x32x1_1x32x1x8_8_2x1_intrawave_v1,932.51,1132.07,0.0001
gfx950,256,736,7168,2048,ck,14,3,22.8087,a8w8_blockscale_bpreshuffle_1x128x128_256x64x128x128_16x16_16x16_8x32x1_8x32x1_1x32x1x8_8_2x1_intrawave_v1,947.4,1172.3,0.0002
gfx950,256,736,7168,2304,ck,14,3,25.8221,a8w8_blockscale_bpreshuffle_1x128x128_256x64x128x128_16x16_16x16_8x32x1_8x32x1_1x32x1x8_8_2x1_intrawave_v1,941.45,1113.86,0.0001
gfx950,256,768,7168,2048,ck,14,1,22.8406,a8w8_blockscale_bpreshuffle_1x128x128_256x64x128x128_16x16_16x16_8x32x1_8x32x1_1x32x1x8_8_2x1_intrawave_v1,987.21,1193.62,0.0002
gfx950,256,768,7168,2304,ck,14,0,25.4961,a8w8_blockscale_bpreshuffle_1x128x128_256x64x128x128_16x16_16x16_8x32x1_8x32x1_1x32x1x8_8_2x1_intrawave_v1,994.94,1148.98,0.0002
gfx950,256,800,7168,2048,ck,14,0,23.6361,a8w8_blockscale_bpreshuffle_1x128x128_256x64x128x128_16x16_16x16_8x32x1_8x32x1_1x32x1x8_8_2x1_intrawave_v1,993.74,1175.63,0.0002
gfx950,256,800,7168,2304,ck,14,1,26.6837,a8w8_blockscale_bpreshuffle_1x128x128_256x64x128x128_16x16_16x16_8x32x1_8x32x1_1x32x1x8_8_2x1_intrawave_v1,990.27,1117.8,0.0001
gfx950,256,832,7168,2048,ck,14,0,23.2242,a8w8_blockscale_bpreshuffle_1x128x128_256x64x128x128_16x16_16x16_8x32x1_8x32x1_1x32x1x8_8_2x1_intrawave_v1,1051.82,1219.05,0.0003
gfx950,256,832,7168,2304,ck,14,1,26.6718,a8w8_blockscale_bpreshuffle_1x128x128_256x64x128x128_16x16_16x16_8x32x1_8x32x1_1x32x1x8_8_2x1_intrawave_v1,1030.34,1138.26,0.0002
gfx950,256,864,7168,2048,ck,13,0,25.6049,a8w8_blockscale_bpreshuffle_1x128x128_256x64x256x128_16x16_16x16_8x32x1_8x32x1_1x32x1x8_8_2x1_intrawave_v1,990.71,1126.18,0.0
gfx950,256,864,7168,2304,ck,13,3,28.3077,a8w8_blockscale_bpreshuffle_1x128x128_256x64x256x128_16x16_16x16_8x32x1_8x32x1_1x32x1x8_8_2x1_intrawave_v1,1008.14,1091.29,0.0
gfx950,256,896,7168,2048,ck,13,0,25.6653,a8w8_blockscale_bpreshuffle_1x128x128_256x64x256x128_16x16_16x16_8x32x1_8x32x1_1x32x1x8_8_2x1_intrawave_v1,1024.99,1143.96,0.0
gfx950,256,896,7168,2304,ck,13,0,27.9433,a8w8_blockscale_bpreshuffle_1x128x128_256x64x256x128_16x16_16x16_8x32x1_8x32x1_1x32x1x8_8_2x1_intrawave_v1,1059.11,1124.58,0.0
gfx950,256,928,7168,2048,ck,13,3,26.5242,a8w8_blockscale_bpreshuffle_1x128x128_256x64x256x128_16x16_16x16_8x32x1_8x32x1_1x32x1x8_8_2x1_intrawave_v1,1027.22,1126.68,0.0
gfx950,256,928,7168,2304,ck,13,0,29.6559,a8w8_blockscale_bpreshuffle_1x128x128_256x64x256x128_16x16_16x16_8x32x1_8x32x1_1x32x1x8_8_2x1_intrawave_v1,1033.59,1077.59,0.0
gfx950,256,960,7168,2048,ck,13,1,26.7867,a8w8_blockscale_bpreshuffle_1x128x128_256x64x256x128_16x16_16x16_8x32x1_8x32x1_1x32x1x8_8_2x1_intrawave_v1,1052.23,1135.22,0.0
gfx950,256,960,7168,2304,ck,13,1,29.2621,a8w8_blockscale_bpreshuffle_1x128x128_256x64x256x128_16x16_16x16_8x32x1_8x32x1_1x32x1x8_8_2x1_intrawave_v1,1083.62,1110.29,0.0
gfx950,256,992,7168,2048,ck,13,2,27.1511,a8w8_blockscale_bpreshuffle_1x128x128_256x64x256x128_16x16_16x16_8x32x1_8x32x1_1x32x1x8_8_2x1_intrawave_v1,1072.71,1139.29,0.0
gfx950,256,992,7168,2304,ck,13,0,30.3926,a8w8_blockscale_bpreshuffle_1x128x128_256x64x256x128_16x16_16x16_8x32x1_8x32x1_1x32x1x8_8_2x1_intrawave_v1,1078.09,1086.51,0.0
gfx950,256,1024,7168,2048,ck,13,2,26.9597,a8w8_blockscale_bpreshuffle_1x128x128_256x64x256x128_16x16_16x16_8x32x1_8x32x1_1x32x1x8_8_2x1_intrawave_v1,1115.17,1166.83,0.0
gfx950,256,1024,7168,2304,ck,13,2,30.2979,a8w8_blockscale_bpreshuffle_1x128x128_256x64x256x128_16x16_16x16_8x32x1_8x32x1_1x32x1x8_8_2x1_intrawave_v1,1116.34,1107.48,0.0
gfx950,256,1088,7168,2048,ck,13,2,27.2805,a8w8_blockscale_bpreshuffle_1x128x128_256x64x256x128_16x16_16x16_8x32x1_8x32x1_1x32x1x8_8_2x1_intrawave_v1,1170.94,1191.54,0.0
gfx950,256,1088,7168,2304,ck,13,3,30.6045,a8w8_blockscale_bpreshuffle_1x128x128_256x64x256x128_16x16_16x16_8x32x1_8x32x1_1x32x1x8_8_2x1_intrawave_v1,1174.23,1131.19,0.0
gfx950,256,1152,7168,2048,ck,13,1,27.4994,a8w8_blockscale_bpreshuffle_1x128x128_256x64x256x128_16x16_16x16_8x32x1_8x32x1_1x32x1x8_8_2x1_intrawave_v1,1229.95,1220.19,0.0
gfx950,256,1152,7168,2304,ck,13,1,30.6421,a8w8_blockscale_bpreshuffle_1x128x128_256x64x256x128_16x16_16x16_8x32x1_8x32x1_1x32x1x8_8_2x1_intrawave_v1,1241.78,1164.55,0.0
gfx950,256,1216,7168,2048,ck,14,1,33.3229,a8w8_blockscale_bpreshuffle_1x128x128_256x64x128x128_16x16_16x16_8x32x1_8x32x1_1x32x1x8_8_2x1_intrawave_v1,1071.39,1038.42,0.0003
gfx950,256,1216,7168,2304,ck,14,1,38.9553,a8w8_blockscale_bpreshuffle_1x128x128_256x64x128x128_16x16_16x16_8x32x1_8x32x1_1x32x1x8_8_2x1_intrawave_v1,1031.04,943.37,0.0002
gfx950,256,1280,7168,2048,ck,14,1,33.8453,a8w8_blockscale_bpreshuffle_1x128x128_256x64x128x128_16x16_16x16_8x32x1_8x32x1_1x32x1x8_8_2x1_intrawave_v1,1110.37,1053.37,0.0003
gfx950,256,1280,7168,2304,ck,14,1,38.5149,a8w8_blockscale_bpreshuffle_1x128x128_256x64x128x128_16x16_16x16_8x32x1_8x32x1_1x32x1x8_8_2x1_intrawave_v1,1097.72,981.81,0.0003
gfx950,256,1344,7168,2048,ck,14,1,35.0697,a8w8_blockscale_bpreshuffle_1x128x128_256x64x128x128_16x16_16x16_8x32x1_8x32x1_1x32x1x8_8_2x1_intrawave_v1,1125.19,1046.49,0.0003
gfx950,256,1344,7168,2304,ck,14,1,39.8326,a8w8_blockscale_bpreshuffle_1x128x128_256x64x128x128_16x16_16x16_8x32x1_8x32x1_1x32x1x8_8_2x1_intrawave_v1,1114.48,976.07,0.0002
gfx950,256,1408,7168,2048,ck,14,1,34.9055,a8w8_blockscale_bpreshuffle_1x128x128_256x64x128x128_16x16_16x16_8x32x1_8x32x1_1x32x1x8_8_2x1_intrawave_v1,1184.31,1081.46,0.0003
gfx950,256,1408,7168,2304,ck,14,0,40.0446,a8w8_blockscale_bpreshuffle_1x128x128_256x64x128x128_16x16_16x16_8x32x1_8x32x1_1x32x1x8_8_2x1_intrawave_v1,1161.37,997.49,0.0002
gfx950,256,1472,7168,2048,ck,13,2,37.8797,a8w8_blockscale_bpreshuffle_1x128x128_256x64x256x128_16x16_16x16_8x32x1_8x32x1_1x32x1x8_8_2x1_intrawave_v1,1140.93,1024.22,0.0
gfx950,256,1472,7168,2304,ck,13,0,41.5178,a8w8_blockscale_bpreshuffle_1x128x128_256x64x256x128_16x16_16x16_8x32x1_8x32x1_1x32x1x8_8_2x1_intrawave_v1,1171.07,987.75,0.0
gfx950,256,1536,7168,2048,ck,13,1,37.7413,a8w8_blockscale_bpreshuffle_1x128x128_256x64x256x128_16x16_16x16_8x32x1_8x32x1_1x32x1x8_8_2x1_intrawave_v1,1194.9,1055.76,0.0
gfx950,256,1536,7168,2304,ck,13,3,41.4718,a8w8_blockscale_bpreshuffle_1x128x128_256x64x256x128_16x16_16x16_8x32x1_8x32x1_1x32x1x8_8_2x1_intrawave_v1,1223.34,1014.52,0.0
gfx950,256,1600,7168,2048,ck,13,0,38.8337,a8w8_blockscale_bpreshuffle_1x128x128_256x64x256x128_16x16_16x16_8x32x1_8x32x1_1x32x1x8_8_2x1_intrawave_v1,1209.68,1053.07,0.0
gfx950,256,1600,7168,2304,ck,13,2,42.9042,a8w8_blockscale_bpreshuffle_1x128x128_256x64x256x128_16x16_16x16_8x32x1_8x32x1_1x32x1x8_8_2x1_intrawave_v1,1231.77,1005.47,0.0
gfx950,256,1664,7168,2048,ck,13,1,39.2573,a8w8_blockscale_bpreshuffle_1x128x128_256x64x256x128_16x16_16x16_8x32x1_8x32x1_1x32x1x8_8_2x1_intrawave_v1,1244.49,1068.41,0.0
gfx950,256,1664,7168,2304,ck,13,2,43.621,a8w8_blockscale_bpreshuffle_1x128x128_256x64x256x128_16x16_16x16_8x32x1_8x32x1_1x32x1x8_8_2x1_intrawave_v1,1259.99,1013.37,0.0
gfx950,256,1728,7168,2048,ck,13,0,39.8069,a8w8_blockscale_bpreshuffle_1x128x128_256x64x256x128_16x16_16x16_8x32x1_8x32x1_1x32x1x8_8_2x1_intrawave_v1,1274.51,1080.0,0.0
gfx950,256,1728,7168,2304,ck,13,3,44.4322,a8w8_blockscale_bpreshuffle_1x128x128_256x64x256x128_16x16_16x16_8x32x1_8x32x1_1x32x1x8_8_2x1_intrawave_v1,1284.57,1018.83,0.0
gfx950,256,1792,7168,2048,ck,14,2,45.809,a8w8_blockscale_bpreshuffle_1x128x128_256x64x128x128_16x16_16x16_8x32x1_8x32x1_1x32x1x8_8_2x1_intrawave_v1,1148.54,961.39,0.0003
gfx950,256,1792,7168,2304,ck,13,2,49.8498,a8w8_blockscale_bpreshuffle_1x128x128_256x64x256x128_16x16_16x16_8x32x1_8x32x1_1x32x1x8_8_2x1_intrawave_v1,1187.37,929.47,0.0
gfx950,256,1856,7168,2048,ck,14,2,46.3162,a8w8_blockscale_bpreshuffle_1x128x128_256x64x128x128_16x16_16x16_8x32x1_8x32x1_1x32x1x8_8_2x1_intrawave_v1,1176.53,973.5,0.0003
gfx950,256,1856,7168,2304,ck,14,1,52.4771,a8w8_blockscale_bpreshuffle_1x128x128_256x64x128x128_16x16_16x16_8x32x1_8x32x1_1x32x1x8_8_2x1_intrawave_v1,1168.2,903.23,0.0003
gfx950,256,1920,7168,2048,ck,13,2,46.9258,a8w8_blockscale_bpreshuffle_1x128x128_256x64x256x128_16x16_16x16_8x32x1_8x32x1_1x32x1x8_8_2x1_intrawave_v1,1201.29,983.2,0.0
gfx950,256,1920,7168,2304,ck,13,1,52.4563,a8w8_blockscale_bpreshuffle_1x128x128_256x64x256x128_16x16_16x16_8x32x1_8x32x1_1x32x1x8_8_2x1_intrawave_v1,1208.97,923.89,0.0
gfx950,256,1984,7168,2048,ck,13,0,48.5366,a8w8_blockscale_bpreshuffle_1x128x128_256x64x256x128_16x16_16x16_8x32x1_8x32x1_1x32x1x8_8_2x1_intrawave_v1,1200.14,972.17,0.0
gfx950,256,1984,7168,2304,ck,13,3,54.0152,a8w8_blockscale_bpreshuffle_1x128x128_256x64x256x128_16x16_16x16_8x32x1_8x32x1_1x32x1x8_8_2x1_intrawave_v1,1213.21,916.94,0.0
gfx950,256,2048,7168,2048,ck,13,1,49.7429,a8w8_blockscale_bpreshuffle_1x128x128_256x64x256x128_16x16_16x16_8x32x1_8x32x1_1x32x1x8_8_2x1_intrawave_v1,1208.81,969.68,0.0
gfx950,256,2048,7168,2304,ck,13,1,54.9991,a8w8_blockscale_bpreshuffle_1x128x128_256x64x256x128_16x16_16x16_8x32x1_8x32x1_1x32x1x8_8_2x1_intrawave_v1,1229.94,919.9,0.0
gfx950,256,4096,7168,2048,ck,13,1,84.9609,a8w8_blockscale_bpreshuffle_1x128x128_256x64x256x128_16x16_16x16_8x32x1_8x32x1_1x32x1x8_8_2x1_intrawave_v1,1415.46,962.67,0.0
gfx950,256,4096,7168,2304,ck,13,0,94.7138,a8w8_blockscale_bpreshuffle_1x128x128_256x64x256x128_16x16_16x16_8x32x1_8x32x1_1x32x1x8_8_2x1_intrawave_v1,1428.42,893.98,0.0
gfx950,256,8192,7168,2048,ck,13,0,157.5272,a8w8_blockscale_bpreshuffle_1x128x128_256x64x256x128_16x16_16x16_8x32x1_8x32x1_1x32x1x8_8_2x1_intrawave_v1,1526.84,945.22,0.0
gfx950,256,8192,7168,2304,ck,13,3,171.0665,a8w8_blockscale_bpreshuffle_1x128x128_256x64x256x128_16x16_16x16_8x32x1_8x32x1_1x32x1x8_8_2x1_intrawave_v1,1581.74,893.39,0.0
gfx950,256,16384,7168,2048,ck,13,1,291.9559,a8w8_blockscale_bpreshuffle_1x128x128_256x64x256x128_16x16_16x16_8x32x1_8x32x1_1x32x1x8_8_2x1_intrawave_v1,1647.63,969.72,0.0
gfx950,256,16384,7168,2304,ck,13,1,324.2426,a8w8_blockscale_bpreshuffle_1x128x128_256x64x256x128_16x16_16x16_8x32x1_8x32x1_1x32x1x8_8_2x1_intrawave_v1,1669.02,891.75,0.0
gfx950,256,32768,7168,2048,ck,13,1,556.7794,a8w8_blockscale_bpreshuffle_1x128x128_256x64x256x128_16x16_16x16_8x32x1_8x32x1_1x32x1x8_8_2x1_intrawave_v1,1727.92,990.61,0.0
gfx950,256,32768,7168,2304,ck,13,0,619.9048,a8w8_blockscale_bpreshuffle_1x128x128_256x64x256x128_16x16_16x16_8x32x1_8x32x1_1x32x1x8_8_2x1_intrawave_v1,1745.96,906.23,0.0
gfx950,256,16,8192,1536,ck,7,2,6.4719,a8w8_blockscale_bpreshuffle_1x128x128_256x16x64x256_16x16_16x16_16x16x1_16x16x1_1x16x1x16_4_1x1_intrawave_v1,62.22,1988.54,0.0
gfx950,256,32,8192,1536,ck,7,2,6.2694,a8w8_blockscale_bpreshuffle_1x128x128_256x16x64x256_16x16_16x16_16x16x1_16x16x1_1x16x1x16_4_1x1_intrawave_v1,128.45,2098.5,0.0
gfx950,256,48,8192,1536,ck,6,0,6.7969,a8w8_blockscale_bpreshuffle_1x128x128_256x16x128x256_16x16_16x16_16x16x1_16x16x1_1x16x1x16_8_1x2_intrawave_v1,177.72,1977.82,0.0
gfx950,256,64,8192,1536,ck,12,1,6.8746,a8w8_blockscale_bpreshuffle_1x128x128_256x32x64x256_16x16_16x16_16x16x1_16x16x1_1x32x1x8_8_2x1_intrawave_v1,234.28,1997.18,0.0
gfx950,256,80,8192,1536,ck,12,0,8.1128,a8w8_blockscale_bpreshuffle_1x128x128_256x32x64x256_16x16_16x16_16x16x1_16x16x1_1x32x1x8_8_2x1_intrawave_v1,248.16,1727.7,0.0
gfx950,256,96,8192,1536,ck,11,3,7.6815,a8w8_blockscale_bpreshuffle_1x128x128_256x32x128x256_16x16_16x16_16x16x1_16x16x1_1x32x1x8_8_2x1_intrawave_v1,314.51,1862.04,0.0
gfx950,256,112,8192,1536,ck,12,1,8.0886,a8w8_blockscale_bpreshuffle_1x128x128_256x32x64x256_16x16_16x16_16x16x1_16x16x1_1x32x1x8_8_2x1_intrawave_v1,348.46,1803.77,0.0
gfx950,256,128,8192,1536,ck,11,0,8.3009,a8w8_blockscale_bpreshuffle_1x128x128_256x32x128x256_16x16_16x16_16x16x1_16x16x1_1x32x1x8_8_2x1_intrawave_v1,388.06,1792.18,0.0
gfx950,256,144,8192,1536,asm,16,1,10.0466,_ZN5aiter42fp8gemm_bf16_blockscale_BpreShuffle_64x128E,360.71,1509.31,0.0
gfx950,256,160,8192,1536,asm,8,1,9.5079,_ZN5aiter42fp8gemm_bf16_blockscale_BpreShuffle_48x128E,423.49,1624.98,0.0
gfx950,256,176,8192,1536,asm,8,1,10.041,_ZN5aiter42fp8gemm_bf16_blockscale_BpreShuffle_48x128E,441.11,1567.26,0.0
gfx950,256,192,8192,1536,asm,8,1,9.735,_ZN5aiter42fp8gemm_bf16_blockscale_BpreShuffle_48x128E,496.34,1645.97,0.0
gfx950,256,208,8192,1536,ck,17,1,10.774,a8w8_blockscale_bpreshuffle_1x128x128_256x64x64x256_16x16_16x16_16x16x1_16x16x1_1x32x1x8_8_2x1_intrawave_v1,485.84,1513.85,0.0
gfx950,256,224,8192,1536,asm,16,1,10.472,_ZN5aiter42fp8gemm_bf16_blockscale_BpreShuffle_64x128E,538.31,1584.89,0.0
gfx950,256,240,8192,1536,ck,17,1,11.016,a8w8_blockscale_bpreshuffle_1x128x128_256x64x64x256_16x16_16x16_16x16x1_16x16x1_1x32x1x8_8_2x1_intrawave_v1,548.28,1532.65,0.0
gfx950,256,256,8192,1536,asm,16,1,10.6076,_ZN5aiter42fp8gemm_bf16_blockscale_BpreShuffle_64x128E,607.34,1618.69,0.0
gfx950,256,288,8192,1536,asm,24,1,11.5847,_ZN5aiter42fp8gemm_bf16_blockscale_BpreShuffle_80x128E,625.63,1531.66,0.0
gfx950,256,320,8192,1536,asm,24,1,11.8865,_ZN5aiter42fp8gemm_bf16_blockscale_BpreShuffle_80x128E,677.5,1541.02,0.0
gfx950,256,352,8192,1536,asm,32,1,13.3519,_ZN5aiter42fp8gemm_bf16_blockscale_BpreShuffle_96x128E,663.45,1414.84,0.0
gfx950,256,384,8192,1536,asm,32,1,13.0874,_ZN5aiter42fp8gemm_bf16_blockscale_BpreShuffle_96x128E,738.4,1487.25,0.0
gfx950,256,416,8192,1536,ck,14,0,15.0583,a8w8_blockscale_bpreshuffle_1x128x128_256x64x128x128_16x16_16x16_8x32x1_8x32x1_1x32x1x8_8_2x1_intrawave_v1,695.23,1330.67,0.0
gfx950,256,448,8192,1536,ck,14,2,14.9824,a8w8_blockscale_bpreshuffle_1x128x128_256x64x128x128_16x16_16x16_8x32x1_8x32x1_1x32x1x8_8_2x1_intrawave_v1,752.5,1375.69,0.0
gfx950,256,480,8192,1536,ck,14,3,15.2947,a8w8_blockscale_bpreshuffle_1x128x128_256x64x128x128_16x16_16x16_8x32x1_8x32x1_1x32x1x8_8_2x1_intrawave_v1,789.79,1385.09,0.0
gfx950,256,512,8192,1536,ck,14,3,15.175,a8w8_blockscale_bpreshuffle_1x128x128_256x64x128x128_16x16_16x16_8x32x1_8x32x1_1x32x1x8_8_2x1_intrawave_v1,849.09,1433.8,0.0
gfx950,256,544,8192,1536,ck,14,0,19.3452,a8w8_blockscale_bpreshuffle_1x128x128_256x64x128x128_16x16_16x16_8x32x1_8x32x1_1x32x1x8_8_2x1_intrawave_v1,707.68,1154.36,0.0001
gfx950,256,576,8192,1536,ck,14,3,19.3504,a8w8_blockscale_bpreshuffle_1x128x128_256x64x128x128_16x16_16x16_8x32x1_8x32x1_1x32x1x8_8_2x1_intrawave_v1,749.11,1183.69,0.0001
gfx950,256,608,8192,1536,ck,14,1,19.5196,a8w8_blockscale_bpreshuffle_1x128x128_256x64x128x128_16x16_16x16_8x32x1_8x32x1_1x32x1x8_8_2x1_intrawave_v1,783.87,1202.8,0.0001
gfx950,256,640,8192,1536,ck,14,0,19.295,a8w8_blockscale_bpreshuffle_1x128x128_256x64x128x128_16x16_16x16_8x32x1_8x32x1_1x32x1x8_8_2x1_intrawave_v1,834.73,1246.53,0.0001
gfx950,256,672,8192,1536,ck,14,2,19.9677,a8w8_blockscale_bpreshuffle_1x128x128_256x64x128x128_16x16_16x16_8x32x1_8x32x1_1x32x1x8_8_2x1_intrawave_v1,846.94,1233.25,0.0002
gfx950,256,704,8192,1536,ck,14,0,19.791,a8w8_blockscale_bpreshuffle_1x128x128_256x64x128x128_16x16_16x16_8x32x1_8x32x1_1x32x1x8_8_2x1_intrawave_v1,895.19,1273.23,0.0001
gfx950,256,736,8192,1536,ck,14,2,20.4392,a8w8_blockscale_bpreshuffle_1x128x128_256x64x128x128_16x16_16x16_8x32x1_8x32x1_1x32x1x8_8_2x1_intrawave_v1,906.2,1260.91,0.0002
gfx950,256,768,8192,1536,ck,14,0,20.2904,a8w8_blockscale_bpreshuffle_1x128x128_256x64x128x128_16x16_16x16_8x32x1_8x32x1_1x32x1x8_8_2x1_intrawave_v1,952.54,1298.42,0.0002
gfx950,256,800,8192,1536,ck,13,2,22.2979,a8w8_blockscale_bpreshuffle_1x128x128_256x64x256x128_16x16_16x16_8x32x1_8x32x1_1x32x1x8_8_2x1_intrawave_v1,902.89,1207.24,0.0
gfx950,256,832,8192,1536,ck,13,0,22.2371,a8w8_blockscale_bpreshuffle_1x128x128_256x64x256x128_16x16_16x16_8x32x1_8x32x1_1x32x1x8_8_2x1_intrawave_v1,941.58,1236.33,0.0
gfx950,256,864,8192,1536,ck,13,3,23.0882,a8w8_blockscale_bpreshuffle_1x128x128_256x64x256x128_16x16_16x16_8x32x1_8x32x1_1x32x1x8_8_2x1_intrawave_v1,941.75,1215.59,0.0
gfx950,256,896,8192,1536,ck,13,3,22.8541,a8w8_blockscale_bpreshuffle_1x128x128_256x64x256x128_16x16_16x16_8x32x1_8x32x1_1x32x1x8_8_2x1_intrawave_v1,986.63,1253.13,0.0
gfx950,256,928,8192,1536,ck,13,0,23.3637,a8w8_blockscale_bpreshuffle_1x128x128_256x64x256x128_16x16_16x16_8x32x1_8x32x1_1x32x1x8_8_2x1_intrawave_v1,999.58,1250.34,0.0
gfx950,256,960,8192,1536,ck,13,0,23.2165,a8w8_blockscale_bpreshuffle_1x128x128_256x64x256x128_16x16_16x16_8x32x1_8x32x1_1x32x1x8_8_2x1_intrawave_v1,1040.6,1282.97,0.0
gfx950,256,992,8192,1536,ck,13,3,24.0286,a8w8_blockscale_bpreshuffle_1x128x128_256x64x256x128_16x16_16x16_8x32x1_8x32x1_1x32x1x8_8_2x1_intrawave_v1,1038.95,1263.48,0.0
gfx950,256,1024,8192,1536,ck,13,0,23.849,a8w8_blockscale_bpreshuffle_1x128x128_256x64x256x128_16x16_16x16_8x32x1_8x32x1_1x32x1x8_8_2x1_intrawave_v1,1080.54,1297.04,0.0
gfx950,256,1088,8192,1536,ck,14,1,28.527,a8w8_blockscale_bpreshuffle_1x128x128_256x64x128x128_16x16_16x16_8x32x1_8x32x1_1x32x1x8_8_2x1_intrawave_v1,959.81,1124.54,0.0001
gfx950,256,1152,8192,1536,ck,14,2,28.3804,a8w8_blockscale_bpreshuffle_1x128x128_256x64x128x128_16x16_16x16_8x32x1_8x32x1_1x32x1x8_8_2x1_intrawave_v1,1021.52,1170.76,0.0002
gfx950,256,1216,8192,1536,ck,14,2,28.9229,a8w8_blockscale_bpreshuffle_1x128x128_256x64x128x128_16x16_16x16_8x32x1_8x32x1_1x32x1x8_8_2x1_intrawave_v1,1058.04,1188.46,0.0002
gfx950,256,1280,8192,1536,ck,14,1,30.0017,a8w8_blockscale_bpreshuffle_1x128x128_256x64x128x128_16x16_16x16_8x32x1_8x32x1_1x32x1x8_8_2x1_intrawave_v1,1073.68,1183.95,0.0002
gfx950,256,1344,8192,1536,ck,13,2,31.5777,a8w8_blockscale_bpreshuffle_1x128x128_256x64x256x128_16x16_16x16_8x32x1_8x32x1_1x32x1x8_8_2x1_intrawave_v1,1071.1,1161.18,0.0
gfx950,256,1408,8192,1536,ck,13,0,31.753,a8w8_blockscale_bpreshuffle_1x128x128_256x64x256x128_16x16_16x16_8x32x1_8x32x1_1x32x1x8_8_2x1_intrawave_v1,1115.91,1190.89,0.0
gfx950,256,1472,8192,1536,ck,13,1,32.3237,a8w8_blockscale_bpreshuffle_1x128x128_256x64x256x128_16x16_16x16_8x32x1_8x32x1_1x32x1x8_8_2x1_intrawave_v1,1146.04,1205.34,0.0
gfx950,256,1536,8192,1536,ck,13,3,32.6491,a8w8_blockscale_bpreshuffle_1x128x128_256x64x256x128_16x16_16x16_8x32x1_8x32x1_1x32x1x8_8_2x1_intrawave_v1,1183.94,1228.46,0.0
gfx950,256,1600,8192,1536,ck,14,3,38.1646,a8w8_blockscale_bpreshuffle_1x128x128_256x64x128x128_16x16_16x16_8x32x1_8x32x1_1x32x1x8_8_2x1_intrawave_v1,1055.04,1080.97,0.0002
gfx950,256,1664,8192,1536,ck,14,3,38.4425,a8w8_blockscale_bpreshuffle_1x128x128_256x64x128x128_16x16_16x16_8x32x1_8x32x1_1x32x1x8_8_2x1_intrawave_v1,1089.31,1102.99,0.0002
gfx950,256,1728,8192,1536,ck,14,3,38.6445,a8w8_blockscale_bpreshuffle_1x128x128_256x64x128x128_16x16_16x16_8x32x1_8x32x1_1x32x1x8_8_2x1_intrawave_v1,1125.3,1126.9,0.0002
gfx950,256,1792,8192,1536,ck,14,1,39.7512,a8w8_blockscale_bpreshuffle_1x128x128_256x64x128x128_16x16_16x16_8x32x1_8x32x1_1x32x1x8_8_2x1_intrawave_v1,1134.49,1124.38,0.0002
gfx950,256,1856,8192,1536,ck,13,2,41.175,a8w8_blockscale_bpreshuffle_1x128x128_256x64x256x128_16x16_16x16_8x32x1_8x32x1_1x32x1x8_8_2x1_intrawave_v1,1134.37,1113.36,0.0
gfx950,256,1920,8192,1536,ck,13,2,41.7573,a8w8_blockscale_bpreshuffle_1x128x128_256x64x256x128_16x16_16x16_8x32x1_8x32x1_1x32x1x8_8_2x1_intrawave_v1,1157.12,1125.3,0.0
gfx950,256,1984,8192,1536,ck,13,2,42.9929,a8w8_blockscale_bpreshuffle_1x128x128_256x64x256x128_16x16_16x16_8x32x1_8x32x1_1x32x1x8_8_2x1_intrawave_v1,1161.33,1119.63,0.0
gfx950,256,2048,8192,1536,ck,13,3,44.712,a8w8_blockscale_bpreshuffle_1x128x128_256x64x256x128_16x16_16x16_8x32x1_8x32x1_1x32x1x8_8_2x1_intrawave_v1,1152.7,1102.23,0.0
gfx950,256,4096,8192,1536,ck,13,1,79.2213,a8w8_blockscale_bpreshuffle_1x128x128_256x64x256x128_16x16_16x16_8x32x1_8x32x1_1x32x1x8_8_2x1_intrawave_v1,1301.16,1085.35,0.0
gfx950,256,8192,8192,1536,ck,13,2,146.3103,a8w8_blockscale_bpreshuffle_1x128x128_256x64x256x128_16x16_16x16_8x32x1_8x32x1_1x32x1x8_8_2x1_intrawave_v1,1409.05,1089.35,0.0
gfx950,256,16384,8192,1536,ck,13,3,271.6202,a8w8_blockscale_bpreshuffle_1x128x128_256x64x256x128_16x16_16x16_8x32x1_8x32x1_1x32x1x8_8_2x1_intrawave_v1,1517.99,1127.25,0.0
gfx950,256,32768,8192,1536,ck,13,1,513.6065,a8w8_blockscale_bpreshuffle_1x128x128_256x64x256x128_16x16_16x16_8x32x1_8x32x1_1x32x1x8_8_2x1_intrawave_v1,1605.57,1167.79,0.0
gfx950,256,16,11264,1536,ck,7,1,6.7619,a8w8_blockscale_bpreshuffle_1x128x128_256x16x64x256_16x16_16x16_16x16x1_16x16x1_1x16x1x16_4_1x1_intrawave_v1,81.88,2615.62,0.0
gfx950,256,32,11264,1536,ck,6,1,7.096,a8w8_blockscale_bpreshuffle_1x128x128_256x16x128x256_16x16_16x16_16x16x1_16x16x1_1x16x1x16_8_1x2_intrawave_v1,156.05,2546.72,0.0
gfx950,256,48,11264,1536,ck,7,0,7.5363,a8w8_blockscale_bpreshuffle_1x128x128_256x16x64x256_16x16_16x16_16x16x1_16x16x1_1x16x1x16_4_1x1_intrawave_v1,220.39,2449.02,0.0
gfx950,256,64,11264,1536,ck,17,2,8.3027,a8w8_blockscale_bpreshuffle_1x128x128_256x64x64x256_16x16_16x16_16x16x1_16x16x1_1x32x1x8_8_2x1_intrawave_v1,266.73,2269.33,0.0
gfx950,256,80,11264,1536,asm,8,1,9.794,_ZN5aiter42fp8gemm_bf16_blockscale_BpreShuffle_48x128E,282.65,1963.1,0.0
gfx950,256,96,11264,1536,asm,8,1,9.9361,_ZN5aiter42fp8gemm_bf16_blockscale_BpreShuffle_48x128E,334.33,1973.78,0.0
gfx950,256,112,11264,1536,ck,12,3,10.4055,a8w8_blockscale_bpreshuffle_1x128x128_256x32x64x256_16x16_16x16_16x16x1_16x16x1_1x32x1x8_8_2x1_intrawave_v1,372.45,1921.74,0.0
gfx950,256,128,11264,1536,ck,10,2,10.6475,a8w8_blockscale_bpreshuffle_1x128x128_256x32x64x128_16x16_16x16_8x32x1_8x32x1_1x32x1x8_8_2x1_intrawave_v1,415.98,1914.22,0.0227
gfx950,256,144,11264,1536,ck,9,2,11.863,a8w8_blockscale_bpreshuffle_1x128x128_256x32x128x128_16x16_16x16_8x32x1_8x32x1_1x32x1x8_8_2x1_intrawave_v1,420.03,1750.55,0.0
gfx950,256,160,11264,1536,ck,9,1,11.9836,a8w8_blockscale_bpreshuffle_1x128x128_256x32x128x128_16x16_16x16_8x32x1_8x32x1_1x32x1x8_8_2x1_intrawave_v1,462.0,1765.06,0.0
gfx950,256,176,11264,1536,ck,15,2,12.9368,a8w8_blockscale_bpreshuffle_1x128x128_256x64x64x128_16x16_16x16_8x32x1_8x32x1_1x32x1x8_8_2x1_intrawave_v1,470.76,1664.77,0.0091
gfx950,256,192,11264,1536,asm,32,1,12.7768,_ZN5aiter42fp8gemm_bf16_blockscale_BpreShuffle_96x128E,519.99,1715.75,0.0
gfx950,256,208,11264,1536,ck,15,3,13.6827,a8w8_blockscale_bpreshuffle_1x128x128_256x64x64x128_16x16_16x16_8x32x1_8x32x1_1x32x1x8_8_2x1_intrawave_v1,526.02,1630.29,0.0112
gfx950,256,224,11264,1536,ck,15,1,13.86,a8w8_blockscale_bpreshuffle_1x128x128_256x64x64x128_16x16_16x16_8x32x1_8x32x1_1x32x1x8_8_2x1_intrawave_v1,559.24,1637.22,0.0122
gfx950,256,240,11264,1536,ck,15,1,14.1955,a8w8_blockscale_bpreshuffle_1x128x128_256x64x64x128_16x16_16x16_8x32x1_8x32x1_1x32x1x8_8_2x1_intrawave_v1,585.02,1625.65,0.0107
gfx950,256,256,11264,1536,ck,15,3,14.3361,a8w8_blockscale_bpreshuffle_1x128x128_256x64x64x128_16x16_16x16_8x32x1_8x32x1_1x32x1x8_8_2x1_intrawave_v1,617.91,1636.56,0.0013
gfx950,256,288,11264,1536,ck,14,3,15.2132,a8w8_blockscale_bpreshuffle_1x128x128_256x64x128x128_16x16_16x16_8x32x1_8x32x1_1x32x1x8_8_2x1_intrawave_v1,655.07,1592.82,0.0
gfx950,256,320,11264,1536,ck,14,0,15.3302,a8w8_blockscale_bpreshuffle_1x128x128_256x64x128x128_16x16_16x16_8x32x1_8x32x1_1x32x1x8_8_2x1_intrawave_v1,722.3,1630.9,0.0
gfx950,256,352,11264,1536,ck,8,2,17.669,a8w8_blockscale_bpreshuffle_1x128x128_256x32x256x128_16x16_16x16_8x32x1_8x32x1_1x32x1x8_8_2x1_intrawave_v1,689.36,1458.6,0.0
gfx950,256,384,11264,1536,ck,14,2,18.7495,a8w8_blockscale_bpreshuffle_1x128x128_256x64x128x128_16x16_16x16_8x32x1_8x32x1_1x32x1x8_8_2x1_intrawave_v1,708.69,1415.62,0.0
gfx950,256,416,11264,1536,ck,14,0,19.4889,a8w8_blockscale_bpreshuffle_1x128x128_256x64x128x128_16x16_16x16_8x32x1_8x32x1_1x32x1x8_8_2x1_intrawave_v1,738.62,1401.42,0.0001
gfx950,256,448,11264,1536,ck,14,2,19.4734,a8w8_blockscale_bpreshuffle_1x128x128_256x64x128x128_16x16_16x16_8x32x1_8x32x1_1x32x1x8_8_2x1_intrawave_v1,796.07,1442.08,0.0001
gfx950,256,480,11264,1536,ck,14,1,19.9547,a8w8_blockscale_bpreshuffle_1x128x128_256x64x128x128_16x16_16x16_8x32x1_8x32x1_1x32x1x8_8_2x1_intrawave_v1,832.36,1445.89,0.0001
gfx950,256,512,11264,1536,ck,14,1,19.8498,a8w8_blockscale_bpreshuffle_1x128x128_256x64x128x128_16x16_16x16_8x32x1_8x32x1_1x32x1x8_8_2x1_intrawave_v1,892.54,1492.32,0.0001
gfx950,256,544,11264,1536,ck,13,0,22.6047,a8w8_blockscale_bpreshuffle_1x128x128_256x64x256x128_16x16_16x16_8x32x1_8x32x1_1x32x1x8_8_2x1_intrawave_v1,832.75,1344.51,0.0
gfx950,256,576,11264,1536,ck,13,2,22.3751,a8w8_blockscale_bpreshuffle_1x128x128_256x64x256x128_16x16_16x16_8x32x1_8x32x1_1x32x1x8_8_2x1_intrawave_v1,890.78,1392.73,0.0
gfx950,256,608,11264,1536,ck,13,0,23.0538,a8w8_blockscale_bpreshuffle_1x128x128_256x64x256x128_16x16_16x16_8x32x1_8x32x1_1x32x1x8_8_2x1_intrawave_v1,912.59,1385.13,0.0
gfx950,256,640,11264,1536,ck,13,2,23.2775,a8w8_blockscale_bpreshuffle_1x128x128_256x64x256x128_16x16_16x16_8x32x1_8x32x1_1x32x1x8_8_2x1_intrawave_v1,951.39,1404.9,0.0
gfx950,256,672,11264,1536,ck,13,2,23.5796,a8w8_blockscale_bpreshuffle_1x128x128_256x64x256x128_16x16_16x16_8x32x1_8x32x1_1x32x1x8_8_2x1_intrawave_v1,986.16,1419.55,0.0
gfx950,256,704,11264,1536,ck,13,1,23.4414,a8w8_blockscale_bpreshuffle_1x128x128_256x64x256x128_16x16_16x16_8x32x1_8x32x1_1x32x1x8_8_2x1_intrawave_v1,1039.21,1460.77,0.0
gfx950,256,736,11264,1536,ck,14,3,28.0696,a8w8_blockscale_bpreshuffle_1x128x128_256x64x128x128_16x16_16x16_8x32x1_8x32x1_1x32x1x8_8_2x1_intrawave_v1,907.31,1247.35,0.0002
gfx950,256,768,11264,1536,ck,14,2,27.9392,a8w8_blockscale_bpreshuffle_1x128x128_256x64x128x128_16x16_16x16_8x32x1_8x32x1_1x32x1x8_8_2x1_intrawave_v1,951.18,1280.73,0.0002
gfx950,256,800,11264,1536,ck,14,0,28.7283,a8w8_blockscale_bpreshuffle_1x128x128_256x64x128x128_16x16_16x16_8x32x1_8x32x1_1x32x1x8_8_2x1_intrawave_v1,963.59,1272.36,0.0002
gfx950,256,832,11264,1536,ck,14,3,29.2751,a8w8_blockscale_bpreshuffle_1x128x128_256x64x128x128_16x16_16x16_8x32x1_8x32x1_1x32x1x8_8_2x1_intrawave_v1,983.42,1274.9,0.0002
gfx950,256,864,11264,1536,ck,14,0,29.5972,a8w8_blockscale_bpreshuffle_1x128x128_256x64x128x128_16x16_16x16_8x32x1_8x32x1_1x32x1x8_8_2x1_intrawave_v1,1010.13,1287.04,0.0002
gfx950,256,896,11264,1536,ck,14,1,29.5197,a8w8_blockscale_bpreshuffle_1x128x128_256x64x128x128_16x16_16x16_8x32x1_8x32x1_1x32x1x8_8_2x1_intrawave_v1,1050.29,1316.51,0.0002
gfx950,256,928,11264,1536,ck,13,1,31.8538,a8w8_blockscale_bpreshuffle_1x128x128_256x64x256x128_16x16_16x16_8x32x1_8x32x1_1x32x1x8_8_2x1_intrawave_v1,1008.09,1244.21,0.0
gfx950,256,960,11264,1536,ck,13,3,31.3254,a8w8_blockscale_bpreshuffle_1x128x128_256x64x256x128_16x16_16x16_8x32x1_8x32x1_1x32x1x8_8_2x1_intrawave_v1,1060.45,1289.78,0.0
gfx950,256,992,11264,1536,ck,13,0,35.4472,a8w8_blockscale_bpreshuffle_1x128x128_256x64x256x128_16x16_16x16_8x32x1_8x32x1_1x32x1x8_8_2x1_intrawave_v1,968.38,1161.53,0.0
gfx950,256,1024,11264,1536,ck,13,0,35.0248,a8w8_blockscale_bpreshuffle_1x128x128_256x64x256x128_16x16_16x16_8x32x1_8x32x1_1x32x1x8_8_2x1_intrawave_v1,1011.67,1197.52,0.0
gfx950,256,1088,11264,1536,ck,13,0,33.7656,a8w8_blockscale_bpreshuffle_1x128x128_256x64x256x128_16x16_16x16_8x32x1_8x32x1_1x32x1x8_8_2x1_intrawave_v1,1114.98,1287.79,0.0
gfx950,256,1152,11264,1536,ck,14,2,36.3374,a8w8_blockscale_bpreshuffle_1x128x128_256x64x128x128_16x16_16x16_8x32x1_8x32x1_1x32x1x8_8_2x1_intrawave_v1,1097.01,1239.03,0.0002
gfx950,256,1216,11264,1536,ck,14,0,38.9925,a8w8_blockscale_bpreshuffle_1x128x128_256x64x128x128_16x16_16x16_8x32x1_8x32x1_1x32x1x8_8_2x1_intrawave_v1,1079.11,1194.16,0.0003
gfx950,256,1280,11264,1536,ck,13,1,39.6937,a8w8_blockscale_bpreshuffle_1x128x128_256x64x256x128_16x16_16x16_8x32x1_8x32x1_1x32x1x8_8_2x1_intrawave_v1,1115.84,1211.87,0.0
gfx950,256,1344,11264,1536,ck,13,1,42.2937,a8w8_blockscale_bpreshuffle_1x128x128_256x64x256x128_16x16_16x16_8x32x1_8x32x1_1x32x1x8_8_2x1_intrawave_v1,1099.61,1173.78,0.0
gfx950,256,1408,11264,1536,ck,13,3,41.3354,a8w8_blockscale_bpreshuffle_1x128x128_256x64x256x128_16x16_16x16_8x32x1_8x32x1_1x32x1x8_8_2x1_intrawave_v1,1178.68,1238.25,0.0
gfx950,256,1472,11264,1536,ck,13,3,41.1898,a8w8_blockscale_bpreshuffle_1x128x128_256x64x256x128_16x16_16x16_8x32x1_8x32x1_1x32x1x8_8_2x1_intrawave_v1,1236.61,1280.02,0.0
gfx950,256,1536,11264,1536,ck,13,3,46.8067,a8w8_blockscale_bpreshuffle_1x128x128_256x64x256x128_16x16_16x16_8x32x1_8x32x1_1x32x1x8_8_2x1_intrawave_v1,1135.53,1159.32,0.0
gfx950,256,1600,11264,1536,ck,13,2,48.4414,a8w8_blockscale_bpreshuffle_1x128x128_256x64x256x128_16x16_16x16_8x32x1_8x32x1_1x32x1x8_8_2x1_intrawave_v1,1142.92,1151.99,0.0
gfx950,256,1664,11264,1536,ck,13,2,48.8634,a8w8_blockscale_bpreshuffle_1x128x128_256x64x256x128_16x16_16x16_8x32x1_8x32x1_1x32x1x8_8_2x1_intrawave_v1,1178.37,1173.56,0.0
gfx950,256,1728,11264,1536,ck,13,3,48.7658,a8w8_blockscale_bpreshuffle_1x128x128_256x64x256x128_16x16_16x16_8x32x1_8x32x1_1x32x1x8_8_2x1_intrawave_v1,1226.15,1207.49,0.0
gfx950,256,1792,11264,1536,ck,13,0,49.6094,a8w8_blockscale_bpreshuffle_1x128x128_256x64x256x128_16x16_16x16_8x32x1_8x32x1_1x32x1x8_8_2x1_intrawave_v1,1249.94,1218.0,0.0
gfx950,256,1856,11264,1536,ck,13,1,52.3927,a8w8_blockscale_bpreshuffle_1x128x128_256x64x256x128_16x16_16x16_8x32x1_8x32x1_1x32x1x8_8_2x1_intrawave_v1,1225.8,1182.69,0.0
gfx950,256,1920,11264,1536,ck,13,3,58.0171,a8w8_blockscale_bpreshuffle_1x128x128_256x64x256x128_16x16_16x16_8x32x1_8x32x1_1x32x1x8_8_2x1_intrawave_v1,1145.14,1094.58,0.0
gfx950,256,1984,11264,1536,ck,13,1,58.9391,a8w8_blockscale_bpreshuffle_1x128x128_256x64x256x128_16x16_16x16_8x32x1_8x32x1_1x32x1x8_8_2x1_intrawave_v1,1164.8,1103.59,0.0
gfx950,256,2048,11264,1536,ck,13,1,61.3891,a8w8_blockscale_bpreshuffle_1x128x128_256x64x256x128_16x16_16x16_8x32x1_8x32x1_1x32x1x8_8_2x1_intrawave_v1,1154.39,1084.63,0.0
gfx950,256,4096,11264,1536,ck,13,1,104.1395,a8w8_blockscale_bpreshuffle_1x128x128_256x64x256x128_16x16_16x16_8x32x1_8x32x1_1x32x1x8_8_2x1_intrawave_v1,1361.0,1112.62,0.0
gfx950,256,8192,11264,1536,ck,13,1,191.8263,a8w8_blockscale_bpreshuffle_1x128x128_256x64x256x128_16x16_16x16_8x32x1_8x32x1_1x32x1x8_8_2x1_intrawave_v1,1477.73,1117.85,0.0
gfx950,256,16384,11264,1536,ck,13,1,360.1565,a8w8_blockscale_bpreshuffle_1x128x128_256x64x256x128_16x16_16x16_8x32x1_8x32x1_1x32x1x8_8_2x1_intrawave_v1,1574.14,1142.74,0.0
gfx950,256,32768,11264,1536,ck,13,2,679.5554,a8w8_blockscale_bpreshuffle_1x128x128_256x64x256x128_16x16_16x16_8x32x1_8x32x1_1x32x1x8_8_2x1_intrawave_v1,1668.55,1185.82,0.0
gfx942,80,16,128,7168,asm,7,8,8.0571,_ZN5aiter42fp8gemm_bf16_blockscale_BpreShuffle_32x128E,3.64,128.62,0.0063
gfx942,80,32,128,7168,asm,7,8,8.394,_ZN5aiter42fp8gemm_bf16_blockscale_BpreShuffle_32x128E,7.0,137.61,0.0051
gfx942,80,48,128,7168,asm,7,8,8.4033,_ZN5aiter42fp8gemm_bf16_blockscale_BpreShuffle_32x128E,10.48,151.59,0.0016
gfx942,80,64,128,7168,asm,7,8,8.4813,_ZN5aiter42fp8gemm_bf16_blockscale_BpreShuffle_32x128E,13.85,164.2,0.0172
gfx942,80,80,128,7168,asm,7,8,8.4735,_ZN5aiter42fp8gemm_bf16_blockscale_BpreShuffle_32x128E,17.32,178.37,0.0014
gfx942,80,96,128,7168,asm,7,8,8.5208,_ZN5aiter42fp8gemm_bf16_blockscale_BpreShuffle_32x128E,20.67,191.32,0.0047
gfx942,80,112,128,7168,asm,7,8,8.5319,_ZN5aiter42fp8gemm_bf16_blockscale_BpreShuffle_32x128E,24.09,204.99,0.0033
gfx942,80,128,128,7168,asm,7,8,8.521,_ZN5aiter42fp8gemm_bf16_blockscale_BpreShuffle_32x128E,27.56,219.2,0.0119
gfx942,80,144,128,7168,asm,7,8,8.6312,_ZN5aiter42fp8gemm_bf16_blockscale_BpreShuffle_32x128E,30.61,230.16,0.0096
gfx942,80,160,128,7168,asm,7,8,8.6426,_ZN5aiter42fp8gemm_bf16_blockscale_BpreShuffle_32x128E,33.97,243.6,0.0078
gfx942,80,176,128,7168,asm,7,8,8.6266,_ZN5aiter42fp8gemm_bf16_blockscale_BpreShuffle_32x128E,37.44,257.82,0.0008
gfx942,80,192,128,7168,asm,7,8,8.7605,_ZN5aiter42fp8gemm_bf16_blockscale_BpreShuffle_32x128E,40.22,267.44,0.0091
gfx942,80,208,128,7168,asm,7,8,8.8638,_ZN5aiter42fp8gemm_bf16_blockscale_BpreShuffle_32x128E,43.06,277.72,0.0007
gfx942,80,224,128,7168,asm,6,7,9.1649,_ZN5aiter42fp8gemm_bf16_blockscale_BpreShuffle_32x128E,44.85,281.56,0.0091
gfx942,80,240,128,7168,asm,7,8,9.212,_ZN5aiter42fp8gemm_bf16_blockscale_BpreShuffle_32x128E,47.81,293.02,0.0116
gfx942,80,256,128,7168,asm,7,8,9.6351,_ZN5aiter42fp8gemm_bf16_blockscale_BpreShuffle_32x128E,48.76,292.48,0.0078
gfx942,80,288,128,7168,asm,7,8,9.458,_ZN5aiter42fp8gemm_bf16_blockscale_BpreShuffle_32x128E,55.88,323.07,0.013
gfx942,80,320,128,7168,asm,7,8,9.5686,_ZN5aiter42fp8gemm_bf16_blockscale_BpreShuffle_32x128E,61.37,344.17,0.0019
gfx942,80,352,128,7168,asm,6,7,10.284,_ZN5aiter42fp8gemm_bf16_blockscale_BpreShuffle_32x128E,62.81,343.32,0.005
gfx942,80,384,128,7168,asm,15,8,10.7807,_ZN5aiter42fp8gemm_bf16_blockscale_BpreShuffle_48x128E,65.36,349.54,0.0106
gfx942,80,416,128,7168,asm,15,8,10.5041,_ZN5aiter42fp8gemm_bf16_blockscale_BpreShuffle_48x128E,72.67,381.36,0.0042
gfx942,80,448,128,7168,asm,15,8,10.5491,_ZN5aiter42fp8gemm_bf16_blockscale_BpreShuffle_48x128E,77.93,402.26,0.0056
gfx942,80,480,128,7168,asm,15,8,10.718,_ZN5aiter42fp8gemm_bf16_blockscale_BpreShuffle_48x128E,82.18,418.08,0.01
gfx942,80,512,128,7168,asm,14,7,11.1046,_ZN5aiter42fp8gemm_bf16_blockscale_BpreShuffle_48x128E,84.61,424.92,0.0093
gfx942,80,544,128,7168,asm,23,8,11.8582,_ZN5aiter42fp8gemm_bf16_blockscale_BpreShuffle_64x128E,84.18,417.95,0.0038
gfx942,80,576,128,7168,asm,23,8,12.066,_ZN5aiter42fp8gemm_bf16_blockscale_BpreShuffle_64x128E,87.6,430.44,0.0058
gfx942,80,608,128,7168,asm,23,8,12.0352,_ZN5aiter42fp8gemm_bf16_blockscale_BpreShuffle_64x128E,92.7,451.28,0.0094
gfx942,80,640,128,7168,asm,23,8,12.0049,_ZN5aiter42fp8gemm_bf16_blockscale_BpreShuffle_64x128E,97.83,472.21,0.0069
gfx942,80,672,128,7168,asm,22,7,12.7084,_ZN5aiter42fp8gemm_bf16_blockscale_BpreShuffle_64x128E,97.03,464.77,0.0015
gfx942,80,704,128,7168,asm,22,7,12.6384,_ZN5aiter42fp8gemm_bf16_blockscale_BpreShuffle_64x128E,102.22,486.14,0.0063
gfx942,80,736,128,7168,asm,12,5,13.2313,_ZN5aiter42fp8gemm_bf16_blockscale_BpreShuffle_48x128E,102.07,482.31,0.0051
gfx942,80,768,128,7168,asm,12,5,13.3449,_ZN5aiter42fp8gemm_bf16_blockscale_BpreShuffle_48x128E,105.6,496.0,0.003
gfx942,80,800,128,7168,asm,21,6,13.9341,_ZN5aiter42fp8gemm_bf16_blockscale_BpreShuffle_64x128E,105.35,492.08,0.004
gfx942,80,832,128,7168,asm,21,6,14.0037,_ZN5aiter42fp8gemm_bf16_blockscale_BpreShuffle_64x128E,109.02,506.6,0.0034
gfx942,80,864,128,7168,asm,30,7,14.2731,_ZN5aiter42fp8gemm_bf16_blockscale_BpreShuffle_80x128E,111.08,513.68,0.0046
gfx942,80,896,128,7168,asm,11,4,14.4045,_ZN5aiter42fp8gemm_bf16_blockscale_BpreShuffle_48x128E,114.14,525.49,0.0013
gfx942,80,928,128,7168,asm,11,4,14.7676,_ZN5aiter42fp8gemm_bf16_blockscale_BpreShuffle_48x128E,115.31,528.66,0.0013
gfx942,80,960,128,7168,asm,11,4,14.5718,_ZN5aiter42fp8gemm_bf16_blockscale_BpreShuffle_48x128E,120.89,552.06,0.0031
gfx942,80,992,128,7168,asm,20,5,15.1298,_ZN5aiter42fp8gemm_bf16_blockscale_BpreShuffle_64x128E,120.31,547.4,0.0044
gfx942,80,1024,128,7168,asm,20,5,15.2061,_ZN5aiter42fp8gemm_bf16_blockscale_BpreShuffle_64x128E,123.57,560.28,0.003
gfx942,80,1088,128,7168,asm,19,4,16.4949,_ZN5aiter42fp8gemm_bf16_blockscale_BpreShuffle_64x128E,121.04,545.31,0.0004
gfx942,80,1152,128,7168,asm,19,4,16.6122,_ZN5aiter42fp8gemm_bf16_blockscale_BpreShuffle_64x128E,127.25,570.06,0.0039
gfx942,80,1216,128,7168,asm,10,3,16.681,_ZN5aiter42fp8gemm_bf16_blockscale_BpreShuffle_48x128E,133.77,596.19,0.0
gfx942,80,1280,128,7168,asm,19,4,16.0918,_ZN5aiter42fp8gemm_bf16_blockscale_BpreShuffle_64x128E,145.96,647.55,0.001
gfx942,80,1344,128,7168,asm,27,4,18.0412,_ZN5aiter42fp8gemm_bf16_blockscale_BpreShuffle_80x128E,136.7,603.92,0.0011
gfx942,80,1408,128,7168,asm,27,4,18.4539,_ZN5aiter42fp8gemm_bf16_blockscale_BpreShuffle_80x128E,140.01,616.16,0.0026
gfx942,80,1472,128,7168,asm,18,3,18.7933,_ZN5aiter42fp8gemm_bf16_blockscale_BpreShuffle_64x128E,143.73,630.31,0.0001
gfx942,80,1536,128,7168,asm,27,4,18.6511,_ZN5aiter42fp8gemm_bf16_blockscale_BpreShuffle_80x128E,151.12,660.59,0.0025
gfx942,80,1600,128,7168,asm,18,3,18.6901,_ZN5aiter42fp8gemm_bf16_blockscale_BpreShuffle_64x128E,157.09,684.64,0.0001
gfx942,80,1664,128,7168,asm,18,3,19.3259,_ZN5aiter42fp8gemm_bf16_blockscale_BpreShuffle_64x128E,158.0,686.7,0.0006
gfx942,80,1728,128,7168,asm,35,4,20.3878,_ZN5aiter42fp8gemm_bf16_blockscale_BpreShuffle_96x128E,155.53,674.24,0.0026
gfx942,80,1792,128,7168,asm,35,4,20.8178,_ZN5aiter42fp8gemm_bf16_blockscale_BpreShuffle_96x128E,157.96,683.13,0.0013
gfx942,80,1856,128,7168,asm,35,4,20.613,_ZN5aiter42fp8gemm_bf16_blockscale_BpreShuffle_96x128E,165.22,712.97,0.0031
gfx942,80,1920,128,7168,asm,9,2,20.9766,_ZN5aiter42fp8gemm_bf16_blockscale_BpreShuffle_48x128E,167.96,723.26,0.0
gfx942,80,1984,128,7168,asm,26,3,22.512,_ZN5aiter42fp8gemm_bf16_blockscale_BpreShuffle_80x128E,161.72,695.04,0.0002
gfx942,80,2048,128,7168,asm,26,3,22.3308,_ZN5aiter42fp8gemm_bf16_blockscale_BpreShuffle_80x128E,168.29,721.96,0.0
gfx942,80,4096,128,7168,asm,16,1,39.0305,_ZN5aiter42fp8gemm_bf16_blockscale_BpreShuffle_64x128E,192.57,802.61,0.0
gfx942,80,8192,128,7168,asm,40,1,67.5646,_ZN5aiter43fp8gemm_bf16_blockscale_BpreShuffle_128x128E,222.49,913.72,0.0
gfx942,80,16384,128,7168,asm,24,1,131.5466,_ZN5aiter42fp8gemm_bf16_blockscale_BpreShuffle_80x128E,228.55,931.63,0.0
gfx942,80,32768,128,7168,asm,32,1,253.8005,_ZN5aiter42fp8gemm_bf16_blockscale_BpreShuffle_96x128E,236.92,962.12,0.0
gfx942,80,16,2112,7168,ck,7,3,18.7169,a8w8_blockscale_bpreshuffle_1x128x128_256x16x64x256_16x16_16x16_16x16x1_16x16x1_1x16x1x16_4_1x1_intrawave_v1,25.88,818.57,0.0
gfx942,80,32,2112,7168,ck,7,1,18.94,a8w8_blockscale_bpreshuffle_1x128x128_256x16x64x256_16x16_16x16_16x16x1_16x16x1_1x16x1x16_4_1x1_intrawave_v1,51.16,818.55,0.0
gfx942,80,48,2112,7168,ck,7,1,22.4739,a8w8_blockscale_bpreshuffle_1x128x128_256x16x64x256_16x16_16x16_16x16x1_16x16x1_1x16x1x16_4_1x1_intrawave_v1,64.67,697.95,0.0
gfx942,80,64,2112,7168,ck,12,1,21.9372,a8w8_blockscale_bpreshuffle_1x128x128_256x32x64x256_16x16_16x16_16x16x1_16x16x1_1x32x1x8_8_2x1_intrawave_v1,88.33,723.33,0.0
gfx942,80,80,2112,7168,ck,7,0,30.5042,a8w8_blockscale_bpreshuffle_1x128x128_256x16x64x256_16x16_16x16_16x16x1_16x16x1_1x16x1x16_4_1x1_intrawave_v1,79.41,526.16,0.0
gfx942,80,96,2112,7168,ck,12,0,30.5276,a8w8_blockscale_bpreshuffle_1x128x128_256x32x64x256_16x16_16x16_16x16x1_16x16x1_1x32x1x8_8_2x1_intrawave_v1,95.21,531.73,0.0
gfx942,80,112,2112,7168,ck,12,2,31.5745,a8w8_blockscale_bpreshuffle_1x128x128_256x32x64x256_16x16_16x16_16x16x1_16x16x1_1x32x1x8_8_2x1_intrawave_v1,107.4,519.87,0.0
gfx942,80,128,2112,7168,ck,12,1,30.9656,a8w8_blockscale_bpreshuffle_1x128x128_256x32x64x256_16x16_16x16_16x16x1_16x16x1_1x32x1x8_8_2x1_intrawave_v1,125.16,535.98,0.0
gfx942,80,144,2112,7168,ck,10,2,37.7796,a8w8_blockscale_bpreshuffle_1x128x128_256x32x64x128_16x16_16x16_8x32x1_8x32x1_1x32x1x8_8_2x1_intrawave_v1,115.41,444.14,0.0
gfx942,80,160,2112,7168,ck,10,2,37.3673,a8w8_blockscale_bpreshuffle_1x128x128_256x32x64x128_16x16_16x16_8x32x1_8x32x1_1x32x1x8_8_2x1_intrawave_v1,129.64,453.91,0.0
gfx942,80,176,2112,7168,ck,10,1,40.1955,a8w8_blockscale_bpreshuffle_1x128x128_256x32x64x128_16x16_16x16_8x32x1_8x32x1_1x32x1x8_8_2x1_intrawave_v1,132.57,426.51,0.0
gfx942,80,192,2112,7168,ck,10,0,40.2833,a8w8_blockscale_bpreshuffle_1x128x128_256x32x64x128_16x16_16x16_8x32x1_8x32x1_1x32x1x8_8_2x1_intrawave_v1,144.31,430.11,0.0
gfx942,80,208,2112,7168,ck,10,3,41.3091,a8w8_blockscale_bpreshuffle_1x128x128_256x32x64x128_16x16_16x16_8x32x1_8x32x1_1x32x1x8_8_2x1_intrawave_v1,152.45,423.84,0.0
gfx942,80,224,2112,7168,ck,10,3,41.3449,a8w8_blockscale_bpreshuffle_1x128x128_256x32x64x128_16x16_16x16_8x32x1_8x32x1_1x32x1x8_8_2x1_intrawave_v1,164.04,427.88,0.0
gfx942,80,240,2112,7168,ck,17,1,54.189,a8w8_blockscale_bpreshuffle_1x128x128_256x64x64x256_16x16_16x16_16x16x1_16x16x1_1x32x1x8_8_2x1_intrawave_v1,134.1,329.83,0.0
gfx942,80,256,2112,7168,ck,15,3,53.1156,a8w8_blockscale_bpreshuffle_1x128x128_256x64x64x128_16x16_16x16_8x32x1_8x32x1_1x32x1x8_8_2x1_intrawave_v1,145.93,339.92,0.0
gfx942,80,288,2112,7168,ck,10,0,55.9433,a8w8_blockscale_bpreshuffle_1x128x128_256x32x64x128_16x16_16x16_8x32x1_8x32x1_1x32x1x8_8_2x1_intrawave_v1,155.87,329.26,0.0
gfx942,80,320,2112,7168,ck,12,2,67.0011,a8w8_blockscale_bpreshuffle_1x128x128_256x32x64x256_16x16_16x16_16x16x1_16x16x1_1x32x1x8_8_2x1_intrawave_v1,144.61,280.36,0.0
gfx942,80,352,2112,7168,ck,12,2,67.6667,a8w8_blockscale_bpreshuffle_1x128x128_256x32x64x256_16x16_16x16_16x16x1_16x16x1_1x32x1x8_8_2x1_intrawave_v1,157.5,282.99,0.0
gfx942,80,384,2112,7168,ck,10,3,67.7239,a8w8_blockscale_bpreshuffle_1x128x128_256x32x64x128_16x16_16x16_8x32x1_8x32x1_1x32x1x8_8_2x1_intrawave_v1,171.68,288.13,0.0
gfx942,80,416,2112,7168,ck,15,1,75.6952,a8w8_blockscale_bpreshuffle_1x128x128_256x64x64x128_16x16_16x16_8x32x1_8x32x1_1x32x1x8_8_2x1_intrawave_v1,166.4,262.6,0.0
gfx942,80,448,2112,7168,ck,15,2,73.6203,a8w8_blockscale_bpreshuffle_1x128x128_256x64x64x128_16x16_16x16_8x32x1_8x32x1_1x32x1x8_8_2x1_intrawave_v1,184.25,274.96,0.0
gfx942,80,480,2112,7168,ck,10,2,90.1308,a8w8_blockscale_bpreshuffle_1x128x128_256x32x64x128_16x16_16x16_8x32x1_8x32x1_1x32x1x8_8_2x1_intrawave_v1,161.25,228.63,0.0
gfx942,80,512,2112,7168,ck,10,3,90.865,a8w8_blockscale_bpreshuffle_1x128x128_256x32x64x128_16x16_16x16_8x32x1_8x32x1_1x32x1x8_8_2x1_intrawave_v1,170.61,230.8,0.0
gfx942,80,544,2112,7168,ck,15,0,95.6856,a8w8_blockscale_bpreshuffle_1x128x128_256x64x64x128_16x16_16x16_8x32x1_8x32x1_1x32x1x8_8_2x1_intrawave_v1,172.14,222.98,0.0
gfx942,80,576,2112,7168,ck,15,1,100.1244,a8w8_blockscale_bpreshuffle_1x128x128_256x64x64x128_16x16_16x16_8x32x1_8x32x1_1x32x1x8_8_2x1_intrawave_v1,174.18,216.74,0.0
gfx942,80,608,2112,7168,ck,10,1,102.0844,a8w8_blockscale_bpreshuffle_1x128x128_256x32x64x128_16x16_16x16_8x32x1_8x32x1_1x32x1x8_8_2x1_intrawave_v1,180.33,216.15,0.0
gfx942,80,640,2112,7168,ck,10,2,111.563,a8w8_blockscale_bpreshuffle_1x128x128_256x32x64x128_16x16_16x16_8x32x1_8x32x1_1x32x1x8_8_2x1_intrawave_v1,173.69,201.05,0.0
gfx942,80,672,2112,7168,ck,10,1,114.1413,a8w8_blockscale_bpreshuffle_1x128x128_256x32x64x128_16x16_16x16_8x32x1_8x32x1_1x32x1x8_8_2x1_intrawave_v1,178.26,199.7,0.0
gfx942,80,704,2112,7168,ck,15,2,118.6633,a8w8_blockscale_bpreshuffle_1x128x128_256x64x64x128_16x16_16x16_8x32x1_8x32x1_1x32x1x8_8_2x1_intrawave_v1,179.63,195.16,0.0
gfx942,80,736,2112,7168,ck,15,3,121.8899,a8w8_blockscale_bpreshuffle_1x128x128_256x64x64x128_16x16_16x16_8x32x1_8x32x1_1x32x1x8_8_2x1_intrawave_v1,182.82,192.99,0.0
gfx942,80,768,2112,7168,ck,15,3,119.5591,a8w8_blockscale_bpreshuffle_1x128x128_256x64x64x128_16x16_16x16_8x32x1_8x32x1_1x32x1x8_8_2x1_intrawave_v1,194.49,199.8,0.0
gfx942,80,800,2112,7168,ck,10,0,135.3582,a8w8_blockscale_bpreshuffle_1x128x128_256x32x64x128_16x16_16x16_8x32x1_8x32x1_1x32x1x8_8_2x1_intrawave_v1,178.95,179.17,0.0
gfx942,80,832,2112,7168,ck,10,1,136.6989,a8w8_blockscale_bpreshuffle_1x128x128_256x32x64x128_16x16_16x16_8x32x1_8x32x1_1x32x1x8_8_2x1_intrawave_v1,184.28,180.08,0.0
gfx942,80,864,2112,7168,ck,15,1,141.6178,a8w8_blockscale_bpreshuffle_1x128x128_256x64x64x128_16x16_16x16_8x32x1_8x32x1_1x32x1x8_8_2x1_intrawave_v1,184.72,176.4,0.0
gfx942,80,896,2112,7168,ck,15,0,140.1552,a8w8_blockscale_bpreshuffle_1x128x128_256x64x64x128_16x16_16x16_8x32x1_8x32x1_1x32x1x8_8_2x1_intrawave_v1,193.56,180.84,0.0
gfx942,80,928,2112,7168,ck,10,0,148.9956,a8w8_blockscale_bpreshuffle_1x128x128_256x32x64x128_16x16_16x16_8x32x1_8x32x1_1x32x1x8_8_2x1_intrawave_v1,188.58,172.56,0.0
gfx942,80,960,2112,7168,ck,10,0,161.2393,a8w8_blockscale_bpreshuffle_1x128x128_256x32x64x128_16x16_16x16_8x32x1_8x32x1_1x32x1x8_8_2x1_intrawave_v1,180.27,161.72,0.0
gfx942,80,992,2112,7168,ck,15,1,157.7571,a8w8_blockscale_bpreshuffle_1x128x128_256x64x64x128_16x16_16x16_8x32x1_8x32x1_1x32x1x8_8_2x1_intrawave_v1,190.39,167.6,0.0
gfx942,80,1024,2112,7168,ck,2,0,160.0913,a8w8_blockscale_bpreshuffle_1x128x128_256x64x64x128_16x16_16x16_8x32x1_8x32x1_1x32x1x8_8_2x1_intrawave_v3,193.67,167.43,0.0
gfx942,80,1088,2112,7168,ck,2,0,177.2614,a8w8_blockscale_bpreshuffle_1x128x128_256x64x64x128_16x16_16x16_8x32x1_8x32x1_1x32x1x8_8_2x1_intrawave_v3,185.84,155.33,0.0
gfx942,80,1152,2112,7168,ck,10,0,179.6506,a8w8_blockscale_bpreshuffle_1x128x128_256x32x64x128_16x16_16x16_8x32x1_8x32x1_1x32x1x8_8_2x1_intrawave_v1,194.15,157.32,0.0
gfx942,80,1216,2112,7168,ck,15,1,184.2345,a8w8_blockscale_bpreshuffle_1x128x128_256x64x64x128_16x16_16x16_8x32x1_8x32x1_1x32x1x8_8_2x1_intrawave_v1,199.84,157.36,0.0
gfx942,80,1280,2112,7168,ck,10,1,198.6922,a8w8_blockscale_bpreshuffle_1x128x128_256x32x64x128_16x16_16x16_8x32x1_8x32x1_1x32x1x8_8_2x1_intrawave_v1,195.05,149.58,0.0
gfx942,80,1344,2112,7168,ck,15,3,205.2034,a8w8_blockscale_bpreshuffle_1x128x128_256x64x64x128_16x16_16x16_8x32x1_8x32x1_1x32x1x8_8_2x1_intrawave_v1,198.31,148.39,0.0
gfx942,80,1408,2112,7168,ck,10,3,225.0839,a8w8_blockscale_bpreshuffle_1x128x128_256x32x64x128_16x16_16x16_8x32x1_8x32x1_1x32x1x8_8_2x1_intrawave_v1,189.4,138.52,0.0
gfx942,80,1472,2112,7168,ck,15,3,227.0834,a8w8_blockscale_bpreshuffle_1x128x128_256x64x64x128_16x16_16x16_8x32x1_8x32x1_1x32x1x8_8_2x1_intrawave_v1,196.27,140.51,0.0
gfx942,80,1536,2112,7168,ck,15,2,226.0578,a8w8_blockscale_bpreshuffle_1x128x128_256x64x64x128_16x16_16x16_8x32x1_8x32x1_1x32x1x8_8_2x1_intrawave_v1,205.73,144.37,0.0
gfx942,80,1600,2112,7168,ck,15,3,247.6727,a8w8_blockscale_bpreshuffle_1x128x128_256x64x64x128_16x16_16x16_8x32x1_8x32x1_1x32x1x8_8_2x1_intrawave_v1,195.6,134.72,0.0
gfx942,80,1664,2112,7168,ck,15,2,248.5469,a8w8_blockscale_bpreshuffle_1x128x128_256x64x64x128_16x16_16x16_8x32x1_8x32x1_1x32x1x8_8_2x1_intrawave_v1,202.71,137.18,0.0
gfx942,80,1728,2112,7168,ck,15,2,267.4093,a8w8_blockscale_bpreshuffle_1x128x128_256x64x64x128_16x16_16x16_8x32x1_8x32x1_1x32x1x8_8_2x1_intrawave_v1,195.65,130.23,0.0
gfx942,80,1792,2112,7168,ck,15,1,268.6836,a8w8_blockscale_bpreshuffle_1x128x128_256x64x64x128_16x16_16x16_8x32x1_8x32x1_1x32x1x8_8_2x1_intrawave_v1,201.94,132.32,0.0
gfx942,80,1856,2112,7168,ck,15,0,270.6934,a8w8_blockscale_bpreshuffle_1x128x128_256x64x64x128_16x16_16x16_8x32x1_8x32x1_1x32x1x8_8_2x1_intrawave_v1,207.6,134.03,0.0
gfx942,80,1920,2112,7168,ck,15,0,293.7054,a8w8_blockscale_bpreshuffle_1x128x128_256x64x64x128_16x16_16x16_8x32x1_8x32x1_1x32x1x8_8_2x1_intrawave_v1,197.93,126.02,0.0
gfx942,80,1984,2112,7168,ck,15,3,294.7005,a8w8_blockscale_bpreshuffle_1x128x128_256x64x64x128_16x16_16x16_8x32x1_8x32x1_1x32x1x8_8_2x1_intrawave_v1,203.84,128.06,0.0
gfx942,80,2048,2112,7168,ck,2,1,305.3982,a8w8_blockscale_bpreshuffle_1x128x128_256x64x64x128_16x16_16x16_8x32x1_8x32x1_1x32x1x8_8_2x1_intrawave_v3,203.04,125.97,0.0
gfx942,80,4096,2112,7168,ck,2,3,579.3995,a8w8_blockscale_bpreshuffle_1x128x128_256x64x64x128_16x16_16x16_8x32x1_8x32x1_1x32x1x8_8_2x1_intrawave_v3,214.04,106.66,0.0
gfx942,80,8192,2112,7168,ck,2,0,1138.7172,a8w8_blockscale_bpreshuffle_1x128x128_256x64x64x128_16x16_16x16_8x32x1_8x32x1_1x32x1x8_8_2x1_intrawave_v3,217.82,95.25,0.0
gfx942,80,16384,2112,7168,ck,2,0,2251.4918,a8w8_blockscale_bpreshuffle_1x128x128_256x64x64x128_16x16_16x16_8x32x1_8x32x1_1x32x1x8_8_2x1_intrawave_v3,220.33,89.62,0.0
gfx942,80,32768,2112,7168,ck,2,2,4481.4633,a8w8_blockscale_bpreshuffle_1x128x128_256x64x64x128_16x16_16x16_8x32x1_8x32x1_1x32x1x8_8_2x1_intrawave_v3,221.39,86.68,0.0
gfx942,80,16,2240,7168,ck,7,1,18.6177,a8w8_blockscale_bpreshuffle_1x128x128_256x16x64x256_16x16_16x16_16x16x1_16x16x1_1x16x1x16_4_1x1_intrawave_v1,27.6,872.43,0.0
gfx942,80,32,2240,7168,ck,7,2,18.9027,a8w8_blockscale_bpreshuffle_1x128x128_256x16x64x256_16x16_16x16_16x16x1_16x16x1_1x16x1x16_4_1x1_intrawave_v1,54.36,869.14,0.0
gfx942,80,48,2240,7168,ck,7,3,22.74,a8w8_blockscale_bpreshuffle_1x128x128_256x16x64x256_16x16_16x16_16x16x1_16x16x1_1x16x1x16_4_1x1_intrawave_v1,67.78,730.67,0.0
gfx942,80,64,2240,7168,ck,12,2,21.9491,a8w8_blockscale_bpreshuffle_1x128x128_256x32x64x256_16x16_16x16_16x16x1_16x16x1_1x32x1x8_8_2x1_intrawave_v1,93.64,765.49,0.0
gfx942,80,80,2240,7168,ck,7,1,31.174,a8w8_blockscale_bpreshuffle_1x128x128_256x16x64x256_16x16_16x16_16x16x1_16x16x1_1x16x1x16_4_1x1_intrawave_v1,82.41,544.95,0.0
gfx942,80,96,2240,7168,ck,12,1,30.9387,a8w8_blockscale_bpreshuffle_1x128x128_256x32x64x256_16x16_16x16_16x16x1_16x16x1_1x32x1x8_8_2x1_intrawave_v1,99.64,555.11,0.0
gfx942,80,112,2240,7168,ck,12,2,31.9012,a8w8_blockscale_bpreshuffle_1x128x128_256x32x64x256_16x16_16x16_16x16x1_16x16x1_1x32x1x8_8_2x1_intrawave_v1,112.74,544.21,0.0
gfx942,80,128,2240,7168,ck,12,1,31.1913,a8w8_blockscale_bpreshuffle_1x128x128_256x32x64x256_16x16_16x16_16x16x1_16x16x1_1x32x1x8_8_2x1_intrawave_v1,131.78,562.57,0.0
gfx942,80,144,2240,7168,ck,10,0,38.293,a8w8_blockscale_bpreshuffle_1x128x128_256x32x64x128_16x16_16x16_8x32x1_8x32x1_1x32x1x8_8_2x1_intrawave_v1,120.76,463.1,0.0
gfx942,80,160,2240,7168,ck,10,3,37.6075,a8w8_blockscale_bpreshuffle_1x128x128_256x32x64x128_16x16_16x16_8x32x1_8x32x1_1x32x1x8_8_2x1_intrawave_v1,136.62,476.5,0.0
gfx942,80,176,2240,7168,ck,10,0,41.201,a8w8_blockscale_bpreshuffle_1x128x128_256x32x64x128_16x16_16x16_8x32x1_8x32x1_1x32x1x8_8_2x1_intrawave_v1,137.18,439.46,0.0
gfx942,80,192,2240,7168,ck,10,3,41.0913,a8w8_blockscale_bpreshuffle_1x128x128_256x32x64x128_16x16_16x16_8x32x1_8x32x1_1x32x1x8_8_2x1_intrawave_v1,150.05,445.17,0.0
gfx942,80,208,2240,7168,ck,10,1,52.7835,a8w8_blockscale_bpreshuffle_1x128x128_256x32x64x128_16x16_16x16_8x32x1_8x32x1_1x32x1x8_8_2x1_intrawave_v1,126.54,350.09,0.0
gfx942,80,224,2240,7168,ck,10,1,53.3349,a8w8_blockscale_bpreshuffle_1x128x128_256x32x64x128_16x16_16x16_8x32x1_8x32x1_1x32x1x8_8_2x1_intrawave_v1,134.87,349.97,0.0
gfx942,80,240,2240,7168,ck,17,0,54.4354,a8w8_blockscale_bpreshuffle_1x128x128_256x64x64x256_16x16_16x16_16x16x1_16x16x1_1x32x1x8_8_2x1_intrawave_v1,141.58,346.32,0.0
gfx942,80,256,2240,7168,ck,15,1,53.2883,a8w8_blockscale_bpreshuffle_1x128x128_256x64x64x128_16x16_16x16_8x32x1_8x32x1_1x32x1x8_8_2x1_intrawave_v1,154.27,357.27,0.0
gfx942,80,288,2240,7168,ck,12,2,56.8997,a8w8_blockscale_bpreshuffle_1x128x128_256x32x64x256_16x16_16x16_16x16x1_16x16x1_1x32x1x8_8_2x1_intrawave_v1,162.54,341.14,0.0
gfx942,80,320,2240,7168,ck,12,3,67.6056,a8w8_blockscale_bpreshuffle_1x128x128_256x32x64x256_16x16_16x16_16x16x1_16x16x1_1x32x1x8_8_2x1_intrawave_v1,152.0,292.63,0.0
gfx942,80,352,2240,7168,ck,12,0,68.2986,a8w8_blockscale_bpreshuffle_1x128x128_256x32x64x256_16x16_16x16_16x16x1_16x16x1_1x32x1x8_8_2x1_intrawave_v1,165.5,295.12,0.0
gfx942,80,384,2240,7168,ck,15,1,72.8546,a8w8_blockscale_bpreshuffle_1x128x128_256x64x64x128_16x16_16x16_8x32x1_8x32x1_1x32x1x8_8_2x1_intrawave_v1,169.26,281.78,0.0
gfx942,80,416,2240,7168,ck,12,3,79.5584,a8w8_blockscale_bpreshuffle_1x128x128_256x32x64x256_16x16_16x16_16x16x1_16x16x1_1x32x1x8_8_2x1_intrawave_v1,167.91,262.72,0.0
gfx942,80,448,2240,7168,ck,2,2,90.1647,a8w8_blockscale_bpreshuffle_1x128x128_256x64x64x128_16x16_16x16_8x32x1_8x32x1_1x32x1x8_8_2x1_intrawave_v3,159.56,235.95,0.0
gfx942,80,480,2240,7168,ck,10,1,92.0207,a8w8_blockscale_bpreshuffle_1x128x128_256x32x64x128_16x16_16x16_8x32x1_8x32x1_1x32x1x8_8_2x1_intrawave_v1,167.51,235.24,0.0
gfx942,80,512,2240,7168,ck,10,1,92.456,a8w8_blockscale_bpreshuffle_1x128x128_256x32x64x128_16x16_16x16_8x32x1_8x32x1_1x32x1x8_8_2x1_intrawave_v1,177.83,238.17,0.0
gfx942,80,544,2240,7168,ck,15,0,96.8123,a8w8_blockscale_bpreshuffle_1x128x128_256x64x64x128_16x16_16x16_8x32x1_8x32x1_1x32x1x8_8_2x1_intrawave_v1,180.44,231.3,0.0
gfx942,80,576,2240,7168,ck,15,3,100.4176,a8w8_blockscale_bpreshuffle_1x128x128_256x64x64x128_16x16_16x16_8x32x1_8x32x1_1x32x1x8_8_2x1_intrawave_v1,184.2,226.71,0.0
gfx942,80,608,2240,7168,ck,10,3,112.1569,a8w8_blockscale_bpreshuffle_1x128x128_256x32x64x128_16x16_16x16_8x32x1_8x32x1_1x32x1x8_8_2x1_intrawave_v1,174.08,206.3,0.0
gfx942,80,640,2240,7168,ck,10,2,112.5448,a8w8_blockscale_bpreshuffle_1x128x128_256x32x64x128_16x16_16x16_8x32x1_8x32x1_1x32x1x8_8_2x1_intrawave_v1,182.61,208.9,0.0
gfx942,80,672,2240,7168,ck,15,3,122.3143,a8w8_blockscale_bpreshuffle_1x128x128_256x64x64x128_16x16_16x16_8x32x1_8x32x1_1x32x1x8_8_2x1_intrawave_v1,176.43,195.27,0.0
gfx942,80,704,2240,7168,ck,15,1,119.8154,a8w8_blockscale_bpreshuffle_1x128x128_256x64x64x128_16x16_16x16_8x32x1_8x32x1_1x32x1x8_8_2x1_intrawave_v1,188.68,202.45,0.0
gfx942,80,736,2240,7168,ck,10,1,133.8018,a8w8_blockscale_bpreshuffle_1x128x128_256x32x64x128_16x16_16x16_8x32x1_8x32x1_1x32x1x8_8_2x1_intrawave_v1,176.64,184.07,0.0
gfx942,80,768,2240,7168,ck,10,3,133.169,a8w8_blockscale_bpreshuffle_1x128x128_256x32x64x128_16x16_16x16_8x32x1_8x32x1_1x32x1x8_8_2x1_intrawave_v1,185.2,187.75,0.0
gfx942,80,800,2240,7168,ck,10,2,137.4687,a8w8_blockscale_bpreshuffle_1x128x128_256x32x64x128_16x16_16x16_8x32x1_8x32x1_1x32x1x8_8_2x1_intrawave_v1,186.88,184.59,0.0
gfx942,80,832,2240,7168,ck,15,2,140.8137,a8w8_blockscale_bpreshuffle_1x128x128_256x64x64x128_16x16_16x16_8x32x1_8x32x1_1x32x1x8_8_2x1_intrawave_v1,189.74,182.85,0.0
gfx942,80,864,2240,7168,ck,10,3,147.5081,a8w8_blockscale_bpreshuffle_1x128x128_256x32x64x128_16x16_16x16_8x32x1_8x32x1_1x32x1x8_8_2x1_intrawave_v1,188.09,177.08,0.0
gfx942,80,896,2240,7168,ck,10,2,157.4241,a8w8_blockscale_bpreshuffle_1x128x128_256x32x64x128_16x16_16x16_8x32x1_8x32x1_1x32x1x8_8_2x1_intrawave_v1,182.77,168.29,0.0
gfx942,80,928,2240,7168,ck,10,1,159.8802,a8w8_blockscale_bpreshuffle_1x128x128_256x32x64x128_16x16_16x16_8x32x1_8x32x1_1x32x1x8_8_2x1_intrawave_v1,186.39,168.04,0.0
gfx942,80,960,2240,7168,ck,15,2,164.5702,a8w8_blockscale_bpreshuffle_1x128x128_256x64x64x128_16x16_16x16_8x32x1_8x32x1_1x32x1x8_8_2x1_intrawave_v1,187.33,165.51,0.0
gfx942,80,992,2240,7168,ck,15,3,159.0991,a8w8_blockscale_bpreshuffle_1x128x128_256x64x64x128_16x16_16x16_8x32x1_8x32x1_1x32x1x8_8_2x1_intrawave_v1,200.23,173.55,0.0
gfx942,80,1024,2240,7168,ck,15,3,162.6083,a8w8_blockscale_bpreshuffle_1x128x128_256x64x64x128_16x16_16x16_8x32x1_8x32x1_1x32x1x8_8_2x1_intrawave_v1,202.22,172.09,0.0
gfx942,80,1088,2240,7168,ck,15,2,184.6629,a8w8_blockscale_bpreshuffle_1x128x128_256x64x64x128_16x16_16x16_8x32x1_8x32x1_1x32x1x8_8_2x1_intrawave_v1,189.2,155.58,0.0
gfx942,80,1152,2240,7168,ck,15,0,183.5025,a8w8_blockscale_bpreshuffle_1x128x128_256x64x64x128_16x16_16x16_8x32x1_8x32x1_1x32x1x8_8_2x1_intrawave_v1,201.6,160.62,0.0
gfx942,80,1216,2240,7168,ck,10,0,202.4083,a8w8_blockscale_bpreshuffle_1x128x128_256x32x64x128_16x16_16x16_8x32x1_8x32x1_1x32x1x8_8_2x1_intrawave_v1,192.92,149.3,0.0
gfx942,80,1280,2240,7168,ck,15,1,205.2885,a8w8_blockscale_bpreshuffle_1x128x128_256x64x64x128_16x16_16x16_8x32x1_8x32x1_1x32x1x8_8_2x1_intrawave_v1,200.23,150.84,0.0
gfx942,80,1344,2240,7168,ck,10,2,224.9089,a8w8_blockscale_bpreshuffle_1x128x128_256x32x64x128_16x16_16x16_8x32x1_8x32x1_1x32x1x8_8_2x1_intrawave_v1,191.9,141.0,0.0
gfx942,80,1408,2240,7168,ck,15,3,227.9458,a8w8_blockscale_bpreshuffle_1x128x128_256x64x64x128_16x16_16x16_8x32x1_8x32x1_1x32x1x8_8_2x1_intrawave_v1,198.36,142.39,0.0
gfx942,80,1472,2240,7168,ck,15,2,246.7014,a8w8_blockscale_bpreshuffle_1x128x128_256x64x64x128_16x16_16x16_8x32x1_8x32x1_1x32x1x8_8_2x1_intrawave_v1,191.61,134.58,0.0
gfx942,80,1536,2240,7168,ck,15,0,245.175,a8w8_blockscale_bpreshuffle_1x128x128_256x64x64x128_16x16_16x16_8x32x1_8x32x1_1x32x1x8_8_2x1_intrawave_v1,201.18,138.46,0.0
gfx942,80,1600,2240,7168,ck,15,0,248.837,a8w8_blockscale_bpreshuffle_1x128x128_256x64x64x128_16x16_16x16_8x32x1_8x32x1_1x32x1x8_8_2x1_intrawave_v1,206.48,139.42,0.0
gfx942,80,1664,2240,7168,ck,15,0,270.2424,a8w8_blockscale_bpreshuffle_1x128x128_256x64x64x128_16x16_16x16_8x32x1_8x32x1_1x32x1x8_8_2x1_intrawave_v1,197.73,131.14,0.0
gfx942,80,1728,2240,7168,ck,15,2,270.6398,a8w8_blockscale_bpreshuffle_1x128x128_256x64x64x128_16x16_16x16_8x32x1_8x32x1_1x32x1x8_8_2x1_intrawave_v1,205.04,133.7,0.0
gfx942,80,1792,2240,7168,ck,10,2,288.2416,a8w8_blockscale_bpreshuffle_1x128x128_256x32x64x128_16x16_16x16_8x32x1_8x32x1_1x32x1x8_8_2x1_intrawave_v1,199.64,128.12,0.0
gfx942,80,1856,2240,7168,ck,15,1,292.1765,a8w8_blockscale_bpreshuffle_1x128x128_256x64x64x128_16x16_16x16_8x32x1_8x32x1_1x32x1x8_8_2x1_intrawave_v1,203.99,128.95,0.0
gfx942,80,1920,2240,7168,ck,2,3,314.4694,a8w8_blockscale_bpreshuffle_1x128x128_256x64x64x128_16x16_16x16_8x32x1_8x32x1_1x32x1x8_8_2x1_intrawave_v3,196.06,122.18,0.0
gfx942,80,1984,2240,7168,ck,15,2,315.1684,a8w8_blockscale_bpreshuffle_1x128x128_256x64x64x128_16x16_16x16_8x32x1_8x32x1_1x32x1x8_8_2x1_intrawave_v1,202.15,124.27,0.0
gfx942,80,2048,2240,7168,ck,2,1,309.6951,a8w8_blockscale_bpreshuffle_1x128x128_256x64x64x128_16x16_16x16_8x32x1_8x32x1_1x32x1x8_8_2x1_intrawave_v3,212.36,128.87,0.0
gfx942,80,4096,2240,7168,ck,2,1,601.4605,a8w8_blockscale_bpreshuffle_1x128x128_256x64x64x128_16x16_16x16_8x32x1_8x32x1_1x32x1x8_8_2x1_intrawave_v3,218.69,106.02,0.0
gfx942,80,8192,2240,7168,ck,2,1,1188.2527,a8w8_blockscale_bpreshuffle_1x128x128_256x64x64x128_16x16_16x16_8x32x1_8x32x1_1x32x1x8_8_2x1_intrawave_v3,221.39,93.82,0.0
gfx942,80,16384,2240,7168,ck,2,1,2360.0542,a8w8_blockscale_bpreshuffle_1x128x128_256x64x64x128_16x16_16x16_8x32x1_8x32x1_1x32x1x8_8_2x1_intrawave_v3,222.93,87.67,0.0
gfx942,80,32768,2240,7168,ck,2,3,4701.297,a8w8_blockscale_bpreshuffle_1x128x128_256x64x64x128_16x16_16x16_8x32x1_8x32x1_1x32x1x8_8_2x1_intrawave_v3,223.82,84.6,0.0
gfx942,80,16,3072,7168,asm,2,3,14.7518,_ZN5aiter42fp8gemm_bf16_blockscale_BpreShuffle_32x128E,47.77,1507.14,0.0003
gfx942,80,32,3072,7168,asm,2,3,15.1746,_ZN5aiter42fp8gemm_bf16_blockscale_BpreShuffle_32x128E,92.87,1479.19,0.0005
gfx942,80,48,3072,7168,asm,10,3,16.3772,_ZN5aiter42fp8gemm_bf16_blockscale_BpreShuffle_48x128E,129.08,1383.57,0.0003
gfx942,80,64,3072,7168,asm,18,3,19.1366,_ZN5aiter42fp8gemm_bf16_blockscale_BpreShuffle_64x128E,147.29,1195.2,0.0003
gfx942,80,80,3072,7168,asm,26,3,21.3361,_ZN5aiter42fp8gemm_bf16_blockscale_BpreShuffle_80x128E,165.13,1081.97,0.0003
gfx942,80,96,3072,7168,asm,34,3,24.1384,_ZN5aiter42fp8gemm_bf16_blockscale_BpreShuffle_96x128E,175.15,965.19,0.0004
gfx942,80,112,3072,7168,asm,42,3,30.6896,_ZN5aiter43fp8gemm_bf16_blockscale_BpreShuffle_128x128E,160.72,766.09,0.0002
gfx942,80,128,3072,7168,asm,42,3,31.1104,_ZN5aiter43fp8gemm_bf16_blockscale_BpreShuffle_128x128E,181.2,762.58,0.0003
gfx942,80,144,3072,7168,asm,8,1,32.2185,_ZN5aiter42fp8gemm_bf16_blockscale_BpreShuffle_48x128E,196.84,742.96,0.0
gfx942,80,160,3072,7168,asm,16,1,37.4621,_ZN5aiter42fp8gemm_bf16_blockscale_BpreShuffle_64x128E,188.09,644.65,0.0
gfx942,80,176,3072,7168,asm,16,1,37.5267,_ZN5aiter42fp8gemm_bf16_blockscale_BpreShuffle_64x128E,206.55,649.22,0.0
gfx942,80,192,3072,7168,asm,16,1,38.8934,_ZN5aiter42fp8gemm_bf16_blockscale_BpreShuffle_64x128E,217.41,631.88,0.0
gfx942,80,208,3072,7168,asm,24,1,44.877,_ZN5aiter42fp8gemm_bf16_blockscale_BpreShuffle_80x128E,204.12,552.38,0.0
gfx942,80,224,3072,7168,asm,24,1,44.6339,_ZN5aiter42fp8gemm_bf16_blockscale_BpreShuffle_80x128E,221.02,560.16,0.0
gfx942,80,240,3072,7168,asm,24,1,45.0432,_ZN5aiter42fp8gemm_bf16_blockscale_BpreShuffle_80x128E,234.66,559.8,0.0
gfx942,80,256,3072,7168,asm,32,1,51.4846,_ZN5aiter42fp8gemm_bf16_blockscale_BpreShuffle_96x128E,218.98,493.89,0.0
gfx942,80,288,3072,7168,asm,32,1,52.1175,_ZN5aiter42fp8gemm_bf16_blockscale_BpreShuffle_96x128E,243.36,496.07,0.0
gfx942,80,320,3072,7168,asm,40,1,66.4841,_ZN5aiter43fp8gemm_bf16_blockscale_BpreShuffle_128x128E,211.97,395.28,0.0
gfx942,80,352,3072,7168,asm,40,1,66.6063,_ZN5aiter43fp8gemm_bf16_blockscale_BpreShuffle_128x128E,232.74,400.95,0.0
gfx942,80,384,3072,7168,asm,40,1,66.0279,_ZN5aiter43fp8gemm_bf16_blockscale_BpreShuffle_128x128E,256.13,410.92,0.0
gfx942,80,416,3072,7168,ck,8,2,83.1534,a8w8_blockscale_bpreshuffle_1x128x128_256x32x256x128_16x16_16x16_8x32x1_8x32x1_1x32x1x8_8_2x1_intrawave_v1,220.32,331.41,0.0
gfx942,80,448,3072,7168,asm,24,1,86.7783,_ZN5aiter42fp8gemm_bf16_blockscale_BpreShuffle_80x128E,227.36,322.48,0.0
gfx942,80,480,3072,7168,asm,24,1,86.7924,_ZN5aiter42fp8gemm_bf16_blockscale_BpreShuffle_80x128E,243.56,327.33,0.0
gfx942,80,512,3072,7168,asm,32,1,100.7868,_ZN5aiter42fp8gemm_bf16_blockscale_BpreShuffle_96x128E,223.73,286.11,0.0
gfx942,80,544,3072,7168,asm,32,1,101.2355,_ZN5aiter42fp8gemm_bf16_blockscale_BpreShuffle_96x128E,236.65,289.05,0.0
gfx942,80,576,3072,7168,asm,32,1,101.2702,_ZN5aiter42fp8gemm_bf16_blockscale_BpreShuffle_96x128E,250.49,293.15,0.0
gfx942,80,608,3072,7168,asm,16,1,109.2248,_ZN5aiter42fp8gemm_bf16_blockscale_BpreShuffle_64x128E,245.15,275.7,0.0
gfx942,80,640,3072,7168,asm,16,1,109.7489,_ZN5aiter42fp8gemm_bf16_blockscale_BpreShuffle_64x128E,256.82,278.27,0.0
gfx942,80,672,3072,7168,asm,24,1,129.1709,_ZN5aiter42fp8gemm_bf16_blockscale_BpreShuffle_80x128E,229.12,239.73,0.0
gfx942,80,704,3072,7168,asm,24,1,129.3467,_ZN5aiter42fp8gemm_bf16_blockscale_BpreShuffle_80x128E,239.7,242.69,0.0
gfx942,80,736,3072,7168,asm,24,1,129.0532,_ZN5aiter42fp8gemm_bf16_blockscale_BpreShuffle_80x128E,251.16,246.55,0.0
gfx942,80,768,3072,7168,asm,24,1,129.1372,_ZN5aiter42fp8gemm_bf16_blockscale_BpreShuffle_80x128E,261.91,249.69,0.0
gfx942,80,800,3072,7168,asm,24,1,129.9978,_ZN5aiter42fp8gemm_bf16_blockscale_BpreShuffle_80x128E,271.02,251.31,0.0
gfx942,80,832,3072,7168,ck,13,0,143.482,a8w8_blockscale_bpreshuffle_1x128x128_256x64x256x128_16x16_16x16_8x32x1_8x32x1_1x32x1x8_8_2x1_intrawave_v1,255.37,230.66,0.0
gfx942,80,864,3072,7168,asm,32,1,150.7098,_ZN5aiter42fp8gemm_bf16_blockscale_BpreShuffle_96x128E,252.48,222.43,0.0
gfx942,80,896,3072,7168,asm,32,1,151.3445,_ZN5aiter42fp8gemm_bf16_blockscale_BpreShuffle_96x128E,260.73,224.31,0.0
gfx942,80,928,3072,7168,asm,32,1,150.9175,_ZN5aiter42fp8gemm_bf16_blockscale_BpreShuffle_96x128E,270.81,227.76,0.0
gfx942,80,960,3072,7168,asm,32,1,151.8724,_ZN5aiter42fp8gemm_bf16_blockscale_BpreShuffle_96x128E,278.38,229.14,0.0
gfx942,80,992,3072,7168,asm,24,1,171.2941,_ZN5aiter42fp8gemm_bf16_blockscale_BpreShuffle_80x128E,255.05,205.64,0.0
gfx942,80,1024,3072,7168,asm,24,1,171.4075,_ZN5aiter42fp8gemm_bf16_blockscale_BpreShuffle_80x128E,263.1,207.99,0.0
gfx942,80,1088,3072,7168,asm,40,1,193.1534,_ZN5aiter43fp8gemm_bf16_blockscale_BpreShuffle_128x128E,248.07,188.99,0.0
gfx942,80,1152,3072,7168,asm,40,1,193.8971,_ZN5aiter43fp8gemm_bf16_blockscale_BpreShuffle_128x128E,261.66,192.66,0.0
gfx942,80,1216,3072,7168,asm,40,1,194.3037,_ZN5aiter43fp8gemm_bf16_blockscale_BpreShuffle_128x128E,275.61,196.64,0.0
gfx942,80,1280,3072,7168,asm,40,1,194.8454,_ZN5aiter43fp8gemm_bf16_blockscale_BpreShuffle_128x128E,289.31,200.46,0.0
gfx942,80,1344,3072,7168,ck,14,0,240.2304,a8w8_blockscale_bpreshuffle_1x128x128_256x64x128x128_16x16_16x16_8x32x1_8x32x1_1x32x1x8_8_2x1_intrawave_v1,246.39,166.14,0.0
gfx942,80,1408,3072,7168,ck,14,0,241.4383,a8w8_blockscale_bpreshuffle_1x128x128_256x64x128x128_16x16_16x16_8x32x1_8x32x1_1x32x1x8_8_2x1_intrawave_v1,256.83,168.84,0.0
gfx942,80,1472,3072,7168,ck,14,0,242.5473,a8w8_blockscale_bpreshuffle_1x128x128_256x64x128x128_16x16_16x16_8x32x1_8x32x1_1x32x1x8_8_2x1_intrawave_v1,267.28,171.58,0.0
gfx942,80,1536,3072,7168,asm,32,1,249.4324,_ZN5aiter42fp8gemm_bf16_blockscale_BpreShuffle_96x128E,271.2,170.26,0.0
gfx942,80,1600,3072,7168,asm,24,1,255.5933,_ZN5aiter42fp8gemm_bf16_blockscale_BpreShuffle_80x128E,275.69,169.49,0.0
gfx942,80,1664,3072,7168,asm,40,1,258.3348,_ZN5aiter43fp8gemm_bf16_blockscale_BpreShuffle_128x128E,283.67,170.98,0.0
gfx942,80,1728,3072,7168,asm,24,1,296.3123,_ZN5aiter42fp8gemm_bf16_blockscale_BpreShuffle_80x128E,256.83,151.95,0.0
gfx942,80,1792,3072,7168,asm,32,1,296.8403,_ZN5aiter42fp8gemm_bf16_blockscale_BpreShuffle_96x128E,265.87,154.55,0.0
gfx942,80,1856,3072,7168,asm,32,1,299.4231,_ZN5aiter42fp8gemm_bf16_blockscale_BpreShuffle_96x128E,272.99,156.06,0.0
gfx942,80,1920,3072,7168,asm,32,1,300.2875,_ZN5aiter42fp8gemm_bf16_blockscale_BpreShuffle_96x128E,281.59,158.45,0.0
gfx942,80,1984,3072,7168,asm,40,1,320.1208,_ZN5aiter43fp8gemm_bf16_blockscale_BpreShuffle_128x128E,272.95,151.29,0.0
gfx942,80,2048,3072,7168,asm,40,1,320.2291,_ZN5aiter43fp8gemm_bf16_blockscale_BpreShuffle_128x128E,281.66,153.9,0.0
gfx942,80,4096,3072,7168,asm,40,1,636.3343,_ZN5aiter43fp8gemm_bf16_blockscale_BpreShuffle_128x128E,283.48,120.29,0.0
gfx942,80,8192,3072,7168,asm,40,1,1275.0246,_ZN5aiter43fp8gemm_bf16_blockscale_BpreShuffle_128x128E,282.96,102.8,0.0
gfx942,80,16384,3072,7168,asm,40,1,2479.218,_ZN5aiter43fp8gemm_bf16_blockscale_BpreShuffle_128x128E,291.04,96.85,0.0
gfx942,80,32768,3072,7168,asm,40,1,4894.7436,_ZN5aiter43fp8gemm_bf16_blockscale_BpreShuffle_128x128E,294.83,93.62,0.0
gfx942,80,16,4096,7168,ck,7,2,18.6898,a8w8_blockscale_bpreshuffle_1x128x128_256x16x64x256_16x16_16x16_16x16x1_16x16x1_1x16x1x16_4_1x1_intrawave_v1,50.27,1584.07,0.0
gfx942,80,32,4096,7168,asm,1,2,19.8485,_ZN5aiter42fp8gemm_bf16_blockscale_BpreShuffle_32x128E,94.67,1503.98,0.0
gfx942,80,48,4096,7168,asm,9,2,21.2654,_ZN5aiter42fp8gemm_bf16_blockscale_BpreShuffle_48x128E,132.54,1415.32,0.0
gfx942,80,64,4096,7168,asm,17,2,24.648,_ZN5aiter42fp8gemm_bf16_blockscale_BpreShuffle_64x128E,152.47,1231.06,0.0
gfx942,80,80,4096,7168,asm,25,2,27.8644,_ZN5aiter42fp8gemm_bf16_blockscale_BpreShuffle_80x128E,168.59,1097.78,0.0
gfx942,80,96,4096,7168,asm,33,2,31.9848,_ZN5aiter42fp8gemm_bf16_blockscale_BpreShuffle_96x128E,176.24,964.04,0.0
gfx942,80,112,4096,7168,asm,16,1,37.6722,_ZN5aiter42fp8gemm_bf16_blockscale_BpreShuffle_64x128E,174.58,825.02,0.0
gfx942,80,128,4096,7168,asm,16,1,38.5926,_ZN5aiter42fp8gemm_bf16_blockscale_BpreShuffle_64x128E,194.76,811.72,0.0
gfx942,80,144,4096,7168,asm,24,1,44.6865,_ZN5aiter42fp8gemm_bf16_blockscale_BpreShuffle_80x128E,189.22,706.52,0.0
gfx942,80,160,4096,7168,asm,24,1,45.084,_ZN5aiter42fp8gemm_bf16_blockscale_BpreShuffle_80x128E,208.39,705.74,0.0
gfx942,80,176,4096,7168,asm,32,1,51.7128,_ZN5aiter42fp8gemm_bf16_blockscale_BpreShuffle_96x128E,199.85,620.03,0.0
gfx942,80,192,4096,7168,asm,32,1,51.8181,_ZN5aiter42fp8gemm_bf16_blockscale_BpreShuffle_96x128E,217.57,623.51,0.0
gfx942,80,208,4096,7168,asm,8,1,61.2001,_ZN5aiter42fp8gemm_bf16_blockscale_BpreShuffle_48x128E,199.57,531.94,0.0
gfx942,80,224,4096,7168,asm,8,1,61.9614,_ZN5aiter42fp8gemm_bf16_blockscale_BpreShuffle_48x128E,212.28,529.37,0.0
gfx942,80,240,4096,7168,asm,8,1,61.8393,_ZN5aiter42fp8gemm_bf16_blockscale_BpreShuffle_48x128E,227.89,534.39,0.0
gfx942,80,256,4096,7168,asm,40,1,66.2085,_ZN5aiter43fp8gemm_bf16_blockscale_BpreShuffle_128x128E,227.05,502.84,0.0
gfx942,80,288,4096,7168,asm,16,1,73.8928,_ZN5aiter42fp8gemm_bf16_blockscale_BpreShuffle_64x128E,228.86,457.2,0.0
gfx942,80,320,4096,7168,asm,16,1,74.1163,_ZN5aiter42fp8gemm_bf16_blockscale_BpreShuffle_64x128E,253.53,462.45,0.0
gfx942,80,352,4096,7168,asm,24,1,87.0854,_ZN5aiter42fp8gemm_bf16_blockscale_BpreShuffle_80x128E,237.35,399.23,0.0
gfx942,80,384,4096,7168,asm,24,1,87.1334,_ZN5aiter42fp8gemm_bf16_blockscale_BpreShuffle_80x128E,258.78,404.65,0.0
gfx942,80,416,4096,7168,asm,32,1,101.4157,_ZN5aiter42fp8gemm_bf16_blockscale_BpreShuffle_96x128E,240.87,352.51,0.0
gfx942,80,448,4096,7168,asm,32,1,101.7786,_ZN5aiter42fp8gemm_bf16_blockscale_BpreShuffle_96x128E,258.47,356.08,0.0
gfx942,80,480,4096,7168,asm,32,1,101.8047,_ZN5aiter42fp8gemm_bf16_blockscale_BpreShuffle_96x128E,276.86,360.82,0.0
gfx942,80,512,4096,7168,asm,24,1,128.1009,_ZN5aiter42fp8gemm_bf16_blockscale_BpreShuffle_80x128E,234.7,290.59,0.0
gfx942,80,544,4096,7168,asm,24,1,128.311,_ZN5aiter42fp8gemm_bf16_blockscale_BpreShuffle_80x128E,248.96,293.94,0.0
gfx942,80,576,4096,7168,asm,40,1,130.2276,_ZN5aiter43fp8gemm_bf16_blockscale_BpreShuffle_128x128E,259.72,293.39,0.0
gfx942,80,608,4096,7168,asm,40,1,130.2322,_ZN5aiter43fp8gemm_bf16_blockscale_BpreShuffle_128x128E,274.14,297.15,0.0
gfx942,80,640,4096,7168,asm,40,1,131.0452,_ZN5aiter43fp8gemm_bf16_blockscale_BpreShuffle_128x128E,286.78,299.06,0.0
gfx942,80,672,4096,7168,asm,32,1,150.7739,_ZN5aiter42fp8gemm_bf16_blockscale_BpreShuffle_96x128E,261.72,263.19,0.0
gfx942,80,704,4096,7168,asm,24,1,170.3934,_ZN5aiter42fp8gemm_bf16_blockscale_BpreShuffle_80x128E,242.61,235.77,0.0
gfx942,80,736,4096,7168,asm,24,1,171.4084,_ZN5aiter42fp8gemm_bf16_blockscale_BpreShuffle_80x128E,252.14,237.24,0.0
gfx942,80,768,4096,7168,asm,24,1,171.238,_ZN5aiter42fp8gemm_bf16_blockscale_BpreShuffle_80x128E,263.36,240.35,0.0
gfx942,80,800,4096,7168,asm,24,1,171.5517,_ZN5aiter42fp8gemm_bf16_blockscale_BpreShuffle_80x128E,273.83,242.77,0.0
gfx942,80,832,4096,7168,asm,40,1,192.7565,_ZN5aiter43fp8gemm_bf16_blockscale_BpreShuffle_128x128E,253.46,218.62,0.0
gfx942,80,864,4096,7168,asm,40,1,192.5909,_ZN5aiter43fp8gemm_bf16_blockscale_BpreShuffle_128x128E,263.43,221.36,0.0
gfx942,80,896,4096,7168,asm,40,1,193.7788,_ZN5aiter43fp8gemm_bf16_blockscale_BpreShuffle_128x128E,271.51,222.54,0.0
gfx942,80,928,4096,7168,asm,32,1,199.6437,_ZN5aiter42fp8gemm_bf16_blockscale_BpreShuffle_96x128E,272.95,218.46,0.0
gfx942,80,960,4096,7168,asm,32,1,201.0278,_ZN5aiter42fp8gemm_bf16_blockscale_BpreShuffle_96x128E,280.42,219.4,0.0
gfx942,80,992,4096,7168,asm,32,1,246.2115,_ZN5aiter42fp8gemm_bf16_blockscale_BpreShuffle_96x128E,236.59,181.13,0.0
gfx942,80,1024,4096,7168,ck,14,0,239.8009,a8w8_blockscale_bpreshuffle_1x128x128_256x64x128x128_16x16_16x16_8x32x1_8x32x1_1x32x1x8_8_2x1_intrawave_v1,250.75,188.03,0.0
gfx942,80,1088,4096,7168,ck,14,2,243.5167,a8w8_blockscale_bpreshuffle_1x128x128_256x64x128x128_16x16_16x16_8x32x1_8x32x1_1x32x1x8_8_2x1_intrawave_v1,262.35,189.19,0.0
gfx942,80,1152,4096,7168,asm,32,1,249.4129,_ZN5aiter42fp8gemm_bf16_blockscale_BpreShuffle_96x128E,271.22,188.66,0.0
gfx942,80,1216,4096,7168,asm,40,1,257.6608,_ZN5aiter43fp8gemm_bf16_blockscale_BpreShuffle_128x128E,277.12,186.44,0.0
gfx942,80,1280,4096,7168,asm,40,1,257.7026,_ZN5aiter43fp8gemm_bf16_blockscale_BpreShuffle_128x128E,291.66,190.22,0.0
gfx942,80,1344,4096,7168,asm,32,1,296.8003,_ZN5aiter42fp8gemm_bf16_blockscale_BpreShuffle_96x128E,265.9,168.48,0.0
gfx942,80,1408,4096,7168,asm,32,1,299.1361,_ZN5aiter42fp8gemm_bf16_blockscale_BpreShuffle_96x128E,276.39,170.45,0.0
gfx942,80,1472,4096,7168,asm,40,1,319.9213,_ZN5aiter43fp8gemm_bf16_blockscale_BpreShuffle_128x128E,270.18,162.45,0.0
gfx942,80,1536,4096,7168,asm,40,1,319.9848,_ZN5aiter43fp8gemm_bf16_blockscale_BpreShuffle_128x128E,281.87,165.49,0.0
gfx942,80,1600,4096,7168,asm,24,1,339.1142,_ZN5aiter42fp8gemm_bf16_blockscale_BpreShuffle_80x128E,277.05,159.05,0.0
gfx942,80,1664,4096,7168,ck,14,0,370.7577,a8w8_blockscale_bpreshuffle_1x128x128_256x64x128x128_16x16_16x16_8x32x1_8x32x1_1x32x1x8_8_2x1_intrawave_v1,263.54,148.13,0.0
gfx942,80,1728,4096,7168,ck,14,0,370.8495,a8w8_blockscale_bpreshuffle_1x128x128_256x64x128x128_16x16_16x16_8x32x1_8x32x1_1x32x1x8_8_2x1_intrawave_v1,273.61,150.74,0.0
gfx942,80,1792,4096,7168,asm,40,1,382.9499,_ZN5aiter43fp8gemm_bf16_blockscale_BpreShuffle_128x128E,274.78,148.54,0.0
gfx942,80,1856,4096,7168,asm,40,1,384.2988,_ZN5aiter43fp8gemm_bf16_blockscale_BpreShuffle_128x128E,283.59,150.58,0.0
gfx942,80,1920,4096,7168,asm,40,1,384.5303,_ZN5aiter43fp8gemm_bf16_blockscale_BpreShuffle_128x128E,293.2,153.05,0.0
gfx942,80,1984,4096,7168,asm,24,1,424.4586,_ZN5aiter42fp8gemm_bf16_blockscale_BpreShuffle_80x128E,274.47,140.97,0.0
gfx942,80,2048,4096,7168,ck,14,3,434.8487,a8w8_blockscale_bpreshuffle_1x128x128_256x64x128x128_16x16_16x16_8x32x1_8x32x1_1x32x1x8_8_2x1_intrawave_v1,276.55,139.86,0.0
gfx942,80,4096,4096,7168,asm,40,1,831.9918,_ZN5aiter43fp8gemm_bf16_blockscale_BpreShuffle_128x128E,289.09,110.91,0.0
gfx942,80,8192,4096,7168,asm,40,1,1654.7731,_ZN5aiter43fp8gemm_bf16_blockscale_BpreShuffle_128x128E,290.7,93.78,0.0
gfx942,80,16384,4096,7168,asm,40,1,3301.1914,_ZN5aiter43fp8gemm_bf16_blockscale_BpreShuffle_128x128E,291.43,85.13,0.0
gfx942,80,32768,4096,7168,asm,40,1,6575.7339,_ZN5aiter43fp8gemm_bf16_blockscale_BpreShuffle_128x128E,292.61,81.01,0.0
gfx942,80,16,4608,7168,ck,7,2,18.3748,a8w8_blockscale_bpreshuffle_1x128x128_256x16x64x256_16x16_16x16_16x16x1_16x16x1_1x16x1x16_4_1x1_intrawave_v1,57.52,1811.84,0.0
gfx942,80,32,4608,7168,asm,1,2,19.9503,_ZN5aiter42fp8gemm_bf16_blockscale_BpreShuffle_32x128E,105.96,1681.9,0.0
gfx942,80,48,4608,7168,asm,9,2,22.5876,_ZN5aiter42fp8gemm_bf16_blockscale_BpreShuffle_48x128E,140.38,1497.13,0.0
gfx942,80,64,4608,7168,asm,17,2,24.7553,_ZN5aiter42fp8gemm_bf16_blockscale_BpreShuffle_64x128E,170.79,1376.62,0.0
gfx942,80,80,4608,7168,asm,25,2,29.0883,_ZN5aiter42fp8gemm_bf16_blockscale_BpreShuffle_80x128E,181.68,1180.57,0.0
gfx942,80,96,4608,7168,asm,8,1,32.6468,_ZN5aiter42fp8gemm_bf16_blockscale_BpreShuffle_48x128E,194.25,1059.92,0.0
gfx942,80,112,4608,7168,asm,16,1,37.6447,_ZN5aiter42fp8gemm_bf16_blockscale_BpreShuffle_64x128E,196.54,926.16,0.0
gfx942,80,128,4608,7168,asm,16,1,38.8654,_ZN5aiter42fp8gemm_bf16_blockscale_BpreShuffle_64x128E,217.56,903.82,0.0
gfx942,80,144,4608,7168,asm,24,1,44.5431,_ZN5aiter42fp8gemm_bf16_blockscale_BpreShuffle_80x128E,213.56,794.5,0.0
gfx942,80,160,4608,7168,asm,24,1,45.1457,_ZN5aiter42fp8gemm_bf16_blockscale_BpreShuffle_80x128E,234.12,789.7,0.0
gfx942,80,176,4608,7168,asm,32,1,52.2426,_ZN5aiter42fp8gemm_bf16_blockscale_BpreShuffle_96x128E,222.55,687.44,0.0
gfx942,80,192,4608,7168,asm,32,1,52.5274,_ZN5aiter42fp8gemm_bf16_blockscale_BpreShuffle_96x128E,241.47,688.7,0.0
gfx942,80,208,4608,7168,asm,40,1,65.8725,_ZN5aiter43fp8gemm_bf16_blockscale_BpreShuffle_128x128E,208.59,553.16,0.0
gfx942,80,224,4608,7168,asm,40,1,65.9301,_ZN5aiter43fp8gemm_bf16_blockscale_BpreShuffle_128x128E,224.44,556.65,0.0
gfx942,80,240,4608,7168,asm,40,1,66.1437,_ZN5aiter43fp8gemm_bf16_blockscale_BpreShuffle_128x128E,239.7,558.82,0.0
gfx942,80,256,4608,7168,asm,40,1,65.9222,_ZN5aiter43fp8gemm_bf16_blockscale_BpreShuffle_128x128E,256.54,564.67,0.0
gfx942,80,288,4608,7168,asm,24,1,86.3585,_ZN5aiter42fp8gemm_bf16_blockscale_BpreShuffle_80x128E,220.31,437.12,0.0
gfx942,80,320,4608,7168,asm,24,1,86.922,_ZN5aiter42fp8gemm_bf16_blockscale_BpreShuffle_80x128E,243.2,440.31,0.0
gfx942,80,352,4608,7168,asm,32,1,100.9543,_ZN5aiter42fp8gemm_bf16_blockscale_BpreShuffle_96x128E,230.33,384.31,0.0
gfx942,80,384,4608,7168,asm,32,1,101.3995,_ZN5aiter42fp8gemm_bf16_blockscale_BpreShuffle_96x128E,250.17,387.79,0.0
gfx942,80,416,4608,7168,ck,8,0,125.3978,a8w8_blockscale_bpreshuffle_1x128x128_256x32x256x128_16x16_16x16_8x32x1_8x32x1_1x32x1x8_8_2x1_intrawave_v1,219.15,317.76,0.0
gfx942,80,448,4608,7168,asm,24,1,128.0119,_ZN5aiter42fp8gemm_bf16_blockscale_BpreShuffle_80x128E,231.19,315.36,0.0
gfx942,80,480,4608,7168,asm,24,1,128.4135,_ZN5aiter42fp8gemm_bf16_blockscale_BpreShuffle_80x128E,246.93,318.46,0.0
gfx942,80,512,4608,7168,asm,40,1,129.7524,_ZN5aiter43fp8gemm_bf16_blockscale_BpreShuffle_128x128E,260.67,319.21,0.0
gfx942,80,544,4608,7168,asm,32,1,149.63,_ZN5aiter42fp8gemm_bf16_blockscale_BpreShuffle_96x128E,240.17,280.31,0.0
gfx942,80,576,4608,7168,asm,32,1,150.6801,_ZN5aiter42fp8gemm_bf16_blockscale_BpreShuffle_96x128E,252.53,281.84,0.0
gfx942,80,608,4608,7168,asm,24,1,169.6501,_ZN5aiter42fp8gemm_bf16_blockscale_BpreShuffle_80x128E,236.75,253.41,0.0
gfx942,80,640,4608,7168,asm,24,1,170.23,_ZN5aiter42fp8gemm_bf16_blockscale_BpreShuffle_80x128E,248.36,255.63,0.0
gfx942,80,672,4608,7168,asm,16,1,178.1505,_ZN5aiter42fp8gemm_bf16_blockscale_BpreShuffle_64x128E,249.19,247.21,0.0
gfx942,80,704,4608,7168,ck,14,0,177.5823,a8w8_blockscale_bpreshuffle_1x128x128_256x64x128x128_16x16_16x16_8x32x1_8x32x1_1x32x1x8_8_2x1_intrawave_v1,261.89,250.95,0.0
gfx942,80,736,4608,7168,asm,40,1,192.5216,_ZN5aiter43fp8gemm_bf16_blockscale_BpreShuffle_128x128E,252.55,234.2,0.0
gfx942,80,768,4608,7168,asm,40,1,193.3022,_ZN5aiter43fp8gemm_bf16_blockscale_BpreShuffle_128x128E,262.46,235.97,0.0
gfx942,80,800,4608,7168,asm,24,1,212.45,_ZN5aiter42fp8gemm_bf16_blockscale_BpreShuffle_80x128E,248.76,217.17,0.0
gfx942,80,832,4608,7168,ck,14,0,208.0825,a8w8_blockscale_bpreshuffle_1x128x128_256x64x128x128_16x16_16x16_8x32x1_8x32x1_1x32x1x8_8_2x1_intrawave_v1,264.14,224.25,0.0
gfx942,80,864,4608,7168,asm,24,1,212.7137,_ZN5aiter42fp8gemm_bf16_blockscale_BpreShuffle_80x128E,268.32,221.83,0.0
gfx942,80,896,4608,7168,ck,14,3,240.3365,a8w8_blockscale_bpreshuffle_1x128x128_256x64x128x128_16x16_16x16_8x32x1_8x32x1_1x32x1x8_8_2x1_intrawave_v1,246.28,198.51,0.0
gfx942,80,928,4608,7168,asm,16,1,247.8788,_ZN5aiter42fp8gemm_bf16_blockscale_BpreShuffle_64x128E,247.31,194.59,0.0
gfx942,80,960,4608,7168,ck,14,0,242.7414,a8w8_blockscale_bpreshuffle_1x128x128_256x64x128x128_16x16_16x16_8x32x1_8x32x1_1x32x1x8_8_2x1_intrawave_v1,261.26,200.87,0.0
gfx942,80,992,4608,7168,asm,32,1,248.9262,_ZN5aiter42fp8gemm_bf16_blockscale_BpreShuffle_96x128E,263.26,197.98,0.0
gfx942,80,1024,4608,7168,asm,32,1,248.6755,_ZN5aiter42fp8gemm_bf16_blockscale_BpreShuffle_96x128E,272.02,200.29,0.0
gfx942,80,1088,4608,7168,ck,13,1,274.1862,a8w8_blockscale_bpreshuffle_1x128x128_256x64x256x128_16x16_16x16_8x32x1_8x32x1_1x32x1x8_8_2x1_intrawave_v1,262.13,185.48,0.0
gfx942,80,1152,4608,7168,asm,24,1,295.49,_ZN5aiter42fp8gemm_bf16_blockscale_BpreShuffle_80x128E,257.54,175.66,0.0
gfx942,80,1216,4608,7168,asm,32,1,298.0223,_ZN5aiter42fp8gemm_bf16_blockscale_BpreShuffle_96x128E,269.54,177.68,0.0
gfx942,80,1280,4608,7168,ck,14,3,306.3953,a8w8_blockscale_bpreshuffle_1x128x128_256x64x128x128_16x16_16x16_8x32x1_8x32x1_1x32x1x8_8_2x1_intrawave_v1,275.97,176.25,0.0
gfx942,80,1344,4608,7168,asm,40,1,320.2425,_ZN5aiter43fp8gemm_bf16_blockscale_BpreShuffle_128x128E,277.24,171.9,0.0
gfx942,80,1408,4608,7168,asm,40,1,321.7264,_ZN5aiter43fp8gemm_bf16_blockscale_BpreShuffle_128x128E,289.11,174.37,0.0
gfx942,80,1472,4608,7168,ck,14,0,369.7628,a8w8_blockscale_bpreshuffle_1x128x128_256x64x128x128_16x16_16x16_8x32x1_8x32x1_1x32x1x8_8_2x1_intrawave_v1,262.98,154.55,0.0
gfx942,80,1536,4608,7168,ck,14,1,370.9982,a8w8_blockscale_bpreshuffle_1x128x128_256x64x128x128_16x16_16x16_8x32x1_8x32x1_1x32x1x8_8_2x1_intrawave_v1,273.5,156.86,0.0
gfx942,80,1600,4608,7168,asm,24,1,382.6584,_ZN5aiter42fp8gemm_bf16_blockscale_BpreShuffle_80x128E,276.22,154.82,0.0
gfx942,80,1664,4608,7168,asm,40,1,384.1595,_ZN5aiter43fp8gemm_bf16_blockscale_BpreShuffle_128x128E,286.14,156.95,0.0
gfx942,80,1728,4608,7168,asm,24,1,422.292,_ZN5aiter42fp8gemm_bf16_blockscale_BpreShuffle_80x128E,270.32,145.26,0.0
gfx942,80,1792,4608,7168,ck,14,0,435.1458,a8w8_blockscale_bpreshuffle_1x128x128_256x64x128x128_16x16_16x16_8x32x1_8x32x1_1x32x1x8_8_2x1_intrawave_v1,272.05,143.38,0.0
gfx942,80,1856,4608,7168,asm,40,1,445.7352,_ZN5aiter43fp8gemm_bf16_blockscale_BpreShuffle_128x128E,275.07,142.32,0.0
gfx942,80,1920,4608,7168,asm,32,1,444.8469,_ZN5aiter42fp8gemm_bf16_blockscale_BpreShuffle_96x128E,285.12,144.97,0.0
gfx942,80,1984,4608,7168,ck,14,3,472.282,a8w8_blockscale_bpreshuffle_1x128x128_256x64x128x128_16x16_16x16_8x32x1_8x32x1_1x32x1x8_8_2x1_intrawave_v1,277.51,138.76,0.0
gfx942,80,2048,4608,7168,asm,32,1,493.6704,_ZN5aiter42fp8gemm_bf16_blockscale_BpreShuffle_96x128E,274.05,134.88,0.0
gfx942,80,4096,4608,7168,ck,14,0,951.778,a8w8_blockscale_bpreshuffle_1x128x128_256x64x128x128_16x16_16x16_8x32x1_8x32x1_1x32x1x8_8_2x1_intrawave_v1,284.29,105.21,0.0
gfx942,80,8192,4608,7168,asm,40,1,1855.4833,_ZN5aiter43fp8gemm_bf16_blockscale_BpreShuffle_128x128E,291.66,90.14,0.0
gfx942,80,16384,4608,7168,asm,40,1,3676.3795,_ZN5aiter43fp8gemm_bf16_blockscale_BpreShuffle_128x128E,294.4,82.0,0.0
gfx942,80,32768,4608,7168,asm,40,1,7356.9633,_ZN5aiter43fp8gemm_bf16_blockscale_BpreShuffle_128x128E,294.23,77.46,0.0
gfx942,80,1,7168,7168,ck,6,1,23.6395,a8w8_blockscale_bpreshuffle_1x128x128_256x16x128x256_16x16_16x16_16x16x1_16x16x1_1x16x1x16_8_1x2_intrawave_v1,4.35,2174.4,0.0
gfx942,80,2,7168,7168,ck,6,0,23.6491,a8w8_blockscale_bpreshuffle_1x128x128_256x16x128x256_16x16_16x16_16x16x1_16x16x1_1x16x1x16_8_1x2_intrawave_v1,8.69,2174.43,0.0
gfx942,80,4,7168,7168,ck,6,1,23.6263,a8w8_blockscale_bpreshuffle_1x128x128_256x16x128x256_16x16_16x16_16x16x1_16x16x1_1x16x1x16_8_1x2_intrawave_v1,17.4,2178.35,0.0
gfx942,80,8,7168,7168,ck,6,0,23.772,a8w8_blockscale_bpreshuffle_1x128x128_256x16x128x256_16x16_16x16_16x16x1_16x16x1_1x16x1x16_8_1x2_intrawave_v1,34.58,2168.61,0.0
gfx942,80,16,7168,7168,ck,6,2,23.7442,a8w8_blockscale_bpreshuffle_1x128x128_256x16x128x256_16x16_16x16_16x16x1_16x16x1_1x16x1x16_8_1x2_intrawave_v1,69.25,2178.4,0.0
gfx942,80,32,7168,7168,asm,0,1,30.8535,_ZN5aiter42fp8gemm_bf16_blockscale_BpreShuffle_32x128E,106.58,1687.6,0.0
gfx942,80,48,7168,7168,asm,8,1,33.0883,_ZN5aiter42fp8gemm_bf16_blockscale_BpreShuffle_48x128E,149.07,1584.02,0.0
gfx942,80,64,7168,7168,asm,16,1,39.3916,_ZN5aiter42fp8gemm_bf16_blockscale_BpreShuffle_64x128E,166.96,1339.28,0.0
gfx942,80,80,7168,7168,asm,24,1,45.4763,_ZN5aiter42fp8gemm_bf16_blockscale_BpreShuffle_80x128E,180.77,1167.65,0.0
gfx942,80,96,7168,7168,asm,32,1,52.233,_ZN5aiter42fp8gemm_bf16_blockscale_BpreShuffle_96x128E,188.87,1023.2,0.0
gfx942,80,112,7168,7168,asm,43,4,65.4304,_ZN5aiter43fp8gemm_bf16_blockscale_BpreShuffle_128x128E,175.9,822.07,0.0019
gfx942,80,128,7168,7168,asm,40,1,65.968,_ZN5aiter43fp8gemm_bf16_blockscale_BpreShuffle_128x128E,199.39,820.59,0.0
gfx942,80,144,7168,7168,asm,25,2,77.7472,_ZN5aiter42fp8gemm_bf16_blockscale_BpreShuffle_80x128E,190.33,700.69,0.0
gfx942,80,160,7168,7168,asm,25,2,78.0434,_ZN5aiter42fp8gemm_bf16_blockscale_BpreShuffle_80x128E,210.67,702.44,0.0
gfx942,80,176,7168,7168,asm,33,2,89.5246,_ZN5aiter42fp8gemm_bf16_blockscale_BpreShuffle_96x128E,202.02,616.2,0.0
gfx942,80,192,7168,7168,asm,33,2,89.943,_ZN5aiter42fp8gemm_bf16_blockscale_BpreShuffle_96x128E,219.36,617.16,0.0
gfx942,80,208,7168,7168,asm,16,1,107.8854,_ZN5aiter42fp8gemm_bf16_blockscale_BpreShuffle_64x128E,198.12,517.71,0.0
gfx942,80,224,7168,7168,asm,16,1,108.5348,_ZN5aiter42fp8gemm_bf16_blockscale_BpreShuffle_64x128E,212.08,517.78,0.0
gfx942,80,240,7168,7168,asm,16,1,108.5439,_ZN5aiter42fp8gemm_bf16_blockscale_BpreShuffle_64x128E,227.21,520.91,0.0
gfx942,80,256,7168,7168,asm,16,1,109.2241,_ZN5aiter42fp8gemm_bf16_blockscale_BpreShuffle_64x128E,240.85,520.81,0.0
gfx942,80,288,7168,7168,asm,24,1,128.4263,_ZN5aiter42fp8gemm_bf16_blockscale_BpreShuffle_80x128E,230.44,448.3,0.0
gfx942,80,320,7168,7168,asm,24,1,129.0346,_ZN5aiter42fp8gemm_bf16_blockscale_BpreShuffle_80x128E,254.84,451.52,0.0
gfx942,80,352,7168,7168,asm,32,1,149.8962,_ZN5aiter42fp8gemm_bf16_blockscale_BpreShuffle_96x128E,241.31,393.27,0.0
gfx942,80,384,7168,7168,asm,32,1,150.9894,_ZN5aiter42fp8gemm_bf16_blockscale_BpreShuffle_96x128E,261.34,394.98,0.0
gfx942,80,416,7168,7168,asm,16,1,177.6743,_ZN5aiter42fp8gemm_bf16_blockscale_BpreShuffle_64x128E,240.6,339.53,0.0
gfx942,80,448,7168,7168,ck,14,2,178.2073,a8w8_blockscale_bpreshuffle_1x128x128_256x64x128x128_16x16_16x16_8x32x1_8x32x1_1x32x1x8_8_2x1_intrawave_v1,258.33,342.38,0.0
gfx942,80,480,7168,7168,asm,40,1,193.7218,_ZN5aiter43fp8gemm_bf16_blockscale_BpreShuffle_128x128E,254.62,318.51,0.0
gfx942,80,512,7168,7168,asm,40,1,193.5094,_ZN5aiter43fp8gemm_bf16_blockscale_BpreShuffle_128x128E,271.89,322.41,0.0
gfx942,80,544,7168,7168,asm,24,1,213.3035,_ZN5aiter42fp8gemm_bf16_blockscale_BpreShuffle_80x128E,262.08,295.72,0.0
gfx942,80,576,7168,7168,ck,14,2,241.7168,a8w8_blockscale_bpreshuffle_1x128x128_256x64x128x128_16x16_16x16_8x32x1_8x32x1_1x32x1x8_8_2x1_intrawave_v1,244.87,263.81,0.0
gfx942,80,608,7168,7168,asm,32,1,248.6084,_ZN5aiter42fp8gemm_bf16_blockscale_BpreShuffle_96x128E,251.31,259.26,0.0
gfx942,80,640,7168,7168,ck,14,0,245.2711,a8w8_blockscale_bpreshuffle_1x128x128_256x64x128x128_16x16_16x16_8x32x1_8x32x1_1x32x1x8_8_2x1_intrawave_v1,268.14,265.6,0.0
gfx942,80,672,7168,7168,asm,32,1,249.7764,_ZN5aiter42fp8gemm_bf16_blockscale_BpreShuffle_96x128E,276.47,263.56,0.0
gfx942,80,704,7168,7168,ck,13,1,274.6188,a8w8_blockscale_bpreshuffle_1x128x128_256x64x256x128_16x16_16x16_8x32x1_8x32x1_1x32x1x8_8_2x1_intrawave_v1,263.43,242.22,0.0
gfx942,80,736,7168,7168,asm,32,1,297.0058,_ZN5aiter42fp8gemm_bf16_blockscale_BpreShuffle_96x128E,254.65,226.28,0.0
gfx942,80,768,7168,7168,asm,24,1,296.4665,_ZN5aiter42fp8gemm_bf16_blockscale_BpreShuffle_80x128E,266.2,229.02,0.0
gfx942,80,800,7168,7168,asm,24,1,297.9262,_ZN5aiter42fp8gemm_bf16_blockscale_BpreShuffle_80x128E,275.94,230.2,0.0
gfx942,80,832,7168,7168,asm,40,1,321.234,_ZN5aiter43fp8gemm_bf16_blockscale_BpreShuffle_128x128E,266.15,215.64,0.0
gfx942,80,864,7168,7168,asm,40,1,321.5634,_ZN5aiter43fp8gemm_bf16_blockscale_BpreShuffle_128x128E,276.1,217.56,0.0
gfx942,80,896,7168,7168,asm,40,1,320.216,_ZN5aiter43fp8gemm_bf16_blockscale_BpreShuffle_128x128E,287.54,220.63,0.0
gfx942,80,928,7168,7168,asm,32,1,346.7691,_ZN5aiter42fp8gemm_bf16_blockscale_BpreShuffle_96x128E,275.0,205.72,0.0
gfx942,80,960,7168,7168,asm,32,1,348.157,_ZN5aiter42fp8gemm_bf16_blockscale_BpreShuffle_96x128E,283.35,206.87,0.0
gfx942,80,992,7168,7168,asm,40,1,382.4742,_ZN5aiter43fp8gemm_bf16_blockscale_BpreShuffle_128x128E,266.52,190.11,0.0
gfx942,80,1024,7168,7168,asm,40,1,382.3258,_ZN5aiter43fp8gemm_bf16_blockscale_BpreShuffle_128x128E,275.23,191.98,0.0
gfx942,80,1088,7168,7168,ck,14,2,407.4043,a8w8_blockscale_bpreshuffle_1x128x128_256x64x128x128_16x16_16x16_8x32x1_8x32x1_1x32x1x8_8_2x1_intrawave_v1,274.43,183.54,0.0
gfx942,80,1152,7168,7168,ck,14,2,435.7381,a8w8_blockscale_bpreshuffle_1x128x128_256x64x128x128_16x16_16x16_8x32x1_8x32x1_1x32x1x8_8_2x1_intrawave_v1,271.68,174.77,0.0
gfx942,80,1216,7168,7168,asm,40,1,446.9481,_ZN5aiter43fp8gemm_bf16_blockscale_BpreShuffle_128x128E,279.58,173.46,0.0
gfx942,80,1280,7168,7168,asm,40,1,447.7131,_ZN5aiter43fp8gemm_bf16_blockscale_BpreShuffle_128x128E,293.79,176.24,0.0
gfx942,80,1344,7168,7168,asm,32,1,494.6614,_ZN5aiter42fp8gemm_bf16_blockscale_BpreShuffle_96x128E,279.2,162.3,0.0
gfx942,80,1408,7168,7168,asm,40,1,510.1749,_ZN5aiter43fp8gemm_bf16_blockscale_BpreShuffle_128x128E,283.6,160.06,0.0
gfx942,80,1472,7168,7168,ck,14,0,563.8113,a8w8_blockscale_bpreshuffle_1x128x128_256x64x128x128_16x16_16x16_8x32x1_8x32x1_1x32x1x8_8_2x1_intrawave_v1,268.29,147.27,0.0
gfx942,80,1536,7168,7168,ck,14,3,565.0521,a8w8_blockscale_bpreshuffle_1x128x128_256x64x128x128_16x16_16x16_8x32x1_8x32x1_1x32x1x8_8_2x1_intrawave_v1,279.34,149.39,0.0
gfx942,80,1600,7168,7168,asm,32,1,591.6153,_ZN5aiter42fp8gemm_bf16_blockscale_BpreShuffle_96x128E,277.91,145.0,0.0
gfx942,80,1664,7168,7168,ck,14,1,630.2392,a8w8_blockscale_bpreshuffle_1x128x128_256x64x128x128_16x16_16x16_8x32x1_8x32x1_1x32x1x8_8_2x1_intrawave_v1,271.32,138.3,0.0
gfx942,80,1728,7168,7168,ck,14,0,631.1466,a8w8_blockscale_bpreshuffle_1x128x128_256x64x128x128_16x16_16x16_8x32x1_8x32x1_1x32x1x8_8_2x1_intrawave_v1,281.35,140.28,0.0
gfx942,80,1792,7168,7168,asm,40,1,640.0152,_ZN5aiter43fp8gemm_bf16_blockscale_BpreShuffle_128x128E,287.72,140.49,0.0
gfx942,80,1856,7168,7168,asm,32,1,690.4563,_ZN5aiter42fp8gemm_bf16_blockscale_BpreShuffle_96x128E,276.23,132.22,0.0
gfx942,80,1920,7168,7168,asm,32,1,691.8261,_ZN5aiter42fp8gemm_bf16_blockscale_BpreShuffle_96x128E,285.19,133.95,0.0
gfx942,80,1984,7168,7168,ck,13,3,731.9962,a8w8_blockscale_bpreshuffle_1x128x128_256x64x256x128_16x16_16x16_8x32x1_8x32x1_1x32x1x8_8_2x1_intrawave_v1,278.52,128.48,0.0
gfx942,80,2048,7168,7168,ck,14,2,756.6679,a8w8_blockscale_bpreshuffle_1x128x128_256x64x128x128_16x16_16x16_8x32x1_8x32x1_1x32x1x8_8_2x1_intrawave_v1,278.13,126.11,0.0
gfx942,80,4096,7168,7168,asm,40,1,1458.1361,_ZN5aiter43fp8gemm_bf16_blockscale_BpreShuffle_128x128E,288.66,95.64,0.0
gfx942,80,6144,7168,7168,asm,40,1,2159.5251,_ZN5aiter43fp8gemm_bf16_blockscale_BpreShuffle_128x128E,292.36,84.97,0.0
gfx942,80,8120,7168,7168,asm,40,1,2871.579,_ZN5aiter43fp8gemm_bf16_blockscale_BpreShuffle_128x128E,290.58,78.7,0.0
gfx942,80,8192,7168,7168,asm,40,1,2858.2589,_ZN5aiter43fp8gemm_bf16_blockscale_BpreShuffle_128x128E,294.52,79.61,0.0
gfx942,80,10240,7168,7168,asm,40,1,3551.8819,_ZN5aiter43fp8gemm_bf16_blockscale_BpreShuffle_128x128E,296.26,76.46,0.0
gfx942,80,12288,7168,7168,asm,40,1,4305.5894,_ZN5aiter43fp8gemm_bf16_blockscale_BpreShuffle_128x128E,293.27,73.31,0.0
gfx942,80,14336,7168,7168,asm,40,1,5011.8657,_ZN5aiter43fp8gemm_bf16_blockscale_BpreShuffle_128x128E,293.94,71.76,0.0
gfx942,80,16384,7168,7168,asm,40,1,5705.2513,_ZN5aiter43fp8gemm_bf16_blockscale_BpreShuffle_128x128E,295.1,70.76,0.0
gfx942,80,32768,7168,7168,asm,40,1,11472.4167,_ZN5aiter43fp8gemm_bf16_blockscale_BpreShuffle_128x128E,293.51,65.9,0.0
gfx942,80,16,8192,7168,ck,7,2,24.2065,a8w8_blockscale_bpreshuffle_1x128x128_256x16x64x256_16x16_16x16_16x16x1_16x16x1_1x16x1x16_4_1x1_intrawave_v1,77.63,2441.37,0.0
gfx942,80,32,8192,7168,asm,0,1,31.3091,_ZN5aiter42fp8gemm_bf16_blockscale_BpreShuffle_32x128E,120.03,1899.57,0.0
gfx942,80,48,8192,7168,asm,8,1,33.4746,_ZN5aiter42fp8gemm_bf16_blockscale_BpreShuffle_48x128E,168.4,1787.95,0.0
gfx942,80,64,8192,7168,asm,16,1,39.6166,_ZN5aiter42fp8gemm_bf16_blockscale_BpreShuffle_64x128E,189.72,1520.26,0.0
gfx942,80,80,8192,7168,asm,24,1,45.3459,_ZN5aiter42fp8gemm_bf16_blockscale_BpreShuffle_80x128E,207.19,1336.49,0.0
gfx942,80,96,8192,7168,asm,32,1,52.4788,_ZN5aiter42fp8gemm_bf16_blockscale_BpreShuffle_96x128E,214.84,1162.02,0.0
gfx942,80,112,8192,7168,asm,40,1,66.4438,_ZN5aiter43fp8gemm_bf16_blockscale_BpreShuffle_128x128E,197.96,923.46,0.0
gfx942,80,128,8192,7168,asm,40,1,67.0671,_ZN5aiter43fp8gemm_bf16_blockscale_BpreShuffle_128x128E,224.14,920.49,0.0
gfx942,80,144,8192,7168,asm,24,1,85.6711,_ZN5aiter42fp8gemm_bf16_blockscale_BpreShuffle_80x128E,197.4,725.0,0.0
gfx942,80,160,8192,7168,ck,8,1,84.9215,a8w8_blockscale_bpreshuffle_1x128x128_256x32x256x128_16x16_16x16_8x32x1_8x32x1_1x32x1x8_8_2x1_intrawave_v1,221.27,735.84,0.0
gfx942,80,176,8192,7168,asm,32,1,100.3129,_ZN5aiter42fp8gemm_bf16_blockscale_BpreShuffle_96x128E,206.05,626.69,0.0
gfx942,80,192,8192,7168,asm,32,1,101.2238,_ZN5aiter42fp8gemm_bf16_blockscale_BpreShuffle_96x128E,222.76,624.78,0.0
gfx942,80,208,8192,7168,asm,8,1,117.6912,_ZN5aiter42fp8gemm_bf16_blockscale_BpreShuffle_48x128E,207.56,540.56,0.0
gfx942,80,224,8192,7168,asm,8,1,118.2004,_ZN5aiter42fp8gemm_bf16_blockscale_BpreShuffle_48x128E,222.56,541.42,0.0
gfx942,80,240,8192,7168,asm,8,1,119.0459,_ZN5aiter42fp8gemm_bf16_blockscale_BpreShuffle_48x128E,236.76,540.74,0.0
gfx942,80,256,8192,7168,asm,40,1,129.2256,_ZN5aiter43fp8gemm_bf16_blockscale_BpreShuffle_128x128E,232.65,501.06,0.0
gfx942,80,288,8192,7168,asm,16,1,143.8245,_ZN5aiter42fp8gemm_bf16_blockscale_BpreShuffle_64x128E,235.17,455.44,0.0
gfx942,80,320,8192,7168,ck,13,2,144.5456,a8w8_blockscale_bpreshuffle_1x128x128_256x64x256x128_16x16_16x16_8x32x1_8x32x1_1x32x1x8_8_2x1_intrawave_v1,259.99,458.38,0.0
gfx942,80,352,8192,7168,asm,24,1,170.7153,_ZN5aiter42fp8gemm_bf16_blockscale_BpreShuffle_80x128E,242.15,392.53,0.0
gfx942,80,384,8192,7168,asm,24,1,171.3207,_ZN5aiter42fp8gemm_bf16_blockscale_BpreShuffle_80x128E,263.23,395.54,0.0
gfx942,80,416,8192,7168,asm,32,1,199.349,_ZN5aiter42fp8gemm_bf16_blockscale_BpreShuffle_96x128E,245.07,343.71,0.0
gfx942,80,448,8192,7168,asm,32,1,200.2177,_ZN5aiter42fp8gemm_bf16_blockscale_BpreShuffle_96x128E,262.78,345.98,0.0
gfx942,80,480,8192,7168,asm,32,1,201.3145,_ZN5aiter42fp8gemm_bf16_blockscale_BpreShuffle_96x128E,280.02,347.84,0.0
gfx942,80,512,8192,7168,ck,14,2,241.041,a8w8_blockscale_bpreshuffle_1x128x128_256x64x128x128_16x16_16x16_8x32x1_8x32x1_1x32x1x8_8_2x1_intrawave_v1,249.46,293.64,0.0
gfx942,80,544,8192,7168,asm,32,1,248.299,_ZN5aiter42fp8gemm_bf16_blockscale_BpreShuffle_96x128E,257.3,288.09,0.0
gfx942,80,576,8192,7168,asm,32,1,249.1733,_ZN5aiter42fp8gemm_bf16_blockscale_BpreShuffle_96x128E,271.48,290.1,0.0
gfx942,80,608,8192,7168,asm,40,1,256.797,_ZN5aiter43fp8gemm_bf16_blockscale_BpreShuffle_128x128E,278.06,284.43,0.0
gfx942,80,640,8192,7168,asm,40,1,257.5838,_ZN5aiter43fp8gemm_bf16_blockscale_BpreShuffle_128x128E,291.8,286.48,0.0
gfx942,80,672,8192,7168,asm,32,1,297.5951,_ZN5aiter42fp8gemm_bf16_blockscale_BpreShuffle_96x128E,265.19,250.5,0.0
gfx942,80,704,8192,7168,ck,14,3,309.2871,a8w8_blockscale_bpreshuffle_1x128x128_256x64x128x128_16x16_16x16_8x32x1_8x32x1_1x32x1x8_8_2x1_intrawave_v1,267.32,243.47,0.0
gfx942,80,736,8192,7168,asm,40,1,318.5767,_ZN5aiter43fp8gemm_bf16_blockscale_BpreShuffle_128x128E,271.32,238.73,0.0
gfx942,80,768,8192,7168,asm,40,1,319.9181,_ZN5aiter43fp8gemm_bf16_blockscale_BpreShuffle_128x128E,281.93,240.09,0.0
gfx942,80,800,8192,7168,asm,24,1,339.0643,_ZN5aiter42fp8gemm_bf16_blockscale_BpreShuffle_80x128E,277.09,228.75,0.0
gfx942,80,832,8192,7168,ck,14,0,371.899,a8w8_blockscale_bpreshuffle_1x128x128_256x64x128x128_16x16_16x16_8x32x1_8x32x1_1x32x1x8_8_2x1_intrawave_v1,262.73,210.58,0.0
gfx942,80,864,8192,7168,asm,24,1,380.2466,_ZN5aiter42fp8gemm_bf16_blockscale_BpreShuffle_80x128E,266.85,207.94,0.0
gfx942,80,896,8192,7168,asm,40,1,382.2342,_ZN5aiter43fp8gemm_bf16_blockscale_BpreShuffle_128x128E,275.29,208.83,0.0
gfx942,80,928,8192,7168,asm,32,1,395.8668,_ZN5aiter42fp8gemm_bf16_blockscale_BpreShuffle_96x128E,275.31,203.54,0.0
gfx942,80,960,8192,7168,asm,32,1,398.4166,_ZN5aiter42fp8gemm_bf16_blockscale_BpreShuffle_96x128E,282.98,204.13,0.0
gfx942,80,992,8192,7168,asm,32,1,443.0065,_ZN5aiter42fp8gemm_bf16_blockscale_BpreShuffle_96x128E,262.98,185.29,0.0
gfx942,80,1024,8192,7168,ck,14,1,435.471,a8w8_blockscale_bpreshuffle_1x128x128_256x64x128x128_16x16_16x16_8x32x1_8x32x1_1x32x1x8_8_2x1_intrawave_v1,276.16,190.23,0.0
gfx942,80,1088,8192,7168,ck,13,1,471.9436,a8w8_blockscale_bpreshuffle_1x128x128_256x64x256x128_16x16_16x16_8x32x1_8x32x1_1x32x1x8_8_2x1_intrawave_v1,270.74,178.72,0.0
gfx942,80,1152,8192,7168,asm,32,1,492.9177,_ZN5aiter42fp8gemm_bf16_blockscale_BpreShuffle_96x128E,274.47,174.17,0.0
gfx942,80,1216,8192,7168,asm,40,1,510.309,_ZN5aiter43fp8gemm_bf16_blockscale_BpreShuffle_128x128E,279.85,171.19,0.0
gfx942,80,1280,8192,7168,asm,40,1,511.1203,_ZN5aiter43fp8gemm_bf16_blockscale_BpreShuffle_128x128E,294.11,173.87,0.0
gfx942,80,1344,8192,7168,ck,14,0,567.7539,a8w8_blockscale_bpreshuffle_1x128x128_256x64x128x128_16x16_16x16_8x32x1_8x32x1_1x32x1x8_8_2x1_intrawave_v1,278.01,159.18,0.0
gfx942,80,1408,8192,7168,asm,40,1,572.9243,_ZN5aiter43fp8gemm_bf16_blockscale_BpreShuffle_128x128E,288.62,160.37,0.0
gfx942,80,1472,8192,7168,ck,14,0,629.8821,a8w8_blockscale_bpreshuffle_1x128x128_256x64x128x128_16x16_16x16_8x32x1_8x32x1_1x32x1x8_8_2x1_intrawave_v1,274.45,148.26,0.0
gfx942,80,1536,8192,7168,asm,40,1,639.584,_ZN5aiter43fp8gemm_bf16_blockscale_BpreShuffle_128x128E,282.04,148.37,0.0
gfx942,80,1600,8192,7168,ck,13,0,663.1966,a8w8_blockscale_bpreshuffle_1x128x128_256x64x256x128_16x16_16x16_8x32x1_8x32x1_1x32x1x8_8_2x1_intrawave_v1,283.33,145.36,0.0
gfx942,80,1664,8192,7168,ck,14,0,697.2274,a8w8_blockscale_bpreshuffle_1x128x128_256x64x128x128_16x16_16x16_8x32x1_8x32x1_1x32x1x8_8_2x1_intrawave_v1,280.28,140.43,0.0
gfx942,80,1728,8192,7168,ck,14,1,727.7777,a8w8_blockscale_bpreshuffle_1x128x128_256x64x128x128_16x16_16x16_8x32x1_8x32x1_1x32x1x8_8_2x1_intrawave_v1,278.85,136.61,0.0
gfx942,80,1792,8192,7168,ck,14,0,759.8229,a8w8_blockscale_bpreshuffle_1x128x128_256x64x128x128_16x16_16x16_8x32x1_8x32x1_1x32x1x8_8_2x1_intrawave_v1,276.98,132.83,0.0
gfx942,80,1856,8192,7168,asm,40,1,762.465,_ZN5aiter43fp8gemm_bf16_blockscale_BpreShuffle_128x128E,285.87,134.34,0.0
gfx942,80,1920,8192,7168,asm,40,1,763.1153,_ZN5aiter43fp8gemm_bf16_blockscale_BpreShuffle_128x128E,295.48,136.2,0.0
gfx942,80,1984,8192,7168,asm,40,1,828.9178,_ZN5aiter43fp8gemm_bf16_blockscale_BpreShuffle_128x128E,281.09,127.21,0.0
gfx942,80,2048,8192,7168,asm,40,1,831.5607,_ZN5aiter43fp8gemm_bf16_blockscale_BpreShuffle_128x128E,289.24,128.62,0.0
gfx942,80,4096,8192,7168,asm,40,1,1655.8207,_ZN5aiter43fp8gemm_bf16_blockscale_BpreShuffle_128x128E,290.51,93.72,0.0
gfx942,80,8192,8192,7168,asm,40,1,3315.7833,_ZN5aiter43fp8gemm_bf16_blockscale_BpreShuffle_128x128E,290.15,75.9,0.0
gfx942,80,16384,8192,7168,asm,40,1,6533.0311,_ZN5aiter43fp8gemm_bf16_blockscale_BpreShuffle_128x128E,294.53,68.05,0.0
gfx942,80,32768,8192,7168,asm,40,1,13047.6508,_ZN5aiter43fp8gemm_bf16_blockscale_BpreShuffle_128x128E,294.94,63.65,0.0
gfx942,80,16,11264,7168,ck,7,2,36.5817,a8w8_blockscale_bpreshuffle_1x128x128_256x16x64x256_16x16_16x16_16x16x1_16x16x1_1x16x1x16_4_1x1_intrawave_v1,70.63,2220.11,0.0
gfx942,80,32,11264,7168,ck,10,3,45.2588,a8w8_blockscale_bpreshuffle_1x128x128_256x32x64x128_16x16_16x16_8x32x1_8x32x1_1x32x1x8_8_2x1_intrawave_v1,114.17,1804.97,0.0
gfx942,80,48,11264,7168,asm,10,3,53.3292,_ZN5aiter42fp8gemm_bf16_blockscale_BpreShuffle_48x128E,145.34,1540.73,0.0004
gfx942,80,64,11264,7168,asm,17,2,64.4544,_ZN5aiter42fp8gemm_bf16_blockscale_BpreShuffle_64x128E,160.34,1282.16,0.0
gfx942,80,80,11264,7168,asm,26,3,76.466,_ZN5aiter42fp8gemm_bf16_blockscale_BpreShuffle_80x128E,168.94,1086.97,0.0003
gfx942,80,96,11264,7168,ck,8,2,85.2489,a8w8_blockscale_bpreshuffle_1x128x128_256x32x256x128_16x16_16x16_8x32x1_8x32x1_1x32x1x8_8_2x1_intrawave_v1,181.85,980.55,0.0
gfx942,80,112,11264,7168,asm,17,2,105.4022,_ZN5aiter42fp8gemm_bf16_blockscale_BpreShuffle_64x128E,171.59,797.58,0.0
gfx942,80,128,11264,7168,asm,17,2,107.3202,_ZN5aiter42fp8gemm_bf16_blockscale_BpreShuffle_64x128E,192.6,787.75,0.0
gfx942,80,144,11264,7168,asm,9,2,121.3708,_ZN5aiter42fp8gemm_bf16_blockscale_BpreShuffle_48x128E,191.59,700.47,0.0
gfx942,80,160,11264,7168,asm,25,2,124.9313,_ZN5aiter42fp8gemm_bf16_blockscale_BpreShuffle_80x128E,206.81,684.31,0.0
gfx942,80,176,11264,7168,asm,16,1,143.1091,_ZN5aiter42fp8gemm_bf16_blockscale_BpreShuffle_64x128E,198.59,600.71,0.0
gfx942,80,192,11264,7168,ck,13,2,143.6915,a8w8_blockscale_bpreshuffle_1x128x128_256x64x256x128_16x16_16x16_8x32x1_8x32x1_1x32x1x8_8_2x1_intrawave_v1,215.77,601.58,0.0
gfx942,80,208,11264,7168,ck,8,1,165.7113,a8w8_blockscale_bpreshuffle_1x128x128_256x32x256x128_16x16_16x16_8x32x1_8x32x1_1x32x1x8_8_2x1_intrawave_v1,202.69,524.51,0.0
gfx942,80,224,11264,7168,ck,8,0,161.8971,a8w8_blockscale_bpreshuffle_1x128x128_256x32x256x128_16x16_16x16_8x32x1_8x32x1_1x32x1x8_8_2x1_intrawave_v1,223.42,539.8,0.0
gfx942,80,240,11264,7168,asm,24,1,170.7373,_ZN5aiter42fp8gemm_bf16_blockscale_BpreShuffle_80x128E,226.99,514.64,0.0
gfx942,80,256,11264,7168,ck,14,0,177.3668,a8w8_blockscale_bpreshuffle_1x128x128_256x64x128x128_16x16_16x16_8x32x1_8x32x1_1x32x1x8_8_2x1_intrawave_v1,233.07,498.08,0.0
gfx942,80,288,11264,7168,asm,33,2,198.9007,_ZN5aiter42fp8gemm_bf16_blockscale_BpreShuffle_96x128E,233.82,448.93,0.0
gfx942,80,320,11264,7168,ck,14,1,211.5644,a8w8_blockscale_bpreshuffle_1x128x128_256x64x128x128_16x16_16x16_8x32x1_8x32x1_1x32x1x8_8_2x1_intrawave_v1,244.25,426.55,0.0
gfx942,80,352,11264,7168,asm,32,1,247.6447,_ZN5aiter42fp8gemm_bf16_blockscale_BpreShuffle_96x128E,229.53,368.24,0.0
gfx942,80,384,11264,7168,ck,14,3,243.994,a8w8_blockscale_bpreshuffle_1x128x128_256x64x128x128_16x16_16x16_8x32x1_8x32x1_1x32x1x8_8_2x1_intrawave_v1,254.14,377.65,0.0
gfx942,80,416,11264,7168,ck,14,2,284.365,a8w8_blockscale_bpreshuffle_1x128x128_256x64x128x128_16x16_16x16_8x32x1_8x32x1_1x32x1x8_8_2x1_intrawave_v1,236.23,327.37,0.0
gfx942,80,448,11264,7168,ck,14,0,276.8844,a8w8_blockscale_bpreshuffle_1x128x128_256x64x128x128_16x16_16x16_8x32x1_8x32x1_1x32x1x8_8_2x1_intrawave_v1,261.28,339.65,0.0
gfx942,80,480,11264,7168,asm,24,1,298.6939,_ZN5aiter42fp8gemm_bf16_blockscale_BpreShuffle_80x128E,259.5,318.03,0.0
gfx942,80,512,11264,7168,ck,14,1,308.1192,a8w8_blockscale_bpreshuffle_1x128x128_256x64x128x128_16x16_16x16_8x32x1_8x32x1_1x32x1x8_8_2x1_intrawave_v1,268.33,311.39,0.0
gfx942,80,544,11264,7168,asm,24,1,340.538,_ZN5aiter42fp8gemm_bf16_blockscale_BpreShuffle_80x128E,257.96,284.53,0.0
gfx942,80,576,11264,7168,ck,14,2,342.5868,a8w8_blockscale_bpreshuffle_1x128x128_256x64x128x128_16x16_16x16_8x32x1_8x32x1_1x32x1x8_8_2x1_intrawave_v1,271.5,285.61,0.0
gfx942,80,608,11264,7168,asm,24,1,381.5139,_ZN5aiter42fp8gemm_bf16_blockscale_BpreShuffle_80x128E,257.34,258.96,0.0
gfx942,80,640,11264,7168,ck,14,3,376.9284,a8w8_blockscale_bpreshuffle_1x128x128_256x64x128x128_16x16_16x16_8x32x1_8x32x1_1x32x1x8_8_2x1_intrawave_v1,274.18,264.63,0.0
gfx942,80,672,11264,7168,asm,32,1,398.956,_ZN5aiter42fp8gemm_bf16_blockscale_BpreShuffle_96x128E,272.0,252.4,0.0
gfx942,80,704,11264,7168,asm,24,1,426.5683,_ZN5aiter42fp8gemm_bf16_blockscale_BpreShuffle_80x128E,266.5,238.29,0.0
gfx942,80,736,11264,7168,asm,32,1,446.8656,_ZN5aiter42fp8gemm_bf16_blockscale_BpreShuffle_96x128E,265.96,229.59,0.0
gfx942,80,768,11264,7168,asm,32,1,448.8617,_ZN5aiter42fp8gemm_bf16_blockscale_BpreShuffle_96x128E,276.29,230.69,0.0
gfx942,80,800,11264,7168,asm,24,1,468.1587,_ZN5aiter42fp8gemm_bf16_blockscale_BpreShuffle_80x128E,275.94,223.21,0.0
gfx942,80,832,11264,7168,asm,32,1,497.0687,_ZN5aiter42fp8gemm_bf16_blockscale_BpreShuffle_96x128E,270.29,212.14,0.0
gfx942,80,864,11264,7168,asm,32,1,497.777,_ZN5aiter42fp8gemm_bf16_blockscale_BpreShuffle_96x128E,280.28,213.75,0.0
gfx942,80,896,11264,7168,asm,40,1,512.9022,_ZN5aiter43fp8gemm_bf16_blockscale_BpreShuffle_128x128E,282.09,209.3,0.0
gfx942,80,928,11264,7168,asm,32,1,544.6763,_ZN5aiter42fp8gemm_bf16_blockscale_BpreShuffle_96x128E,275.13,198.83,0.0
gfx942,80,960,11264,7168,asm,32,1,548.2095,_ZN5aiter42fp8gemm_bf16_blockscale_BpreShuffle_96x128E,282.78,199.28,0.0
gfx942,80,992,11264,7168,asm,40,1,575.1715,_ZN5aiter43fp8gemm_bf16_blockscale_BpreShuffle_128x128E,278.51,191.59,0.0
gfx942,80,1024,11264,7168,asm,40,1,578.1058,_ZN5aiter43fp8gemm_bf16_blockscale_BpreShuffle_128x128E,286.03,192.26,0.0
gfx942,80,1088,11264,7168,ck,14,0,637.3914,a8w8_blockscale_bpreshuffle_1x128x128_256x64x128x128_16x16_16x16_8x32x1_8x32x1_1x32x1x8_8_2x1_intrawave_v1,275.64,177.36,0.0
gfx942,80,1152,11264,7168,asm,40,1,641.0348,_ZN5aiter43fp8gemm_bf16_blockscale_BpreShuffle_128x128E,290.2,179.32,0.0
gfx942,80,1216,11264,7168,ck,14,2,695.9631,a8w8_blockscale_bpreshuffle_1x128x128_256x64x128x128_16x16_16x16_8x32x1_8x32x1_1x32x1x8_8_2x1_intrawave_v1,282.14,167.9,0.0
gfx942,80,1280,11264,7168,asm,40,1,705.6929,_ZN5aiter43fp8gemm_bf16_blockscale_BpreShuffle_128x128E,292.9,168.28,0.0
gfx942,80,1344,11264,7168,asm,32,1,789.0994,_ZN5aiter42fp8gemm_bf16_blockscale_BpreShuffle_96x128E,275.04,152.9,0.0
gfx942,80,1408,11264,7168,ck,14,2,826.4833,a8w8_blockscale_bpreshuffle_1x128x128_256x64x128x128_16x16_16x16_8x32x1_8x32x1_1x32x1x8_8_2x1_intrawave_v1,275.1,148.28,0.0
gfx942,80,1472,11264,7168,ck,14,2,857.699,a8w8_blockscale_bpreshuffle_1x128x128_256x64x128x128_16x16_16x16_8x32x1_8x32x1_1x32x1x8_8_2x1_intrawave_v1,277.14,145.1,0.0
gfx942,80,1536,11264,7168,ck,14,3,888.838,a8w8_blockscale_bpreshuffle_1x128x128_256x64x128x128_16x16_16x16_8x32x1_8x32x1_1x32x1x8_8_2x1_intrawave_v1,279.05,142.16,0.0
gfx942,80,1600,11264,7168,ck,14,1,922.651,a8w8_blockscale_bpreshuffle_1x128x128_256x64x128x128_16x16_16x16_8x32x1_8x32x1_1x32x1x8_8_2x1_intrawave_v1,280.03,139.01,0.0
gfx942,80,1664,11264,7168,asm,40,1,952.6571,_ZN5aiter43fp8gemm_bf16_blockscale_BpreShuffle_128x128E,282.06,136.62,0.0
gfx942,80,1728,11264,7168,ck,14,0,987.7767,a8w8_blockscale_bpreshuffle_1x128x128_256x64x128x128_16x16_16x16_8x32x1_8x32x1_1x32x1x8_8_2x1_intrawave_v1,282.49,133.69,0.0
gfx942,80,1792,11264,7168,asm,40,1,1016.7702,_ZN5aiter43fp8gemm_bf16_blockscale_BpreShuffle_128x128E,284.6,131.75,0.0
gfx942,80,1856,11264,7168,ck,14,1,1055.8714,a8w8_blockscale_bpreshuffle_1x128x128_256x64x128x128_16x16_16x16_8x32x1_8x32x1_1x32x1x8_8_2x1_intrawave_v1,283.85,128.67,0.0
gfx942,80,1920,11264,7168,asm,40,1,1080.5188,_ZN5aiter43fp8gemm_bf16_blockscale_BpreShuffle_128x128E,286.94,127.49,0.0
gfx942,80,1984,11264,7168,asm,40,1,1148.3802,_ZN5aiter43fp8gemm_bf16_blockscale_BpreShuffle_128x128E,278.98,121.61,0.0
gfx942,80,2048,11264,7168,asm,40,1,1143.3801,_ZN5aiter43fp8gemm_bf16_blockscale_BpreShuffle_128x128E,289.24,123.81,0.0
gfx942,80,4096,11264,7168,asm,40,1,2286.2033,_ZN5aiter43fp8gemm_bf16_blockscale_BpreShuffle_128x128E,289.31,88.52,0.0
gfx942,80,8192,11264,7168,asm,40,1,4510.3929,_ZN5aiter43fp8gemm_bf16_blockscale_BpreShuffle_128x128E,293.29,71.84,0.0
gfx942,80,16384,11264,7168,asm,40,1,8997.119,_ZN5aiter43fp8gemm_bf16_blockscale_BpreShuffle_128x128E,294.06,63.05,0.0
gfx942,80,32768,11264,7168,asm,40,1,17903.6992,_ZN5aiter43fp8gemm_bf16_blockscale_BpreShuffle_128x128E,295.55,58.86,0.0
gfx942,80,1,36864,7168,ck,3,3,80.2402,a8w8_blockscale_bpreshuffle_1x128x128_256x16x256x128_8x16_16x16_16x16x1_8x32x1_1x16x1x16_8_1x2_intrawave_v1,6.59,3294.13,0.0
gfx942,80,2,36864,7168,ck,3,3,80.6014,a8w8_blockscale_bpreshuffle_1x128x128_256x16x256x128_8x16_16x16_16x16x1_8x32x1_1x16x1x16_8_1x2_intrawave_v1,13.11,3280.38,0.0
gfx942,80,4,36864,7168,ck,3,2,80.9864,a8w8_blockscale_bpreshuffle_1x128x128_256x16x256x128_8x16_16x16_16x16x1_8x32x1_1x16x1x16_8_1x2_intrawave_v1,26.1,3266.78,0.0
gfx942,80,8,36864,7168,ck,3,2,82.1174,a8w8_blockscale_bpreshuffle_1x128x128_256x16x256x128_8x16_16x16_16x16x1_8x32x1_1x16x1x16_8_1x2_intrawave_v1,51.49,3225.73,0.0
gfx942,80,16,36864,7168,ck,3,0,86.0665,a8w8_blockscale_bpreshuffle_1x128x128_256x16x256x128_8x16_16x16_16x16x1_8x32x1_1x16x1x16_8_1x2_intrawave_v1,98.25,3085.24,0.0
gfx942,80,32,36864,7168,ck,8,2,100.6318,a8w8_blockscale_bpreshuffle_1x128x128_256x32x256x128_16x16_16x16_8x32x1_8x32x1_1x32x1x8_8_2x1_intrawave_v1,168.05,2651.55,0.0
gfx942,80,64,36864,7168,asm,16,1,151.3015,_ZN5aiter42fp8gemm_bf16_blockscale_BpreShuffle_64x128E,223.55,1780.67,0.0
gfx942,80,128,36864,7168,asm,40,1,258.7545,_ZN5aiter43fp8gemm_bf16_blockscale_BpreShuffle_128x128E,261.43,1061.22,0.0
gfx942,80,256,36864,7168,ck,14,1,509.2441,a8w8_blockscale_bpreshuffle_1x128x128_256x64x128x128_16x16_16x16_8x32x1_8x32x1_1x32x1x8_8_2x1_intrawave_v1,265.67,559.56,0.0
gfx942,80,512,36864,7168,asm,40,1,955.6557,_ZN5aiter43fp8gemm_bf16_blockscale_BpreShuffle_128x128E,283.14,319.84,0.0
gfx942,80,1024,36864,7168,asm,40,1,1847.0023,_ZN5aiter43fp8gemm_bf16_blockscale_BpreShuffle_128x128E,293.0,187.91,0.0
gfx942,80,2048,36864,7168,asm,40,1,3690.7146,_ZN5aiter43fp8gemm_bf16_blockscale_BpreShuffle_128x128E,293.26,116.49,0.0
gfx942,80,4096,36864,7168,asm,40,1,7390.514,_ZN5aiter43fp8gemm_bf16_blockscale_BpreShuffle_128x128E,292.9,80.59,0.0
gfx942,80,6144,36864,7168,asm,40,1,10983.185,_ZN5aiter43fp8gemm_bf16_blockscale_BpreShuffle_128x128E,295.63,69.31,0.0
gfx942,80,8120,36864,7168,asm,40,1,14679.9317,_ZN5aiter43fp8gemm_bf16_blockscale_BpreShuffle_128x128E,292.32,62.75,0.0
gfx942,80,10240,36864,7168,asm,40,1,18403.5602,_ZN5aiter43fp8gemm_bf16_blockscale_BpreShuffle_128x128E,294.05,59.37,0.0
gfx942,80,12288,36864,7168,asm,40,1,22128.6447,_ZN5aiter43fp8gemm_bf16_blockscale_BpreShuffle_128x128E,293.47,56.86,0.0
gfx942,80,14336,36864,7168,asm,40,1,25659.6676,_ZN5aiter43fp8gemm_bf16_blockscale_BpreShuffle_128x128E,295.26,55.49,0.0
gfx942,80,16384,36864,7168,asm,40,1,29295.594,_ZN5aiter43fp8gemm_bf16_blockscale_BpreShuffle_128x128E,295.56,54.26,0.0
