aiter/configs/model_configs/a8w8_blockscale_tuned_fmoe_qwen3_235b.csv
cu_num,token,model_dim,inter_dim,expert,topk,act_type,dtype,q_dtype_a,q_dtype_w,q_type,use_g1u1,doweight_stage1,block_m,ksplit,us1,kernelName1,err1,us2,kernelName2,err2,us,run_1stage,tflops,bw,_tag
256,1,4096,1536,16,8,ActivationType.Silu,torch.bfloat16,torch.float8_e4m3fn,torch.float8_e4m3fn,QuantType.per_1x128,1,0,16,0,44.4733,_ZN5aiter47fmoe_bf16_blockscaleFp8_g1u1_vs_pf2_silu_16x128E,0.0%,0.0,,0.0%,44.4733,1,6.79,6790.64,
256,2,4096,1536,16,8,ActivationType.Silu,torch.bfloat16,torch.float8_e4m3fn,torch.float8_e4m3fn,QuantType.per_1x128,1,0,16,0,49.078,_ZN5aiter47fmoe_bf16_blockscaleFp8_g1u1_vs_pf2_silu_16x128E,0.0%,0.0,,0.0%,49.078,1,12.31,6153.76,
256,4,4096,1536,16,8,ActivationType.Silu,torch.bfloat16,torch.float8_e4m3fn,torch.float8_e4m3fn,QuantType.per_1x128,1,0,16,0,56.6031,_ZN5aiter47fmoe_bf16_blockscaleFp8_g1u1_vs_pf2_silu_16x128E,0.0%,0.0,,0.0%,56.6031,1,21.34,5336.09,
256,8,4096,1536,16,8,ActivationType.Silu,torch.bfloat16,torch.float8_e4m3fn,torch.float8_e4m3fn,QuantType.per_1x128,1,0,16,0,65.7221,_ZN5aiter47fmoe_bf16_blockscaleFp8_g1u1_vs_pf2_silu_16x128E,0.0%,0.0,,0.0%,65.7221,1,36.76,4596.45,
256,16,4096,1536,16,8,ActivationType.Silu,torch.bfloat16,torch.float8_e4m3fn,torch.float8_e4m3fn,QuantType.per_1x128,1,0,32,0,47.4816,moe_ck2stages_gemm1_256x32x128x128_1x4_MulABScaleExpertWeightA8W8blkscale_v1_Nswizzle0_Quant4_MulRoutedWeight0_silu_F8_F8_B16,0.1%,25.0412,moe_ck2stages_gemm2_256x32x128x128_1x4_MulABScaleExpertWeightA8W8blkscale_v1_Nswizzle0_Quant4_MulRoutedWeight1_F8_F8_B16,14.1%,72.5228,0,66.63,4166.78,
256,32,4096,1536,16,8,ActivationType.Silu,torch.bfloat16,torch.float8_e4m3fn,torch.float8_e4m3fn,QuantType.per_1x128,1,0,32,0,48.5349,moe_ck2stages_gemm1_256x32x128x128_1x4_MulABScaleExpertWeightA8W8blkscale_v1_Nswizzle0_Quant4_MulRoutedWeight0_silu_F8_F8_B16,0.1%,25.8063,moe_ck2stages_gemm2_256x32x128x128_1x4_MulABScaleExpertWeightA8W8blkscale_v1_Nswizzle0_Quant4_MulRoutedWeight1_F8_F8_B16,14.4%,74.3412,0,129.99,4067.5,
256,64,4096,1536,16,8,ActivationType.Silu,torch.bfloat16,torch.float8_e4m3fn,torch.float8_e4m3fn,QuantType.per_1x128,1,0,32,0,61.2206,moe_ck2stages_gemm1_256x32x128x128_1x4_MulABScaleExpertWeightA8W8blkscale_v1_Nswizzle0_Quant4_MulRoutedWeight0_silu_F8_F8_B16,0.1%,29.5277,moe_ck2stages_gemm2_256x32x128x128_1x4_MulABScaleExpertWeightA8W8blkscale_v1_Nswizzle0_Quant4_MulRoutedWeight1_F8_F8_B16,14.4%,90.7483,0,212.98,3336.44,
256,128,4096,1536,16,8,ActivationType.Silu,torch.bfloat16,torch.float8_e4m3fn,torch.float8_e4m3fn,QuantType.per_1x128,1,0,32,0,67.5755,moe_ck2stages_gemm1_256x32x128x128_1x4_MulABScaleExpertWeightA8W8blkscale_v1_Nswizzle0_Quant4_MulRoutedWeight0_silu_F8_F8_B16,0.1%,40.3167,moe_ck2stages_gemm2_256x32x128x128_1x4_MulABScaleExpertWeightA8W8blkscale_v1_Nswizzle0_Quant4_MulRoutedWeight1_F8_F8_B16,14.4%,107.8922,0,358.27,2813.57,
256,256,4096,1536,16,8,ActivationType.Silu,torch.bfloat16,torch.float8_e4m3fn,torch.float8_e4m3fn,QuantType.per_1x128,1,0,64,0,142.1512,_ZN5aiter46fmoe_bf16_blockscaleFp8_g1u1_vs_ps_silu_64x256E,9.6%,0.0,,0.0%,142.1512,1,543.85,2146.56,
256,512,4096,1536,16,8,ActivationType.Silu,torch.bfloat16,torch.float8_e4m3fn,torch.float8_e4m3fn,QuantType.per_1x128,1,0,32,0,152.7835,moe_ck2stages_gemm1_256x32x128x128_1x4_MulABScaleExpertWeightA8W8blkscale_v1_Nswizzle0_Quant4_MulRoutedWeight0_silu_F8_F8_B16,0.1%,96.2901,moe_ck2stages_gemm2_256x32x128x128_1x4_MulABScaleExpertWeightA8W8blkscale_v1_Nswizzle0_Quant4_MulRoutedWeight1_F8_F8_B16,14.5%,249.0736,0,620.78,1237.71,
256,1024,4096,1536,16,8,ActivationType.Silu,torch.bfloat16,torch.float8_e4m3fn,torch.float8_e4m3fn,QuantType.per_1x128,1,0,32,0,258.0873,moe_ck2stages_gemm1_256x32x128x128_1x4_MulABScaleExpertWeightA8W8blkscale_v1_Nswizzle0_Quant4_MulRoutedWeight0_silu_F8_F8_B16,0.1%,169.0166,moe_ck2stages_gemm2_256x32x128x128_1x4_MulABScaleExpertWeightA8W8blkscale_v1_Nswizzle0_Quant4_MulRoutedWeight1_F8_F8_B16,14.6%,427.1039,0,724.03,736.53,
256,2048,4096,1536,16,8,ActivationType.Silu,torch.bfloat16,torch.float8_e4m3fn,torch.float8_e4m3fn,QuantType.per_1x128,1,0,32,0,468.703,moe_ck2stages_gemm1_256x32x128x128_1x4_MulABScaleExpertWeightA8W8blkscale_v1_Nswizzle0_Quant4_MulRoutedWeight0_silu_F8_F8_B16,0.1%,308.263,moe_ck2stages_gemm2_256x32x128x128_1x4_MulABScaleExpertWeightA8W8blkscale_v1_Nswizzle0_Quant4_MulRoutedWeight1_F8_F8_B16,14.4%,776.966,0,796.01,421.07,
256,4096,4096,1536,16,8,ActivationType.Silu,torch.bfloat16,torch.float8_e4m3fn,torch.float8_e4m3fn,QuantType.per_1x128,1,0,32,0,891.308,moe_ck2stages_gemm1_256x32x128x128_1x4_MulABScaleExpertWeightA8W8blkscale_v1_Nswizzle0_Quant4_MulRoutedWeight0_silu_F8_F8_B16,0.1%,579.9584,moe_ck2stages_gemm2_256x32x128x128_1x4_MulABScaleExpertWeightA8W8blkscale_v1_Nswizzle0_Quant4_MulRoutedWeight1_F8_F8_B16,14.5%,1471.2664,0,840.74,239.47,
256,8192,4096,1536,16,8,ActivationType.Silu,torch.bfloat16,torch.float8_e4m3fn,torch.float8_e4m3fn,QuantType.per_1x128,1,0,32,0,2840.6239,_ZN5aiter45fmoe_bf16_blockscaleFp8_g1u1_novs_silu_32x384E,0.0%,0.0,,0.0%,2840.6239,1,870.9,141.75,
256,16384,4096,1536,16,8,ActivationType.Silu,torch.bfloat16,torch.float8_e4m3fn,torch.float8_e4m3fn,QuantType.per_1x128,1,0,32,0,5217.5794,_ZN5aiter43fmoe_bf16_blockscaleFp8_g1u1_vs_silu_32x384E,0.0%,0.0,,0.0%,5217.5794,1,948.29,96.47,
256,32768,4096,1536,16,8,ActivationType.Silu,torch.bfloat16,torch.float8_e4m3fn,torch.float8_e4m3fn,QuantType.per_1x128,1,0,32,0,10403.6177,_ZN5aiter45fmoe_bf16_blockscaleFp8_g1u1_novs_silu_32x384E,0.0%,0.0,,0.0%,10403.6177,1,951.17,67.73,
256,1,4096,384,128,8,ActivationType.Silu,torch.bfloat16,torch.float8_e4m3fn,torch.float8_e4m3fn,QuantType.per_1x128,1,0,32,8,19.0419,moe_ck2stages_gemm1_256x32x128x128_1x4_MulABScaleExpertWeightA8W8blkscaleSplitk_v1_Nswizzle0_Quant4_MulRoutedWeight0_silu_F8_F8_B16,1.1%,8.3931,moe_ck2stages_gemm2_256x32x128x128_1x4_MulABScaleExpertWeightA8W8blkscale_v1_Nswizzle0_Quant4_MulRoutedWeight1_F8_F8_B16,15.5%,27.435,0,2.75,22015.38,
256,2,4096,384,128,8,ActivationType.Silu,torch.bfloat16,torch.float8_e4m3fn,torch.float8_e4m3fn,QuantType.per_1x128,1,0,32,4,23.3333,moe_ck2stages_gemm1_256x32x128x128_1x4_MulABScaleExpertWeightA8W8blkscaleSplitk_v1_Nswizzle0_Quant4_MulRoutedWeight0_silu_F8_F8_B16,1.0%,13.9733,moe_ck2stages_gemm2_256x32x128x128_1x4_MulABScaleExpertWeightA8W8blkscale_v1_Nswizzle0_Quant4_MulRoutedWeight1_F8_F8_B16,15.4%,37.3066,0,4.05,16190.28,
256,4,4096,384,128,8,ActivationType.Silu,torch.bfloat16,torch.float8_e4m3fn,torch.float8_e4m3fn,QuantType.per_1x128,1,0,16,0,42.2041,_ZN5aiter47fmoe_bf16_blockscaleFp8_g1u1_vs_pf2_silu_16x128E,0.0%,0.0,,0.0%,42.2041,1,7.16,14312.09,
256,8,4096,384,128,8,ActivationType.Silu,torch.bfloat16,torch.float8_e4m3fn,torch.float8_e4m3fn,QuantType.per_1x128,1,0,16,0,48.6586,_ZN5aiter47fmoe_bf16_blockscaleFp8_g1u1_vs_pf2_silu_16x128E,0.0%,0.0,,0.0%,48.6586,1,12.41,12414.62,
256,16,4096,384,128,8,ActivationType.Silu,torch.bfloat16,torch.float8_e4m3fn,torch.float8_e4m3fn,QuantType.per_1x128,1,0,16,0,73.5923,_ZN5aiter47fmoe_bf16_blockscaleFp8_g1u1_vs_pf2_silu_16x128E,0.0%,0.0,,0.0%,73.5923,1,16.41,8209.78,
256,32,4096,384,128,8,ActivationType.Silu,torch.bfloat16,torch.float8_e4m3fn,torch.float8_e4m3fn,QuantType.per_1x128,1,0,16,0,110.8486,_ZN5aiter47fmoe_bf16_blockscaleFp8_g1u1_vs_pf2_silu_16x128E,0.0%,0.0,,0.0%,110.8486,1,21.79,5452.24,
256,64,4096,384,128,8,ActivationType.Silu,torch.bfloat16,torch.float8_e4m3fn,torch.float8_e4m3fn,QuantType.per_1x128,1,0,16,0,120.831,_ZN5aiter47fmoe_bf16_blockscaleFp8_g1u1_vs_pf2_silu_16x128E,0.0%,0.0,,0.0%,120.831,1,39.99,5005.06,
256,128,4096,384,128,8,ActivationType.Silu,torch.bfloat16,torch.float8_e4m3fn,torch.float8_e4m3fn,QuantType.per_1x128,1,0,16,0,122.4552,_ZN5aiter47fmoe_bf16_blockscaleFp8_g1u1_vs_pf2_silu_16x128E,0.0%,0.0,,0.0%,122.4552,1,78.92,4945.1,
256,256,4096,384,128,8,ActivationType.Silu,torch.bfloat16,torch.float8_e4m3fn,torch.float8_e4m3fn,QuantType.per_1x128,1,0,32,0,83.462,moe_ck2stages_gemm1_256x32x128x128_1x4_MulABScaleExpertWeightA8W8blkscale_v1_Nswizzle0_Quant4_MulRoutedWeight0_silu_F8_F8_B16,0.1%,45.7736,moe_ck2stages_gemm2_256x32x128x128_1x4_MulABScaleExpertWeightA8W8blkscale_v1_Nswizzle0_Quant4_MulRoutedWeight1_F8_F8_B16,15.5%,129.2356,0,149.55,4697.82,
256,512,4096,384,128,8,ActivationType.Silu,torch.bfloat16,torch.float8_e4m3fn,torch.float8_e4m3fn,QuantType.per_1x128,1,0,32,0,110.1493,moe_ck2stages_gemm1_256x32x128x128_1x4_MulABScaleExpertWeightA8W8blkscale_v1_Nswizzle0_Quant4_MulRoutedWeight0_silu_F8_F8_B16,0.1%,58.3348,moe_ck2stages_gemm2_256x32x128x128_1x4_MulABScaleExpertWeightA8W8blkscale_v1_Nswizzle0_Quant4_MulRoutedWeight1_F8_F8_B16,15.6%,168.4841,0,229.43,3622.13,
256,1024,4096,384,128,8,ActivationType.Silu,torch.bfloat16,torch.float8_e4m3fn,torch.float8_e4m3fn,QuantType.per_1x128,1,0,32,0,154.4034,moe_ck2stages_gemm1_256x32x128x128_1x4_MulABScaleExpertWeightA8W8blkscale_v1_Nswizzle0_Quant4_MulRoutedWeight0_silu_F8_F8_B16,0.1%,87.1208,moe_ck2stages_gemm2_256x32x128x128_1x4_MulABScaleExpertWeightA8W8blkscale_v1_Nswizzle0_Quant4_MulRoutedWeight1_F8_F8_B16,15.5%,241.5242,0,320.09,2552.8,
256,2048,4096,384,128,8,ActivationType.Silu,torch.bfloat16,torch.float8_e4m3fn,torch.float8_e4m3fn,QuantType.per_1x128,1,0,64,0,209.3299,moe_ck2stages_gemm1_256x64x128x128_1x4_MulABScaleExpertWeightA8W8blkscale_v3_Nswizzle0_Quant4_MulRoutedWeight0_silu_F8_F8_B16,0.1%,170.4266,moe_ck2stages_gemm2_256x64x128x128_1x4_MulABScaleExpertWeightA8W8blkscale_v3_Nswizzle0_Quant4_MulRoutedWeight1_F8_F8_B16,15.6%,379.7565,0,407.15,1656.71,
256,4096,4096,384,128,8,ActivationType.Silu,torch.bfloat16,torch.float8_e4m3fn,torch.float8_e4m3fn,QuantType.per_1x128,1,0,64,0,384.5051,moe_ck2stages_gemm1_256x64x128x128_1x4_MulABScaleExpertWeightA8W8blkscale_v3_Nswizzle0_Quant4_MulRoutedWeight0_silu_F8_F8_B16,0.1%,308.9218,moe_ck2stages_gemm2_256x64x128x128_1x4_MulABScaleExpertWeightA8W8blkscale_v3_Nswizzle0_Quant4_MulRoutedWeight1_F8_F8_B16,15.6%,693.4269,0,445.96,943.59,
256,8192,4096,384,128,8,ActivationType.Silu,torch.bfloat16,torch.float8_e4m3fn,torch.float8_e4m3fn,QuantType.per_1x128,1,0,32,0,646.6441,moe_ck2stages_gemm1_256x32x128x128_1x4_MulABScaleExpertWeightA8W8blkscale_v1_Nswizzle0_Quant4_MulRoutedWeight0_silu_F8_F8_B16,0.1%,527.7251,moe_ck2stages_gemm2_256x32x128x128_1x4_MulABScaleExpertWeightA8W8blkscale_v1_Nswizzle0_Quant4_MulRoutedWeight1_F8_F8_B16,15.6%,1174.3692,0,526.64,600.02,
256,16384,4096,384,128,8,ActivationType.Silu,torch.bfloat16,torch.float8_e4m3fn,torch.float8_e4m3fn,QuantType.per_1x128,1,0,32,0,1808.4732,_ZN5aiter43fmoe_bf16_blockscaleFp8_g1u1_vs_silu_32x384E,0.0%,0.0,,0.0%,1808.4732,1,683.98,445.3,
256,32768,4096,384,128,8,ActivationType.Silu,torch.bfloat16,torch.float8_e4m3fn,torch.float8_e4m3fn,QuantType.per_1x128,1,0,32,0,3449.1606,_ZN5aiter43fmoe_bf16_blockscaleFp8_g1u1_vs_silu_32x384E,0.0%,0.0,,0.0%,3449.1606,1,717.25,291.85,
