aiter/configs/model_configs/dsv4_fp4_tuned_fmoe.csv
cu_num,token,model_dim,inter_dim,expert,topk,act_type,dtype,q_dtype_a,q_dtype_w,q_type,use_g1u1,doweight_stage1,block_m,ksplit,us1,kernelName1,err1,us2,kernelName2,err2,us,run_1stage,tflops,bw,_tag
256,1,7168,512,385,6,ActivationType.Silu,torch.bfloat16,torch.float4_e2m1fn_x2,torch.float4_e2m1fn_x2,QuantType.per_1x32,1,0,32,0,17.8886,flydsl_moe1_afp4_wfp4_bf16_t32x64x256_w3_kb4_go_fp4,20.8%,7.5925,moe_ck2stages_gemm2_256x32x128x128_1x4_MulABScaleExpertWeightShuffled_v3_Nswizzle0_Quant3_MulRoutedWeight1_FP4X2_FP4X2_B16,2.9%,25.4811,0,7.78,166354.28,
256,2,7168,512,385,6,ActivationType.Silu,torch.bfloat16,torch.float4_e2m1fn_x2,torch.float4_e2m1fn_x2,QuantType.per_1x32,1,0,32,0,22.8149,flydsl_moe1_afp4_wfp4_bf16_t32x128x256_w3_kb7_xcd4_fp4,21.0%,13.1788,moe_ck2stages_gemm2_256x32x128x128_1x4_MulABScaleExpertWeightShuffled_v3_Nswizzle0_Quant3_MulRoutedWeight1_FP4X2_FP4X2_B16,2.9%,35.9937,0,11.01,117768.15,
256,4,7168,512,385,6,ActivationType.Silu,torch.bfloat16,torch.float4_e2m1fn_x2,torch.float4_e2m1fn_x2,QuantType.per_1x32,1,0,32,0,27.7235,flydsl_moe1_afp4_wfp4_bf16_t32x128x256_w3_fp4,19.7%,19.328,flydsl_moe2_afp4_wfp4_bf16_t32x256x256_atomic,2.9%,47.0515,0,16.85,90091.8,
256,8,7168,512,385,6,ActivationType.Silu,torch.bfloat16,torch.float4_e2m1fn_x2,torch.float4_e2m1fn_x2,QuantType.per_1x32,1,0,32,0,51.6825,flydsl_moe1_afp4_wfp4_bf16_t32x64x256_w4_fp4,0.0%,29.1534,flydsl_moe2_afp4_wfp4_bf16_t32x128x256_atomic_bnt2,2.7%,80.8359,0,19.61,52440.07,
256,16,7168,512,385,6,ActivationType.Silu,torch.bfloat16,torch.float4_e2m1fn_x2,torch.float4_e2m1fn_x2,QuantType.per_1x32,1,0,32,0,78.1272,flydsl_moe1_afp4_wfp4_bf16_t32x128x256_w3,0.0%,44.6234,flydsl_moe2_afp4_wfp4_bf16_t32x128x256_atomic_bnt2,2.9%,122.7506,0,25.83,34535.17,
256,32,7168,512,385,6,ActivationType.Silu,torch.bfloat16,torch.float4_e2m1fn_x2,torch.float4_e2m1fn_x2,QuantType.per_1x32,1,0,32,0,132.1537,flydsl_moe1_afp4_wfp4_bf16_t32x64x256_w4_fp4,17.8%,67.5444,flydsl_moe2_afp4_wfp4_bf16_t16x256x256_atomic_bnt2_persist_sbm32,3.0%,199.6981,0,31.76,21229.83,
256,64,7168,512,385,6,ActivationType.Silu,torch.bfloat16,torch.float4_e2m1fn_x2,torch.float4_e2m1fn_x2,QuantType.per_1x32,1,0,32,0,184.367,flydsl_moe1_afp4_wfp4_bf16_t32x128x256_w2_fp4,17.2%,101.1521,flydsl_moe2_afp4_wfp4_bf16_t32x256x256_atomic_bnt2_persist,2.9%,285.5191,0,44.42,14851.0,
256,128,7168,512,385,6,ActivationType.Silu,torch.bfloat16,torch.float4_e2m1fn_x2,torch.float4_e2m1fn_x2,QuantType.per_1x32,1,0,32,0,219.1026,flydsl_moe1_afp4_wfp4_bf16_t32x64x256_w2_fp4,17.3%,120.1837,flydsl_moe2_afp4_wfp4_bf16_t32x256x256_atomic_bnt2,3.0%,339.2863,0,74.77,12501.6,
256,256,7168,512,385,6,ActivationType.Silu,torch.bfloat16,torch.float4_e2m1fn_x2,torch.float4_e2m1fn_x2,QuantType.per_1x32,1,0,64,0,228.2939,flydsl_moe1_afp4_wfp4_bf16_t64x128x256_w3_fp4,17.3%,132.8644,flydsl_moe2_afp4_wfp4_bf16_t32x256x256_atomic_bnt2_sbm64,2.9%,361.1583,0,140.48,11752.11,
256,512,7168,512,385,6,ActivationType.Silu,torch.bfloat16,torch.float4_e2m1fn_x2,torch.float4_e2m1fn_x2,QuantType.per_1x32,1,0,32,0,248.5047,flydsl_moe1_afp4_wfp4_bf16_t32x64x256_w4,0.0%,135.3295,flydsl_moe2_afp4_wfp4_bf16_t32x256x256_atomic_bnt2,3.0%,383.8342,0,264.36,11072.17,
256,1024,7168,512,385,6,ActivationType.Silu,torch.bfloat16,torch.float4_e2m1fn_x2,torch.float4_e2m1fn_x2,QuantType.per_1x32,1,0,64,0,250.3871,flydsl_moe1_afp4_wfp4_bf16_t64x128x256_w2_fp4,17.2%,157.9713,flydsl_moe2_afp4_wfp4_bf16_t32x256x256_atomic_bnt2_sbm64,2.9%,408.3584,0,496.96,10434.19,
256,2048,7168,512,385,6,ActivationType.Silu,torch.bfloat16,torch.float4_e2m1fn_x2,torch.float4_e2m1fn_x2,QuantType.per_1x32,1,0,64,0,265.6454,flydsl_moe1_afp4_wfp4_bf16_t64x128x256_w2_fp4,17.3%,229.7372,flydsl_moe2_afp4_wfp4_bf16_t64x256x256_reduce_persist,0.3%,495.3826,0,819.32,8645.66,
256,4096,7168,512,385,6,ActivationType.Silu,torch.bfloat16,torch.float4_e2m1fn_x2,torch.float4_e2m1fn_x2,QuantType.per_1x32,1,0,128,0,335.2709,flydsl_moe1_afp4_wfp4_bf16_t128x128x256_w4,0.0%,397.6695,flydsl_moe2_afp4_wfp4_bf16_t64x256x256_reduce_persist_sbm128,0.3%,732.9404,0,1107.52,5903.55,
256,8192,7168,512,385,6,ActivationType.Silu,torch.bfloat16,torch.float4_e2m1fn_x2,torch.float4_e2m1fn_x2,QuantType.per_1x32,1,0,128,0,544.8151,flydsl_moe1_afp4_wfp4_bf16_t128x128x256_w2_xcd4,0.0%,707.078,flydsl_moe2_afp4_wfp4_bf16_t64x256x256_reduce_sbm128,0.3%,1251.8931,0,1296.83,3526.68,
256,16384,7168,512,385,6,ActivationType.Silu,torch.bfloat16,torch.float4_e2m1fn_x2,torch.float4_e2m1fn_x2,QuantType.per_1x32,1,0,64,0,862.1587,flydsl_moe1_afp4_wfp4_bf16_t64x128x256_w4_bnt0_xcd4,0.0%,1305.102,flydsl_moe2_afp4_wfp4_bf16_t64x256x256_reduce_xcd4,0.3%,2167.2607,0,1498.2,2118.43,
256,32768,7168,512,385,6,ActivationType.Silu,torch.bfloat16,torch.float4_e2m1fn_x2,torch.float4_e2m1fn_x2,QuantType.per_1x32,1,0,128,0,1391.8997,moe_ck2stages_gemm1_256x128x128x128_1x4_MulABScaleShuffled_v3_Nswizzle0_Quant3_MulRoutedWeight0_silu_FP4X2_FP4X2_B16,0.0%,2564.68,flydsl_moe2_afp4_wfp4_bf16_t64x256x256_reduce_xcd4_persist_sbm128,0.3%,3956.5797,0,1641.31,1249.44,
