aiter/configs/model_configs/kimik2_bf16_tuned_gemm.csv
gfx,cu_num,M,N,K,bias,dtype,outdtype,scaleAB,bpreshuffle,libtype,solidx,splitK,us,kernelName,err_ratio,tflops,bw
gfx950,256,8,384,7168,False,torch.bfloat16,torch.bfloat16,False,False,flydsl,180,16,7.8287,flydsl_gemm2_abf16_wbf16_bf16_t32x64x64_split_k16_block_m_warp1_block_n_warp4_async_copyTrue_b_to_ldsFalse_b_preshuffleFalse_c_to_ldsFalse_gfx950,0.0316,5.63,718.62
gfx950,256,16,384,7168,False,torch.bfloat16,torch.bfloat16,False,False,flydsl,180,16,7.9866,flydsl_gemm2_abf16_wbf16_bf16_t32x64x64_split_k16_block_m_warp1_block_n_warp4_async_copyTrue_b_to_ldsFalse_b_preshuffleFalse_c_to_ldsFalse_gfx950,0.0308,11.03,719.54
gfx950,256,24,384,7168,False,torch.bfloat16,torch.bfloat16,False,False,flydsl,180,16,8.0995,flydsl_gemm2_abf16_wbf16_bf16_t32x64x64_split_k16_block_m_warp1_block_n_warp4_async_copyTrue_b_to_ldsFalse_b_preshuffleFalse_c_to_ldsFalse_gfx950,0.0318,16.31,724.43
gfx950,256,32,384,7168,False,torch.bfloat16,torch.bfloat16,False,False,flydsl,180,16,8.1003,flydsl_gemm2_abf16_wbf16_bf16_t32x64x64_split_k16_block_m_warp1_block_n_warp4_async_copyTrue_b_to_ldsFalse_b_preshuffleFalse_c_to_ldsFalse_gfx950,0.0298,21.75,739.28
gfx950,256,40,384,7168,False,torch.bfloat16,torch.bfloat16,False,False,flydsl,180,16,8.1775,flydsl_gemm2_abf16_wbf16_bf16_t32x64x64_split_k16_block_m_warp1_block_n_warp4_async_copyTrue_b_to_ldsFalse_b_preshuffleFalse_c_to_ldsFalse_gfx950,0.0303,26.93,747.07
gfx950,256,48,384,7168,False,torch.bfloat16,torch.bfloat16,False,False,flydsl,179,8,9.1109,flydsl_gemm2_abf16_wbf16_bf16_t32x64x128_split_k8_block_m_warp2_block_n_warp2_async_copyTrue_b_to_ldsTrue_b_preshuffleFalse_c_to_ldsFalse_gfx950,0.0225,29.0,683.8
gfx950,256,56,384,7168,False,torch.bfloat16,torch.bfloat16,False,False,asm,5,14,9.3551,_ZN5aiter39bf16gemm_fp32bf16_tn_64x64_splitk_cleanE,0.0279,32.95,678.86
gfx950,256,64,384,7168,False,torch.bfloat16,torch.bfloat16,False,False,flydsl,180,16,8.8653,flydsl_gemm2_abf16_wbf16_bf16_t32x64x64_split_k16_block_m_warp1_block_n_warp4_async_copyTrue_b_to_ldsFalse_b_preshuffleFalse_c_to_ldsFalse_gfx950,0.0312,39.74,730.0
gfx950,256,72,384,7168,False,torch.bfloat16,torch.bfloat16,False,False,flydsl,179,8,9.603,flydsl_gemm2_abf16_wbf16_bf16_t32x64x128_split_k8_block_m_warp2_block_n_warp2_async_copyTrue_b_to_ldsTrue_b_preshuffleFalse_c_to_ldsFalse_gfx950,0.0222,41.27,686.51
gfx950,256,80,384,7168,False,torch.bfloat16,torch.bfloat16,False,False,flydsl,179,8,9.2927,flydsl_gemm2_abf16_wbf16_bf16_t32x64x128_split_k8_block_m_warp2_block_n_warp2_async_copyTrue_b_to_ldsTrue_b_preshuffleFalse_c_to_ldsFalse_gfx950,0.0216,47.39,722.43
gfx950,256,88,384,7168,False,torch.bfloat16,torch.bfloat16,False,False,asm,8,14,9.9299,_ZN5aiter39bf16gemm_fp32bf16_tn_96x64_splitk_cleanE,0.0281,48.79,688.24
gfx950,256,96,384,7168,False,torch.bfloat16,torch.bfloat16,False,False,asm,8,14,10.5219,_ZN5aiter39bf16gemm_fp32bf16_tn_96x64_splitk_cleanE,0.0291,50.23,661.0
gfx950,256,104,384,7168,False,torch.bfloat16,torch.bfloat16,False,False,flydsl,179,8,10.7243,flydsl_gemm2_abf16_wbf16_bf16_t32x64x128_split_k8_block_m_warp2_block_n_warp2_async_copyTrue_b_to_ldsTrue_b_preshuffleFalse_c_to_ldsFalse_gfx950,0.0213,53.39,659.8
gfx950,256,112,384,7168,False,torch.bfloat16,torch.bfloat16,False,False,flydsl,179,8,11.0639,flydsl_gemm2_abf16_wbf16_bf16_t32x64x128_split_k8_block_m_warp2_block_n_warp2_async_copyTrue_b_to_ldsTrue_b_preshuffleFalse_c_to_ldsFalse_gfx950,0.0217,55.73,650.46
gfx950,256,120,384,7168,False,torch.bfloat16,torch.bfloat16,False,False,flydsl,179,8,10.5619,flydsl_gemm2_abf16_wbf16_bf16_t32x64x128_split_k8_block_m_warp2_block_n_warp2_async_copyTrue_b_to_ldsTrue_b_preshuffleFalse_c_to_ldsFalse_gfx950,0.0213,62.55,692.82
gfx950,256,128,384,7168,False,torch.bfloat16,torch.bfloat16,False,False,flydsl,179,8,12.0315,flydsl_gemm2_abf16_wbf16_bf16_t32x64x128_split_k8_block_m_warp2_block_n_warp2_async_copyTrue_b_to_ldsTrue_b_preshuffleFalse_c_to_ldsFalse_gfx950,0.0225,58.57,618.24
gfx950,256,136,384,7168,False,torch.bfloat16,torch.bfloat16,False,False,flydsl,179,8,11.9587,flydsl_gemm2_abf16_wbf16_bf16_t32x64x128_split_k8_block_m_warp2_block_n_warp2_async_copyTrue_b_to_ldsTrue_b_preshuffleFalse_c_to_ldsFalse_gfx950,0.0222,62.61,632.11
gfx950,256,144,384,7168,False,torch.bfloat16,torch.bfloat16,False,False,asm,7,9,12.4755,_ZN5aiter39bf16gemm_fp32bf16_tn_80x64_splitk_cleanE,0.0224,63.54,615.61
gfx950,256,168,384,7168,False,torch.bfloat16,torch.bfloat16,False,False,flydsl,179,8,12.5098,flydsl_gemm2_abf16_wbf16_bf16_t32x64x128_split_k8_block_m_warp2_block_n_warp2_async_copyTrue_b_to_ldsTrue_b_preshuffleFalse_c_to_ldsFalse_gfx950,0.0228,73.93,642.9
gfx950,256,176,384,7168,False,torch.bfloat16,torch.bfloat16,False,False,flydsl,179,8,12.823,flydsl_gemm2_abf16_wbf16_bf16_t32x64x128_split_k8_block_m_warp2_block_n_warp2_async_copyTrue_b_to_ldsTrue_b_preshuffleFalse_c_to_ldsFalse_gfx950,0.0222,75.56,636.62
gfx950,256,184,384,7168,False,torch.bfloat16,torch.bfloat16,False,False,flydsl,179,8,12.9575,flydsl_gemm2_abf16_wbf16_bf16_t32x64x128_split_k8_block_m_warp2_block_n_warp2_async_copyTrue_b_to_ldsTrue_b_preshuffleFalse_c_to_ldsFalse_gfx950,0.0222,78.17,639.33
gfx950,256,192,384,7168,False,torch.bfloat16,torch.bfloat16,False,False,flydsl,179,8,13.1135,flydsl_gemm2_abf16_wbf16_bf16_t32x64x128_split_k8_block_m_warp2_block_n_warp2_async_copyTrue_b_to_ldsTrue_b_preshuffleFalse_c_to_ldsFalse_gfx950,0.0222,80.6,640.94
gfx950,256,200,384,7168,False,torch.bfloat16,torch.bfloat16,False,False,flydsl,289,8,13.004,flydsl_gemm2_abf16_wbf16_bf16_t64x64x128_split_k8_block_m_warp2_block_n_warp2_async_copyTrue_b_to_ldsTrue_b_preshuffleFalse_c_to_ldsFalse_gfx950,0.0218,84.67,655.63
gfx950,256,208,384,7168,False,torch.bfloat16,torch.bfloat16,False,False,flydsl,289,8,12.9955,flydsl_gemm2_abf16_wbf16_bf16_t64x64x128_split_k8_block_m_warp2_block_n_warp2_async_copyTrue_b_to_ldsTrue_b_preshuffleFalse_c_to_ldsFalse_gfx950,0.0221,88.11,665.36
gfx950,256,216,384,7168,False,torch.bfloat16,torch.bfloat16,False,False,flydsl,289,8,13.5066,flydsl_gemm2_abf16_wbf16_bf16_t64x64x128_split_k8_block_m_warp2_block_n_warp2_async_copyTrue_b_to_ldsTrue_b_preshuffleFalse_c_to_ldsFalse_gfx950,0.0216,88.04,649.13
gfx950,256,224,384,7168,False,torch.bfloat16,torch.bfloat16,False,False,flydsl,289,8,13.6487,flydsl_gemm2_abf16_wbf16_bf16_t64x64x128_split_k8_block_m_warp2_block_n_warp2_async_copyTrue_b_to_ldsTrue_b_preshuffleFalse_c_to_ldsFalse_gfx950,0.0222,90.35,651.22
gfx950,256,232,384,7168,False,torch.bfloat16,torch.bfloat16,False,False,flydsl,179,8,13.4444,flydsl_gemm2_abf16_wbf16_bf16_t32x64x128_split_k8_block_m_warp2_block_n_warp2_async_copyTrue_b_to_ldsTrue_b_preshuffleFalse_c_to_ldsFalse_gfx950,0.0221,95.0,670.1
gfx950,256,240,384,7168,False,torch.bfloat16,torch.bfloat16,False,False,flydsl,179,8,13.5075,flydsl_gemm2_abf16_wbf16_bf16_t32x64x128_split_k8_block_m_warp2_block_n_warp2_async_copyTrue_b_to_ldsTrue_b_preshuffleFalse_c_to_ldsFalse_gfx950,0.0222,97.81,675.92
gfx950,256,248,384,7168,False,torch.bfloat16,torch.bfloat16,False,False,flydsl,179,8,13.6196,flydsl_gemm2_abf16_wbf16_bf16_t32x64x128_split_k8_block_m_warp2_block_n_warp2_async_copyTrue_b_to_ldsTrue_b_preshuffleFalse_c_to_ldsFalse_gfx950,0.0227,100.24,679.23
gfx950,256,256,384,7168,False,torch.bfloat16,torch.bfloat16,False,False,asm,3,6,13.8836,_ZN5aiter39bf16gemm_fp32bf16_tn_48x64_splitk_cleanE,0.0185,101.51,675.02
gfx950,256,264,384,7168,False,torch.bfloat16,torch.bfloat16,False,False,asm,3,6,14.0505,_ZN5aiter39bf16gemm_fp32bf16_tn_48x64_splitk_cleanE,0.0182,103.44,675.6
gfx950,256,272,384,7168,False,torch.bfloat16,torch.bfloat16,False,False,asm,3,6,14.142,_ZN5aiter39bf16gemm_fp32bf16_tn_48x64_splitk_cleanE,0.0185,105.88,679.77
gfx950,256,280,384,7168,False,torch.bfloat16,torch.bfloat16,False,False,asm,3,6,14.0565,_ZN5aiter39bf16gemm_fp32bf16_tn_48x64_splitk_cleanE,0.0184,109.66,692.5
gfx950,256,288,384,7168,False,torch.bfloat16,torch.bfloat16,False,False,asm,5,6,14.17,_ZN5aiter39bf16gemm_fp32bf16_tn_64x64_splitk_cleanE,0.019,111.89,695.48
gfx950,256,296,384,7168,False,torch.bfloat16,torch.bfloat16,False,False,asm,3,6,14.0038,_ZN5aiter39bf16gemm_fp32bf16_tn_48x64_splitk_cleanE,0.0186,116.36,712.36
gfx950,256,304,384,7168,False,torch.bfloat16,torch.bfloat16,False,False,asm,3,6,14.3644,_ZN5aiter39bf16gemm_fp32bf16_tn_48x64_splitk_cleanE,0.0187,116.51,702.89
gfx950,256,312,384,7168,False,torch.bfloat16,torch.bfloat16,False,False,asm,5,6,14.2119,_ZN5aiter39bf16gemm_fp32bf16_tn_64x64_splitk_cleanE,0.0189,120.85,718.94
gfx950,256,320,384,7168,False,torch.bfloat16,torch.bfloat16,False,False,asm,3,6,14.0163,_ZN5aiter39bf16gemm_fp32bf16_tn_48x64_splitk_cleanE,0.0187,125.68,737.59
gfx950,256,328,384,7168,False,torch.bfloat16,torch.bfloat16,False,False,asm,3,6,14.1727,_ZN5aiter39bf16gemm_fp32bf16_tn_48x64_splitk_cleanE,0.0188,127.4,737.98
gfx950,256,336,384,7168,False,torch.bfloat16,torch.bfloat16,False,False,asm,3,5,14.2772,_ZN5aiter39bf16gemm_fp32bf16_tn_48x64_splitk_cleanE,0.0162,129.56,741.04
gfx950,256,344,384,7168,False,torch.bfloat16,torch.bfloat16,False,False,asm,5,6,14.3755,_ZN5aiter39bf16gemm_fp32bf16_tn_64x64_splitk_cleanE,0.0184,131.73,744.38
gfx950,256,352,384,7168,False,torch.bfloat16,torch.bfloat16,False,False,asm,5,5,14.5901,_ZN5aiter39bf16gemm_fp32bf16_tn_64x64_splitk_cleanE,0.0162,132.81,741.71
gfx950,256,360,384,7168,False,torch.bfloat16,torch.bfloat16,False,False,asm,5,6,14.4607,_ZN5aiter39bf16gemm_fp32bf16_tn_64x64_splitk_cleanE,0.0187,137.05,756.7
gfx950,256,368,384,7168,False,torch.bfloat16,torch.bfloat16,False,False,asm,5,6,14.5298,_ZN5aiter39bf16gemm_fp32bf16_tn_64x64_splitk_cleanE,0.0186,139.43,761.42
gfx950,256,376,384,7168,False,torch.bfloat16,torch.bfloat16,False,False,asm,3,5,14.5702,_ZN5aiter39bf16gemm_fp32bf16_tn_48x64_splitk_cleanE,0.0161,142.06,767.6
gfx950,256,384,384,7168,False,torch.bfloat16,torch.bfloat16,False,False,asm,5,6,14.6341,_ZN5aiter39bf16gemm_fp32bf16_tn_64x64_splitk_cleanE,0.0188,144.45,772.51
gfx950,256,392,384,7168,False,torch.bfloat16,torch.bfloat16,False,False,asm,5,5,14.7176,_ZN5aiter39bf16gemm_fp32bf16_tn_64x64_splitk_cleanE,0.0162,146.63,776.34
gfx950,256,400,384,7168,False,torch.bfloat16,torch.bfloat16,False,False,asm,5,5,14.7254,_ZN5aiter39bf16gemm_fp32bf16_tn_64x64_splitk_cleanE,0.0163,149.54,784.13
gfx950,256,408,384,7168,False,torch.bfloat16,torch.bfloat16,False,False,asm,5,5,14.8111,_ZN5aiter39bf16gemm_fp32bf16_tn_64x64_splitk_cleanE,0.0161,151.65,787.75
gfx950,256,416,384,7168,False,torch.bfloat16,torch.bfloat16,False,False,asm,5,5,14.8643,_ZN5aiter39bf16gemm_fp32bf16_tn_64x64_splitk_cleanE,0.0162,154.07,793.06
gfx950,256,424,384,7168,False,torch.bfloat16,torch.bfloat16,False,False,asm,5,5,15.0387,_ZN5aiter39bf16gemm_fp32bf16_tn_64x64_splitk_cleanE,0.0163,155.21,791.9
gfx950,256,432,384,7168,False,torch.bfloat16,torch.bfloat16,False,False,asm,5,5,14.9946,_ZN5aiter39bf16gemm_fp32bf16_tn_64x64_splitk_cleanE,0.0162,158.6,802.29
gfx950,256,440,384,7168,False,torch.bfloat16,torch.bfloat16,False,False,asm,5,5,14.9368,_ZN5aiter39bf16gemm_fp32bf16_tn_64x64_splitk_cleanE,0.0162,162.16,813.48
gfx950,256,448,384,7168,False,torch.bfloat16,torch.bfloat16,False,False,asm,5,5,15.0012,_ZN5aiter39bf16gemm_fp32bf16_tn_64x64_splitk_cleanE,0.0162,164.4,818.04
gfx950,256,456,384,7168,False,torch.bfloat16,torch.bfloat16,False,False,asm,7,5,15.275,_ZN5aiter39bf16gemm_fp32bf16_tn_80x64_splitk_cleanE,0.0161,164.34,811.29
gfx950,256,464,384,7168,False,torch.bfloat16,torch.bfloat16,False,False,asm,5,5,15.3249,_ZN5aiter39bf16gemm_fp32bf16_tn_64x64_splitk_cleanE,0.0164,166.68,816.53
gfx950,256,472,384,7168,False,torch.bfloat16,torch.bfloat16,False,False,asm,5,5,15.4675,_ZN5aiter39bf16gemm_fp32bf16_tn_64x64_splitk_cleanE,0.0162,167.99,816.82
gfx950,256,480,384,7168,False,torch.bfloat16,torch.bfloat16,False,False,asm,5,5,15.4382,_ZN5aiter39bf16gemm_fp32bf16_tn_64x64_splitk_cleanE,0.0162,171.16,826.19
gfx950,256,488,384,7168,False,torch.bfloat16,torch.bfloat16,False,False,asm,7,5,15.4672,_ZN5aiter39bf16gemm_fp32bf16_tn_80x64_splitk_cleanE,0.0164,173.69,832.46
gfx950,256,496,384,7168,False,torch.bfloat16,torch.bfloat16,False,False,asm,5,5,15.5009,_ZN5aiter39bf16gemm_fp32bf16_tn_64x64_splitk_cleanE,0.0163,176.15,838.44
gfx950,256,504,384,7168,False,torch.bfloat16,torch.bfloat16,False,False,asm,5,5,15.5875,_ZN5aiter39bf16gemm_fp32bf16_tn_64x64_splitk_cleanE,0.0163,178.0,841.54
gfx950,256,512,384,7168,False,torch.bfloat16,torch.bfloat16,False,False,asm,7,5,15.5896,_ZN5aiter39bf16gemm_fp32bf16_tn_80x64_splitk_cleanE,0.016,180.8,849.17
gfx950,256,1,1024,7168,False,torch.bfloat16,torch.bfloat16,False,False,flydsl,180,16,8.4015,flydsl_gemm2_abf16_wbf16_bf16_t32x64x64_split_k16_block_m_warp1_block_n_warp4_async_copyTrue_b_to_ldsFalse_b_preshuffleFalse_c_to_ldsFalse_gfx950,0.0322,1.75,1749.26
gfx950,256,2,1024,7168,False,torch.bfloat16,torch.bfloat16,False,False,flydsl,180,16,7.9899,flydsl_gemm2_abf16_wbf16_bf16_t32x64x64_split_k16_block_m_warp1_block_n_warp4_async_copyTrue_b_to_ldsFalse_b_preshuffleFalse_c_to_ldsFalse_gfx950,0.0269,3.67,1841.43
gfx950,256,8,1024,7168,False,torch.bfloat16,torch.bfloat16,False,False,flydsl,180,16,8.6843,flydsl_gemm2_abf16_wbf16_bf16_t32x64x64_split_k16_block_m_warp1_block_n_warp4_async_copyTrue_b_to_ldsFalse_b_preshuffleFalse_c_to_ldsFalse_gfx950,0.0272,13.52,1705.51
gfx950,256,16,1024,7168,False,torch.bfloat16,torch.bfloat16,False,False,flydsl,180,16,8.3784,flydsl_gemm2_abf16_wbf16_bf16_t32x64x64_split_k16_block_m_warp1_block_n_warp4_async_copyTrue_b_to_ldsFalse_b_preshuffleFalse_c_to_ldsFalse_gfx950,0.0298,28.03,1783.42
gfx950,256,24,1024,7168,False,torch.bfloat16,torch.bfloat16,False,False,flydsl,179,8,9.5427,flydsl_gemm2_abf16_wbf16_bf16_t32x64x128_split_k8_block_m_warp2_block_n_warp2_async_copyTrue_b_to_ldsTrue_b_preshuffleFalse_c_to_ldsFalse_gfx950,0.0212,36.92,1579.56
gfx950,256,40,1024,7168,False,torch.bfloat16,torch.bfloat16,False,False,flydsl,179,8,9.9028,flydsl_gemm2_abf16_wbf16_bf16_t32x64x128_split_k8_block_m_warp2_block_n_warp2_async_copyTrue_b_to_ldsTrue_b_preshuffleFalse_c_to_ldsFalse_gfx950,0.0215,59.3,1548.59
gfx950,256,48,1024,7168,False,torch.bfloat16,torch.bfloat16,False,False,flydsl,179,8,10.8668,flydsl_gemm2_abf16_wbf16_bf16_t32x64x128_split_k8_block_m_warp2_block_n_warp2_async_copyTrue_b_to_ldsTrue_b_preshuffleFalse_c_to_ldsFalse_gfx950,0.0211,64.84,1423.28
gfx950,256,56,1024,7168,False,torch.bfloat16,torch.bfloat16,False,False,flydsl,179,8,10.662,flydsl_gemm2_abf16_wbf16_bf16_t32x64x128_split_k8_block_m_warp2_block_n_warp2_async_copyTrue_b_to_ldsTrue_b_preshuffleFalse_c_to_ldsFalse_gfx950,0.0208,77.1,1462.91
gfx950,256,64,1024,7168,False,torch.bfloat16,torch.bfloat16,False,False,flydsl,177,8,12.0685,flydsl_gemm2_abf16_wbf16_bf16_t32x64x128_split_k8_block_m_warp1_block_n_warp4_async_copyTrue_b_to_ldsFalse_b_preshuffleFalse_c_to_ldsFalse_gfx950,0.0211,77.85,1303.28
gfx950,256,72,1024,7168,False,torch.bfloat16,torch.bfloat16,False,False,flydsl,289,8,13.1302,flydsl_gemm2_abf16_wbf16_bf16_t64x64x128_split_k8_block_m_warp2_block_n_warp2_async_copyTrue_b_to_ldsTrue_b_preshuffleFalse_c_to_ldsFalse_gfx950,0.0213,80.5,1207.88
gfx950,256,80,1024,7168,False,torch.bfloat16,torch.bfloat16,False,False,flydsl,179,8,13.4925,flydsl_gemm2_abf16_wbf16_bf16_t32x64x128_split_k8_block_m_warp2_block_n_warp2_async_copyTrue_b_to_ldsTrue_b_preshuffleFalse_c_to_ldsFalse_gfx950,0.0213,87.04,1185.16
gfx950,256,88,1024,7168,False,torch.bfloat16,torch.bfloat16,False,False,flydsl,289,8,13.6987,flydsl_gemm2_abf16_wbf16_bf16_t64x64x128_split_k8_block_m_warp2_block_n_warp2_async_copyTrue_b_to_ldsTrue_b_preshuffleFalse_c_to_ldsFalse_gfx950,0.0213,94.3,1176.89
gfx950,256,96,1024,7168,False,torch.bfloat16,torch.bfloat16,False,False,asm,1,5,14.0943,_ZN5aiter39bf16gemm_fp32bf16_tn_32x64_splitk_cleanE,0.0158,99.99,1153.16
gfx950,256,104,1024,7168,False,torch.bfloat16,torch.bfloat16,False,False,asm,5,6,14.2129,_ZN5aiter39bf16gemm_fp32bf16_tn_64x64_splitk_cleanE,0.018,107.42,1152.76
gfx950,256,112,1024,7168,False,torch.bfloat16,torch.bfloat16,False,False,asm,5,7,14.2435,_ZN5aiter39bf16gemm_fp32bf16_tn_64x64_splitk_cleanE,0.0194,115.43,1159.48
gfx950,256,120,1024,7168,False,torch.bfloat16,torch.bfloat16,False,False,asm,5,6,14.3959,_ZN5aiter39bf16gemm_fp32bf16_tn_64x64_splitk_cleanE,0.0181,122.37,1156.31
gfx950,256,128,1024,7168,False,torch.bfloat16,torch.bfloat16,False,False,asm,3,5,14.5892,_ZN5aiter39bf16gemm_fp32bf16_tn_48x64_splitk_cleanE,0.0161,128.8,1149.98
gfx950,256,136,1024,7168,False,torch.bfloat16,torch.bfloat16,False,False,asm,3,5,14.714,_ZN5aiter39bf16gemm_fp32bf16_tn_48x64_splitk_cleanE,0.0162,135.69,1149.13
gfx950,256,144,1024,7168,False,torch.bfloat16,torch.bfloat16,False,False,asm,3,5,14.569,_ZN5aiter39bf16gemm_fp32bf16_tn_48x64_splitk_cleanE,0.0161,145.1,1169.56
gfx950,256,152,1024,7168,False,torch.bfloat16,torch.bfloat16,False,False,asm,7,7,14.7479,_ZN5aiter39bf16gemm_fp32bf16_tn_80x64_splitk_cleanE,0.0206,151.3,1164.26
gfx950,256,160,1024,7168,False,torch.bfloat16,torch.bfloat16,False,False,asm,7,6,14.9606,_ZN5aiter39bf16gemm_fp32bf16_tn_80x64_splitk_cleanE,0.0184,157.0,1156.47
gfx950,256,168,1024,7168,False,torch.bfloat16,torch.bfloat16,False,False,asm,5,5,14.9201,_ZN5aiter39bf16gemm_fp32bf16_tn_64x64_splitk_cleanE,0.0163,165.3,1168.4
gfx950,256,176,1024,7168,False,torch.bfloat16,torch.bfloat16,False,False,asm,5,5,15.243,_ZN5aiter39bf16gemm_fp32bf16_tn_64x64_splitk_cleanE,0.0162,169.5,1152.24
gfx950,256,184,1024,7168,False,torch.bfloat16,torch.bfloat16,False,False,asm,5,5,15.2612,_ZN5aiter39bf16gemm_fp32bf16_tn_64x64_splitk_cleanE,0.0162,176.99,1159.46
gfx950,256,192,1024,7168,False,torch.bfloat16,torch.bfloat16,False,False,asm,5,5,15.3106,_ZN5aiter39bf16gemm_fp32bf16_tn_64x64_splitk_cleanE,0.0163,184.09,1164.28
gfx950,256,200,1024,7168,False,torch.bfloat16,torch.bfloat16,False,False,asm,7,5,15.415,_ZN5aiter39bf16gemm_fp32bf16_tn_80x64_splitk_cleanE,0.0162,190.46,1164.9
gfx950,256,208,1024,7168,False,torch.bfloat16,torch.bfloat16,False,False,asm,7,5,15.5644,_ZN5aiter39bf16gemm_fp32bf16_tn_80x64_splitk_cleanE,0.0162,196.18,1162.14
gfx950,256,216,1024,7168,False,torch.bfloat16,torch.bfloat16,False,False,asm,7,5,15.6173,_ZN5aiter39bf16gemm_fp32bf16_tn_80x64_splitk_cleanE,0.0162,203.04,1166.59
gfx950,256,224,1024,7168,False,torch.bfloat16,torch.bfloat16,False,False,asm,7,5,15.9662,_ZN5aiter39bf16gemm_fp32bf16_tn_80x64_splitk_cleanE,0.0163,205.96,1149.31
gfx950,256,232,1024,7168,False,torch.bfloat16,torch.bfloat16,False,False,asm,7,5,15.8927,_ZN5aiter39bf16gemm_fp32bf16_tn_80x64_splitk_cleanE,0.0161,214.3,1162.87
gfx950,256,240,1024,7168,False,torch.bfloat16,torch.bfloat16,False,False,asm,7,5,15.9019,_ZN5aiter39bf16gemm_fp32bf16_tn_80x64_splitk_cleanE,0.0161,221.56,1170.44
gfx950,256,248,1024,7168,False,torch.bfloat16,torch.bfloat16,False,False,asm,8,5,16.1733,_ZN5aiter39bf16gemm_fp32bf16_tn_96x64_splitk_cleanE,0.0162,225.1,1158.9
gfx950,256,256,1024,7168,False,torch.bfloat16,torch.bfloat16,False,False,asm,8,5,16.642,_ZN5aiter39bf16gemm_fp32bf16_tn_96x64_splitk_cleanE,0.0163,225.82,1134.14
gfx950,256,264,1024,7168,False,torch.bfloat16,torch.bfloat16,False,False,asm,8,5,16.4312,_ZN5aiter39bf16gemm_fp32bf16_tn_96x64_splitk_cleanE,0.0162,235.86,1156.67
gfx950,256,272,1024,7168,False,torch.bfloat16,torch.bfloat16,False,False,asm,8,5,16.4581,_ZN5aiter39bf16gemm_fp32bf16_tn_96x64_splitk_cleanE,0.0161,242.61,1162.74
gfx950,256,280,1024,7168,False,torch.bfloat16,torch.bfloat16,False,False,asm,8,5,16.5508,_ZN5aiter39bf16gemm_fp32bf16_tn_96x64_splitk_cleanE,0.0163,248.35,1164.15
gfx950,256,288,1024,7168,False,torch.bfloat16,torch.bfloat16,False,False,asm,8,5,16.6374,_ZN5aiter39bf16gemm_fp32bf16_tn_96x64_splitk_cleanE,0.0162,254.12,1165.97
gfx950,256,296,1024,7168,False,torch.bfloat16,torch.bfloat16,False,False,asm,7,4,17.3769,_ZN5aiter39bf16gemm_fp32bf16_tn_80x64_splitk_cleanE,0.0138,250.06,1123.89
gfx950,256,304,1024,7168,False,torch.bfloat16,torch.bfloat16,False,False,asm,7,4,17.5554,_ZN5aiter39bf16gemm_fp32bf16_tn_80x64_splitk_cleanE,0.0138,254.21,1119.93
gfx950,256,312,1024,7168,False,torch.bfloat16,torch.bfloat16,False,False,asm,7,4,17.6566,_ZN5aiter39bf16gemm_fp32bf16_tn_80x64_splitk_cleanE,0.0137,259.4,1120.93
gfx950,256,320,1024,7168,False,torch.bfloat16,torch.bfloat16,False,False,asm,7,4,17.8904,_ZN5aiter39bf16gemm_fp32bf16_tn_80x64_splitk_cleanE,0.0138,262.58,1113.61
gfx950,256,328,1024,7168,False,torch.bfloat16,torch.bfloat16,False,False,asm,8,4,18.1946,_ZN5aiter39bf16gemm_fp32bf16_tn_96x64_splitk_cleanE,0.0138,264.64,1102.2
gfx950,256,336,1024,7168,False,torch.bfloat16,torch.bfloat16,False,False,asm,8,4,18.2072,_ZN5aiter39bf16gemm_fp32bf16_tn_96x64_splitk_cleanE,0.0139,270.91,1108.63
gfx950,256,344,1024,7168,False,torch.bfloat16,torch.bfloat16,False,False,asm,8,4,18.2544,_ZN5aiter39bf16gemm_fp32bf16_tn_96x64_splitk_cleanE,0.0138,276.64,1112.95
gfx950,256,376,1024,7168,False,torch.bfloat16,torch.bfloat16,False,False,asm,8,4,18.8057,_ZN5aiter39bf16gemm_fp32bf16_tn_96x64_splitk_cleanE,0.0139,293.51,1108.2
gfx950,256,384,1024,7168,False,torch.bfloat16,torch.bfloat16,False,False,asm,8,4,18.8317,_ZN5aiter39bf16gemm_fp32bf16_tn_96x64_splitk_cleanE,0.0139,299.34,1113.63
gfx950,256,4,2112,7168,False,torch.bfloat16,torch.bfloat16,False,False,flydsl,182,16,8.82,flydsl_gemm2_abf16_wbf16_bf16_t32x64x64_split_k16_block_m_warp2_block_n_warp2_async_copyTrue_b_to_ldsTrue_b_preshuffleFalse_c_to_ldsFalse_gfx950,0.0279,13.73,3441.26
gfx950,256,8,2112,7168,False,torch.bfloat16,torch.bfloat16,False,False,flydsl,179,8,10.9139,flydsl_gemm2_abf16_wbf16_bf16_t32x64x128_split_k8_block_m_warp2_block_n_warp2_async_copyTrue_b_to_ldsTrue_b_preshuffleFalse_c_to_ldsFalse_gfx950,0.0185,22.19,2787.83
gfx950,256,16,2112,7168,False,torch.bfloat16,torch.bfloat16,False,False,flydsl,179,8,10.4057,flydsl_gemm2_abf16_wbf16_bf16_t32x64x128_split_k8_block_m_warp2_block_n_warp2_async_copyTrue_b_to_ldsTrue_b_preshuffleFalse_c_to_ldsFalse_gfx950,0.0223,46.56,2938.25
gfx950,256,24,2112,7168,False,torch.bfloat16,torch.bfloat16,False,False,flydsl,179,8,12.8415,flydsl_gemm2_abf16_wbf16_bf16_t32x64x128_split_k8_block_m_warp2_block_n_warp2_async_copyTrue_b_to_ldsTrue_b_preshuffleFalse_c_to_ldsFalse_gfx950,0.0218,56.59,2392.48
gfx950,256,32,2112,7168,False,torch.bfloat16,torch.bfloat16,False,False,flydsl,289,8,13.4509,flydsl_gemm2_abf16_wbf16_bf16_t64x64x128_split_k8_block_m_warp2_block_n_warp2_async_copyTrue_b_to_ldsTrue_b_preshuffleFalse_c_to_ldsFalse_gfx950,0.0222,72.03,2295.13
gfx950,256,40,2112,7168,False,torch.bfloat16,torch.bfloat16,False,False,flydsl,289,8,14.577,flydsl_gemm2_abf16_wbf16_bf16_t64x64x128_split_k8_block_m_warp2_block_n_warp2_async_copyTrue_b_to_ldsTrue_b_preshuffleFalse_c_to_ldsFalse_gfx950,0.0216,83.08,2128.01
gfx950,256,48,2112,7168,False,torch.bfloat16,torch.bfloat16,False,False,asm,3,6,14.7667,_ZN5aiter39bf16gemm_fp32bf16_tn_48x64_splitk_cleanE,0.0181,98.42,2110.73
gfx950,256,56,2112,7168,False,torch.bfloat16,torch.bfloat16,False,False,asm,5,6,15.4235,_ZN5aiter39bf16gemm_fp32bf16_tn_64x64_splitk_cleanE,0.0181,109.93,2030.47
gfx950,256,72,2112,7168,False,torch.bfloat16,torch.bfloat16,False,False,asm,7,6,15.6998,_ZN5aiter39bf16gemm_fp32bf16_tn_80x64_splitk_cleanE,0.0177,138.85,2013.65
gfx950,256,88,2112,7168,False,torch.bfloat16,torch.bfloat16,False,False,asm,8,7,16.2598,_ZN5aiter39bf16gemm_fp32bf16_tn_96x64_splitk_cleanE,0.02,163.87,1962.56
gfx950,256,360,4096,512,False,torch.bfloat16,torch.bfloat16,False,False,flydsl,280,1,7.4475,flydsl_gemm2_abf16_wbf16_bf16_t64x64x128_split_k1_block_m_warp2_block_n_warp2_async_copyTrue_b_to_ldsTrue_b_preshuffleFalse_c_to_ldsFalse_gfx950,0.0,202.75,1008.67
gfx950,256,1,7168,512,False,torch.bfloat16,torch.bfloat16,False,False,triton,0,0,5.3991,auto,0.0,1.36,1362.34
gfx950,256,48,7168,512,False,torch.bfloat16,torch.bfloat16,False,False,flydsl,170,1,6.2363,flydsl_gemm2_abf16_wbf16_bf16_t32x64x128_split_k1_block_m_warp2_block_n_warp2_async_copyTrue_b_to_ldsTrue_b_preshuffleFalse_c_to_ldsFalse_gfx950,0.0,56.5,1295.21
gfx950,256,72,7168,512,False,torch.bfloat16,torch.bfloat16,False,False,asm,4,1,6.6171,_ZN5aiter37bf16gemm_fp32bf16_tn_48x64_pf3_splitkE,0.0,79.87,1276.38
gfx950,256,80,7168,512,False,torch.bfloat16,torch.bfloat16,False,False,asm,4,1,6.5744,_ZN5aiter37bf16gemm_fp32bf16_tn_48x64_pf3_splitkE,0.0,89.32,1303.36
gfx950,256,120,7168,512,False,torch.bfloat16,torch.bfloat16,False,False,flydsl,280,1,6.9203,flydsl_gemm2_abf16_wbf16_bf16_t64x64x128_split_k1_block_m_warp2_block_n_warp2_async_copyTrue_b_to_ldsTrue_b_preshuffleFalse_c_to_ldsFalse_gfx950,0.0,127.28,1327.0
gfx950,256,128,7168,512,False,torch.bfloat16,torch.bfloat16,False,False,triton,0,0,6.3033,auto,0.0,149.05,1476.39
