aiter/configs/model_configs/qwen3_5_397b_fp4_tuned_fmoe.csv
cu_num,token,model_dim,inter_dim,expert,topk,act_type,dtype,q_dtype_a,q_dtype_w,q_type,use_g1u1,doweight_stage1,block_m,ksplit,us1,kernelName1,err1,us2,kernelName2,err2,us,run_1stage,tflops,bw,_tag
256,1,4096,256,512,10,ActivationType.Silu,torch.bfloat16,torch.float4_e2m1fn_x2,torch.float4_e2m1fn_x2,QuantType.per_1x32,1,0,32,0,16.4506,flydsl_moe1_afp4_wfp4_bf16_t32x64x256_w2,0.0%,6.4429,flydsl_moe2_afp4_wfp4_bf16_t32x128x256_atomic,0.1%,22.8935,0,2.75,70352.94,
256,2,4096,256,512,10,ActivationType.Silu,torch.bfloat16,torch.float4_e2m1fn_x2,torch.float4_e2m1fn_x2,QuantType.per_1x32,1,0,32,0,16.384,flydsl_moe1_afp4_wfp4_bf16_t32x64x256_w4,0.0%,8.4925,flydsl_moe2_afp4_wfp4_bf16_t32x128x256_atomic,0.1%,24.8765,0,5.06,64745.33,
256,4,4096,256,512,10,ActivationType.Silu,torch.bfloat16,torch.float4_e2m1fn_x2,torch.float4_e2m1fn_x2,QuantType.per_1x32,1,0,32,0,18.1685,flydsl_moe1_afp4_wfp4_bf16_t32x64x256_w2,0.0%,11.8352,flydsl_moe2_afp4_wfp4_bf16_t32x128x256_atomic,0.1%,30.0037,0,8.39,53682.11,
256,8,4096,256,512,10,ActivationType.Silu,torch.bfloat16,torch.float4_e2m1fn_x2,torch.float4_e2m1fn_x2,QuantType.per_1x32,1,0,32,0,21.8503,flydsl_moe1_afp4_wfp4_bf16_t32x32x256_w3,0.0%,15.5857,flydsl_moe2_afp4_wfp4_bf16_t32x256x256_atomic,0.1%,37.436,0,13.44,43025.72,
256,16,4096,256,512,10,ActivationType.Silu,torch.bfloat16,torch.float4_e2m1fn_x2,torch.float4_e2m1fn_x2,QuantType.per_1x32,1,0,32,0,34.7981,flydsl_moe1_afp4_wfp4_bf16_t32x64x256_w2,0.0%,21.5978,flydsl_moe2_afp4_wfp4_bf16_t32x256x256_atomic,0.2%,56.3959,0,17.85,28562.53,
256,32,4096,256,512,10,ActivationType.Silu,torch.bfloat16,torch.float4_e2m1fn_x2,torch.float4_e2m1fn_x2,QuantType.per_1x32,1,0,32,0,50.2597,flydsl_moe1_afp4_wfp4_bf16_t32x64x256_w2,0.0%,31.5129,flydsl_moe2_afp4_wfp4_bf16_t16x128x256_atomic_persist_sbm32,0.1%,81.7726,0,24.62,19701.05,
256,64,4096,256,512,10,ActivationType.Silu,torch.bfloat16,torch.float4_e2m1fn_x2,torch.float4_e2m1fn_x2,QuantType.per_1x32,1,0,32,0,70.71889999999999,flydsl_moe1_afp4_wfp4_bf16_t32x64x256_w3,0.0%,43.8912,flydsl_moe2_afp4_wfp4_bf16_t32x128x256_atomic_bnt2,0.2%,114.6101,0,35.13,14059.84,
256,128,4096,256,512,10,ActivationType.Silu,torch.bfloat16,torch.float4_e2m1fn_x2,torch.float4_e2m1fn_x2,QuantType.per_1x32,1,0,32,0,87.4931,flydsl_moe1_afp4_wfp4_bf16_t32x32x256_w4,0.0%,53.1125,flydsl_moe2_afp4_wfp4_bf16_t16x256x256_atomic_bnt2_persist_sbm32,0.2%,140.6056,0,57.27,11466.01,
256,256,4096,256,512,10,ActivationType.Silu,torch.bfloat16,torch.float4_e2m1fn_x2,torch.float4_e2m1fn_x2,QuantType.per_1x32,1,0,32,0,95.837,flydsl_moe1_afp4_wfp4_bf16_t32x32x256_w4,0.0%,57.6025,flydsl_moe2_afp4_wfp4_bf16_t16x128x256_atomic_bnt2_sbm32,0.2%,153.4395,0,104.97,10517.23,
256,512,4096,256,512,10,ActivationType.Silu,torch.bfloat16,torch.float4_e2m1fn_x2,torch.float4_e2m1fn_x2,QuantType.per_1x32,1,0,32,0,99.6753,flydsl_moe1_afp4_wfp4_bf16_t32x32x256_w4,0.0%,60.7698,flydsl_moe2_afp4_wfp4_bf16_t16x128x256_atomic_bnt2_persist_sbm32,0.2%,160.4451,0,200.77,10077.62,
256,1024,4096,256,512,10,ActivationType.Silu,torch.bfloat16,torch.float4_e2m1fn_x2,torch.float4_e2m1fn_x2,QuantType.per_1x32,1,0,32,0,110.6725,flydsl_moe1_afp4_wfp4_bf16_t32x64x256_w3,0.0%,81.2088,flydsl_moe2_afp4_wfp4_bf16_t32x128x256_atomic_bnt2,0.2%,191.8813,0,335.75,8459.37,
256,2048,4096,256,512,10,ActivationType.Silu,torch.bfloat16,torch.float4_e2m1fn_x2,torch.float4_e2m1fn_x2,QuantType.per_1x32,1,0,64,0,119.997,flydsl_moe1_afp4_wfp4_bf16_t64x64x256_w4,0.0%,121.9695,flydsl_moe2_afp4_wfp4_bf16_t64x256x256_reduce_bnt2,0.0%,241.9665,0,532.51,6760.35,
256,4096,4096,256,512,10,ActivationType.Silu,torch.bfloat16,torch.float4_e2m1fn_x2,torch.float4_e2m1fn_x2,QuantType.per_1x32,1,0,64,0,149.0609,flydsl_moe1_afp4_wfp4_bf16_t64x128x256_w3_bnt0_xcd4,0.0%,201.2182,flydsl_moe2_afp4_wfp4_bf16_t64x256x256_reduce_persist,0.0%,350.2791,0,735.69,4741.77,
256,8192,4096,256,512,10,ActivationType.Silu,torch.bfloat16,torch.float4_e2m1fn_x2,torch.float4_e2m1fn_x2,QuantType.per_1x32,1,0,64,0,201.6767,flydsl_moe1_afp4_wfp4_bf16_t64x128x256_w2_bnt0_xcd4,0.0%,342.1527,flydsl_moe2_afp4_wfp4_bf16_t64x256x256_reduce_persist,0.0%,543.8294,0,947.72,3146.71,
256,16384,4096,256,512,10,ActivationType.Silu,torch.bfloat16,torch.float4_e2m1fn_x2,torch.float4_e2m1fn_x2,QuantType.per_1x32,1,0,64,0,321.84610000000004,flydsl_moe1_afp4_wfp4_bf16_t64x128x256_w2_bnt0_xcd4,0.0%,664.9736,flydsl_moe2_afp4_wfp4_bf16_t64x256x256_reduce_persist,0.0%,986.8197,0,1044.56,1836.14,
256,32768,4096,256,512,10,ActivationType.Silu,torch.bfloat16,torch.float4_e2m1fn_x2,torch.float4_e2m1fn_x2,QuantType.per_1x32,1,0,128,0,568.1335,flydsl_moe1_afp4_wfp4_bf16_t128x128x256_w2_bnt0_xcd4,0.0%,1325.2201,flydsl_moe2_afp4_wfp4_bf16_t64x256x256_reduce_sbm128,0.0%,1893.3536,0,1088.85,1063.33,
256,1,4096,256,512,10,ActivationType.Silu,torch.bfloat16,torch.float4_e2m1fn_x2,torch.float4_e2m1fn_x2,QuantType.per_1x32,1,0,32,0,16.5743,moe_ck2stages_gemm1_64x32x32x128_1x1_MulABScaleShuffled_v3_Nswizzle0_Quant3_MulRoutedWeight0_silu_FP4X2_FP4X2_B16,0.0,6.4429,moe_ck2stages_gemm2_256x32x128x128_1x4_MulABScaleExpertWeightShuffled_v3_Nswizzle0_Quant3_MulRoutedWeight1_FP4X2_FP4X2_B16,0.0012,23.0172,0,0.0,0.0,flydsl_fallback
256,2,4096,256,512,10,ActivationType.Silu,torch.bfloat16,torch.float4_e2m1fn_x2,torch.float4_e2m1fn_x2,QuantType.per_1x32,1,0,32,0,17.2652,moe_ck2stages_gemm1_64x32x32x128_1x1_MulABScaleShuffled_v3_Nswizzle0_Quant3_MulRoutedWeight0_silu_FP4X2_FP4X2_B16,0.0,8.4925,moe_ck2stages_gemm2_64x32x32x128_1x1_MulABScaleExpertWeightShuffled_v1_Nswizzle0_Quant3_MulRoutedWeight1_FP4X2_FP4X2_B16,0.0013,25.7577,0,0.0,0.0,flydsl_fallback
256,4,4096,256,512,10,ActivationType.Silu,torch.bfloat16,torch.float4_e2m1fn_x2,torch.float4_e2m1fn_x2,QuantType.per_1x32,1,0,32,0,19.4205,moe_ck2stages_gemm1_64x32x32x128_1x1_MulABScaleShuffled_v3_Nswizzle0_Quant3_MulRoutedWeight0_silu_FP4X2_FP4X2_B16,0.0,13.2991,moe_ck2stages_gemm2_64x32x32x128_1x1_MulABScaleExpertWeightShuffled_v1_Nswizzle0_Quant3_MulRoutedWeight1_FP4X2_FP4X2_B16,0.0016,32.7196,0,0.0,0.0,flydsl_fallback
256,8,4096,256,512,10,ActivationType.Silu,torch.bfloat16,torch.float4_e2m1fn_x2,torch.float4_e2m1fn_x2,QuantType.per_1x32,1,0,32,0,23.0803,moe_ck2stages_gemm1_64x32x32x128_1x1_MulABScaleShuffled_v3_Nswizzle0_Quant3_MulRoutedWeight0_silu_FP4X2_FP4X2_B16,0.0,16.2458,moe_ck2stages_gemm2_64x32x32x128_1x1_MulABScaleExpertWeightShuffled_v1_Nswizzle0_Quant3_MulRoutedWeight1_FP4X2_FP4X2_B16,0.0012,39.3261,0,0.0,0.0,flydsl_fallback
256,16,4096,256,512,10,ActivationType.Silu,torch.bfloat16,torch.float4_e2m1fn_x2,torch.float4_e2m1fn_x2,QuantType.per_1x32,1,0,32,0,34.7981,moe_ck2stages_gemm1_64x32x32x128_1x1_MulABScaleShuffled_v3_Nswizzle0_Quant3_MulRoutedWeight0_silu_FP4X2_FP4X2_B16,0.0,22.7451,moe_ck2stages_gemm2_64x32x32x128_1x1_MulABScaleExpertWeightShuffled_v1_Nswizzle0_Quant3_MulRoutedWeight1_FP4X2_FP4X2_B16,0.0015,57.5432,0,0.0,0.0,flydsl_fallback
256,32,4096,256,512,10,ActivationType.Silu,torch.bfloat16,torch.float4_e2m1fn_x2,torch.float4_e2m1fn_x2,QuantType.per_1x32,1,0,32,0,55.099,moe_ck2stages_gemm1_64x32x32x128_1x1_MulABScaleShuffled_v3_Nswizzle0_Quant3_MulRoutedWeight0_silu_FP4X2_FP4X2_B16,0.0,32.8657,moe_ck2stages_gemm2_64x32x32x128_1x1_MulABScaleExpertWeightShuffled_v1_Nswizzle0_Quant3_MulRoutedWeight1_FP4X2_FP4X2_B16,0.0014,87.9647,0,0.0,0.0,flydsl_fallback
256,64,4096,256,512,10,ActivationType.Silu,torch.bfloat16,torch.float4_e2m1fn_x2,torch.float4_e2m1fn_x2,QuantType.per_1x32,1,0,32,0,77.97529999999999,moe_ck2stages_gemm1_64x32x32x128_1x1_MulABScaleShuffled_v3_Nswizzle0_Quant3_MulRoutedWeight0_silu_FP4X2_FP4X2_B16,0.0,43.8912,moe_ck2stages_gemm2_64x32x32x128_1x1_MulABScaleExpertWeightShuffled_v1_Nswizzle0_Quant3_MulRoutedWeight1_FP4X2_FP4X2_B16,0.0017,121.8665,0,0.0,0.0,flydsl_fallback
256,128,4096,256,512,10,ActivationType.Silu,torch.bfloat16,torch.float4_e2m1fn_x2,torch.float4_e2m1fn_x2,QuantType.per_1x32,1,0,32,0,96.8916,moe_ck2stages_gemm1_64x32x32x128_1x1_MulABScaleShuffled_v3_Nswizzle0_Quant3_MulRoutedWeight0_silu_FP4X2_FP4X2_B16,0.0,56.0101,moe_ck2stages_gemm2_64x32x32x128_1x1_MulABScaleExpertWeightShuffled_v1_Nswizzle0_Quant3_MulRoutedWeight1_FP4X2_FP4X2_B16,0.0017,152.9017,0,0.0,0.0,flydsl_fallback
256,256,4096,256,512,10,ActivationType.Silu,torch.bfloat16,torch.float4_e2m1fn_x2,torch.float4_e2m1fn_x2,QuantType.per_1x32,1,0,32,0,106.3327,moe_ck2stages_gemm1_64x32x32x128_1x1_MulABScaleShuffled_v3_Nswizzle0_Quant3_MulRoutedWeight0_silu_FP4X2_FP4X2_B16,0.0,61.2544,moe_ck2stages_gemm2_64x32x32x128_1x1_MulABScaleExpertWeightShuffled_v1_Nswizzle0_Quant3_MulRoutedWeight1_FP4X2_FP4X2_B16,0.0017,167.5871,0,0.0,0.0,flydsl_fallback
256,512,4096,256,512,10,ActivationType.Silu,torch.bfloat16,torch.float4_e2m1fn_x2,torch.float4_e2m1fn_x2,QuantType.per_1x32,1,0,32,0,109.7165,moe_ck2stages_gemm1_64x32x32x128_1x1_MulABScaleShuffled_v3_Nswizzle0_Quant3_MulRoutedWeight0_silu_FP4X2_FP4X2_B16,0.0,67.0832,moe_ck2stages_gemm2_64x32x32x128_1x1_MulABScaleExpertWeightShuffled_v1_Nswizzle0_Quant3_MulRoutedWeight1_FP4X2_FP4X2_B16,0.0017,176.7997,0,0.0,0.0,flydsl_fallback
256,1024,4096,256,512,10,ActivationType.Silu,torch.bfloat16,torch.float4_e2m1fn_x2,torch.float4_e2m1fn_x2,QuantType.per_1x32,1,0,32,0,116.02,moe_ck2stages_gemm1_64x32x32x128_1x1_MulABScaleShuffled_v3_Nswizzle0_Quant3_MulRoutedWeight0_silu_FP4X2_FP4X2_B16,0.0,84.338,moe_ck2stages_gemm2_64x32x32x128_1x1_MulABScaleExpertWeightShuffled_v1_Nswizzle0_Quant3_MulRoutedWeight1_FP4X2_FP4X2_B16,0.0016,200.358,0,0.0,0.0,flydsl_fallback
256,2048,4096,256,512,10,ActivationType.Silu,torch.bfloat16,torch.float4_e2m1fn_x2,torch.float4_e2m1fn_x2,QuantType.per_1x32,1,0,32,0,141.96210000000002,moe_ck2stages_gemm1_64x32x32x128_1x1_MulABScaleShuffled_v3_Nswizzle0_Quant3_MulRoutedWeight0_silu_FP4X2_FP4X2_B16,0.0,148.9518,moe_ck2stages_gemm2_64x32x32x128_1x1_MulABScaleExpertWeightShuffled_v1_Nswizzle0_Quant3_MulRoutedWeight1_FP4X2_FP4X2_B16,0.0017,290.9139,0,0.0,0.0,flydsl_fallback
256,4096,4096,256,512,10,ActivationType.Silu,torch.bfloat16,torch.float4_e2m1fn_x2,torch.float4_e2m1fn_x2,QuantType.per_1x32,1,0,128,0,157.3485,moe_ck2stages_gemm1_256x128x128x128_1x4_MulABScaleShuffled_v3_Nswizzle0_Quant3_MulRoutedWeight0_silu_FP4X2_FP4X2_B16,0.0,295.767,moe_ck2stages_gemm2_64x128x128x128_1x1_MulABScaleExpertWeightShuffled_v3_Nswizzle0_Quant3_MulRoutedWeight1_FP4X2_FP4X2_B16,0.0017,453.1155,0,0.0,0.0,flydsl_fallback
256,8192,4096,256,512,10,ActivationType.Silu,torch.bfloat16,torch.float4_e2m1fn_x2,torch.float4_e2m1fn_x2,QuantType.per_1x32,1,0,128,0,271.8116,moe_ck2stages_gemm1_256x128x128x128_1x4_MulABScaleShuffled_v3_Nswizzle0_Quant3_MulRoutedWeight0_silu_FP4X2_FP4X2_B16,0.0,548.1027,moe_ck2stages_gemm2_64x128x128x128_1x1_MulABScaleExpertWeightShuffled_v3_Nswizzle0_Quant3_MulRoutedWeight1_FP4X2_FP4X2_B16,0.0016,819.9143,0,0.0,0.0,flydsl_fallback
256,16384,4096,256,512,10,ActivationType.Silu,torch.bfloat16,torch.float4_e2m1fn_x2,torch.float4_e2m1fn_x2,QuantType.per_1x32,1,0,128,0,424.6578,moe_ck2stages_gemm1_256x128x128x128_1x4_MulABScaleShuffled_v3_Nswizzle0_Quant3_MulRoutedWeight0_silu_FP4X2_FP4X2_B16,0.0,1053.187,moe_ck2stages_gemm2_64x128x128x128_1x1_MulABScaleExpertWeightShuffled_v3_Nswizzle0_Quant3_MulRoutedWeight1_FP4X2_FP4X2_B16,0.0017,1477.8448,0,0.0,0.0,flydsl_fallback
256,32768,4096,256,512,10,ActivationType.Silu,torch.bfloat16,torch.float4_e2m1fn_x2,torch.float4_e2m1fn_x2,QuantType.per_1x32,1,0,128,0,667.0119,moe_ck2stages_gemm1_256x128x128x128_1x4_MulABScaleShuffled_v3_Nswizzle0_Quant3_MulRoutedWeight0_silu_FP4X2_FP4X2_B16,0.0,2099.58,moe_ck2stages_gemm2_64x128x128x128_1x1_MulABScaleExpertWeightShuffled_v3_Nswizzle0_Quant3_MulRoutedWeight1_FP4X2_FP4X2_B16,0.0017,2766.5919,0,0.0,0.0,flydsl_fallback
