aiter/configs/model_configs/qwen3next_80b_fp8_tuned_fmoe.csv
cu_num,token,model_dim,inter_dim,expert,topk,act_type,dtype,q_dtype_a,q_dtype_w,q_type,use_g1u1,doweight_stage1,block_m,ksplit,us1,kernelName1,err1,us2,kernelName2,err2,us,run_1stage,xbf16,tflops,bw,_tag
256,1,2048,512,512,10,ActivationType.Silu,torch.bfloat16,torch.float8_e4m3fn,torch.float8_e4m3fn,QuantType.per_1x128,1,0,16,0,23.9614,_ZN5aiter48fmoe_bf16_blockscaleBf16_g1u1_vs_pf2_silu_16x128E,0.0%,0.0,,0.0%,23.9614,1,1,2.63,67217.23,
256,2,2048,512,512,10,ActivationType.Silu,torch.bfloat16,torch.float8_e4m3fn,torch.float8_e4m3fn,QuantType.per_1x128,1,0,16,0,25.0894,_ZN5aiter48fmoe_bf16_blockscaleBf16_g1u1_vs_pf2_silu_16x128E,0.0%,0.0,,0.0%,25.0894,1,1,5.02,64195.44,
256,4,2048,512,512,10,ActivationType.Silu,torch.bfloat16,torch.float8_e4m3fn,torch.float8_e4m3fn,QuantType.per_1x128,1,0,16,0,29.862,_ZN5aiter48fmoe_bf16_blockscaleBf16_g1u1_vs_pf2_silu_16x128E,0.0%,0.0,,0.0%,29.862,1,1,8.43,53936.02,
256,8,2048,512,512,10,ActivationType.Silu,torch.bfloat16,torch.float8_e4m3fn,torch.float8_e4m3fn,QuantType.per_1x128,1,0,32,0,51.7372,_ZN5aiter47fmoe_bf16_blockscaleBf16_g1u1_vs_ps_silu_32x256E,0.0%,0.0,,0.0%,51.7372,1,1,9.73,31131.6,
256,16,2048,512,512,10,ActivationType.Silu,torch.bfloat16,torch.float8_e4m3fn,torch.float8_e4m3fn,QuantType.per_1x128,1,0,16,0,91.5941,_ZN5aiter48fmoe_bf16_blockscaleBf16_g1u1_vs_pf2_silu_16x128E,0.0%,0.0,,0.0%,91.5941,1,1,10.99,17585.31,
256,32,2048,512,512,10,ActivationType.Silu,torch.bfloat16,torch.float8_e4m3fn,torch.float8_e4m3fn,QuantType.per_1x128,1,0,32,0,139.1285,_ZN5aiter47fmoe_bf16_blockscaleBf16_g1u1_vs_ps_silu_32x256E,0.0%,0.0,,0.0%,139.1285,1,1,14.47,11577.85,
256,64,2048,512,512,10,ActivationType.Silu,torch.bfloat16,torch.float8_e4m3fn,torch.float8_e4m3fn,QuantType.per_1x128,1,0,16,0,210.0949,_ZN5aiter48fmoe_bf16_blockscaleBf16_g1u1_vs_pf2_silu_16x128E,0.0%,0.0,,0.0%,210.0949,1,1,19.17,7667.99,
256,128,2048,512,512,10,ActivationType.Silu,torch.bfloat16,torch.float8_e4m3fn,torch.float8_e4m3fn,QuantType.per_1x128,1,0,32,0,268.7429,_ZN5aiter47fmoe_bf16_blockscaleBf16_g1u1_vs_ps_silu_32x256E,0.0%,0.0,,0.0%,268.7429,1,1,29.97,5996.06,
256,256,2048,512,512,10,ActivationType.Silu,torch.bfloat16,torch.float8_e4m3fn,torch.float8_e4m3fn,QuantType.per_1x128,1,0,32,0,304.2347,_ZN5aiter47fmoe_bf16_blockscaleBf16_g1u1_vs_ps_silu_32x256E,0.0%,0.0,,0.0%,304.2347,1,1,52.94,5299.15,
256,512,2048,512,512,10,ActivationType.Silu,torch.bfloat16,torch.float8_e4m3fn,torch.float8_e4m3fn,QuantType.per_1x128,1,0,64,0,315.8708,_ZN5aiter46fmoe_bf16_blockscaleFp8_g1u1_vs_ps_silu_64x256E,0.0%,0.0,,0.0%,315.8708,1,0,101.98,5108.92,
256,1024,2048,512,512,10,ActivationType.Silu,torch.bfloat16,torch.float8_e4m3fn,torch.float8_e4m3fn,QuantType.per_1x128,1,0,64,0,321.7681,_ZN5aiter46fmoe_bf16_blockscaleFp8_g1u1_vs_ps_silu_64x256E,0.0%,0.0,,0.0%,321.7681,1,0,200.22,5025.06,
256,2048,2048,512,512,10,ActivationType.Silu,torch.bfloat16,torch.float8_e4m3fn,torch.float8_e4m3fn,QuantType.per_1x128,1,0,64,0,349.4413,_ZN5aiter46fmoe_bf16_blockscaleFp8_g1u1_vs_ps_silu_64x256E,0.0%,0.0,,0.0%,349.4413,1,0,368.73,4645.12,
256,4096,2048,512,512,10,ActivationType.Silu,torch.bfloat16,torch.float8_e4m3fn,torch.float8_e4m3fn,QuantType.per_1x128,1,0,64,0,486.1015,_ZN5aiter46fmoe_bf16_blockscaleFp8_g1u1_vs_ps_silu_64x256E,0.0%,0.0,,0.0%,486.1015,1,0,530.13,3365.1,
256,8192,2048,512,512,10,ActivationType.Silu,torch.bfloat16,torch.float8_e4m3fn,torch.float8_e4m3fn,QuantType.per_1x128,1,0,64,0,778.0019,_ZN5aiter46fmoe_bf16_blockscaleFp8_g1u1_vs_ps_silu_64x256E,0.0%,0.0,,0.0%,778.0019,1,0,662.46,2134.88,
256,16384,2048,512,512,10,ActivationType.Silu,torch.bfloat16,torch.float8_e4m3fn,torch.float8_e4m3fn,QuantType.per_1x128,1,0,64,0,1361.5884999999998,_ZN5aiter46fmoe_bf16_blockscaleFp8_g1u1_vs_ps_silu_64x256E,0.0%,0.0,,0.0%,1361.5885,1,0,757.05,1256.82,
256,32768,2048,512,512,10,ActivationType.Silu,torch.bfloat16,torch.float8_e4m3fn,torch.float8_e4m3fn,QuantType.per_1x128,1,0,64,0,2752.8245,_ZN5aiter46fmoe_bf16_blockscaleFp8_g1u1_vs_ps_silu_64x256E,0.0%,0.0,,0.0%,2752.8245,1,0,748.9,658.21,
256,1,2048,512,513,11,ActivationType.Silu,torch.bfloat16,torch.float8_e4m3fn,torch.float8_e4m3fn,QuantType.per_1x128,1,0,16,0,24.0684,_ZN5aiter48fmoe_bf16_blockscaleBf16_g1u1_vs_pf2_silu_16x128E,0.0%,0.0,,0.0%,24.0684,1,1,2.88,67049.1,
256,2,2048,512,513,11,ActivationType.Silu,torch.bfloat16,torch.float8_e4m3fn,torch.float8_e4m3fn,QuantType.per_1x128,1,0,16,0,25.7081,_ZN5aiter48fmoe_bf16_blockscaleBf16_g1u1_vs_pf2_silu_16x128E,0.0%,0.0,,0.0%,25.7081,1,1,5.38,62772.85,
256,4,2048,512,513,11,ActivationType.Silu,torch.bfloat16,torch.float8_e4m3fn,torch.float8_e4m3fn,QuantType.per_1x128,1,0,16,0,34.0827,_ZN5aiter48fmoe_bf16_blockscaleBf16_g1u1_vs_pf2_silu_16x128E,0.0%,0.0,,0.0%,34.0827,1,1,8.12,47349.04,
256,8,2048,512,513,11,ActivationType.Silu,torch.bfloat16,torch.float8_e4m3fn,torch.float8_e4m3fn,QuantType.per_1x128,1,0,32,0,59.2809,_ZN5aiter47fmoe_bf16_blockscaleBf16_g1u1_vs_ps_silu_32x256E,0.0%,0.0,,0.0%,59.2809,1,1,9.34,27223.06,
256,16,2048,512,513,11,ActivationType.Silu,torch.bfloat16,torch.float8_e4m3fn,torch.float8_e4m3fn,QuantType.per_1x128,1,0,16,0,94.1309,_ZN5aiter48fmoe_bf16_blockscaleBf16_g1u1_vs_pf2_silu_16x128E,0.0%,0.0,,0.0%,94.1309,1,1,11.76,17144.81,
256,32,2048,512,513,11,ActivationType.Silu,torch.bfloat16,torch.float8_e4m3fn,torch.float8_e4m3fn,QuantType.per_1x128,1,0,16,0,145.2844,_ZN5aiter48fmoe_bf16_blockscaleBf16_g1u1_vs_pf2_silu_16x128E,0.0%,0.0,,0.0%,145.2844,1,1,15.24,11108.94,
256,64,2048,512,513,11,ActivationType.Silu,torch.bfloat16,torch.float8_e4m3fn,torch.float8_e4m3fn,QuantType.per_1x128,1,0,16,0,229.9116,_ZN5aiter48fmoe_bf16_blockscaleBf16_g1u1_vs_pf2_silu_16x128E,0.0%,0.0,,0.0%,229.9116,1,1,19.26,7020.75,
256,128,2048,512,513,11,ActivationType.Silu,torch.bfloat16,torch.float8_e4m3fn,torch.float8_e4m3fn,QuantType.per_1x128,1,0,32,0,279.3343,_ZN5aiter47fmoe_bf16_blockscaleBf16_g1u1_vs_ps_silu_32x256E,0.0%,0.0,,0.0%,279.3343,1,1,31.71,5779.97,
256,256,2048,512,513,11,ActivationType.Silu,torch.bfloat16,torch.float8_e4m3fn,torch.float8_e4m3fn,QuantType.per_1x128,1,0,32,0,301.1938,_ZN5aiter47fmoe_bf16_blockscaleBf16_g1u1_vs_ps_silu_32x256E,0.0%,0.0,,0.0%,301.1938,1,1,58.82,5363.1,
256,512,2048,512,513,11,ActivationType.Silu,torch.bfloat16,torch.float8_e4m3fn,torch.float8_e4m3fn,QuantType.per_1x128,1,0,64,0,322.25699999999995,_ZN5aiter46fmoe_bf16_blockscaleFp8_g1u1_vs_ps_silu_64x256E,0.0%,0.0,,0.0%,322.257,1,0,109.95,5017.44,
256,1024,2048,512,513,11,ActivationType.Silu,torch.bfloat16,torch.float8_e4m3fn,torch.float8_e4m3fn,QuantType.per_1x128,1,0,32,0,223.3849,moe_ck2stages_gemm1_256x32x128x128_1x4_MulABScaleExpertWeightA8W8blkscale_v1_Nswizzle0_Quant4_MulRoutedWeight0_silu_F8_F8_B16,0.1%,114.2833,moe_ck2stages_gemm2_256x32x128x128_1x4_MulABScaleExpertWeightA8W8blkscale_v1_Nswizzle0_Quant4_MulRoutedWeight1_F8_F8_B16,18.6%,337.6682,0,0,209.87,4797.76,
256,2048,2048,512,513,11,ActivationType.Silu,torch.bfloat16,torch.float8_e4m3fn,torch.float8_e4m3fn,QuantType.per_1x128,1,0,64,0,370.0069,_ZN5aiter46fmoe_bf16_blockscaleFp8_g1u1_vs_ps_silu_64x256E,0.0%,0.0,,0.0%,370.0069,1,0,383.06,4395.44,
256,4096,2048,512,513,11,ActivationType.Silu,torch.bfloat16,torch.float8_e4m3fn,torch.float8_e4m3fn,QuantType.per_1x128,1,0,64,0,504.2974,_ZN5aiter46fmoe_bf16_blockscaleFp8_g1u1_vs_ps_silu_64x256E,0.0%,0.0,,0.0%,504.2974,1,0,562.1,3249.92,
256,8192,2048,512,513,11,ActivationType.Silu,torch.bfloat16,torch.float8_e4m3fn,torch.float8_e4m3fn,QuantType.per_1x128,1,0,64,0,808.2662,_ZN5aiter46fmoe_bf16_blockscaleFp8_g1u1_vs_ps_silu_64x256E,0.0%,0.0,,0.0%,808.2662,1,0,701.42,2058.84,
256,16384,2048,512,513,11,ActivationType.Silu,torch.bfloat16,torch.float8_e4m3fn,torch.float8_e4m3fn,QuantType.per_1x128,1,0,64,0,1497.8295,_ZN5aiter46fmoe_bf16_blockscaleFp8_g1u1_vs_ps_silu_64x256E,0.0%,0.0,,0.0%,1497.8295,1,0,757.01,1144.6,
256,32768,2048,512,513,11,ActivationType.Silu,torch.bfloat16,torch.float8_e4m3fn,torch.float8_e4m3fn,QuantType.per_1x128,1,0,64,0,2924.6331,_ZN5aiter46fmoe_bf16_blockscaleFp8_g1u1_vs_ps_silu_64x256E,0.0%,0.0,,0.0%,2924.6331,1,0,775.39,620.62,
256,1,2048,256,512,10,ActivationType.Silu,torch.bfloat16,torch.float8_e4m3fn,torch.float8_e4m3fn,QuantType.per_1x128,1,0,16,0,23.4143,_ZN5aiter48fmoe_bf16_blockscaleBf16_g1u1_vs_pf2_silu_16x128E,0.0%,0.0,,0.0%,23.4143,1,1,1.34,34394.05,
256,2,2048,256,512,10,ActivationType.Silu,torch.bfloat16,torch.float8_e4m3fn,torch.float8_e4m3fn,QuantType.per_1x128,1,0,16,0,23.799,_ZN5aiter48fmoe_bf16_blockscaleBf16_g1u1_vs_pf2_silu_16x128E,0.0%,0.0,,0.0%,23.799,1,1,2.64,33838.34,
256,4,2048,256,512,10,ActivationType.Silu,torch.bfloat16,torch.float8_e4m3fn,torch.float8_e4m3fn,QuantType.per_1x128,1,0,16,0,25.2122,_ZN5aiter48fmoe_bf16_blockscaleBf16_g1u1_vs_pf2_silu_16x128E,0.0%,0.0,,0.0%,25.2122,1,1,4.99,31942.11,
256,8,2048,256,512,10,ActivationType.Silu,torch.bfloat16,torch.float8_e4m3fn,torch.float8_e4m3fn,QuantType.per_1x128,1,0,16,0,31.9615,_ZN5aiter48fmoe_bf16_blockscaleBf16_g1u1_vs_pf2_silu_16x128E,0.0%,0.0,,0.0%,31.9615,1,1,7.87,25197.68,
256,16,2048,256,512,10,ActivationType.Silu,torch.bfloat16,torch.float8_e4m3fn,torch.float8_e4m3fn,QuantType.per_1x128,1,0,32,0,52.8053,_ZN5aiter47fmoe_bf16_blockscaleBf16_g1u1_vs_ps_silu_32x256E,0.0%,0.0,,0.0%,52.8053,1,1,9.53,15252.35,
256,32,2048,256,512,10,ActivationType.Silu,torch.bfloat16,torch.float8_e4m3fn,torch.float8_e4m3fn,QuantType.per_1x128,1,0,16,0,74.8045,_ZN5aiter48fmoe_bf16_blockscaleBf16_g1u1_vs_pf2_silu_16x128E,0.0%,0.0,,0.0%,74.8045,1,1,13.46,10768.11,
256,64,2048,256,512,10,ActivationType.Silu,torch.bfloat16,torch.float8_e4m3fn,torch.float8_e4m3fn,QuantType.per_1x128,1,0,16,0,110.1294,_ZN5aiter48fmoe_bf16_blockscaleBf16_g1u1_vs_pf2_silu_16x128E,0.0%,0.0,,0.0%,110.1294,1,1,18.28,7315.94,
256,128,2048,256,512,10,ActivationType.Silu,torch.bfloat16,torch.float8_e4m3fn,torch.float8_e4m3fn,QuantType.per_1x128,1,0,32,0,142.7148,_ZN5aiter47fmoe_bf16_blockscaleBf16_g1u1_vs_ps_silu_32x256E,0.0%,0.0,,0.0%,142.7148,1,1,28.21,5648.28,
256,256,2048,256,512,10,ActivationType.Silu,torch.bfloat16,torch.float8_e4m3fn,torch.float8_e4m3fn,QuantType.per_1x128,1,0,32,0,153.8389,_ZN5aiter47fmoe_bf16_blockscaleBf16_g1u1_vs_ps_silu_32x256E,0.0%,0.0,,0.0%,153.8389,1,1,52.35,5244.96,
256,512,2048,256,512,10,ActivationType.Silu,torch.bfloat16,torch.float8_e4m3fn,torch.float8_e4m3fn,QuantType.per_1x128,1,0,64,0,158.2988,_ZN5aiter46fmoe_bf16_blockscaleFp8_g1u1_vs_ps_silu_64x256E,0.0%,0.0,,0.0%,158.2988,1,0,101.75,5107.13,
256,1024,2048,256,512,10,ActivationType.Silu,torch.bfloat16,torch.float8_e4m3fn,torch.float8_e4m3fn,QuantType.per_1x128,1,0,64,0,164.5528,_ZN5aiter46fmoe_bf16_blockscaleFp8_g1u1_vs_ps_silu_64x256E,0.0%,0.0,,0.0%,164.5528,1,0,195.76,4932.14,
256,2048,2048,256,512,10,ActivationType.Silu,torch.bfloat16,torch.float8_e4m3fn,torch.float8_e4m3fn,QuantType.per_1x128,1,0,64,0,182.1152,_ZN5aiter46fmoe_bf16_blockscaleFp8_g1u1_vs_ps_silu_64x256E,0.0%,0.0,,0.0%,182.1152,1,0,353.76,4491.05,
256,4096,2048,256,512,10,ActivationType.Silu,torch.bfloat16,torch.float8_e4m3fn,torch.float8_e4m3fn,QuantType.per_1x128,1,0,64,0,257.8256,_ZN5aiter46fmoe_bf16_blockscaleFp8_g1u1_vs_ps_silu_64x256E,0.0%,0.0,,0.0%,257.8256,1,0,499.75,3221.06,
256,8192,2048,256,512,10,ActivationType.Silu,torch.bfloat16,torch.float8_e4m3fn,torch.float8_e4m3fn,QuantType.per_1x128,1,0,64,0,413.7365,_ZN5aiter46fmoe_bf16_blockscaleFp8_g1u1_vs_ps_silu_64x256E,0.0%,0.0,,0.0%,413.7365,1,0,622.86,2068.07,
256,16384,2048,256,512,10,ActivationType.Silu,torch.bfloat16,torch.float8_e4m3fn,torch.float8_e4m3fn,QuantType.per_1x128,1,0,64,0,733.6064,_ZN5aiter46fmoe_bf16_blockscaleFp8_g1u1_vs_ps_silu_64x256E,0.0%,0.0,,0.0%,733.6064,1,0,702.55,1234.95,
256,32768,2048,256,512,10,ActivationType.Silu,torch.bfloat16,torch.float8_e4m3fn,torch.float8_e4m3fn,QuantType.per_1x128,1,0,64,0,1410.5906,_ZN5aiter46fmoe_bf16_blockscaleFp8_g1u1_vs_ps_silu_64x256E,0.0%,0.0,,0.0%,1410.5906,1,0,730.75,713.63,
256,1,2048,256,513,11,ActivationType.Silu,torch.bfloat16,torch.float8_e4m3fn,torch.float8_e4m3fn,QuantType.per_1x128,1,0,16,0,23.1749,_ZN5aiter48fmoe_bf16_blockscaleBf16_g1u1_vs_pf2_silu_16x128E,0.0%,0.0,,0.0%,23.1749,1,1,1.49,34817.21,
256,2,2048,256,513,11,ActivationType.Silu,torch.bfloat16,torch.float8_e4m3fn,torch.float8_e4m3fn,QuantType.per_1x128,1,0,16,0,24.0101,_ZN5aiter48fmoe_bf16_blockscaleBf16_g1u1_vs_pf2_silu_16x128E,0.0%,0.0,,0.0%,24.0101,1,1,2.88,33606.34,
256,4,2048,256,513,11,ActivationType.Silu,torch.bfloat16,torch.float8_e4m3fn,torch.float8_e4m3fn,QuantType.per_1x128,1,0,16,0,26.034,_ZN5aiter48fmoe_bf16_blockscaleBf16_g1u1_vs_pf2_silu_16x128E,0.0%,0.0,,0.0%,26.034,1,1,5.32,30994.23,
256,8,2048,256,513,11,ActivationType.Silu,torch.bfloat16,torch.float8_e4m3fn,torch.float8_e4m3fn,QuantType.per_1x128,1,0,16,0,31.9162,_ZN5aiter48fmoe_bf16_blockscaleBf16_g1u1_vs_pf2_silu_16x128E,0.0%,0.0,,0.0%,31.9162,1,1,8.67,25282.72,
256,16,2048,256,513,11,ActivationType.Silu,torch.bfloat16,torch.float8_e4m3fn,torch.float8_e4m3fn,QuantType.per_1x128,1,0,32,0,52.4307,_ZN5aiter47fmoe_bf16_blockscaleBf16_g1u1_vs_ps_silu_32x256E,0.0%,0.0,,0.0%,52.4307,1,1,10.56,15391.32,
256,32,2048,256,513,11,ActivationType.Silu,torch.bfloat16,torch.float8_e4m3fn,torch.float8_e4m3fn,QuantType.per_1x128,1,0,16,0,77.2154,_ZN5aiter48fmoe_bf16_blockscaleBf16_g1u1_vs_pf2_silu_16x128E,0.0%,0.0,,0.0%,77.2154,1,1,14.34,10452.27,
256,64,2048,256,513,11,ActivationType.Silu,torch.bfloat16,torch.float8_e4m3fn,torch.float8_e4m3fn,QuantType.per_1x128,1,0,16,0,112.3662,_ZN5aiter48fmoe_bf16_blockscaleBf16_g1u1_vs_pf2_silu_16x128E,0.0%,0.0,,0.0%,112.3662,1,1,19.71,7184.3,
256,128,2048,256,513,11,ActivationType.Silu,torch.bfloat16,torch.float8_e4m3fn,torch.float8_e4m3fn,QuantType.per_1x128,1,0,32,0,145.3609,_ZN5aiter47fmoe_bf16_blockscaleBf16_g1u1_vs_ps_silu_32x256E,0.0%,0.0,,0.0%,145.3609,1,1,30.47,5556.28,
256,256,2048,256,513,11,ActivationType.Silu,torch.bfloat16,torch.float8_e4m3fn,torch.float8_e4m3fn,QuantType.per_1x128,1,0,64,0,154.8814,_ZN5aiter46fmoe_bf16_blockscaleFp8_g1u1_vs_ps_silu_64x256E,0.0%,0.0,,0.0%,154.8814,1,0,57.19,5219.81,
256,512,2048,256,513,11,ActivationType.Silu,torch.bfloat16,torch.float8_e4m3fn,torch.float8_e4m3fn,QuantType.per_1x128,1,0,32,0,172.622,_ZN5aiter47fmoe_bf16_blockscaleBf16_g1u1_vs_ps_silu_32x256E,0.0%,0.0,,0.0%,172.622,1,1,102.63,4692.48,
256,1024,2048,256,513,11,ActivationType.Silu,torch.bfloat16,torch.float8_e4m3fn,torch.float8_e4m3fn,QuantType.per_1x128,1,0,32,0,123.6434,moe_ck2stages_gemm1_256x32x128x128_1x4_MulABScaleExpertWeightA8W8blkscale_v1_Nswizzle0_Quant4_MulRoutedWeight0_silu_F8_F8_B16,0.1%,61.0437,moe_ck2stages_gemm2_256x32x128x128_1x4_MulABScaleExpertWeightA8W8blkscale_v1_Nswizzle0_Quant4_MulRoutedWeight1_F8_F8_B16,18.5%,184.6871,0,0,191.86,4402.96,
256,2048,2048,256,513,11,ActivationType.Silu,torch.bfloat16,torch.float8_e4m3fn,torch.float8_e4m3fn,QuantType.per_1x128,1,0,64,0,211.3189,_ZN5aiter46fmoe_bf16_blockscaleFp8_g1u1_vs_ps_silu_64x256E,0.0%,0.0,,0.0%,211.3189,1,0,335.36,3877.85,
256,4096,2048,256,513,11,ActivationType.Silu,torch.bfloat16,torch.float8_e4m3fn,torch.float8_e4m3fn,QuantType.per_1x128,1,0,64,0,260.3115,_ZN5aiter46fmoe_bf16_blockscaleFp8_g1u1_vs_ps_silu_64x256E,0.0%,0.0,,0.0%,260.3115,1,0,544.48,3196.34,
256,8192,2048,256,513,11,ActivationType.Silu,torch.bfloat16,torch.float8_e4m3fn,torch.float8_e4m3fn,QuantType.per_1x128,1,0,64,0,425.2727,_ZN5aiter46fmoe_bf16_blockscaleFp8_g1u1_vs_ps_silu_64x256E,0.0%,0.0,,0.0%,425.2727,1,0,666.56,2015.67,
256,16384,2048,256,513,11,ActivationType.Silu,torch.bfloat16,torch.float8_e4m3fn,torch.float8_e4m3fn,QuantType.per_1x128,1,0,64,0,810.1216999999999,_ZN5aiter46fmoe_bf16_blockscaleFp8_g1u1_vs_ps_silu_64x256E,0.0%,0.0,,0.0%,810.1217,1,0,699.82,1120.25,
256,32768,2048,256,513,11,ActivationType.Silu,torch.bfloat16,torch.float8_e4m3fn,torch.float8_e4m3fn,QuantType.per_1x128,1,0,64,0,1526.0958,_ZN5aiter46fmoe_bf16_blockscaleFp8_g1u1_vs_ps_silu_64x256E,0.0%,0.0,,0.0%,1526.0958,1,0,742.99,660.64,
256,1,2048,128,512,10,ActivationType.Silu,torch.bfloat16,torch.float8_e4m3fn,torch.float8_e4m3fn,QuantType.per_1x128,1,0,16,0,23.2506,_ZN5aiter48fmoe_bf16_blockscaleBf16_g1u1_vs_pf2_silu_16x128E,0.0%,0.0,,0.0%,23.2506,1,1,0.68,17318.23,
256,2,2048,128,512,10,ActivationType.Silu,torch.bfloat16,torch.float8_e4m3fn,torch.float8_e4m3fn,QuantType.per_1x128,1,0,16,0,23.2039,_ZN5aiter48fmoe_bf16_blockscaleBf16_g1u1_vs_pf2_silu_16x128E,0.0%,0.0,,0.0%,23.2039,1,1,1.36,17353.35,
256,4,2048,128,512,10,ActivationType.Silu,torch.bfloat16,torch.float8_e4m3fn,torch.float8_e4m3fn,QuantType.per_1x128,1,0,16,0,23.7753,_ZN5aiter48fmoe_bf16_blockscaleBf16_g1u1_vs_pf2_silu_16x128E,0.0%,0.0,,0.0%,23.7753,1,1,2.65,16936.81,
256,8,2048,128,512,10,ActivationType.Silu,torch.bfloat16,torch.float8_e4m3fn,torch.float8_e4m3fn,QuantType.per_1x128,1,0,16,0,25.4387,_ZN5aiter48fmoe_bf16_blockscaleBf16_g1u1_vs_pf2_silu_16x128E,0.0%,0.0,,0.0%,25.4387,1,1,4.95,15830.3,
256,16,2048,128,512,10,ActivationType.Silu,torch.bfloat16,torch.float8_e4m3fn,torch.float8_e4m3fn,QuantType.per_1x128,1,0,16,0,30.2337,_ZN5aiter48fmoe_bf16_blockscaleBf16_g1u1_vs_pf2_silu_16x128E,0.0%,0.0,,0.0%,30.2337,1,1,8.32,13321.28,
256,32,2048,128,512,10,ActivationType.Silu,torch.bfloat16,torch.float8_e4m3fn,torch.float8_e4m3fn,QuantType.per_1x128,1,0,16,0,40.8084,_ZN5aiter48fmoe_bf16_blockscaleBf16_g1u1_vs_pf2_silu_16x128E,0.0%,0.0,,0.0%,40.8084,1,1,12.33,9871.74,
256,64,2048,128,512,10,ActivationType.Silu,torch.bfloat16,torch.float8_e4m3fn,torch.float8_e4m3fn,QuantType.per_1x128,1,0,32,0,62.3622,_ZN5aiter47fmoe_bf16_blockscaleBf16_g1u1_vs_ps_silu_32x128E,0.0%,0.0,,0.0%,62.3622,1,1,16.14,6462.99,
256,128,2048,128,512,10,ActivationType.Silu,torch.bfloat16,torch.float8_e4m3fn,torch.float8_e4m3fn,QuantType.per_1x128,1,0,16,0,72.2901,_ZN5aiter48fmoe_bf16_blockscaleBf16_g1u1_vs_pf2_silu_16x128E,0.0%,0.0,,0.0%,72.2901,1,1,27.85,5580.84,
256,256,2048,128,512,10,ActivationType.Silu,torch.bfloat16,torch.float8_e4m3fn,torch.float8_e4m3fn,QuantType.per_1x128,1,0,64,0,89.9481,_ZN5aiter46fmoe_bf16_blockscaleFp8_g1u1_vs_ps_silu_64x128E,0.0%,0.0,,0.0%,89.9481,1,0,44.77,4493.99,
256,512,2048,128,512,10,ActivationType.Silu,torch.bfloat16,torch.float8_e4m3fn,torch.float8_e4m3fn,QuantType.per_1x128,1,0,64,0,92.0022,_ZN5aiter46fmoe_bf16_blockscaleFp8_g1u1_vs_ps_silu_64x128E,0.0%,0.0,,0.0%,92.0022,1,0,87.53,4410.75,
256,1024,2048,128,512,10,ActivationType.Silu,torch.bfloat16,torch.float8_e4m3fn,torch.float8_e4m3fn,QuantType.per_1x128,1,0,64,0,98.7766,_ZN5aiter46fmoe_bf16_blockscaleFp8_g1u1_vs_ps_silu_64x128E,0.0%,0.0,,0.0%,98.7766,1,0,163.06,4140.1,
256,2048,2048,128,512,10,ActivationType.Silu,torch.bfloat16,torch.float8_e4m3fn,torch.float8_e4m3fn,QuantType.per_1x128,1,0,64,0,128.3825,_ZN5aiter46fmoe_bf16_blockscaleFp8_g1u1_vs_ps_silu_64x128E,0.0%,0.0,,0.0%,128.3825,1,0,250.91,3234.37,
256,4096,2048,128,512,10,ActivationType.Silu,torch.bfloat16,torch.float8_e4m3fn,torch.float8_e4m3fn,QuantType.per_1x128,1,0,64,0,205.5035,_ZN5aiter46fmoe_bf16_blockscaleFp8_g1u1_vs_ps_silu_64x128E,0.0%,0.0,,0.0%,205.5035,1,0,313.5,2081.81,
256,8192,2048,128,512,10,ActivationType.Silu,torch.bfloat16,torch.float8_e4m3fn,torch.float8_e4m3fn,QuantType.per_1x128,1,0,64,0,350.1335,_ZN5aiter46fmoe_bf16_blockscaleFp8_g1u1_vs_ps_silu_64x128E,0.0%,0.0,,0.0%,350.1335,1,0,368.0,1293.75,
256,16384,2048,128,512,10,ActivationType.Silu,torch.bfloat16,torch.float8_e4m3fn,torch.float8_e4m3fn,QuantType.per_1x128,1,0,64,0,638.0503,_ZN5aiter46fmoe_bf16_blockscaleFp8_g1u1_vs_ps_silu_64x128E,0.0%,0.0,,0.0%,638.0503,1,0,403.88,788.84,
256,32768,2048,128,512,10,ActivationType.Silu,torch.bfloat16,torch.float8_e4m3fn,torch.float8_e4m3fn,QuantType.per_1x128,1,0,64,0,1218.9199,_ZN5aiter46fmoe_bf16_blockscaleFp8_g1u1_vs_ps_silu_64x128E,0.0%,0.0,,0.0%,1218.9199,1,0,422.83,495.5,
256,1,2048,128,513,11,ActivationType.Silu,torch.bfloat16,torch.float8_e4m3fn,torch.float8_e4m3fn,QuantType.per_1x128,1,0,16,0,23.0488,_ZN5aiter48fmoe_bf16_blockscaleBf16_g1u1_vs_pf2_silu_16x128E,0.0%,0.0,,0.0%,23.0488,1,1,0.75,17503.98,
256,2,2048,128,513,11,ActivationType.Silu,torch.bfloat16,torch.float8_e4m3fn,torch.float8_e4m3fn,QuantType.per_1x128,1,0,16,0,23.2659,_ZN5aiter48fmoe_bf16_blockscaleBf16_g1u1_vs_pf2_silu_16x128E,0.0%,0.0,,0.0%,23.2659,1,1,1.49,17340.91,
256,4,2048,128,513,11,ActivationType.Silu,torch.bfloat16,torch.float8_e4m3fn,torch.float8_e4m3fn,QuantType.per_1x128,1,0,16,0,23.6299,_ZN5aiter48fmoe_bf16_blockscaleBf16_g1u1_vs_pf2_silu_16x128E,0.0%,0.0,,0.0%,23.6299,1,1,2.93,17074.31,
256,8,2048,128,513,11,ActivationType.Silu,torch.bfloat16,torch.float8_e4m3fn,torch.float8_e4m3fn,QuantType.per_1x128,1,0,16,0,25.375,_ZN5aiter48fmoe_bf16_blockscaleBf16_g1u1_vs_pf2_silu_16x128E,0.0%,0.0,,0.0%,25.375,1,1,5.45,15901.04,
256,16,2048,128,513,11,ActivationType.Silu,torch.bfloat16,torch.float8_e4m3fn,torch.float8_e4m3fn,QuantType.per_1x128,1,0,16,0,30.9087,_ZN5aiter48fmoe_bf16_blockscaleBf16_g1u1_vs_pf2_silu_16x128E,0.0%,0.0,,0.0%,30.9087,1,1,8.96,13055.8,
256,32,2048,128,513,11,ActivationType.Silu,torch.bfloat16,torch.float8_e4m3fn,torch.float8_e4m3fn,QuantType.per_1x128,1,0,16,0,43.2203,_ZN5aiter48fmoe_bf16_blockscaleBf16_g1u1_vs_pf2_silu_16x128E,0.0%,0.0,,0.0%,43.2203,1,1,12.81,9339.04,
256,64,2048,128,513,11,ActivationType.Silu,torch.bfloat16,torch.float8_e4m3fn,torch.float8_e4m3fn,QuantType.per_1x128,1,0,32,0,63.1739,_ZN5aiter47fmoe_bf16_blockscaleBf16_g1u1_vs_ps_silu_32x128E,0.0%,0.0,,0.0%,63.1739,1,1,17.53,6392.4,
256,128,2048,128,513,11,ActivationType.Silu,torch.bfloat16,torch.float8_e4m3fn,torch.float8_e4m3fn,QuantType.per_1x128,1,0,32,0,75.1743,_ZN5aiter47fmoe_bf16_blockscaleBf16_g1u1_vs_ps_silu_32x128E,0.0%,0.0,,0.0%,75.1743,1,1,29.46,5377.18,
256,256,2048,128,513,11,ActivationType.Silu,torch.bfloat16,torch.float8_e4m3fn,torch.float8_e4m3fn,QuantType.per_1x128,1,0,64,0,89.3193,_ZN5aiter46fmoe_bf16_blockscaleFp8_g1u1_vs_ps_silu_64x128E,0.0%,0.0,,0.0%,89.3193,1,0,49.59,4534.43,
256,512,2048,128,513,11,ActivationType.Silu,torch.bfloat16,torch.float8_e4m3fn,torch.float8_e4m3fn,QuantType.per_1x128,1,0,32,0,101.5269,_ZN5aiter47fmoe_bf16_blockscaleBf16_g1u1_vs_ps_silu_32x128E,0.0%,0.0,,0.0%,101.5269,1,1,87.25,4004.71,
256,1024,2048,128,513,11,ActivationType.Silu,torch.bfloat16,torch.float8_e4m3fn,torch.float8_e4m3fn,QuantType.per_1x128,1,0,64,0,122.7635,_ZN5aiter46fmoe_bf16_blockscaleFp8_g1u1_vs_ps_silu_64x128E,0.0%,0.0,,0.0%,122.7635,1,0,144.32,3337.56,
256,2048,2048,128,513,11,ActivationType.Silu,torch.bfloat16,torch.float8_e4m3fn,torch.float8_e4m3fn,QuantType.per_1x128,1,0,64,0,154.50619999999998,_ZN5aiter46fmoe_bf16_blockscaleFp8_g1u1_vs_ps_silu_64x128E,0.0%,0.0,,0.0%,154.5062,1,0,229.33,2692.59,
256,4096,2048,128,513,11,ActivationType.Silu,torch.bfloat16,torch.float8_e4m3fn,torch.float8_e4m3fn,QuantType.per_1x128,1,0,64,0,210.4731,_ZN5aiter46fmoe_bf16_blockscaleFp8_g1u1_vs_ps_silu_64x128E,0.0%,0.0,,0.0%,210.4731,1,0,336.7,2036.39,
256,8192,2048,128,513,11,ActivationType.Silu,torch.bfloat16,torch.float8_e4m3fn,torch.float8_e4m3fn,QuantType.per_1x128,1,0,64,0,381.7426,_ZN5aiter46fmoe_bf16_blockscaleFp8_g1u1_vs_ps_silu_64x128E,0.0%,0.0,,0.0%,381.7426,1,0,371.28,1188.68,
256,16384,2048,128,513,11,ActivationType.Silu,torch.bfloat16,torch.float8_e4m3fn,torch.float8_e4m3fn,QuantType.per_1x128,1,0,64,0,697.8221,_ZN5aiter46fmoe_bf16_blockscaleFp8_g1u1_vs_ps_silu_64x128E,0.0%,0.0,,0.0%,697.8221,1,0,406.22,722.39,
256,32768,2048,128,513,11,ActivationType.Silu,torch.bfloat16,torch.float8_e4m3fn,torch.float8_e4m3fn,QuantType.per_1x128,1,0,64,0,1318.1731,_ZN5aiter46fmoe_bf16_blockscaleFp8_g1u1_vs_ps_silu_64x128E,0.0%,0.0,,0.0%,1318.1731,1,0,430.09,458.79,
