op_tests/configs/gemm_codegen_gfx_filter.csv
gfx,cu_num,M,N,K,q_dtype_w,kernelId,splitK,us,kernelName,tflops,bw,errRatio,libtype
gfx942,80,1,8192,1024,torch.int8,78,0,9.1327,a8w8_rowwise_64x16x16x128_16x16_1x1_8x8x1_8x8x1_1x16x1x4_4x4x1_1x1_interwave_v2,1.84,920.43,0.0,
gfx942,304,1,8192,1024,torch.int8,78,0,9.1327,a8w8_rowwise_64x16x16x128_16x16_1x1_8x8x1_8x8x1_1x16x1x4_4x4x1_1x1_interwave_v2,1.84,1021.33,0.0,
gfx950,256,1,8192,1024,torch.int8,79,0,5.7218,a8w8_rowwise_128x16x32x128_16x16_1x1_8x16x1_8x16x1_1x16x1x8_4x4x1_1x1_interwave_v2,2.93,1469.12,0.0,
gfx942,80,32,8192,1024,torch.int8,28,0,9.9382,a8w8_rowwise_256x32x128x256_32x32_1x1_16x16x1_16x16x1_1x32x1x8_8x8x1_1x1_intrawave_v3,54.02,900.13,0.0,
gfx942,304,32,8192,1024,torch.int8,28,0,9.9382,a8w8_rowwise_256x32x128x256_32x32_1x1_16x16x1_16x16x1_1x32x1x8_8x8x1_1x1_intrawave_v3,54.02,900.13,0.0,
gfx950,256,32,8192,1024,torch.int8,79,0,5.6281,a8w8_rowwise_128x16x32x128_16x16_1x1_8x16x1_8x16x1_1x16x1x8_4x4x1_1x1_interwave_v2,95.39,1589.46,0.0,
gfx942,80,128,1280,8192,torch.int8,30,0,23.3376,a8w8_rowwise_256x32x64x512_16x16_1x2_32x8x1_32x8x1_1x32x1x8_8x8x1_1x2_intrawave_v3,115.02,508.28,0.0,
gfx942,304,128,1280,8192,torch.int8,30,0,23.3376,a8w8_rowwise_256x32x64x512_16x16_1x2_32x8x1_32x8x1_1x32x1x8_8x8x1_1x2_intrawave_v3,115.02,508.28,0.0,
gfx950,256,128,1280,8192,torch.int8,34,0,13.9827,a8w8_rowwise_256x16x64x512_16x16_1x1_32x8x1_32x8x1_1x16x1x16_4x4x1_1x1_intrawave_v3,191.98,848.34,0.0,
